id,name,artists,duration_ms,release_date,year,acousticness,danceability,energy,instrumentalness,liveness,loudness,speechiness,tempo,valence,mode,key,popularity,explicit,genre
16h7QrvbE6ZWeFNmKiKxhV,The Wild Side of Life,The Wilburn Brothers,147093,1950-06-24,1950,0.712,0.577,0.396,0.0,0.0699,-10.705,0.0268,64.981,0.864,1,8,12,False,"classic country pop, traditional country"
4Bsym9x55B9lkzvmRIZzNc,The Peanut Vendor,Stan Kenton & His Orchestra,164560,1950-01-01,1950,0.853,0.634,0.931,0.872,0.0803,-7.611,0.0647,106.924,0.652,1,2,12,False,"big band, jazz orchestra, man's orchestra, swing"
4rmhQyN7hMYrc5ER8Sebe5,"The Oldest Established (from ""Guys & Dolls"")","Same Levene, Stubby Kaye, Johnny Silver",156613,1950,1950,0.849,0.638,0.262,5.73e-06,0.333,-20.468,0.186,130.207,0.543,1,7,11,False,
6NQrNKkLdQaGm3RfzyNwgB,There's No Business Like Show Business,"Betty Hutton, Howard Keel, Louis Calhern, Keenan Wynn",150973,1950-05-17,1950,0.954,0.646,0.445,1.26e-05,0.109,-9.617,0.0598,138.412,0.73,1,5,12,False,vintage hollywood
2wyifZXEC0Z4HNKlQnyroD,Always Late (With Your Kisses),Lefty Frizzell,191360,1950,1950,0.781,0.763,0.262,4.98e-06,0.229,-9.726,0.0297,117.043,0.623,1,9,27,False,"arkansas country, classic country pop, honky tonk, traditional country, western swing"
5ukHmdUBB1anlKt7xmehep,I Love You a Thousand Ways,Lefty Frizzell,168373,1950,1950,0.813,0.679,0.259,0.0,0.134,-10.841,0.0298,126.179,0.673,1,4,25,False,"arkansas country, classic country pop, honky tonk, traditional country, western swing"
5LgJxOtSB0kDKphDn7oxGt,"Take Back Your Mink (from ""Guys & Dolls"")","Vivian Blaine, The Hot Box Girls",173703,1950,1950,0.853,0.563,0.0808,0.000507,0.0871,-21.863,0.0479,80.183,0.523,1,10,10,False,
3bQruwRbJld9mYFRmO9taT,Travellin' Blues,Lefty Frizzell,174906,1950,1950,0.519,0.758,0.325,1.94e-05,0.152,-8.938,0.0355,127.075,0.676,1,5,10,False,"arkansas country, classic country pop, honky tonk, traditional country, western swing"
4UNiDnVTggpj2HBT9LWqfR,Melodie D'Amour,The Ames Brothers,157240,1950,1950,0.884,0.447,0.582,1.38e-05,0.452,-7.422,0.0297,168.304,0.876,1,7,26,False,"easy listening, vocal harmony group"
6fSoMGZQPnH6ZK6NA3vWY7,Cruising Down the River,The Ames Brothers,160613,1950-11-26,1950,0.921,0.64,0.19,0.0,0.14,-13.953,0.0315,98.087,0.686,1,2,21,False,"easy listening, vocal harmony group"
3VUhUXnQSahUjJHrUgmiwz,Taita Inty,Yma Sumac,186493,1950-01-01,1950,0.971,0.294,0.186,0.448,0.243,-18.184,0.0573,87.344,0.188,0,5,17,False,"exotica, lounge, space age pop"
1MU8arVSkbhrAWJCLgJ6nt,La Strada,Tony Mottola,180320,1950-05-26,1950,0.92,0.472,0.281,0.836,0.143,-14.199,0.0273,101.232,0.492,1,0,30,False,"easy listening, space age pop"
2ZZXBE0RpQAM23Hc2DokKW,Sentimental Me,The Ames Brothers,205893,1950-11-26,1950,0.814,0.165,0.22,0.0551,0.0984,-13.417,0.036,75.055,0.223,1,8,23,False,"easy listening, vocal harmony group"
1yFqpPQ3uT28gCxt2n3yxj,September In The Rain,George Shearing,194880,1950-01-01,1950,0.936,0.58,0.147,0.755,0.0997,-23.478,0.0353,124.738,0.592,1,8,28,False,"cool jazz, jazz piano"
6i6ch3gxV9qxdxJAAVeZWP,The Girl That I Marry,Howard Keel,80360,1950-05-17,1950,0.965,0.411,0.136,1.66e-06,0.382,-11.004,0.0266,36.238,0.546,1,9,12,False,vintage hollywood
4hm4jPF7KK6d2sHxiJYqti,Temptation Rag,Benny Goodman Sextet,165400,1950,1950,0.62,0.52,0.501,0.464,0.11,-15.057,0.0354,127.584,0.844,0,5,11,False,"big band, swing, vintage jazz"
4kUOtZSlv59bX5e7ouSKRK,Roman Guitar,Tony Mottola y Su Orquesta,215053,1950-05-26,1950,0.978,0.482,0.198,0.89,0.12,-13.607,0.0349,106.314,0.668,1,9,34,False,"easy listening, man's orchestra"
4FBrRBHvwVjtLNCNxvlCM5,Dominiqui,Tony Mottola y Su Orquesta,137466,1950-05-26,1950,0.908,0.65,0.408,0.935,0.109,-11.173,0.039,125.51,0.564,1,8,35,False,"easy listening, man's orchestra"
7e1ZGEuBnVD9B2rV84JaDl,This Room Is My Castle Of Quiet,"Dr. Samuel J. Hoffman, Billy May",146826,1950-01-01,1950,0.991,0.245,0.143,0.934,0.0763,-16.279,0.0363,102.225,0.068,0,4,10,False,"exotica, laboratorio, theremin"
0Up8S7P0nRbJvezk63WoXc,There's a Pawnshop on the Corner in Pittsburgh / Pennsylvania,Guy Mitchell,171920,1950-04-07,1950,0.984,0.734,0.327,0.000246,0.292,-10.477,0.037,74.838,0.874,1,7,14,False,deep adult standards
60qvt3skaW0nJzVkynxpBP,Twelfth Street Rag,Pee Wee Hunt,172960,1950-03-01,1950,0.444,0.662,0.591,0.86,0.1,-8.049,0.0452,106.892,0.963,1,3,16,False,jazz trombone
5rJPcj8vu1wBZbKym4m57q,It Only Hurts for a Little While,The Ames Brothers,162173,1950-11-26,1950,0.967,0.328,0.237,0.0104,0.199,-11.528,0.0303,85.059,0.226,1,9,21,False,"easy listening, vocal harmony group"
40FLOuvgK6XpyCf8zWzb4W,Three Blind Mice,Nat King Cole Trio,154400,1950-04-01,1950,0.977,0.629,0.043,0.000167,0.105,-18.596,0.0729,146.72,0.406,1,1,10,False,"adult standards, lounge, swing, vocal jazz"
4Rrm5AaiACtvvIueTqfoh0,The Naughty Lady Of Shady Lane,The Ames Brothers,168613,1950,1950,0.867,0.692,0.493,0.000136,0.0881,-7.964,0.0386,131.366,0.838,0,10,8,False,"easy listening, vocal harmony group"
7pqJSnbNHvBWGnfMWJng05,Volare,Tony Mottola y Su Orquesta,133360,1950-05-26,1950,0.922,0.61,0.298,0.512,0.08,-10.709,0.0343,106.289,0.615,0,9,32,False,"easy listening, man's orchestra"
6lWgyr3elZmBkCHb7dYUGK,The Long Black Veil,Lefty Frizzell,188506,1950,1950,0.831,0.533,0.193,0.0,0.121,-15.85,0.0399,63.107,0.426,1,4,7,False,"arkansas country, classic country pop, honky tonk, traditional country, western swing"
0JpkWvGg83rjXiYbRPL8Va,Blues In My Shower,Nat King Cole Trio,173133,1950-04-01,1950,0.983,0.618,0.123,0.883,0.097,-18.077,0.0649,72.111,0.476,1,5,25,False,"adult standards, lounge, swing, vocal jazz"
4Un8avfhDBwfHP2XhNXGm6,I’ve Got the Sun in the Morning,Betty Hutton,137866,1950-05-17,1950,0.941,0.654,0.353,0.0,0.116,-9.131,0.0717,88.419,0.641,1,2,21,False,vintage hollywood
02NbNJq2v7tQl4lIU0VOYK,I Want to Be with You Always,Lefty Frizzell,183746,1950,1950,0.748,0.691,0.235,0.000215,0.327,-12.995,0.0331,115.457,0.738,1,10,18,False,"arkansas country, classic country pop, honky tonk, traditional country, western swing"
2P57gdzmXewVrbNPwxd2Pc,My Bonnie Lassie,The Ames Brothers,148733,1950-11-26,1950,0.85,0.62,0.328,0.000408,0.12,-10.988,0.0399,116.538,0.721,1,0,23,False,"easy listening, vocal harmony group"
4zjWP2Ha9VERv7BNaxmk2K,Tumpa!,Yma Sumac,199973,1950-01-01,1950,0.907,0.312,0.314,0.0593,0.149,-16.02,0.148,182.251,0.595,0,6,15,False,"exotica, lounge, space age pop"
6fYh9si2l151Xd3L4XWdej,They Say It's Wonderful,"Betty Hutton, Howard Keel",209200,1950-05-17,1950,0.962,0.227,0.214,7.98e-06,0.108,-11.603,0.0323,81.155,0.196,1,4,8,False,vintage hollywood
17S4TXtQcVnPdqiiwUY4bj,"The Hostess With The Mostes' On The Ball - From ""Call Me Madam""","Ethel Merman, Gordon Jenkins & His Orchestra",206426,1950-01-01,1950,0.823,0.613,0.312,0.0,0.114,-8.215,0.133,175.9,0.647,1,8,9,False,"tin pan alley, vintage broadway"
0SsLcRcyJZOyra4nCM8vfE,I Didn't Know What Time It Was,George Shearing,198466,1950-01-01,1950,0.959,0.481,0.134,0.845,0.256,-20.387,0.038,133.259,0.615,1,2,16,False,"cool jazz, jazz piano"
4vt8mqdomZCEfah35rL4rR,Toreador's Song,Edmundo Ros,132000,1950-03-03,1950,0.182,0.861,0.803,0.89,0.135,-11.297,0.0428,121.853,0.984,0,0,5,False,"easy listening, mambo"
2JR4xv4473QgAK5wgRPb6u,Mom and Dad's Waltz,Lefty Frizzell,185293,1950,1950,0.74,0.605,0.259,0.000136,0.0734,-10.788,0.0297,95.637,0.562,1,0,21,False,"arkansas country, classic country pop, honky tonk, traditional country, western swing"
7Kyw5bdvQ5mOQHF5TkljS9,"Shine, Shave, Shower (It's Saturday)",Lefty Frizzell,155560,1950,1950,0.775,0.811,0.362,1.13e-05,0.0611,-9.87,0.0713,102.612,0.895,1,2,21,False,"arkansas country, classic country pop, honky tonk, traditional country, western swing"
1pn02i8KH8XqR66tbxxU9J,Lullaby Of The Leaves,Benny Goodman Sextet,161426,1950,1950,0.967,0.568,0.174,0.783,0.125,-17.856,0.0394,79.937,0.69,0,7,18,False,"big band, swing, vintage jazz"
7mCaLxitL4BGWJtWxbvZY4,A Very Precious Love,The Ames Brothers,164000,1950-11-26,1950,0.835,0.375,0.234,0.000333,0.174,-11.27,0.0284,81.998,0.321,1,3,18,False,"easy listening, vocal harmony group"
4zR5SPKuc5fu7RbTg2Gc1Q,My Baby's Just Like Money - 1950 Version,Lefty Frizzell,139680,1950,1950,0.539,0.709,0.325,0.0,0.119,-11.438,0.0341,77.114,0.818,0,1,20,False,"arkansas country, classic country pop, honky tonk, traditional country, western swing"
6f7QCFZp8bZV1nsUCgZ6fp,Tu Recuerdo en Cuatro Copas,José Alfredo Jimenez,192493,1950,1950,0.63,0.455,0.282,0.0,0.283,-11.94,0.0396,84.15,0.674,1,5,13,False,"mariachi, musica mexicana, norteno, ranchera"
5uLAvAKYZhFYtEVJTPgNMQ,Três Apitos,"Noel Rosa, Orlando Silva",87400,1950,1950,0.991,0.427,0.126,0.968,0.199,-18.7,0.212,89.11,0.617,0,7,26,False,"bossa nova, mpb, samba, velha guarda"
2P12SmID74922J8JwQd90j,Mambo Gozón,Tito Puente,167133,1950-06-17,1950,0.484,0.753,0.718,0.299,0.0828,-10.256,0.0594,104.993,0.897,1,9,22,False,"afro-cuban percussion, jazz puertorriqueno, latin jazz, mambo, musica tradicional cubana, salsa"
3vcSwhwwZ9BeCyANuIM9Tb,Hawaiian War Chant,The Ames Brothers,153013,1950-11-26,1950,0.95,0.828,0.372,0.000158,0.15,-12.725,0.0486,92.83,0.759,1,0,16,False,"easy listening, vocal harmony group"
0kH2sn0Xy2OC5fgi31EYAW,Poinciana,The Four Freshmen,185480,1950-01-01,1950,0.901,0.455,0.0287,0.0,0.111,-16.85,0.0296,90.808,0.279,1,0,20,False,vocal harmony group
0HEU3berJ5OBojU8XmEk1c,How Long Has This Been Going On?,Ella Fitzgerald,197666,1950-09-11,1950,0.974,0.303,0.175,1.32e-06,0.105,-14.203,0.0378,168.743,0.25,0,1,32,False,"adult standards, jazz, jazz blues, soul, swing, vocal jazz"
56xq9OiEcvefJfXcnujbS6,Anna,Tony Mottola y Su Orquesta,126546,1950-05-26,1950,0.0766,0.722,0.546,9.12e-05,0.0524,-9.741,0.0382,114.751,0.964,1,7,29,False,"easy listening, man's orchestra"
1zoyHU5tY6IUa5GB4mSloE,Now You Know,The Four Freshmen,186493,1950-01-01,1950,0.983,0.507,0.0164,0.0,0.144,-17.365,0.0291,95.098,0.166,0,0,20,False,vocal harmony group
4ENooWjadvTa6yqHS13y1e,A Tree in the Meadow,The Ames Brothers,191653,1950-11-26,1950,0.989,0.412,0.0487,0.000317,0.0881,-14.321,0.0338,133.114,0.18,1,9,14,False,"easy listening, vocal harmony group"
0J7t1rCq34WraeFTCjyN0l,I Don't Care If The Sun Don't Shine,Dean Martin,117626,1950,1950,0.927,0.657,0.315,0.00033,0.0571,-10.418,0.0957,151.365,0.808,1,5,26,False,"adult standards, easy listening, lounge, vocal jazz"
0rmyS3zyUq9Boc0GV4uhz5,"Vieni Su (Say You Love Me, Too)",Dean Martin,160133,1950,1950,0.973,0.269,0.0407,0.603,0.174,-20.047,0.0373,100.659,0.199,1,7,26,False,"adult standards, easy listening, lounge, vocal jazz"
0ZV7nuh9LZzUCckvp18yUW,Somebody's Back in Town,The Wilburn Brothers,146613,1950-06-24,1950,0.844,0.521,0.299,0.0,0.0875,-9.126,0.0278,136.523,0.713,1,4,16,False,"classic country pop, traditional country"
5LZJHpQn8QJ1qwidGTaLat,East Of The Sun (And West Of The Moon),George Shearing,185653,1950-01-01,1950,0.984,0.48,0.0845,0.869,0.116,-22.891,0.0376,133.518,0.543,0,4,21,False,"cool jazz, jazz piano"
2Yta9WtksFNeVPTC1QedgU,Eager Beaver,Stan Kenton & His Orchestra,189293,1950-01-01,1950,0.816,0.534,0.329,0.872,0.142,-10.538,0.0503,151.054,0.522,0,5,20,False,"big band, jazz orchestra, man's orchestra, swing"
7xYplbRkb6V4HwgdGYx6kV,Three Wishes,Dean Martin,160360,1950,1950,0.986,0.322,0.0569,0.000275,0.154,-16.457,0.0366,118.084,0.154,1,3,8,False,"adult standards, easy listening, lounge, vocal jazz"
59CX1qFRzgUeLUzAARGJsM,The Darkness Gives Me You Again,"Dr. Samuel J. Hoffman, Billy May",159573,1950-01-01,1950,0.987,0.255,0.273,0.894,0.375,-13.025,0.0358,135.461,0.114,1,3,6,False,"exotica, laboratorio, theremin"
4YH4zCNzVQuZjhcWSwuiCR,On The Sunny Side Of The Street,Teddy Wilson,257693,1950,1950,0.94,0.699,0.146,0.479,0.181,-18.029,0.0407,127.576,0.638,1,3,19,False,"jazz piano, stride"
1az6Sly5tiMzWcW7AdK6HT,Travellin' Blues,Lefty Frizzell,172840,1950,1950,0.671,0.756,0.185,0.000174,0.159,-13.968,0.0397,127.935,0.622,1,5,5,False,"arkansas country, classic country pop, honky tonk, traditional country, western swing"
6mIwzGh82Ra9s5zVn0fdV6,Teri Duniya Men Dil Lagta Nahin,Mukesh,200706,1950-12-31,1950,0.835,0.349,0.257,0.247,0.421,-12.508,0.0331,92.088,0.318,1,7,8,False,"classic bollywood, filmi"
5cq1YeivEmtmbjCMVHD8DD,"Arrivederci, Roma",Tony Mottola y Su Orquesta,212453,1950-05-26,1950,0.952,0.642,0.315,0.888,0.392,-13.019,0.0286,104.056,0.596,1,7,26,False,"easy listening, man's orchestra"
6rVmW1K5NUbnnBWjQZCQBH,"Music, Music, Music",The Ames Brothers,158840,1950-11-26,1950,0.816,0.667,0.32,0.00344,0.1,-10.241,0.0492,95.952,0.947,1,1,16,False,"easy listening, vocal harmony group"
2BMorWMRsJPc1hEstsFKRU,I'll Remember April,George Shearing,166640,1950-01-01,1950,0.988,0.551,0.112,0.884,0.121,-23.167,0.0383,126.778,0.659,1,0,40,False,"cool jazz, jazz piano"
2mk0BzmjX5ajXIxhhWlTT1,"Main Title (From ""Rio Grande"")",Victor Young,135666,1950,1950,0.474,0.119,0.479,0.922,0.278,-8.092,0.0325,86.681,0.446,1,10,17,False,classic soundtrack
6BVGSY5a78glGMpENbkt8D,Singing the Blues,Guy Mitchell,145773,1950-04-07,1950,0.594,0.624,0.509,0.000147,0.159,-7.615,0.0559,141.365,0.664,1,4,23,False,deep adult standards
5Xu51ZxSnYBxtWB0VNHYiM,Picadillo,Tito Puente,167466,1950-06-17,1950,0.759,0.493,0.893,0.872,0.156,-8.322,0.0378,95.771,0.763,0,9,19,False,"afro-cuban percussion, jazz puertorriqueno, latin jazz, mambo, musica tradicional cubana, salsa"
2bBwi0SQowI6sCQyptjJ4U,Ain't Got No Home,Clarence,141933,1950-12-21,1950,0.688,0.767,0.43,0.293,0.0781,-8.039,0.0852,168.789,0.963,1,0,27,False,
0Qgy3ER1BqFRnav19wprak,Stardust,The Ames Brothers,192440,1950-11-26,1950,0.942,0.363,0.126,1.22e-05,0.317,-12.193,0.0307,67.229,0.304,1,9,14,False,"easy listening, vocal harmony group"
6SDRaHFt4TdoAHkgv09MDx,Sorrento,Tony Mottola y Su Orquesta,167066,1950-05-26,1950,0.979,0.316,0.192,0.691,0.119,-12.939,0.0319,82.018,0.492,0,9,25,False,"easy listening, man's orchestra"
6zJJ0nug4cuvTYsOBqWy7L,C'est Si Bon,Tony Mottola y Su Orquesta,182786,1950-05-26,1950,0.906,0.728,0.187,0.0413,0.0778,-12.31,0.0429,121.479,0.615,1,6,25,False,"easy listening, man's orchestra"
2r0J7PRddQffYIBcnDw0V3,Ae Dil Mujhe Aisi Jagah Le Chal,Talat Mahmood,207706,1950-12-31,1950,0.789,0.438,0.326,0.0373,0.16,-12.92,0.0516,126.155,0.758,1,10,21,False,"classic bollywood, filmi, ghazal"
7sgAXJK49YOj3LjsSs5I4L,Treasury Scandal,Attila the Hun,193733,1950-01-01,1950,0.921,0.655,0.392,8.16e-06,0.101,-13.013,0.202,120.011,0.961,1,0,11,False,calypso
11QFinScRKx4KSLcx4Ea5t,Under Paris Skies,Tony Mottola y Su Orquesta,124480,1950-05-26,1950,0.984,0.275,0.282,0.936,0.357,-13.263,0.0331,209.099,0.559,0,5,35,False,"easy listening, man's orchestra"
1bDzspMSL17XQokxAxAe22,Undecided,The Ames Brothers,179146,1950-11-26,1950,0.791,0.753,0.439,0.0,0.24,-8.908,0.0387,135.192,0.873,1,8,24,False,"easy listening, vocal harmony group"
2x0r8qhqZ2156G1h0Z7qqN,Un Bel Di Vedremo (Madame Butterfly),"Renata Tebaldi, Orchestre de la Suisse Romande",292533,1950-03-03,1950,0.982,0.306,0.185,1.91e-06,0.105,-10.894,0.0397,128.274,0.0615,1,1,28,False,"classical soprano, italian soprano, opera"
3aDe7oTXpLZdUmiNXMqHcJ,Por un Puñado de Oro,La Sonora Santanera,168600,1950,1950,0.775,0.546,0.49,3.5e-05,0.577,-9.489,0.0322,135.286,0.82,0,7,22,False,"bolero, bolero mexicano, tropical"
4ldyOS2Nuy0DBZ2BBJYmyv,Con un Beso,La Sonora Santanera,175800,1950,1950,0.882,0.657,0.395,0.000233,0.0895,-11.298,0.0538,113.439,0.942,1,3,16,False,"bolero, bolero mexicano, tropical"
1kRRiHfLnqqBZ9wAVFXYnz,Undecided,Benny Goodman Sextet,339373,1950,1950,0.932,0.446,0.34,0.712,0.0963,-16.059,0.0462,208.681,0.848,1,8,9,False,"big band, swing, vintage jazz"
6qKITW7oFQizGzS69M64Oj,Under A Blanket Of Blue,Benny Goodman Sextet,174466,1950,1950,0.977,0.759,0.127,0.359,0.137,-18.666,0.0388,138.399,0.664,0,0,8,False,"big band, swing, vintage jazz"
29MA6rGNBVlLx38jQKUWdM,Por un Puñado de Oro,La Sonora Santanera,172173,1950,1950,0.306,0.573,0.467,0.0,0.235,-10.456,0.0377,133.988,0.838,1,7,26,False,"bolero, bolero mexicano, tropical"
2JwN7tGjERYwPEO6o6iBUB,Under Paris Skies,Tony Mottola,124480,1950-05-26,1950,0.984,0.275,0.282,0.936,0.357,-13.263,0.0331,209.099,0.559,0,5,7,False,"easy listening, space age pop"
7AZM13BeBrNzGw2lY8khB9,Una Noche de Tantas,José Alfredo Jimenez,150640,1950,1950,0.727,0.341,0.35,0.0,0.11,-12.712,0.0363,87.205,0.7,1,9,9,False,"mariachi, musica mexicana, norteno, ranchera"
5PKx98pqCaUpq75By9h1G7,Darkie Uncle Ned,Harry McClintock,121146,1950-01-01,1950,0.839,0.659,0.126,0.0,0.261,-18.14,0.567,99.49,0.52,0,5,10,False,traditional folk
3VVMhFxCy67GPwOxc96XMT,I Wake Up In The Morning Feeling Fine,"Betty Hutton, Robert Norberg",166146,1950-01-01,1950,0.869,0.641,0.216,0.0,0.738,-8.477,0.172,148.692,0.687,1,1,15,False,vintage hollywood
1pVducHptSthezG15Her5R,Un ballo in maschera*: Act II: Ecco l'orrido campo,"Giuseppe Verdi, Maria Callas, Milan La Scala Chorus, Orchestra Del Teatro Alla Scala, Milano, Antonino Votto",89920,1950,1950,0.982,0.401,0.109,2.38e-05,0.113,-17.603,0.115,80.88,0.0373,0,9,7,False,"classical, italian opera, italian romanticism, late romantic era"
7oGgqMbvr4spmZfzyNA5su,Up The Lazy River,The Ink Spots,182028,1950-07-17,1950,0.901,0.546,0.267,0.186,0.107,-16.448,0.0389,108.535,0.402,1,0,3,False,"lounge, vocal harmony group"
5C1gNm0m1rXoNlCyw9G4TX,Utah Carl,Harry McClintock,92053,1950-01-01,1950,0.773,0.612,0.0778,0.0,0.365,-19.84,0.143,103.873,0.291,0,4,3,False,traditional folk
3WI8gq9TiEZAhF9VNPXGIi,Until The Real Thing Comes Along,The Ink Spots,294071,1950-07-17,1950,0.915,0.385,0.235,0.000154,0.0964,-15.957,0.0344,68.708,0.249,1,5,2,False,"lounge, vocal harmony group"
0IUb4m8eEZ2mguPBQ1zUc1,Por una Cosa - Remasterizado,La Sonora Santanera,190266,1950,1950,0.128,0.69,0.682,0.0,0.326,-10.964,0.186,90.711,0.855,0,4,19,False,"bolero, bolero mexicano, tropical"
1kwH9OvNithgayU4Zw0Oq0,Mambo Universitario,Pérez Prado,145506,1950-11-26,1950,0.233,0.765,0.621,0.184,0.168,-10.143,0.267,126.405,0.777,0,10,15,False,"mambo, musica tradicional cubana, space age pop"
3DoGOqis8SyoEtwFfH2UCt,En el Campo Hay una Flor,Los Davalos,182259,1950-02-17,1950,0.912,0.761,0.331,7.27e-06,0.0875,-10.391,0.153,105.75,0.642,1,10,32,False,classic peruvian pop
61UtniVQPdIpnmPUR1f8w6,Sur une Lanterne / A Lantern,Francis Poulenc,97880,1950-01-01,1950,0.989,0.451,0.17,0.92,0.0837,-15.54,0.0898,93.68,0.108,1,7,4,False,"classical, early modern classical, neoclassicism"
1YEJmDqWNpnTSpKY2fzxRe,Sur un Vaisseau / A Ship,Francis Poulenc,88133,1950-01-01,1950,0.993,0.374,0.202,0.935,0.107,-17.302,0.0515,83.602,0.367,1,3,4,False,"classical, early modern classical, neoclassicism"
056Ori48GetNy8Vcan3pnI,Con un Corazón,La Sonora Santanera,199000,1950,1950,0.834,0.607,0.5,0.00281,0.332,-11.132,0.0466,146.619,0.934,0,7,1,False,"bolero, bolero mexicano, tropical"
7cf2ybGo9gMYCJZWYEnTs8,Treasure Untold,Lefty Frizzell,196946,1950,1950,0.683,0.711,0.219,0.0,0.242,-10.35,0.0342,114.498,0.397,1,2,3,False,"arkansas country, classic country pop, honky tonk, traditional country, western swing"
4Bsym9x55B9lkzvmRIZzNc,The Peanut Vendor,Stan Kenton & His Orchestra,164560,1950-01-01,1950,0.853,0.634,0.931,0.872,0.0803,-7.611,0.0647,106.924,0.652,1,2,12,False,"big band, jazz orchestra, man's orchestra, swing"
0yq48UtYqMcdFN5Vmt4t58,Casey Jones (The Union Scab),Harry McClintock,211506,1950-01-01,1950,0.904,0.628,0.102,0.0,0.279,-17.291,0.196,129.742,0.553,1,7,5,False,traditional folk
3F3iXm7fvEHWfITcUW5CV3,"Mahler: Kindertotenlieder: No. 5, In diesem Wetter, in diesem Braus","Gustav Mahler, Kathleen Ferrier, Wiener Philharmoniker, Bruno Walter",390106,1950-01-01,1950,0.964,0.239,0.127,0.00519,0.104,-19.889,0.0411,106.802,0.0516,1,2,9,False,"classical, post-romantic era"
7Clg9NcEJxX5tC5LbfF0Zp,"La forza del destino: Act IV Pace, pace, mio Dio!","Giuseppe Verdi, Maria Callas, Milan La Scala Chorus, Orchestra Del Teatro Alla Scala, Milano, Tullio Serafin",384093,1950,1950,0.982,0.313,0.0537,0.00698,0.125,-19.469,0.047,128.797,0.0625,0,0,15,False,"classical, italian opera, italian romanticism, late romantic era"
3pLkXUHU1fzqKs1R7H27to,Un ballo in maschera*: Act II: Ma dall'arido stelo,"Giuseppe Verdi, Maria Callas, Milan La Scala Chorus, Orchestra Del Teatro Alla Scala, Milano, Antonino Votto",316973,1950,1950,0.978,0.237,0.0806,0.000493,0.0809,-18.278,0.0482,77.844,0.0606,1,5,0,False,"classical, italian opera, italian romanticism, late romantic era"
1oFdSnxONYt5PRKUaHrQws,"Un ballo in maschera*: Act III: Morro, ma prima in grazia","Giuseppe Verdi, Maria Callas, Milan La Scala Chorus, Orchestra Del Teatro Alla Scala, Milano, Antonino Votto",273293,1950,1950,0.982,0.242,0.113,9.07e-05,0.0918,-19.19,0.0433,88.85,0.0365,0,3,0,False,"classical, italian opera, italian romanticism, late romantic era"
7xKiPGSw4XpfV7b5br5F5L,Un Bel Dì Vedremp - Madama Butterfly Atto Ii,Renata Tebaldi,288360,1950-03-03,1950,0.97,0.303,0.167,0.0,0.219,-12.606,0.0394,93.211,0.0521,1,1,1,False,"classical soprano, italian soprano, opera"
6bY7TKFYCHLJMrM0nhRi3L,Un Jardinero de Amor,Compay Segundo,171053,1950-06-17,1950,0.426,0.739,0.443,0.0,0.14,-10.488,0.0796,134.945,0.914,0,10,2,False,"mambo, musica tradicional cubana, son cubano"
0qIem4rIxwL79GyoyTX9qx,Udan Liris (Vocal with Katjapi),"Female Sundanese singer, katjapi player",86880,1950-01-01,1950,0.924,0.353,0.116,0.119,0.397,-18.914,0.0475,92.719,0.347,1,10,2,False,indonesian indigenous traditional
3PZOfovyHzI232JoKdgIFn,Unless,Guy Mitchell,166853,1950-04-07,1950,0.979,0.297,0.166,5.97e-06,0.105,-10.729,0.0346,78.235,0.105,1,0,0,False,deep adult standards
6Hyqhzg3786Ya5aNWX8oSy,Una Cerveza,Tito Cortes,158400,1950,1950,0.249,0.761,0.497,1.43e-05,0.104,-9.213,0.0371,112.064,0.842,0,2,3,False,classic colombian pop
105GHQPEhtb0dDxbb6bvwS,Uthaye Ja Unke Sitam,Lata Mangeshkar,173026,1950-01-01,1950,0.923,0.467,0.297,8.47e-05,0.382,-10.094,0.0298,119.308,0.522,1,7,3,False,"classic bollywood, filmi, lata"
5J50amPAxUeawx8pEBq1Pl,Us Mulk Ki Sarhad Ko,Mohammed Rafi,254955,1950-12-01,1950,0.694,0.332,0.843,3.6e-05,0.0795,-5.361,0.0776,88.686,0.529,0,11,3,False,"classic bollywood, filmi"
5ydZi6vQ8xGN1BpYMGKLzM,Una Casa Portuguesa,Jorge Sepúlveda,155773,1950-02-04,1950,0.813,0.628,0.346,0.000571,0.0837,-12.367,0.0798,124.975,0.653,1,2,15,False,"cancion melodica, spanish invasion, vintage spanish pop"
5bH474vzwf5XxjElE1NIhT,Upar Gagan Vishal,Manna Dey,353373,1950-12-31,1950,0.918,0.589,0.354,0.000208,0.328,-12.95,0.0468,78.159,0.534,1,6,2,False,"classic bollywood, filmi, rabindra sangeet"
7fG1fIOqGQ0pe7PQBII9gS,Historia de un Amor,Pérez Prado,171893,1950-11-26,1950,0.712,0.498,0.405,0.909,0.0388,-10.267,0.0533,98.018,0.592,1,2,8,False,"mambo, musica tradicional cubana, space age pop"
1OEQY0XymIs7kJCcCa6WbK,"Can You Use Any Money Today? - From ""Call Me Madam""","Ethel Merman, Gordon Jenkins & His Orchestra",171640,1950-01-01,1950,0.801,0.743,0.345,0.0,0.301,-7.926,0.0724,92.114,0.564,1,9,3,False,"tin pan alley, vintage broadway"
1VgDD1IJ8O6F8BWjTebql2,Pick Yourself Up,George Shearing,173413,1950-01-01,1950,0.98,0.626,0.152,0.91,0.117,-23.091,0.0361,117.094,0.724,1,6,4,False,"cool jazz, jazz piano"
1p8J3GP9QqMpJRxnyjzVgQ,Pictures at an Exhibition: V. Ballet of the Unhatched Chicks,"Modest Mussorgsky, Leonard Bernstein, New York Philharmonic",73093,1950,1950,0.958,0.475,0.195,0.978,0.0636,-23.079,0.0794,176.519,0.754,1,1,3,False,"classical, early modern classical, late romantic era, russian romanticism"
4JW4CWZMY8a6B5bsOohDUT,"Mahler: Kindertotenlieder: No. 1, Nun will die Sonn' so hell aufgeh'n","Gustav Mahler, Kathleen Ferrier, Wiener Philharmoniker, Bruno Walter",292613,1950-01-01,1950,0.988,0.217,0.136,0.0297,0.128,-18.204,0.0458,70.054,0.0541,0,2,12,False,"classical, post-romantic era"
5U6Q3hqtPUdWwog5Ht8esX,"I'll Walk With God (from ""The Student Prince"")","Nicholas Brodszky, Mario Lanza, Constantine Callinicos",174666,1950,1950,0.935,0.153,0.423,0.000722,0.157,-7.437,0.033,80.056,0.123,1,10,7,False,
1npAN67l27TgATBudc8QP7,Pictures at an Exhibition: VI. Samuel Goldenberg und Schmuÿle,"Modest Mussorgsky, Leonard Bernstein, New York Philharmonic",151720,1950,1950,0.858,0.358,0.207,0.695,0.143,-19.386,0.0481,135.867,0.0575,1,1,2,False,"classical, early modern classical, late romantic era, russian romanticism"
1q3sFbV1c0s58WTCGoYG1P,"Mahler: Kindertotenlieder: No. 2, Nun seh' ich wohl, warum so dunkle Flammen","Gustav Mahler, Kathleen Ferrier, Wiener Philharmoniker, Bruno Walter",279586,1950-01-01,1950,0.981,0.308,0.157,0.032,0.168,-18.017,0.0504,76.528,0.0379,0,2,9,False,"classical, post-romantic era"
70rzSMGjetOgyU67l6vbYP,"Mahler: Kindertotenlieder: No. 4, Oft denk' ich, sie sind nur ausgegangen!","Gustav Mahler, Kathleen Ferrier, Wiener Philharmoniker, Bruno Walter",175013,1950-01-01,1950,0.988,0.265,0.205,0.0102,0.143,-18.972,0.0398,104.567,0.0945,0,10,8,False,"classical, post-romantic era"
2gSvBqYv19ZuCiPGj2sl5g,"Mahler: Kindertotenlieder: No. 3, Wenn dein Mütterlein tritt zur Tür herein","Gustav Mahler, Kathleen Ferrier, Wiener Philharmoniker, Bruno Walter",271640,1950-01-01,1950,0.967,0.136,0.086,0.0259,0.123,-19.832,0.0451,70.01,0.0694,0,0,8,False,"classical, post-romantic era"
6iCFz05JXqA45ET2AhNNeI,Falstaff: Act I: Scene 2: Quell'otre! quel tino!,"Giuseppe Verdi, Arturo Toscanini, NBC Symphony Orchestra, Herva Nelli, Cloe Elmo, Teresa Stich-Randall",42546,1950,1950,0.986,0.651,0.491,0.157,0.778,-18.861,0.115,142.288,0.909,1,4,3,False,"classical, italian opera, italian romanticism, late romantic era"
2sq0MR2yxe1VAcnzieBvdj,Little White Lies,George Shearing,176106,1950-01-01,1950,0.955,0.633,0.0991,0.158,0.139,-22.017,0.0433,136.416,0.656,1,8,6,False,"cool jazz, jazz piano"
2U3o1vM2nLoxbOiSoHUWxb,"Once Upon A Time Today - From ""Call Me Madam""",Dick Haymes,194546,1950-01-01,1950,0.906,0.282,0.2,0.00167,0.343,-14.262,0.0331,82.852,0.298,1,10,0,False,"british dance band, deep adult standards, swing, tin pan alley"
2wuT7tFpZHOekKru1CchA9,Feet Up (Pat Him on the Po-Po),Guy Mitchell,162373,1950-04-07,1950,0.759,0.652,0.649,0.0,0.617,-8.653,0.0449,114.298,0.96,1,2,1,False,deep adult standards
