id,name,artists,duration_ms,release_date,year,acousticness,danceability,energy,instrumentalness,liveness,loudness,speechiness,tempo,valence,mode,key,popularity,explicit,genre
0jXSDgk1qvK7QesamhRLhg,"If I Were A Bell (from ""Guys & Dolls"")",Isabel Bigley,174294,1950,1950,0.692,0.533,0.0556,6.2e-06,0.0905,-20.385,0.0337,98.654,0.482,1,2,11,False,vintage broadway
2n2Kt9Ux0CbQuSDxINMSeF,"Sue Me (from ""Guys & Dolls"")","Vivian Blaine, Sam Levene",147298,1950,1950,0.919,0.636,0.104,0.0,0.127,-23.485,0.119,127.671,0.569,1,10,11,False,
0l8zylitJAc0A6TqLbMu4e,Good To The Last Bop,George Shearing Quintet,169640,1950-01-01,1950,0.805,0.569,0.279,0.643,0.12,-13.498,0.074,146.444,0.676,0,5,4,False,
4rmhQyN7hMYrc5ER8Sebe5,"The Oldest Established (from ""Guys & Dolls"")","Same Levene, Stubby Kaye, Johnny Silver",156613,1950,1950,0.849,0.638,0.262,5.73e-06,0.333,-20.468,0.186,130.207,0.543,1,7,11,False,
0fdkGbBzZmiLraPJS5gYd8,Gia mas kelaidoun ta poulia,Nikos Gounaris,209533,1950-01-01,1950,0.976,0.546,0.346,0.555,0.272,-13.326,0.0339,98.087,0.81,0,7,12,False,rebetiko
0cg8VeTm14UUaTMCFIHrgx,The Girl That I Marry - Reprise,Betty Hutton,104266,1950-05-17,1950,0.96,0.382,0.0233,0.00093,0.0685,-18.57,0.0506,99.145,0.116,1,5,3,False,vintage hollywood
0XNAX6BtrldewWknTQz3bj,Look At That Girl,Guy Mitchell,170786,1950-04-07,1950,0.948,0.78,0.319,1.33e-06,0.109,-11.246,0.0556,123.808,0.768,0,10,12,False,deep adult standards
2poTLiBVdUHe4O0qSz1sMC,You Can’t Get a Man with a Gun,Betty Hutton,218333,1950-05-17,1950,0.877,0.467,0.136,0.0,0.0676,-14.905,0.0831,201.125,0.485,1,1,12,False,vintage hollywood
1x4VYBDa31Js7qAc63QIRE,If You've Got the Money I've Got the Time,Lefty Frizzell,174360,1950,1950,0.772,0.815,0.487,0.000566,0.103,-9.589,0.0339,105.251,0.91,1,7,11,False,"arkansas country, classic country pop, honky tonk, traditional country, western swing"
2mk0BzmjX5ajXIxhhWlTT1,"Main Title (From ""Rio Grande"")",Victor Young,135666,1950,1950,0.474,0.119,0.479,0.922,0.278,-8.092,0.0325,86.681,0.446,1,10,17,False,classic soundtrack
099sWPNYw44xJAAKcXYDmv,"Marry The Man Today / Guys And Dolls (Reprise) (from ""Guys & Dolls"")","Vivian Blaine, Isabel Bigley",216623,1950,1950,0.822,0.66,0.0726,0.00014,0.638,-23.808,0.0532,109.398,0.578,0,11,9,False,
5LgJxOtSB0kDKphDn7oxGt,"Take Back Your Mink (from ""Guys & Dolls"")","Vivian Blaine, The Hot Box Girls",173703,1950,1950,0.853,0.563,0.0808,0.000507,0.0871,-21.863,0.0479,80.183,0.523,1,10,10,False,
5KGtFmJY3rps8eCH7fA9L3,I've Got A Feeling I'm Falling,Benny Goodman Sextet,169226,1950,1950,0.954,0.602,0.154,0.874,0.125,-18.04,0.0437,149.697,0.701,0,5,10,False,"big band, swing, vintage jazz"
7kGADjDiqCmUPBNLO1xs8m,"I'll Know (from ""Guys & Dolls"")","Robert Alda, Isabel Bigley",211668,1950,1950,0.951,0.31,0.097,1.27e-06,0.136,-21.189,0.0443,89.82,0.414,1,7,10,False,
1NbWYfmSQjnW31rvrfl0jg,"I've Never Been In Love Before (from ""Guys & Dolls"")","Robert Alda, Isabel Bigley",158334,1950,1950,0.976,0.232,0.061,7.89e-06,0.33,-21.599,0.0395,70.888,0.37,1,1,10,False,
348hFxsGCKtAmtNu1Mu2co,Rock-A-Billy,"Guy Mitchell, Jimmy Carroll",134533,1950-04-07,1950,0.712,0.519,0.784,1.97e-06,0.292,-7.459,0.0411,179.362,0.938,1,1,15,False,deep adult standards
4qSFRQeNr88zBQw1eIYZdr,Jumpin' With Symphony Sid,George Shearing,159253,1950-01-01,1950,0.981,0.588,0.182,0.375,0.126,-20.107,0.0442,177.132,0.723,1,0,13,False,"cool jazz, jazz piano"
0zWhhHBG8CiCZSseDlJpc1,Band of Gold (with Ray Conniff & His Orchestra & Chorus),"Don Cherry, Ray Conniff",154026,1950,1950,0.928,0.392,0.483,0.0201,0.171,-5.856,0.0297,113.116,0.652,1,7,10,False,
0Up8S7P0nRbJvezk63WoXc,There's a Pawnshop on the Corner in Pittsburgh / Pennsylvania,Guy Mitchell,171920,1950-04-07,1950,0.984,0.734,0.327,0.000246,0.292,-10.477,0.037,74.838,0.874,1,7,14,False,deep adult standards
4swwucP2GWoqEAvQcm7vgT,Johnny Get Your Girl,Dean Martin,155600,1950,1950,0.984,0.753,0.0592,0.00392,0.119,-16.291,0.0447,123.88,0.525,1,0,9,False,"adult standards, easy listening, lounge, vocal jazz"
1pn02i8KH8XqR66tbxxU9J,Lullaby Of The Leaves,Benny Goodman Sextet,161426,1950,1950,0.967,0.568,0.174,0.783,0.125,-17.856,0.0394,79.937,0.69,0,7,18,False,"big band, swing, vintage jazz"
1jI85mMQ3dxEmRYwuSqvkC,"My Time Of Day (from ""Guys & Dolls"")",Robert Alda,115613,1950,1950,0.757,0.295,0.0815,0.000357,0.121,-21.388,0.0457,87.076,0.296,1,11,8,False,
2JhD6zZE509OWEtSUslNn5,Choo'n Gum,Teresa Brewer,185562,1950-03-21,1950,0.906,0.671,0.362,0.0419,0.314,-11.781,0.0923,126.168,0.972,1,8,8,False,deep adult standards
2YhhNVpR3qkUiH9LPuPjRQ,You Go To My Head,Gene Ammons,176946,1950-01-01,1950,0.903,0.369,0.169,0.824,0.506,-10.661,0.0325,96.707,0.241,1,1,6,False,"jazz saxophone, soul jazz"
65Dm4aRthohlvuuyKVydIu,But Not For Me,Ella Fitzgerald,195133,1950-09-11,1950,0.986,0.41,0.0978,1.38e-05,0.174,-14.359,0.0321,136.431,0.24,0,4,33,False,"adult standards, jazz, jazz blues, soul, swing, vocal jazz"
17S4TXtQcVnPdqiiwUY4bj,"The Hostess With The Mostes' On The Ball - From ""Call Me Madam""","Ethel Merman, Gordon Jenkins & His Orchestra",206426,1950-01-01,1950,0.823,0.613,0.312,0.0,0.114,-8.215,0.133,175.9,0.647,1,8,9,False,"tin pan alley, vintage broadway"
4A6dlsRCbixJiQAOAR9WUI,Παλαμάκια,"Μ.Νίνου, Giorgos Mitsakis, I. Τατασόπουλος",193706,1950-01-01,1950,0.977,0.582,0.801,0.0986,0.125,-6.148,0.0534,171.652,0.972,1,9,12,False,
1MWRSfVAayw0sBlHdusEcx,Spring Is Here,Erroll Garner,145173,1950-09-18,1950,0.99,0.42,0.101,0.774,0.133,-20.648,0.0381,100.499,0.127,0,10,23,False,"bebop, jazz, jazz piano"
3BuxSqZabqCgSAWUaQlO85,El Caballo Blanco,José Alfredo Jimenez,159293,1950,1950,0.745,0.418,0.393,0.0,0.23,-12.243,0.0444,86.055,0.819,1,0,21,False,"mariachi, musica mexicana, norteno, ranchera"
043QzucEEVktfk3pD4pUwX,He's A Real Gone Guy,Nellie Lutcher,182426,1950-07-31,1950,0.483,0.69,0.297,9e-06,0.102,-13.883,0.169,119.511,0.788,1,1,18,False,"rhythm and blues, vintage swing"
2Eex8qCCTJEn0WOWBg444h,Camino de Guanajuato,José Alfredo Jimenez,220480,1950,1950,0.744,0.413,0.406,0.0,0.313,-12.957,0.0346,90.813,0.522,1,4,14,False,"mariachi, musica mexicana, norteno, ranchera"
7pYXUG0016ymha4xGByi7C,Khayalon Mein Kisi Ke Is Tarah,"Mukesh, Geeta Dutt",297936,1950-12-31,1950,0.896,0.535,0.305,1.21e-05,0.379,-8.912,0.0294,98.705,0.57,0,2,9,False,"classic bollywood, filmi"
3qmWt7F4XlTI3eHpD4wiaJ,Singing the Blues,Guy Mitchell,144693,1950,1950,0.734,0.661,0.624,0.000206,0.0898,-7.421,0.0391,139.936,0.894,1,4,6,False,deep adult standards
7wwfA92cDrU5EUn9gLL7A1,Fine Brown Frame,Nellie Lutcher,177640,1950-07-31,1950,0.594,0.725,0.12,0.0,0.158,-15.837,0.378,116.204,0.424,1,1,27,False,"rhythm and blues, vintage swing"
5xRfy0x9S7CxEMRtXGEZpN,My Baby's Gone,The Ravens,165866,1950,1950,0.832,0.782,0.321,0.0,0.358,-11.256,0.04,136.74,0.802,0,5,12,False,"doo-wop, rhythm and blues, vocal harmony group"
4uaJsPNaNXctC3bPE1ZqLk,"My Gal Is Purple (Stan Jones) [From ""Rio Grande""]",Victor Young,89986,1950,1950,0.936,0.352,0.0709,0.00013,0.101,-18.039,0.0331,79.632,0.298,1,9,3,False,classic soundtrack
4FVRGt6vBE3FUjeUpSIYta,Ninety Nine Years (Dead Or Alive),Guy Mitchell,173680,1950-04-07,1950,0.831,0.546,0.651,1.23e-06,0.0581,-8.397,0.0722,127.064,0.719,1,3,6,False,deep adult standards
4hfHhyPXBXyjY250iN7XHh,Absence Makes The Heart Grow Fonder (For Somebody Else),Dean Martin,180893,1950,1950,0.933,0.226,0.122,0.252,0.117,-14.679,0.045,169.987,0.187,1,1,12,False,"adult standards, easy listening, lounge, vocal jazz"
5FcY8F6eQSk70dVOxSjdYx,Main Title (Annie Get Your Gun),"Adolph Deutsch, MGM Studio Orchestra",85440,1950-05-17,1950,0.734,0.223,0.452,0.00048,0.578,-8.117,0.0406,70.077,0.358,0,7,9,False,classic soundtrack
5iksfNH7nOqT5d7uvviPqk,Choo'n Gum,Dean Martin,150173,1950,1950,0.902,0.477,0.381,5.46e-05,0.331,-10.217,0.0733,185.308,0.906,0,7,6,False,"adult standards, easy listening, lounge, vocal jazz"
6N8DUpisyPtbbQFzVV4PAv,Take Good Care of Her,The Wilburn Brothers,148666,1950-06-24,1950,0.927,0.515,0.214,1.09e-06,0.147,-12.548,0.0275,106.238,0.47,1,10,3,False,"classic country pop, traditional country"
5iEjdCVJtSFED3zn073BeU,By the Time I Get to Phoenix,Tony Mottola,188346,1950-05-26,1950,0.858,0.414,0.127,0.91,0.229,-19.744,0.0311,88.107,0.262,1,4,12,False,"easy listening, space age pop"
2cMc8EJKKflR5CDYWJbIc0,Ingênua,"Noel Rosa, Glauco Vianna",177866,1950,1950,0.992,0.258,0.151,0.876,0.111,-19.472,0.0367,74.03,0.256,0,10,24,False,"bossa nova, mpb, samba, velha guarda"
5fpcvXLo9xpo7ysaEvHPNl,Pennies From Heaven,Gene Ammons,154440,1950-01-01,1950,0.914,0.356,0.16,0.83,0.122,-14.052,0.0318,103.026,0.344,1,0,8,False,"jazz saxophone, soul jazz"
2sq0MR2yxe1VAcnzieBvdj,Little White Lies,George Shearing,176106,1950-01-01,1950,0.955,0.633,0.0991,0.158,0.139,-22.017,0.0433,136.416,0.656,1,8,6,False,"cool jazz, jazz piano"
7iWHi4A2wA2gkV0xzoBXZJ,Prelude To A Kiss,Gene Ammons,177440,1950-01-01,1950,0.906,0.351,0.0855,0.00178,0.294,-11.872,0.0306,79.959,0.177,0,9,7,False,"jazz saxophone, soul jazz"
3F3iXm7fvEHWfITcUW5CV3,"Mahler: Kindertotenlieder: No. 5, In diesem Wetter, in diesem Braus","Gustav Mahler, Kathleen Ferrier, Wiener Philharmoniker, Bruno Walter",390106,1950-01-01,1950,0.964,0.239,0.127,0.00519,0.104,-19.889,0.0411,106.802,0.0516,1,2,9,False,"classical, post-romantic era"
5ZopflSlQpcIkw175eh7Uj,Happiness Is A Thing Called Joe,Gene Ammons,165946,1950-01-01,1950,0.715,0.282,0.0982,0.0873,0.128,-11.482,0.0346,85.865,0.357,1,5,8,False,"jazz saxophone, soul jazz"
7Clg9NcEJxX5tC5LbfF0Zp,"La forza del destino: Act IV Pace, pace, mio Dio!","Giuseppe Verdi, Maria Callas, Milan La Scala Chorus, Orchestra Del Teatro Alla Scala, Milano, Tullio Serafin",384093,1950,1950,0.982,0.313,0.0537,0.00698,0.125,-19.469,0.047,128.797,0.0625,0,0,15,False,"classical, italian opera, italian romanticism, late romantic era"
2lb6kUapI9O4L14He8vsZB,Can Anyone Explain,Gene Ammons,171013,1950-01-01,1950,0.887,0.351,0.155,0.348,0.129,-12.25,0.0297,134.754,0.311,1,0,8,False,"jazz saxophone, soul jazz"
5LR0Fj48d0gjutU4zlC45d,Aaj Ki Raat Piya Dil Na Todo,Geeta Dutt,173560,1950-12-01,1950,0.987,0.542,0.292,0.0262,0.06,-12.848,0.165,170.958,0.85,1,8,6,False,"classic bollywood, filmi"
7a2WIGNWoqE5VXsXHx33Sn,Mucha Muchacha,Esquivel!,137927,1950-01-01,1950,0.585,0.672,0.524,0.0147,0.224,-10.664,0.0736,107.33,0.915,1,7,16,False,"exotica, lounge, space age pop"
0ihszCgDrbt0Elx9bT5nTX,Heather,xter0,144091,1950-04-17,1950,0.483,0.624,0.462,1.43e-06,0.28,-11.8,0.331,99.895,0.203,0,11,35,True,
0HEU3berJ5OBojU8XmEk1c,How Long Has This Been Going On?,Ella Fitzgerald,197666,1950-09-11,1950,0.974,0.303,0.175,1.32e-06,0.105,-14.203,0.0378,168.743,0.25,0,1,32,False,"adult standards, jazz, jazz blues, soul, swing, vocal jazz"
2eEknJsB9GvHbnSNfbZhJN,It Had To Be You,"Betty Hutton, Robert Norberg",191213,1950-01-01,1950,0.971,0.542,0.0548,3.35e-06,0.0782,-14.991,0.0473,97.275,0.324,0,10,35,False,vintage hollywood
55ofJJsCcK7c9XeMNbv0ir,Sweet Violets,Harry McClintock,82893,1950-01-01,1950,0.82,0.65,0.163,0.0,0.324,-14.588,0.0972,101.896,0.773,1,1,31,False,traditional folk
5P3mHI9VLJBEzBODPkG6et,Hechicera,Sonia Lopez,154333,1950,1950,0.643,0.746,0.62,0.0,0.0297,-8.776,0.051,83.146,0.967,1,9,25,False,mexican rock-and-roll
1y0U0HAe5QfTRzOsz74bOt,My Foolish Heart,Gene Ammons,166080,1950-01-01,1950,0.953,0.313,0.116,0.331,0.161,-12.645,0.0319,74.071,0.255,0,0,39,False,"jazz saxophone, soul jazz"
3vcSwhwwZ9BeCyANuIM9Tb,Hawaiian War Chant,The Ames Brothers,153013,1950-11-26,1950,0.95,0.828,0.372,0.000158,0.15,-12.725,0.0486,92.83,0.759,1,0,16,False,"easy listening, vocal harmony group"
5wUI4meWBEpTzgbEWkKInv,Heartaches By the Numbers,Guy Mitchell,161266,1950-04-07,1950,0.853,0.488,0.661,0.0,0.209,-9.145,0.0392,162.093,0.962,1,7,15,False,deep adult standards
7AEkLfvWlkDiOoHkjFJaCI,Hurry On Down,Nellie Lutcher,147066,1950-07-31,1950,0.647,0.859,0.216,0.00099,0.165,-12.229,0.217,113.211,0.562,1,8,20,False,"rhythm and blues, vintage swing"
6WlddmQR3oP9tVbMd8t6LW,Hliovasilema sosto,"Orfanos Kreouzis, Ioanna Georgakopoulou",189466,1950-01-01,1950,0.976,0.555,0.579,0.601,0.138,-11.283,0.0321,141.697,0.718,1,1,19,False,
1R1x57XruihE0IJKyLYJZX,Hedge Hog,Harry McClintock,64546,1950-01-01,1950,0.703,0.575,0.0919,0.0,0.277,-20.206,0.255,149.77,0.828,0,0,11,False,traditional folk
12pe2mL5SQGMI1gBGcEWKE,Night on Bald Mountain,"Modest Mussorgsky, Leonard Bernstein, New York Philharmonic",659560,1950,1950,0.854,0.316,0.308,0.888,0.585,-15.944,0.0411,103.459,0.095,1,2,30,False,"classical, early modern classical, late romantic era, russian romanticism"
7xb2RKxQF7qQg75SdYL4s7,How High The Moon,Nat King Cole Trio,161560,1950-04-01,1950,0.979,0.574,0.121,0.924,0.131,-20.403,0.0517,75.787,0.572,1,7,12,False,"adult standards, lounge, swing, vocal jazz"
043QzucEEVktfk3pD4pUwX,He's A Real Gone Guy,Nellie Lutcher,182426,1950-07-31,1950,0.483,0.69,0.297,9e-06,0.102,-13.883,0.169,119.511,0.788,1,1,18,False,"rhythm and blues, vintage swing"
41t0GDYrvt2TtV8gUWWatC,Have A Little Sympathy,Dean Martin,144240,1950,1950,0.95,0.456,0.132,0.000177,0.219,-13.913,0.0491,166.86,0.459,1,3,11,False,"adult standards, easy listening, lounge, vocal jazz"
2bBwi0SQowI6sCQyptjJ4U,Ain't Got No Home,Clarence,141933,1950-12-21,1950,0.688,0.767,0.43,0.293,0.0781,-8.039,0.0852,168.789,0.963,1,0,27,False,
6lL18eUPpm611uZkESRUph,How Am I To Know?,Benny Goodman Sextet,186066,1950,1950,0.974,0.731,0.047,0.65,0.281,-22.056,0.0401,127.245,0.586,1,10,9,False,"big band, swing, vintage jazz"
1Wvls9LpxOk88CdcIcLIx2,Hum Aaj Kahin Dil Kho Baithe,Mukesh,192800,1950-01-01,1950,0.991,0.645,0.31,0.792,0.169,-13.478,0.0301,110.264,0.661,1,5,11,False,"classic bollywood, filmi"
17S4TXtQcVnPdqiiwUY4bj,"The Hostess With The Mostes' On The Ball - From ""Call Me Madam""","Ethel Merman, Gordon Jenkins & His Orchestra",206426,1950-01-01,1950,0.823,0.613,0.312,0.0,0.114,-8.215,0.133,175.9,0.647,1,8,9,False,"tin pan alley, vintage broadway"
3w8DUQMmDBoBaDV6sO0TZ8,"Happy Feet (Based On ""Miles Shoes Jingle"")",Dean Martin,155266,1950,1950,0.879,0.824,0.388,0.0117,0.0645,-13.197,0.275,128.534,0.908,1,5,9,False,"adult standards, easy listening, lounge, vocal jazz"
2P12SmID74922J8JwQd90j,Mambo Gozón,Tito Puente,167133,1950-06-17,1950,0.484,0.753,0.718,0.299,0.0828,-10.256,0.0594,104.993,0.897,1,9,22,False,"afro-cuban percussion, jazz puertorriqueno, latin jazz, mambo, musica tradicional cubana, salsa"
7HVtPsj4WnABUmzJnWUT0D,Long Haired Preacher (Preacher and the Slave),Harry McClintock,198373,1950-01-01,1950,0.793,0.602,0.0576,0.0,0.353,-19.276,0.0753,102.816,0.686,1,0,12,False,traditional folk
25PRJaqKr4IEp9KVIu8FGB,How Can I Tell Her,The Four Freshmen,160613,1950-01-01,1950,0.767,0.248,0.26,0.0,0.0568,-11.099,0.0274,100.411,0.261,1,9,7,False,vocal harmony group
2MLmMItieH3cYupvapW81T,How Long Will It Take (To Stop Loving You),Lefty Frizzell,145306,1950,1950,0.889,0.782,0.18,5.09e-05,0.0571,-12.914,0.034,110.057,0.709,1,9,7,False,"arkansas country, classic country pop, honky tonk, traditional country, western swing"
5Xu51ZxSnYBxtWB0VNHYiM,Picadillo,Tito Puente,167466,1950-06-17,1950,0.759,0.493,0.893,0.872,0.156,-8.322,0.0378,95.771,0.763,0,9,19,False,"afro-cuban percussion, jazz puertorriqueno, latin jazz, mambo, musica tradicional cubana, salsa"
4BVCV3yMfVlwMSR1ImJzFs,How Far Down Can I Go,Lefty Frizzell,140693,1950,1950,0.838,0.515,0.219,0.0835,0.175,-12.708,0.0296,98.814,0.55,1,2,4,False,"arkansas country, classic country pop, honky tonk, traditional country, western swing"
5ZopflSlQpcIkw175eh7Uj,Happiness Is A Thing Called Joe,Gene Ammons,165946,1950-01-01,1950,0.715,0.282,0.0982,0.0873,0.128,-11.482,0.0346,85.865,0.357,1,5,8,False,"jazz saxophone, soul jazz"
61d3zbeymdgxsnXw5hFvMy,"Doctor, Lawyer, Indian Chief",Betty Hutton,186186,1950-01-01,1950,0.822,0.7,0.291,0.0,0.0639,-9.72,0.231,176.253,0.943,1,8,32,False,vintage hollywood
5DIVWgTeJ2fPIxaY9e7ZKn,I've Got A Crush On You,Ella Fitzgerald,196440,1950-09-11,1950,0.986,0.455,0.106,0.0,0.122,-14.086,0.0422,66.807,0.258,1,2,56,False,"adult standards, jazz, jazz blues, soul, swing, vocal jazz"
5rJPcj8vu1wBZbKym4m57q,It Only Hurts for a Little While,The Ames Brothers,162173,1950-11-26,1950,0.967,0.328,0.237,0.0104,0.199,-11.528,0.0303,85.059,0.226,1,9,21,False,"easy listening, vocal harmony group"
6KVtw1sKuSLK4yzCX4jzib,Mambo Ni Hablar,Pérez Prado,167920,1950-11-26,1950,0.0666,0.837,0.918,0.00106,0.241,-6.657,0.204,106.42,0.546,1,2,28,False,"mambo, musica tradicional cubana, space age pop"
1MWRSfVAayw0sBlHdusEcx,Spring Is Here,Erroll Garner,145173,1950-09-18,1950,0.99,0.42,0.101,0.774,0.133,-20.648,0.0381,100.499,0.127,0,10,23,False,"bebop, jazz, jazz piano"
2tbhHWrW6dg3aqIkCnrFna,"A Bushel And A Peck (from ""Guys & Dolls"")","Vivian Blaine, The Hot Box Girls",92308,1950,1950,0.769,0.627,0.252,0.122,0.676,-19.391,0.0713,145.115,0.647,1,2,15,False,
5Ojjj9ske1LPxOGWp7WlBn,His Rocking Horse Ran Away,Betty Hutton,187160,1950-01-01,1950,0.88,0.714,0.338,0.0,0.365,-7.545,0.437,111.73,0.486,1,7,5,False,vintage hollywood
5RcvlmVx2xtFcp2Ta5pw7X,Someone To Watch Over Me,Ella Fitzgerald,196666,1950-09-11,1950,0.99,0.354,0.0851,4.49e-06,0.123,-13.738,0.0345,97.684,0.197,1,7,51,False,"adult standards, jazz, jazz blues, soul, swing, vocal jazz"
78UodCLFFbjKsVBuGIkY7G,Blue Skies,Betty Hutton,172306,1950-01-01,1950,0.908,0.521,0.143,0.000285,0.29,-10.587,0.0498,130.511,0.349,0,5,29,False,vintage hollywood
4Vb1yy1CuBdEMPDPgtDGsK,Milti Hai Zindagi Men,Lata Mangeshkar,291388,1950-12-01,1950,0.933,0.548,0.607,9.22e-06,0.104,-5.734,0.0454,129.192,0.567,0,2,18,False,"classic bollywood, filmi, lata"
3fQLXoRwKQTnThncdMCqwG,Mambo No 5,Pérez Prado,156975,1950-11-26,1950,0.36,0.673,0.493,0.753,0.0358,-14.83,0.34,180.624,0.807,0,5,44,False,"mambo, musica tradicional cubana, space age pop"
5PKx98pqCaUpq75By9h1G7,Darkie Uncle Ned,Harry McClintock,121146,1950-01-01,1950,0.839,0.659,0.126,0.0,0.261,-18.14,0.567,99.49,0.52,0,5,10,False,traditional folk
6EzCJwgHK5v8UJzmBSfFml,Tea for Two (with Axel Stordahl & His Orchestra),"Doris Day, Axel Stordahl And His Orchestra",191306,1950-04-01,1950,0.929,0.401,0.205,0.0,0.234,-13.377,0.0365,86.813,0.394,1,2,25,False,"adult standards, easy listening, lounge, vocal jazz"
1tBFUIJXiOGRkqhWEfrk6L,"Milte Hi Ankhen Dil Hua Diwana, Pt. 1","Shamshad Begum, Talat Mahmood, Shakeel Badayuni",192066,1950-01-02,1950,0.919,0.648,0.279,6.82e-05,0.151,-11.413,0.0353,119.061,0.58,1,3,14,False,"classic bollywood, filmi, ghazal"
1VvLeHfMxqXxiKbkCOdTHD,Reconstructed Rebel Soldier,Harry McClintock,161546,1950-01-01,1950,0.8,0.619,0.142,0.0,0.744,-19.021,0.52,98.368,0.573,1,0,9,False,traditional folk
4UNiDnVTggpj2HBT9LWqfR,Melodie D'Amour,The Ames Brothers,157240,1950,1950,0.884,0.447,0.582,1.38e-05,0.452,-7.422,0.0297,168.304,0.876,1,7,26,False,"easy listening, vocal harmony group"
6eiznY58rpstk4J6nqYnAi,Anything You Can Do,"Betty Hutton, Howard Keel",190275,1950-05-17,1950,0.955,0.687,0.304,0.0,0.158,-11.235,0.445,86.462,0.692,1,9,14,False,vintage hollywood
6GRtcfDgt38aoVPJoVEmwm,Agua Limpia Todo,Tito Puente,175960,1950-06-17,1950,0.799,0.688,0.714,0.00136,0.342,-9.007,0.0537,95.805,0.965,0,5,13,False,"afro-cuban percussion, jazz puertorriqueno, latin jazz, mambo, musica tradicional cubana, salsa"
6HfN6qDsnwTSfF4a6teEt5,I Could Have Danced All Night,Edmundo Ros,144733,1950-03-03,1950,0.461,0.761,0.505,0.000244,0.0602,-13.235,0.12,133.143,0.848,1,0,12,False,"easy listening, mambo"
3Jz8xtvlVl7rEGQwbCGzgK,Carry Me Back to Old Virginny,The Chordettes,133626,1950-05-15,1950,0.972,0.372,0.022,0.0,0.185,-17.19,0.0391,85.819,0.0646,1,3,14,False,"classic girl group, doo-wop, vocal harmony group"
52gS0teTG1YwlslomzfyVp,My Defenses Are Down,Howard Keel,205440,1950-05-17,1950,0.953,0.275,0.217,0.0,0.0733,-10.413,0.03,75.608,0.517,1,9,14,False,vintage hollywood
5qZaO3SBUFHYhD2ftdsGZl,De México a la Habana,La Sonora Santanera,170560,1950,1950,0.465,0.547,0.383,0.00365,0.191,-17.096,0.0602,83.197,0.75,0,2,25,False,"bolero, bolero mexicano, tropical"
4kCb5K4lyspz6G8cmW7saK,The Thing,Phil Harris and His Orchestra,139506,1950,1950,0.884,0.838,0.686,0.0,0.384,-7.66,0.297,126.929,0.922,1,2,17,False,
5wqS4ggLpzheFW3XsktQHl,Hamlet,"Betty Hutton, Robert Norberg",169626,1950-01-01,1950,0.717,0.689,0.241,0.0,0.316,-8.468,0.171,157.102,0.616,1,0,3,False,vintage hollywood
70hNBUhDf8RZ4vsiIMgNrV,Be Honest With Me,Dean Martin,150426,1950,1950,0.884,0.575,0.322,0.0,0.287,-10.887,0.0492,149.397,0.921,1,3,11,False,"adult standards, easy listening, lounge, vocal jazz"
3wGEtQ3MUP4CG4R0N4X6tr,Tell Me Why,The Chordettes,142600,1950-05-15,1950,0.977,0.188,0.0327,0.0,0.311,-18.114,0.0316,84.861,0.0394,1,7,13,False,"classic girl group, doo-wop, vocal harmony group"
6NQrNKkLdQaGm3RfzyNwgB,There's No Business Like Show Business,"Betty Hutton, Howard Keel, Louis Calhern, Keenan Wynn",150973,1950-05-17,1950,0.954,0.646,0.445,1.26e-05,0.109,-9.617,0.0598,138.412,0.73,1,5,12,False,vintage hollywood
7fG1fIOqGQ0pe7PQBII9gS,Historia de un Amor,Pérez Prado,171893,1950-11-26,1950,0.712,0.498,0.405,0.909,0.0388,-10.267,0.0533,98.018,0.592,1,2,8,False,"mambo, musica tradicional cubana, space age pop"
4hBAiBM4rYTT1B2hsWHBCS,Hey Mr Bluebird,The Wilburn Brothers,125640,1950-06-24,1950,0.641,0.777,0.386,0.0,0.192,-9.169,0.0292,83.051,0.941,1,7,2,False,"classic country pop, traditional country"
2SojFEGc4Ybg2wK8m4htxx,Hands,The Wilburn Brothers,191266,1950-06-24,1950,0.832,0.475,0.354,0.000256,0.208,-15.654,0.0288,80.534,0.431,1,2,2,False,"classic country pop, traditional country"
2axTGW6HuwS7BwXwh7ia0U,Husn Walon Ko Na Dil Do,"Talat Mahmood, Shakeel Badayuni",210808,1950-01-02,1950,0.829,0.319,0.16,0.00108,0.0959,-16.453,0.0457,69.476,0.695,1,8,3,False,"classic bollywood, filmi, ghazal"
6KYCpY7v61IaoDFHDE0sVI,The Hostess with the Mostes' on the Ball,Dinah Shore,215120,1950,1950,0.96,0.732,0.215,0.0,0.111,-13.048,0.0558,83.528,0.59,1,7,2,False,"adult standards, easy listening, torch song, vocal jazz"
4Un8avfhDBwfHP2XhNXGm6,I’ve Got the Sun in the Morning,Betty Hutton,137866,1950-05-17,1950,0.941,0.654,0.353,0.0,0.116,-9.131,0.0717,88.419,0.641,1,2,21,False,vintage hollywood
3EhXkO5ITpreU8oI1gw6IS,Outside Dan Murphy's Door,Harry McClintock,121746,1950-01-01,1950,0.891,0.533,0.0971,0.0,0.245,-16.918,0.133,176.823,0.619,1,7,8,False,traditional folk
73rJdLzGNXOkUP1T2E3kcN,Whitney Houston Medley,"Zsa Zsa Padilla, Freestyle, Lani Misalucha",506200,1950-01-01,1950,0.429,0.278,0.456,1.53e-05,0.944,-10.952,0.0443,140.879,0.144,1,7,20,False,"classic opm, opm"
7jDHfGpTIwZvUkYPLUK2ay,Mon homme,Patachou,215293,1950-07-08,1950,0.953,0.518,0.12,0.0,0.0973,-18.473,0.0696,92.381,0.311,0,9,24,False,"vintage chanson, ye ye"
5LgJxOtSB0kDKphDn7oxGt,"Take Back Your Mink (from ""Guys & Dolls"")","Vivian Blaine, The Hot Box Girls",173703,1950,1950,0.853,0.563,0.0808,0.000507,0.0871,-21.863,0.0479,80.183,0.523,1,10,10,False,
7wOypVbv6u3sdnjBwLqFgO,Peg O' My Heart,Jerry Murad's Harmonicats,133813,1950-01-01,1950,0.364,0.427,0.201,0.329,0.423,-11.632,0.0364,67.071,0.522,0,11,15,False,
4Sj3LgGGyAdx6hWLXDj9wx,That Lucky Old Sun (Just Rolls Around Heaven All Day),Dean Martin,183666,1950,1950,0.973,0.647,0.11,0.165,0.121,-11.469,0.0559,131.722,0.531,1,1,18,False,"adult standards, easy listening, lounge, vocal jazz"
1pn02i8KH8XqR66tbxxU9J,Lullaby Of The Leaves,Benny Goodman Sextet,161426,1950,1950,0.967,0.568,0.174,0.783,0.125,-17.856,0.0394,79.937,0.69,0,7,18,False,"big band, swing, vintage jazz"
6i6ch3gxV9qxdxJAAVeZWP,The Girl That I Marry,Howard Keel,80360,1950-05-17,1950,0.965,0.411,0.136,1.66e-06,0.382,-11.004,0.0266,36.238,0.546,1,9,12,False,vintage hollywood
4LmdMHMM5bR1ly1FWt2mRi,My Heart Stood Still,Erroll Garner,256160,1950-09-18,1950,0.991,0.508,0.103,0.911,0.135,-20.703,0.0353,137.164,0.158,0,7,12,False,"bebop, jazz, jazz piano"
4MElOMJoYXtkHl7KqZtH2y,Tadbeer Se Bigdi Huyi Taqdeer,Geeta Dutt,204080,1950-12-01,1950,0.955,0.748,0.352,0.0,0.184,-11.839,0.035,100.81,0.828,1,0,17,False,"classic bollywood, filmi"
3DoGOqis8SyoEtwFfH2UCt,En el Campo Hay una Flor,Los Davalos,182259,1950-02-17,1950,0.912,0.761,0.331,7.27e-06,0.0875,-10.391,0.153,105.75,0.642,1,10,32,False,classic peruvian pop
0zWhhHBG8CiCZSseDlJpc1,Band of Gold (with Ray Conniff & His Orchestra & Chorus),"Don Cherry, Ray Conniff",154026,1950,1950,0.928,0.392,0.483,0.0201,0.171,-5.856,0.0297,113.116,0.652,1,7,10,False,
0yq48UtYqMcdFN5Vmt4t58,Casey Jones (The Union Scab),Harry McClintock,211506,1950-01-01,1950,0.904,0.628,0.102,0.0,0.279,-17.291,0.196,129.742,0.553,1,7,5,False,traditional folk
3XQ2ZGDLsNVzypE5UMFsIF,Always Late (With Your Kisses),Lefty Frizzell,184040,1950,1950,0.842,0.776,0.198,0.0,0.35,-11.406,0.0318,117.755,0.567,1,9,23,False,"arkansas country, classic country pop, honky tonk, traditional country, western swing"
05m1SOCHqhGLsiHUOViOyq,Dungaree Doll,"Eddie Fisher, Hugo Winterhalter and His Orchestra and Chorus",119626,1950,1950,0.77,0.543,0.634,0.0,0.206,-5.327,0.085,166.722,0.825,1,8,6,False,"adult standards, deep adult standards, easy listening"
6fYh9si2l151Xd3L4XWdej,They Say It's Wonderful,"Betty Hutton, Howard Keel",209200,1950-05-17,1950,0.962,0.227,0.214,7.98e-06,0.108,-11.603,0.0323,81.155,0.196,1,4,8,False,vintage hollywood
2VJVEYheOmScpMPIEmQerk,Colonel Buffalo Bill,"Keenan Wynn, Benay Venuta, Howard Keel",154760,1950-05-17,1950,0.971,0.63,0.45,1.06e-06,0.398,-10.91,0.235,135.597,0.681,1,8,8,False,
5yAxeEQPH0sIcAVrPc3IvM,Jordan Is a Hard Road to Travel,Harry McClintock,124453,1950-01-01,1950,0.786,0.735,0.233,0.0,0.218,-17.612,0.0823,105.867,0.802,1,9,4,False,traditional folk
0oo4keuQavD0b9JgR71x7C,It Happened Once Before,The Four Freshmen,151720,1950-01-01,1950,0.936,0.608,0.129,3.73e-06,0.102,-11.593,0.0279,82.947,0.36,1,0,6,False,vocal harmony group
6rMj9k99Rw3woiM2mXrma5,Stung Right,Harry McClintock,167506,1950-01-01,1950,0.711,0.673,0.156,0.0,0.376,-17.175,0.42,122.064,0.693,1,7,4,False,traditional folk
