id,name,artists,duration_ms,release_date,year,acousticness,danceability,energy,instrumentalness,liveness,loudness,speechiness,tempo,valence,mode,key,popularity,explicit,genre
0PDyEOcb2ASZ7pj9lZ29xC,Zing-A Zing-A Zing Boom,Dean Martin,135293,1950,1950,0.653,0.598,0.418,0.0,0.276,-8.846,0.0624,95.644,0.932,1,0,27,False,"adult standards, easy listening, lounge, vocal jazz"
06wdcXqI8cFTjt5gMSFZ2e,Mam'selle,The Four Freshmen,185906,1950-01-01,1950,0.899,0.287,0.13,0.0,0.122,-12.033,0.0305,145.629,0.185,1,1,4,False,vocal harmony group
3xpB9FWoqfMaKr0uqckkXC,Mood Indigo,The Four Freshmen,166146,1950-01-01,1950,0.913,0.583,0.157,0.0,0.114,-12.073,0.0265,75.511,0.31,1,7,5,False,vocal harmony group
6EASfsMv6799S8PTYN8tyd,Mi Casita de Papel,Jorge Sepúlveda,120626,1950-02-04,1950,0.157,0.626,0.323,1.22e-06,0.095,-15.137,0.0597,97.585,0.917,1,10,29,False,"cancion melodica, spanish invasion, vintage spanish pop"
7eEPGz86EFokmwkbi9AHcu,My Baby's Just Like Money,Lefty Frizzell,162973,1950,1950,0.633,0.609,0.347,0.000547,0.13,-10.838,0.0402,157.672,0.765,1,4,5,False,"arkansas country, classic country pop, honky tonk, traditional country, western swing"
11QFinScRKx4KSLcx4Ea5t,Under Paris Skies,Tony Mottola y Su Orquesta,124480,1950-05-26,1950,0.984,0.275,0.282,0.936,0.357,-13.263,0.0331,209.099,0.559,0,5,35,False,"easy listening, man's orchestra"
7cNJPOPa9FpGfIYayDyBx4,De México a la Habana,La Sonora Santanera,174173,1950,1950,0.247,0.64,0.56,0.000159,0.233,-11.515,0.0574,82.197,0.85,1,5,20,False,"bolero, bolero mexicano, tropical"
3Jz8xtvlVl7rEGQwbCGzgK,Carry Me Back to Old Virginny,The Chordettes,133626,1950-05-15,1950,0.972,0.372,0.022,0.0,0.185,-17.19,0.0391,85.819,0.0646,1,3,14,False,"classic girl group, doo-wop, vocal harmony group"
12pe2mL5SQGMI1gBGcEWKE,Night on Bald Mountain,"Modest Mussorgsky, Leonard Bernstein, New York Philharmonic",659560,1950,1950,0.854,0.316,0.308,0.888,0.585,-15.944,0.0411,103.459,0.095,1,2,30,False,"classical, early modern classical, late romantic era, russian romanticism"
2UIFgL0El5vH1u70nMnMPv,Niégalo Todo,Alci Acosta,181373,1950,1950,0.438,0.724,0.511,1.56e-06,0.0571,-9.201,0.0456,120.181,0.93,0,7,39,False,"bolero, classic colombian pop, cumbia, musica popular colombiana"
3fQLXoRwKQTnThncdMCqwG,Mambo No 5,Pérez Prado,156975,1950-11-26,1950,0.36,0.673,0.493,0.753,0.0358,-14.83,0.34,180.624,0.807,0,5,44,False,"mambo, musica tradicional cubana, space age pop"
09I9binBXLWyB82M3IrxoR,The Naughty Lady of Shady Lane,The Ames Brothers,171066,1950-11-26,1950,0.846,0.698,0.478,0.000154,0.083,-8.265,0.0406,130.998,0.738,1,1,26,False,"easy listening, vocal harmony group"
7d0GT25coyRGTYKPdohfC9,El Nido,La Sonora Santanera,179573,1950,1950,0.779,0.598,0.428,5.82e-06,0.0625,-10.487,0.0423,76.244,0.964,0,4,32,False,"bolero, bolero mexicano, tropical"
1zoyHU5tY6IUa5GB4mSloE,Now You Know,The Four Freshmen,186493,1950-01-01,1950,0.983,0.507,0.0164,0.0,0.144,-17.365,0.0291,95.098,0.166,0,0,20,False,vocal harmony group
2RxY7nzk3Enn39Ahf2vjbW,Pena Negra,La Sonora Santanera,178866,1950,1950,0.77,0.66,0.487,2.43e-06,0.648,-10.17,0.0331,132.799,0.961,0,7,26,False,"bolero, bolero mexicano, tropical"
7ke1JNPEeYIO1ryd1A2SyJ,Norma Guadalajara,Pérez Prado,183133,1950-11-26,1950,0.314,0.32,0.552,0.764,0.242,-6.826,0.0708,197.283,0.708,0,0,26,False,"mambo, musica tradicional cubana, space age pop"
1zj2Tu2goqddycoNosJZGz,Mambo No. 8,Pérez Prado,165893,1950-11-26,1950,0.466,0.553,0.77,0.0019,0.153,-7.487,0.0995,142.451,0.84,0,5,37,False,"mambo, musica tradicional cubana, space age pop"
2tBHXwPZpoWqHPI8oQ0qSz,Ya No Vuelvas Conmigo,La Sonora Santanera,162826,1950,1950,0.735,0.692,0.499,0.000234,0.0634,-12.133,0.0369,132.347,0.932,1,5,24,False,"bolero, bolero mexicano, tropical"
6tFBh6N8hwyOBTleBebz4x,Non Dimenticar,Tony Mottola y Su Orquesta,170320,1950-05-26,1950,0.989,0.472,0.244,0.778,0.224,-12.973,0.0281,79.767,0.335,0,6,19,False,"easy listening, man's orchestra"
2bBwi0SQowI6sCQyptjJ4U,Ain't Got No Home,Clarence,141933,1950-12-21,1950,0.688,0.767,0.43,0.293,0.0781,-8.039,0.0852,168.789,0.963,1,0,27,False,
65Dm4aRthohlvuuyKVydIu,But Not For Me,Ella Fitzgerald,195133,1950-09-11,1950,0.986,0.41,0.0978,1.38e-05,0.174,-14.359,0.0321,136.431,0.24,0,4,33,False,"adult standards, jazz, jazz blues, soul, swing, vocal jazz"
2rwkzLkV4OYY3eszKsPUMm,Luces de Nueva York - Remasterizado,La Sonora Santanera,185400,1950,1950,0.679,0.646,0.209,0.0,0.0767,-17.241,0.0575,118.239,0.791,1,10,40,False,"bolero, bolero mexicano, tropical"
1r8SFRVZWeyLDlG0lBbEiu,El Nido,La Sonora Santanera,184160,1950,1950,0.66,0.522,0.502,0.0,0.0537,-9.555,0.0339,149.762,0.962,1,9,36,False,"bolero, bolero mexicano, tropical"
1SzDyi767gsi2PNqmygxwa,Gnoissienne No 3,Francis Poulenc,137920,1950-01-01,1950,0.995,0.399,0.112,0.911,0.11,-16.635,0.0405,132.42,0.066,0,9,24,False,"classical, early modern classical, neoclassicism"
4Rrm5AaiACtvvIueTqfoh0,The Naughty Lady Of Shady Lane,The Ames Brothers,168613,1950,1950,0.867,0.692,0.493,0.000136,0.0881,-7.964,0.0386,131.366,0.838,0,10,8,False,"easy listening, vocal harmony group"
2BMorWMRsJPc1hEstsFKRU,I'll Remember April,George Shearing,166640,1950-01-01,1950,0.988,0.551,0.112,0.884,0.121,-23.167,0.0383,126.778,0.659,1,0,40,False,"cool jazz, jazz piano"
6UBVauLFn5cXv0egiowOFH,La Nina Popof,Pérez Prado,165720,1950-11-26,1950,0.175,0.572,0.83,0.336,0.306,-7.149,0.0885,145.028,0.908,0,10,28,False,"mambo, musica tradicional cubana, space age pop"
0JpkWvGg83rjXiYbRPL8Va,Blues In My Shower,Nat King Cole Trio,173133,1950-04-01,1950,0.983,0.618,0.123,0.883,0.097,-18.077,0.0649,72.111,0.476,1,5,25,False,"adult standards, lounge, swing, vocal jazz"
0rd7q2ibicTeKNbLUl3gTV,Pena Negra,La Sonora Santanera,181933,1950,1950,0.635,0.679,0.486,0.0,0.361,-10.398,0.0337,131.197,0.962,0,7,34,False,"bolero, bolero mexicano, tropical"
6KVtw1sKuSLK4yzCX4jzib,Mambo Ni Hablar,Pérez Prado,167920,1950-11-26,1950,0.0666,0.837,0.918,0.00106,0.241,-6.657,0.204,106.42,0.546,1,2,28,False,"mambo, musica tradicional cubana, space age pop"
2eEknJsB9GvHbnSNfbZhJN,It Had To Be You,"Betty Hutton, Robert Norberg",191213,1950-01-01,1950,0.971,0.542,0.0548,3.35e-06,0.0782,-14.991,0.0473,97.275,0.324,0,10,35,False,vintage hollywood
1uIHc8oPOKPeoGuncGUxFY,Libiamo Ne' Lieti Calici (Brindisi) - la Traviata Atto I,Renata Tebaldi,184253,1950-03-03,1950,0.911,0.395,0.339,4.94e-05,0.399,-13.309,0.0582,134.469,0.35,1,10,29,False,"classical soprano, italian soprano, opera"
4Bsym9x55B9lkzvmRIZzNc,The Peanut Vendor,Stan Kenton & His Orchestra,164560,1950-01-01,1950,0.853,0.634,0.931,0.872,0.0803,-7.611,0.0647,106.924,0.652,1,2,12,False,"big band, jazz orchestra, man's orchestra, swing"
5uEo5o9Gm36FBaSfBgu7Za,Gymnopedie No 1,Francis Poulenc,176826,1950-01-01,1950,0.992,0.493,0.0567,0.932,0.103,-16.439,0.0425,88.599,0.233,0,4,20,False,"classical, early modern classical, neoclassicism"
4FVRGt6vBE3FUjeUpSIYta,Ninety Nine Years (Dead Or Alive),Guy Mitchell,173680,1950-04-07,1950,0.831,0.546,0.651,1.23e-06,0.0581,-8.397,0.0722,127.064,0.719,1,3,6,False,deep adult standards
2KOS441jedIFjSiy5qJVD9,Blues for Nica,Kenny Drew,328866,1950-05-12,1950,0.633,0.74,0.223,0.635,0.291,-16.155,0.0521,108.001,0.393,1,5,23,False,"bebop, hard bop, jazz piano"
7wwfA92cDrU5EUn9gLL7A1,Fine Brown Frame,Nellie Lutcher,177640,1950-07-31,1950,0.594,0.725,0.12,0.0,0.158,-15.837,0.378,116.204,0.424,1,1,27,False,"rhythm and blues, vintage swing"
7178cp8ua1xWgHeBm2Lv90,Bakit Ngayon Ka Lang,"Zsa Zsa Padilla, Freestyle, Lani Misalucha",292000,1950-01-01,1950,0.677,0.301,0.531,0.0,0.578,-9.096,0.0397,129.61,0.151,1,7,25,False,"classic opm, opm"
5MoliimIV6dhS6Ew31dDlX,Nothing But D Best,George Shearing Quintet,178480,1950-01-01,1950,0.98,0.525,0.233,0.899,0.115,-20.536,0.0402,119.346,0.594,1,0,4,False,
1WiMVeKlTBCXhasPf3t06V,I'll Never Be The Same,Nat King Cole Trio,170466,1950-04-01,1950,0.987,0.463,0.0655,0.937,0.105,-23.375,0.0674,206.236,0.315,1,1,11,False,"adult standards, lounge, swing, vocal jazz"
4E3nNsPrpd0gM3mwVwHPB0,Ya No Vuelvas Conmigo,La Sonora Santanera,165933,1950,1950,0.64,0.709,0.52,0.000122,0.048,-11.095,0.0353,131.082,0.962,1,5,24,False,"bolero, bolero mexicano, tropical"
1rvXymShkt4ClhiWEsn4ad,It Never Occurred To Me,The Four Freshmen,187053,1950-01-01,1950,0.753,0.275,0.219,0.0,0.161,-9.164,0.027,90.935,0.236,0,0,12,False,vocal harmony group
6NQrNKkLdQaGm3RfzyNwgB,There's No Business Like Show Business,"Betty Hutton, Howard Keel, Louis Calhern, Keenan Wynn",150973,1950-05-17,1950,0.954,0.646,0.445,1.26e-05,0.109,-9.617,0.0598,138.412,0.73,1,5,12,False,vintage hollywood
1yFqpPQ3uT28gCxt2n3yxj,September In The Rain,George Shearing,194880,1950-01-01,1950,0.936,0.58,0.147,0.755,0.0997,-23.478,0.0353,124.738,0.592,1,8,28,False,"cool jazz, jazz piano"
1NbWYfmSQjnW31rvrfl0jg,"I've Never Been In Love Before (from ""Guys & Dolls"")","Robert Alda, Isabel Bigley",158334,1950,1950,0.976,0.232,0.061,7.89e-06,0.33,-21.599,0.0395,70.888,0.37,1,1,10,False,
4oHO5ivH2ECajGsj8VH9VM,Moonlight In Vermont,Nat King Cole Trio,193026,1950-04-01,1950,0.982,0.525,0.173,0.907,0.121,-17.574,0.048,64.257,0.228,1,8,14,False,"adult standards, lounge, swing, vocal jazz"
7AEkLfvWlkDiOoHkjFJaCI,Hurry On Down,Nellie Lutcher,147066,1950-07-31,1950,0.647,0.859,0.216,0.00099,0.165,-12.229,0.217,113.211,0.562,1,8,20,False,"rhythm and blues, vintage swing"
1zpcmHFlnd8VAvtdsmZTmZ,These Foolish Things (Remind Me Of You),Nat King Cole Trio,194533,1950-04-01,1950,0.972,0.547,0.0972,0.938,0.105,-19.857,0.0601,182.509,0.232,0,0,15,False,"adult standards, lounge, swing, vocal jazz"
7wTcoNrpCDnPyQ7ADmVFir,Não Brinca Não,"Noel Rosa, Almirante",135773,1950,1950,0.993,0.674,0.332,0.953,0.115,-19.359,0.326,130.136,0.936,1,7,19,False,"bossa nova, mpb, samba, velha guarda"
3xrgLEGAvQOTAYZZXfhhWk,Flores Negras,Sonia Lopez,174933,1950,1950,0.829,0.816,0.479,0.00667,0.0723,-9.199,0.0452,132.642,0.92,1,7,18,False,mexican rock-and-roll
6vQCRZe6tiHOcNwb7vnVbY,Night In Tunisia,Charlie Parker,177056,1950-05-25,1950,0.981,0.447,0.383,0.861,0.108,-14.91,0.0916,178.961,0.524,1,10,5,False,"bebop, contemporary post-bop, cool jazz, jazz, jazz saxophone, vocal jazz"
7JzyZojx4nuckMOzLFehvF,The Ninety and Nine,Burl Ives,164710,1950-06-19,1950,0.952,0.542,0.115,0.0,0.102,-11.435,0.0493,169.2,0.542,1,7,3,False,"adult standards, american folk revival"
7KwZeRQy75kZAkvJGpaTZe,Nadie Nos Ve,Compay Segundo,169733,1950-06-17,1950,0.691,0.733,0.498,0.0,0.0434,-11.631,0.0385,103.585,0.919,1,9,7,False,"mambo, musica tradicional cubana, son cubano"
7McmdP4CnVfIVUCtjA6rGo,"Nightime Approach / Rescuing the Children (From ""Rio Grande"")",Victor Young,412160,1950,1950,0.897,0.125,0.389,0.798,0.12,-11.554,0.0343,80.862,0.0398,1,6,1,False,classic soundtrack
4sJmIGy7sICjyc9mc4UlHH,November Seascape,George Shearing,155920,1950-01-01,1950,0.985,0.441,0.0521,0.877,0.112,-20.59,0.0466,80.318,0.132,1,9,2,False,"cool jazz, jazz piano"
2UrbQGKNoY1iMZrfneFryf,Night in Tunisia,Charlie Parker,280896,1950-05-23,1950,0.99,0.591,0.477,0.888,0.131,-11.605,0.08,95.871,0.637,0,7,3,False,"bebop, contemporary post-bop, cool jazz, jazz, jazz saxophone, vocal jazz"
07HC3TNoA6UWhqOFxNRC21,No Letter Today,The Wilburn Brothers,136333,1950-06-24,1950,0.885,0.32,0.302,0.0,0.169,-12.273,0.0276,92.251,0.406,1,2,3,False,"classic country pop, traditional country"
25zYT06Cdwg2Y2qDlFartm,Naga Batu,Susarla Dakshinamurthy,180853,1950-12-31,1950,0.985,0.484,0.42,0.0716,0.14,-7.111,0.0672,118.479,0.431,1,6,5,False,vintage tollywood
5K1Fh8W1hgTWjXh8aXF1QY,Gago Apaixonado,"Noel Rosa, Nuno Roland",162426,1950,1950,0.992,0.435,0.195,0.98,0.557,-18.128,0.113,65.629,0.618,0,3,33,False,"bossa nova, mpb, samba, velha guarda"
1hwbx9bouO1iXa2tSgYMMP,Poor Butterfly,Nat King Cole Trio,154840,1950-04-01,1950,0.988,0.672,0.0734,0.945,0.106,-21.966,0.0517,76.883,0.368,1,8,12,False,"adult standards, lounge, swing, vocal jazz"
7xb2RKxQF7qQg75SdYL4s7,How High The Moon,Nat King Cole Trio,161560,1950-04-01,1950,0.979,0.574,0.121,0.924,0.131,-20.403,0.0517,75.787,0.572,1,7,12,False,"adult standards, lounge, swing, vocal jazz"
043QzucEEVktfk3pD4pUwX,He's A Real Gone Guy,Nellie Lutcher,182426,1950-07-31,1950,0.483,0.69,0.297,9e-06,0.102,-13.883,0.169,119.511,0.788,1,1,18,False,"rhythm and blues, vintage swing"
7dMpQpFkOQzKLuvk2t2KkH,I'll Never Be The Same,Benny Goodman Sextet,237093,1950,1950,0.981,0.392,0.042,0.721,0.0905,-24.984,0.0386,84.081,0.349,1,7,8,False,"big band, swing, vintage jazz"
5GnfyK9GVTQiZ6T1bTjhJu,Dreamy Old New England Moon,Dean Martin,155533,1950,1950,0.973,0.209,0.0808,0.000755,0.105,-17.142,0.0338,86.416,0.131,1,8,13,False,"adult standards, easy listening, lounge, vocal jazz"
6HfN6qDsnwTSfF4a6teEt5,I Could Have Danced All Night,Edmundo Ros,144733,1950-03-03,1950,0.461,0.761,0.505,0.000244,0.0602,-13.235,0.12,133.143,0.848,1,0,12,False,"easy listening, mambo"
2bcQlqQmk2NccLqe8QQsjZ,Liebestraum No. 3 in A-flat,"Franz Liszt, Arthur Rubinstein",309813,1950,1950,0.992,0.323,0.0759,0.893,0.0947,-17.3,0.0428,169.953,0.0419,1,8,9,False,"classical, late romantic era"
5PKx98pqCaUpq75By9h1G7,Darkie Uncle Ned,Harry McClintock,121146,1950-01-01,1950,0.839,0.659,0.126,0.0,0.261,-18.14,0.567,99.49,0.52,0,5,10,False,traditional folk
2cMc8EJKKflR5CDYWJbIc0,Ingênua,"Noel Rosa, Glauco Vianna",177866,1950,1950,0.992,0.258,0.151,0.876,0.111,-19.472,0.0367,74.03,0.256,0,10,24,False,"bossa nova, mpb, samba, velha guarda"
40FLOuvgK6XpyCf8zWzb4W,Three Blind Mice,Nat King Cole Trio,154400,1950-04-01,1950,0.977,0.629,0.043,0.000167,0.105,-18.596,0.0729,146.72,0.406,1,1,10,False,"adult standards, lounge, swing, vocal jazz"
5wUI4meWBEpTzgbEWkKInv,Heartaches By the Numbers,Guy Mitchell,161266,1950-04-07,1950,0.853,0.488,0.661,0.0,0.209,-9.145,0.0392,162.093,0.962,1,7,15,False,deep adult standards
4IHgT5AxBiDAOW6AczsfiG,I Never Will Marry,Anita Carter,210720,1950-04-15,1950,0.81,0.583,0.153,0.0,0.229,-8.14,0.0337,107.257,0.475,1,2,5,False,
061uXiFTP07iAIv8qEpcKD,I'm Not the Man I'm Supposed to Be,Lefty Frizzell,162200,1950,1950,0.886,0.719,0.277,0.0519,0.0746,-11.787,0.0272,98.219,0.576,1,5,4,False,"arkansas country, classic country pop, honky tonk, traditional country, western swing"
64ypIF4aBwOVYwbxctGihM,La nuit,Patachou,156360,1950-07-08,1950,0.994,0.347,0.319,0.64,0.321,-7.899,0.0724,188.932,0.57,0,9,13,False,"vintage chanson, ye ye"
1bqij8t0tGY8aUp0PVRhBt,Feitio de Oração,"Noel Rosa, Francisco Alves, Castro Barbosa",176826,1950,1950,0.994,0.646,0.365,0.817,0.143,-13.969,0.0459,89.331,0.829,1,3,26,False,"bossa nova, mpb, samba, velha guarda"
5uLAvAKYZhFYtEVJTPgNMQ,Três Apitos,"Noel Rosa, Orlando Silva",87400,1950,1950,0.991,0.427,0.126,0.968,0.199,-18.7,0.212,89.11,0.617,0,7,26,False,"bossa nova, mpb, samba, velha guarda"
4LjqEIpHZQ8RL7yqaVQZ4U,"Chopin: Waltz No. 12 in F Minor, Op. Posth. 70 No. 2","Frédéric Chopin, Dinu Lipatti",164042,1950,1950,0.995,0.41,0.094,0.922,0.155,-22.725,0.0501,71.967,0.361,1,8,6,False,"classical, early romantic era, polish classical"
7uniIlsPwAzfsgmk9q9umc,"Piano Concerto No. 1 in E-Flat Major, S. 124: II. Quasi Adagio","Franz Liszt, Arthur Rubinstein, Alfred Wallenstein, RCA Victor Symphony Orchestra",258466,1950,1950,0.973,0.239,0.0271,0.867,0.306,-30.864,0.0426,164.655,0.0625,0,8,12,False,"classical, late romantic era"
235ckTowoxg6LzTUZuFZDt,Long Ago and Far Away,Erroll Garner,157960,1950-09-18,1950,0.991,0.497,0.0633,0.891,0.103,-21.277,0.0322,57.25,0.149,1,5,26,False,"bebop, jazz, jazz piano"
5DwD2z4KpSHkIHZBMDOU0b,Doin' What Comes Natur'lly,Betty Hutton,161840,1950-05-17,1950,0.815,0.675,0.295,0.0,0.0526,-11.308,0.131,170.292,0.707,1,8,11,False,vintage hollywood
6PTuv9rrPXBhr7gjWOHm34,Stuff Like That There,"Betty Hutton, Robert Norberg",179933,1950-01-01,1950,0.398,0.594,0.274,5.75e-05,0.299,-9.738,0.294,159.045,0.697,1,10,17,False,vintage hollywood
3cjUf7hadtqcszSWzhF9Zr,There's No Business Like Show Business - Reprise,Betty Hutton,65133,1950-05-17,1950,0.819,0.387,0.278,0.0,0.0662,-12.558,0.0733,92.558,0.462,1,5,6,False,vintage hollywood
7AZM13BeBrNzGw2lY8khB9,Una Noche de Tantas,José Alfredo Jimenez,150640,1950,1950,0.727,0.341,0.35,0.0,0.11,-12.712,0.0363,87.205,0.7,1,9,9,False,"mariachi, musica mexicana, norteno, ranchera"
5sM6h1Ty9dQUFOEoPvQDtN,Dar Na Muhabbat Kar Le,"Lata Mangeshkar, Shamshad Begum",184555,1950-01-01,1950,0.984,0.52,0.3,0.274,0.23,-13.544,0.0635,79.594,0.947,0,8,6,False,"classic bollywood, filmi, lata"
0eVPczZP7WgKQmsA5CT6XQ,Pictures at an Exhibition: Promenade II,"Modest Mussorgsky, Leonard Bernstein, New York Philharmonic",59053,1950,1950,0.99,0.21,0.0105,0.81,0.0872,-33.202,0.0425,76.119,0.189,1,8,4,False,"classical, early modern classical, late romantic era, russian romanticism"
33gClY5cxPy9LF4nNENMri,Pictures at an Exhibition: Promenade I,"Modest Mussorgsky, Leonard Bernstein, New York Philharmonic",110560,1950,1950,0.974,0.24,0.0785,0.826,0.313,-16.894,0.0324,78.332,0.21,1,5,4,False,"classical, early modern classical, late romantic era, russian romanticism"
78D1AkHL5NRzrAVksF4px4,Cole Capers,Nat King Cole Trio,116106,1950-04-01,1950,0.949,0.575,0.191,0.937,0.153,-17.761,0.0442,136.261,0.747,1,5,7,False,"adult standards, lounge, swing, vocal jazz"
7jXNNXcEuobCmfHDmbsCXD,"Bellini: I Puritani, Act 2: ""O rendetemi la speme"" (Elvira)","Vincenzo Bellini, Maria Callas, Arturo Basile, Orchestra Sinfonica Di Torino Della Rai",71506,1950,1950,0.954,0.154,0.208,0.171,0.273,-19.416,0.0606,166.057,0.23,1,3,31,False,"classical, early romantic era, italian opera, italian romanticism, opera"
0xgulEfXsdV2fyl8i5OF6O,Cherry Pink and Apple Blossom White,Pérez Prado,183842,1950-11-26,1950,0.556,0.506,0.417,0.816,0.0986,-10.14,0.043,118.424,0.726,1,3,28,False,"mambo, musica tradicional cubana, space age pop"
3F3iXm7fvEHWfITcUW5CV3,"Mahler: Kindertotenlieder: No. 5, In diesem Wetter, in diesem Braus","Gustav Mahler, Kathleen Ferrier, Wiener Philharmoniker, Bruno Walter",390106,1950-01-01,1950,0.964,0.239,0.127,0.00519,0.104,-19.889,0.0411,106.802,0.0516,1,2,9,False,"classical, post-romantic era"
56rfIdnHAMa8hngNZcIVzH,"Piano Concerto No. 1 in E-Flat Major, S. 124: IV. Allegro marziale animato","Franz Liszt, Arthur Rubinstein, Alfred Wallenstein, RCA Victor Symphony Orchestra",243600,1950,1950,0.945,0.371,0.235,0.355,0.282,-17.796,0.0314,79.799,0.338,1,8,9,False,"classical, late romantic era"
2AAZOmuTpxcgSfu8vehtSg,"Blue Yodel, No. 6",Lefty Frizzell,194466,1950,1950,0.691,0.742,0.353,0.000241,0.155,-8.064,0.0322,121.285,0.649,1,7,5,False,"arkansas country, classic country pop, honky tonk, traditional country, western swing"
7e4uIiQTVInfCEhylmcRpU,Tarzan,"Noel Rosa, Almirante",168720,1950-06-01,1950,0.994,0.704,0.332,0.908,0.172,-12.257,0.0827,78.974,0.858,1,1,21,False,"bossa nova, mpb, samba, velha guarda"
6qNyJxiapLKuJpdP9fnkZc,Pictures at an Exhibition: II. Il vecchio castello,"Modest Mussorgsky, Leonard Bernstein, New York Philharmonic",243640,1950,1950,0.976,0.0943,0.0274,0.895,0.105,-30.956,0.0378,162.977,0.0517,1,8,3,False,"classical, early modern classical, late romantic era, russian romanticism"
1p8J3GP9QqMpJRxnyjzVgQ,Pictures at an Exhibition: V. Ballet of the Unhatched Chicks,"Modest Mussorgsky, Leonard Bernstein, New York Philharmonic",73093,1950,1950,0.958,0.475,0.195,0.978,0.0636,-23.079,0.0794,176.519,0.754,1,1,3,False,"classical, early modern classical, late romantic era, russian romanticism"
33ijyZiIaPC8q9E88KUjhO,Pictures at an Exhibition: VIIIb. Con mortuis in lingua mortua,"Modest Mussorgsky, Leonard Bernstein, New York Philharmonic",197226,1950,1950,0.807,0.256,0.245,0.649,0.659,-18.581,0.044,177.942,0.231,1,7,3,False,"classical, early modern classical, late romantic era, russian romanticism"
6cRqdsj06C9O3Dsq9Hx4H8,Pictures at an Exhibition: Promenade III,"Modest Mussorgsky, Leonard Bernstein, New York Philharmonic",37133,1950,1950,0.958,0.343,0.086,0.954,0.103,-20.495,0.0344,75.407,0.321,1,1,3,False,"classical, early modern classical, late romantic era, russian romanticism"
0538mNDAUv3bGzK4OMpJDH,Pictures at an Exhibition: VIIIa. Catacombæ (Sepulcrum romanum),"Modest Mussorgsky, Leonard Bernstein, New York Philharmonic",362800,1950,1950,0.876,0.216,0.198,0.778,0.358,-13.97,0.0349,135.781,0.133,1,3,3,False,"classical, early modern classical, late romantic era, russian romanticism"
5w04WrOeSTdMdxKDKbr70x,Pictures at an Exhibition: I. Gnomus,"Modest Mussorgsky, Leonard Bernstein, New York Philharmonic",168920,1950,1950,0.95,0.244,0.152,0.761,0.208,-17.649,0.04,85.341,0.066,0,8,3,False,"classical, early modern classical, late romantic era, russian romanticism"
5MdCW0oBtK42fg2Zztp7zb,Pictures at an Exhibition: IV. Bydlo,"Modest Mussorgsky, Leonard Bernstein, New York Philharmonic",145440,1950,1950,0.953,0.192,0.0336,0.956,0.112,-19.376,0.0328,106.651,0.138,0,1,3,False,"classical, early modern classical, late romantic era, russian romanticism"
3VVMhFxCy67GPwOxc96XMT,I Wake Up In The Morning Feeling Fine,"Betty Hutton, Robert Norberg",166146,1950-01-01,1950,0.869,0.641,0.216,0.0,0.738,-8.477,0.172,148.692,0.687,1,1,15,False,vintage hollywood
5U6Q3hqtPUdWwog5Ht8esX,"I'll Walk With God (from ""The Student Prince"")","Nicholas Brodszky, Mario Lanza, Constantine Callinicos",174666,1950,1950,0.935,0.153,0.423,0.000722,0.157,-7.437,0.033,80.056,0.123,1,10,7,False,
5Wv0Jh7oRP5wpYSKshJHa8,Só Pode Ser Você,"Noel Rosa, Aracy de Almeida",190066,1950,1950,0.996,0.483,0.216,0.903,0.264,-17.356,0.056,128.892,0.67,1,6,26,False,"bossa nova, mpb, samba, velha guarda"
3xeON8YuVrtw8VDunZ3uqE,Roses Of Picardy,George Shearing,177146,1950-01-01,1950,0.989,0.648,0.045,0.896,0.115,-24.043,0.0468,116.102,0.536,0,6,19,False,"cool jazz, jazz piano"
39BBmCv6KurOvpfCdm2PTa,Caballo Negro,Pérez Prado,138800,1950-11-26,1950,0.88,0.515,0.797,0.672,0.118,-12.876,0.0576,138.633,0.659,0,11,8,False,"mambo, musica tradicional cubana, space age pop"
65INLegxubfWrHf0tpTnKS,Sarabande No 2,Francis Poulenc,228840,1950-01-01,1950,0.994,0.663,0.0285,0.932,0.107,-14.072,0.207,127.062,0.0978,0,3,4,False,"classical, early modern classical, neoclassicism"
2JR4xv4473QgAK5wgRPb6u,Mom and Dad's Waltz,Lefty Frizzell,185293,1950,1950,0.74,0.605,0.259,0.000136,0.0734,-10.788,0.0297,95.637,0.562,1,0,21,False,"arkansas country, classic country pop, honky tonk, traditional country, western swing"
0n5LTbmEEq2w4Mp1tCvsKW,There's No Business Like Show Business - Alternate Version,"Judy Garland, Howard Keel, Frank Morgan, Keenan Wynn, Bill Seclar, Mac McLain",142866,1950-05-17,1950,0.93,0.529,0.395,0.0,0.223,-10.416,0.0687,68.572,0.685,1,10,3,False,"adult standards, torch song, vocal jazz"
1gjTBbfqYck4vytfUowjGq,A Night in Tunisia,Charlie Parker,179446,1950-05-25,1950,0.956,0.422,0.399,0.883,0.113,-14.204,0.0465,177.422,0.657,0,7,5,False,"bebop, contemporary post-bop, cool jazz, jazz, jazz saxophone, vocal jazz"
5DIVWgTeJ2fPIxaY9e7ZKn,I've Got A Crush On You,Ella Fitzgerald,196440,1950-09-11,1950,0.986,0.455,0.106,0.0,0.122,-14.086,0.0422,66.807,0.258,1,2,56,False,"adult standards, jazz, jazz blues, soul, swing, vocal jazz"
0hULMf7oqrHYIFh3fh4nFa,Opm Medley: When I Met You,"Zsa Zsa Padilla, Freestyle, Lani Misalucha",557986,1950-01-01,1950,0.434,0.403,0.486,0.0,0.979,-10.941,0.0486,86.924,0.302,1,10,43,False,"classic opm, opm"
5RcvlmVx2xtFcp2Ta5pw7X,Someone To Watch Over Me,Ella Fitzgerald,196666,1950-09-11,1950,0.99,0.354,0.0851,4.49e-06,0.123,-13.738,0.0345,97.684,0.197,1,7,51,False,"adult standards, jazz, jazz blues, soul, swing, vocal jazz"
12pe2mL5SQGMI1gBGcEWKE,Night on Bald Mountain,"Modest Mussorgsky, Leonard Bernstein, New York Philharmonic",659560,1950,1950,0.854,0.316,0.308,0.888,0.585,-15.944,0.0411,103.459,0.095,1,2,30,False,"classical, early modern classical, late romantic era, russian romanticism"
7LQhQy14kruDULvKmiL5LM,All My Love,Patti Page,194480,1950-09-01,1950,0.884,0.673,0.189,0.0,0.126,-14.072,0.0458,124.978,0.666,1,8,26,False,"adult standards, easy listening"
4YH4zCNzVQuZjhcWSwuiCR,On The Sunny Side Of The Street,Teddy Wilson,257693,1950,1950,0.94,0.699,0.146,0.479,0.181,-18.029,0.0407,127.576,0.638,1,3,19,False,"jazz piano, stride"
4rmhQyN7hMYrc5ER8Sebe5,"The Oldest Established (from ""Guys & Dolls"")","Same Levene, Stubby Kaye, Johnny Silver",156613,1950,1950,0.849,0.638,0.262,5.73e-06,0.333,-20.468,0.186,130.207,0.543,1,7,11,False,
5t9CciqUi6H3kFTyFs7L0r,Once In Love With Amy,Dean Martin,133893,1950,1950,0.982,0.467,0.15,0.000863,0.139,-14.612,0.0428,117.585,0.541,1,3,11,False,"adult standards, easy listening, lounge, vocal jazz"
5LZJHpQn8QJ1qwidGTaLat,East Of The Sun (And West Of The Moon),George Shearing,185653,1950-01-01,1950,0.984,0.48,0.0845,0.869,0.116,-22.891,0.0376,133.518,0.543,0,4,21,False,"cool jazz, jazz piano"
0s6xQ1bwaRdk3ny0XUxETc,My One And Only,Ella Fitzgerald,196960,1950-09-11,1950,0.984,0.635,0.0984,0.0,0.0971,-12.335,0.0509,117.812,0.462,0,10,23,False,"adult standards, jazz, jazz blues, soul, swing, vocal jazz"
5rJPcj8vu1wBZbKym4m57q,It Only Hurts for a Little While,The Ames Brothers,162173,1950-11-26,1950,0.967,0.328,0.237,0.0104,0.199,-11.528,0.0303,85.059,0.226,1,9,21,False,"easy listening, vocal harmony group"
3EhXkO5ITpreU8oI1gw6IS,Outside Dan Murphy's Door,Harry McClintock,121746,1950-01-01,1950,0.891,0.533,0.0971,0.0,0.245,-16.918,0.133,176.823,0.619,1,7,8,False,traditional folk
7jXNNXcEuobCmfHDmbsCXD,"Bellini: I Puritani, Act 2: ""O rendetemi la speme"" (Elvira)","Vincenzo Bellini, Maria Callas, Arturo Basile, Orchestra Sinfonica Di Torino Della Rai",71506,1950,1950,0.954,0.154,0.208,0.171,0.273,-19.416,0.0606,166.057,0.23,1,3,31,False,"classical, early romantic era, italian opera, italian romanticism, opera"
47prN3im9kvkhvOM8AfDpd,Oh!,Pee Wee Hunt,161093,1950-03-01,1950,0.587,0.814,0.125,0.000427,0.0373,-12.303,0.206,124.634,0.831,1,10,12,False,jazz trombone
0HEU3berJ5OBojU8XmEk1c,How Long Has This Been Going On?,Ella Fitzgerald,197666,1950-09-11,1950,0.974,0.303,0.175,1.32e-06,0.105,-14.203,0.0378,168.743,0.25,0,1,32,False,"adult standards, jazz, jazz blues, soul, swing, vocal jazz"
