id,name,artists,duration_ms,release_date,year,acousticness,danceability,energy,instrumentalness,liveness,loudness,speechiness,tempo,valence,mode,key,popularity,explicit,genre
2mGptyQXBkLRfnOHDucFmF,I've Got Plenty To Be Thankful For,Bing Crosby,177546,1942-01-01,1942,0.849,0.611,0.195,0.0117,0.506,-14.923,0.103,153.734,0.827,0,10,32,False,"adult standards, easy listening, lounge, swing"
1UVETAQbq7tKLdfrSjeWST,I'll Never Smile Again,The Pied Pipers,189252,1942-12-09,1942,0.962,0.457,0.0692,0.543,0.232,-17.764,0.0292,69.268,0.072,1,0,31,False,vocal harmony group
5fxcFfC3AhvNThc1ImR53I,Avalon,"Arthur Briggs, Stéphane Grappelli, Django Reinhardt, Quintette du Hot Club de France",170877,1942-01-01,1942,0.908,0.833,0.238,0.811,0.114,-15.953,0.126,138.425,0.872,1,5,13,False,
6d7HdOZVrflcNvKorLDlwk,Abraham,"Bing Crosby, Ken Darby Singers, John Scott Trotter & His Orchestra",165000,1942-01-01,1942,0.706,0.493,0.223,0.531,0.632,-12.053,0.062,168.426,0.766,0,5,11,False,"adult standards, easy listening, lounge, swing"
4F6FDCjqiJMXIPkKViujK6,"Étude in D-sharp minor, Op. 8, No. 12","Alexander Scriabin, Vladimir Horowitz",127080,1942,1942,0.967,0.251,0.304,0.896,0.105,-16.228,0.0352,166.953,0.439,0,1,29,False,"classical, contemporary classical, early modern classical, impressionism, late romantic era, russian romanticism"
3dxDIeMuYGopSAtyEpaKX2,I'll Capture Your Heart,"Bing Crosby, Fred Astaire, Bob Crosby & His Orchestra",143453,1942-01-01,1942,0.748,0.586,0.291,0.00638,0.921,-13.291,0.257,100.689,0.582,1,10,13,False,"adult standards, easy listening, lounge, swing"
2uyauwbFWLFylysg2ypqLf,Amurado,Osvaldo Pugliese,162333,1942-02-25,1942,0.912,0.563,0.177,0.0373,0.124,-8.886,0.0541,120.753,0.46,1,7,10,False,"latin classical, tango"
6dqDPqUGonBNzIV4c9kYSd,I Can't Tell A Lie,"Fred Astaire, Bob Crosby & His Orchestra",160813,1942-01-01,1942,0.885,0.586,0.196,0.327,0.679,-14.188,0.148,79.758,0.677,0,3,9,False,"adult standards, vintage hollywood"
2tDKWngdaCDdXtj1BgRa6n,I Saw Stars,"Stéphane Grappelli, Django Reinhardt, Quintette du Hot Club de France",149370,1942-01-01,1942,0.866,0.843,0.143,0.815,0.255,-20.629,0.153,107.66,0.638,1,7,33,False,"french jazz, gypsy jazz, jazz violin"
7brVTWz2tm6zVqK3EotOc5,愛似浮雲,白光,162666,1942-05-01,1942,0.991,0.367,0.27,0.000756,0.252,-11.517,0.0643,106.004,0.453,0,4,14,False,"c-pop, vintage chinese pop"
0uhPEfy7doR7jxrQXfgLfk,Do I Love You,"Helen Forrest, Artie Shaw",181813,1942-04-29,1942,0.975,0.588,0.265,0.0578,0.34,-7.948,0.0286,72.495,0.504,1,8,11,False,torch song
2jydNK60967Ojvz2Ju299U,"Aai Basant Ritu Madhumati (From ""Jawani"")","Husn Banu, Surendra",180533,1942-01-01,1942,0.995,0.448,0.199,0.904,0.104,-15.143,0.0939,131.174,0.529,0,7,4,False,
1Yj4a0dMBiK1pEqZa9tE9a,"Arabeske in C Major, Op. 18","Robert Schumann, Vladimir Horowitz",427466,1942,1942,0.995,0.228,0.0187,0.844,0.176,-26.977,0.0374,94.527,0.135,1,0,3,False,"early romantic era, german romanticism"
0aDkcjKTTsYnTiBWmOUYJA,Aari Aaja Nindiya,"Kishore Kumar, Lata Mangeshkar, Mehmood",405890,1942-12-01,1942,0.976,0.276,0.27,0.835,0.371,-15.023,0.0372,130.527,0.316,1,9,5,False,"classic bollywood, filmi"
6VNJ32MJF5DAKPzileg5am,Aria - Cantilena from Bachiana brasileira No. 5,"Heitor Villa-Lobos, Bidu Sayão, Leonard Rose",421106,1942,1942,0.934,0.222,0.184,0.155,0.135,-16.512,0.0382,111.987,0.0931,0,2,8,False,"brazilian classical, classical, early modern classical, latin classical, neoclassicism"
0dFfiBFNd10yWiQ8vGrff8,Smoke Rings,"Stéphane Grappelli, Django Reinhardt, Quintette du Hot Club de France",170960,1942-01-01,1942,0.939,0.454,0.0881,0.921,0.187,-21.934,0.0387,104.51,0.542,1,2,29,False,"french jazz, gypsy jazz, jazz violin"
0G4T7Tho9Lr65nlEk7OtFm,Tiger Rag,"Stéphane Grappelli, Django Reinhardt, Quintette du Hot Club de France",153425,1942-01-01,1942,0.827,0.618,0.249,0.76,0.196,-18.132,0.441,147.969,0.836,1,8,29,False,"french jazz, gypsy jazz, jazz violin"
3iHPLypNjYHmVHm65Yq1WY,"It's Been a Long, Long Time",Helen Forrest,187570,1942-04-29,1942,0.8,0.376,0.266,0.00853,0.151,-8.151,0.0295,72.966,0.327,1,0,9,False,torch song
1R9eghNr3OjUET9XNqNsW9,"Let's Start The New Year Right - From ""Holiday Inn"" Soundtrack","Bing Crosby, Bob Crosby & His Orchestra",153946,1942-01-01,1942,0.666,0.36,0.15,0.952,0.207,-14.651,0.0321,66.255,0.452,1,10,29,False,"adult standards, easy listening, lounge, swing"
0mbJ17SU7NN2hWjRfYvOTL,Djangology,"Stéphane Grappelli, Django Reinhardt, Quintette du Hot Club de France",173770,1942-01-01,1942,0.924,0.602,0.151,0.696,0.328,-20.031,0.179,175.839,0.612,1,7,28,False,"french jazz, gypsy jazz, jazz violin"
31n9izao0F4nSKThcNfXTC,"Happy Holiday - From ""Holiday Inn"" Soundtrack","Bing Crosby, The Music Maids & Hal, John Scott Trotter & His Orchestra",145786,1942-01-01,1942,0.807,0.649,0.295,0.131,0.22,-13.642,0.0583,94.81,0.776,1,10,26,False,"adult standards, easy listening, lounge, swing"
5rqh9ExnLuViEBTbhcLIG3,I'm Confessin' (That I Love You),"Stéphane Grappelli, Django Reinhardt, Quintette du Hot Club de France",173314,1942-01-01,1942,0.528,0.761,0.17,0.251,0.0885,-19.887,0.166,112.687,0.642,1,2,25,False,"french jazz, gypsy jazz, jazz violin"
5iZMoYx762iNo2aczQhVze,Ya Mesafer Wahdak,Mohammed Abdel Wahab,717780,1942-01-01,1942,0.941,0.495,0.159,0.000791,0.508,-17.629,0.429,87.698,0.732,0,0,21,False,"arab folk, belly dance, classic arab pop"
0JYPgcIy1DJfiEskGcKDUe,El Abrojito,"Osvaldo Pugliese, Alberto Morán",200173,1942-02-25,1942,0.938,0.531,0.321,0.00034,0.171,-6.139,0.0432,118.641,0.559,1,0,16,False,"latin classical, tango"
1645qTeUjJ85uGFkdka7fI,Some of these Days,"Stéphane Grappelli, Django Reinhardt, Quintette du Hot Club de France",142494,1942-01-01,1942,0.92,0.622,0.161,0.109,0.178,-17.702,0.396,170.681,0.699,0,4,25,False,"french jazz, gypsy jazz, jazz violin"
4a5UVI9gvDpK1s6dcHPI3w,Tumhin Meri Mandir,Lata Mangeshkar,349297,1942-12-01,1942,0.989,0.495,0.404,0.0363,0.373,-6.404,0.0409,123.598,0.533,0,4,32,False,"classic bollywood, filmi, lata"
0WZGFA39yR2y148H05bHgC,You're Easy To Dance With,"Fred Astaire, Bob Crosby & His Orchestra",168000,1942-01-01,1942,0.755,0.507,0.219,0.162,0.858,-13.62,0.0644,178.512,0.804,1,0,21,False,"adult standards, vintage hollywood"
2Wkqdl5MrUZEQfzUsRKbZ2,El Arranque,Osvaldo Pugliese,184693,1942-02-25,1942,0.937,0.643,0.224,0.453,0.122,-7.727,0.0458,120.597,0.43,1,4,9,False,"latin classical, tango"
7azjiChoevBf6XIaoIKin4,"Piano Sonata No. 11 in A Major, K. 331: III. Rondo alla turca","Wolfgang Amadeus Mozart, Vladimir Horowitz",220560,1942,1942,0.993,0.504,0.129,0.896,0.127,-20.853,0.0539,122.597,0.576,1,9,8,False,"classical, classical era"
1Ny1Upi3WktLuAGRCGWZmb,"Be Careful, It's My Heart","Bing Crosby, John Scott Trotter & His Orchestra",162280,1942-01-01,1942,0.617,0.384,0.216,0.0397,0.284,-14.712,0.0393,129.518,0.378,1,2,20,False,"adult standards, easy listening, lounge, swing"
247xvjDKL9FyboglUBrx7L,我要你的愛,葛蘭,164373,1942,1942,0.748,0.796,0.486,0.0,0.13,-9.48,0.0385,90.824,0.914,1,3,24,False,vintage chinese pop
5BsMpz8CUIJiXFegUIImdU,"Polonaise in A-Flat Major, Op. 53 ""Heroic""","Frédéric Chopin, Vladimir Horowitz",356880,1942,1942,0.991,0.264,0.291,0.909,0.0985,-16.078,0.0332,86.866,0.471,1,8,8,False,"classical, early romantic era, polish classical"
2dX8FXsHFNBk45eQyBKXmX,"Goldberg Variations, BWV 988: Variation XXX - Quodlibet","Johann Sebastian Bach, Claudio Arrau",100853,1942,1942,0.996,0.593,0.247,0.927,0.143,-18.542,0.0851,78.457,0.882,1,7,7,False,"baroque, classical, early music, german baroque"
06hcCZNnx80lia0CMg9ClS,Deep in a Dream,"Helen Forrest, Artie Shaw",199960,1942-04-29,1942,0.947,0.676,0.325,0.0063,0.157,-8.163,0.0467,113.81,0.563,1,3,2,False,torch song
4bI2cy6httfY5nXnL0aVJQ,Scherzo a capriccio: Presto,"Felix Mendelssohn, Vladimir Horowitz",352986,1942,1942,0.995,0.441,0.109,0.916,0.0917,-20.183,0.0523,127.303,0.314,0,6,4,False,"classical, early romantic era, german romanticism"
6MoPknoEDBw400HmX40f0a,Lazy,Bing Crosby,148813,1942-01-01,1942,0.816,0.699,0.146,0.0296,0.303,-14.876,0.0422,113.262,0.57,1,10,16,False,"adult standards, easy listening, lounge, swing"
3MIi9UeKZYWybc0C2Q0JNB,"Variations on a Theme from ""Carmen""",Vladimir Horowitz,213213,1942,1942,0.992,0.384,0.246,0.865,0.127,-19.823,0.0319,144.701,0.443,1,4,9,False,"classical, classical piano, russian classical piano"
4oP9eTDpN6CbIE6ANumMWo,The Stars and Stripes Forever,"John Philip Sousa, Vladimir Horowitz",230453,1942,1942,0.993,0.536,0.242,0.879,0.218,-17.258,0.0375,112.672,0.511,1,8,6,False,"american romanticism, concert band"
68O406JXvOubdBIkUhhaiz,Esta Noche de Luna,"Osvaldo Pugliese, Orquesta de Osvaldo Pugliese, Jorge Maciel",224000,1942-02-25,1942,0.976,0.45,0.414,1.2e-06,0.282,-6.112,0.0353,113.471,0.311,1,10,28,False,"latin classical, tango"
521xvXNh0pQWnEfDxz4w6L,Easter Parade,Bing Crosby,131826,1942-01-01,1942,0.906,0.378,0.145,0.0,0.124,-16.25,0.0467,89.806,0.367,1,5,15,False,"adult standards, easy listening, lounge, swing"
1LeQMGzGUGNogLv6mlRZ9u,Sin Palabras,"Osvaldo Pugliese, Alberto Morán",186626,1942-02-25,1942,0.963,0.438,0.417,0.00107,0.0788,-5.956,0.0427,119.651,0.348,0,2,14,False,"latin classical, tango"
6nLpK1RwKTOoKpUPPhiK2A,Balash Tebosny,Mohammed Abdel Wahab,589101,1942-01-01,1942,0.975,0.504,0.161,0.0144,0.115,-16.281,0.236,141.277,0.806,0,4,14,False,"arab folk, belly dance, classic arab pop"
7xzGOYAzPTIOylSVEguAkJ,Amigazo,"Osvaldo Pugliese, Alfredo Belusi",222493,1942-02-25,1942,0.877,0.363,0.343,0.0,0.142,-8.217,0.0496,89.565,0.459,1,9,4,False,"latin classical, tango"
6vW3WZnPB3eylrwaCYlcj2,Ahora No Me Conocés,"Osvaldo Pugliese, Alberto Morán",147053,1942-02-25,1942,0.957,0.492,0.303,0.0,0.14,-8.296,0.0479,116.565,0.476,0,5,11,False,"latin classical, tango"
0vv5EY0Rx4DNR8r3s5x1Hm,La Tupungatina,Osvaldo Pugliese,241213,1942-02-25,1942,0.837,0.563,0.261,0.13,0.163,-12.612,0.0375,119.976,0.547,1,11,22,False,"latin classical, tango"
6o0SCSVfkbllhGvAVy5ccj,A String of Pearls,Benny Goodman,177733,1942-01-16,1942,0.875,0.511,0.487,0.939,0.22,-11.715,0.0547,180.633,0.717,1,0,0,False,"adult standards, big band, dixieland, jazz, jazz clarinet, swing, vintage jazz, vocal jazz"
0CCHyHsOEq0cAANJNKUBSy,Aa Dance Karen Thora Romance Karen,"Asha Bhosle, Mohammed Rafi",170004,1942-12-01,1942,0.892,0.762,0.684,0.000134,0.625,-6.297,0.061,103.514,0.96,1,4,1,False,"chutney, classic bollywood, filmi"
243h9znlZh2HtvJujXogBR,Neel Gagan Par Udte Badal,"Asha Bhosle, Mohammed Rafi",242860,1942-12-01,1942,0.934,0.362,0.622,0.000589,0.121,-7.239,0.056,170.849,0.787,0,10,4,False,"chutney, classic bollywood, filmi"
6hQjBcumeTv0Og1chvmvX8,"Étude in C-Sharp Minor, Op. 2, No. 1","Alexander Scriabin, Vladimir Horowitz",184240,1942,1942,0.995,0.445,0.0403,0.908,0.146,-25.343,0.0389,116.474,0.118,0,1,5,False,"classical, contemporary classical, early modern classical, impressionism, late romantic era, russian romanticism"
3BhBhtvItxP3SGaAyKn01S,"Day In, Day Out","Helen Forrest, Artie Shaw",216533,1942-04-29,1942,0.99,0.519,0.273,0.638,0.395,-10.032,0.0346,141.868,0.415,1,1,2,False,torch song
1WhgC1N0WBVaZE5CJ98XMg,Machine languagE+,"Zaram, AYODROOP",140583,1942-12-30,1942,0.551,0.767,0.567,0.000167,0.127,-7.937,0.177,89.946,0.707,0,6,3,False,
7omqkLq8mS2rPYNKkGGcN7,Children's Corner Suite: Serenade of the Doll,"Claude Debussy, Vladimir Horowitz",173053,1942,1942,0.996,0.531,0.0132,0.945,0.074,-28.959,0.0471,83.881,0.174,0,8,5,False,"classical, impressionism, post-romantic era"
2si3lFSF2wnIqNF4r8f4tn,"Prélude in D-Flat Major, Op. 28, No. 15 ""Raindrop""","Frédéric Chopin, Vladimir Horowitz",310133,1942,1942,0.994,0.347,0.0317,0.887,0.0754,-22.936,0.0514,77.711,0.129,1,1,7,False,"classical, early romantic era, polish classical"
28o75LD1BltloxpnvGkrsx,Mal de Amores,Osvaldo Pugliese,164453,1942-02-25,1942,0.97,0.683,0.21,0.862,0.1,-7.345,0.0634,122.001,0.448,0,9,8,False,"latin classical, tango"
2hX032fqGc8KzdunDjsz3G,A la Luz de un Candil,"Osvaldo Pugliese, Orquesta de Osvaldo Pugliese, Miguel Montero",183200,1942-02-25,1942,0.86,0.553,0.377,4.18e-06,0.479,-8.218,0.0887,111.174,0.428,0,4,1,False,"latin classical, tango"
5oPvZJUWSn7o5p4L1BMrBb,Adiós Bardi,Osvaldo Pugliese,165693,1942-02-25,1942,0.984,0.544,0.293,0.863,0.0905,-4.629,0.0391,121.814,0.477,1,9,2,False,"latin classical, tango"
0vWNROdi40KveanNS5C7Cc,Andá Que Te Cure Lola,"Osvaldo Pugliese, Roberto Chanel",133280,1942-02-25,1942,0.938,0.548,0.417,0.196,0.107,-6.059,0.0869,101.189,0.717,1,9,3,False,"latin classical, tango"
5OmHEO46I13khn9Kf1g4Hu,Amando en Silencio - Remasterizado,"Francisco Canaro, Eduardo Adrian",182986,1942-03-08,1942,0.975,0.528,0.288,0.0113,0.0972,-12.759,0.0726,124.472,0.461,1,5,0,False,"orquesta tipica, tango, vintage tango"
1KAvsGr9CWQgO5786taGCP,Apasionadamente - Remasterizado,"Francisco Canaro, Ernesto Fama",176000,1942-03-08,1942,0.993,0.658,0.273,0.415,0.12,-10.822,0.108,137.932,0.927,0,8,0,False,"orquesta tipica, tango, vintage tango"
4oiJvd28VX8w8yeHEe002C,Anema e core,Claudio Villa,189257,1942-11-13,1942,0.992,0.245,0.172,0.0125,0.113,-13.902,0.0416,166.466,0.205,1,10,1,False,classic italian pop
279thyXRO3NaXpk6QN2Ma9,Angelitos Negros,Lola Flores,155640,1942-07-07,1942,0.0431,0.544,0.283,0.0,0.369,-12.995,0.0364,120.277,0.361,0,7,8,False,copla
3EyviwqmjwzkWuVk0Tec98,A Tu Vera,Lola Flores,207973,1942-07-07,1942,0.971,0.492,0.296,0.000595,0.278,-12.548,0.0406,117.156,0.613,1,7,12,False,copla
0RONEsJbTDiUXgfPFu7D6U,Ayye Met Tha,M.M.Dandapani Desikar,193213,1942-12-31,1942,0.993,0.539,0.311,0.682,0.299,-14.291,0.0791,145.567,0.679,1,6,0,False,
3Hug8v6MgJdQMOP2ZXsUna,A Surprise Visit,Charlie Chaplin,334451,1942,1942,0.974,0.318,0.263,0.664,0.552,-11.608,0.0431,108.743,0.204,1,2,1,False,classic soundtrack
09Pk2OFYpv2cimLJRdJw3K,El Sueño del Pibe,"Osvaldo Pugliese, Roberto Chanel",175680,1942-02-25,1942,0.917,0.56,0.245,0.000101,0.0928,-6.722,0.0527,118.318,0.693,0,10,27,False,"latin classical, tango"
5qKEVzAwFMDw1nwdLAUeah,"Etude in A-Flat, Op. 72, No. 11","Moritz Moszkowski, Vladimir Horowitz",81173,1942,1942,0.993,0.414,0.16,0.955,0.27,-21.197,0.0373,75.403,0.691,1,8,5,False,"german romanticism, late romantic era, polish classical"
52TXHeE4bKDHlySYU7xb15,"Sonata No. 14 in C-Sharp Minor for Piano, Op. 27, No. 2 ""Moonlight"": I. Adagio sostenuto","Ludwig van Beethoven, Vladimir Horowitz",354120,1942,1942,0.995,0.292,0.0203,0.898,0.121,-31.873,0.0367,73.41,0.155,0,1,5,False,"classical, classical era, early romantic era, german romanticism"
5A91N8OxPL3yxwdWATwP7n,"Ballade No. 1 in G Minor, Op. 23","Frédéric Chopin, Vladimir Horowitz",547866,1942,1942,0.987,0.35,0.16,0.912,0.356,-20.551,0.0402,105.333,0.0419,0,7,6,False,"classical, early romantic era, polish classical"
7IeGB5T4QI7oDZY5AGcGcd,"Träumerei from Kinderszenen, Op. 15","Robert Schumann, Vladimir Horowitz",168800,1942,1942,0.996,0.373,0.0148,0.959,0.0938,-28.532,0.0615,72.42,0.33,1,5,11,False,"early romantic era, german romanticism"
58UUyDTPGYj7GFGnt81YHD,Song Of Freedom,"Bing Crosby, John Scott Trotter & His Orchestra, Ken Darby Singers",142066,1942-01-01,1942,0.854,0.546,0.262,0.00178,0.224,-13.835,0.0632,170.601,0.858,1,10,12,False,"adult standards, easy listening, lounge, swing"
1NubF72uRkX0OFeIo6FIvf,Clouds,"Stéphane Grappelli, Django Reinhardt, Quintette du Hot Club de France",194888,1942-01-01,1942,0.867,0.617,0.263,0.853,0.146,-20.284,0.0772,126.036,0.689,1,5,10,False,"french jazz, gypsy jazz, jazz violin"
4nKQaQrF2TWdVbKL4q5fuo,"Concerto No. 5 in E-Flat Major for Piano and Orchestra, Op. 73 ""Emperor"": I. Allegro - 2017 Remastered Version","Ludwig van Beethoven, Rudolf Serkin, Bruno Walter, New York Philharmonic",1151400,1942,1942,0.986,0.329,0.197,0.912,0.125,-15.216,0.0359,135.205,0.113,1,3,4,False,"classical, classical era, early romantic era, german romanticism"
1i4B06ofP2iQavOvzJl9Np,"Sonata No. 8 in C Minor for Piano, Op. 13 ""Pathétique"": II. Adagio cantabile","Ludwig van Beethoven, Vladimir Horowitz",326760,1942,1942,0.995,0.254,0.00581,0.893,0.127,-36.109,0.0372,64.945,0.267,1,8,5,False,"classical, classical era, early romantic era, german romanticism"
5VjJ08LxGgoehXpddCRAIw,秋夜,白光,178840,1942-05-01,1942,0.984,0.247,0.449,8.77e-05,0.0855,-10.312,0.0411,83.304,0.586,1,1,2,False,"c-pop, vintage chinese pop"
4arSsuzOaCBL0w5LanQMiL,相見不恨晚,白光,190133,1942-05-01,1942,0.992,0.394,0.188,1.84e-05,0.0699,-12.308,0.031,87.14,0.359,1,0,1,False,"c-pop, vintage chinese pop"
7DYJemcdNqmMfhzWgrc3ih,"Mazurka in B Minor, Op. 33, No. 4","Frédéric Chopin, Vladimir Horowitz",269146,1942,1942,0.994,0.247,0.0211,0.901,0.8,-22.814,0.0388,74.269,0.114,0,11,4,False,"classical, early romantic era, polish classical"
7b3JzwJUsCH5y5a5e5yYu0,Blue Drag,"Stéphane Grappelli, Django Reinhardt, Quintette du Hot Club de France",171637,1942-01-01,1942,0.883,0.789,0.169,0.646,0.103,-15.693,0.0667,113.951,0.52,0,2,7,False,"french jazz, gypsy jazz, jazz violin"
6i035WnveP4Oqc769rFWP5,"Von fremden Ländern und Menschen (From ""Kinderszenen"", Op. 15)","Robert Schumann, Vladimir Horowitz",90866,1942,1942,0.996,0.431,0.00632,0.912,0.0701,-34.215,0.0511,69.265,0.374,1,7,5,False,"early romantic era, german romanticism"
3G6NyHughCiu3XMDC72EsD,Frente a una Copa,"Osvaldo Pugliese, Alberto Morán",191333,1942-02-25,1942,0.954,0.483,0.336,6.22e-06,0.245,-7.305,0.0413,117.489,0.357,0,5,6,False,"latin classical, tango"
5auvwFGPeYprBc2OBd6bSM,Manos Adoradas,"Osvaldo Pugliese, Alberto Morán",139520,1942-02-25,1942,0.811,0.451,0.721,0.0,0.367,-4.722,0.0915,70.323,0.869,0,0,3,False,"latin classical, tango"
3qzzk1E8zXLDuDDEdrDAsk,Hoy al Recordarla,"Osvaldo Pugliese, Alberto Morán",196600,1942-02-25,1942,0.954,0.492,0.417,0.0263,0.336,-5.853,0.0418,118.179,0.566,0,2,4,False,"latin classical, tango"
6aypsbO4SF1wNQgbRWePh9,Ton doux sourire,"Stéphane Grappelli, Django Reinhardt, Quintette du Hot Club de France",172111,1942-01-01,1942,0.944,0.607,0.152,0.364,0.139,-18.809,0.0567,112.946,0.58,1,7,5,False,"french jazz, gypsy jazz, jazz violin"
5AXNhsR6OfsruKSpfPMlg5,Ultrafox,"Stéphane Grappelli, Django Reinhardt, Quintette du Hot Club de France",198981,1942-01-01,1942,0.941,0.583,0.197,0.792,0.139,-16.979,0.167,176.275,0.739,1,5,4,False,"french jazz, gypsy jazz, jazz violin"
6BRZu1mudjVmbLSSBTGZCL,"Believe It, Beloved","Stéphane Grappelli, Django Reinhardt, Quintette du Hot Club de France",191829,1942-01-01,1942,0.908,0.564,0.251,0.739,0.101,-16.239,0.347,208.202,0.727,1,7,4,False,"french jazz, gypsy jazz, jazz violin"
4Zwt04D6mzQ9B91PqJ50ZD,White Christmas,Bing Crosby,177480,1942-01-01,1942,0.673,0.29,0.159,0.355,0.338,-16.486,0.0363,100.32,0.252,1,9,5,False,"adult standards, easy listening, lounge, swing"
4fadxwIbgm3kBliXRvgbn6,La Abandoné y No Sabía,"Osvaldo Pugliese, Roberto Chanel",191066,1942-02-25,1942,0.971,0.532,0.223,0.027,0.109,-8.432,0.0437,119.575,0.425,0,10,3,False,"latin classical, tango"
4s0IeFQ4FaabbfDvS3ShXv,Barra Querida,Osvaldo Pugliese,188853,1942-02-25,1942,0.986,0.575,0.281,2.17e-06,0.138,-6.411,0.0445,126.563,0.744,0,11,12,False,"latin classical, tango"
450MebrTVdJVMyVFEYpvAj,Negracha,Osvaldo Pugliese,163120,1942-02-25,1942,0.783,0.743,0.266,0.41,0.0831,-7.291,0.0695,122.995,0.341,0,9,8,False,"latin classical, tango"
3ZdVqvKVWrMHg7kHM8TApS,Campanera,Estrellita Castro,210927,1942-03-11,1942,0.841,0.507,0.49,1.51e-05,0.127,-4.169,0.0366,123.99,0.665,1,10,27,False,copla
3Vhi44Xvn3jITeSc0w0XIM,"Seguime, Si Podes",Osvaldo Pugliese,185626,1942-02-25,1942,0.938,0.513,0.195,0.23,0.387,-14.753,0.0629,121.394,0.392,1,0,12,False,"latin classical, tango"
06zPN0Y4Uz4sxXCnrL9NbV,It Ain't Necessarily So,"George Gershwin, Paul Robeson, Lawrence Brown, Columbia Concert Orchestra, Emanuel Balaban",155160,1942,1942,0.953,0.297,0.134,0.00265,0.137,-15.198,0.0346,177.823,0.398,1,0,1,False,"american modern classical, classical, early modern classical, tin pan alley"
08DGQyibQmL4OISz6SeE4o,Hustling and Shovelling / New Year's Eve,Charlie Chaplin,253499,1942,1942,0.967,0.34,0.23,0.802,0.683,-12.727,0.106,177.472,0.261,0,8,1,False,classic soundtrack
0DGvtziK6jdK6x1Qp7PeEG,By an' By,"Traditional, Paul Robeson, Lawrence Brown, Columbia Concert Orchestra, Emanuel Balaban",145800,1942,1942,0.988,0.354,0.114,6.56e-05,0.1,-18.225,0.036,101.495,0.531,1,11,1,False,"gregorian chant, puirt-a-beul"
5TJheyN3a9AavME5qyf7Iw,Tumi Aaj Kato Durey,Jaganmoy Mitra,417000,1942-12-01,1942,0.993,0.331,0.229,0.434,0.112,-14.631,0.0394,126.094,0.248,1,8,5,False,classic bangla pop
38diJODsdBfHtSX5Jv9swx,Dos Que Se Aman,"Osvaldo Pugliese, Alberto Morán",171853,1942-02-25,1942,0.964,0.46,0.45,0.0241,0.291,-8.238,0.0416,84.093,0.598,1,10,2,False,"latin classical, tango"
11SvJWqbZUXXylo5qI2Zv9,"Don Giovanni, K. 527, Act I: ""Batti, batti, o bel Masetto""","Wolfgang Amadeus Mozart, Bidu Sayão, Erich Leinsdorf, Columbia Symphony Orchestra",269266,1942,1942,0.982,0.416,0.148,3.8e-05,0.118,-13.532,0.064,68.05,0.296,1,0,0,False,"classical, classical era"
0OFhmIPqahSpqp9n80QnwC,"Goldberg Variations, BWV 988: Variation XII - Canon at the Fourth","Johann Sebastian Bach, Claudio Arrau",232786,1942,1942,0.996,0.485,0.168,0.927,0.166,-26.099,0.0589,99.61,0.803,1,7,0,False,"baroque, classical, early music, german baroque"
4qtQWHmtSZJIwO83nLyTCC,"Goldberg Variations, BWV 988: Variation IX - Canon at the Third","Johann Sebastian Bach, Claudio Arrau",133866,1942,1942,0.996,0.667,0.113,0.879,0.207,-25.897,0.0824,120.522,0.657,1,7,0,False,"baroque, classical, early music, german baroque"
18nWdXPLqb1qOcRknC0u0D,"Goldberg Variations, BWV 988: Variation III - Canon at the Unison","Johann Sebastian Bach, Claudio Arrau",113386,1942,1942,0.994,0.479,0.204,0.867,0.138,-22.163,0.0399,104.377,0.721,1,7,1,False,"baroque, classical, early music, german baroque"
3rvoBcGM8HHBOMeSnGHfbE,"Goldberg Variations, BWV 988: Aria","Johann Sebastian Bach, Claudio Arrau",299133,1942,1942,0.995,0.508,0.0189,0.89,0.105,-29.073,0.0442,81.268,0.299,1,7,1,False,"baroque, classical, early music, german baroque"
6NBLLkUxwVTTNwmDwMYnHC,Tintarella di luna,Mina,178285,1942-11-13,1942,0.795,0.502,0.68,0.153,0.123,-9.74,0.0436,154.964,0.966,1,5,49,False,"classic italian pop, italian adult pop, ye ye"
22i2x82yy7ikz3cvaTu72d,"Badi Der Bhai Nandlala, Pt. 2",Mohammed Rafi,233426,1942-12-01,1942,0.946,0.433,0.55,0.0,0.0823,-9.834,0.0452,132.06,0.791,1,5,13,False,"classic bollywood, filmi"
3At6Er6Lapy9lSavoDVBux,Il cielo in una stanza,Mina,174915,1942-11-13,1942,0.899,0.245,0.297,1.02e-06,0.114,-14.806,0.03,91.895,0.464,1,3,43,False,"classic italian pop, italian adult pop, ye ye"
3gyZ2WU9Yyz2BuyyDXZ0oA,Buongiorno tristezza,Luciano Tajoli,219533,1942-11-23,1942,0.988,0.413,0.132,0.0362,0.241,-15.195,0.0469,70.131,0.277,1,8,15,False,"canzone napoletana, classic italian pop"
6GfWMPguyqRcqS5klCl6B9,Broadway Melody of 1940: Begin the Biguine,"Django Reinhardt, Grand Orchestre de Danse",173189,1942-01-01,1942,0.95,0.561,0.207,0.905,0.593,-17.99,0.038,77.844,0.717,1,0,4,False,"french jazz, gypsy jazz, jazz, jazz guitar, swing"
7rjRP8FKFHnPIQsHIXr8f7,Blues en mineur,"Django Reinhardt, Ivon Debie",168991,1942-01-01,1942,0.983,0.494,0.0678,0.359,0.112,-22.0,0.0683,183.781,0.658,0,7,4,False,"french jazz, gypsy jazz, jazz, jazz guitar, swing"
1zoCDeGJuT69fW1wBdeySZ,"Badi Der Bhai Nandlala, Pt. 1",Mohammed Rafi,209345,1942-12-01,1942,0.935,0.429,0.417,0.0,0.192,-13.743,0.0408,133.233,0.792,1,0,5,False,"classic bollywood, filmi"
1UMvHuBLWux0OThCRbJLl5,Le mille bolle blù,Mina,234083,1942-11-13,1942,0.839,0.395,0.613,6.88e-06,0.382,-5.133,0.0526,126.774,0.484,1,9,20,False,"classic italian pop, italian adult pop, ye ye"
2YhHXDylBCBcxw8c2XKEoI,Chihuahua,Mina,130533,1942-11-13,1942,0.895,0.471,0.521,0.000588,0.143,-9.56,0.0354,89.401,0.832,0,9,24,False,"classic italian pop, italian adult pop, ye ye"
1pQR8nQ9FLoL5VY3t2VBx8,天邊一朵雲,白光,188933,1942-05-01,1942,0.974,0.382,0.167,0.0,0.0971,-13.25,0.0539,87.956,0.303,1,10,16,False,"c-pop, vintage chinese pop"
0WXHKH1u9sJPXEXeBJg3UG,向王小二拜年,白光,164706,1942-05-01,1942,0.99,0.64,0.248,0.0594,0.0839,-11.185,0.0608,90.898,0.658,1,7,15,False,"c-pop, vintage chinese pop"
7g48CfO0jVNS7kVuU1hdUI,送情歌,白光,143306,1942-05-01,1942,0.982,0.464,0.266,1.25e-05,0.138,-11.104,0.0807,70.398,0.59,0,5,11,False,"c-pop, vintage chinese pop"
3xKwRsLB6qnq3CQchooOTw,Folle banderuola,Mina,140460,1942-11-13,1942,0.775,0.532,0.424,8.49e-06,0.579,-11.869,0.0434,125.896,0.909,1,0,6,False,"classic italian pop, italian adult pop, ye ye"
4eogYXzIcmrjCIfFSBzFyE,Sabato notte,Mina,159085,1942-11-13,1942,0.706,0.617,0.318,0.0,0.417,-12.273,0.0394,117.296,0.749,0,0,16,False,"classic italian pop, italian adult pop, ye ye"
3h2SLBJz9Lr5iPZqJltcc8,Jewel Song from Faust (Act III),"Charles Gounod, Bidu Sayão, Fausto Cleva, Metropolitan Opera Orchestra",232266,1942,1942,0.976,0.368,0.208,4.45e-05,0.241,-15.865,0.049,107.316,0.168,1,11,5,False,"classical, french opera, french romanticism, late romantic era"
3IxUsXWlm3cKf6Q8NRiotU,Balm in Gilead,"Traditional, Paul Robeson, Lawrence Brown, Columbia Concert Orchestra, Emanuel Balaban",148133,1942,1942,0.991,0.269,0.0298,0.0481,0.114,-21.884,0.0355,88.082,0.467,1,1,2,False,"gregorian chant, puirt-a-beul"
32jESUQtEQ1Pp0LTEz8Dq7,Baldosa Floja,"Osvaldo Pugliese, Jorge Maciel, Alfredo Belusi",184413,1942-02-25,1942,0.861,0.523,0.556,1.3e-05,0.0856,-6.616,0.0568,123.175,0.744,0,11,4,False,"latin classical, tango"
6jErNNbttYWo2ZfSYQRRPR,Bien Milonga,Osvaldo Pugliese,192133,1942-02-25,1942,0.986,0.629,0.258,0.6,0.678,-8.091,0.045,119.923,0.537,0,7,6,False,"latin classical, tango"
103Ejyfo48Xwo9zcdquHRq,Bien Compadre,Osvaldo Pugliese,190160,1942-02-25,1942,0.95,0.633,0.325,0.789,0.163,-5.706,0.0505,119.793,0.514,1,7,1,False,"latin classical, tango"
4bNkHHgp7BcpSn5dieJSfk,Barro,"Osvaldo Pugliese, Alberto Morán",187733,1942-02-25,1942,0.991,0.531,0.23,0.00156,0.134,-10.647,0.055,118.297,0.325,0,6,3,False,"latin classical, tango"
