id,name,artists,duration_ms,release_date,year,acousticness,danceability,energy,instrumentalness,liveness,loudness,speechiness,tempo,valence,mode,key,popularity,explicit,genre
1dsiUHQQOcSS3NbbIA4zBG,Lo Poquito Que Me Queda,Los Invasores De Nuevo León,181160,1993-01-01,1993,0.302,0.793,0.683,0.0,0.0435,-8.886,0.0375,104.751,0.968,1.0,7.0,42,False,"banda, musica mexicana, norteno"
4y7Wjl5ACfJFTwPTU93sHt,La Daga,Los Tigres Del Norte,165546,1993-01-01,1993,0.258,0.832,0.766,0.0,0.0543,-9.917,0.086,106.925,0.894,1.0,7.0,42,False,"banda, musica mexicana, norteno, ranchera"
36CTxkvfEPmhZ95y2le5F2,Losing Skin,Seaweed,163066,1993-09-01,1993,6.51e-06,0.209,0.951,0.00619,0.0829,-6.326,0.0609,100.945,0.471,1.0,0.0,40,False,underground grunge
4p7XH4NhQ25iGYrrbg93gt,Suave,Luis Miguel,289600,1993,1993,0.0614,0.61,0.677,0.0,0.232,-9.813,0.0325,103.946,0.444,0.0,4.0,70,False,"bolero, latin pop"
5rY2qSGDyHI1lHYnNOidy1,Lady Soul - Single Version,The Temptations,285173,1993-01-15,1993,0.156,0.84,0.443,0.000235,0.059,-11.655,0.0393,114.008,0.906,1.0,1.0,35,False,"classic soul, disco, memphis soul, motown, soul"
2nBl6V42VMmSKV9kZ7zWWY,Los machos también lloran,Banda Machos,148120,1993-10-06,1993,0.71,0.52,0.483,1.82e-06,0.313,-8.339,0.201,182.706,0.967,1.0,2.0,39,False,"banda, banda jalisciense, musica mexicana, tecnobanda"
1eqGYJJr2z2GXK1i0hD3BC,Love Letters In The Sand,Pat Boone,134560,1993-01-01,1993,0.811,0.571,0.196,0.0,0.142,-13.216,0.0278,88.728,0.555,1.0,3.0,45,False,"adult standards, easy listening, rock-and-roll, rockabilly"
0lTbsFD5kFXc2DpfrcBrcz,Lo Que Mas Extraño,Industria del Amor,171920,1993-01-01,1993,0.0567,0.473,0.507,0.000306,0.111,-9.378,0.0278,134.25,0.663,1.0,0.0,39,False,"banda, grupera, gruperas inmortales, musica mexicana, norteno"
2jaCU99LSbJeQiFue57ORT,Lick a Shot,Cypress Hill,203600,1993-07-20,1993,0.0634,0.551,0.685,0.808,0.127,-10.738,0.273,147.25,0.728,1.0,8.0,42,True,"chicano rap, gangster rap, hip hop, rap rock, west coast rap"
5ICwDM1fzgqv7HNFUIjPyx,Living in Danger,Ace of Base,223226,1993-12-24,1993,0.000573,0.669,0.931,0.56,0.106,-7.161,0.0488,102.079,0.829,0.0,11.0,47,False,"eurodance, europop, new wave pop"
0r2joAcaJghNmtRIBBIzu1,Let the Beat Go On (Short Version),Dr. Alban,243266,1993-03-29,1993,0.00397,0.707,0.928,0.23,0.285,-6.181,0.0438,136.027,0.969,0.0,7.0,57,False,"eurodance, europop, hip house"
0T3xmp3KqDklZ12Ze0Nm13,Let Me Be the One,Intro,297520,1993-03-16,1993,0.00662,0.629,0.518,0.0,0.0534,-13.237,0.0352,92.042,0.632,1.0,11.0,36,False,"contemporary r&b, new jack swing"
2PlegUHfHASQcqlQ9DUdhf,The Love Bug,George Strait,171573,1993-01-01,1993,0.509,0.523,0.751,6.21e-06,0.0504,-12.686,0.0401,173.014,0.926,1.0,9.0,36,False,"contemporary country, country, country road"
3ypgdnPnb8KxSLsBlTLxI7,Love Doesn't Ask Why,Céline Dion,248866,1993-11-09,1993,0.453,0.467,0.438,0.0,0.275,-9.864,0.0335,139.859,0.223,0.0,0.0,51,False,canadian pop
0kAGAVB0bhDJvNoNuJaqzI,The Last Rebel,Lynyrd Skynyrd,405946,1993-02-02,1993,0.123,0.305,0.518,0.00404,0.0762,-7.765,0.0305,137.225,0.0781,0.0,9.0,38,False,"album rock, classic rock, hard rock, rock, southern rock"
0BqTFv2hwGpDrxKTWmtzBY,Last Wordz,"2Pac, ICE-T, Ice Cube",216906,1993-02-16,1993,0.0477,0.764,0.721,0.0014,0.405,-12.537,0.182,109.293,0.62,1.0,11.0,39,True,"g funk, gangster rap, hip hop, rap, west coast rap"
7jr49sk04tOLtPpP96HeG2,La Oferta,Los Tigres Del Norte,153693,1993-01-01,1993,0.183,0.511,0.68,0.0,0.108,-9.157,0.265,209.49,0.964,1.0,7.0,40,False,"banda, musica mexicana, norteno, ranchera"
6BaeBGjyN0w3k3uoYiDoNd,La carga del diablo,Banda Machos,180093,1993-10-06,1993,0.679,0.764,0.427,0.0,0.265,-10.674,0.101,142.193,0.972,1.0,5.0,37,False,"banda, banda jalisciense, musica mexicana, tecnobanda"
1x3Sxgpq3MIyZUi9v2W1ZT,Let Go,Brother Phelps,219040,1993,1993,0.52,0.618,0.62,0.0,0.0722,-12.347,0.0289,143.77,0.9,1.0,7.0,35,False,deep contemporary country
3xctrMbABMVdIzRCFbyOlz,Learning As You Go,Rick Trevino,209640,1993,1993,0.107,0.604,0.647,0.000169,0.187,-7.006,0.0285,110.026,0.482,1.0,7.0,34,False,deep contemporary country
1miGbo3IxDxe1im0b4fvBM,Me Quede Llorando,Industria del Amor,205346,1993-01-01,1993,0.0352,0.582,0.62,4.94e-05,0.0872,-9.781,0.03,117.7,0.554,1.0,0.0,53,False,"banda, grupera, gruperas inmortales, musica mexicana, norteno"
1ch4u7n3GCyUYuLfRi8NAd,La Flaca,Mi Banda El Mexicano,171230,1993-02-18,1993,0.0477,0.921,0.837,5.34e-06,0.0438,-6.413,0.0407,139.877,0.985,1.0,10.0,41,False,"banda, musica mexicana, norteno, tecnobanda"
5koEBSDfDV8MQVN0tg67z5,Love Is A Many-Splendored Thing,"The Four Aces, Al Alberts",179466,1993-09-28,1993,0.735,0.4,0.293,0.0,0.346,-11.781,0.0282,77.111,0.232,1.0,2.0,35,False,"adult standards, doo-wop, easy listening, vocal harmony group"
2CxZESKjoN4Un4rTJYpwu3,Let 'Em Know,Souls Of Mischief,255293,1993-02-13,1993,0.00761,0.67,0.631,1.91e-05,0.0892,-10.558,0.373,100.877,0.636,0.0,10.0,39,True,"alternative hip hop, hardcore hip hop, hip hop, jazz rap"
1b5qdcETwEAKc78vsiDZG6,Leaving The Docks,Zbigniew Preisner,89133,1993-01-01,1993,0.985,0.344,0.0313,0.8,0.0751,-22.913,0.0484,120.793,0.0622,0.0,4.0,39,False,polish contemporary classical
7dCF8jZXWHJtBgi60jwGZg,La Mañana Que Se Fue,Los Reyes Locos,223440,1993-01-01,1993,0.212,0.528,0.709,0.0,0.26,-5.332,0.0671,176.514,0.961,1.0,0.0,43,False,"gruperas inmortales, musica coahuilense"
2jeBcSclYZHOGQ89ZyF2BN,Lizzy,Melvins,283760,1993-08-31,1993,0.301,0.516,0.294,0.116,0.0989,-11.333,0.0379,119.067,0.0894,0.0,4.0,37,False,"alternative metal, alternative rock, grunge, post-hardcore, punk, sludge metal, stoner metal"
7voHUmPNDuYZ1SW1mwRu26,No Limit,2 Unlimited,224220,1993-05-10,1993,0.00872,0.65,0.985,0.00422,0.0485,-14.404,0.0445,141.047,0.757,0.0,5.0,65,False,"eurodance, europop, hip house"
0bhwkOfM7yVI0fZmlS0d2t,Love Me Browning,Buju Banton,227866,1993,1993,0.206,0.784,0.406,0.0,0.0731,-10.199,0.152,81.995,0.763,1.0,0.0,38,True,"dancehall, reggae fusion"
6UONjmhxEjAAy74wFh6fuN,La Carcacha/Besitos - Live,Selena,413986,1993,1993,0.447,0.719,0.706,6.23e-05,0.384,-8.827,0.0315,91.015,0.822,1.0,8.0,36,False,"mexican pop, tejano"
0FpYqjOx9Q4khUauXDrVtj,Luz Verde,Luis Miguel,301933,1993,1993,0.136,0.71,0.859,0.000508,0.23,-6.86,0.0782,107.499,0.793,0.0,10.0,52,False,"bolero, latin pop"
4L9UGKy4of0cmR3ei0k1Lf,La Mini Mini,Banda Kañón,171440,1993-01-01,1993,0.0374,0.855,0.728,7.1e-05,0.0373,-8.513,0.0367,112.664,0.935,0.0,11.0,43,False,"cumbia lagunera, gruperas inmortales, musica coahuilense"
3YsG8BwqrJzM3DOqYpFLp0,Leafy Incline,Tad,210533,1993,1993,1.58e-05,0.24,0.863,0.416,0.0944,-8.046,0.0402,75.591,0.331,0.0,11.0,37,False,grunge
7FVYW5IyR8vcDQkXmPOLJQ,Las mañanitas,Banda Machos,155906,1993-10-06,1993,0.588,0.48,0.443,2.14e-06,0.314,-10.449,0.129,194.388,0.98,1.0,7.0,42,False,"banda, banda jalisciense, musica mexicana, tecnobanda"
2vWaZmzwxRDNYySRGUdq3N,Lord Jazz Hit Me One Time (Make It Funky),Lords Of The Underground,166400,1993-01-01,1993,0.0194,0.789,0.797,0.0718,0.449,-8.471,0.204,94.919,0.555,0.0,10.0,38,True,"conscious hip hop, east coast hip hop, new jersey rap"
0nwnaHLObT2ZEkrNAfryEB,"Le Bien, Le Mal","Guru, MC Solaar",202160,1993-01-01,1993,0.0413,0.842,0.821,0.00249,0.346,-9.86,0.163,101.986,0.594,1.0,1.0,45,False,"boston hip hop, east coast hip hop, jazz rap"
2rTYgHxgcndkUrRoU7x0Sv,Mr. Vain,Culture Beat,336840,1993-01-01,1993,0.0478,0.676,0.996,0.262,0.333,-7.946,0.0397,132.871,0.4,0.0,9.0,65,False,"eurodance, europop, german techno, hip house"
3a1Ska1dAtx4KE4b86eumQ,More Mess on My Thing,The Poets Of Rhythm,252000,1993-01-01,1993,0.225,0.542,0.869,0.891,0.0453,-6.18,0.0947,190.132,0.962,1.0,0.0,52,False,"afrobeat, bboy"
7wNrk2vc0GUUNBFggJzEsI,Mujeres,Ricardo Arjona,206000,1993-02-08,1993,0.376,0.761,0.634,0.00177,0.0452,-9.476,0.0371,106.043,0.881,1.0,2.0,61,False,"cantautor, latin arena pop, latin pop"
01RVupyBFNuALcAFZjL4FY,My Baby Loves Me,Martina McBride,154960,1993-09-12,1993,0.553,0.719,0.757,0.0,0.113,-5.32,0.0332,124.716,0.817,1.0,11.0,45,False,"contemporary country, country, country dawn, country road"
0JXXm3RqxU8EKzX4P8M0n3,More And More - Single Version,Captain Hollywood Project,253573,1993-03-05,1993,0.225,0.661,0.847,0.835,0.0863,-11.855,0.0349,125.862,0.71,1.0,7.0,62,False,"diva house, eurodance, german techno, hip house"
12GEszobr92vUXs4LCdwjK,Mr. Smiley,Mustard Plug,166040,1993-11-15,1993,0.000253,0.497,0.811,0.00979,0.0715,-12.489,0.0507,183.31,0.861,1.0,2.0,47,False,"grand rapids indie, ska, ska punk"
0HXYmIG0cO3y0ASrZiezJx,Mario Portillo,"Chalino Sanchez, Banda Brava",242439,1993-04-14,1993,0.676,0.44,0.405,4.74e-05,0.167,-8.835,0.108,179.972,0.965,1.0,0.0,48,False,"banda, corrido, corridos clasicos, musica mexicana, norteno, sierreno"
3fP8KXXUoBenEM46UZZgSG,Moist Vagina - 2013 Mix,Nirvana,213453,1993-09-21,1993,0.000127,0.344,0.567,0.205,0.225,-11.437,0.0384,110.306,0.613,1.0,10.0,50,False,"grunge, permanent wave, rock"
2junx9LRubsMY2OHaSc5DE,Mayonaise - 2011 Remaster,The Smashing Pumpkins,348773,1993,1993,0.000107,0.482,0.528,0.543,0.0839,-10.426,0.0272,146.043,0.0882,1.0,10.0,47,False,"alternative metal, alternative rock, grunge, permanent wave, rock, spacegrunge"
6WtPeZXQnoLbLOz7e0dfZL,Mi Amigo el Tordillo,Vicente Fernández,210226,1993,1993,0.122,0.359,0.508,0.0,0.29,-6.043,0.0341,181.624,0.875,1.0,10.0,51,False,"mariachi, ranchera"
6gJdDnF2TzfA1WPMXuCa3x,Proud Mary,Tina Turner,327400,1993,1993,0.0766,0.397,0.499,1.55e-06,0.111,-10.972,0.0685,171.067,0.367,1.0,2.0,66,False,soft rock
0ejCXxg1xLNengD587zpAe,Morena Ven,Los Hermanos Rosario,261355,1993-07-22,1993,0.746,0.715,0.704,0.0336,0.2,-17.605,0.043,150.007,0.921,1.0,9.0,49,False,"merengue, salsa, tropical"
5N5sbaoN8UvXw8ngNR9iUk,Mojada,Vilma Palma e Vampiros,367960,1993,1993,0.328,0.666,0.859,0.0,0.322,-5.517,0.0427,120.701,0.198,1.0,7.0,62,False,"argentine rock, latin alternative, latin pop, latin rock, rock en espanol"
3Vqbj9yPHBTIRhTDJHPQMq,Moanin',Mingus Big Band,539360,1993,1993,0.0639,0.392,0.683,0.000599,0.392,-9.654,0.125,115.934,0.593,1.0,8.0,43,False,"big band, jazz orchestra, modern big band"
28hioqqNRQD0izp6KOXpoH,Mr. Big,8Ball & MJG,353853,1993,1993,0.00458,0.856,0.5,0.00192,0.0915,-10.697,0.285,155.863,0.389,1.0,1.0,40,True,"dirty south rap, memphis hip hop"
58MAh1fboa0lvwaX2JS0B1,Muchacho malo,Olga Tañón,267533,1993-08-03,1993,0.105,0.797,0.913,9.1e-05,0.256,-5.734,0.0454,138.015,0.928,0.0,6.0,51,False,"puerto rican pop, salsa, tropical"
7d4pdMym8ZBOgf1oVPTiPb,Matador - Remasterizado 2008,Los Fabulosos Cadillacs,275893,1993-06-18,1993,0.0274,0.543,0.962,0.027,0.09,-5.337,0.106,193.66,0.639,0.0,4.0,60,False,"argentine rock, latin alternative, latin pop, latin rock, rock en espanol, ska, ska argentino"
1t2NRCaPgdCScicuzq8tjG,Mountain Dew (with Tommy Makem),"The Clancy Brothers, Tommy Makem",131533,1993-02-02,1993,0.827,0.805,0.364,2.57e-06,0.0932,-14.493,0.143,103.546,0.699,1.0,2.0,47,False,"irish folk, irish pub song"
2gh86ZgtMwrDQEESi2p2C3,My Heart Skips A Beat,Buck Owens,148200,1993-11-16,1993,0.411,0.639,0.506,4.98e-06,0.0559,-9.156,0.0391,86.396,0.855,1.0,9.0,45,False,"bakersfield sound, classic country pop, country, country rock, cowboy western, western swing"
7g2BVLCYyGeVHGGFajED65,Midnight (feat. Raphael Saadiq),"A Tribe Called Quest, Raphael Saadiq",265026,1993-11-09,1993,0.145,0.807,0.539,0.517,0.107,-9.968,0.18,94.586,0.596,1.0,1.0,43,False,"conscious hip hop, east coast hip hop, golden age hip hop, hip hop, jazz rap, queens hip hop"
2kW8ugQnEoLXekBFVf8Wwe,Me Volvieron A Hablar De Ella,Gilberto Santa Rosa,344240,1993,1993,0.215,0.647,0.557,0.000276,0.179,-10.04,0.0367,168.422,0.64,0.0,11.0,53,False,"salsa, salsa puertorriquena, tropical"
6nQVB7McD3XdFEZ0x8H9i0,Mary Of Silence,Mazzy Star,362066,1993-10-05,1993,0.0156,0.164,0.263,0.0927,0.11,-14.905,0.0331,174.192,0.0346,1.0,7.0,44,False,"dream pop, melancholia, shoegaze, slowcore"
3wRiwV9HdarzkktRH7If46,Me and You and a Dog Named Boo,Lobo,177933,1993-06-11,1993,0.178,0.628,0.603,1.73e-05,0.0686,-10.286,0.0312,120.782,0.951,1.0,6.0,47,False,soft rock
7vPd1EHjkZGXdHVwf9fXVd,Make That Move,Shalamar,373160,1993-01-01,1993,0.0354,0.788,0.685,0.000891,0.0636,-7.806,0.103,116.947,0.753,1.0,7.0,38,False,"classic soul, disco, funk, motown, new jack swing, post-disco, quiet storm, soul, urban contemporary"
5mQZ5pln1nychtPCtG88em,My Opinion,Mac Mall,244733,1993,1993,0.00169,0.632,0.575,0.000459,0.848,-8.868,0.198,82.024,0.648,1.0,2.0,38,False,"g funk, west coast rap"
3Vfj2JGXayXgc0c9J4gJ8m,Tell Me Why,Wynonna,230640,1993-05-11,1993,0.00746,0.621,0.802,0.00279,0.0677,-6.717,0.0315,141.612,0.81,1.0,3.0,52,False,"country, country dawn, country road"
1ipFQkkkgRJ9HWu5zGzMuv,Me Caí De La Nube,Cornelio Reyna,186131,1993-07-14,1993,0.589,0.827,0.513,1.75e-05,0.0783,-7.901,0.0425,112.581,0.871,1.0,8.0,45,False,"musica mexicana, norteno, ranchera"
6xkI5r6u6HPXSACeIwjqFx,Me Enamoré,Anthony Santos,337133,1993-02-01,1993,0.245,0.503,0.871,0.0136,0.132,-7.862,0.0737,167.763,0.966,1.0,2.0,37,False,"bachata, bachata dominicana"
3PP7TRychfSQiAZgtq1Xjv,Mi Buen Amor,Gloria Estefan,227600,1993-06-03,1993,0.413,0.614,0.388,0.0,0.409,-10.141,0.0375,119.935,0.595,1.0,0.0,52,False,"new wave pop, soft rock"
65lfzguWycfHortBjpZAwr,Motivos,Banda Machos,188506,1993-10-06,1993,0.364,0.804,0.61,2.34e-05,0.0685,-5.022,0.0279,107.781,0.944,1.0,10.0,43,False,"banda, banda jalisciense, musica mexicana, tecnobanda"
4lIyYuC3f68DZjeIfo6BrM,Midnight Marauders Tour Guide,A Tribe Called Quest,45333,1993-11-09,1993,0.552,0.651,0.124,0.188,0.175,-21.527,0.484,94.24,0.803,1.0,8.0,42,False,"conscious hip hop, east coast hip hop, golden age hip hop, hip hop, jazz rap, queens hip hop"
5LPbV9HGYquJThvbCN89nw,Milk It,Nirvana,234746,1993-09-21,1993,0.00064,0.468,0.524,0.0221,0.131,-12.38,0.0474,136.293,0.537,0.0,1.0,44,False,"grunge, permanent wave, rock"
2KHn9Hlv8kU1DVohI0sIKP,My Stoney Baby,311,224226,1993-02-09,1993,0.00214,0.747,0.86,0.00113,0.0547,-8.635,0.0531,95.269,0.841,1.0,5.0,36,False,"alternative metal, alternative rock, funk metal, funk rock, nu metal, pop rock, rap rock, reggae fusion"
1c3zgIrrFkhnavRt20lsqu,Method Man - Home Grown Version,Wu-Tang Clan,310466,1993-11-09,1993,0.138,0.899,0.592,8.24e-05,0.335,-8.082,0.332,101.038,0.736,1.0,6.0,43,True,"east coast hip hop, gangster rap, hardcore hip hop, hip hop, rap"
660s5fvZVVupYoxBPzS9Ze,Magnet,Bikini Kill,86293,1993-10-26,1993,0.00056,0.191,0.889,0.33,0.145,-5.99,0.0585,194.101,0.48,0.0,4.0,40,False,"olympia wa indie, punk, riot grrrl"
6QRHr540RPyPgWNyCtX0Y5,Mega Medley,Zapp,248600,1993-09-28,1993,0.197,0.732,0.788,9.09e-05,0.39,-7.09,0.15,111.738,0.765,1.0,6.0,37,False,"classic soul, funk, new jack swing, p funk, popping, post-disco, quiet storm, soul, synth funk"
02W7noV2tXER7vHh26JEme,Mi Vejez,Vicente Fernández,197800,1993,1993,0.164,0.437,0.372,0.0,0.35,-7.374,0.0384,131.405,0.565,1.0,0.0,44,False,"mariachi, ranchera"
7DeQY9t9zCkNdUlUP17GHy,Mi Linda Amiga,Los Fugitivos,202706,1993-01-01,1993,0.132,0.671,0.516,0.0,0.292,-7.647,0.0236,93.663,0.476,1.0,2.0,39,False,"grupera, gruperas inmortales"
5PyA2avguoJ2n2U42Y9GXS,My Love,Little Texas,245800,1993,1993,0.372,0.495,0.532,0.0,0.0416,-10.397,0.03,189.042,0.451,1.0,9.0,46,False,"contemporary country, country, country road"
2wKOlbWJXvvnB2QmqprjZG,My Wife Thinks You're Dead,Junior Brown,228573,1993-08-24,1993,0.798,0.64,0.385,0.00187,0.0935,-12.693,0.0349,121.318,0.698,1.0,4.0,37,False,classic texas country
5dKBaJnw30NkrtcWI2TxaT,Me Estás Haciendo Falta,Liberación,202280,1993-01-01,1993,0.285,0.569,0.59,0.0,0.574,-7.077,0.0297,90.995,0.509,1.0,0.0,44,False,"banda, grupera, gruperas inmortales, grupero romantico, musica mexicana, norteno, tejano"
33pj1QE0DnA6B3rcyNr0ji,Maui Hawaiian Sup'pa Man,Israel Kamakawiwo'ole,233666,1993-11-01,1993,0.295,0.679,0.877,1.05e-06,0.158,-5.337,0.029,153.071,0.906,0.0,9.0,36,False,hawaiian
0aMhtRysxPRDSYtY1E1rwt,Money in the Ghetto,Too $hort,343733,1993-10-26,1993,0.0468,0.951,0.51,3.04e-06,0.211,-9.75,0.178,103.065,0.386,1.0,1.0,35,True,"cali rap, gangster rap, golden age hip hop, hyphy, oakland hip hop, west coast rap"
7MksalMuo9vbaDCfipewcV,Mis Últimas Lagrimas,Los Invasores De Nuevo León,167133,1993-01-01,1993,0.289,0.758,0.668,0.0,0.104,-8.572,0.0301,108.838,0.96,1.0,9.0,42,False,"banda, musica mexicana, norteno"
2i5K0EdMY5zFs9t7KfYK3k,Rape Me,Nirvana,170000,1993-09-21,1993,0.0141,0.42,0.746,0.0,0.0661,-10.628,0.0467,111.886,0.229,1.0,8.0,55,False,"grunge, permanent wave, rock"
1G6E8yhilqdeZuduRrob1S,Melon Yellow,Slowdive,232946,1993,1993,0.437,0.395,0.33,0.675,0.0581,-13.399,0.0301,128.434,0.303,0.0,6.0,40,False,"alternative rock, dream pop, reading indie, shoegaze"
5TC1Np25hdWpmr8qsAtwmx,Main Title,Jerry Goldsmith,216893,1993-09-28,1993,0.877,0.13,0.0925,0.896,0.117,-18.214,0.041,93.774,0.0631,1.0,9.0,35,False,"classic soundtrack, orchestral soundtrack, soundtrack"
47jRWT09YkhZXJMuGBYkpb,Miss You In A Heartbeat - Revised Version,Def Leppard,244611,1993-10-05,1993,0.551,0.603,0.394,3.98e-05,0.104,-10.02,0.0288,134.083,0.239,1.0,10.0,42,False,"album rock, classic rock, glam metal, hard rock, nwobhm, rock"
1INQHODdz8xth4KOH04RWI,Move It Like This - Alternative Mix,K7,325000,1993-11-09,1993,0.0396,0.788,0.642,0.000242,0.0529,-9.467,0.0394,106.048,0.901,1.0,7.0,35,False,"freestyle, miami bass"
7jLyxBaU1KJvkTXGq7kpha,She's My Baby,Mazzy Star,265000,1993-10-05,1993,0.0523,0.39,0.518,0.0194,0.127,-11.531,0.0303,150.46,0.206,1.0,0.0,48,False,"dream pop, melancholia, shoegaze, slowcore"
5GYDLehClDE0qcEc9nxxVi,Por Mi Timidez,Anthony Santos,281560,1993-01-12,1993,0.349,0.749,0.5,7.77e-05,0.139,-5.019,0.045,136.208,0.771,1.0,7.0,46,False,"bachata, bachata dominicana"
1HWzODlA2k8nLxrOeTkEAx,Mi Sueño,Vicente Fernández,191160,1993-12-02,1993,0.79,0.353,0.286,7.97e-06,0.162,-8.688,0.0397,80.258,0.387,1.0,2.0,39,False,"mariachi, ranchera"
3kxr8R2FrhQcENEDvWPNqa,Music Box,Mariah Carey,295693,1993-08-31,1993,0.705,0.383,0.165,1.58e-05,0.0704,-14.891,0.0308,139.565,0.0371,1.0,4.0,41,False,"dance pop, pop, urban contemporary"
64hCnEogVnvLhX33wL6JvL,María De La Luz,"Chalino Sanchez, Banda Brava",245272,1993-04-14,1993,0.645,0.437,0.429,1.2e-05,0.294,-8.248,0.0641,180.915,0.97,1.0,8.0,37,False,"banda, corrido, corridos clasicos, musica mexicana, norteno, sierreno"
0PLCJmRl2v7Ipp7FwlNS9k,Might,Archers Of Loaf,125519,1993-09-07,1993,0.00453,0.435,0.956,0.198,0.257,-7.554,0.0431,141.115,0.846,1.0,4.0,35,False,"alternative rock, chapel hill sound, gbvfi, lo-fi, lo-fi emo, post-hardcore, triangle indie"
11Qaut2ciprckYhFDPsQmc,Money In The Bank,John Anderson,180573,1993-06-22,1993,0.0839,0.686,0.751,0.0,0.11,-8.454,0.0319,128.474,0.936,1.0,0.0,32,False,"classic country pop, country, country road, country rock"
5Dkz3IZCmp6PajxQ8DSzhM,Muéveme el Pollo,Alfredo Y Sus Teclados,234066,1993,1993,0.194,0.807,0.691,9.84e-05,0.16,-8.601,0.0333,133.82,0.961,1.0,2.0,45,False,"cumbia del sureste, tropical tecladista"
588uZPIRuinNW3WPxcGN00,The Murda Show (with MC Eiht),"Spice 1, MC Eiht",267840,1993-09-28,1993,0.00963,0.777,0.707,0.00878,0.0722,-7.493,0.248,89.891,0.766,0.0,11.0,33,True,"g funk, west coast rap"
46SiVo3HExVQgLCkgnX6NL,My Truth,Cocteau Twins,274480,1993-10-18,1993,0.297,0.416,0.465,0.0067,0.0956,-10.161,0.0386,174.896,0.604,1.0,9.0,32,False,"alternative rock, art pop, dream pop, ethereal wave, melancholia, new wave, scottish indie, scottish shoegaze, shoegaze, synthpop"
1Ou6RRAWBpVQqkWDY3vFAR,Me Niego Estar Solo,Luis Miguel,258800,1993,1993,0.277,0.527,0.572,0.0,0.112,-8.451,0.0297,133.947,0.297,0.0,11.0,52,False,"bolero, latin pop"
4pTjHw5HwFpfOt6Yavgr2S,Mi Castigo,Banda El Recodo,152960,1993-03-11,1993,0.666,0.662,0.311,6.16e-06,0.088,-11.919,0.0681,135.151,0.975,1.0,5.0,40,False,"banda, banda sinaloense, musica mexicana, norteno"
0I1PhlsduqBaygiLVuh0gT,Mi Morenita,Los Aventureros,200000,1993,1993,0.467,0.696,0.469,0.0,0.036,-9.477,0.0625,80.71,0.93,0.0,9.0,37,False,
4tO4Sf6RU5TMbG6EQD79Kg,My Sister,The Juliana Hatfield Three,203333,1993-01-01,1993,0.159,0.52,0.835,0.0,0.148,-6.788,0.0365,136.687,0.568,1.0,11.0,34,False,"alternative pop, boston rock, lilith"
2vpuMzASMYd7xZrnlMwqaz,Me has librado de la muerte,Edgar Rocha,234919,1993-09-23,1993,0.241,0.476,0.475,0.0,0.889,-13.29,0.0279,143.982,0.369,0.0,4.0,42,False,
45XCemfNzdzUfB3lU1xKNL,More Than You'll Ever Know,Michael Ruff,267493,1993,1993,0.916,0.422,0.0223,5.92e-06,0.0898,-23.715,0.0418,129.827,0.322,1.0,10.0,53,False,deep soft rock
7LdrTu0apcwGJi3B5WWYnk,My Funny Valentine,"Ben Webster, Teddy Wilson",204760,1993-01-01,1993,0.945,0.54,0.0692,0.298,0.147,-15.105,0.052,72.984,0.38,1.0,3.0,39,False,"bebop, jazz, jazz saxophone"
004uWjBm1cOgxJAwQb6X8P,Mar y Luna,Pecos Kanvas,260466,1993-11-01,1993,0.2,0.774,0.634,0.00976,0.22,-11.401,0.0487,119.953,0.933,0.0,0.0,48,False,"classic venezuelan pop, pop romantico"
2H3Ee8gYFvCZ2ivuOl5wwI,Make Your Mind Up,Souls Of Mischief,230813,1993-02-13,1993,0.109,0.788,0.623,3.62e-05,0.142,-12.298,0.357,93.567,0.542,0.0,10.0,37,False,"alternative hip hop, hardcore hip hop, hip hop, jazz rap"
3gAdXCoPRBhIGRoa7XdyUq,The Morning After - Single Version,Maureen McGovern,139226,1993-01-01,1993,0.518,0.392,0.448,0.0,0.431,-9.096,0.0278,80.223,0.399,1.0,11.0,48,False,bubblegum pop
1d0GYRpnCb0XNQcQdKhfKL,You Mean the World to Me,Toni Braxton,296400,1993-07-13,1993,0.1,0.595,0.735,9.62e-06,0.104,-6.648,0.047,167.662,0.521,1.0,11.0,50,False,"contemporary r&b, dance pop, r&b, urban contemporary"
5FSpX03Lkr4NNGx6Sqm9p8,Minamahal Kita,Freddie Aguilar,264173,1993-03-01,1993,0.632,0.452,0.4,0.000292,0.108,-12.502,0.0363,141.816,0.223,1.0,9.0,53,False,"classic opm, kundiman"
2TEdI0KNrYHo4UPhrt0ais,Moody River - Single Version,Pat Boone,157266,1993-01-01,1993,0.774,0.767,0.269,0.0,0.0875,-14.983,0.0333,129.921,0.534,1.0,3.0,39,False,"adult standards, easy listening, rock-and-roll, rockabilly"
0wGXmuLI1BxPngWHVGmCaz,Mexican Moon,Concrete Blonde,303017,1993-10-19,1993,0.00425,0.439,0.923,0.0512,0.0974,-6.007,0.0689,92.293,0.673,1.0,0.0,34,False,lilith
28ldZTSap5HK0GQHKFOayo,Me Está Esperando María,Vicente Fernández,182893,1993-12-13,1993,0.675,0.341,0.506,1.35e-06,0.368,-5.038,0.0328,164.677,0.653,1.0,7.0,38,False,"mariachi, ranchera"
4J7lUTYSQ6pLLsPXDQwe6w,Moskau,Dschinghis Khan,269973,1993-04-26,1993,0.103,0.752,0.84,8.15e-05,0.193,-7.577,0.0359,131.764,0.888,0.0,5.0,31,False,classic schlager
0HXYqKxtdHB9HLhjwPozcF,Me Vuelvo Loco por Vos,Vilma Palma e Vampiros,292000,1993,1993,0.175,0.83,0.662,0.0,0.0604,-6.603,0.0636,122.601,0.845,0.0,4.0,50,False,"argentine rock, latin alternative, latin pop, latin rock, rock en espanol"
0REPZpvbRsCv1WVahCAqdN,My Kimono,Polvo,141066,1993-01-11,1993,0.985,0.677,0.603,0.0071,0.282,-11.95,0.0318,75.162,0.657,1.0,11.0,35,False,"chapel hill sound, experimental rock, lo-fi, math rock, noise pop, noise rock, post-hardcore, shoegaze, slowcore"
1lGkBImUYe5zCnwHaT6XoC,Make It A Double,Gary Stewart,186880,1993-10-15,1993,0.116,0.798,0.523,1.52e-05,0.073,-7.866,0.0274,117.847,0.635,1.0,4.0,30,False,"classic country pop, classic texas country, outlaw country"
6wbuQr8VIbgXHXp1hedMkD,The Man Who Sold The World - Live & Loud,Nirvana,274653,1993-09-21,1993,0.000208,0.242,0.849,0.018,0.861,-7.528,0.0448,123.518,0.334,1.0,8.0,38,False,"grunge, permanent wave, rock"
3X4qUkEhAvGY3qIlpNh1sl,Man-Size,PJ Harvey,196306,1993-01-01,1993,0.0198,0.685,0.307,0.00375,0.108,-19.125,0.0696,128.994,0.832,0.0,9.0,38,False,"alternative rock, art pop, melancholia, permanent wave, piano rock, singer-songwriter"
1UviWMzF3JTVHWpHS46ql7,Magic Moments,Perry Como,159906,1993-10-25,1993,0.88,0.719,0.257,2.61e-06,0.257,-14.447,0.0435,103.845,0.75,0.0,0.0,42,False,"adult standards, easy listening, lounge"
2gjr6Seh7mH5Tsgmo5DqjQ,Matando Gueros,Brujeria,143306,1993-06-27,1993,0.001,0.331,0.899,0.000208,0.168,-8.112,0.155,94.64,0.23,0.0,5.0,39,False,"deathgrind, latin metal, mexican death metal, mexican metal"
6CUWzTRmC1GjjSDTtiVfsI,None Of Your Business,Salt-N-Pepa,213173,1993-10-12,1993,0.193,0.765,0.569,0.0,0.0586,-9.511,0.479,197.9,0.752,1.0,6.0,53,False,"girl group, golden age hip hop, hip hop, hip pop, old school hip hop, queens hip hop"
4GqF1OeM18jaUiCs56JR5s,Nereyda,Raulin Rodriguez,295760,1993-12-01,1993,0.447,0.727,0.362,0.00186,0.303,-13.524,0.0496,76.528,0.929,0.0,9.0,51,False,"bachata, bachata dominicana"
7izTc9bk8wT1RRz4giRHFW,No Aloha,The Breeders,127226,1993-08-30,1993,0.0798,0.291,0.536,0.269,0.1,-9.166,0.0321,107.41,0.448,1.0,10.0,48,False,alternative rock
5L2STOBiS00u7q4aLtRjKK,Nowhere Near,Yo La Tengo,363973,1993-10-05,1993,0.832,0.431,0.233,0.848,0.099,-15.242,0.0288,81.183,0.085,1.0,9.0,48,False,"alternative rock, art pop, dream pop, indie rock, indietronica, lo-fi, new jersey indie, noise pop, permanent wave, shoegaze"
0Pu71wxadDlB8fJXfjIjeJ,Shoop,Salt-N-Pepa,248573,1993-10-12,1993,0.091,0.939,0.674,0.0,0.0565,-7.232,0.212,96.918,0.792,1.0,0.0,72,False,"girl group, golden age hip hop, hip hop, hip pop, old school hip hop, queens hip hop"
28HbbKkcLFSnCUW4GzYTY5,Nada Va A Cambiar Mi Amor Por Ti,Samuray,212226,1993-01-01,1993,0.493,0.516,0.457,0.0,0.221,-6.35,0.0348,147.375,0.66,1.0,1.0,46,False,"banda, grupera, gruperas inmortales, grupero romantico, musica mexicana, norteno"
6jlhaghCUXyRA4Tr5cHz54,No Time To Kill,Clint Black,240400,1993-07-13,1993,0.0905,0.582,0.678,0.0,0.356,-9.25,0.0299,92.978,0.827,1.0,10.0,40,False,"contemporary country, country, country road"
1ZZrt2XVXRz3gmGJ3GuWV6,Necesito De Ti,Roberto Orellana,284160,1993-02-12,1993,0.253,0.275,0.255,0.0,0.14,-13.73,0.0313,186.122,0.182,1.0,0.0,48,False,latin christian
4Ssgx7QJr0fzabt4D4JZ1b,New Madrid,Uncle Tupelo,211813,1993-10-01,1993,0.0171,0.711,0.489,0.000663,0.0836,-11.164,0.0301,125.494,0.628,1.0,9.0,40,False,"alternative country, heartland rock, roots rock, singer-songwriter"
11vrQj1I2XWt7ul8O2WTw2,Nabbed,Danny Elfman,184200,1993-10-12,1993,0.968,0.41,0.0555,0.765,0.0755,-23.869,0.0384,130.618,0.24,0.0,11.0,39,False,"orchestral soundtrack, soundtrack"
