id,name,artists,duration_ms,release_date,year,acousticness,danceability,energy,instrumentalness,liveness,loudness,speechiness,tempo,valence,mode,key,popularity,explicit,genre
186vMMyioGqrspihiD5bkI,Blue Christmas - 1991 Remix,The Beach Boys,190106,1964-11-09,1964,0.753,0.211,0.189,9.31e-06,0.114,-13.099,0.03,82.909,0.227,1.0,10.0,11,False,"baroque pop, classic rock, folk rock, mellow gold, psychedelic rock, rock, singer-songwriter, sunshine pop"
4G1shNKdcxz7CnTkPLFk9d,"Bye Bye Blackbird (feat. John Coltrane, Bill Evans, Cannonball Adderley, Paul Chambers & Jimmy Cobb) - Live at the Newport Jazz Festival, Newport, RI - July 1958","Miles Davis, John Coltrane, Bill Evans, Cannonball Adderley, Paul Chambers, Jimmy Cobb",550733,1964,1964,0.554,0.525,0.317,0.00037,0.266,-14.903,0.0558,129.668,0.501,1.0,0.0,8,False,"cool jazz, hard bop, jazz, jazz fusion, jazz trumpet, soul, vocal jazz"
2hsCzq4h6gb0TWFVCXaUsD,"Blue Monk - Live at the ""It"" Club, Los Angeles, CA - Oct/Nov 1964",Thelonious Monk,680466,1964,1964,0.788,0.578,0.398,0.102,0.503,-14.751,0.0623,123.279,0.64,0.0,0.0,9,False,"bebop, contemporary post-bop, jazz, jazz piano, jazz trio"
7IMFCNVii0sAfDPN0Q2I8H,Blowin' In The Wind,Glen Campbell,147680,1964,1964,0.468,0.503,0.411,0.112,0.0929,-10.441,0.0365,183.583,0.935,1.0,10.0,7,False,"adult standards, arkansas country, classic country pop, country rock, folk rock, mellow gold, nashville sound, singer-songwriter, soft rock"
2fgcxNJczfnQ3We6lvaguE,Bizet: Carmen: Prélude,"Georges Bizet, Georges Prêtre, Orchestre du Théâtre National de l'Opéra de Paris",138933,1964,1964,0.365,0.328,0.464,0.0353,0.202,-11.866,0.0372,124.539,0.605,1.0,9.0,12,False,"classical, french opera, french romanticism, late romantic era"
2fJJilvmei8CKL29eR2gck,"Battle Hymn Of The Republic - Live On ""The Judy Garland Show"", 1963",Judy Garland,262548,1964-01-01,1964,0.909,0.33,0.871,0.0,0.753,-4.692,0.464,70.91,0.358,1.0,2.0,9,False,"adult standards, torch song, vocal jazz"
58N7prCcsFWkoJ8cHLbRsl,Berimbau,Nara Leão,153733,1964-01-01,1964,0.794,0.474,0.42,0.0,0.139,-7.204,0.0394,84.903,0.35,0.0,9.0,9,False,"bossa nova, brazilian jazz, mpb, samba, tropicalia, velha guarda"
1JLXOW8x6b9Ut6a6AkSxmP,"6 Piano Pieces, Op. 118: No. 5 Romance in F Major","Johannes Brahms, Wilhelm Kempff",210666,1964-01-01,1964,0.994,0.272,0.00602,0.909,0.0849,-33.475,0.0403,68.935,0.131,1.0,5.0,14,False,"classical, german romanticism, late romantic era"
2SKt1Vb1Gzvi9OvWAK3MqI,"Bemsha Swing - Live at the ""It"" Club, Los Angeles, CA - Oct/Nov 1964",Thelonious Monk,513666,1964,1964,0.686,0.434,0.398,0.138,0.476,-15.694,0.0734,177.615,0.669,1.0,0.0,5,False,"bebop, contemporary post-bop, jazz, jazz piano, jazz trio"
3yZQIZ5Nk4kZ84fNxrhuq7,"Blues Five Spot - Live at the ""It"" Club, Los Angeles, CA - Oct/Nov 1964",Thelonious Monk,612640,1964,1964,0.596,0.488,0.321,0.116,0.541,-17.575,0.05,143.979,0.68,1.0,8.0,5,False,"bebop, contemporary post-bop, jazz, jazz piano, jazz trio"
49OlIvMSo34csVvenwImLR,White Christmas - 1991 Remix,The Beach Boys,149560,1964-11-09,1964,0.838,0.258,0.212,2.85e-05,0.329,-13.942,0.0302,87.733,0.163,1.0,7.0,11,False,"baroque pop, classic rock, folk rock, mellow gold, psychedelic rock, rock, singer-songwriter, sunshine pop"
0PRi09hMSJTgQlywNVt4xq,Bull Durham,Glen Campbell,126640,1964,1964,0.363,0.712,0.546,0.973,0.114,-11.87,0.0451,81.129,0.966,1.0,7.0,5,False,"adult standards, arkansas country, classic country pop, country rock, folk rock, mellow gold, nashville sound, singer-songwriter, soft rock"
24pZxIXNIw4u7noxFU8VPw,"Three Dance Episodes (From ""On the Town""): III. Times Square: 1944","Leonard Bernstein, New York Philharmonic",279413,1964,1964,0.739,0.348,0.415,0.648,0.0602,-13.346,0.0635,93.385,0.327,1.0,5.0,13,False,"american modern classical, classical, orchestral performance"
2eiHxuNVWOQh2OtqG1Rgem,"Lewis' Boogie - Live At The Star-Club, Hamburg, Germany/1964",Jerry Lee Lewis,125506,1964,1964,0.0722,0.401,0.9,0.00546,0.623,-6.954,0.147,93.166,0.622,1.0,0.0,15,False,"piano rock, rock-and-roll, rockabilly"
4khfmq0rmcRUI5AOhvtLSE,In Your Own Sweet Way (Take 1),Bill Evans Trio,418253,1964,1964,0.753,0.404,0.245,0.8,0.119,-15.601,0.0433,78.641,0.288,0.0,10.0,12,False,"bebop, contemporary post-bop, jazz, jazz trio"
6NfnD3eVDdicKVNcVUQagn,"Ballade No. 1 in G Minor, Op. 23","Frédéric Chopin, Vladimir Horowitz",548533,1964,1964,0.987,0.31,0.16,0.902,0.36,-20.558,0.041,94.178,0.04,0.0,7.0,4,False,"classical, early romantic era, polish classical"
03PkhOIWpzxJJjvDNqmJG3,"Beggar Man - Live at Ulster Hall, Belfast, Ireland - August 1964","The Clancy Brothers, Tommy Makem",131120,1964-12-21,1964,0.856,0.615,0.591,5.6e-05,0.68,-15.874,0.208,102.763,0.912,1.0,6.0,2,False,"irish folk, irish pub song"
0hOhtlO9zQT2yhLjgnK5KK,"Ba-lue Bolivar Ba-lues-are - Live at the ""It"" Club, Los Angeles, CA - Oct/Nov 1964",Thelonious Monk,540640,1964,1964,0.358,0.553,0.499,0.0561,0.622,-14.251,0.041,75.021,0.581,1.0,8.0,3,False,"bebop, contemporary post-bop, jazz, jazz piano, jazz trio"
5TH2OT2g0aYBUaUx6XcuVu,"Bright Mississippi - Live at the ""It"" Club, Los Angeles, CA - Oct/Nov 1964",Thelonious Monk,586760,1964,1964,0.401,0.499,0.65,0.015,0.565,-11.139,0.0421,112.384,0.723,1.0,10.0,3,False,"bebop, contemporary post-bop, jazz, jazz piano, jazz trio"
2Bvop18leb1y14k1Sbk07O,"Bye, Bye Blackbird - Live At The Americana Hotel, New York, 1964",Julie London,150976,1964-01-01,1964,0.649,0.431,0.0986,0.00625,0.633,-23.028,0.0818,131.735,0.37,0.0,9.0,4,False,"torch song, vocal jazz"
3bh3aQUl8gWEL6p9WfFswv,Berceuse,Jean Ferrat,200666,1964,1964,0.834,0.224,0.328,4.59e-06,0.216,-7.913,0.0334,80.94,0.273,1.0,5.0,13,False,chanson
77D6ThR6tshLgZUkeve8hG,"Two Bass Hit (feat. John Coltrane, Bill Evans, Cannonball Adderley, Paul Chambers & Jimmy Cobb) - Live at the Newport Jazz Festival, Newport, RI - July 1958","Miles Davis, John Coltrane, Bill Evans, Cannonball Adderley, Paul Chambers, Jimmy Cobb",250626,1964,1964,0.392,0.408,0.646,0.00096,0.642,-13.047,0.0482,76.731,0.646,1.0,0.0,7,False,"cool jazz, hard bop, jazz, jazz fusion, jazz trumpet, soul, vocal jazz"
66JCdyH8sUGPZB1zDhxw56,"Don't Smoke In Bed - Live At Carnegie Hall, New York, 1964",Nina Simone,328426,1964-01-01,1964,0.988,0.31,0.0976,0.0484,0.707,-19.352,0.0441,83.679,0.103,0.0,4.0,18,False,"jazz blues, neo soul, soul, soul jazz, torch song, vocal jazz"
3qwu0TpSb2AGNzqUpOcJcQ,"Galway Bay - Live at Carnegie Hall, New York, NY - March 17, 1963",The Clancy Brothers & Tommy Makem,109266,1964,1964,0.863,0.436,0.484,0.0,0.971,-19.05,0.588,120.231,0.534,1.0,8.0,9,False,"irish folk, irish pub song"
1QOT5PqbE2MGsXoama2vuA,Nipple Blood,Sherman and the Pudding Bandits,194999,1964-07-04,1964,0.0487,0.828,0.516,3.34e-05,0.161,-9.944,0.0398,87.473,0.907,1.0,5.0,6,False,
5ArSCWGmvJJhMjxwUaf8dQ,Don't Pop the Baby,Sherman and the Pudding Bandits,134206,1964-07-04,1964,0.251,0.805,0.45,1.61e-06,0.0879,-10.082,0.0369,127.896,0.956,1.0,0.0,6,False,
2JC2x01R51NyLxhR7LbjM5,"Oh Baby, Don't You Weep - Live At The Royal Theatre/1964",James Brown,417426,1964-01-01,1964,0.14,0.614,0.487,1.56e-05,0.779,-16.479,0.0628,98.21,0.649,1.0,11.0,8,False,"funk, soul, vocal jazz"
795QlEKGrXfnXilRyWumOI,Everybody But You,The Skyliners,148346,1964-01-01,1964,0.78,0.33,0.398,0.000228,0.136,-8.971,0.0253,91.513,0.384,1.0,1.0,7,False,doo-wop
6gtl4xOff5bo1AgAH7udZQ,"Introduction By Willis Connover - Live at the Newport Jazz Festival, Newport, RI - July 1958",Miles Davis,135800,1964,1964,0.132,0.554,0.334,0.000571,0.0671,-20.048,0.579,132.981,0.188,1.0,0.0,7,False,"cool jazz, hard bop, jazz, jazz fusion, jazz trumpet, soul, vocal jazz"
4ma2FUE8y3Vgl0LajiO5HM,"Fran-Dance (feat. John Coltrane, Bill Evans, Cannonball Adderley, Paul Chambers & Jimmy Cobb) - Live at the Newport Jazz Festival, Newport, RI - July 1958","Miles Davis, John Coltrane, Bill Evans, Cannonball Adderley, Paul Chambers, Jimmy Cobb",433706,1964,1964,0.743,0.608,0.232,0.00178,0.0599,-16.372,0.0481,114.881,0.449,0.0,10.0,8,False,"cool jazz, hard bop, jazz, jazz fusion, jazz trumpet, soul, vocal jazz"
0BCklXiq6WZmq34qnwFDKL,"Parsifal, WWV 111: Prelude - Live","Richard Wagner, Bayreuth Festival Orchestra, Hans Knappertsbusch",722000,1964-01-01,1964,0.97,0.109,0.0819,0.935,0.813,-23.709,0.0354,85.752,0.0343,1.0,8.0,6,False,"classical, german opera, german romanticism, late romantic era"
6KBp7G4sgXwO8FA2wYuDmL,"Oro Se Do Bheatha Bhaile - Live at Carnegie Hall, New York, NY - March 17, 1963",The Clancy Brothers & Tommy Makem,132266,1964,1964,0.962,0.456,0.45,0.0,0.806,-15.345,0.344,77.168,0.706,1.0,10.0,10,False,"irish folk, irish pub song"
22OgayPnnqE3kX8b7SrC6r,"Psalm 143 ""Hear My Prayer, O Lord""","Matthew Camidge, Joseph Pring, Choir of King's College, Cambridge, Sir David Willcocks",211266,1964-01-01,1964,0.984,0.261,0.0473,0.0671,0.375,-31.217,0.0478,84.319,0.121,1.0,8.0,5,False,
4Kb7mrFLC2nknpBx2v5al2,"La Bohème (1991 Digital Remaster), Act I: Sì. Mi chiamano Mimì (Mimì/Rodolfo)","Giacomo Puccini, Nicolai Gedda, Thomas Schippers, Orchestra Del Teatro Dell'Opera Di Roma",293760,1964,1964,0.986,0.211,0.0633,8.55e-06,0.129,-18.91,0.058,180.545,0.0448,1.0,2.0,15,False,"classical, italian opera, italian romanticism, post-romantic era"
3uzUhHtxqbiYr4TNTbZXu4,La Bamba,Glen Campbell,128093,1964,1964,0.321,0.586,0.719,0.933,0.116,-9.872,0.0359,165.08,0.968,1.0,10.0,6,False,"adult standards, arkansas country, classic country pop, country rock, folk rock, mellow gold, nashville sound, singer-songwriter, soft rock"
3DwLt7dy2UTuevJOKpdK5V,Mes mains - Nouvelle version de 1964,Gilbert Bécaud,163880,1964,1964,0.735,0.399,0.327,0.0,0.113,-9.586,0.037,85.294,0.253,1.0,1.0,25,False,chanson
2Lq8tG2Gqxc0VsWjD2BgOe,"Symphony No. 1 in D Major ""Titan"": IV. Stürmisch bewegt - Energisch","Gustav Mahler, Leonard Bernstein, New York Philharmonic",1136546,1964,1964,0.83,0.179,0.147,0.859,0.104,-17.423,0.0349,89.891,0.0608,1.0,1.0,7,False,"classical, post-romantic era"
2Iz7jlWfqO6Dzaif2qTYbN,"Symphony No. 1 in D Major ""Titan"": I. Langsam. Schleppend","Gustav Mahler, Leonard Bernstein, New York Philharmonic",909680,1964,1964,0.804,0.139,0.0812,0.802,0.12,-20.672,0.0359,77.103,0.0759,1.0,5.0,8,False,"classical, post-romantic era"
2tbqFjZSKOtHfOJrjraseo,"Hello, Young Lovers (From the 1951 Broadway Production of ""The King and I"")",Jimmy Durante,185813,1964,1964,0.88,0.354,0.319,0.000253,0.169,-11.934,0.038,77.321,0.215,1.0,2.0,11,False,"adult standards, lounge"
26VnsWJf80bpnQYWZLbPJL,"The Theme (feat. John Coltrane, Bill Evans, Cannonball Adderley, Paul Chambers & Jimmy Cobb) - Live at the Newport Jazz Festival, Newport, RI - July 1958","Miles Davis, John Coltrane, Bill Evans, Cannonball Adderley, Paul Chambers, Jimmy Cobb",168666,1964,1964,0.388,0.507,0.497,0.0383,0.746,-15.195,0.073,144.656,0.55,1.0,0.0,6,False,"cool jazz, hard bop, jazz, jazz fusion, jazz trumpet, soul, vocal jazz"
0h108wDjpHSDJVtmW3Yzkr,My Baby Left Me - Version 1,Dave Berry,122413,1964,1964,0.136,0.64,0.654,3.97e-06,0.518,-12.22,0.0459,120.677,0.971,0.0,0.0,12,False,british invasion
7DXknWEiikbzhkxr9FZefb,Main Title Theme - Isandhlwana 1879,John Barry,135109,1964-11-10,1964,0.847,0.426,0.316,0.000315,0.175,-16.277,0.0788,108.27,0.335,1.0,0.0,8,False,"british soundtrack, classic soundtrack, orchestral soundtrack"
2KGunZsIu9Rg9bCYL8MYfG,"My Babe - Live At The Bohemian Caverns, Washington, D.C., 1964",Ramsey Lewis Trio,241373,1964-01-01,1964,0.866,0.613,0.363,0.93,0.694,-17.112,0.0566,122.037,0.824,1.0,2.0,6,False,soul jazz
5aiMM39Nc2T4L2iWMSFcJX,Chopin Waltz No. 10 in B Minor,Chet Atkins,227840,1964-07-01,1964,0.968,0.516,0.235,0.891,0.106,-13.976,0.0525,125.412,0.511,0.0,9.0,8,False,nashville sound
3u5leNtj00dJV0J5p7RAth,Vou Por Ai,Nara Leão,125093,1964-01-01,1964,0.739,0.196,0.237,1.45e-05,0.18,-9.337,0.0346,199.253,0.205,0.0,2.0,6,False,"bossa nova, brazilian jazz, mpb, samba, tropicalia, velha guarda"
6bfIHY56jWujcHjLoEH4sc,"Chichester Psalms: III. Psalm 131 ""Adonai, Adonai"" - Psalm 133:1 ""Hineh mah tov""","Leonard Bernstein, New York Philharmonic",554066,1964,1964,0.925,0.158,0.0409,0.944,0.0722,-26.808,0.0383,93.05,0.0392,1.0,7.0,4,False,"american modern classical, classical, orchestral performance"
0sUoFYKuqQ8YP5kAdJT7WS,"Chichester Psalms: I. Psalm 108:2 ""Urah, hanevel, v'chinor!"" - Psalm 100 ""Hariu l'Adonai kol haarets""","Leonard Bernstein, New York Philharmonic",213640,1964,1964,0.669,0.38,0.324,0.00035,0.198,-16.598,0.0436,134.727,0.209,1.0,0.0,4,False,"american modern classical, classical, orchestral performance"
0bbJUTqy89rLuRIS7PTBG9,"Symphony No. 1 in D Major ""Titan"": III. Feierlich und gemessen, ohne zu schleppen","Gustav Mahler, Leonard Bernstein, New York Philharmonic",618826,1964,1964,0.903,0.0946,0.0496,0.889,0.137,-27.296,0.0392,77.859,0.129,0.0,9.0,8,False,"classical, post-romantic era"
5wNrlHFnuKYkF2pizxJhh9,"Symphony No. 1 in D Major ""Titan"": II. Kräftig bewegt, doch nicht zu schnell","Gustav Mahler, Leonard Bernstein, New York Philharmonic",498400,1964,1964,0.905,0.252,0.109,0.673,0.108,-19.443,0.0475,171.819,0.197,1.0,9.0,6,False,"classical, post-romantic era"
00L6AkGVZGsL2DEWNG1nns,"Intermezzi, Op. 117: No. 1 in E-Flat Major","Johannes Brahms, Wilhelm Kempff",277000,1964-01-01,1964,0.995,0.405,0.0031,0.938,0.103,-33.203,0.0422,80.731,0.155,1.0,3.0,5,False,"classical, german romanticism, late romantic era"
5bfhcVsIPsb8D454CSOlvR,In Your Own Sweet Way - (Take 1),Bill Evans Trio,417000,1964,1964,0.805,0.394,0.105,0.824,0.126,-23.809,0.0421,75.419,0.318,0.0,10.0,7,False,"bebop, contemporary post-bop, jazz, jazz trio"
4EuFMPZc9DLVC2Rwg8hXPK,"Something You Got - Live At The Bohemian Caverns, Washington, D.C., 1964",Ramsey Lewis Trio,218893,1964-01-01,1964,0.452,0.628,0.646,0.308,0.971,-14.613,0.0619,113.629,0.734,1.0,7.0,7,False,soul jazz
5YfggiGVTWlDhWp53I4wJ6,"Steamboat Whistle Blues - Live at Vanderbilt University, Nashville, TN - May 1963",Flatt & Scruggs,163440,1964-07-01,1964,0.799,0.674,0.536,0.000123,0.678,-14.76,0.0628,118.81,0.689,1.0,10.0,4,False,"banjo, bluegrass, bluegrass gospel, traditional country"
35EfgbWftftrV0f6mnz8SR,"Love in a Home - From the Broadway Prod. Of 1956 ""Li'l Abner""",Jimmy Durante,176613,1964,1964,0.834,0.357,0.315,0.00011,0.212,-11.511,0.0399,82.577,0.389,1.0,10.0,7,False,"adult standards, lounge"
1u5enEni1FJduTlaSzXD3n,Fool #1,Loretta Lynn,140480,1964-06-22,1964,0.749,0.723,0.353,7.14e-06,0.0701,-7.024,0.0263,98.021,0.53,1.0,0.0,5,False,"classic country pop, country, country rock, nashville sound"
1wlmzIQgzbMcTPPmlRfLLz,"High Heel Sneakers - Live At The Municipal Auditorium, Birmingham, Alabama/1964",Jerry Lee Lewis,218066,1964-07-01,1964,0.5,0.403,0.875,0.000321,0.951,-9.319,0.0529,147.798,0.536,1.0,0.0,8,False,"piano rock, rock-and-roll, rockabilly"
2L8QMbzt6ivEdQ3aQIJ8cK,"Whole Lotta Shakin' Goin' On - Live At The Municipal Auditorium, Birmingham, Alabama/1964",Jerry Lee Lewis,307040,1964-07-01,1964,0.29,0.286,0.96,0.000326,0.926,-8.585,0.178,91.464,0.34,1.0,5.0,10,False,"piano rock, rock-and-roll, rockabilly"
2L59DztrMdcghK7mRy25Cn,"Chaconne in E Minor, BuxWV 160","Dietrich Buxtehude, Kenneth Gilbert",338333,1964-03-05,1964,0.922,0.162,0.19,0.892,0.124,-16.247,0.0324,67.333,0.136,0.0,4.0,5,False,"baroque, classical, early music"
2QeMmEdOtphVxvDo3eRDsD,Wrap Myself Up (In Your Skin),Sherman and the Pudding Bandits,227063,1964-07-04,1964,0.284,0.624,0.443,0.0,0.208,-10.463,0.0401,186.216,0.82,1.0,0.0,3,False,
0lFxEbyNikODNahbQ2gGy1,"Johnson's Motor Car - Live at Carnegie Hall, New York, NY - March 17, 1963",The Clancy Brothers & Tommy Makem,110600,1964,1964,0.757,0.634,0.706,2.28e-06,0.954,-13.272,0.529,128.168,0.815,1.0,0.0,8,False,"irish folk, irish pub song"
6Y9K2whNIbJz3dx2R6shyD,"Reilly's Daughter - Live at Carnegie Hall, New York, NY - March 17, 1963",The Clancy Brothers & Tommy Makem,104933,1964,1964,0.694,0.608,0.844,0.0,0.973,-12.88,0.725,127.965,0.628,1.0,6.0,9,False,"irish folk, irish pub song"
712yXHwIaDMxrhVCnVwqj1,"Maggie Blues - Live at Vanderbilt University, Nashville, TN - May 1963",Flatt & Scruggs,131960,1964-07-01,1964,0.691,0.394,0.508,0.92,0.182,-14.554,0.0422,134.492,0.817,1.0,7.0,2,False,"banjo, bluegrass, bluegrass gospel, traditional country"
54casu0iL84To824OMSbSk,"Cannonball Blues - Live at Vanderbilt University, Nashville, TN - May 1963",Flatt & Scruggs,136533,1964-07-01,1964,0.795,0.562,0.39,0.876,0.113,-19.97,0.0483,121.636,0.913,1.0,7.0,3,False,"banjo, bluegrass, bluegrass gospel, traditional country"
1ioeuYcoRVxsfCpTFd4jsG,"Going Back to Harlan - Live at Vanderbilt University, Nashville, TN - May 1963",Flatt & Scruggs,98133,1964-07-01,1964,0.591,0.356,0.515,0.00122,0.944,-15.107,0.1,170.191,0.947,1.0,7.0,2,False,"banjo, bluegrass, bluegrass gospel, traditional country"
0TWWqLwNMtCr2Pka8oPLoe,"My Baby Just Cares For Me - Live At The Americana Hotel, New York, 1964",Julie London,219000,1964-01-01,1964,0.789,0.367,0.242,1.05e-06,0.713,-12.579,0.0419,92.728,0.129,1.0,7.0,5,False,"torch song, vocal jazz"
4QBEFjLeClxRfwlotkmgYh,Make Believe Ballroom,Charlie Barnet And His Glen Island Casino Orchestra,149645,1964-01-01,1964,0.963,0.585,0.457,0.0253,0.377,-11.147,0.0561,172.645,0.932,0.0,10.0,1,False,
2ohd9wQGGEuSMGmR0YJ5E3,"Violin Concerto in E Major, BWV 1042 (Arranged by John Williams for Guitar and Orchestra): II. Adagio","Johann Sebastian Bach, John C. Williams, Kenneth Sillito, Academy of St. Martin in the Fields",400360,1964,1964,0.972,0.292,0.045,0.88,0.114,-24.957,0.0343,104.481,0.128,0.0,1.0,4,False,"baroque, classical, early music, german baroque"
14ItsemeMVKiZBnGiajQ8E,"Violin Partita No. 2 in D Minor, BWV 1004: V. Chaconne (Transcribed for Guitar by John Williams)","Johann Sebastian Bach, John C. Williams",831440,1964,1964,0.957,0.37,0.0945,0.893,0.116,-24.223,0.0555,122.608,0.189,1.0,2.0,6,False,"baroque, classical, early music, german baroque"
1QOAPynvsjbD4iZ8tjpF45,"Violin Concerto in E Major, BWV 1042 (Arranged by John Williams for Guitar and Orchestra): I. Allegro","Johann Sebastian Bach, John C. Williams, Kenneth Sillito, Academy of St. Martin in the Fields",485373,1964,1964,0.937,0.614,0.359,0.882,0.105,-18.353,0.0423,89.644,0.752,1.0,4.0,5,False,"baroque, classical, early music, german baroque"
0enTVaXFNcQTHpsT1IWQK1,O Morro (Feio Nao E Bonito),Nara Leão,185173,1964-01-01,1964,0.307,0.489,0.578,0.0,0.104,-5.098,0.0292,84.246,0.473,0.0,7.0,17,False,"bossa nova, brazilian jazz, mpb, samba, tropicalia, velha guarda"
6ZjpsZ5mmMmM7rMqK4nOLz,"Back Road - Rudy Van Gelder, 2000 Remaster",Joe Henderson,379786,1964-05-01,1964,0.806,0.567,0.424,0.3,0.113,-9.935,0.0384,128.265,0.613,0.0,5.0,19,False,"bebop, contemporary post-bop, hard bop, jazz, jazz saxophone"
7Lp6IeOe4bppPHmHW6ySkn,Barbara Polka,Walter Ostanek,119133,1964-01-01,1964,0.114,0.786,0.522,0.301,0.0388,-11.464,0.0359,129.493,0.987,1.0,10.0,15,False,polka
1KQr7XLIu4sCMtWSjEGljb,Bedtime Story,Tammy Wynette,254426,1964,1964,0.746,0.534,0.197,0.0,0.104,-13.441,0.0336,113.681,0.368,1.0,9.0,15,False,"country, country dawn, nashville sound"
1uZJnNyFA98H3rpSU5YHK2,Blue Star (The Medic Theme),The Ventures,137426,1964-01-01,1964,0.649,0.578,0.693,0.628,0.827,-7.809,0.0289,103.373,0.373,0.0,1.0,18,False,surf music
30kPKdxPGlHmXPuFMqgttt,Blackbird - Mono; Single Edit; 2017 Remaster,Nina Simone,234426,1964,1964,0.769,0.752,0.238,0.154,0.105,-17.8,0.0762,94.156,0.249,1.0,7.0,10,False,"jazz blues, neo soul, soul, soul jazz, torch song, vocal jazz"
7iUHbt1DhPnsg447goOVi7,Bristol Stomp,The Dovells,138853,1964-01-01,1964,0.6,0.657,0.757,0.0,0.51,-7.187,0.0588,105.363,0.931,1.0,2.0,3,False,"doo-wop, rhythm and blues"
1iFmBZsabnie1orMfdbzCN,Monster Mash - Live / 2001 Remastered,The Beach Boys,147600,1964-10-19,1964,0.502,0.541,0.951,0.0336,0.903,-6.058,0.152,132.216,0.466,1.0,0.0,11,False,"baroque pop, classic rock, folk rock, mellow gold, psychedelic rock, rock, singer-songwriter, sunshine pop"
5Ge6hzsuQ4GJ3uN7mhMIBg,Buying Spree,William Loose,75541,1964-01-01,1964,0.883,0.551,0.528,0.933,0.551,-13.315,0.0332,107.465,0.869,1.0,7.0,5,False,
55FYnuvROAef5K0iqYUU7w,Between Twenty-Nine and Danger,Tammy Wynette,187960,1964,1964,0.295,0.667,0.309,3.28e-06,0.11,-14.519,0.0326,88.178,0.507,1.0,8.0,6,False,"country, country dawn, nashville sound"
4vdIuyAMWxfGYtvyImnXYe,Charade - 2001 Remaster,Bobby Darin,106760,1964-01-01,1964,0.448,0.601,0.635,0.0,0.0642,-10.347,0.124,129.198,0.527,0.0,2.0,14,False,"adult standards, easy listening, lounge, rock-and-roll, rockabilly, vocal jazz"
1juhQsSMMpqaBfzFIdaNWs,"Fun, Fun, Fun - Live / 2001 Remastered",The Beach Boys,146200,1964-10-19,1964,0.0409,0.421,0.97,0.00756,0.511,-6.493,0.0731,82.075,0.749,1.0,4.0,11,False,"baroque pop, classic rock, folk rock, mellow gold, psychedelic rock, rock, singer-songwriter, sunshine pop"
14vnPI3ekoda1reLyJ71PX,Little Deuce Coupe - Live / 2001 Remastered,The Beach Boys,147200,1964-10-19,1964,0.402,0.491,0.94,8.69e-06,0.902,-6.348,0.132,143.478,0.77,1.0,8.0,10,False,"baroque pop, classic rock, folk rock, mellow gold, psychedelic rock, rock, singer-songwriter, sunshine pop"
40xXTcZn0fJ9EZl0lU5JZP,I Believe,Tammy Wynette,132800,1964,1964,0.854,0.463,0.192,3.78e-05,0.1,-13.375,0.0292,100.356,0.259,1.0,9.0,14,False,"country, country dawn, nashville sound"
0i66pmtkW9qScIcAkpQbMg,"Goodbye, Charlie - 2001 Remaster",Bobby Darin,142666,1964-01-01,1964,0.604,0.29,0.655,0.0,0.205,-10.391,0.0649,200.456,0.693,1.0,1.0,14,False,"adult standards, easy listening, lounge, rock-and-roll, rockabilly, vocal jazz"
42PnXfiRa9IQI1Cv1XBVUl,On Broadway (2019 - Remaster),The Dave Clark Five,158933,1964-06-01,1964,0.481,0.718,0.54,0.0,0.0781,-6.862,0.0356,121.313,0.896,1.0,10.0,13,False,"british invasion, merseybeat"
7cIosjei8U5YAUDjz5EO5b,In My Room - Live / 2001 Remastered,The Beach Boys,145173,1964-10-19,1964,0.104,0.424,0.701,2.09e-05,0.685,-7.916,0.0317,103.235,0.324,1.0,11.0,9,False,"baroque pop, classic rock, folk rock, mellow gold, psychedelic rock, rock, singer-songwriter, sunshine pop"
3YBbe4daAosdMHrzh2y07x,Breakaway - 2005 Digital Remaster,Jackie DeShannon,137586,1964-10-01,1964,0.102,0.495,0.906,0.0,0.194,-6.528,0.061,119.788,0.511,1.0,7.0,4,False,brill building pop
1FZtXt6t1wZKYCJgn4qjfC,Brace Yourself - 2013 Remaster,Ben E. King,124480,1964-08-24,1964,0.883,0.643,0.598,0.0,0.363,-8.216,0.0549,142.164,0.886,1.0,10.0,7,False,"rock-and-roll, soul"
5WEmpbtayIUef21tCbiCIA,Graduation Day - Live / 2001 Remastered,The Beach Boys,208666,1964-10-19,1964,0.638,0.42,0.702,0.0,0.566,-8.644,0.148,70.955,0.533,1.0,7.0,8,False,"baroque pop, classic rock, folk rock, mellow gold, psychedelic rock, rock, singer-songwriter, sunshine pop"
6uh0H2aHYcKwvfPif5Nfaw,The Wanderer - Live / 2001 Remastered,The Beach Boys,119768,1964-10-19,1964,0.574,0.333,0.927,1.99e-05,0.837,-5.322,0.081,135.864,0.657,1.0,4.0,9,False,"baroque pop, classic rock, folk rock, mellow gold, psychedelic rock, rock, singer-songwriter, sunshine pop"
2iSPa4RpFADQiK0p4zcUlJ,Buffalo Gals,"Woody Guthrie, Cisco Houston, Sonny Terry",156946,1964-01-01,1964,0.98,0.495,0.513,0.652,0.146,-11.675,0.041,131.022,0.843,1.0,2.0,3,False,"american folk revival, folk, protest folk, singer-songwriter, traditional blues, traditional folk"
0hkcnxnXqzhQQzJpqNC4AE,By the Way - 2007 Remaster,Lee Hazlewood,160493,1964-06-15,1964,0.808,0.566,0.269,0.0,0.154,-13.291,0.0259,77.579,0.588,1.0,9.0,3,False,"baroque pop, classic oklahoma country, singer-songwriter"
5AD6zxwoDd3NT16DLWAJIK,Blues For A Four String Guitar - 2006 Remaster,Lou Rawls,210133,1964-01-01,1964,0.662,0.445,0.694,0.0,0.248,-5.94,0.0553,77.694,0.532,1.0,3.0,3,False,"classic soul, disco, motown, philly soul, quiet storm, soul, soul blues"
6cp3GWNbU2zpkqIKlcY8s2,Where Love Has Gone - 2001 Remaster,Bobby Darin,163066,1964-01-01,1964,0.886,0.32,0.264,1.56e-06,0.132,-10.957,0.0295,85.954,0.259,1.0,10.0,14,False,"adult standards, easy listening, lounge, rock-and-roll, rockabilly, vocal jazz"
3v3mmoLAtzEQAz9H6R1s3K,Blue Monday (2019 - Remaster),The Dave Clark Five,176880,1964-08-03,1964,0.304,0.636,0.528,0.232,0.224,-9.14,0.0278,114.865,0.764,1.0,0.0,4,False,"british invasion, merseybeat"
4O8rHLRKLyJZJTzpqcqj5w,Blue Velvet,Jackie Gleason,167360,1964-01-01,1964,0.972,0.131,0.112,0.903,0.0728,-23.113,0.0385,75.376,0.112,1.0,10.0,3,False,"easy listening, lounge"
2PRJD595ygGzP34gVPe0J6,Let's Go Trippin' - Live / 2001 Remastered,The Beach Boys,154552,1964-10-19,1964,0.362,0.29,0.975,0.184,0.53,-5.022,0.242,88.649,0.606,1.0,4.0,7,False,"baroque pop, classic rock, folk rock, mellow gold, psychedelic rock, rock, singer-songwriter, sunshine pop"
7rdqx7d4l8MBfxbRjlc7Zz,Hawaii - Live / 2001 Remastered,The Beach Boys,111200,1964-10-19,1964,0.403,0.38,0.875,0.0,0.624,-6.474,0.0741,82.543,0.852,1.0,7.0,7,False,"baroque pop, classic rock, folk rock, mellow gold, psychedelic rock, rock, singer-songwriter, sunshine pop"
3ugqnJMyTH6QqpwVOm0Xnz,Why Do Fools Fall in Love (Mono),The Beach Boys,127616,1964-03-02,1964,0.47,0.39,0.686,0.0,0.154,-7.098,0.0312,82.613,0.921,1.0,5.0,10,False,"baroque pop, classic rock, folk rock, mellow gold, psychedelic rock, rock, singer-songwriter, sunshine pop"
57Wz1KiaBw2z6jvZ2V7A98,Why Do Fools Fall in Love (Stereo),The Beach Boys,130360,1964-03-02,1964,0.438,0.371,0.705,0.0,0.145,-7.291,0.0393,82.206,0.577,1.0,5.0,10,False,"baroque pop, classic rock, folk rock, mellow gold, psychedelic rock, rock, singer-songwriter, sunshine pop"
11kAy9rOr7Uyn5WxYHEILh,The End Of Never - 2001 Remaster,Bobby Darin,159200,1964-01-01,1964,0.911,0.185,0.257,0.00741,0.117,-12.09,0.0331,77.484,0.0869,1.0,0.0,11,False,"adult standards, easy listening, lounge, rock-and-roll, rockabilly, vocal jazz"
4IFAl3XqjVrhu3wLneJ1Xn,Fancy Free Ballet: I. Enter Three Sailors,Leonard Bernstein,170040,1964,1964,0.846,0.5,0.319,0.776,0.378,-16.138,0.0429,104.69,0.376,0.0,7.0,7,False,"american modern classical, classical, orchestral performance"
