id,name,artists,duration_ms,release_date,year,acousticness,danceability,energy,instrumentalness,liveness,loudness,speechiness,tempo,valence,mode,key,popularity,explicit,genre
625IqdLPgkOw7vHyi22F79,Living in Darkness,Agent Orange,253066,1981,1981,0.498,0.207,0.906,2.29e-05,0.165,-8.201,0.0654,185.602,0.442,1.0,9.0,30,False,"hardcore punk, punk, surf punk"
0wgXzjgHh13xFz9S92SZpN,Your Love - Radio Edit,Lime,242733,1981,1981,0.00213,0.771,0.752,0.713,0.0414,-8.49,0.0378,138.161,0.752,0.0,0.0,56,False,"hi-nrg, italo disco"
33OwJC03RAnXDp086RT41S,La Cumbia Barulera,La Sonora Dinamita,163251,1981-09-13,1981,0.17,0.416,0.881,0.0,0.278,-5.768,0.0463,194.964,0.938,1.0,7.0,31,False,"cumbia, ranchera, salsa colombiana, tropical"
5vjsIox5BJAP1YIERBLdfn,Lullaby,Alain Presencer,168800,1981-01-01,1981,0.987,0.174,0.00389,0.807,0.119,-38.254,0.0497,78.663,0.0308,1.0,0.0,33,False,
4qpYMHU0JWyhX56M9J82Dn,Lorelei,Tom Tom Club,305466,1981-09-09,1981,0.0606,0.838,0.474,0.619,0.105,-14.273,0.0413,128.636,0.975,1.0,0.0,28,False,"dance rock, new wave, no wave"
1iPbcdvxT4WVG0Irt98uL3,Love Has Come Around,Donald Byrd,472866,1981,1981,0.0888,0.727,0.724,0.271,0.292,-8.982,0.0398,111.741,0.519,0.0,2.0,33,False,"bebop, hard bop, jazz, jazz funk, jazz trumpet, soul jazz"
7Ck20OK7r9MBJYrF4nCeuY,Pa'Que Sientas Lo Que Siento,Los Baron De Apodaca,192466,1981-01-01,1981,0.125,0.759,0.538,2.7e-06,0.0788,-6.217,0.0341,100.674,0.765,1.0,9.0,46,False,norteno
0UD03iEKKl7AZllXappAUM,Lonesome Whistle,Little Feat,209426,1981,1981,0.352,0.684,0.483,0.0,0.448,-12.566,0.0328,120.019,0.962,1.0,0.0,28,False,"blues rock, country rock, electric blues, folk, folk rock, jam band, mellow gold, roots rock, southern rock, swamp rock"
2sSEnvy4GbDYbu2rESQc1a,Leader of the Band / Washington Post March,Dan Fogelberg,288466,1981-08,1981,0.889,0.607,0.092,0.0,0.0739,-21.067,0.0461,135.089,0.461,1.0,8.0,34,False,"classic rock, folk rock, mellow gold, singer-songwriter, soft rock, yacht rock"
5tHLI9JQD1n9w8wapOyvXx,Lloro Mi Corazon,Pastor Lopez,226949,1981-07-14,1981,0.386,0.696,0.621,0.0238,0.123,-9.166,0.0521,97.061,0.97,0.0,10.0,35,False,"cumbia, musica popular colombiana, tropical"
4j52tbi7dYkP09gJrJVO8K,The Look In Your Eyes - Live,"Maze, Frankie Beverly",451040,1981-01-09,1981,0.425,0.49,0.742,1.08e-05,0.987,-6.842,0.0416,94.65,0.671,1.0,5.0,28,False,"classic soul, funk, motown, neo soul, new jack swing, post-disco, quiet storm, soul, urban contemporary"
0juXlE2pWi7ErWYuCcd5ev,La petite valse,Gérard Lenorman,168626,1981-01-01,1981,0.913,0.474,0.49,0.0,0.18,-8.371,0.0494,77.016,0.631,1.0,9.0,52,False,"chanson, ye ye"
2bSPRjTehTdFwJAzm6HXgk,Let It Go - Remastered 2018,Def Leppard,283186,1981-07-11,1981,0.00444,0.409,0.915,0.0022,0.342,-7.205,0.0667,138.143,0.409,1.0,2.0,30,False,"album rock, classic rock, glam metal, hard rock, nwobhm, rock"
3BTvPgNPWviFyRg46ERlEr,Lonely Nights,Bryan Adams,226466,1981-07-12,1981,0.00514,0.505,0.633,2.58e-06,0.13,-10.189,0.0292,131.974,0.548,1.0,4.0,34,False,"canadian pop, canadian singer-songwriter, classic canadian rock, heartland rock, mellow gold, soft rock"
1wayFI8Xz98U0rck9v47J7,The Night Owls - Remastered 2022,Little River Band,322194,1981-08-01,1981,0.0184,0.587,0.698,0.00182,0.0875,-7.789,0.03,126.671,0.589,0.0,4.0,47,False,"album rock, classic rock, country rock, mellow gold, singer-songwriter, soft rock, yacht rock"
0iGNd4z2m80OjE2JcWmBSs,The Voice,The Moody Blues,316560,1981-05-15,1981,0.076,0.439,0.831,0.000462,0.127,-8.116,0.045,152.334,0.58,1.0,0.0,46,False,"album rock, art rock, british invasion, classic rock, country rock, flute rock, folk rock, mellow gold, progressive rock, rock, singer-songwriter, soft rock, symphonic rock"
689CSL6W1c4JdonfEB6q2L,Love Is Pain,Joan Jett & the Blackhearts,187560,1981-11-18,1981,0.00225,0.377,0.948,0.00411,0.405,-3.737,0.0402,112.07,0.639,1.0,2.0,31,False,"glam punk, rock"
0nhhq4M9oJH6SOj6h6PYEi,Lady Sun,"Earth, Wind & Fire",220933,1981-11-14,1981,0.234,0.79,0.895,0.000706,0.71,-8.797,0.145,127.182,0.564,0.0,5.0,32,False,"disco, funk, jazz funk, motown, soul"
1ruNQCGE5wAh4ouGcLjEcI,Letting You Go,Tom Petty and the Heartbreakers,202866,1981-05-05,1981,0.204,0.64,0.777,0.0,0.0654,-7.057,0.0338,106.624,0.679,1.0,5.0,26,False,"album rock, classic rock, hard rock, heartland rock, mellow gold, rock, singer-songwriter, soft rock"
5Iy8oh8ct6bDPcUJIvUZGP,Look At California - Live,"Maze, Frankie Beverly",663373,1981-01-09,1981,0.476,0.513,0.719,0.000194,0.937,-7.075,0.0586,128.337,0.702,0.0,6.0,26,False,"classic soul, funk, motown, neo soul, new jack swing, post-disco, quiet storm, soul, urban contemporary"
312qLrfYGCDSF2O56sZtZe,Labelled With Love,Squeeze,283800,1981,1981,0.0495,0.602,0.226,3.47e-06,0.0846,-17.864,0.0354,93.458,0.678,1.0,4.0,40,False,"beatlesque, new romantic, new wave, new wave pop, power pop, sophisti-pop"
6zEf9xxlJpOgTgFgFz0Qos,Love Song,Simple Minds,303626,1981-09-12,1981,0.00145,0.592,0.782,0.244,0.148,-8.875,0.0305,122.762,0.784,1.0,4.0,25,False,"album rock, dance rock, new romantic, new wave, new wave pop, rock, scottish new wave, soft rock"
2g4jJ32ZrfKHeyYNwfl40A,Like It or Not - 2007 Remaster,Genesis,298760,1981-09-18,1981,0.0238,0.438,0.796,0.00912,0.271,-8.671,0.0289,109.531,0.43,1.0,9.0,30,False,"album rock, art rock, classic rock, hard rock, mellow gold, new romantic, progressive rock, rock, soft rock, symphonic rock"
7lDo760vksTiXkqzJqNxXF,Looking For A Good Sign,Daryl Hall & John Oates,235533,1981,1981,0.183,0.86,0.867,1.38e-05,0.0583,-7.425,0.0438,118.827,0.964,1.0,0.0,29,False,"album rock, classic rock, mellow gold, rock, singer-songwriter, soft rock, yacht rock"
4S60EuX9dDV3GfcG06Tk3N,Si Me Quieres,Los Bukis,174426,1981-01-01,1981,0.0701,0.569,0.5,1.39e-05,0.202,-12.469,0.0324,95.999,0.769,1.0,9.0,42,False,"grupera, gruperas inmortales, musica mexicana"
0UTxUXHbo1igrXRnQTTTAE,Quiéreme Como Soy,Los Bukis,170426,1981-01-01,1981,0.514,0.493,0.83,7.77e-05,0.253,-9.449,0.0394,170.334,0.972,1.0,5.0,41,False,"grupera, gruperas inmortales, musica mexicana"
5yAcJtUiOFTdvePkHb4hs8,New Life,Depeche Mode,224173,1981-11-02,1981,0.122,0.659,0.873,0.297,0.0771,-7.975,0.0426,158.122,0.71,1.0,7.0,49,False,"dance rock, new romantic, new wave, permanent wave, rock, synthpop"
5gYH9rmaQbzSNTZFIsjt8I,Lost in a Moment,Sad Lovers & Giants,259560,1981-01-01,1981,0.521,0.328,0.82,0.000123,0.0838,-12.135,0.0471,87.667,0.693,0.0,0.0,31,False,"gothic rock, uk post-punk"
4XCvXkbtuPLs4bjDPpJvQW,'65 Love Affair,Paul Davis,233800,1981,1981,0.558,0.654,0.764,0.0,0.204,-4.046,0.0289,154.549,0.88,0.0,9.0,39,False,"soft rock, yacht rock"
1P2PVxcnbU21li3SCbqxFl,We Need Love To Live,"Maze, Frankie Beverly",288253,1981-01-09,1981,0.746,0.625,0.535,0.00331,0.0944,-8.274,0.0316,81.888,0.624,1.0,5.0,37,False,"classic soul, funk, motown, neo soul, new jack swing, post-disco, quiet storm, soul, urban contemporary"
60xOXI1zbcofQcLSq9346G,La Mitad Del Mundo,Ramon Ayala Y Sus Bravos Del Norte,217045,1981-07-01,1981,0.379,0.545,0.483,0.0,0.229,-6.515,0.08,150.743,0.363,1.0,8.0,23,False,"musica mexicana, norteno"
6MlgLxohy15iSnnrenWKGL,L' Elephant,Tom Tom Club,291160,1981-09-09,1981,0.0614,0.711,0.605,0.6,0.204,-15.807,0.0285,109.321,0.9,1.0,9.0,24,False,"dance rock, new wave, no wave"
2cd44XY8d2bmXS2cLNagC3,The Loneliest Man in Town,Side Effect,245760,1981-01-01,1981,0.801,0.482,0.181,0.00262,0.0816,-20.274,0.0455,132.565,0.524,0.0,2.0,29,False,
4MwIfjHioAW9RN40TN757u,Lost In Space,S.O.A.,43133,1981-03-01,1981,0.0117,0.389,0.805,0.648,0.332,-16.263,0.0787,96.434,0.451,1.0,7.0,26,False,"anarcho-punk, crust punk, dc hardcore, hardcore punk, punk"
4PHld19cwLHcLCKMmBsSB1,Living Eyes,Bee Gees,260733,1981-10-01,1981,0.0515,0.645,0.433,0.0,0.0901,-10.95,0.0244,94.457,0.342,1.0,10.0,37,False,"disco, mellow gold, soft rock"
6SDUhwv7kjWt4YVDSLsf8k,Too Young to Die,Agent Orange,124026,1981,1981,0.11,0.226,0.963,0.0005,0.179,-7.927,0.177,183.594,0.272,1.0,7.0,43,False,"hardcore punk, punk, surf punk"
75BdorOxqofBDoLW9mkjIE,Only A Lad,Oingo Boingo,237400,1981-06-19,1981,0.0399,0.655,0.783,0.00511,0.0677,-11.294,0.069,179.466,0.776,1.0,1.0,43,False,"dance rock, new romantic, new wave, zolo"
6mZNV5HXWZI6clrKcdNe8e,Lonely People,Styx,321573,1981-01-01,1981,0.0219,0.623,0.497,0.000341,0.513,-13.967,0.055,92.904,0.615,1.0,5.0,26,False,"album rock, classic rock, glam metal, hard rock, mellow gold, progressive rock, rock, soft rock"
2WJvcoVqoj5j6ciImA9orj,On the Loose,Saga,252821,1981-09-01,1981,0.0999,0.59,0.912,0.00177,0.153,-5.913,0.0366,134.892,0.683,1.0,10.0,43,False,progressive rock
1NYiFG8cdKEVDO0ZowYi3j,Life of Pain,Black Flag,170466,1981,1981,0.296,0.188,0.807,0.984,0.946,-14.537,0.109,109.682,0.285,1.0,9.0,26,False,"alternative rock, california hardcore, hardcore punk, punk"
19yMObdL1SW8Y25HIlYtCV,Lagrimas de Escarcha,Pastor Lopez,195068,1981-09-08,1981,0.179,0.919,0.521,0.00208,0.0347,-7.523,0.0509,138.034,0.837,1.0,2.0,25,False,"cumbia, musica popular colombiana, tropical"
2N7HFhlGMv4aVOcCo4rWzd,La Carta # 3,Alfredo Gutierrez,223503,1981-08-01,1981,0.101,0.871,0.523,0.0,0.094,-7.083,0.0614,116.487,0.897,1.0,5.0,37,False,"cumbia, vallenato"
66SyL8s1raOqTpMVfoMz37,Livin' In the 80's,Zero Boys,130546,1981-02-03,1981,0.00618,0.201,0.972,0.57,0.829,-1.475,0.0803,183.171,0.656,1.0,0.0,25,False,"anarcho-punk, hardcore punk, punk"
4ucPqC3qsM16PRKPvB3uPE,Night Life,Foreigner,230093,1981,1981,0.00315,0.607,0.932,4.22e-05,0.116,-4.463,0.0369,134.933,0.765,1.0,9.0,41,False,"album rock, classic rock, glam metal, hard rock, mellow gold, rock, soft rock"
013qmiO04xhcxHvcNM63lE,La Celda,Los Rebeldes Del Bravo,201213,1981,1981,0.133,0.657,0.866,0.0,0.227,-5.668,0.0359,120.116,0.965,1.0,10.0,24,False,deep norteno
1RhscZWFp75XvlJvbpbpYf,Miserlou,Agent Orange,127066,1981,1981,0.0353,0.152,0.991,0.781,0.132,-9.184,0.0866,185.099,0.421,1.0,4.0,41,False,"hardcore punk, punk, surf punk"
5WQaKf7SMtmemhhBrRZ5lc,Loser - Live; 2008 Remaster,Grateful Dead,355200,1981-08-26,1981,0.561,0.61,0.423,0.00331,0.99,-10.842,0.0331,108.966,0.443,0.0,4.0,22,False,"cosmic american, jam band, psychedelic rock"
2ijM39revG8B01AWb0M9V7,Lost Inside of You,Barbra Streisand,237840,1981,1981,0.712,0.188,0.253,0.0014,0.116,-15.221,0.0312,172.922,0.137,0.0,9.0,31,False,"adult standards, operatic pop, soft rock"
599dVw15FkG0ZOduPCAxKz,Love Is Where You Find It,The Whispers,320133,1981-01-01,1981,0.344,0.697,0.633,1.15e-06,0.141,-8.296,0.157,81.842,0.876,0.0,7.0,22,False,"classic soul, disco, funk, new jack swing, post-disco, quiet storm, soul, urban contemporary"
7HKez549fwJQDzx3zLjHKC,Start Me Up - Remastered 2009,The Rolling Stones,213066,1981-08-24,1981,0.0429,0.631,0.932,0.137,0.0918,-4.142,0.0354,122.431,0.971,1.0,5.0,78,False,"album rock, british invasion, classic rock, rock"
3QZ7uX97s82HFYSmQUAN1D,Tom Sawyer,Rush,276880,1981-02-12,1981,0.00145,0.536,0.901,0.0186,0.06,-7.211,0.0374,87.559,0.666,1.0,9.0,69,False,"album rock, canadian metal, classic canadian rock, classic rock, hard rock, progressive rock, rock"
0I3cUqffwmH2mMUHIfpC0l,Memory,Barbra Streisand,235160,1981,1981,0.415,0.185,0.24,0.0007,0.105,-14.889,0.0399,79.471,0.11,1.0,10.0,52,False,"adult standards, operatic pop, soft rock"
2Cg5XzRsGO2VYbaUYN2j8i,The Mob Rules - 2008 Remaster,Black Sabbath,195333,1981-11-04,1981,0.0121,0.211,0.933,0.392,0.258,-6.935,0.047,137.312,0.447,1.0,1.0,40,False,"album rock, alternative metal, birmingham metal, classic rock, hard rock, metal, rock, stoner rock, uk doom metal"
6C0jR6PqOluW9xwrTSeCvt,The Man with X-Ray Eyes,Bauhaus,185200,1981,1981,0.0735,0.545,0.468,0.000676,0.103,-16.188,0.048,152.965,0.718,0.0,11.0,42,False,"alternative rock, dark wave, dream pop, gothic rock, industrial rock, new wave, post-punk, uk post-punk"
3jM1W9APJx3dG61sd89IEp,Mine All Mine,The Stylistics,270253,1981,1981,0.403,0.782,0.613,0.101,0.112,-9.743,0.0504,90.351,0.714,1.0,0.0,39,False,"classic soul, disco, funk, motown, philly soul, quiet storm, soul"
1lNn0udm3EHKFRCGpNKZxn,"The More You Live, The More You Love",A Flock Of Seagulls,249106,1981,1981,0.00224,0.612,0.845,0.00168,0.582,-5.565,0.0352,139.514,0.769,0.0,11.0,46,False,"new romantic, new wave, new wave pop, synthpop"
72Um6MOofVPiyrjAlhr3E5,Man On Your Mind - Remastered 2022,Little River Band,258066,1981-08-01,1981,0.0988,0.812,0.697,0.000282,0.0798,-8.741,0.0455,112.856,0.961,1.0,4.0,40,False,"album rock, classic rock, country rock, mellow gold, singer-songwriter, soft rock, yacht rock"
3lpDrxUkr0tIe1kmJvdK7d,YYZ,Rush,265840,1981-02-12,1981,0.00205,0.51,0.919,0.809,0.068,-8.244,0.0593,141.053,0.386,1.0,7.0,55,False,"album rock, canadian metal, classic canadian rock, classic rock, hard rock, progressive rock, rock"
3F3qMsKHOAmHDezIK840bp,"My Girl (Gone, Gone, Gone)",Chilliwack,254506,1981,1981,0.382,0.439,0.821,4.85e-06,0.609,-8.536,0.0973,111.239,0.473,1.0,2.0,43,False,classic canadian rock
2UXCWyEOySmZR97yq4OIAY,Melina,Camilo Sesto,167000,1981-04-01,1981,0.751,0.582,0.459,0.0,0.0587,-13.282,0.0455,135.59,0.932,0.0,2.0,37,False,"bolero, latin pop, ranchera"
6FmZlee5EidftqgWdWsgpY,Morning Dew,Eddie Kamae And The Sons Of Hawai`i,175706,1981-11-19,1981,0.4,0.492,0.272,2.56e-05,0.1,-13.68,0.0259,81.607,0.48,1.0,8.0,36,False,hawaiian
0jSLiZUrDXPhJOVQcoLPQE,Magic Power,Triumph,294800,1981-09-19,1981,0.13,0.235,0.73,0.0,0.105,-4.745,0.0348,151.544,0.468,1.0,7.0,36,False,"album rock, canadian metal, classic canadian rock, classic rock, glam metal, hard rock"
5DbaLLjxAmlGfgyfroxwOq,Message of Love - 2018 Remaster,Pretenders,205158,1981-01-11,1981,0.17,0.616,0.765,0.00425,0.5,-7.66,0.189,143.01,0.577,0.0,7.0,36,False,"album rock, classic rock, mellow gold, new romantic, new wave, new wave pop, permanent wave, rock, soft rock"
0sL4YMO9wPjNI0MnWfwAHu,Más Feliz Que Tú,Los Bukis,193440,1981-01-01,1981,0.134,0.691,0.781,1.13e-05,0.339,-10.271,0.0323,94.786,0.954,1.0,7.0,36,False,"grupera, gruperas inmortales, musica mexicana"
1pEeWKbTCtRsjtyG9Jxp7L,Memory,"Andrew Lloyd Webber, ""Cats"" 1981 Original London Cast, Elaine Paige",315626,1981-01-01,1981,0.759,0.239,0.127,0.00328,0.0907,-16.427,0.0341,94.825,0.0765,0.0,5.0,42,False,"broadway, west end"
5xuJNMwQ08hrQDbR68MpD1,Mercury Blues,David Lindley,212240,1981-01-01,1981,0.00539,0.409,0.862,9.86e-05,0.271,-8.264,0.122,173.689,0.499,1.0,5.0,41,False,arab folk
0FFyHXmFKwzqHXXsrXWhfW,"Miami 2017 (Seen the Lights Go Out on Broadway) - Live at Madison Square Garden, New York, NY - June 1980",Billy Joel,304400,1981-09-14,1981,0.267,0.313,0.798,5.71e-05,0.951,-8.422,0.0588,165.074,0.181,1.0,2.0,32,False,"album rock, classic rock, mellow gold, piano rock, rock, singer-songwriter, soft rock"
190Tz6CYjyOAq5ypbV8CFi,Matinee Idol,Yellowjackets,312373,1981-06-10,1981,0.175,0.61,0.647,0.926,0.0421,-15.759,0.0378,108.528,0.889,1.0,0.0,36,False,"contemporary post-bop, jazz fusion, smooth jazz"
5sHVppAcOwooritENtX6ob,Me Basta,José José,230026,1981-11-05,1981,0.197,0.532,0.442,1.36e-06,0.133,-9.407,0.0274,90.34,0.298,1.0,10.0,48,False,"bolero, cancion melodica, ranchera"
58Dc3Osn3EulmDBpMde1va,Monkey and the Engineer - Live,Grateful Dead,175346,1981-04-01,1981,0.737,0.495,0.707,0.00447,0.972,-9.218,0.0888,149.971,0.757,1.0,7.0,29,False,"cosmic american, jam band, psychedelic rock"
1fxkvie5yzUEtiIkGhfiZe,My Eyes Adored You - Live,Frankie Valli & The Four Seasons,233933,1981,1981,0.576,0.468,0.459,0.0,0.985,-11.907,0.0635,139.765,0.446,0.0,11.0,32,False,"adult standards, bubblegum pop, doo-wop, lounge, northern soul, rock-and-roll, rockabilly"
0XuzMyxDpctWWdJZLqZX5L,Mano A Mano,Daryl Hall & John Oates,233600,1981,1981,0.162,0.764,0.873,1.24e-06,0.245,-5.27,0.0271,113.381,0.942,1.0,2.0,31,False,"album rock, classic rock, mellow gold, rock, singer-songwriter, soft rock, yacht rock"
6kG6NaXS2WuwZ4Hc6TwFIr,Moody,ESG,167560,1981,1981,3.51e-05,0.811,0.499,0.788,0.0896,-11.847,0.08,122.813,0.4,0.0,8.0,34,False,"dance-punk, no wave, post-punk"
4ZXe7VD6xqd7aKqFUsw87j,Me And My Wine - 1984 Remix,"Def Leppard, Robert John ""Mutt"" Lange",218752,1981-07-11,1981,9.43e-05,0.481,0.96,0.00262,0.0742,-6.505,0.058,139.758,0.478,1.0,2.0,30,False,"album rock, classic rock, glam metal, hard rock, nwobhm, rock"
1b9Q015tzd0tYzlPumy3UG,Miracles,Don Williams,180893,1981-01-01,1981,0.345,0.631,0.22,0.00135,0.104,-19.249,0.0283,104.677,0.473,1.0,6.0,38,False,"classic country pop, country"
2uqweSgRtAg5dt0pHZuzhn,Me and Sarah Jane - 2007 Remaster,Genesis,362360,1981-09-18,1981,0.22,0.586,0.628,0.000747,0.0607,-9.253,0.0293,109.027,0.449,1.0,1.0,32,False,"album rock, art rock, classic rock, hard rock, mellow gold, new romantic, progressive rock, rock, soft rock, symphonic rock"
3WcN5tEI6XoiUd8IJ8zr4r,Martha la Reyna,Lisandro Meza,230210,1981-05-08,1981,0.312,0.693,0.643,0.266,0.0494,-3.19,0.0664,174.06,0.978,0.0,7.0,37,False,"classic colombian pop, cumbia, folclor colombiano, musica andina colombiana, musica popular colombiana"
6PaSPjWbgzttf85Ao3vyVC,The Map Room: Dawn,"John Williams, London Symphony Orchestra",229733,1981-01-01,1981,0.879,0.178,0.168,0.847,0.746,-14.774,0.037,65.65,0.0366,1.0,8.0,30,False,"orchestral soundtrack, soundtrack"
6aQjZqAnWDYUiyALcfxv74,More Stars - Abba - Original Single Edit,Stars On 45,233213,1981,1981,0.155,0.647,0.818,8.18e-06,0.166,-6.174,0.051,122.552,0.908,0.0,1.0,42,False,
4ViqRfZoOGFryXi8BDh6Gj,Megatron Man,Patrick Cowley,546346,1981,1981,0.00214,0.669,0.642,0.712,0.101,-10.72,0.0381,126.309,0.93,0.0,9.0,39,False,"hi-nrg, italo disco"
0wXpLAGn8vD4nuer85zZ9f,My Heroes Have Always Been Cowboys,Willie Nelson,183973,1981-08-21,1981,0.163,0.368,0.316,0.0156,0.22,-14.137,0.0421,110.528,0.222,1.0,2.0,25,False,"classic country pop, classic texas country, country, country rock, nashville sound, outlaw country, singer-songwriter"
425QoSPrc8nk2GUM8yA2BT,Medley: Maligayang Pasko At Masaganang Bagong Taon / Namamasko / Ang Pasko'Y Sumapit Na Naman / Dalangin Sa Pasko / Pasko Ng Madla,"APO Hiking Society, Celeste Legaspi, Leo Valdez, Dulce, Janet Basco, Marco Sison, Ivy Violan, Verni Gonzales, Noel Trinidad, Subas Herrero",325800,1981-01-01,1981,0.56,0.574,0.398,0.0,0.442,-14.623,0.0711,123.859,0.904,0.0,4.0,47,False,"classic opm, opm"
35pxf40aAH6DJgnyp9OHii,Midnight Rider,Willie Nelson,170800,1981-08-21,1981,0.223,0.614,0.796,0.00283,0.156,-6.823,0.0625,96.607,0.643,1.0,2.0,25,False,"classic country pop, classic texas country, country, country rock, nashville sound, outlaw country, singer-songwriter"
19wJhby0FPBFnCTxKvLCYa,Merry-Go-Round - Live,Mötley Crüe,234213,1981-11-10,1981,0.0312,0.402,0.927,0.00159,0.443,-5.725,0.198,117.073,0.367,0.0,10.0,29,False,"album rock, alternative metal, glam metal, hard rock, metal, rock, sleaze rock"
5PhLUt6pPshyFKOXrMslQK,Myself to Myself,Romeo Void,223706,1981,1981,0.001,0.568,0.497,3.59e-05,0.0333,-11.112,0.069,169.068,0.768,1.0,7.0,28,False,new wave
7gszfXzM2EKwRGJ7dMh23J,My Love,"Earth, Wind & Fire",279853,1981-11-14,1981,0.235,0.686,0.551,0.0,0.197,-10.045,0.104,95.339,0.613,0.0,11.0,30,False,"disco, funk, jazz funk, motown, soul"
7nNPh2syeFXORvpSOEcQbg,Mainstreet - Live/Remastered,Bob Seger,244227,1981-09-05,1981,0.0272,0.376,0.847,0.0504,0.991,-4.984,0.0366,136.398,0.3,1.0,7.0,26,False,"album rock, classic rock, country rock, detroit rock, hard rock, heartland rock, mellow gold, rock, singer-songwriter, soft rock"
6rCSVe1CsMFN3lZns1FjSF,Marion's Theme / The Crate,"John Williams, London Symphony Orchestra",127813,1981-01-01,1981,0.94,0.181,0.176,0.92,0.0945,-16.799,0.0414,84.091,0.0659,1.0,7.0,28,False,"orchestral soundtrack, soundtrack"
3bSKHihztyH9D1ZyQsoqzI,That's When I Reach for My Revolver,Mission Of Burma,233573,1981-07-04,1981,0.00194,0.3,0.915,0.000332,0.147,-5.691,0.049,147.116,0.51,1.0,4.0,41,False,"alternative rock, boston rock, gbvfi, noise pop, post-hardcore, post-punk, punk"
47ULAV7jxxH7xf4qFrIe11,The Man With the Horn (2022 Remaster),Miles Davis,392487,1981-07,1981,0.178,0.559,0.479,0.000803,0.0945,-8.003,0.0307,126.414,0.381,1.0,11.0,28,False,"cool jazz, hard bop, jazz, jazz fusion, jazz trumpet, soul, vocal jazz"
2vFfb8BNUbPkr40QnKla9L,Mi Presidio,Romualdo Brito,280216,1981-05-11,1981,0.67,0.877,0.219,0.0,0.131,-14.138,0.135,124.101,0.888,0.0,4.0,31,False,vallenato
44VoCOPuYs1zKklhslfazm,Memory - Radio Edit,"Andrew Lloyd Webber, ""Cats"" 1981 Original London Cast, Elaine Paige",256506,1981-01-01,1981,0.773,0.277,0.228,0.00311,0.0935,-9.762,0.0319,62.511,0.1,1.0,8.0,34,False,"broadway, west end"
4tnbkWkfKLwcIbFybc4zC6,"Mississippi Queen (with Ted Nugent) - Live at the Municipal Auditorium, Nashville, TN - January 1981","Charlie Daniels, Molly Hatchet, Ted Nugent",195760,1981,1981,0.269,0.426,0.923,0.00412,0.976,-9.791,0.205,151.673,0.415,1.0,9.0,24,False,"country, country road, country rock, outlaw country, southern rock"
2ZMK2GJqwnsFzM7EJyeQYl,Mask,Bauhaus,274906,1981,1981,0.00132,0.351,0.51,0.000154,0.364,-15.096,0.0366,74.121,0.158,1.0,7.0,28,False,"alternative rock, dark wave, dream pop, gothic rock, industrial rock, new wave, post-punk, uk post-punk"
0MJiECmrhQvEggBvVfBSOj,Musta Notta Gotta Lotta,Joe Ely,155000,1981-01-01,1981,0.0781,0.417,0.79,0.00014,0.0823,-10.237,0.0666,95.001,0.847,1.0,4.0,29,False,"classic texas country, heartland rock, outlaw country"
2jWjNK9R5h3pSqd6fVPmKc,Medley: I Want You Back / ABC / The Love You Save - Live from the 1981 U.S. Tour,The Jacksons,179413,1981-11-11,1981,0.0956,0.492,0.944,0.0,0.992,-7.56,0.0917,132.494,0.637,1.0,0.0,33,False,"disco, motown"
63AGY2jSDODql9blDfP5xv,Make Love To Me,Rick James,288333,1981-04-07,1981,0.0328,0.58,0.71,5.15e-06,0.0923,-10.333,0.0339,96.497,0.628,0.0,7.0,26,False,"disco, funk, motown, p funk, quiet storm, soul, synth funk"
3z1aezJ16J6OseLAQTneuf,My Old Friend,Al Jarreau,268093,1981,1981,0.453,0.571,0.366,0.000357,0.216,-16.044,0.036,82.988,0.607,1.0,9.0,31,False,"smooth jazz, yacht rock"
25s3N3LvlXB45twTOzbA6S,Medley: Halina / Halina / Pasko Kasi / Kami Po'S Paskuhan / Damdaming Pasko / Pasko'Y Laganap / Simula Ng Pasko,"APO Hiking Society, Celeste Legaspi, Leo Valdez, Dulce, Janet Basco, Marco Sison, Ivy Violan, Verni Gonzales, Noel Trinidad, Subas Herrero",394373,1981-01-01,1981,0.378,0.54,0.381,0.0,0.161,-12.835,0.0669,124.684,0.723,1.0,0.0,45,False,"classic opm, opm"
3eNtItNZBC06O2ij4Brz4M,The Mob Rules - 2021 Remaster,Black Sabbath,195293,1981-11-04,1981,0.00254,0.242,0.945,0.0695,0.241,-7.156,0.0592,137.066,0.345,1.0,1.0,23,False,"album rock, alternative metal, birmingham metal, classic rock, hard rock, metal, rock, stoner rock, uk doom metal"
5KQc6OiD3GIiV4g9LPWs4a,Modern Love Is Automatic,A Flock Of Seagulls,230200,1981,1981,0.0444,0.323,0.821,0.979,0.135,-6.245,0.109,162.7,0.192,1.0,7.0,29,False,"new romantic, new wave, new wave pop, synthpop"
2XcqVRhBgGAG5OqW2Q0zro,Talking Out Of Turn,The Moody Blues,439666,1981-05-15,1981,0.199,0.475,0.707,0.261,0.149,-7.698,0.0352,76.799,0.641,1.0,6.0,39,False,"album rock, art rock, british invasion, classic rock, country rock, flute rock, folk rock, mellow gold, progressive rock, rock, singer-songwriter, soft rock, symphonic rock"
4JDh5uVymMm2Kpd9RDf5M3,Message of Love - 2006 Remaster,Pretenders,206946,1981-08-07,1981,0.0632,0.62,0.778,0.00786,0.455,-7.901,0.108,141.31,0.534,1.0,5.0,23,False,"album rock, classic rock, mellow gold, new romantic, new wave, new wave pop, permanent wave, rock, soft rock"
0Az7436p78jDNDNmpJRJWy,Mirror Mirror (Look Into My Eyes) - Remastered 2018,Def Leppard,247739,1981-07-11,1981,0.0053,0.499,0.756,0.00473,0.169,-7.335,0.0432,115.753,0.402,1.0,7.0,25,False,"album rock, classic rock, glam metal, hard rock, nwobhm, rock"
1hPPUsWzyxwRzsg9yOXwmr,Mr. Mistoffelees,"Andrew Lloyd Webber, ""Cats"" 1981 Original London Cast, Wayne Sleep, Paul Nicholas",217613,1981-01-01,1981,0.418,0.487,0.69,0.0,0.954,-10.897,0.267,175.842,0.773,1.0,5.0,33,False,"broadway, west end"
599PwTEN0IteW91YvePBtG,My Baby Thinks He's a Train,Rosanne Cash,193653,1981-01-01,1981,0.091,0.678,0.845,0.0418,0.156,-8.234,0.0335,123.777,0.719,1.0,0.0,22,False,"classic country pop, country rock, folk, lilith, singer-songwriter"
11M2feG39q4TXMlLa7jd3K,Maate Manthramu,"S. P. Balasubrahmanyam, S. P. Sailaja",272541,1981-01-01,1981,0.826,0.378,0.447,0.000725,0.171,-9.316,0.0308,76.036,0.611,1.0,2.0,41,False,filmi
2TDIpOqyhZ24H0ApLRDwrN,My Favorite Memory,Merle Haggard,184906,1981-06-11,1981,0.868,0.447,0.175,0.000346,0.0775,-13.209,0.0353,130.43,0.152,1.0,2.0,22,False,"bakersfield sound, country, country rock, nashville sound, outlaw country"
7k1fu2zeQ3S47mT4lhJWcL,Modern Girl,Sheena Easton,217466,1981,1981,0.467,0.679,0.661,1.83e-05,0.193,-12.017,0.0862,119.596,0.823,1.0,0.0,34,False,"mellow gold, minneapolis sound, new romantic, new wave pop, soft rock"
4FZOj1X9ypXqxAm45kUkdP,Mirror Man - Remastered 2012,The Human League,230600,1981,1981,0.0128,0.675,0.775,4.5e-05,0.0811,-7.928,0.0464,133.138,0.415,1.0,0.0,27,False,"new romantic, new wave, new wave pop, permanent wave, sophisti-pop, synthpop"
52w21TdgoWWs2IwfRnbpu4,On and On - 2009 Remaster,Michael Schenker Group,285493,1981-01-01,1981,0.00999,0.339,0.797,0.0035,0.48,-10.03,0.0789,138.553,0.261,0.0,5.0,40,False,"german hard rock, glam metal, hard rock, metal"
6oIhR0ePq8m30Ensdj512M,Meanwhile,The Moody Blues,248533,1981-05-15,1981,0.211,0.516,0.595,0.0333,0.0868,-8.073,0.0291,125.52,0.444,1.0,4.0,26,False,"album rock, art rock, british invasion, classic rock, country rock, flute rock, folk rock, mellow gold, progressive rock, rock, singer-songwriter, soft rock, symphonic rock"
2e78W1biaKWQf3F5qn0CG7,Malaika,Boney M.,206173,1981,1981,0.299,0.824,0.621,1.07e-06,0.356,-6.944,0.0458,119.149,0.746,1.0,0.0,41,False,europop
5smC5kSVuFxNZeoa2ZLUKu,"Mere Angne Mein, Pt. 1",Amitabh Bachchan,317440,1981-12-31,1981,0.693,0.581,0.518,0.0,0.481,-13.427,0.0714,116.35,0.851,1.0,11.0,29,False,"classic bollywood, filmi"
0f2X5k3CByNhzx2naRCOYj,Monasterio De Sal,Paco de Lucía,292066,1981-03-03,1981,0.911,0.388,0.477,0.878,0.0939,-16.745,0.0313,103.458,0.678,1.0,7.0,34,False,"flamenco, flamenco guitar, rumba"
