id,name,artists,duration_ms,release_date,year,acousticness,danceability,energy,instrumentalness,liveness,loudness,speechiness,tempo,valence,mode,key,popularity,explicit,genre
5PAIesBT42Vh5smBvbKkgN,You Mustn't Kick It Around,Original Broadway Cast of 'Pal Joey',173093,1952-01-01,1952,0.761,0.555,0.61,0.000836,0.206,-6.944,0.0403,95.571,0.865,1.0,3.0,3,False,vintage broadway
0IzvUGd3adOchJaGIkIVRL,That Terrific Rainbow,Original Broadway Cast of 'Pal Joey',138373,1952-01-01,1952,0.726,0.49,0.403,0.0337,0.827,-5.894,0.0513,116.087,0.598,1.0,7.0,3,False,vintage broadway
2FKZspC4gDD8FOz8Sj1Juc,Overture,Original Broadway Cast of 'Pal Joey',128373,1952-01-01,1952,0.818,0.262,0.457,0.77,0.14,-6.888,0.0296,82.584,0.517,1.0,10.0,2,False,vintage broadway
7IlJrHM843aQ0qgtuRlw3l,Pal Joey,Original Broadway Cast of 'Pal Joey',101253,1952-01-01,1952,0.51,0.465,0.463,0.0243,0.217,-6.067,0.0425,80.571,0.632,1.0,5.0,1,False,vintage broadway
67yBeuBK5NtZv5fUS9ZhXA,Lover Come Back To Me - 1952 Version,Anita O'Day,145800,1952-01-01,1952,0.874,0.565,0.318,0.0,0.077,-14.862,0.0519,126.882,0.565,0.0,9.0,3,False,"torch song, vocal jazz"
3IQ1WvXiE9SR5DRRqKRsPv,I Just Don't Love You Anymore,Curtis Gordon,174029,1952-04-22,1952,0.958,0.507,0.117,2.88e-05,0.111,-16.767,0.039,118.584,0.453,1.0,4.0,1,False,"rockabilly, traditional rockabilly, western swing"
3SA5hmyW2KPCtnD0EWmtef,I Just Couldn't See the Forest (For the Trees),Lefty Frizzell,145066,1952-02-01,1952,0.692,0.647,0.382,6.8e-06,0.0459,-14.654,0.0364,130.31,0.903,1.0,11.0,1,False,"arkansas country, classic country pop, honky tonk, traditional country, western swing"
5Eg0MYwdJ1Qz6mVKMMBQEX,Sentimental Journey,The Chordettes,125240,1952-08-22,1952,0.981,0.41,0.027,0.0,0.093,-20.634,0.0324,76.67,0.113,1.0,4.0,2,False,"classic girl group, doo-wop, vocal harmony group"
6kHPlyOQteP6ilvefJlL31,Mere Jeevan Sahare,Talat Mahmood,230666,1952-12-31,1952,0.972,0.292,0.276,0.814,0.0734,-15.443,0.0381,86.985,0.3,1.0,3.0,1,False,"classic bollywood, filmi, ghazal"
1tasNA19Z6nKN5cn14g4DM,Duti Jale Bheja Chokh,Satinath Mukherjee,243066,1952-12-01,1952,0.956,0.258,0.267,0.3,0.357,-14.807,0.0346,80.771,0.414,0.0,4.0,0,False,classic bangla pop
2XD1dhAT69Watmgk3m5ibA,Vaazhvin Jeevan,Ghantasala,186266,1952-12-01,1952,0.93,0.58,0.512,3.08e-05,0.127,-6.447,0.0366,82.326,0.926,1.0,1.0,0,False,vintage tollywood
2RtqV2pRCKqVykvf0daO4z,Shama Jali Parwana Aaya,"Lata Mangeshkar, Mohammed Rafi, Shakeel Badayuni",190119,1952-01-02,1952,0.868,0.724,0.455,4.85e-06,0.397,-9.773,0.0353,96.495,0.866,0.0,11.0,1,False,"classic bollywood, filmi, lata"
5KqSKi5ehd2QIXjrQDZ34N,A Joinville-le-Pont,Andre Bourvil,162346,1952-08-25,1952,0.863,0.732,0.598,0.000843,0.352,-7.334,0.093,113.074,0.876,1.0,0.0,1,False,"chanson, ye ye"
1o2R5Qebme0b7SVoF5Ohc7,Thi Jinse Palbhar Ki Pehchan,Asha Bhosle,176355,1952-12-31,1952,0.983,0.706,0.331,0.000307,0.295,-8.143,0.0385,119.298,0.488,0.0,5.0,0,False,"chutney, classic bollywood, filmi"
39Oz6jARmzqUerO0qdlfIm,The Way You Look Tonight,Oscar Peterson,178666,1952-01-01,1952,0.992,0.586,0.0563,0.924,0.112,-23.05,0.0489,76.645,0.294,0.0,7.0,5,False,"bebop, contemporary post-bop, jazz, jazz piano, stride"
319gYR32rnug41daq0BvFQ,Prelude To A Kiss,Oscar Peterson,196000,1952-12-02,1952,0.993,0.442,0.121,0.888,0.116,-16.775,0.0419,63.835,0.114,0.0,6.0,6,False,"bebop, contemporary post-bop, jazz, jazz piano, stride"
4kygzPMzNfK17KJCFYnGed,Das Lied von der Erde: 3. Von der Jugend,"Gustav Mahler, Julius Patzak, Wiener Philharmoniker, Bruno Walter",184000,1952-01-01,1952,0.956,0.337,0.182,0.000164,0.0895,-18.772,0.0376,89.738,0.371,1.0,10.0,1,False,"classical, post-romantic era"
5knRnjECfPkn59toDbbIvi,Das Lied von der Erde: 1. Das Trinklied vom Jammer der Erde,"Gustav Mahler, Julius Patzak, Wiener Philharmoniker, Bruno Walter",528000,1952-01-01,1952,0.954,0.162,0.279,0.00989,0.0789,-10.774,0.0368,80.177,0.0555,1.0,10.0,3,False,"classical, post-romantic era"
13cp4tTRdv6Lb5orO4PQXz,"Girl with the Flaxen Hair - 16 July, 1945",Jascha Heifetz,143226,1952-01-01,1952,0.969,0.229,0.0241,0.0623,0.227,-32.644,0.0493,104.508,0.243,1.0,7.0,2,False,violin
1qyURQ1DhJEqRu8jpNMSfZ,"St. Matthew Passion, BWV 244 - Part One: No. 4d Chorus I: ""Wozu dienet dieser Unrat""","Johann Sebastian Bach, Amsterdam Toonkunst Choir, Royal Concertgebouw Orchestra, Willem Mengelberg",36641,1952-01-01,1952,0.979,0.315,0.573,0.0368,0.477,-11.501,0.0414,132.283,0.456,0.0,2.0,0,False,"baroque, classical, early music, german baroque"
7e64FcqWAdTD2X8tL2Ze3I,"St. Matthew Passion, BWV 244 - Part Two: No. 39 Aria (Alto): ""Erbarme dich""","Johann Sebastian Bach, Ilona Durigo, Royal Concertgebouw Orchestra, Willem Mengelberg",506600,1952-01-01,1952,0.846,0.122,0.328,0.00465,0.111,-17.097,0.0501,83.085,0.0721,1.0,7.0,1,False,"baroque, classical, early music, german baroque"
2jdbf1n1cpWguEu8GOUSH9,"St. Matthew Passion, BWV 244 - Part One: No. 1 Chorus I/II: ""Kommt, ihr Töchter, helft mir klagen""","Johann Sebastian Bach, Amsterdam Toonkunst Choir, Jongenskoor ""Zanglust"", Royal Concertgebouw Orchestra, Willem Mengelberg",654426,1952-01-01,1952,0.841,0.074,0.376,0.938,0.362,-15.787,0.0547,63.375,0.043,0.0,4.0,1,False,"baroque, classical, early music, german baroque"
213w4RgUTNvnzwBBs2I8rZ,"Ça (Je t'aime, moi non plus)","Bourvil, Jacqueline Maillan",258665,1952-08-25,1952,0.279,0.495,0.511,3.87e-06,0.108,-13.168,0.406,78.289,0.574,0.0,9.0,7,False,chanson
5TGrSPsfb8SDho4Lu1pg11,"Symphony No. 88 in G Major, Hob. I:88: IV. Finale (Allegro con spirito)","Joseph Haydn, Berliner Philharmoniker, Wilhelm Furtwängler",220000,1952-01-01,1952,0.979,0.475,0.395,0.854,0.0453,-17.929,0.0443,144.962,0.84,1.0,7.0,0,False,"classical, classical era"
0OUabt67DXddQMSK3jK7Sw,Kantáta o Gottwaldovi,"Šimon Jurovský, Czech Radio Chorus, Prague Radio Symphony Orchestra, Jiří Pinkas",471684,1952,1952,0.98,0.26,0.392,0.00433,0.178,-11.736,0.0325,83.601,0.302,0.0,9.0,4,False,
1G5UEy0gECAJ5WN5UPC2Tb,The King's New Clothes,Danny Kaye,213293,1952-01-01,1952,0.815,0.645,0.381,0.0,0.467,-14.987,0.591,136.836,0.725,1.0,7.0,9,False,"adult standards, big band, comic, lounge, swing, tin pan alley"
73Zx7HBN571ELhQzn6eaaN,Karibe Taki,Yma Sumac,184560,1952-05-01,1952,0.945,0.555,0.338,5.19e-05,0.161,-12.736,0.039,113.543,0.294,1.0,4.0,5,False,"exotica, lounge, space age pop"
4WVz87dmg6MAIEZYKFTVpY,Kentucky Waltz,Pee Wee King & His Golden West Cowboys,176093,1952-06-13,1952,0.919,0.453,0.227,0.0052,0.282,-14.138,0.0317,111.813,0.48,1.0,0.0,2,False,western swing
4V5cNgMPp1K6cxEMIpis5c,Kon Tiki,Yma Sumac,188893,1952-05-01,1952,0.953,0.339,0.313,0.00122,0.128,-12.077,0.0401,106.01,0.155,0.0,11.0,4,False,"exotica, lounge, space age pop"
4DzMU9nNAzmNeoOcw31ry2,Kuyaway (Inca Love Song),Yma Sumac,165440,1952-05-01,1952,0.811,0.366,0.414,0.00198,0.571,-12.357,0.12,92.5,0.543,0.0,7.0,5,False,"exotica, lounge, space age pop"
3x3styudMxrswoN8gcK6Y6,Love Nest,"Otto Harbach, Ludwig Hirsch, Tal Farlow",163386,1952-01-01,1952,0.696,0.556,0.248,0.827,0.109,-18.402,0.0439,135.961,0.651,1.0,8.0,6,False,
2c0DzpoqZe3WnxQvoa9DjJ,La Cumparsita,Mariano Mores,175106,1952-02-17,1952,0.794,0.375,0.363,0.916,0.0977,-12.215,0.0296,130.459,0.241,0.0,10.0,20,False,"latin classical, tango"
4Ov8u9BbliBXoYBgn3X0HN,Somebody Loves Me - Remastered,Nat King Cole,185626,1952-09-15,1952,0.954,0.71,0.171,0.871,0.104,-20.313,0.0386,147.15,0.634,1.0,7.0,17,False,"adult standards, lounge, soul, swing, vocal jazz"
1m7vwMrcBq5JXR1Eml6TxU,Tanguera,Mariano Mores,117653,1952-02-17,1952,0.681,0.526,0.376,0.807,0.095,-12.125,0.0489,127.154,0.355,0.0,5.0,25,False,"latin classical, tango"
0qmvZTzXugOAZkjcSo8YKK,Las Perlas de Tu Boca,Noro Morales,143151,1952,1952,0.811,0.712,0.472,0.897,0.134,-9.725,0.0541,125.985,0.752,1.0,2.0,5,False,"latin jazz, mambo"
4sxgLUEKTZEoYLfvK4wcTX,Lament,Yma Sumac,197840,1952-05-01,1952,0.897,0.209,0.278,0.0173,0.134,-13.037,0.0408,78.043,0.0648,0.0,4.0,3,False,"exotica, lounge, space age pop"
15haEs8U7iRrCazmWzTvmy,Let's Make the Most of a Beautiful Thing,Frank Chacksfield Orchestra,220613,1952-05-06,1952,0.803,0.221,0.169,0.939,0.131,-16.512,0.0312,87.563,0.071,1.0,0.0,8,False,"easy listening, light music, man's orchestra"
1DhLJY2GyJSOeb8l69hu97,Legba Aguator (Nago Dance),The Ayida Group,212000,1952-01-01,1952,0.975,0.47,0.269,0.806,0.201,-22.099,0.192,175.777,0.754,1.0,7.0,3,False,"haitian traditional, haitian vodou drumming"
378eFWx5X73RLaBUIwoNiu,Love,Frank Chacksfield Orchestra,184013,1952-05-06,1952,0.934,0.313,0.209,0.929,0.118,-16.345,0.0381,94.754,0.15,1.0,2.0,7,False,"easy listening, light music, man's orchestra"
00TxuVLGvhVvUh0oXoKflE,Lullaby of Birland,Stanley Black,149093,1952-04-29,1952,0.478,0.575,0.259,0.599,0.0624,-12.23,0.0317,115.814,0.336,0.0,9.0,7,False,"easy listening, exotica, light music"
4S8cHvvJVxZ0PnfuOmq04f,Learn to Love,Frank Chacksfield Orchestra,180040,1952-05-06,1952,0.865,0.218,0.247,0.962,0.113,-14.017,0.0322,102.139,0.185,1.0,0.0,6,False,"easy listening, light music, man's orchestra"
2AbmFy1IyTuBY26m7sJMvW,Laura - Remastered,Nat King Cole,165906,1952-09-15,1952,0.98,0.426,0.0514,0.922,0.114,-23.191,0.0445,141.12,0.107,0.0,5.0,5,False,"adult standards, lounge, soul, swing, vocal jazz"
70RDK8ZUO1lHnwdfikqM1D,Someday You'll Want Me,Smiley Lewis,134280,1952-12-03,1952,0.734,0.431,0.507,0.0,0.29,-9.272,0.0345,103.809,0.737,1.0,4.0,16,False,"jump blues, louisiana blues, memphis blues, new orleans blues, rhythm and blues"
5CxrohLmH0jBJwxo5pTvLT,Sabor a Mí,"La Sonora Matancera, Rolando Laserie",141626,1952,1952,0.862,0.618,0.455,5.56e-05,0.0317,-6.918,0.0437,118.704,0.826,0.0,9.0,15,False,"bolero, mambo, musica tradicional cubana, salsa"
7s8A7PXTM1JJS9XWukMob5,Taquito Militar,Mariano Mores,151373,1952-02-17,1952,0.843,0.505,0.589,0.836,0.145,-10.304,0.0511,140.747,0.5,0.0,9.0,25,False,"latin classical, tango"
3fPXG8Is2esxhm2y7W9ULI,One Night,Smiley Lewis,146373,1952-12-03,1952,0.832,0.584,0.386,7.83e-06,0.206,-9.388,0.0303,121.985,0.578,1.0,1.0,21,False,"jump blues, louisiana blues, memphis blues, new orleans blues, rhythm and blues"
19wDiRZFwrJaU9ObnFSa18,Un clair de lune à Maubeuge,Bourvil,141466,1952-08-25,1952,0.911,0.639,0.189,0.0,0.0983,-12.781,0.0503,113.03,0.591,1.0,9.0,26,False,chanson
51lJM1VTnByb1Kv9GJofi1,Sabrá Dios,"Lucho Gatica, Alvaro Carrillo",126520,1952-04-14,1952,0.889,0.428,0.34,0.00396,0.155,-7.819,0.0384,100.86,0.456,0.0,8.0,12,False,"bolero, nueva ola chilena"
7Bz08pcTvHRN48403OtNYR,Terry's Solo / Terry's Theme (Eternally) / Pas de Deux,Charlie Chaplin,130997,1952,1952,0.955,0.197,0.234,0.719,0.876,-16.16,0.0583,163.919,0.138,1.0,5.0,15,False,classic soundtrack
2zMlwAO8chXOdeebqMinqi,Tere Bina Aag Yeh Chandni,"Lata Mangeshkar, Manna Dey",352235,1952-01-22,1952,0.911,0.307,0.375,0.0847,0.488,-12.41,0.0462,73.994,0.357,0.0,6.0,8,False,"classic bollywood, filmi, lata"
0ke9oWCh9WyQnlAxVOEKLg,À bicyclette,Bourvil,194893,1952-08-25,1952,0.507,0.713,0.409,0.0,0.109,-7.771,0.382,124.374,0.741,1.0,0.0,6,False,chanson
6nBLMx2VPWwTuCSnwy0xWL,Sous Le Ciel de Paris (Waltz of Paree),Stanley Black,136600,1952-04-29,1952,0.83,0.601,0.373,0.542,0.295,-7.697,0.0272,98.125,0.829,0.0,5.0,9,False,"easy listening, exotica, light music"
4Seo5KOiH0KvcQhmr66XDc,Mister Lonely,Frank Chacksfield Orchestra,151973,1952-05-06,1952,0.984,0.169,0.182,0.956,0.115,-13.036,0.0338,185.19,0.151,1.0,5.0,5,False,"easy listening, light music, man's orchestra"
1IyUoZiZXtdFkmik19BWL1,Somebody Loves Me - Remastered,Nat King Cole,185626,1952-09-15,1952,0.954,0.71,0.171,0.869,0.104,-20.313,0.0386,147.15,0.634,1.0,7.0,5,False,"adult standards, lounge, soul, swing, vocal jazz"
09o86qjFabysV6TD9PkkhS,"Shame, Shame, Shame!",Smiley Lewis,118653,1952-12-03,1952,0.727,0.32,0.706,0.000873,0.0541,-5.543,0.0553,187.078,0.288,1.0,6.0,12,False,"jump blues, louisiana blues, memphis blues, new orleans blues, rhythm and blues"
1onFLIYhBVwqodVNf8IqoO,Look What Thoughts Will Do,Lefty Frizzell,152093,1952-02-01,1952,0.798,0.74,0.187,6.13e-06,0.178,-14.522,0.0322,126.667,0.761,1.0,9.0,1,False,"arkansas country, classic country pop, honky tonk, traditional country, western swing"
7q4CG6BZBCNhObsCN02xPf,Los Ejes de Mi Carreta,"Lucho Gatica, Yupanki",108026,1952-04-14,1952,0.892,0.726,0.43,0.0227,0.086,-9.035,0.0548,126.089,0.67,0.0,5.0,0,False,"bolero, nueva ola chilena"
7mYuX1Op6vftm18BC3dfjN,Love For Sale - 1952 Version,Anita O'Day,216266,1952-01-01,1952,0.811,0.38,0.282,0.0,0.245,-13.587,0.0405,79.47,0.735,1.0,8.0,1,False,"torch song, vocal jazz"
6voq9Q41BmnknjUL6J3dZd,The Lady Is A Tramp,Anita O'Day,159133,1952-01-01,1952,0.408,0.545,0.151,0.0,0.173,-19.869,0.0776,126.419,0.332,1.0,7.0,3,False,"torch song, vocal jazz"
10l08BbFuT6KHV153iIcrr,"Laura - Live at Rockland Palace September 26, 1952",Charlie Parker,180714,1952-05-20,1952,0.958,0.351,0.22,0.838,0.381,-18.256,0.0353,93.414,0.369,1.0,7.0,1,False,"bebop, contemporary post-bop, cool jazz, jazz, jazz saxophone, vocal jazz"
3tkfADAr3QnkW9xCcAQzXJ,Les sourires de Paris,Bourvil,181920,1952-08-25,1952,0.804,0.583,0.238,0.0,0.0974,-9.746,0.0384,120.605,0.42,0.0,5.0,13,False,chanson
10rw12mNzZUeohUObLmCMj,La canzone dell'amore,Giuseppe Di Stefano,180200,1952-02-24,1952,0.946,0.131,0.281,0.0027,0.288,-11.796,0.035,170.946,0.12,1.0,10.0,3,False,"canzone napoletana, classical tenor, italian tenor, opera"
1VB5pSw8JJrH2BMiY21j7o,La Cumparsita,Carlos Di Sarli,190557,1952-01-01,1952,0.961,0.455,0.334,0.862,0.299,-11.331,0.0377,116.452,0.425,0.0,7.0,0,False,"tango, tango cancion, vintage tango"
1DIblB2zJ6XTHzMszfTOrH,La tendresse,Bourvil,189773,1952-08-25,1952,0.877,0.538,0.261,1.54e-05,0.152,-13.703,0.0378,136.8,0.555,1.0,4.0,25,False,chanson
1VSl0OYVyy5iLXcyUNJgB3,La Calesita,Mariano Mores,179920,1952-02-17,1952,0.735,0.51,0.381,3.01e-05,0.211,-10.903,0.0546,124.18,0.562,1.0,1.0,1,False,"latin classical, tango"
2KvJUEmZh5lYwPab4Aewbc,Love You Dearly (with Leith Stevens & His Orchestra),"Doris Day, Leith Stevens And His Orchestra",160373,1952-06-01,1952,0.901,0.298,0.171,1.69e-05,0.195,-12.443,0.0295,102.424,0.194,1.0,8.0,0,False,"adult standards, easy listening, lounge, vocal jazz"
4Fs08liKkl8YfWpkdOrNpm,L'ultima canzone,Giuseppe Di Stefano,287813,1952-02-24,1952,0.984,0.275,0.109,0.00197,0.0968,-15.951,0.0411,113.956,0.125,1.0,2.0,3,False,"canzone napoletana, classical tenor, italian tenor, opera"
3SKwqsURLf72CXER4IgRQ2,"Lester Leaps In - Live at Rockland Palace September 26, 1952",Charlie Parker,226922,1952-05-20,1952,0.958,0.319,0.549,0.874,0.154,-17.313,0.0792,90.913,0.617,1.0,2.0,1,False,"bebop, contemporary post-bop, cool jazz, jazz, jazz saxophone, vocal jazz"
3VaBSzHxzkOBqkUp1p97VF,Les sourires de Paris,Andre Bourvil,181920,1952-08-25,1952,0.804,0.583,0.238,0.0,0.0974,-9.746,0.0384,120.605,0.42,0.0,5.0,2,False,"chanson, ye ye"
0cYyZdAz1OinP8XQhzN52D,Les enfants fan fan,Andre Bourvil,173906,1952-08-25,1952,0.946,0.814,0.438,0.0,0.915,-8.202,0.168,125.403,0.951,1.0,5.0,10,False,"chanson, ye ye"
1dJoEWfFJX3BGUN6uvJivF,La serenata,Giuseppe Di Stefano,185786,1952-02-24,1952,0.906,0.207,0.272,0.33,0.363,-9.792,0.0345,167.875,0.186,1.0,5.0,3,False,"canzone napoletana, classical tenor, italian tenor, opera"
66c5JVdjnz2xcHYkKJ3YnY,L'ultima canzone 2,"Giuseppe Di Stefano, Henri Ottone",261265,1952-02-24,1952,0.995,0.353,0.0375,0.131,0.0838,-17.06,0.0401,132.459,0.168,1.0,2.0,1,False,"canzone napoletana, classical tenor, italian tenor, opera"
1TuYQSZHZQTCSIn9S6djBo,Money Tree,Lefty Frizzell,176640,1952-02-01,1952,0.824,0.599,0.252,0.00529,0.148,-15.744,0.028,104.694,0.647,1.0,7.0,3,False,"arkansas country, classic country pop, honky tonk, traditional country, western swing"
3QY4IGVUblg5Czq2BqwUEr,Montana,Yma Sumac,221200,1952-05-01,1952,0.972,0.293,0.291,0.0154,0.175,-14.579,0.038,107.163,0.138,0.0,1.0,6,False,"exotica, lounge, space age pop"
3QVSB0kTKqEyBgiHbrBPYD,Suray Surita,Yma Sumac,198893,1952-05-01,1952,0.901,0.322,0.312,0.00211,0.136,-15.018,0.0431,124.351,0.0603,0.0,0.0,3,False,"exotica, lounge, space age pop"
1HvLfbw4HzwTu0tn3hIZNE,No Doubt About It,Flatt & Scruggs,150226,1952,1952,0.844,0.715,0.545,0.0125,0.0807,-7.436,0.029,108.16,0.68,1.0,5.0,3,False,"banjo, bluegrass, bluegrass gospel, traditional country"
1TMh7qFeON2idmauxz178U,Lillie Mae,Smiley Lewis,133533,1952-12-03,1952,0.835,0.586,0.712,0.0,0.649,-6.465,0.321,190.309,0.905,1.0,8.0,1,False,"jump blues, louisiana blues, memphis blues, new orleans blues, rhythm and blues"
2kpS7D7bgPiXitJXOpw7Xl,Looking for My Baby,Big Bill Broonzy,170973,1952-04-14,1952,0.991,0.458,0.377,0.000544,0.124,-12.662,0.0473,185.254,0.735,1.0,3.0,0,False,"acoustic blues, blues, chicago blues, country blues, traditional blues"
0wXAFr6rTBfhwtv7Nd2Smr,Long Tall Mama,Big Bill Broonzy,169173,1952-04-14,1952,0.895,0.59,0.359,0.00138,0.0987,-14.769,0.047,174.724,0.723,1.0,5.0,1,False,"acoustic blues, blues, chicago blues, country blues, traditional blues"
4EoyXGm9KXQcu0Ys3ABEIl,Lone Wolf Blues,Big Bill Broonzy,178280,1952-04-14,1952,0.993,0.454,0.369,0.0225,0.112,-14.029,0.0307,90.834,0.685,0.0,7.0,0,False,"acoustic blues, blues, chicago blues, country blues, traditional blues"
2Cj15b7gdgKt4OjC9tS3cV,Looking up at Down,Big Bill Broonzy,181440,1952-04-14,1952,0.959,0.754,0.246,6.15e-05,0.0916,-11.831,0.0624,69.851,0.75,1.0,5.0,0,False,"acoustic blues, blues, chicago blues, country blues, traditional blues"
3pPF5Vk3V7RcFOPS5Flgyx,Lonesome Road Blues,Big Bill Broonzy,176946,1952-04-14,1952,0.993,0.518,0.25,2.59e-06,0.117,-9.038,0.0462,82.601,0.487,1.0,7.0,0,False,"acoustic blues, blues, chicago blues, country blues, traditional blues"
3IiD1akpaDbemvX9Zxxi4b,La Luna Se Va Metiendo,"Alfred Campos, Edwin Lobato",133906,1952-01-01,1952,0.996,0.568,0.0258,0.112,0.174,-30.062,0.0891,82.383,0.626,1.0,4.0,1,False,
5cTVei6sRx3eCxM61l4CBX,Le fossoyeur,Georges Brassens,124400,1952,1952,0.982,0.685,0.0916,0.0,0.111,-14.668,0.065,82.019,0.463,1.0,9.0,17,False,"chanson, french rock"
34c4zFi663hVQejjOa8aEI,Les Feuilles Mortes,Yves Montand,150053,1952-05-08,1952,0.98,0.375,0.106,1.72e-05,0.622,-21.889,0.0453,107.53,0.233,0.0,2.0,5,False,chanson
7gQwzKqBsommqJ5ihqpTdz,Lullaby Of The Leaves,Anita O'Day,190560,1952-01-01,1952,0.977,0.407,0.179,5.78e-05,0.298,-12.162,0.031,74.896,0.357,1.0,3.0,6,False,"torch song, vocal jazz"
3Br9q0N1lv3Wj3ezKw9lCI,Lover Come Back To Me,Anita O'Day,147760,1952-01-01,1952,0.981,0.562,0.359,0.00395,0.0767,-11.871,0.0492,127.928,0.554,0.0,9.0,2,False,"torch song, vocal jazz"
1sRx4ubxu6HFwFvwuprfsk,Love For Sale,Anita O'Day,217280,1952-01-01,1952,0.977,0.425,0.316,6.85e-05,0.181,-10.705,0.0443,155.588,0.643,1.0,8.0,1,False,"torch song, vocal jazz"
3V4v8VSWUEGn9ljHTSJmJS,Largo from Xerxes - Arranged for Cello,"George Frideric Handel, Pablo Casals",234093,1952,1952,0.993,0.155,0.163,0.874,0.138,-20.234,0.0464,63.471,0.135,1.0,7.0,2,False,"baroque, classical, early music, english baroque, german baroque"
1KKxMgZGLA9JewuygOlXNJ,La salvaora,Amália Rodrigues,187053,1952,1952,0.898,0.407,0.105,0.00013,0.391,-10.863,0.0523,169.992,0.25,0.0,9.0,1,False,"fado, fado antigo, fado de coimbra"
2ORnzj8PwVvgLod07VTn9G,Les pecheurs de perles: Act I: Au fond du temple saint,"Georges Bizet, Jussi Björling, Robert Merrill, Renato Cellini, RCA Victor Symphony Orchestra",277653,1952,1952,0.971,0.163,0.39,0.876,0.108,-10.133,0.0378,86.476,0.123,1.0,3.0,3,False,"classical, french opera, french romanticism, late romantic era"
4cz64s0Vo2XKMRJgiT1k6z,Les Feuilles Mortes (Autumn Leaves),Mabel Mercer,276706,1952,1952,0.972,0.393,0.076,0.0,0.182,-14.935,0.0573,75.821,0.174,0.0,0.0,0,False,cabaret
5IeOUndPu6lPLEJiRteLwW,Lo-Flame,Howard McGhee,169906,1952-01-01,1952,0.988,0.661,0.234,0.918,0.111,-15.686,0.0672,94.6,0.819,1.0,6.0,1,False,jazz trumpet
5ANvdaCL43enT9Q3qmLdl1,Libya: Goumri Oueld Eddounane,Troupe Chaoueche Saad,198186,1952-01-01,1952,0.925,0.372,0.191,5.8e-06,0.953,-14.972,0.252,64.336,0.636,1.0,9.0,1,False,
1roVUNLGq9cYTwUGwagwDu,"La Bohème: Act IV: In un coupé? O Mimì, tu più non torni","Giacomo Puccini, Jussi Björling, Robert Merrill, Renato Cellini",253093,1952,1952,0.972,0.307,0.185,0.0454,0.219,-14.804,0.0366,86.693,0.239,1.0,0.0,0,False,"classical, italian opera, italian romanticism, post-romantic era"
3jrYCqO753QYKr10iqvZj8,Locomotive Blues,Sonny Terry,215306,1952-01-01,1952,0.985,0.66,0.144,0.0229,0.132,-19.481,0.313,87.268,0.431,1.0,9.0,1,False,"acoustic blues, blues, country blues, harmonica blues, piedmont blues, traditional blues"
42oQwZdD0MUE6EgEBlLi1o,Lock the Barn Door,Eileen Barton,137373,1952-12-03,1952,0.908,0.528,0.453,0.0,0.644,-8.584,0.295,184.325,0.712,1.0,5.0,1,False,deep adult standards
1aZRkyLE9X9eF1CZm5Dxmw,L'âme Des Poètes (At Last! At Last! ),Stanley Black,165080,1952-04-29,1952,0.679,0.483,0.488,0.000397,0.2,-7.958,0.0277,99.399,0.608,1.0,7.0,6,False,"easy listening, exotica, light music"
0MipGNvbWtk8HaRT440KGJ,Lucia - Meringue,Fabre Duroseau,119306,1952-01-01,1952,0.994,0.401,0.361,0.932,0.0905,-9.724,0.0579,118.96,0.959,1.0,7.0,0,False,haitian traditional
64MdPScAJ55IIMIRczcGPJ,Leavin' Town,"Gerry Mulligan, Chubby Jackson Big Band",149413,1952-01-01,1952,0.987,0.355,0.0994,0.481,0.158,-13.837,0.0333,133.273,0.173,1.0,10.0,2,False,"bebop, cool jazz, jazz, jazz saxophone"
1rqrEQICaxYVKz3LQOyVIJ,Leap Frog - Take 1 / Incomplete,"Dizzy Gillespie, Charlie Parker, Thelonious Monk, Curly Russell, Buddy Rich",28426,1952-07-01,1952,0.604,0.654,0.197,0.0,0.35,-16.32,0.676,86.052,0.511,1.0,5.0,0,False,"bebop, contemporary post-bop, jazz, jazz trumpet, vocal jazz"
2rR7lYjrlxpdPAMRAaqaBE,La Nina Callada,Frank Chacksfield Orchestra,200973,1952-05-06,1952,0.957,0.376,0.288,0.931,0.109,-12.465,0.0335,126.837,0.186,0.0,5.0,4,False,"easy listening, light music, man's orchestra"
3XM3vQBYxVybXICdy0LlZI,Little Bo Peep,Curtis Gordon,147600,1952-04-22,1952,0.963,0.591,0.152,0.000117,0.0771,-14.742,0.0584,173.459,0.802,0.0,9.0,1,False,"rockabilly, traditional rockabilly, western swing"
2fW0cdMuclAAq95Dol2jpB,Los Tres Sabinos,Pedro Ayala,126813,1952-03-11,1952,0.575,0.679,0.28,0.901,0.0696,-7.058,0.0869,146.806,0.759,1.0,5.0,0,False,
7sbb5q4pjig0qOvvWojRt1,La Papaya,Pedro Ayala,151106,1952-03-11,1952,0.332,0.935,0.419,0.157,0.0795,-8.695,0.0638,115.268,0.982,1.0,7.0,0,False,
6rq5EyKQEws2plFvQo2Ayn,La Redova de Jímenez,Pedro Ayala,122573,1952-03-11,1952,0.302,0.781,0.638,0.918,0.0519,-5.31,0.136,175.482,0.984,1.0,7.0,0,False,
3XwY55TIT0bFfzHFP9y6Wy,Les Raftsmen,Alan Mills,152280,1952-01-01,1952,0.939,0.856,0.184,0.0136,0.113,-13.95,0.368,133.723,0.833,1.0,9.0,2,False,
2GDHwSXUcTQha0bRNLLVHv,Leave a Happy Fool Alone,Varetta Dillard,149373,1952-06-24,1952,0.835,0.384,0.638,0.0,0.0781,-7.495,0.0363,147.207,0.909,0.0,0.0,1,False,rhythm and blues
10Ee1FvrZ1GS1KNzKTtCUr,The Lover's Departure,Wallace House,87893,1952-01-01,1952,0.851,0.675,0.0809,0.0,0.0857,-21.038,0.232,98.095,0.533,1.0,0.0,0,False,
5P5hx9cr13CRJx7rYDS46t,Le Siffleur Et Son Chien,Helmut Zacharias,159773,1952-02-03,1952,0.533,0.614,0.491,0.00556,0.317,-8.469,0.126,107.595,0.593,1.0,5.0,2,False,"easy listening, jazz violin"
4VY26eGYCj2kMcgYif5Z8d,"Long, Long Ago (Apple Tree)",Art Tatum Trio,162560,1952-01-01,1952,0.937,0.599,0.107,0.0529,0.152,-25.577,0.176,77.368,0.593,1.0,6.0,0,False,stride
0q1xvSfqZehXQfUCvSKRex,La forza del destino: Act III: Scene 1: Solenne in quest'ora,"Giuseppe Verdi, Jussi Björling, Robert Merrill, Renato Cellini",251920,1952,1952,0.964,0.207,0.219,0.25,0.108,-13.203,0.0336,96.651,0.113,1.0,0.0,1,False,"classical, italian opera, italian romanticism, late romantic era"
4hUfMQyeJm0oZSRUaykwDb,La Mer (The Sea),Stanley Black,249586,1952-04-29,1952,0.775,0.516,0.218,0.31,0.341,-11.999,0.0286,113.424,0.423,1.0,1.0,5,False,"easy listening, exotica, light music"
6U2rxZ9zPpfI6XTKZy1VDt,La Violetera,Helmut Zacharias,138093,1952-02-03,1952,0.536,0.336,0.524,1.66e-06,0.37,-6.05,0.0283,98.228,0.406,1.0,7.0,4,False,"easy listening, jazz violin"
2AbXcI7Pwo7d5lk6YXOBVq,The Law of Love,Hank Snow,156600,1952-06-13,1952,0.701,0.474,0.379,0.0,0.223,-12.23,0.0303,79.671,0.563,1.0,9.0,0,False,"canadian country, canadian singer-songwriter, classic country pop, nashville sound, western swing"
2GeI7jIJPX7Z42mBcY5YEf,Lovely Luawana Lady,Victor Young,159688,1952,1952,0.666,0.389,0.555,0.947,0.239,-8.402,0.0304,140.792,0.902,1.0,10.0,1,False,classic soundtrack
4Tzc4TDPGkZDTolpuWlOSd,Love That Man,Varetta Dillard,161773,1952-06-24,1952,0.846,0.61,0.36,2e-05,0.345,-9.549,0.0514,135.113,0.89,1.0,2.0,0,False,rhythm and blues
67S4fEImXog0duAxNPkF71,"Long, Long Ago (Apple Tree)",Art Tatum Trio,199480,1952-01-01,1952,0.958,0.521,0.0646,0.0463,0.0903,-29.069,0.0974,81.194,0.387,0.0,5.0,0,False,stride
4s7hlQBxVfFAKTFq4L76ce,Let Me Love You,Mabel Mercer,156333,1952,1952,0.939,0.448,0.102,0.0,0.0946,-14.773,0.0496,115.64,0.31,1.0,1.0,0,False,cabaret
68ojecdvT1rLlDKnKMs0ro,Luar de Paquetá,"Freire Júnior, Hermes Fontes, Carolina Cardoso de Menezes, José Menezes",178415,1952-06-16,1952,0.827,0.642,0.745,0.868,0.225,-13.658,0.0362,100.847,0.963,0.0,4.0,4,False,
1ddLZA6RQiGHfIrJ51uwYL,"Lute Suite in E Minor, BWV 996: V. Bourree (arr. A. Segovia)","Andrés Segovia, Johann Sebastian Bach",91853,1952,1952,0.935,0.538,0.15,0.878,0.121,-24.376,0.0516,72.943,0.716,1.0,7.0,2,False,"classical guitar, guitarra clasica, historic classical performance"
7wEnDEBVlmCactn5nMVA9C,"L'Arianna, SV291: ""Lasciatemi morire"" - 1953 Version","Claudio Monteverdi, Irma Kolassi, Jacqueline Bonneau",123373,1952-01-01,1952,0.993,0.182,0.121,9.17e-05,0.0732,-13.818,0.0464,90.122,0.0454,0.0,5.0,0,False,"baroque, classical, early music, italian baroque, italian renaissance, madrigal, renaissance"
2t76316WQPuRgHp7vZtXwe,La Reina,"Tito Rodriguez, Noro Morales Y Su Orquesta",178233,1952-03-08,1952,0.967,0.524,0.532,0.799,0.108,-10.082,0.13,93.218,0.631,1.0,1.0,0,False,"charanga, latin jazz, mambo, salsa, salsa puertorriquena"
