id,name,artists,duration_ms,release_date,year,acousticness,danceability,energy,instrumentalness,liveness,loudness,speechiness,tempo,valence,mode,key,popularity,explicit,genre
37CMjUAU8fL6YqZVTplZqZ,The Last Night,Skillet,210786,2006-10-03,2006,0.0253,0.358,0.856,0.0,0.233,-2.934,0.0471,169.81,0.542,1.0,2.0,54,False,"alternative metal, christian alternative rock, christian music, christian rock"
3cDE9Yn4GrsxSrlMCLdmTT,Love Like Winter,AFI,165653,2006-06-06,2006,0.000259,0.592,0.914,0.000139,0.0452,-4.753,0.0468,120.032,0.524,0.0,10.0,51,False,"alternative metal, nu metal, pop punk, post-grunge, punk, screamo"
1HH9AYnSKZaPKgZUGuiDRf,Love Is My Religion,Ziggy Marley,228506,2006-07-02,2006,0.202,0.826,0.717,0.0,0.394,-6.212,0.0481,93.505,0.78,1.0,9.0,47,False,"reggae, roots reggae"
570ZDO2Lmh6NQChOU5xPUL,Love Is A Losing Game,Amy Winehouse,154160,2006-10-27,2006,0.317,0.48,0.561,0.00641,0.184,-5.874,0.027,164.791,0.541,1.0,0.0,56,False,"british soul, neo soul"
5iyE2d4U3Vc5cqY9mPTlpy,LoveStoned / I Think She Knows (Interlude),Justin Timberlake,444333,2006-09-12,2006,0.34,0.859,0.681,0.000161,0.213,-6.247,0.0549,121.243,0.852,1.0,1.0,57,True,"dance pop, pop"
4ltXPf327ewFdmTPp5Skow,Lay Down,Priestess,185800,2006-06-13,2006,0.00128,0.52,0.886,0.0,0.0846,-2.387,0.0454,121.945,0.636,1.0,8.0,50,False,"canadian metal, canadian rock, retro metal"
48T3AtfhOgz3euMEO2Z4hS,LDN,Lily Allen,192333,2006-05-08,2006,0.0142,0.673,0.607,4.15e-06,0.333,-7.672,0.027,100.023,0.898,1.0,5.0,46,False,"dance pop, electropop, neo mellow"
246ZcQ4VJJI3i2WNfzpQEp,Le Compré La Muerte A Mi Hijo,Los Tigres Del Norte,205506,2006-01-01,2006,0.141,0.832,0.679,0.0,0.435,-7.214,0.0506,110.974,0.931,0.0,7.0,55,False,"banda, musica mexicana, norteno, ranchera"
6QZpOdCLH4nubyfrFRxp6Q,La Brujita,Patrulla 81,150280,2006-05-02,2006,0.243,0.762,0.883,0.0,0.15,-4.195,0.0437,81.383,0.961,1.0,2.0,51,False,"banda, duranguense, musica mexicana"
21dO2n3oshsn3FkbB6Y5Mm,Lobo Domesticado,Valentín Elizalde,170440,2006-01-01,2006,0.374,0.789,0.538,1.51e-05,0.34,-4.997,0.0445,116.034,0.923,1.0,10.0,57,False,"banda, corrido, musica mexicana, musica sonorense, norteno, sierreno"
5dJqHtAc4toOPTRX9xfOB6,Los Angeles,Sugarcult,237573,2006-09-12,2006,0.000439,0.509,0.817,5.56e-06,0.0947,-5.472,0.0502,155.199,0.597,0.0,10.0,54,True,"neon pop punk, pop punk, screamo"
4Du0BRUJvKybzxcRplp7HF,Leave Before The Lights Come On,Arctic Monkeys,233946,2006-08-14,2006,0.00272,0.365,0.887,2.18e-05,0.0923,-4.579,0.0417,150.718,0.916,1.0,0.0,58,False,"garage rock, modern rock, permanent wave, rock, sheffield indie"
0X6LpTaCRqlMUmjCynuo5a,Livin' Part Of Life,Eric Church,269173,2006-01-01,2006,0.481,0.451,0.648,0.0,0.201,-8.659,0.0355,146.792,0.857,1.0,1.0,45,False,"contemporary country, country, country road"
1gbHzmkqs6NuTSsy4hhutw,Little Bit of Life,Craig Morgan,251720,2006-10-31,2006,0.292,0.667,0.834,0.0,0.287,-4.743,0.0344,96.944,0.703,1.0,7.0,45,False,"contemporary country, country, country road"
5pdKPY4O9CHuzDDp557j4N,"Luckenbach, Texas (Back to the Basics of Love) (feat. Willie Nelson)","Waylon Jennings, Willie Nelson",200640,2006-09-26,2006,0.712,0.687,0.469,0.00203,0.252,-9.992,0.0322,102.88,0.674,1.0,7.0,46,False,"classic texas country, country, outlaw country"
77jdTLPg3EXHJ8cbU7SBni,Llegaste tú,Jesse & Joy,246666,2006-07-18,2006,0.196,0.547,0.528,0.0,0.164,-6.525,0.025,146.068,0.29,1.0,0.0,62,False,"latin arena pop, latin pop, mexican pop"
5GWyNA4n9hx5rhkK0KvQ83,Lullaby,The Chicks,350712,2006-05-23,2006,0.762,0.55,0.205,0.00943,0.112,-11.409,0.0279,109.396,0.316,1.0,0.0,47,False,"contemporary country, country, country dawn"
6Zgd7SomLTZkL1WPh4CUnV,Wolf Like Me,TV On The Radio,277466,2006-07-03,2006,0.00165,0.345,0.785,0.00813,0.124,-4.989,0.0437,175.963,0.184,1.0,7.0,63,False,"alternative dance, alternative rock, brooklyn indie, chamber pop, indie rock, indietronica, modern rock, neo-synthpop"
79bODrebIu4YZRIQeDEVhR,Las Tres Mujeres,Saul Viera El Gavilancillo,177600,2006-08-17,2006,0.192,0.812,0.621,0.0,0.104,-8.671,0.0936,102.162,0.858,1.0,8.0,46,False,"corridos clasicos, norteno"
7g4RwwhSrmX9iuNFE8wk2G,Lobo Domesticado,Joan Sebastian,164440,2006-01-31,2006,0.405,0.718,0.514,6.87e-06,0.291,-9.639,0.0265,115.769,0.824,1.0,2.0,56,False,"banda, grupera, musica mexicana, norteno, ranchera"
18cMxAuSTWkljxRYk1Fma1,Lie About Us,"Avant, Nicole Scherzinger",248346,2006-01-01,2006,0.189,0.695,0.671,0.0,0.235,-4.763,0.0577,77.608,0.839,0.0,6.0,53,False,"contemporary r&b, r&b, urban contemporary"
3vXfJ9iAKPGLfy8G7es3bz,La Gran Pachanga,Banda El Recodo,167373,2006-01-01,2006,0.687,0.687,0.647,7.53e-05,0.289,-2.934,0.0311,141.139,0.981,1.0,8.0,50,False,"banda, banda sinaloense, musica mexicana, norteno"
4jjtFbO4dYu4JO0CIph6Ak,Le Disko,Shiny Toy Guns,203306,2006-01-01,2006,0.0688,0.762,0.697,7.52e-05,0.269,-3.657,0.0463,123.033,0.705,1.0,7.0,46,True,"electronic rock, indietronica"
1wt8PzNPhWi5o0voZjzhMs,Let Love In,The Goo Goo Dolls,301173,2006,2006,0.015,0.531,0.908,0.00346,0.135,-2.822,0.0408,118.935,0.174,1.0,2.0,47,False,"neo mellow, permanent wave, pop rock, post-grunge"
1u2SU0MSoNbWj3H95G23JK,Leaning On The Everlasting Arms,Alan Jackson,94146,2006,2006,0.839,0.555,0.364,0.0,0.144,-8.955,0.0272,105.821,0.48,1.0,5.0,47,False,country
1VyvSOCfQlZ21hBugn10om,La Loquera,Brazeros Musical De Durango,181226,2006-01-01,2006,0.132,0.682,0.856,0.000206,0.528,-3.599,0.103,74.933,0.934,1.0,0.0,49,False,"banda, duranguense, musica mexicana, norteno"
4tNMhJlHB0vJMadXGCdteB,L no Theme,Hideki Taniuchi,184000,2006-12-21,2006,0.285,0.674,0.827,0.929,0.0875,-6.99,0.0285,135.021,0.457,1.0,2.0,53,False,
4JKwW0A2OQeAUpYZd99Lfo,Let's Ride,The Game,237680,2006-01-01,2006,0.169,0.878,0.739,0.0,0.119,-5.157,0.189,93.601,0.824,1.0,5.0,52,True,"detroit hip hop, gangster rap, hip hop, pop rap, rap, southern hip hop, trap"
166uOnqKj9iSOp4GYqoDOj,Little Red Rodeo,Phil Vassar,203680,2006-02-05,2006,0.148,0.63,0.729,0.0,0.292,-5.191,0.0331,126.984,0.64,1.0,0.0,44,False,"contemporary country, country, country road"
0PaOYkEinHPDxK4yq7sR5l,The Light,The Album Leaf,269066,2006-11-08,2006,0.908,0.154,0.123,0.879,0.208,-16.596,0.0421,101.738,0.0389,1.0,1.0,45,False,"american post-rock, compositional ambient, instrumental post-rock, post-rock"
6wKHY3Sh6GcY62CSy3uZbM,Leave Me Alone (I'm Lonely),P!nk,198653,2006-04-04,2006,0.000422,0.475,0.874,5.7e-05,0.0736,-3.693,0.0397,150.183,0.474,1.0,7.0,54,True,"dance pop, pop"
5w8w9sp6p7c8aAXb84OCY3,Like Me And You,"Raffi, Ken Whiteley",161533,2006-01-01,2006,0.89,0.722,0.19,0.000271,0.105,-14.267,0.0284,98.614,0.53,1.0,10.0,43,False,"canadian children's music, children's folk, children's music"
1GH5tpvz5g1ZGKNBPBWkTm,London Bridge,Fergie,208093,2006-01-01,2006,0.159,0.751,0.648,0.0,0.0508,-5.394,0.241,90.987,0.678,1.0,1.0,50,True,"dance pop, pop"
16D1W4BryVlcLI4JcTRFkU,The Long Way Around,The Chicks,272900,2006-05-23,2006,0.427,0.599,0.87,1.11e-05,0.15,-3.377,0.0367,128.454,0.249,1.0,0.0,47,False,"contemporary country, country, country dawn"
60CEVNgCHcVyWCPy6Kh2K6,Luz Sin Gravedad,Belinda,241906,2006,2006,0.28,0.535,0.563,0.0,0.152,-3.521,0.0315,137.79,0.172,1.0,5.0,62,False,"latin arena pop, latin pop, mexican pop"
6wn2nmFn3wDuiMldRiuRuL,Last Christmas - Remastered,Wham!,267160,2006-11-11,2006,0.262,0.757,0.618,0.0,0.221,-7.964,0.0282,106.856,0.861,0.0,11.0,54,False,"new romantic, new wave, new wave pop, soft rock"
206QiQ5OnKTZE3cnuMYu3H,Lost One,"JAY-Z, Chrisette Michele",224226,2006-11-21,2006,0.248,0.806,0.686,0.0,0.0613,-2.754,0.154,84.011,0.632,0.0,8.0,43,True,"east coast hip hop, gangster rap, hip hop, pop rap, rap"
1M8YN6ekSgCnjc5UckHYpq,Lacrymosa,Evanescence,217466,2006-01-01,2006,0.00801,0.439,0.775,5.28e-05,0.104,-5.35,0.0727,136.973,0.194,0.0,4.0,50,False,alternative metal
7IR7GUO0dUyUsBp7BfQ3vJ,Lean On Sheena,The Bouncing Souls,200786,2006-06-06,2006,0.16,0.491,0.866,0.000211,0.13,-4.431,0.0583,175.969,0.694,1.0,11.0,46,False,"asbury park indie, new jersey hardcore, new jersey punk, power-pop punk, punk, ska, ska punk, skate punk"
0PLtBp8VchqMaJMl4abJaZ,Lost Keys (Blame Hofman),TOOL,226266,2006-04-28,2006,0.274,0.281,0.385,0.882,0.51,-15.219,0.0403,122.115,0.0618,1.0,7.0,48,False,"alternative metal, art rock, nu metal, post-grunge, progressive metal, progressive rock, rock"
1oy1AVM5TJ12onoDO9IKfC,Loco por Ti,Mazizo Musical,178840,2006,2006,0.28,0.676,0.713,0.00549,0.0184,-4.083,0.0334,126.544,0.966,0.0,11.0,50,False,"duranguense, musica mexicana, norteno"
0pAT3JUEjIiqUkwxE0vbBQ,The Little Drummer Boy - Remastered 2006,Bing Crosby,180040,2006-01-01,2006,0.885,0.636,0.165,4.79e-05,0.0502,-14.261,0.0328,112.773,0.505,1.0,10.0,45,False,"adult standards, easy listening, lounge, swing"
1kGYHnD4aHkQsyVnzyvabM,Low Down,Hank Williams III,203306,2006-02-28,2006,0.138,0.69,0.743,0.00104,0.112,-6.169,0.0311,127.072,0.556,1.0,7.0,43,False,"cowpunk, outlaw country"
1MrZ8hGkUWMmT816wPaMgE,La flaca,Jarabe De Palo,261200,2006-06-23,2006,0.52,0.871,0.481,5.54e-05,0.0809,-9.068,0.0383,103.063,0.664,1.0,7.0,60,False,"latin alternative, latin rock, rock en espanol, spanish pop, spanish rock"
2OqYarizUUGzSSNHPrDEii,Shoulder Lean (feat. T.I.),"Young Dro, T.I.",258680,2006-08-28,2006,0.0471,0.7,0.518,0.0,0.1,-7.191,0.177,75.973,0.542,0.0,4.0,55,True,"atl hip hop, crunk, dirty south rap, futuristic swag, old school atlanta hip hop, southern hip hop, trap"
4yRpPJBLOuTcXQDxEkCEt1,Las Cerezas,Cardenales De Nuevo León,147266,2006-01-01,2006,0.239,0.575,0.705,2.34e-06,0.0598,-4.489,0.091,176.24,0.961,1.0,2.0,49,False,"banda, musica mexicana, norteno"
3MJd5S8ZIUp19dVvKxgNoe,Lovesong from the Mountains,Deuter,478520,2006-02-13,2006,0.894,0.184,0.0878,0.51,0.103,-20.655,0.0461,64.248,0.0374,0.0,2.0,52,False,"healing, meditation"
0HX2bNHJrHA53MVRMeGVQ6,Like Sexy Dynamite,"The Orion Experience, ORION, Linda XO",183251,2006-01-01,2006,0.00216,0.613,0.885,4.24e-06,0.197,-1.921,0.0381,148.925,0.939,1.0,6.0,45,False,"pov: indie, stomp pop"
4IDk4uuSV3s0IBwvRMHWT1,Lo Que Te Queda,Tito Rojas,301040,2006-01-01,2006,0.473,0.738,0.642,0.0,0.0632,-11.357,0.0352,95.341,0.756,0.0,7.0,49,False,"salsa, salsa puertorriquena, tropical"
1TKg3TNK8AN6WSoETpnNnI,Labios Compartidos,Maná,317626,2006-08-22,2006,0.027,0.527,0.898,0.0,0.0686,-3.624,0.0367,162.058,0.462,0.0,0.0,51,False,"latin arena pop, latin pop, latin rock, mexican pop, mexican rock, rock en espanol"
3mtUR8aNUoMblqX49YzVF3,Life Is Beautiful,Keb' Mo',256493,2006,2006,0.81,0.651,0.462,3.3e-06,0.136,-9.011,0.0336,80.289,0.567,1.0,2.0,44,False,"acoustic blues, blues, country blues, electric blues, modern blues, piedmont blues"
2KKYlJFyJ8Ozxj7FABxKEg,La Medecina,Joan Sebastian,160853,2006-04-24,2006,0.752,0.678,0.616,0.000231,0.047,-6.723,0.0441,105.831,0.689,1.0,2.0,50,False,"banda, grupera, musica mexicana, norteno, ranchera"
59lBAMCis4C6NsPdUV35Vz,愛愛愛,Khalil Fong,215253,2006-12-31,2006,0.4,0.473,0.459,0.0,0.0862,-7.348,0.0377,66.37,0.346,1.0,9.0,56,False,"chinese r&b, mandopop"
6Gfmj0HbpvxTdW0sdlzTDU,My Wish,Rascal Flatts,248280,2006-01-01,2006,0.0307,0.548,0.769,5.53e-06,0.0867,-4.853,0.0312,135.712,0.388,1.0,4.0,62,False,"contemporary country, country, country road"
6h3YJ05BovN1Pgk145J3r9,Mama Tried,Merle Haggard,134453,2006-01-01,2006,0.719,0.738,0.538,1.35e-05,0.0653,-10.118,0.0374,97.487,0.81,1.0,2.0,58,False,"bakersfield sound, country, country rock, nashville sound, outlaw country"
1Qa9FSirMhxlMxN1nbCkTB,Mickey Mouse Clubhouse Theme,"They Might Be Giants (For Kids), Disney Junior",59666,2006-01-01,2006,0.29,0.64,0.568,0.0,0.107,-10.6,0.524,95.492,0.702,1.0,7.0,58,False,children's music
2JpUkUR0OsOlUUfm6iS8ic,Money Maker,"Ludacris, Pharrell Williams",230613,2006-01-01,2006,0.15,0.551,0.598,0.0,0.299,-6.79,0.27,78.756,0.612,1.0,1.0,58,True,"atl hip hop, dance pop, dirty south rap, hip hop, old school atlanta hip hop, pop rap, rap, southern hip hop, trap"
7vfUhnW7qDtkFId4GJnvtA,Mein,Deftones,238040,2006-10-25,2006,8.47e-06,0.428,0.932,0.574,0.0763,-2.746,0.0515,124.99,0.239,1.0,9.0,58,False,"alternative metal, nu metal, rap metal, rock, sacramento indie"
2QrQCMel6v2JiLxqrg4p2O,Mary's Song (Oh My My My),Taylor Swift,213080,2006-10-24,2006,0.0177,0.403,0.627,0.0,0.182,-5.28,0.0292,74.9,0.374,1.0,2.0,55,False,pop
3pYKJaLiixRcDFfcNhxZKK,The Metal,Tenacious D,165960,2006-11-02,2006,0.00296,0.623,0.938,0.000852,0.48,-4.161,0.123,112.022,0.308,1.0,0.0,59,False,"alternative metal, comedy rock, comic, comic metal, parody"
0KQ1LhU7vGiXqn7eAw1nfl,Monster,Meg & Dia,161333,2006,2006,0.00164,0.35,0.834,1.19e-05,0.149,-3.856,0.0596,192.005,0.424,0.0,6.0,57,False,"candy pop, pixie"
5YXr4AGfUQpLSxtFSsKUh6,Map of the Problematique,Muse,258066,2006-06-19,2006,0.000386,0.493,0.959,0.118,0.254,-3.613,0.0414,125.04,0.703,1.0,8.0,61,False,"alternative rock, modern rock, permanent wave, rock"
2NCmyKVXhY4iPBXaRCajoi,Mi Mayor Venganza,LA INDIA,313560,2006-01-01,2006,0.542,0.42,0.753,1.87e-05,0.413,-7.347,0.062,81.417,0.725,1.0,7.0,57,False,"salsa, salsa puertorriquena, tropical"
5RqIM2vv5nw2PGJBqPD8Rg,Me & Mr Jones,Amy Winehouse,151573,2006-10-27,2006,0.537,0.59,0.803,0.0,0.105,-2.518,0.085,87.851,0.477,1.0,4.0,58,True,"british soul, neo soul"
1UVffD20CfHJ2wD0x0as8L,Monsters,Matchbook Romance,243746,2006-02-14,2006,0.00131,0.362,0.945,2.51e-05,0.154,-2.651,0.0575,114.797,0.487,0.0,10.0,53,False,"neon pop punk, pop punk, screamo"
2tN2Kvzm2ITh1jnMKjjWBZ,My Dick,Mickey Avalon,180386,2006-01-01,2006,0.34,0.937,0.592,0.0,0.0935,-4.659,0.287,99.636,0.811,1.0,6.0,50,True,
2VLcpwzuZVSZQUCQDQRM8n,Me Duele Amarte,Reik,192973,2006-11-14,2006,0.401,0.62,0.591,0.0,0.138,-7.085,0.0304,148.06,0.591,1.0,1.0,65,False,"latin arena pop, latin pop, mexican pop, reggaeton, urbano latino"
6uoOKr3dxk9GVIhmJyQPMh,MySpace (feat. Wisin & Yandel),"Don Omar, Wisin, Yandel",221179,2006-11-21,2006,0.0698,0.841,0.799,5.72e-06,0.0889,-7.232,0.189,87.989,0.74,1.0,10.0,62,False,"latin hip hop, puerto rican pop, reggaeton, trap latino, urbano latino"
1gKSpFpX3poa17WIAyFVsp,"Mammas, Don't Let Your Babies Grow Up to Be Cowboys","Waylon Jennings, Willie Nelson",153200,2006-09-26,2006,0.616,0.592,0.422,0.0015,0.158,-11.549,0.0332,94.597,0.536,1.0,9.0,52,False,"classic texas country, country, outlaw country"
3HDI4IbXISO10HhQSDM1vF,"Mighty To Save - Live At Sydney Entertainment Centre, Sydney, Australia/2006",Hillsong Worship,410973,2006-09-05,2006,0.0821,0.46,0.795,0.0,0.0782,-6.635,0.0453,146.015,0.253,1.0,9.0,49,False,"ccm, christian music, world worship, worship"
6YTp4sUEi3oWNToQvOjke6,Money in the Bank (feat. Young Buck) - Remix,"Lil Scrappy, Young Buck",233706,2006,2006,0.0599,0.88,0.693,0.0,0.248,-5.201,0.332,75.603,0.767,1.0,1.0,50,True,"atl hip hop, crunk, dirty south rap, old school atlanta hip hop, southern hip hop"
6U7GUjtamt2P0LcFod1dBT,Mas Que Nada,"Sérgio Mendes, Black Eyed Peas",262840,2006-01-01,2006,0.0297,0.747,0.928,1.75e-06,0.113,-6.107,0.0824,100.065,0.87,0.0,5.0,64,False,"bossa nova, brazilian jazz, samba"
09HBvmj0dUeQYHGbKJefR5,Main Titles - The Little Mermaid,"Alan Menken, Disney",86186,2006-01-01,2006,0.818,0.0906,0.196,0.778,0.27,-16.486,0.0365,85.97,0.158,1.0,7.0,53,False,"broadway, movie tunes, orchestral soundtrack"
0Om9WAB5RS09L80DyOfTNa,Tim McGraw,Taylor Swift,232106,2006-10-24,2006,0.575,0.58,0.491,0.0,0.121,-6.462,0.0251,76.009,0.425,1.0,0.0,62,False,pop
5KNuHsIeFtD0oukst77hBi,Maula Mere Maula,Roop Kumar Rathod,364329,2006-12-01,2006,0.458,0.548,0.737,0.00806,0.091,-7.865,0.0386,119.961,0.412,1.0,0.0,61,False,"filmi, modern bollywood, sufi"
33J0xfFaRZO6RzHVdbQkiO,Manda Una Señal,Maná,281880,2006-08-22,2006,0.0294,0.452,0.834,0.0,0.138,-5.039,0.0296,186.141,0.321,1.0,0.0,61,False,"latin arena pop, latin pop, latin rock, mexican pop, mexican rock, rock en espanol"
4UJX7so2d2L2XttE5Pfwm7,My Apocalypse,Escape the Fate,283360,2006-10-03,2006,0.00173,0.195,0.935,0.000137,0.108,-3.623,0.133,129.328,0.236,0.0,7.0,52,False,"alternative metal, metalcore, neon pop punk, pixie, pop punk, post-grunge, screamo"
2m1nPrniN0HhvS2EzZ7hGi,Me Llamas,Montez de Durango,183040,2006-05-02,2006,0.364,0.818,0.784,1.06e-05,0.0732,-3.285,0.0424,122.091,0.971,1.0,5.0,53,False,"banda, duranguense, grupera, musica mexicana, norteno"
4Ni2mtHVH4yvlVRM3KlKfd,Mass Destruction,Lotus Juice,208800,2006-07-19,2006,0.0211,0.779,0.904,0.00159,0.342,-8.314,0.0925,118.995,0.901,1.0,1.0,54,False,
3L1b8FSECnjZgs03oGZBMV,Morning Ride,Fiji,223413,2006-04-09,2006,0.138,0.843,0.46,0.000359,0.138,-7.608,0.0755,147.503,0.951,1.0,7.0,51,False,"cook islands pop, fijian pop, melanesian pop, pacific islands pop"
25gGaMURpL6xXOKTuyrYj6,Morenita Labios Rojos,Toño Y Freddy,128333,2006-01-01,2006,0.408,0.772,0.459,0.0,0.156,-7.343,0.0544,133.55,0.972,1.0,5.0,50,False,tierra caliente
2lxiwqCxyXDxL8xks4aXBu,Mirame,Jenni Rivera,223920,2006-02-07,2006,0.702,0.484,0.587,0.0,0.33,-4.651,0.051,174.416,0.79,1.0,4.0,57,False,"banda, mariachi, musica mexicana, ranchera, regional mexicano femenil"
0BesqvlvkbU9FZMiQHrIzA,Moriré,La Factoria,208169,2006-12-04,2006,0.148,0.642,0.747,0.0,0.332,-6.547,0.0345,94.91,0.396,0.0,11.0,61,False,"latin hip hop, reggaeton"
1FL7eUG80aeUeyMO2N4btN,Mission: Impossible Theme,Michael Giacchino,51800,2006-05-08,2006,0.318,0.299,0.571,0.137,0.0452,-8.949,0.0395,89.642,0.764,0.0,5.0,55,False,"orchestral soundtrack, soundtrack"
02ykJXbTaAyxPgaicIRxo4,Mariposa de Barrio,Jenni Rivera,238026,2006-02-07,2006,0.464,0.705,0.448,6.66e-06,0.0702,-5.643,0.0677,78.993,0.553,1.0,7.0,54,False,"banda, mariachi, musica mexicana, ranchera, regional mexicano femenil"
2OpI7zHFQS0NAaaTkZFjzt,Me Encantaría,Banda Pequeños Musical,225653,2006-01-01,2006,0.34,0.638,0.682,5.08e-06,0.144,-7.067,0.0332,148.017,0.64,1.0,7.0,47,False,"banda, banda jalisciense, musica mexicana, norteno, tecnobanda"
3zK2IUdvnOaKWC3yCP0P3C,Mi Swing es Tropical,"Nickodemus, Quantic, Tempo",222920,2006-11-14,2006,0.0213,0.814,0.894,6.94e-05,0.294,-9.225,0.0779,100.0,0.968,1.0,6.0,57,False,"electro jazz, funky breaks, nu jazz"
56BNLFLPUL9NtIoxuC6dCQ,Master Exploder,Tenacious D,144800,2006-11-02,2006,0.00962,0.311,0.934,0.00863,0.127,-3.942,0.0737,74.47,0.574,0.0,11.0,52,True,"alternative metal, comedy rock, comic, comic metal, parody"
3r3v3yoi2dEowTwO1IAfLy,Mas Maiz,"N.O.R.E., Fat Joe, Big Mato, Nina Sky, Chingo Bling, Lil Rob, Negra, Lumidee",274946,2006-07-18,2006,0.086,0.694,0.904,0.0,0.265,-5.134,0.101,91.014,0.842,0.0,4.0,48,True,"dirty south rap, gangster rap, hardcore hip hop, hip hop, queens hip hop, southern hip hop"
0vblqF5R4FyCAVBasjLGdu,Meet Me in the City,The Black Keys,218466,2006-05-02,2006,0.579,0.482,0.754,0.227,0.11,-5.486,0.0538,121.418,0.301,1.0,9.0,47,False,"alternative rock, blues rock, garage rock, indie rock, indietronica, modern blues rock, modern rock, punk blues, rock"
1Fwn33YQGJ1lcBaCWPiaOU,Me Duele Escuchar Tu Nombre,Montez de Durango,234173,2006-01-01,2006,0.351,0.676,0.788,4.03e-06,0.46,-3.225,0.0627,137.929,0.97,1.0,4.0,49,False,"banda, duranguense, grupera, musica mexicana, norteno"
4lPt4A5vNxMS0b2FiRuqcS,Mary Es Mi Amor,Leo Dan,188453,2006-12-05,2006,0.451,0.628,0.43,1.23e-06,0.12,-8.731,0.0334,104.29,0.758,1.0,4.0,43,False,"bolero, cancion melodica, latin pop, ranchera"
35jyxg80z7cV6rUZhMctyj,Mein,Deftones,238040,2006-10-30,2006,8.47e-06,0.428,0.932,0.574,0.0763,-2.746,0.0515,124.99,0.239,1.0,9.0,49,False,"alternative metal, nu metal, rap metal, rock, sacramento indie"
7hli5WhBbu0cWx1pof3wXY,Mary Wore Her Red Dress,Raffi,87466,2006-01-01,2006,0.767,0.697,0.238,0.0,0.108,-10.33,0.0348,99.135,0.547,1.0,0.0,44,False,"canadian children's music, children's folk, children's music"
5rLHszkkgiIwWrGwyWAFFE,Millstone,Brand New,256666,2006-01-01,2006,0.00591,0.268,0.82,0.000288,0.0882,-3.729,0.0495,202.461,0.166,1.0,9.0,44,False,"emo, pop punk, post-hardcore, screamo"
435sp9O64WY2P9DLMuBDCU,Me And My Gang,Rascal Flatts,217986,2006-01-01,2006,0.0775,0.628,0.9,0.0,0.0454,-3.719,0.0408,108.745,0.611,1.0,7.0,44,False,"contemporary country, country, country road"
7rbtNjuh56l71xV7Uowf50,Mi Fanatica,De La Ghetto,228560,2006-09-25,2006,0.0446,0.875,0.691,0.00326,0.219,-7.704,0.114,92.993,0.612,1.0,4.0,59,False,"reggaeton, reggaeton flow, trap latino, urbano latino"
2r5HpO5yuhGHR0xDw7FTBr,México Lindo Y Querido,Vicente Fernández,212573,2006-06-30,2006,0.526,0.354,0.48,1.63e-06,0.114,-3.897,0.0319,145.917,0.253,1.0,8.0,60,False,"mariachi, ranchera"
47OC0Xl9TIijX4gkafSX1G,McQueen and Sally,Randy Newman,119173,2006-01-01,2006,0.407,0.399,0.285,0.82,0.153,-13.991,0.0328,120.1,0.147,1.0,2.0,48,False,"movie tunes, singer-songwriter"
6ta5yavnnEfCE4faU0jebM,Mr Blue,Catherine Feeny,154600,2006,2006,0.835,0.456,0.386,0.108,0.389,-10.293,0.032,165.733,0.612,1.0,10.0,50,False,
2cKGzCcBEnN9BmhR1FOvRM,Mátame,Antony Santos,208586,2006-01-03,2006,0.132,0.82,0.835,0.0,0.188,0.116,0.094,123.006,0.866,0.0,1.0,49,False,
4yhGkvdYU5bi4950r80FRo,Tell Me Why - Radio Edit,"Supermode, Axwell, Steve Angello",173866,2006-01-01,2006,0.00143,0.554,0.91,0.000111,0.215,-7.508,0.0742,128.996,0.682,0.0,6.0,73,False,hypertechno
62N7RkB1weggv5VHqgYOsb,Me Quiere Besar,Alexis y Fido,155413,2006,2006,0.143,0.792,0.814,0.0,0.302,-5.319,0.0706,95.015,0.847,1.0,1.0,55,False,"latin hip hop, reggaeton, urbano latino"
52MaiPIUXo88RUeTNkACFG,My Struggle,Boosie Badazz,202266,2006-10-24,2006,0.0519,0.835,0.829,0.0,0.331,-4.912,0.296,81.974,0.734,0.0,5.0,43,True,"baton rouge rap, dirty south rap, memphis hip hop, southern hip hop, trap"
4Qf4sunHJJz4581avJ07kX,Minstrel's Lament,Jeremy Soule,281547,2006-03-20,2006,0.956,0.0674,0.0267,0.947,0.11,-25.469,0.0388,71.49,0.0344,0.0,3.0,48,False,"orchestral soundtrack, scorecore, video game music"
0TGXhbsTJ1LohY8HvmxSvT,Metele Sazón,Tego Calderón,242520,2006-03-14,2006,0.493,0.845,0.651,0.000888,0.0736,-7.928,0.0606,95.043,0.913,0.0,2.0,53,False,"latin hip hop, rap boricua, reggaeton, trap latino, urbano latino"
0FXE0aS5IZnQYR56Vwiv4v,Morí,Tranzas,215560,2006-11-07,2006,0.405,0.613,0.517,0.0,0.118,-7.505,0.0543,76.117,0.118,1.0,7.0,61,False,"ecuadorian pop, latin pop, mexican pop"
4e51xdDLaQW08LHNhdkwl9,Mama Who Bore Me - Original Broadway Cast Recording/2006,Lea Michele,140653,2006-01-01,2006,0.814,0.323,0.244,0.0,0.0765,-10.308,0.0317,68.932,0.088,1.0,2.0,46,False,"hollywood, post-teen pop, viral pop"
1vMuSYlp2Im8Gpj6JxRJfj,Medley: Let Me Talk to You / My Love (feat. T.I.),"Justin Timberlake, T.I.",370133,2006-09-12,2006,0.122,0.818,0.663,0.0,0.504,-7.592,0.187,119.896,0.727,0.0,11.0,50,False,"dance pop, pop"
2F3XxRbmkrlZj7EPNAvaux,Manda Una Señal,Maná,281880,2006-08-18,2006,0.0294,0.452,0.834,0.0,0.138,-5.039,0.0296,186.141,0.321,1.0,0.0,43,False,"latin arena pop, latin pop, latin rock, mexican pop, mexican rock, rock en espanol"
6PvpKM4BW48ic8cbM4Vxcg,Man in the Box,Alice In Chains,286706,2006-07-24,2006,0.00136,0.337,0.849,0.0,0.0904,-4.604,0.0456,106.395,0.685,1.0,8.0,41,True,"alternative metal, alternative rock, grunge, hard rock, nu metal, rock"
0LU2Gqb4DyaxmAd46e5nAm,Momentos,Andrea Bocelli,234570,2006-01-01,2006,0.818,0.615,0.541,0.00283,0.11,-8.115,0.0352,91.993,0.522,1.0,7.0,55,False,"classical tenor, italian tenor, operatic pop"
6cAldqwmbUwpM8D17FWtPL,Mr. Me Too,Clipse,221906,2006-11-27,2006,0.337,0.683,0.581,0.0,0.208,-7.077,0.316,90.984,0.708,1.0,7.0,45,True,"alternative hip hop, hardcore hip hop, hip hop, southern hip hop, virginia hip hop"
1AERsDlEADxcp9WtjZBtiU,Mariposas,Los Enanitos Verdes,221720,2006-01-01,2006,0.188,0.549,0.916,9.9e-06,0.161,-4.316,0.0279,136.993,0.704,1.0,2.0,62,False,"argentine rock, latin alternative, latin pop, latin rock, mexican pop, rock en espanol, ska argentino"
0qxAdhIIf3S6Nwq88qp8i0,Moving For The Sake Of Motion,Underoath,195480,2006-01-01,2006,1.13e-05,0.248,0.99,0.00614,0.437,-2.006,0.117,185.087,0.135,1.0,9.0,44,False,"christian metal, christian metalcore, melodic metalcore, metalcore, pop punk, post-hardcore, screamo, tampa indie"
4RWbOGWFhcnQbzafhHUSGB,Mi Corazon Enamorado,Alberto Pedraza Con Su Ritmo Y Sabor,279880,2006,2006,0.00416,0.658,0.498,0.339,0.0983,-9.369,0.0297,90.976,0.774,0.0,5.0,50,False,cumbia sonidera
6pYzQWbPT3zw4F8Y5euTfl,My Blue Heaven,Taking Back Sunday,247226,2006-04-25,2006,0.00302,0.362,0.896,0.0,0.102,-4.622,0.0766,137.487,0.331,1.0,1.0,43,False,"emo, neon pop punk, pop punk, post-hardcore, screamo"
6K66ynN5AC1jEUkSg8b7ct,My Mom,Kimya Dawson,201440,2006-05-09,2006,0.741,0.498,0.365,0.0,0.132,-10.61,0.0373,132.674,0.598,1.0,0.0,44,False,"anti-folk, olympia wa indie"
5vhjiYaPrm4PKpPABpLc8O,Mister Sun,Barney,65066,2006-01-01,2006,0.29,0.716,0.322,0.0,0.0519,-17.076,0.19,104.069,0.816,1.0,2.0,45,False,"cartoon, children's music"
01nXYKtKjrtlJgS7TClnXk,Mar Amar,Rosalia De Souza,130873,2006,2006,0.848,0.758,0.484,0.00372,0.223,-11.683,0.0311,138.044,0.822,0.0,4.0,52,False,sambass
0YgQktpUzB8EQHSxifAYn3,Mi Reina,La Makina,248760,2006,2006,0.406,0.869,0.811,0.000136,0.0317,-6.143,0.0355,135.908,0.852,1.0,10.0,52,False,"merengue, salsa, tropical"
1rHZnOvNV0DQIOCJSDzb6h,Mirame,"Daddy Yankee, Deevani",230948,2006-01-01,2006,0.189,0.816,0.8,0.0,0.255,-7.026,0.179,96.025,0.696,0.0,10.0,54,False,"latin hip hop, reggaeton, trap latino, urbano latino"
42DSTal38NakfMCu7RuNcv,Make You Feel Better,Red Hot Chili Peppers,231733,2006-05-09,2006,0.0241,0.404,0.877,7.89e-06,0.166,-4.319,0.037,179.885,0.68,1.0,7.0,49,False,"alternative rock, funk metal, funk rock, permanent wave, rock"
4SimUIFxXh5N6VsF33oMo7,Maestro,Hans Zimmer,233706,2006-01-09,2006,0.895,0.18,0.219,0.939,0.565,-14.296,0.0343,150.209,0.07,1.0,0.0,51,False,"german soundtrack, orchestral soundtrack, soundtrack"
0EOHTNYZtLF9aiBWQiA1UJ,Mayor Que Yo 2,Wisin & Yandel,229453,2006-03-14,2006,0.00153,0.76,0.866,1.5e-06,0.0643,-7.926,0.09,89.985,0.631,1.0,5.0,50,False,"electro latino, reggaeton, trap latino, urbano latino"
1qjpqPksHOOIKcwShB08oz,"No, No, No","Thalia, Romeo Santos",249760,2006-01-01,2006,0.48,0.533,0.673,0.0,0.345,-7.26,0.144,125.082,0.696,1.0,0.0,65,False,"latin pop, mexican pop"
