id,name,artists,duration_ms,release_date,year,acousticness,danceability,energy,instrumentalness,liveness,loudness,speechiness,tempo,valence,mode,key,popularity,explicit,genre
1AiIUvuAH3m1Hugunwaqrd,Mustapha - Remastered 2011,Queen,181026,1978-11-10,1978,0.479,0.596,0.632,3.18e-06,0.0712,-9.896,0.128,152.763,0.456,0.0,5.0,28,False,"classic rock, glam rock, rock"
3uOpN1IdMSnzLOoRNcw60p,Mihalis,David Gilmour,358520,1978-05-25,1978,0.0561,0.359,0.478,0.772,0.0881,-12.428,0.0281,115.03,0.218,1.0,5.0,33,False,"album rock, art rock, classic rock, progressive rock, symphonic rock"
3N9Vibj1SwLn4SRtWJVDVO,Ma préférence,Julien Clerc,206866,1978-02-02,1978,0.764,0.562,0.41,0.000353,0.0773,-7.51,0.0253,97.782,0.29,1.0,1.0,56,False,chanson
6scsl6l5Sqyx7j0BRdvsJR,"Mercenary Territory - Live at the Rainbow Theatre, London, UK, 8/2/1977",Little Feat,276840,1978,1978,0.0803,0.484,0.694,0.000189,0.898,-7.497,0.0379,102.412,0.502,1.0,7.0,27,False,"blues rock, country rock, electric blues, folk, folk rock, jam band, mellow gold, roots rock, southern rock, swamp rock"
4yt0ktA4S9ihg0PIyTyrEE,The Movie,Jim Morrison,95986,1978,1978,0.915,0.521,0.0307,0.00174,0.145,-30.582,0.0615,81.326,0.095,1.0,9.0,35,True,"album rock, classic rock, psychedelic rock, rock"
4qgjTShkgEYwyfxfHWpFLO,Meditation - Remastered 2002,The Abyssinians,175560,1978,1978,0.0932,0.73,0.442,0.0,0.0804,-9.811,0.15,129.298,0.481,1.0,0.0,33,False,"dub, reggae, roots reggae"
7JwbbjiEiHaDD40aYssV0j,My Love,Wings,249506,1978-11-22,1978,0.511,0.439,0.381,0.000668,0.075,-12.916,0.0326,120.124,0.129,1.0,5.0,32,False,"album rock, art rock, classic rock, folk rock, mellow gold, rock, singer-songwriter, soft rock"
68MzQKYvOLKDqAWIchJSUh,More Of That Jazz - Remastered 2011,Queen,256653,1978-11-10,1978,0.0335,0.359,0.718,3.8e-05,0.0935,-5.786,0.061,174.105,0.509,1.0,4.0,26,False,"classic rock, glam rock, rock"
4dHeBVpuKV1LXIrjrwVUn8,Messin' with the Kid - Live,The Blues Brothers,174000,1978-11-01,1978,0.315,0.609,0.795,0.00112,0.701,-8.058,0.139,135.221,0.84,0.0,6.0,30,False,"blues, blues rock"
0Mur5jhkaTCaSbLZgx5fb3,Move It On Over,Hank Williams,165466,1978-01-01,1978,0.958,0.722,0.332,0.000101,0.0906,-12.25,0.0433,83.304,0.928,1.0,4.0,28,False,"country, honky tonk, traditional country, yodeling"
1jEor5XjnNHeGXJ6bdn4z6,Mi Linda Esposa,Los Bukis,143840,1978-01-01,1978,0.0802,0.505,0.621,0.0,0.302,-11.35,0.0582,93.162,0.699,1.0,7.0,31,False,"grupera, gruperas inmortales, musica mexicana"
48dL6SIUIqTS4XIUYIQBSI,Mirage,Siouxsie and the Banshees,170973,1978-11-13,1978,0.000198,0.353,0.861,0.125,0.319,-6.75,0.0457,158.196,0.742,0.0,4.0,31,False,"alternative rock, dream pop, new romantic, new wave, post-punk, punk, uk post-punk"
6dF7XmbZekbgJW5wsbHgT9,Make It Last,Con Funk Shun,302146,1978-01-01,1978,0.958,0.25,0.149,0.00624,0.1,-13.976,0.0296,74.634,0.0394,1.0,2.0,25,False,"classic soul, disco, funk, new jack swing, p funk, post-disco, quiet storm, soul, urban contemporary"
5Sq9ADswKXGMnN7HQ6Ev0L,Milk and Alcohol - 2002 Remaster,Dr. Feelgood,155880,1978,1978,0.000443,0.381,0.754,0.549,0.223,-6.945,0.0469,170.182,0.948,1.0,0.0,41,False,"blues rock, british blues, protopunk, pub rock"
4rbt9xJMIYwjTyMUYSvEL2,The Man Machine - 2009 Remaster,Kraftwerk,332333,1978,1978,0.0419,0.49,0.774,0.708,0.175,-10.854,0.0573,89.371,0.808,1.0,1.0,35,False,"dusseldorf electronic, early synthpop, electro, proto-techno, synthpop"
0jQpWlkLUf7YV8Mx3Y3zJk,Que Me Lleve El Diablo,Ramon Ayala Y Sus Bravos Del Norte,205506,1978,1978,0.705,0.791,0.518,0.000213,0.244,-7.031,0.0733,110.872,0.705,1.0,9.0,34,False,"musica mexicana, norteno"
59fEMDf3bZ2uGaeXVtCTdR,Make A Truce - Remastered 2001,Althea And Donna,240240,1978-01-01,1978,0.0113,0.88,0.585,0.034,0.0586,-10.795,0.0998,128.909,0.842,0.0,9.0,34,False,"dub, reggae, roots reggae"
4XIVYWREho2Mtj1zccY90u,Mariana,Hëctor Montemayor,159813,1978-01-01,1978,0.644,0.764,0.388,2.76e-06,0.0991,-7.003,0.0372,119.659,0.927,1.0,4.0,30,False,
1IRYhKCRI2mfxNgRKGcGcn,Manuela Run,TOTO,234640,1978-10-10,1978,0.00999,0.617,0.816,0.00277,0.66,-6.082,0.0337,105.999,0.81,1.0,9.0,35,False,"album rock, classic rock, hard rock, mellow gold, rock, soft rock, yacht rock"
6OG8fTcc7S5HWuFYVc5WgR,Mattie's Rag,Gerry Rafferty,206160,1978,1978,0.44,0.648,0.382,5.06e-05,0.102,-13.955,0.0298,125.916,0.416,0.0,2.0,32,False,"art rock, classic rock, folk rock, mellow gold, soft rock"
4Lk86divN6elNG9ShrqSuZ,Outdoor Miner - 2006 Remastered Version,Wire,104506,1978-08-07,1978,0.431,0.568,0.636,3.02e-06,0.492,-8.862,0.0297,124.37,0.71,1.0,4.0,42,False,"alternative rock, art punk, experimental rock, post-punk, punk, uk post-punk"
0nJdnEbymQOoYRnZpVTB81,The Motor-Booty Affair,Parliament,316799,1978-01-01,1978,0.0533,0.706,0.537,8.8e-05,0.144,-15.894,0.0413,105.139,0.964,0.0,5.0,26,False,"afrofuturism, classic soul, funk, funk rock, p funk, soul"
24G3gIRBrI94XfUyjc0pxI,Metropolis - 2009 Remaster,Kraftwerk,361106,1978,1978,0.00118,0.564,0.795,0.781,0.137,-9.391,0.0311,122.719,0.49,0.0,5.0,35,False,"dusseldorf electronic, early synthpop, electro, proto-techno, synthpop"
4WEdPzCYBPiUezETE0Y0pi,Misty Morning,Bob Marley & The Wailers,213546,1978-03-23,1978,0.0135,0.834,0.537,0.0,0.123,-10.644,0.0834,125.156,0.819,0.0,11.0,30,False,"reggae, roots reggae"
6ixIe6J23NbYQ1yeu7mIc5,Moon and Stars,Kalapana,203266,1978-10-23,1978,0.281,0.644,0.514,1.79e-05,0.366,-11.124,0.029,125.005,0.792,1.0,0.0,25,False,
2FMRihC1szTQtsiPIjonMh,Music of the Earth,Patrice Rushen,237186,1978-10-17,1978,0.0726,0.745,0.705,0.488,0.0697,-11.214,0.0466,103.543,0.961,1.0,5.0,33,False,"classic soul, disco, funk, jazz funk, p funk, post-disco, quiet storm, soul"
4Z6fM17CeMZ4pG61XolLby,Wild Mountain Honey,Steve Miller Band,291866,1978-01-01,1978,0.54,0.456,0.368,0.074,0.177,-15.955,0.027,103.2,0.479,1.0,4.0,37,False,"album rock, classic rock, hard rock, heartland rock, mellow gold, rock, singer-songwriter, soft rock"
2S0sC4tLzRxLVpHMxiaYrU,No More Fighting - Remastered 2001,Althea And Donna,217560,1978-01-01,1978,0.272,0.784,0.662,0.00181,0.0502,-9.183,0.135,79.535,0.703,1.0,7.0,48,False,"dub, reggae, roots reggae"
45PX39nKytoCVXaI7HkXOy,Mr.サマータイム,CIRCUS,234666,1978,1978,0.79,0.519,0.685,0.0,0.0853,-5.686,0.0393,140.646,0.823,0.0,3.0,30,False,kayokyoku
4GXsl6BhhesY0fMULm3VE7,Message From The King - 2000 Digital Remaster,Prince Far I,212093,1978,1978,0.259,0.708,0.571,0.0,0.25,-10.532,0.214,133.064,0.322,1.0,10.0,33,False,"dub, dub poetry, reggae, roots reggae, uk dub"
1360oA6YJXktFWEmVVsU99,Modern Dance,Pere Ubu,208936,1978-01-01,1978,0.157,0.372,0.634,0.0286,0.527,-8.712,0.0652,155.557,0.509,1.0,7.0,28,True,"art punk, art rock, experimental, experimental rock, post-punk, protopunk, zolo"
1nl13AcSpiCKdbkhtvJoo7,Maria Maria,Milton Nascimento,184466,1978-01-02,1978,0.61,0.468,0.612,1.23e-06,0.0672,-8.168,0.0382,128.693,0.767,1.0,8.0,52,False,"bossa nova, mpb, musica popular mineira, samba"
1fZWZxwDpzMw9qkGv17d4c,My Song,"Keith Jarrett, Jan Garbarek, Palle Danielsson, Jon Christensen",369666,1978-06-01,1978,0.914,0.443,0.0944,0.517,0.123,-16.703,0.0406,119.517,0.118,1.0,0.0,35,False,"bebop, contemporary jazz, contemporary post-bop, ecm-style jazz, jazz, jazz fusion, jazz piano"
0AgDwbiTuCKKrWcFiQDp9D,みずいろの雨,Junko Yagami,208786,1978,1978,0.0808,0.5,0.553,2.83e-06,0.133,-6.879,0.0383,126.364,0.632,0.0,2.0,37,False,"classic city pop, japanese singer-songwriter"
0S1ZV2v7DkPYLOMgaAN8LX,Missing Angel,Jim Reeves,122000,1978-06-01,1978,0.864,0.604,0.298,0.00382,0.264,-17.656,0.0283,110.514,0.679,1.0,2.0,35,False,nashville sound
5xHb1SyPrTOLC3ThG1LUu7,"Spanish Moon - Live at Lisner Auditorium, Washington, DC, 8/8/1977",Little Feat,338266,1978,1978,0.0102,0.508,0.819,0.0141,0.776,-9.074,0.209,170.853,0.771,0.0,8.0,35,False,"blues rock, country rock, electric blues, folk, folk rock, jam band, mellow gold, roots rock, southern rock, swamp rock"
1bpYNCph1aQTakZyhZaj7U,Me and the I.R.S.,Johnny Paycheck,157733,1978,1978,0.409,0.755,0.473,0.0,0.0816,-11.63,0.067,144.563,0.672,1.0,2.0,23,False,"country, outlaw country"
0hyejWewcc3twfGnfEqgRZ,Mansion On The Hill,"Hank Williams, Drifting Cowboys",156226,1978-01-01,1978,0.894,0.52,0.24,0.0,0.125,-14.233,0.0261,154.144,0.766,1.0,9.0,25,False,"country, honky tonk, traditional country, yodeling"
7hDRih8BUwk8b7pklkupDf,María Bonita,Julio Iglesias,179106,1978,1978,0.629,0.394,0.385,2.96e-06,0.0858,-15.659,0.0484,74.848,0.798,1.0,2.0,33,False,latin pop
2za1yqhpjvm5EF4s3bUf6e,NIGHTS,Masayoshi Takanaka,294013,1978,1978,0.062,0.606,0.463,0.0859,0.0793,-12.464,0.0381,123.742,0.304,1.0,0.0,43,False,classic japanese jazz
5R6K9DrJHgVhE31KA2ERZ7,Mind Your Own Business,"Hank Williams, Drifting Cowboys",177600,1978-01-01,1978,0.899,0.754,0.322,0.0,0.112,-14.274,0.0343,140.594,0.848,1.0,4.0,25,False,"country, honky tonk, traditional country, yodeling"
7vUbFCefkYWl4uSpMManF1,One More Look At The Night,Andy Gibb,227066,1978-04-04,1978,0.37,0.71,0.614,2.39e-06,0.19,-9.552,0.0323,120.955,0.91,1.0,2.0,43,False,"disco, mellow gold, soft rock"
2j7wh4O5ntkLl0YsTBMDel,Music Must Change,The Who,278026,1978-08-18,1978,0.667,0.566,0.354,3e-06,0.149,-9.992,0.0298,106.819,0.397,1.0,7.0,26,False,"album rock, british invasion, classic rock, hard rock, rock"
1yK84CWCGfVDUOCraSUsaQ,Muqaddar Ka Sikandar,Kishore Kumar,322120,1978-12-01,1978,0.636,0.471,0.649,2.64e-06,0.333,-9.742,0.0436,111.535,0.707,0.0,0.0,29,False,"classic bollywood, filmi"
7dcJDj6oZYp8hmVr3Nfo8Q,Magnolia,Tom Petty and the Heartbreakers,183400,1978-01-01,1978,0.118,0.63,0.765,0.0,0.0487,-5.583,0.0298,125.152,0.564,0.0,6.0,24,False,"album rock, classic rock, hard rock, heartland rock, mellow gold, rock, singer-songwriter, soft rock"
6tisytwaOaBA4CAZPPdlFP,Menino do Rio,Baby Do Brasil,263733,1978-09-14,1978,0.73,0.38,0.548,0.000142,0.31,-9.26,0.0333,152.498,0.395,1.0,0.0,51,False,"mpb, pop nacional antigas, rock nacional brasileiro"
7HjipY3Vy2HAN11D2juKHT,Next To You,The Police,171973,1978-11-02,1978,0.0454,0.407,0.975,1.26e-05,0.0837,-6.181,0.0666,175.246,0.61,0.0,4.0,54,False,"album rock, classic rock, permanent wave, rock"
6Ys5Xmyl13GuzVWDOqZlcL,ノスタルジア・オブ・アイランド,Tatsuro Yamashita,575986,1978,1978,0.173,0.545,0.676,0.622,0.362,-8.274,0.0607,124.639,0.234,1.0,7.0,49,False,classic city pop
0w24uOUM9O7Jli66Mx5RIf,Never Say Die - 2014 Remaster,Black Sabbath,229040,1978-09-28,1978,0.00389,0.332,0.709,4.74e-05,0.097,-8.335,0.0321,97.897,0.467,0.0,9.0,40,False,"album rock, alternative metal, birmingham metal, classic rock, hard rock, metal, rock, stoner rock, uk doom metal"
53rN8CcgrWP6DZcuQ4Q4og,Needles and Pins - 2018 Remaster,Ramones,141653,1978,1978,0.0145,0.732,0.935,6.59e-05,0.105,-2.928,0.031,119.218,0.961,1.0,6.0,49,False,"alternative rock, early us punk, permanent wave, punk, rock"
3Y5BAkdubZYhu16DLLN95E,New Orleans Ladies,LeRoux,236760,1978-01-01,1978,0.22,0.491,0.679,2e-05,0.122,-4.055,0.0247,81.433,0.385,1.0,11.0,33,False,
2nnPaUi7ENaRlheBOPR4g4,ノアノア,Shigeru Suzuki,249440,1978,1978,0.816,0.737,0.5,0.902,0.0861,-9.98,0.0291,120.885,0.504,1.0,9.0,37,False,classic city pop
2GFakdGflCFgwFrJfZkvzK,No Action - 2021 Remaster,Elvis Costello & The Attractions,121093,1978-03-17,1978,0.0265,0.342,0.907,2.36e-05,0.206,-4.44,0.0672,157.509,0.624,1.0,4.0,35,False,"art rock, new romantic, new wave, new wave pop, power pop"
4B9MPmBNMqJkJCpj93NtOe,Nighttime in the Switching Yard,Warren Zevon,259320,1978-06-01,1978,0.0295,0.8,0.882,0.0828,0.0442,-6.659,0.0495,113.364,0.964,1.0,8.0,34,False,"country rock, folk, folk rock, piano rock, roots rock, singer-songwriter"
0Ukn3JxUNbxCroOKkVNH4C,No Way,David Gilmour,372320,1978-05-25,1978,0.00973,0.515,0.413,0.00335,0.0795,-12.375,0.024,76.366,0.112,0.0,0.0,34,False,"album rock, art rock, classic rock, progressive rock, symphonic rock"
2308VPPaMh7Q3AX1Zap99A,Rock 'N' Roll Damnation,AC/DC,217640,1978-05-05,1978,0.0327,0.524,0.995,0.147,0.0819,-2.676,0.106,133.596,0.323,1.0,9.0,52,False,"australian rock, hard rock, rock"
712cvetPbOegLiirMnU1ye,Nice Boys,Rose Tattoo,172466,1978-11-01,1978,5.19e-05,0.358,0.885,0.0066,0.275,-11.828,0.0363,198.737,0.757,1.0,4.0,40,False,australian rock
2b8ja3uL8fPS0ozNfjV15p,Never Let Her Go,David Gates,187840,1978,1978,0.312,0.592,0.356,3.94e-06,0.0877,-15.755,0.0245,84.159,0.631,1.0,8.0,36,False,soft rock
4jV4ld7z4BrswF3uKqz8Ny,Never Let Her Slip Away,Andrew Gold,208240,1978,1978,0.538,0.718,0.368,0.0,0.0614,-17.535,0.0351,114.295,0.895,0.0,0.0,45,False,underground power pop
1krBKWusytTAT2jNWJGA7m,Neon Lights - 2009 Remaster,Kraftwerk,532533,1978,1978,0.0551,0.71,0.978,0.9,0.272,-9.017,0.0382,104.753,0.661,1.0,4.0,36,False,"dusseldorf electronic, early synthpop, electro, proto-techno, synthpop"
1iVTEYGy9dKQSdNYRtkIvj,Ni El Dinero Ni Nada,Ramon Ayala Y Sus Bravos Del Norte,250733,1978,1978,0.208,0.777,0.74,0.003,0.0375,-5.68,0.12,106.553,0.707,1.0,9.0,26,False,"musica mexicana, norteno"
6kbq7yE8CbAqWkP1opSd7v,Nereci,"Djavan, Marizinha",199800,1978-01-08,1978,0.226,0.684,0.578,0.0,0.246,-12.839,0.096,99.934,0.815,1.0,0.0,42,False,"mpb, musica alagoana"
00NZUSWCUszqs2MFEfReTj,Never Give Your Heart Away,Carlton & The Shoes,185760,1978-01-01,1978,0.713,0.8,0.296,0.565,0.116,-11.202,0.161,143.367,0.656,1.0,2.0,26,False,"rocksteady, vintage reggae"
0TTYGSGO6kWhpRu4xgiZC3,"Nocturne No. 2 in E flat, Op. 9 No. 2","Frédéric Chopin, Claudio Arrau",286493,1978-01-01,1978,0.992,0.484,0.0235,0.934,0.0782,-25.245,0.0486,108.074,0.0734,1.0,10.0,33,False,"classical, early romantic era, polish classical"
5UbgEQUFzAfkS034ymdkrT,Nutted By Reality,Nick Lowe,171466,1978,1978,0.0381,0.599,0.503,8.47e-05,0.127,-11.478,0.0461,125.642,0.96,1.0,9.0,27,False,"power pop, pub rock, singer-songwriter"
6ZapnnfYEywUlViWjOCkJZ,Nicotine Stain,Siouxsie and the Banshees,177120,1978-11-13,1978,0.00266,0.475,0.759,0.316,0.0496,-5.496,0.0348,148.106,0.711,1.0,9.0,30,False,"alternative rock, dream pop, new romantic, new wave, post-punk, punk, uk post-punk"
0rSECa18k7Gaok4eizJvuw,Non-Alignment Pact,Pere Ubu,198529,1978-01-01,1978,0.0106,0.276,0.828,0.521,0.143,-9.01,0.0536,156.391,0.34,1.0,9.0,29,False,"art punk, art rock, experimental, experimental rock, post-punk, protopunk, zolo"
0RqPDkzJYtVwmAUjjWRjVx,New Song,The Who,253000,1978-08-18,1978,0.097,0.7,0.77,7.86e-05,0.346,-8.872,0.0359,134.167,0.419,1.0,0.0,28,False,"album rock, british invasion, classic rock, hard rock, rock"
3magba5fn3Wpzh9P9jbA7e,Naturally,Kalapana,260466,1978-10-23,1978,0.533,0.401,0.383,5.49e-06,0.0833,-12.391,0.0283,131.79,0.456,1.0,7.0,23,False,
7iyd0aOJ2J54hENgLeGxCk,Stardust,Willie Nelson,230933,1978-04-01,1978,0.881,0.549,0.267,0.0209,0.137,-12.382,0.0416,144.546,0.0993,0.0,9.0,41,False,"classic country pop, classic texas country, country, country rock, nashville sound, outlaw country, singer-songwriter"
66zOdwAIuFXNrB3kcnrkyr,"Nocturne No. 19 in E minor, Op. 72 No. 1","Frédéric Chopin, Claudio Arrau",252000,1978-01-01,1978,0.99,0.283,0.0352,0.915,0.135,-21.772,0.04,69.512,0.0502,0.0,4.0,32,False,"classical, early romantic era, polish classical"
4wr2UsVqrWgrZsOtl8Rusy,Never Make A Move Too Soon,B.B. King,329933,1978-01-01,1978,0.37,0.762,0.524,0.0875,0.727,-12.762,0.0445,107.489,0.923,1.0,10.0,26,False,"blues, blues rock, classic rock, electric blues, jazz blues, soul, soul blues, traditional blues"
2wr9GtUc8xPMhTVZTc191u,What's Next to the Moon,AC/DC,211813,1978-05-05,1978,0.00115,0.513,0.825,0.00591,0.187,-5.019,0.0556,140.949,0.894,1.0,9.0,43,False,"australian rock, hard rock, rock"
4ZGvfw5qMYC7nDUpKdp8or,Nanea Ko Maka I Ka Le'ale'a,Gabby Pahinui,159573,1978,1978,0.742,0.753,0.273,1.46e-06,0.108,-13.347,0.133,125.352,0.516,1.0,7.0,23,False,"hula, slack-key guitar"
5RMaw36NEmgSJk7Nlloh91,Never Let You Down,Al Campbell,215226,1978,1978,0.108,0.845,0.421,0.000752,0.0937,-10.691,0.0807,133.479,0.824,1.0,0.0,28,False,"lovers rock, old school dancehall, reggae, rocksteady, roots reggae"
26f5vLkn7M4U2TNjwpMOEM,Natalia - Remastered,Van Morrison,246413,1978-09,1978,0.0806,0.628,0.857,5.94e-05,0.317,-5.827,0.0365,127.539,0.764,1.0,2.0,25,False,"classic rock, folk, folk rock, mellow gold, rock, singer-songwriter, soft rock"
2cPSVURedYKPcWmL03FAW8,No Walls No Ceilings No Floors,Barbara Mandrell,171074,1978-09-20,1978,0.333,0.545,0.335,8.03e-05,0.103,-11.394,0.0283,135.975,0.284,1.0,0.0,32,False,"classic country pop, country, country gospel, country rock"
2gXvgBpMaDZRxctxbI3Zpc,New Pony,Bob Dylan,269640,1978-06-15,1978,0.252,0.493,0.574,2.71e-05,0.203,-11.08,0.0313,80.256,0.829,1.0,9.0,29,False,"classic rock, country rock, folk, folk rock, rock, roots rock, singer-songwriter"
2CeBK22RiNWepnaCs0yHPb,Nice 'N' Sleazy,The Stranglers,194080,1978-05-26,1978,0.00591,0.555,0.639,0.00398,0.0743,-8.438,0.0367,103.522,0.964,0.0,11.0,38,False,"glam rock, new romantic, new wave, new wave pop, protopunk, pub rock, zolo"
76GyGS1C84YBtb3qX6j5mk,Northern Lights,Renaissance,247200,1978-11-06,1978,0.569,0.503,0.405,0.0,0.604,-10.868,0.0264,94.514,0.526,1.0,4.0,35,False,"progressive rock, symphonic rock"
2J7xJcaxx8IuhAheIjDzdz,No Limit,Breakwater,255826,1978,1978,0.125,0.646,0.666,1.54e-05,0.062,-12.691,0.0465,109.175,0.73,1.0,1.0,26,False,canadian indie
4gmJjjVWv9rfK4Nl8wDNVR,Nightflight to Venus,Boney M.,287240,1978,1978,0.00324,0.631,0.946,0.713,0.144,-7.738,0.0572,123.373,0.814,0.0,1.0,36,False,europop
00JflFF3IHAUi3eHvTKzmV,No Regrets,Black Devil Disco Club,301139,1978-01-01,1978,0.0354,0.616,0.859,0.554,0.0686,-6.955,0.0333,126.458,0.412,1.0,0.0,29,False,"dark disco, italo disco, vintage french electronic"
04E1J0D07gVhOTTyrztkgJ,Now That We've Found Love,Third World,459600,1978-01-01,1978,0.00435,0.712,0.503,0.00374,0.0834,-15.707,0.0754,119.312,0.719,1.0,1.0,29,False,"reggae, reggae fusion, roots reggae"
2WEE10JUB0IuuTKluMyYXG,No Time to Think,Bob Dylan,500453,1978-06-15,1978,0.273,0.388,0.478,0.0,0.121,-10.093,0.0404,188.573,0.622,1.0,10.0,28,False,"classic rock, country rock, folk, folk rock, rock, roots rock, singer-songwriter"
5Hake6CnTOJgVl5eXpG6XQ,Nostalgia - 1996 Remastered Version,Buzzcocks,174173,1978,1978,0.0016,0.269,0.657,0.0,0.21,-12.394,0.0432,174.044,0.803,1.0,10.0,27,False,"alternative rock, britpop, madchester, new wave, post-punk, punk, uk post-punk"
3TMvz08PqjPCVzINmbK06s,Needles and Pins - 1999 Remaster,Ramones,141506,1978-09-22,1978,0.0143,0.788,0.886,0.000759,0.103,-5.914,0.0318,119.218,0.942,1.0,6.0,40,False,"alternative rock, early us punk, permanent wave, punk, rock"
0TQdYnI97UYWDFRgKmwJ9L,No Me Amenaces,Julio Iglesias,191360,1978,1978,0.617,0.391,0.209,0.000275,0.417,-15.61,0.0379,83.012,0.514,1.0,5.0,32,False,latin pop
3bCmDqflFBHijgJfvtqev5,1/1 - Remastered 2004,Brian Eno,1041520,1978,1978,0.982,0.26,0.00397,0.913,0.102,-31.095,0.0406,82.862,0.0368,1.0,2.0,49,False,"abstract, ambient, art pop, art rock, compositional ambient, experimental, experimental ambient, fourth world, glam rock, minimalism, singer-songwriter"
2oKbSFQU9N8bUgUutVDPTD,No Second Thoughts,Tom Petty and the Heartbreakers,161173,1978-01-01,1978,0.476,0.399,0.526,0.0,0.291,-6.822,0.0295,169.87,0.37,1.0,0.0,21,False,"album rock, classic rock, hard rock, heartland rock, mellow gold, rock, singer-songwriter, soft rock"
7ui6zsu0BWTzi7WdscJ78r,"Need Your Love - Live at Nippon Budokan, Tokyo, JPN - April 1978",Cheap Trick,526240,1978-10-08,1978,0.00302,0.394,0.822,0.672,0.917,-9.594,0.0448,134.04,0.419,1.0,9.0,22,False,"album rock, beatlesque, classic rock, glam metal, glam rock, hard rock, mellow gold, power pop, rock, singer-songwriter, soft rock"
4363q2V1UHzgbUDItJ7KZH,Need You Bad,Ted Nugent,256800,1978,1978,0.0234,0.367,0.868,0.00974,0.777,-11.036,0.0603,166.647,0.59,0.0,2.0,22,False,"acid rock, album rock, blues rock, classic rock, glam metal, hard rock, rock, southern rock"
0BbTIw4SY4kF9RkZ514bRY,No Woman No Cry - Live At Ahoy Hallen/1978,Bob Marley & The Wailers,402360,1978-03-23,1978,0.0666,0.457,0.681,0.0,0.93,-10.464,0.126,80.728,0.499,1.0,0.0,27,False,"reggae, roots reggae"
3ixUkfhlX2EnQhtKv1denb,No Es Como Antes,Vitin Aviles,164362,1978-02-11,1978,0.946,0.458,0.427,0.00043,0.114,-8.635,0.081,178.192,0.43,1.0,7.0,23,False,"musica tradicional cubana, salsa international"
0sFq478LIo9BFwf2qzMzzF,The Year 2003 Minus 25 - Remastered,"Waylon Jennings, Willie Nelson",184266,1978-01-01,1978,0.355,0.626,0.457,9.2e-06,0.0668,-13.785,0.0384,102.166,0.474,1.0,4.0,37,False,"classic texas country, country, outlaw country"
7m4lC0uLXHITenebWYjeER,No Place to Fall,Townes Van Zandt,215320,1978,1978,0.588,0.514,0.255,3.85e-05,0.107,-15.484,0.0315,121.403,0.281,1.0,4.0,21,False,"alternative country, classic texas country, cosmic american, folk, outlaw country, roots rock, singer-songwriter"
5ZsjiK0NIgNmDhe5qiCVJI,Nite Flights,The Walker Brothers,261640,1978-07-15,1978,0.00224,0.523,0.572,0.00148,0.287,-12.436,0.0352,124.07,0.664,1.0,7.0,25,False,british invasion
6qPJyX7IRJ4aFuUDGIX3lg,Naci Moreno,Bobby Valentin,277200,1978-05-01,1978,0.582,0.627,0.495,1.94e-05,0.324,-16.153,0.0408,101.538,0.851,1.0,5.0,23,False,"boogaloo, jazz puertorriqueno, salsa, salsa puertorriquena"
1Cq5jJQ5DWsZ7OAEeskMNZ,Nada One,Heart,320733,1978-10-07,1978,0.403,0.443,0.103,0.00068,0.0782,-19.841,0.0298,78.149,0.155,1.0,5.0,21,False,"album rock, classic rock, glam metal, hard rock, mellow gold, new wave pop, rock, singer-songwriter, soft rock"
53ZWOGMHGZFbp55aTbesUs,Night Rally - 2021 Remaster,Elvis Costello & The Attractions,162506,1978-03-17,1978,0.396,0.43,0.63,0.0,0.596,-5.604,0.0291,101.089,0.55,1.0,4.0,23,False,"art rock, new romantic, new wave, new wave pop, power pop"
1AR0s6tAeEXNwu7vQHGu4c,No Time to Be 21,The Adverts,156479,1978-01-01,1978,0.00962,0.332,0.849,5.92e-06,0.136,-6.094,0.105,162.123,0.71,1.0,0.0,26,True,"punk, uk post-punk"
6L8L0AAupUq6cLsY2S6y3y,Rock N' Roll Party Queen - From “Grease”,Louis St. Louis,131840,1978-04-04,1978,0.718,0.765,0.499,4.87e-05,0.102,-11.204,0.0398,144.177,0.964,1.0,5.0,39,False,
1JrYGuKqJsMK99kjLFQ0rC,No Means Yes,Herbie Hancock,378400,1978-06,1978,0.278,0.601,0.68,0.81,0.0998,-12.306,0.0342,103.404,0.905,0.0,1.0,24,False,"contemporary post-bop, instrumental funk, jazz, jazz funk, jazz fusion, jazz piano"
4hx7B8TCMXljgRhQgboyFf,Nobody's Lonesome For Me - Single Version,"Hank Williams, Drifting Cowboys",151000,1978-01-01,1978,0.831,0.714,0.236,0.0,0.0712,-14.12,0.051,140.578,0.956,1.0,2.0,21,False,"country, honky tonk, traditional country, yodeling"
2zWmGDao7Bq4190TCRtswH,No Spare Parts,The Rolling Stones,270466,1978-06-09,1978,0.239,0.594,0.761,1.47e-05,0.712,-5.145,0.0292,72.657,0.541,1.0,0.0,18,False,"album rock, british invasion, classic rock, rock"
6O2vaCQvjnbJdirwwPmIbS,"Night Life - Live at Harrah's Casino, Lake Tahoe, NV - April 1978",Willie Nelson,247160,1978-11-01,1978,0.558,0.515,0.601,0.291,0.498,-8.391,0.0514,79.577,0.35,1.0,0.0,18,False,"classic country pop, classic texas country, country, country rock, nashville sound, outlaw country, singer-songwriter"
2DC2kFrRHR9IVAuRdjAUQa,"Whiskey River - Live at Harrah's Casino, Lake Tahoe, NV - April 1978",Willie Nelson,218626,1978-11-01,1978,0.428,0.512,0.755,0.133,0.439,-7.693,0.0305,99.797,0.736,1.0,7.0,33,False,"classic country pop, classic texas country, country, country rock, nashville sound, outlaw country, singer-songwriter"
76Wu3hxN50G2PgOB5LIE0d,Not A Chance,Don Williams,224520,1978-08-23,1978,0.111,0.684,0.434,0.0382,0.0816,-15.561,0.0376,96.917,0.455,1.0,7.0,23,False,"classic country pop, country"
7akwJF31cm16zeovNH8DZj,Summer Nights in Hollywood,Brian Elliot,190106,1978,1978,0.163,0.775,0.667,0.000279,0.0546,-9.601,0.0448,101.843,0.934,1.0,1.0,37,False,"deep soft rock, yacht rock"
618fimpMrg4gJWMI641Nuw,Narnia - Remastered 2005,Steve Hackett,245226,1978,1978,0.058,0.454,0.533,0.00216,0.765,-11.342,0.0296,135.876,0.398,1.0,4.0,26,False,"instrumental rock, progressive rock, symphonic rock"
1qm36Z3FdMC6zJKsRF8rfg,New Waltz,Tony Rice Unit,311493,1978-11-30,1978,0.735,0.363,0.145,0.92,0.107,-18.471,0.0319,80.113,0.42,1.0,5.0,17,False,"bluegrass, progressive bluegrass"
4wEEm9yCQnHShbbzmZmvpJ,Nurse Rozetta,Alice Cooper,255706,1978,1978,0.116,0.39,0.648,2.64e-06,0.139,-14.092,0.288,165.392,0.246,1.0,5.0,23,False,"album rock, classic rock, detroit rock, glam metal, glam rock, hard rock, metal, protopunk, rock"
5MmqoR1P4LUcFtkZQOXn7G,"When Did You Stop Loving Me, When Did I Stop Loving You - Instrumental",Marvin Gaye,363733,1978-12-15,1978,0.423,0.652,0.584,0.0189,0.0547,-12.593,0.0408,109.493,0.488,0.0,5.0,24,False,"classic soul, motown, neo soul, northern soul, quiet storm, soul, vocal jazz"
0g2ADk0pu6ynetEOPV11Vb,Something in the Night,Bruce Springsteen,311826,1978-06-02,1978,0.0439,0.391,0.375,0.000512,0.102,-9.174,0.027,142.025,0.481,1.0,0.0,41,False,"heartland rock, mellow gold, permanent wave, rock, singer-songwriter"
3KH39R9cO3ZWN6hqRbTKM3,This Night Won't Last Forever,Bill LaBounty,265640,1978-07-21,1978,0.322,0.648,0.402,1.38e-06,0.0886,-14.972,0.0241,102.682,0.607,1.0,3.0,36,False,"deep soft rock, yacht rock"
7h7IkK9jXlc2szCeexTDHG,Yo No Te Pido,Pablo Milanés,167563,1978-01-01,1978,0.00557,0.424,0.628,0.002,0.243,-7.864,0.0287,146.397,0.609,1.0,9.0,46,False,"bolero cubano, cantautor, nueva cancion, trova"
771gsWCBNIxpPRe5vpxkb8,Nunca Me Ha Dejado,Marino,303966,1978-02-01,1978,0.0248,0.456,0.344,0.0211,0.0957,-16.093,0.0569,77.157,0.595,0.0,2.0,24,False,mariachi cristiano
1jMUJ4j7f7nKo58VQoDbvA,Pick Up the Tempo,"Waylon Jennings, Willie Nelson",151160,1978-01-01,1978,0.106,0.485,0.461,4.31e-05,0.269,-13.99,0.046,177.236,0.809,1.0,9.0,34,False,"classic texas country, country, outlaw country"
7y8N6j8JIsA6N6KUkpLj7u,Nobody,Eddie Money,279640,1978,1978,0.0413,0.692,0.575,6.42e-05,0.0524,-12.067,0.055,102.055,0.904,1.0,7.0,17,False,"album rock, classic rock, country rock, glam metal, hard rock, mellow gold, soft rock, southern rock"
