id,name,artists,duration_ms,release_date,year,acousticness,danceability,energy,instrumentalness,liveness,loudness,speechiness,tempo,valence,mode,key,popularity,explicit,genre
4DXRCX1cX9d7DpcAqlVbAE,Orgulho Vencido,Banda Sul América,190390,1978-01-01,1978,0.591,0.619,0.49,0.182,0.0931,-9.679,0.0279,102.538,0.972,1.0,10.0,0,False,
4ENYog3LzgNmb6F4uAdtHD,Sem Ondas,Banda Sul América,236720,1978-01-01,1978,0.12,0.536,0.55,0.155,0.296,-10.075,0.026,98.047,0.915,1.0,10.0,0,False,
58QF5bnsgWhbWfP1sVq1Lm,Que Maravilha,Banda Sul América,206585,1978-01-01,1978,0.672,0.519,0.666,0.0496,0.0685,-9.232,0.0381,85.671,0.984,1.0,5.0,0,False,
3y0Z2rzpExUS2XCAPJWvsR,Maxixe do Joaquim,Banda Sul América,204833,1978-01-01,1978,0.583,0.608,0.797,0.0654,0.19,-10.158,0.0389,114.461,0.967,1.0,5.0,0,False,
4T18l10gDfyoLsHERK7nlv,Na Casa de Sinhá,Banda Sul América,127445,1978-01-01,1978,0.157,0.487,0.824,0.0148,0.516,-9.649,0.0403,115.325,0.935,1.0,0.0,0,False,
3GxB7mhtOUtcADftfPoaIq,Marcas do Que Se Foi,Banda Sul América,148745,1978-01-01,1978,0.297,0.476,0.53,0.000218,0.165,-9.229,0.0325,148.31,0.966,1.0,5.0,0,False,
2oFUNpujepad73cQxILDm0,Menina Linda,Banda Sul América,213184,1978-01-01,1978,0.4,0.552,0.64,0.00472,0.215,-8.901,0.0365,117.598,0.792,1.0,10.0,0,False,
3YJQDPpuXfi0zy4997K5nI,Het Hele Leven Is Maar 30.000 Dagen,Wim Kersten & De Viltjes,224280,1978,1978,0.814,0.81,0.524,0.0,0.148,-12.824,0.038,106.817,0.934,1.0,0.0,0,False,
5aVl5P7bDV3H669auBKGjk,When Pompeii Blows,This Evening's Show,79072,1978-12-11,1978,0.899,0.401,0.723,2.42e-06,0.447,-8.542,0.0594,157.847,0.844,1.0,9.0,0,False,
0HalFJGLV0HmaHsc4wa3yF,Like a Bird,Nautilus,259467,1978-03-31,1978,0.177,0.304,0.607,4.57e-06,0.11,-7.336,0.0304,142.056,0.43,1.0,2.0,0,False,
6Xtb06IXq2EQcBd1vh6sYd,I Am Your Brain,This Evening's Show,82311,1978-12-11,1978,0.137,0.781,0.358,0.0,0.155,-14.132,0.0446,120.044,0.6,1.0,2.0,0,False,
7KVtGCF4TXBuAnH77OaYKX,"Kalli Morni Mor Binaan Tarfey Wey (From ""Duniya"")",Noor Jehan,274269,1978-01-01,1978,0.749,0.484,0.744,0.00468,0.331,-6.182,0.063,90.949,0.822,1.0,3.0,0,False,"classic bollywood, classic pakistani pop, filmi, ghazal"
1A7P6dICIdHgnAtKEgzeaf,Tane Ramta Shreefal Rakhun,Asha Bhosle,357787,1978-01-30,1978,0.93,0.512,0.533,0.00044,0.214,-7.434,0.144,115.016,0.722,1.0,8.0,0,False,"chutney, classic bollywood, filmi"
3eFMPMsdS0R6CJKkaJWH4M,Podhi Ja Podhi Ja Mara Lal,Asha Bhosle,384134,1978-01-30,1978,0.979,0.456,0.221,0.000511,0.161,-7.334,0.0569,173.699,0.508,1.0,6.0,0,False,"chutney, classic bollywood, filmi"
0cvVOxJZVRgybAoD40w18a,"Nayin Nayin Nayin Sajnaan (From ""Tere Ishq Nachaya"")",Naseem Begum,192621,1978-01-01,1978,0.86,0.437,0.593,0.000117,0.526,-11.354,0.0779,138.921,0.964,1.0,5.0,0,False,"classic pakistani pop, ghazal"
5F1btb1oYaMRUAuzav1qBo,What Is an Idea?,This Evening's Show,193854,1978-12-11,1978,0.202,0.585,0.44,0.749,0.383,-10.266,0.0269,102.488,0.48,1.0,2.0,0,False,
7wATP2GKvAewVCIpg8Ehqq,Morning Map,This Evening's Show,51200,1978-12-11,1978,0.945,0.355,0.102,0.592,0.112,-21.173,0.0454,97.116,0.456,1.0,3.0,0,False,
0yAi8iKRgy90VuNNZd3zhz,11:59,Blondie,200864,1978-09-23,1978,0.0166,0.394,0.872,0.004,0.178,-5.709,0.0588,183.874,0.753,1.0,6.0,36,False,"candy pop, new wave pop, permanent wave, power pop, rock, synthpop"
53X9XQNprbRaS2n7GZATDe,Backwards Traveller - Remastered 1993,Wings,69026,1978-03-31,1978,0.0362,0.686,0.487,0.00112,0.195,-11.906,0.0342,114.167,0.68,1.0,0.0,24,False,"album rock, art rock, classic rock, folk rock, mellow gold, rock, singer-songwriter, soft rock"
5bL5TIGPu665w0L0BzzbUM,"Bloody Mary Morning - Live at Harrah's Casino, Lake Tahoe, NV - April 1978",Willie Nelson,213160,1978-11-01,1978,0.3,0.391,0.75,0.0401,0.955,-8.379,0.046,167.842,0.556,1.0,7.0,16,False,"classic country pop, classic texas country, country, country rock, nashville sound, outlaw country, singer-songwriter"
7ESwIYzf5RcbsOO2eZUvLC,Bicycle Race - 1991 Bonus Remix,Queen,298000,1978-11-10,1978,0.0375,0.568,0.654,0.00101,0.0771,-13.356,0.268,170.686,0.633,1.0,7.0,13,False,"classic rock, glam rock, rock"
15RP4bsiHwMV9wbhR8RHEa,Billy Hunt - 1997 Remaster,The Jam,180026,1978-11-03,1978,0.0206,0.371,0.791,0.0,0.382,-10.409,0.087,92.081,0.896,1.0,7.0,25,False,"mod revival, new romantic, new wave, punk, ska revival"
7DCLXIkWn0RPXztXvpFbRq,"Back Home Again - Live at the Sydney Opera House, Australia - November 1977",John Denver,286240,1978-03-01,1978,0.377,0.497,0.407,0.0,0.704,-10.865,0.0372,121.149,0.462,1.0,4.0,14,False,"classic country pop, folk, folk rock, mellow gold, singer-songwriter, soft rock"
5AxegK3ROc4Meb0Fy1XbpP,Blues Won't Let Me Be,Left Hand Frank,151333,1978-09-01,1978,0.539,0.493,0.632,0.231,0.246,-11.51,0.0424,118.517,0.72,1.0,4.0,16,False,
1wKph9itficbq3OGbVWTDx,To Be True,Kalapana,166066,1978-10-23,1978,0.402,0.655,0.433,0.0,0.252,-12.065,0.0418,134.569,0.698,1.0,2.0,19,False,
3R30L1nkH6nUVAsyAc0xMW,Love You More - 1996 Remastered Version,Buzzcocks,110000,1978,1978,0.00139,0.33,0.793,0.0,0.406,-6.3,0.0937,87.459,0.754,1.0,4.0,28,False,"alternative rock, britpop, madchester, new wave, post-punk, punk, uk post-punk"
3wqi3tFhbgG6JEZCQDdMDW,Lipstick - 1996 Remastered Version,Buzzcocks,160106,1978,1978,1.14e-05,0.267,0.824,1.3e-05,0.186,-7.006,0.0547,166.557,0.43,1.0,4.0,25,False,"alternative rock, britpop, madchester, new wave, post-punk, punk, uk post-punk"
2aWDeT8LtP9XRnVawFVfKW,Book Of Life,Hugh Mundell,183520,1978-07-01,1978,0.0159,0.66,0.475,0.0212,0.168,-9.47,0.203,138.948,0.641,1.0,2.0,18,False,"dub, reggae, roots reggae"
2eH6hxg55caYvT8tWqoaTf,(For You) I'd Chase a Rainbow,Kalapana,179000,1978-10-23,1978,0.28,0.546,0.385,2.94e-06,0.198,-11.47,0.0271,125.3,0.291,0.0,9.0,22,False,
31W6LGVV6sSQQZQIXJVIbV,Beep Beep Love,Gruppo Sportivo,176160,1978-04-08,1978,0.319,0.727,0.774,0.0,0.472,-8.192,0.0299,116.25,0.725,0.0,11.0,25,False,"dutch rock, nederpop"
04G0gtPClMntl19E0TuKu8,Love Battery - 1996 Remastered Version,Buzzcocks,127706,1978,1978,0.000157,0.156,0.847,1.85e-05,0.17,-8.157,0.0704,194.156,0.565,0.0,11.0,20,False,"alternative rock, britpop, madchester, new wave, post-punk, punk, uk post-punk"
7aDE1BHtM60H65I3U89dlY,"Cello Suite No. 1 in G Major, BWV 1007: Prélude","Johann Sebastian Bach, Yo-Yo Ma",139000,1978,1978,0.978,0.395,0.152,0.723,0.101,-23.131,0.07,86.312,0.458,1.0,6.0,23,False,"baroque, classical, early music, german baroque"
1GJur1isKPhj2qopwJPyK1,12 Bars from Mars,Lenny White,190920,1978,1978,0.00136,0.431,0.686,0.661,0.345,-12.144,0.0577,132.938,0.947,1.0,2.0,9,False,"jazz funk, jazz fusion"
30chBEF8YtdVjCImxQybXF,Shock On The Tube (Don't Want Love),10cc,218426,1978,1978,0.453,0.608,0.451,0.0,0.0981,-10.878,0.0427,117.998,0.567,1.0,2.0,24,False,"album rock, art rock, classic rock, glam rock, mellow gold, new romantic, soft rock, symphonic rock, yacht rock"
5yijXzKaT2wO9ySWMTkTKy,Icarus - Borne on Wings of Steel - Live 1977-1978,Kansas,358466,1978-10-01,1978,0.00206,0.327,0.851,0.0037,0.722,-7.656,0.0629,96.377,0.508,0.0,6.0,23,False,"album rock, classic rock, hard rock, heartland rock, mellow gold, progressive rock, rock, soft rock"
1ZjTT7C4lVP0f8mWhcGFax,Belexes - Live 1977-1978,Kansas,274493,1978-10-01,1978,0.000217,0.227,0.95,0.00221,0.986,-7.905,0.0763,174.349,0.514,1.0,10.0,9,False,"album rock, classic rock, hard rock, heartland rock, mellow gold, progressive rock, rock, soft rock"
46VjzCIkXJjJTLmg6bscSU,My Baby's So Ugly,Eddie Shaw,211866,1978-09-01,1978,0.54,0.679,0.621,0.00755,0.113,-11.117,0.134,118.295,0.879,1.0,0.0,20,False,chicago blues
1ZTLDuz2IRQwx3USdUYrnF,What Do I Do,Kalapana,176733,1978-10-23,1978,0.29,0.646,0.512,1.02e-05,0.125,-10.789,0.045,150.762,0.821,1.0,1.0,20,False,
7wnTa3tx1wVq8QgIR9bfB2,"Girl, You're A Woman - The Best Little Whorehouse In Texas/1978 Original Broadway Cast/Remastered","Carol Hall, Carlin Glynn, Lisa Brown, Donna King, Marta Sanders, Jan Merchant, Louise Quick-Bowen, Becky Gelke",206332,1978-01-01,1978,0.733,0.323,0.386,0.0,0.0831,-7.236,0.0319,150.823,0.263,1.0,4.0,22,False,
0LiSlICWoaiRLP7WqzJ68X,La Barca De Oro - Remasterizado,Mocedades,208266,1978,1978,0.885,0.608,0.424,2.32e-05,0.131,-10.075,0.0237,95.911,0.374,1.0,4.0,20,False,"cancion melodica, pop romantico, ranchera"
6PWvOj8Sjt6hDWnwniD6f3,Reds In My Bed,10cc,248080,1978,1978,0.785,0.765,0.539,7.15e-06,0.122,-12.885,0.0342,112.059,0.96,1.0,0.0,24,False,"album rock, art rock, classic rock, glam rock, mellow gold, new romantic, soft rock, symphonic rock, yacht rock"
6yKV0d7fD8IcrErWZ1NlQC,Historia de Un Amor,"Trio Los Panchos, Eydie Gormé",147746,1978-02-15,1978,0.846,0.548,0.23,0.0,0.117,-18.641,0.0339,101.516,0.624,0.0,2.0,30,False,
4VaaUNxltNC5KTozJC3ftz,"(Don't Fear) The Reaper - Live at Barton Coliseum, Little Rock, AR - April 1978",Blue Öyster Cult,370493,1978,1978,0.0316,0.287,0.975,0.152,0.99,-7.552,0.0963,148.847,0.288,0.0,11.0,19,False,"album rock, classic rock, glam metal, hard rock, progressive rock, rock"
1xmyzwA8jSwToSy8xfIejG,"Mind Blowing Decisions - 12"" Disco Version",Heatwave,451640,1978-03-31,1978,0.213,0.716,0.45,0.00135,0.112,-12.862,0.0583,91.561,0.802,1.0,0.0,17,False,"brit funk, classic soul, disco, funk, motown, p funk, post-disco, quiet storm, soul"
1TQu9Nhw8WgwrMjQ4IrfX0,The Bus From Amarillo - The Best Little Whorehouse In Texas/1978 Original Broadway Cast/Remastered,"Carol Hall, Carlin Glynn",227360,1978-01-01,1978,0.725,0.453,0.396,0.0,0.0535,-7.672,0.0329,75.726,0.287,1.0,8.0,7,False,
5jZWuO6cdWOU7v5uu9RAEf,What Do I Get? - 1996 Remastered Version,Buzzcocks,174053,1978,1978,0.00176,0.249,0.922,0.0,0.408,-7.929,0.118,176.509,0.199,1.0,7.0,23,False,"alternative rock, britpop, madchester, new wave, post-punk, punk, uk post-punk"
2DIvv50yb83BGbZVEt5yyI,Get On Our Own - 1996 Remastered Version,Buzzcocks,145040,1978,1978,0.00151,0.139,0.923,5.18e-05,0.0908,-6.672,0.0928,171.587,0.499,1.0,6.0,22,False,"alternative rock, britpop, madchester, new wave, post-punk, punk, uk post-punk"
0DjQoPTFhFdURjjArLywUR,The Bryden 2-Step (For Amphibians) [Part 1],National Health,533164,1978-12-31,1978,0.32,0.234,0.387,0.884,0.0762,-16.129,0.0576,164.539,0.218,0.0,2.0,12,False,"canterbury scene, italian progressive rock, progressive rock"
7p01CaxwKBXFHxSpNLX5qn,Bringing It Back - Live 1977-1978,Kansas,427093,1978-10-01,1978,4.91e-05,0.452,0.888,0.589,0.978,-8.044,0.0788,122.327,0.314,0.0,4.0,7,False,"album rock, classic rock, hard rock, heartland rock, mellow gold, progressive rock, rock, soft rock"
3jOsbjTZ9ub4zjkrrrcGal,Real World - 1996 Remastered Version,Buzzcocks,212466,1978,1978,0.00325,0.359,0.708,0.00338,0.593,-12.305,0.0339,147.038,0.641,1.0,9.0,21,False,"alternative rock, britpop, madchester, new wave, post-punk, punk, uk post-punk"
2UFLZNBQwsEdVHukytDJSQ,Concrete Jungle - Live At Ahoy Hallen/1978,Bob Marley & The Wailers,348933,1978-03-23,1978,0.0911,0.635,0.531,0.049,0.555,-11.546,0.195,89.233,0.599,0.0,4.0,26,False,"reggae, roots reggae"
0EwlPb6qqz0emHrfYVwxJn,1841 Shuffle,Roy Buchanan,257519,1978,1978,0.525,0.518,0.861,0.633,0.0847,-7.128,0.107,118.071,0.662,1.0,10.0,5,False,"acoustic blues, blues, blues rock, electric blues, modern blues, traditional blues"
1wfkwHPoYsb6jXZDjax5eW,The Black Page Drum Solo/Black Page #1,Frank Zappa,230520,1978-03-03,1978,0.00886,0.388,0.765,0.0194,0.359,-10.567,0.218,81.225,0.429,0.0,9.0,12,False,"art rock, blues rock, experimental, instrumental rock, jazz fusion, jazz rock, progressive rock, proto-metal, psychedelic rock, symphonic rock, zolo"
3OpD9ZqZd9Yx2bduA4FEM9,War / No More Trouble - Live At Ahoy Hallen/1978,Bob Marley & The Wailers,382906,1978-03-23,1978,0.383,0.62,0.62,0.0198,0.652,-10.966,0.383,82.266,0.58,0.0,4.0,25,False,"reggae, roots reggae"
2oSHVpkj0Uojg832i50jxh,I Don't Mind - 1996 Remastered Version,Buzzcocks,137253,1978,1978,0.00083,0.301,0.813,0.0148,0.309,-7.347,0.0618,83.371,0.887,0.0,10.0,22,False,"alternative rock, britpop, madchester, new wave, post-punk, punk, uk post-punk"
4oifzuUGkfy0oCK68AG1ST,"Concerto for Flute, Strings And Basso Continuo in C Major, BWV 1055: I. Allegro","Johann Sebastian Bach, Jean-Pierre Rampal, Milan Munclinger, Josef Hála, Ars Rediviva Orchestra Of Prague",250000,1978,1978,0.881,0.683,0.325,0.000837,0.0896,-11.601,0.0538,101.936,0.938,1.0,0.0,20,False,"baroque, classical, early music, german baroque"
3a3xjMQnao5shHeSFrI3l2,"Cantata, BWV 208: Schafe können sicher weiden","Johann Sebastian Bach, Yo-Yo Ma, Ton Koopman, Amsterdam Baroque Orchestra",217933,1978,1978,0.972,0.303,0.0244,0.84,0.119,-28.06,0.0446,68.915,0.173,1.0,9.0,14,False,"baroque, classical, early music, german baroque"
4NJLffUFKtfwEYCIZr9nTy,God Bless My Solo,Illinois Jacquet,247106,1978,1978,0.498,0.717,0.431,0.742,0.151,-9.385,0.0588,93.738,0.743,1.0,8.0,21,False,jazz saxophone
0oN2bwreaFIPO5snLpXJcp,Walking Distance - 1996 Remastered Version,Buzzcocks,120826,1978,1978,0.000201,0.154,0.737,0.946,0.201,-12.752,0.107,176.337,0.447,1.0,2.0,20,False,"alternative rock, britpop, madchester, new wave, post-punk, punk, uk post-punk"
5c2jTQGGcku5oZn7UhikOU,Cafe On The Left Bank - Remastered 1993,Wings,205200,1978-03-31,1978,0.000456,0.517,0.562,0.0668,0.0871,-13.026,0.0297,130.752,0.743,0.0,2.0,26,False,"album rock, art rock, classic rock, folk rock, mellow gold, rock, singer-songwriter, soft rock"
7EUicA1ZWopQICfTSStfkM,"Godzilla - Live at Newcastle City Hall, Newcastle, UK - June 1978",Blue Öyster Cult,253040,1978,1978,0.04,0.411,0.827,0.000561,0.962,-8.996,0.0446,96.736,0.753,1.0,4.0,17,False,"album rock, classic rock, glam metal, hard rock, progressive rock, rock"
6fgMkKfzC6qQ4Vw7LQgqxs,Inarajan (The Village),Kalapana,197400,1978-10-23,1978,0.371,0.757,0.541,0.000112,0.037,-12.833,0.039,132.738,0.967,1.0,5.0,17,False,
5HBbiKzu4nQFtvGLok5dNI,The Heathen - Live At Ahoy Hallen/1978,Bob Marley & The Wailers,245866,1978-03-23,1978,0.214,0.62,0.518,0.00912,0.641,-10.019,0.0918,135.741,0.485,1.0,0.0,24,False,"reggae, roots reggae"
49x3HAN26H8gN3fVx7WiTN,Operators Manual - 1996 Remastered Version,Buzzcocks,213133,1978,1978,0.00707,0.219,0.728,5.98e-05,0.343,-11.608,0.0429,149.783,0.609,0.0,9.0,20,False,"alternative rock, britpop, madchester, new wave, post-punk, punk, uk post-punk"
0dw8GtJJBpMatD1jOr54AL,"Berlin - Live at the Bottom Line, New York, NY - May 1978",Lou Reed,373586,1978-11-01,1978,0.223,0.259,0.541,1.64e-05,0.976,-9.092,0.0355,80.792,0.0847,0.0,9.0,9,False,"classic rock, glam rock, permanent wave, rock, singer-songwriter"
3n7ZxTGBVMmzhe1Nmhr02R,"Band Introduction - Live at the Sydney Opera House, Australia - November 1977",John Denver,146960,1978-03-01,1978,0.815,0.52,0.593,0.0,0.909,-24.844,0.921,79.93,0.0374,1.0,7.0,6,False,"classic country pop, folk, folk rock, mellow gold, singer-songwriter, soft rock"
3aGODHmZLtv8LduZrjtMfT,Bailando Hasta el Amanecer,Los Master's,187547,1978-01-01,1978,0.539,0.67,0.715,0.0973,0.511,-12.655,0.0342,108.763,0.973,1.0,9.0,11,False,"classic venezuelan pop, salsa venezolana"
6e17J4IMLiJ58JWxkisxPi,Feel So Blue,Lafayette Leake,321293,1978,1978,0.26,0.644,0.472,0.276,0.0944,-11.524,0.0286,96.621,0.641,0.0,9.0,29,False,piano blues
3dbjrUGzgQjBkZHG0UJW9j,Dorothy Louise,Kalapana,202466,1978-10-23,1978,0.686,0.589,0.394,4.67e-06,0.0758,-15.188,0.0546,85.991,0.345,1.0,7.0,17,False,
4G7m12iFDQxptDWjOwccyq,The Black Page Drum Solo/Black Page #1,Frank Zappa,230520,1978-03-03,1978,0.00886,0.388,0.765,0.0194,0.359,-10.567,0.218,81.225,0.429,0.0,9.0,5,False,"art rock, blues rock, experimental, instrumental rock, jazz fusion, jazz rock, progressive rock, proto-metal, psychedelic rock, symphonic rock, zolo"
4G6ab7QZYRGrGleOy30ZGK,Black Cat,Raffaella Carrà,232106,1978-03-04,1978,0.0871,0.704,0.794,0.00419,0.128,-4.362,0.154,128.557,0.725,1.0,7.0,14,False,classic italian pop
3D3ydXZaPDOXy1tjWyglvq,Intro - Live,The Blues Brothers,103186,1978,1978,0.275,0.595,0.912,0.844,0.874,-9.176,0.358,94.554,0.646,1.0,0.0,23,False,"blues, blues rock"
1RBDCqOb1goOBEFgTguvVy,From Rochdale To Ocho Rios,10cc,221320,1978,1978,0.39,0.675,0.499,0.0,0.179,-13.476,0.067,88.783,0.831,1.0,7.0,23,False,"album rock, art rock, classic rock, glam rock, mellow gold, new romantic, soft rock, symphonic rock, yacht rock"
4mi7kgTuUL9qxwt09IjN4I,Ooh Boys (It's Hot) - Live / 1978,The Ozark Mountain Daredevils,256040,1978,1978,0.324,0.689,0.838,0.00109,0.965,-9.147,0.0504,114.841,0.815,1.0,7.0,13,False,"classic rock, country rock, soft rock, southern rock"
1ppi1KAa03Ex3RnN59Ldkn,Rebel Music - Live At Ahoy Hallen/1978,Bob Marley & The Wailers,313986,1978-03-23,1978,0.0656,0.49,0.618,0.00073,0.397,-12.245,0.291,168.496,0.677,0.0,6.0,22,False,"reggae, roots reggae"
2VoXgpYu0nZZLWJL8JswhY,Jamming - Live At Ahoy Hallen/1978,Bob Marley & The Wailers,474160,1978-03-23,1978,0.0289,0.553,0.769,0.000118,0.518,-9.278,0.134,131.842,0.622,0.0,11.0,23,False,"reggae, roots reggae"
6tatBuVmCo1KeIh79Pynyq,Just Lust - 1996 Remastered Version,Buzzcocks,180173,1978,1978,0.0029,0.312,0.785,4.42e-05,0.333,-11.101,0.0613,129.789,0.693,1.0,4.0,18,False,"alternative rock, britpop, madchester, new wave, post-punk, punk, uk post-punk"
6nloQGEPxou9e9CtsPNLDU,Love Is Lies - 1996 Remastered Version,Buzzcocks,192200,1978,1978,0.0998,0.482,0.647,4.84e-05,0.313,-13.202,0.046,122.981,0.657,1.0,0.0,19,False,"alternative rock, britpop, madchester, new wave, post-punk, punk, uk post-punk"
6lhafIy72OhLCVMT92tiSz,"E.T.I. (Extra Terrestrial Intelligence) - Live at Columbus Municipal Auditorium, Columbus, GA - April 1978",Blue Öyster Cult,318173,1978,1978,0.0077,0.328,0.956,0.0409,0.987,-7.321,0.0803,99.683,0.43,1.0,9.0,16,False,"album rock, classic rock, glam metal, hard rock, progressive rock, rock"
6qtc2G14ZJYQhti7Q4sIbX,E.S.P. - 1996 Remastered Version,Buzzcocks,285906,1978,1978,4.07e-05,0.183,0.663,0.135,0.0907,-11.696,0.0594,149.777,0.695,1.0,9.0,17,False,"alternative rock, britpop, madchester, new wave, post-punk, punk, uk post-punk"
0Rv5TL9z4mKKVZlEiOML4q,"Get Up, Stand Up - Live At Ahoy Hallen/1978",Bob Marley & The Wailers,295173,1978-03-23,1978,0.107,0.434,0.659,0.0,0.449,-11.104,0.291,155.334,0.757,1.0,9.0,23,False,"reggae, roots reggae"
04EH9lb2zvpeydtFS6mreN,We're On Our Way Home (Part 1),Brainstorm,224706,1978-01-01,1978,0.0311,0.66,0.809,0.0001,0.326,-12.88,0.0416,117.355,0.803,1.0,0.0,17,False,p funk
1e2W1UlyBSKsPzLM0Xubrt,No Reply - 1996 Remastered Version,Buzzcocks,135733,1978,1978,0.0053,0.413,0.895,0.0,0.215,-7.442,0.041,95.057,0.633,1.0,7.0,19,False,"alternative rock, britpop, madchester, new wave, post-punk, punk, uk post-punk"
5GhbzekUO0v3uIPfKSvdDg,Is This Love - Live At Ahoy Hallen/1978,Bob Marley & The Wailers,355386,1978-03-23,1978,0.0727,0.659,0.637,0.00195,0.721,-9.854,0.151,129.415,0.587,1.0,9.0,22,False,"reggae, roots reggae"
5V17upcAwZeb4hIxiYVygK,Promises - 1996 Remastered Version,Buzzcocks,156093,1978,1978,0.000143,0.287,0.808,0.0,0.243,-7.907,0.0862,168.546,0.702,1.0,0.0,18,False,"alternative rock, britpop, madchester, new wave, post-punk, punk, uk post-punk"
5Apk5PAfQt4LWSIdcBWEXf,"We Gotta Get out of This Place - Live at Newcastle City Hall, Newcastle, UK - June 1978",Blue Öyster Cult,279906,1978,1978,0.00452,0.505,0.848,0.000126,0.87,-8.223,0.0442,122.858,0.809,1.0,5.0,17,False,"album rock, classic rock, glam metal, hard rock, progressive rock, rock"
0NeWTUrXVRdJ9GHEVtrAGB,Easy Skanking - Live At Ahoy Hallen/1978,Bob Marley & The Wailers,290853,1978-03-23,1978,0.0386,0.628,0.599,0.0238,0.433,-12.189,0.194,133.44,0.703,1.0,8.0,21,False,"reggae, roots reggae"
2snprykyiJBwM1mdQn9JgT,Nothing Left - 1996 Remastered Version,Buzzcocks,266440,1978,1978,0.0034,0.415,0.777,0.0281,0.0569,-12.28,0.0447,162.836,0.927,1.0,9.0,18,False,"alternative rock, britpop, madchester, new wave, post-punk, punk, uk post-punk"
4gEP6CcUKjIYFb768eeVZc,"Big Eyes - Live at Nippon Budokan, Tokyo, JPN - April 1978",Cheap Trick,229306,1978-10-08,1978,0.00684,0.394,0.939,0.513,0.916,-8.004,0.0501,127.909,0.524,0.0,4.0,4,False,"album rock, beatlesque, classic rock, glam metal, glam rock, hard rock, mellow gold, power pop, rock, singer-songwriter, soft rock"
0CQWFnTrA3skDd4rclUfbY,"Kick out the Jams - Live at Fox Theater, Atlanta, GA - April 1978",Blue Öyster Cult,187200,1978,1978,0.0743,0.255,0.98,0.961,0.818,-9.225,0.0848,163.542,0.583,1.0,9.0,15,False,"album rock, classic rock, glam metal, hard rock, progressive rock, rock"
4NKTDpk4oYnyewweYDgYDz,Feel Like Breaking Up Someone's Home,Jimmy Johnson,287400,1978-09-01,1978,0.506,0.574,0.465,3.88e-05,0.101,-11.449,0.0345,97.633,0.75,1.0,2.0,20,False,chicago blues
1ryuZ77kDQ6bFYjXd3mTWQ,Behold - 2000 Digital Remaster,Culture,279160,1978,1978,0.0262,0.813,0.683,0.00105,0.159,-9.413,0.0549,143.553,0.966,1.0,2.0,32,False,"reggae, roots reggae"
4xmvEwNnNbc49rPVMxG5tS,Big Tears - 2021 Remaster,Elvis Costello & The Attractions,191106,1978-03-17,1978,0.0612,0.558,0.838,0.00182,0.309,-6.479,0.0417,119.089,0.778,1.0,7.0,24,False,"art rock, new romantic, new wave, new wave pop, power pop"
24gMIupmzMh8fhtNnDbMwf,Blondes (Have More Fun) - 2008 Remaster,Rod Stewart,226800,1978-11-24,1978,0.00351,0.53,0.835,0.0264,0.0643,-7.44,0.0518,173.907,0.913,1.0,7.0,27,False,"mellow gold, soft rock"
5gsXR9xaP3dyHJe4Mdjcss,Boxcars - 2022 Remaster,Joe Ely,239440,1978,1978,0.122,0.389,0.68,0.00269,0.274,-9.028,0.0301,136.734,0.733,1.0,0.0,20,False,"classic texas country, heartland rock, outlaw country"
5uvsptNfNKPLR2rRZP53nv,Being Sucked in Again - 2006 Remastered Version,Wire,194786,1978-08-07,1978,0.273,0.587,0.378,0.902,0.0975,-8.471,0.0329,113.396,0.304,1.0,9.0,21,False,"alternative rock, art punk, experimental rock, post-punk, punk, uk post-punk"
6yGXCKHpJPJY2Md2jAKWiy,The Best Days of My Life - 2008 Remaster,Rod Stewart,261733,1978-11-24,1978,0.802,0.565,0.278,0.0247,0.0957,-15.176,0.0278,104.149,0.383,1.0,9.0,25,False,"mellow gold, soft rock"
5lE9SpbfbyXFqaZsH9Nxyt,Bad Brain - 2018 Remaster,Ramones,145320,1978-09-21,1978,0.000601,0.572,0.912,0.000206,0.324,-2.308,0.0488,102.7,0.961,0.0,11.0,20,False,"alternative rock, early us punk, permanent wave, punk, rock"
1NDfblpMh24mD6LR7s0wPl,Black Sand,Kalapana,320026,1978-10-23,1978,0.0456,0.44,0.847,0.397,0.0728,-7.915,0.0482,94.241,0.689,0.0,2.0,15,False,
3SVyOJJBiRscLr2iWJth3G,Brute Force And Ignorance,Rory Gallagher,262992,1978-10-01,1978,0.183,0.28,0.707,0.000498,0.341,-8.656,0.0378,179.59,0.893,1.0,7.0,25,False,"blues rock, british blues, electric blues"
7HtTHlnO2xvjzBBYT90Be0,Blitzkrieg Bop / Teenage Labotomy / California Sun / Pinhead / She's the One - Live,Ramones,660400,1978-09-22,1978,0.0226,0.29,0.961,0.366,0.564,-6.37,0.0478,199.154,0.692,1.0,9.0,26,False,"alternative rock, early us punk, permanent wave, punk, rock"
5Bin9DRdlFK2BktgOqh50T,Bird In Hand - 2022 Remaster,"The Upsetters, Lee ""Scratch"" Perry",208803,1978,1978,0.0551,0.769,0.555,0.000932,0.138,-11.841,0.256,155.126,0.758,1.0,7.0,18,False,"dub, reggae, rocksteady, roots reggae"
6Oxep8mw3bTfzFPe4AfceL,Born to Lose - 2008 Remaster,UFO,222826,1978-07-15,1978,0.0932,0.411,0.446,0.00156,0.189,-10.651,0.0288,103.946,0.197,1.0,2.0,18,False,"album rock, glam metal, hard rock, metal, progressive rock"
4ladZJCTbpqbZHI2YFGRJn,Broadford Bazaar - 2003 Remaster,Jethro Tull,218133,1978-04-10,1978,0.62,0.447,0.427,0.0,0.146,-10.24,0.0285,151.233,0.605,1.0,9.0,20,False,"album rock, art rock, blues rock, classic rock, flute rock, folk rock, hard rock, progressive rock, psychedelic rock, rock, singer-songwriter, symphonic rock"
2QeB7o9zzLRBy9wG90DEBi,Backstage Queen (Live) (2015 - Remaster),Scorpions,219653,1978-08-01,1978,0.00115,0.312,0.943,0.102,0.61,-4.175,0.129,139.53,0.436,1.0,1.0,22,False,"album rock, german hard rock, german metal, german rock, hard rock, rock"
6Rz0oKDWGOn7nBpzixh7BN,Baby I Love You,Kalapana,257213,1978-10-23,1978,0.381,0.525,0.741,2.38e-05,0.113,-8.858,0.0369,77.749,0.763,0.0,4.0,11,False,
6QNuAiHPmCXFSGtWbbhYJD,Bread - 2015 Remaster,Todd Rundgren,171440,1978,1978,0.18,0.56,0.555,0.0,0.134,-10.302,0.0285,131.496,0.637,0.0,9.0,12,False,"art rock, country rock, folk rock, mellow gold, philly soul, power pop, singer-songwriter, soft rock, zolo"
4ibQxBg0D2jMr56opblWvR,Bag Lady - 2015 Remaster,Todd Rundgren,196853,1978,1978,0.716,0.327,0.143,1.28e-06,0.136,-16.675,0.0368,55.89,0.0779,0.0,10.0,12,False,"art rock, country rock, folk rock, mellow gold, philly soul, power pop, singer-songwriter, soft rock, zolo"
65tKUCBFx7fT8jV8yM0SWu,Black Page #2,Frank Zappa,336200,1978-03-03,1978,0.289,0.385,0.732,0.0022,0.735,-7.919,0.109,133.497,0.357,1.0,7.0,15,False,"art rock, blues rock, experimental, instrumental rock, jazz fusion, jazz rock, progressive rock, proto-metal, psychedelic rock, symphonic rock, zolo"
7h7cvBSEVo6fPRPaEyh64z,Bent Cold Sidewalk,Tangerine Dream,789938,1978-03-01,1978,0.849,0.211,0.423,0.112,0.121,-11.046,0.0383,167.394,0.127,1.0,0.0,18,False,"berlin school, german prog, krautrock, synthesizer"
27rQhhWl5yBnZAq9ISBJi0,Burn That Candle - 2003 Remaster,Emmylou Harris,265986,1978,1978,0.491,0.561,0.632,0.0,0.0969,-7.049,0.0292,146.207,0.801,1.0,3.0,11,False,"country rock, folk, lilith, melancholia, singer-songwriter"
7pXri8NG6W69EyvTkIfquv,Back On The Road Again (2024 Remaster),"Dickey Betts, Great Southern",250624,1978,1978,0.362,0.471,0.601,0.091,0.121,-12.975,0.0363,160.317,0.854,1.0,2.0,11,False,"country rock, southern rock"
6TKROOSXTTbzjXGwq6uaJl,Blues After Hours,Pinetop Perkins,303373,1978-01-09,1978,0.397,0.456,0.234,0.0714,0.309,-15.507,0.0319,174.975,0.325,1.0,7.0,17,False,"blues, boogie-woogie, delta blues, piano blues"
21yOaTUVC5hzAAHwNe0RNw,Besoin d'amour - Remastered,"France Gall, Starmania",238133,1978-09-10,1978,0.284,0.696,0.896,0.0375,0.396,-9.063,0.03,132.221,0.95,1.0,0.0,40,False,"chanson, ye ye"
7xuv8xakMFJWNiZo0QrekL,Le blues du businessman - Remastered,"Claude Dubois, Starmania",261613,1978-09-10,1978,0.28,0.39,0.533,4.26e-06,0.12,-7.66,0.0324,143.596,0.308,1.0,2.0,52,False,"auteur-compositeur-interprete quebecois, chanson quebecois"
