id,name,artists,duration_ms,release_date,year,acousticness,danceability,energy,instrumentalness,liveness,loudness,speechiness,tempo,valence,mode,key,popularity,explicit,genre
5B25Jpgu62IX8w1YtLibuA,You Gonna Fly,Keith Urban,216866,2010-01-01,2010,0.0598,0.457,0.846,0.0,0.34,-8.547,0.0477,177.353,0.851,1.0,4.0,35,False,"contemporary country, country, country road, modern country rock"
7fV3vMnPmwkqOVSEEiDTmC,You Came Out,We Have Band,206960,2010-04-05,2010,0.00251,0.666,0.875,0.0895,0.106,-6.82,0.0295,139.959,0.878,1.0,4.0,43,False,"alternative dance, dance-punk, electrofox, new rave"
6rCHGKyJNcAeN00ivrbpy8,You Give Love A Bad Name,Bon Jovi,223146,2010-11-09,2010,0.0342,0.532,0.963,2.1e-06,0.367,-2.543,0.0528,122.742,0.798,0.0,0.0,44,False,"glam metal, rock"
0d8cGMosMcPJA8UsxQCtZq,You Spin Me Round (Like a Record),Dead Or Alive,195640,2010-10-25,2010,0.00566,0.562,0.979,0.00155,0.721,-4.058,0.0537,128.169,0.827,0.0,6.0,44,False,"hi-nrg, new romantic, new wave pop, synthpop"
2NgcYJd7SboLZ2ofUnldSe,Yellow Line,JAMES SHIMOJI,419400,2010-10-06,2010,0.000102,0.504,0.946,0.85,0.0913,-3.416,0.071,139.988,0.478,0.0,9.0,39,False,
1pWbMRdexwG9VEGMxq1zL2,Yo soy tu amigo fiel,Ricardo Murguía,123413,2010-01-01,2010,0.825,0.595,0.307,0.0,0.272,-13.813,0.0307,115.945,0.575,1.0,3.0,54,False,cancion infantil mexicana
2g1RlpsrFQNScIvJIYkeJa,You've Changed,Teebs,131709,2010,2010,0.135,0.356,0.97,0.0,0.1,-5.857,0.0437,143.976,0.921,0.0,0.0,39,False,"abstract beats, instrumental hip hop, wonky"
5jXkSYABmqFxiZFupKfjA8,You Are My All In All/Canon In D - Medley,Gaither Vocal Band,314120,2010-01-01,2010,0.797,0.243,0.284,0.451,0.365,-9.617,0.0325,119.4,0.0852,1.0,5.0,41,False,southern gospel
1tZbYHImeBPPvEN8aRzMva,You,Gold Panda,216373,2010-09-07,2010,0.000905,0.504,0.955,0.835,0.322,-4.84,0.0814,179.856,0.655,0.0,1.0,39,False,"chillwave, electronica, future garage, indietronica, microhouse, wonky"
72d2qNpo39PRtwMWS9m2nq,You´ve Got A Friend (Bossa Version),Tahta Menezes,255933,2010-03-31,2010,0.88,0.765,0.317,2.35e-06,0.126,-11.881,0.0274,108.04,0.524,0.0,11.0,54,False,"bossa nova cover, coverchill"
3rKrypBgAbjWzSN9ajvyXE,Yo Me Llamo Cumbia,Totó La Momposina,269560,2010-06-30,2010,0.86,0.527,0.39,0.00495,0.124,-13.176,0.0702,87.972,0.685,0.0,9.0,48,False,"bullerengue, chicha, cumbia, folclor afrocolombiano, porro"
0QnOq3rPKLxxeghfXcLXAG,You Oughta Know,"Das Racist, Heems",175786,2010-03-29,2010,0.135,0.642,0.73,0.00297,0.372,-4.732,0.0581,81.902,0.675,1.0,9.0,36,True,comedy rap
5PjpIjrejmldJosUT8ARfC,Your Smile,Josh Turner,215266,2010,2010,0.334,0.588,0.839,0.494,0.188,-8.233,0.0307,107.861,0.924,1.0,10.0,36,False,"contemporary country, country, country road"
6asU049doNupkVllo61luh,Zebra,Beach House,288720,2010-01-26,2010,0.861,0.612,0.476,0.0044,0.147,-8.256,0.0275,118.381,0.257,1.0,8.0,48,False,"art pop, baltimore indie, dream pop, dreamo, indie rock, indietronica, modern dream pop, pov: indie"
3ylrCkU7BD4N7SNegCRRXY,Zen Garden,Laura Shigihara,60092,2010-11-22,2010,0.995,0.785,0.049,0.922,0.097,-21.895,0.0486,120.006,0.968,1.0,0.0,51,False,video game music
4xAoWpiEREH6iMffSDTqTh,Zombies on Your Lawn,Laura Shigihara,159381,2010-11-22,2010,0.75,0.734,0.4,0.041,0.144,-17.791,0.0529,105.055,0.767,0.0,7.0,51,False,video game music
3v65IsDl6LDOHDu9bU4ZOn,Zodiac Shit,Flying Lotus,164640,2010-05-03,2010,0.0229,0.308,0.749,0.0614,0.3,-4.606,0.281,79.39,0.181,0.0,10.0,41,False,"afrofuturism, alternative hip hop, electronica, escape room, experimental hip hop, glitch, glitch hop, indietronica, instrumental hip hop, intelligent dance music, jazztronica, psychedelic hip hop, wonky"
1u6dNbB16GVIkCbORJf4xp,Zombie Slide,Insane Clown Posse,207293,2010-04-01,2010,0.0366,0.86,0.871,0.0,0.587,-4.045,0.0718,109.944,0.732,0.0,11.0,39,True,rap rock
2EV2d3nyB30ZKWs2TT6RDG,Zombotany (Bonus Track),Laura Shigihara,77960,2010-11-22,2010,0.421,0.55,0.407,0.959,0.0937,-18.843,0.0433,120.028,0.648,1.0,8.0,42,False,video game music
56adT6jCryvnKPBhYygBlN,"Zoal, Face Dancer",Grimes,156000,2010-10-01,2010,0.869,0.779,0.547,0.0111,0.103,-12.178,0.0536,120.021,0.739,1.0,11.0,39,False,"art pop, canadian electropop, grave wave, indietronica, metropopolis, neo-synthpop"
3AS4gc24Hsp25HN5LbJoMZ,Zombie,The Pretty Reckless,188560,2010-01-01,2010,9.13e-05,0.386,0.923,0.033,0.269,-2.894,0.19,150.993,0.223,1.0,9.0,35,False,"alternative metal, candy pop"
7EIq46YALncEzg0fYvLo0L,Zor Ka Jhatka,"Pritam, Daler Mehndi, Richa Sharma",248130,2010-10-07,2010,0.0955,0.742,0.977,0.000118,0.101,-3.267,0.229,176.108,0.823,1.0,1.0,54,False,"filmi, indian instrumental, modern bollywood"
0ANx3accyfc1uuZZ2Bolq3,Zorbing,Stornoway,209360,2010-08-10,2010,0.637,0.531,0.504,1.89e-05,0.21,-7.534,0.0306,154.879,0.479,1.0,9.0,33,False,oxford indie
5aJshF6mtr7SsztEMhAvZv,Zun Zun Rompiendo Caderas,Wisin & Yandel,200000,2010-01-01,2010,0.121,0.726,0.842,0.0,0.11,-4.457,0.223,116.702,0.284,1.0,1.0,45,False,"electro latino, reggaeton, trap latino, urbano latino"
1xLJ3vYuidvAGFZAHMKgl9,The Life,Hinder,217186,2010-01-01,2010,0.000835,0.396,0.72,0.0,0.24,-3.854,0.0311,152.125,0.289,1.0,2.0,42,False,"alternative metal, nu metal, post-grunge"
7c5lMuvtz2gddhDyG5MjB6,The Final Countdown,Europe,236760,2010-02-26,2010,0.02,0.543,0.737,0.00135,0.0497,-9.587,0.0399,117.826,0.377,0.0,6.0,48,False,"album rock, glam metal, hard rock, rock, swedish hard rock, swedish melodic rock"
0ttpfXbTTA2TsqhiGhq1DJ,Been Here All Along,Hannah Montana,241506,2010-01-01,2010,0.323,0.43,0.624,0.0,0.149,-4.141,0.036,159.886,0.205,1.0,3.0,43,False,"pop, post-teen pop"
3s6H6UW7yPu2rsF8CGki60,Zindagi Do Pal Ki,KK,253200,2010-03-29,2010,0.0277,0.678,0.771,0.00253,0.149,-2.849,0.0266,105.976,0.462,1.0,6.0,56,False,"filmi, modern bollywood"
1BGXHSXW84XkVe5cdRMLKN,The Promise,Kenny G,313560,2010-06-06,2010,0.192,0.331,0.561,0.0805,0.0729,-7.169,0.0468,84.245,0.288,1.0,8.0,44,False,"smooth jazz, smooth saxophone"
4BlnR7y7sDouqBggjzuZxR,說了再見,Jay Chou,282720,2010-05-18,2010,0.447,0.547,0.503,0.0,0.135,-7.97,0.0277,124.058,0.127,1.0,2.0,54,False,"c-pop, mandopop, taiwan pop, zhongguo feng"
18UstSCaLtS38OpBEytBWR,Zuzu's Petals,Will Ackerman,290293,2010-09-03,2010,0.955,0.294,0.101,0.789,0.106,-19.261,0.0513,113.061,0.0463,1.0,11.0,30,False,"fingerstyle, new age"
02NKMA9cIkq6VuBNu9q9Wf,The Chipmunk Song (Christmas Don't Be Late) - Remastered 1999,"Alvin & The Chipmunks, David Seville",141466,2010-01-01,2010,0.707,0.611,0.37,2.98e-06,0.23,-11.548,0.0345,152.559,0.778,1.0,3.0,36,False,children's music
3UJAy6NEcGFbza1cc5nr5H,Zen Garden (In-Game),Laura Shigihara,69239,2010-11-22,2010,0.995,0.831,0.0883,0.926,0.0892,-22.671,0.0608,119.994,0.941,1.0,0.0,35,False,video game music
7t32XwS5ZpqS4IxcrIMg6E,Zion Town (feat. Queen Sparrow),"Ras Sparrow, Queen Sparrow",310047,2010-05-21,2010,0.386,0.877,0.399,1.21e-05,0.135,-8.839,0.304,140.101,0.676,0.0,4.0,54,False,reggae do maranhao
3mXiG9nAZGuMSxpPnQGxaR,Zombie Dance,Escape the Fate,197560,2010-01-01,2010,0.000656,0.57,0.965,1.22e-06,0.079,-3.564,0.0498,125.007,0.581,0.0,5.0,27,False,"alternative metal, metalcore, neon pop punk, pixie, pop punk, post-grunge, screamo"
1BKTC2TMUJ11nUxvrzTwfy,ゼロコンマ、色とりどりの世界,MASS OF THE FERMENTING DREGS,271546,2010-07-30,2010,5.36e-05,0.0911,0.985,0.142,0.328,-2.071,0.0903,186.871,0.236,1.0,0.0,30,False,"japanese emo, japanese post-rock, japanese shoegaze"
6x53YxdtkR2rGLptZCLgUx,Les passants,Zaz,213420,2010-05-10,2010,0.358,0.742,0.658,0.0,0.0685,-6.289,0.115,153.769,0.609,0.0,0.0,58,False,"chanson, french jazz, nouvelle chanson francaise"
3biMQVil52sKP7Rwj8o7Rb,The Sun,The Naked And Famous,236560,2010,2010,0.51,0.589,0.485,0.00901,0.112,-9.721,0.0325,123.992,0.0355,1.0,0.0,37,False,"auckland indie, indietronica, kiwi rock, metropopolis"
5VQymjM48L2PD26oPED9kB,Zyglrox,Periphery,306322,2010-04-20,2010,7.28e-05,0.48,0.983,0.00146,0.212,-5.07,0.14,125.015,0.0728,1.0,2.0,25,False,"djent, melodic metalcore, progressive metal, progressive metalcore"
204FRaXJ77a1NbkQmQRhn5,Zero,Alter Bridge,279483,2010-01-01,2010,0.000158,0.122,0.876,0.0,0.341,-4.44,0.0683,185.14,0.508,1.0,1.0,25,True,"alternative metal, nu metal, post-grunge"
7jsxRBbHE5POgDjCEOeKwh,Zydrate Anatomy,Kidcrusher,202840,2010-08-11,2010,0.000405,0.54,0.751,2.54e-06,0.163,-6.81,0.211,94.982,0.404,1.0,7.0,29,True,horrorcore
6zYSgdagO0Yaf4bZqpYJpi,There Goes My Baby,USHER,283373,2010-08-24,2010,0.183,0.601,0.51,0.0,0.0898,-8.094,0.0933,154.887,0.268,0.0,9.0,33,False,"atl hip hop, contemporary r&b, dance pop, pop, r&b, rap, south carolina hip hop, urban contemporary"
59HVcwGKW18a5mjjyhvKQW,Atlanta Zoo (feat. Ludacris),"Gucci Mane, Ludacris",219080,2010-04-12,2010,0.00587,0.737,0.833,0.0,0.619,-6.023,0.366,145.139,0.732,0.0,6.0,37,True,"atl hip hop, dirty south rap, hip hop, pop rap, rap, southern hip hop, trap"
2Ihrfi47Du7rCvQOT3svHS,絶体絶命,Tokyo Incidents,186773,2010-02-24,2010,0.06,0.64,0.879,1.71e-05,0.0388,-2.733,0.0294,133.052,0.719,1.0,10.0,43,False,"anime, j-pop, j-rock"
0eduOExvDRVeZCi8B82N47,Za Smierc Przyjaciela,The Dreadnoughts,154613,2010-09-28,2010,0.611,0.202,0.327,0.957,0.0854,-10.874,0.0332,84.996,0.102,0.0,0.0,24,False,"celtic rock, pirate, shanty, vancouver punk"
6UeSxjdZaXrgg3LGNxnKqL,"Zombies, March",Gwar,273746,2010-11-09,2010,0.000827,0.292,0.961,6.48e-05,0.177,-3.822,0.1,97.482,0.408,1.0,8.0,24,True,"comic metal, groove metal, industrial metal, nu metal, old school thrash, virginia metal, virginia punk"
1claBmKHgv3n0Mw3p8NE8O,ズレる,MASS OF THE FERMENTING DREGS,204840,2010-07-30,2010,0.0184,0.634,0.943,0.704,0.278,-4.436,0.124,99.175,0.575,0.0,9.0,27,False,"japanese emo, japanese post-rock, japanese shoegaze"
3pUaCxwQnoY7aD0169gQOE,自導自演,Jay Chou,255333,2010-05-18,2010,0.0217,0.713,0.75,0.081,0.301,-7.617,0.0285,132.993,0.769,1.0,0.0,31,False,"c-pop, mandopop, taiwan pop, zhongguo feng"
0d32fDp1ez3ojJiGLBhl2g,Amor Genuino,Zion & Lennox,244680,2010-11-02,2010,0.172,0.632,0.843,3.2e-05,0.0712,-6.888,0.142,89.677,0.901,0.0,0.0,38,False,"reggaeton, urbano latino"
1tjjIN0ITaa5euBqiLbe6N,Zestways (feat. Husalah & The Jacka),"Andre Nickatina, Husalah, The Jacka",211493,2010-09-07,2010,0.0174,0.881,0.695,0.0,0.153,-7.374,0.39,124.597,0.39,0.0,6.0,21,True,"hyphy, west coast rap"
5LH9xSxI9oUx4a8jsA0GBZ,I Play the Road,Zac Brown Band,259586,2010-09-20,2010,0.394,0.548,0.734,0.0,0.0945,-6.185,0.0311,170.044,0.528,1.0,6.0,39,False,"contemporary country, country, country road, modern country rock"
0iVoLG8mSr3aEuyP2NzKec,There She Goes - Single Version,The La's,148666,2010-01-01,2010,0.0187,0.588,0.932,0.000208,0.125,-8.63,0.0324,127.637,0.95,1.0,8.0,36,False,britpop
43lR06cTMygPeZTS7FMxnr,再見!我的愛人,Teresa Teng,209400,2010-01-01,2010,0.61,0.467,0.208,0.0,0.13,-14.176,0.0361,113.033,0.431,1.0,3.0,35,False,"c-pop, classic mandopop, kayokyoku"
4eHpP4BAoKMvwt2s1MKRVI,只對你有感覺,JJ Lin,264895,2010-12-08,2010,0.00911,0.587,0.846,0.0,0.314,-4.158,0.0376,104.96,0.649,1.0,0.0,33,False,"mandopop, singaporean mandopop, singaporean pop"
3nBRUICiESaoa2IDr2suuz,That Should Be Me - Acoustic Version,Justin Bieber,249066,2010-01-01,2010,0.409,0.491,0.463,0.0,0.0723,-6.37,0.0289,139.784,0.0743,1.0,8.0,30,False,"canadian pop, pop"
26ZnmGlPGXaOzPDydAP9D5,She's Long Gone,The Black Keys,186000,2010-05-18,2010,0.0361,0.349,0.866,0.0406,0.216,-6.676,0.112,167.951,0.488,0.0,11.0,45,False,"alternative rock, blues rock, garage rock, indie rock, indietronica, modern blues rock, modern rock, punk blues, rock"
6TUK6UJ3A0YbGsiyPgYzYV,Colder Weather (feat. Little Big Town) - Live,"Zac Brown Band, Little Big Town",269533,2010-05-04,2010,0.617,0.382,0.47,0.0,0.91,-7.643,0.0344,139.3,0.254,1.0,3.0,39,False,"contemporary country, country, country road, modern country rock"
2IjbBt2nw3a4QlkwkUsPdR,轉身之後,Bii,225466,2010-10-06,2010,0.662,0.512,0.386,0.0,0.143,-8.688,0.0275,66.014,0.26,1.0,7.0,45,False,mandopop
69no5UFvU1Lh0rhzus3H1l,"Abdelazar Suite, Z. 570: VI. Air","Henry Purcell, Camerata Nordica, Terje Tonnesen",68986,2010-10-01,2010,0.843,0.538,0.209,0.944,0.243,-19.315,0.0411,130.784,0.722,0.0,7.0,50,False,"baroque, classical, early music, english baroque"
7alzCeFlbAQv0kGjUr9ze3,Zim,Gossaye Tesfaye,345200,2010-12-01,2010,0.188,0.584,0.759,0.000113,0.152,-11.128,0.1,177.991,0.775,1.0,10.0,34,False,"amharic pop, ethiopian pop"
1WjKuawJICMU2zSNFgzfgh,03' Bonnie & Clyde,"JAY-Z, Beyoncé",205240,2010-11-22,2010,0.21,0.87,0.765,0.0,0.235,-3.4,0.297,89.91,0.379,0.0,9.0,34,True,"east coast hip hop, gangster rap, hip hop, pop rap, rap"
5PihV701oMGdxinPSesGVO,Wanting More,Irie Souls,235240,2010-01-01,2010,0.0289,0.908,0.557,0.000462,0.102,-9.347,0.0836,133.943,0.766,0.0,9.0,38,False,jawaiian
1VFSjE7JVH20bbpWOoerfa,罪人,Hacken Lee,286853,2010-01-01,2010,0.849,0.652,0.436,0.0,0.147,-8.844,0.0293,100.056,0.221,1.0,11.0,32,False,"c-pop, cantopop, classic cantopop"
0S2manLicCIJ4lo4lZ6Tvb,Zombie Dance,Escape the Fate,197560,2010-01-01,2010,0.000656,0.57,0.965,1.22e-06,0.079,-3.564,0.0498,125.007,0.581,0.0,5.0,27,False,"alternative metal, metalcore, neon pop punk, pixie, pop punk, post-grunge, screamo"
3pAaCCA5TEW1j6piYSNgqa,再吻我吧!,Andy Lau,246066,2010-01-01,2010,0.534,0.601,0.523,1.9e-05,0.101,-8.382,0.0353,135.93,0.352,1.0,1.0,32,False,"c-pop, cantopop, classic mandopop"
6I2MGdpnqXB3GFrIqIcVQ6,在这颗行星所有的酒馆,万能青年旅店,549453,2010-11-12,2010,0.113,0.608,0.723,0.122,0.232,-4.509,0.0346,112.276,0.614,0.0,5.0,34,False,"chinese indie rock, northwest china indie"
2kecqztGBsjkT2I1ViK8C6,Free / Into the Mystic (feat. Joey + Rory) - Live,"Zac Brown Band, Joey + Rory",456773,2010-05-04,2010,0.0879,0.317,0.55,0.00192,0.725,-6.905,0.0299,145.883,0.161,1.0,1.0,37,False,"contemporary country, country, country road, modern country rock"
5IpgXFFwZP20UeG7JXg5SP,Éblouie par la nuit,Zaz,163306,2010-05-10,2010,0.657,0.608,0.47,0.000216,0.0802,-6.493,0.0662,74.838,0.672,0.0,6.0,57,False,"chanson, french jazz, nouvelle chanson francaise"
6APKs0Hrzi8xrJQayGVbYT,Settle Me Down,Zac Brown Band,201546,2010-09-20,2010,0.121,0.633,0.696,0.0,0.0667,-6.364,0.0683,169.855,0.922,1.0,7.0,37,False,"contemporary country, country, country road, modern country rock"
4HC13oxSHOqA092lFbRnyW,That Tree,"Snoop Dogg, Kid Cudi",271600,2010-01-01,2010,0.181,0.823,0.753,0.00145,0.0644,-5.344,0.33,101.004,0.883,0.0,10.0,31,True,"g funk, gangster rap, hip hop, pop rap, rap, west coast rap"
58vsA5Rs4OoZYFJMJW5et8,The Day,"The Roots, Blu, Phonte, Patty Crash",224106,2010-06-22,2010,0.201,0.698,0.683,0.0,0.101,-7.432,0.243,94.878,0.325,0.0,6.0,30,False,"conscious hip hop, east coast hip hop, hip hop, philly rap, political hip hop"
3UlN5RexwAJnFnS2CKNOak,"Zydeco Swingout (feat. Chalie Boy, C-Moe and Elle Gie)",Step Rideau and The Zydeco Outlaws,221053,2010-08-27,2010,0.0993,0.676,0.809,0.0,0.0238,-2.784,0.0699,78.583,0.728,1.0,7.0,19,False,zydeco
6yrL5toJG30OYFSn3OxjGP,Zorra,TIMBALIVE,245760,2010-04-18,2010,0.459,0.809,0.897,0.0,0.0451,-6.94,0.0477,96.029,0.646,0.0,9.0,32,False,"modern salsa, salsa cubana, timba"
1aRC0YiEcNQ5gk94ZWXd7E,Rude Boy,Zeds Dead,164575,2010-11-22,2010,0.0308,0.568,0.858,0.778,0.108,-2.442,0.307,139.795,0.453,0.0,11.0,37,True,"brostep, canadian electronic, dubstep, edm, electro house, progressive electro house"
65Qu4G4Bx9Pw7tYOnpmPMd,The Z Song,Super Simple Songs,65438,2010-05-22,2010,0.0469,0.711,0.469,4.9e-05,0.0792,-13.413,0.0807,179.917,0.315,1.0,5.0,25,False,children's music
1wuKBOls2V2LrReQvC1eIB,Zamuro,Charliepapa,178906,2010-12-17,2010,0.897,0.569,0.283,1.79e-05,0.109,-9.785,0.0318,87.873,0.316,1.0,10.0,31,False,"venezuelan indie, venezuelan rock"
1VfjcoqpW6Ty19YexT6oVP,Gangsta,"Slim Thug, Z-Ro",254333,2010-11-30,2010,0.166,0.441,0.752,0.0,0.0939,-4.837,0.467,77.993,0.45,1.0,2.0,35,True,"crunk, dirty south rap"
5RFiKWBnoCCN91wZGqnbFq,Martin,Zac Brown Band,306493,2010-09-20,2010,0.561,0.637,0.373,1.27e-05,0.0943,-9.206,0.0282,135.943,0.138,1.0,3.0,36,False,"contemporary country, country, country road, modern country rock"
2a3U3GTCvrcma7wetBtOpi,The Flood,Take That,289359,2010-01-01,2010,0.0378,0.514,0.83,1.43e-06,0.122,-6.077,0.044,100.631,0.138,0.0,11.0,57,False,"boy band, europop, talent show"
4vA7UNrquUGf7vUQkiyTjM,Love Zone,Billy Ocean,253200,2010-04-26,2010,0.193,0.726,0.829,5.33e-05,0.101,-6.103,0.0655,95.031,0.826,1.0,7.0,38,False,"disco, mellow gold, new romantic, new wave pop, soft rock, yacht rock"
748bePTe7igAR5NHybUW2q,Zombie Corpseplay,"Bill Elm, Woody Jackson",173680,2010-11-23,2010,0.000623,0.597,0.5,0.635,0.107,-11.7,0.031,130.0,0.169,0.0,9.0,24,False,old west
1NKFZslF0RC8Ikl8xDG9wc,Zu-Zu (Ken's Theme),Randy Newman,35040,2010-01-01,2010,0.863,0.469,0.37,0.0,0.216,-12.231,0.0489,127.315,0.521,1.0,3.0,23,False,"movie tunes, singer-songwriter"
4MJYsDTjTVLk9oFYmlhPFP,I See the Light,"Mandy Moore, Zachary Levi",223840,2010-09-29,2010,0.835,0.255,0.142,0.0,0.0758,-14.313,0.0323,96.225,0.166,1.0,0.0,48,False,"dance pop, hollywood, neo mellow, post-teen pop"
0vSxdYAqJW6CnQqK0zrrC3,Zoom,Latin Fresh,273066,2010-11-15,2010,0.102,0.525,0.687,0.0,0.423,-4.709,0.211,90.997,0.681,1.0,7.0,42,False,panamanian pop
3fFH4f1VojAaoZwpPCcNYm,追 - 電影《金枝玉葉》歌曲,Leslie Cheung,300760,2010-01-01,2010,0.385,0.546,0.376,3.76e-06,0.102,-9.052,0.0238,95.148,0.0659,1.0,0.0,31,False,"c-pop, cantopop"
6LEdg5TBD4SbW3uDK87zZm,Let Zion In Her Beauty Rise,Addison Kirk,120813,2010-07-13,2010,0.991,0.418,0.186,0.879,0.194,-18.305,0.0541,122.258,0.489,1.0,5.0,32,False,"lds, lds instrumental"
0x6KKx5DATCW0tBdosjMyg,I've Got a Dream,"Mandy Moore, Brad Garrett, Ensemble - Tangled, Zachary Levi, Jeffrey Tambor",191413,2010-11-24,2010,0.628,0.605,0.543,0.0,0.172,-7.603,0.0993,134.243,0.885,1.0,4.0,40,False,"dance pop, hollywood, neo mellow, post-teen pop"
71b8CQvcm070jgEypaevrV,最後晚餐,Supper Moment,333173,2010-08-06,2010,0.00362,0.39,0.712,0.0,0.248,-4.273,0.0276,179.666,0.449,1.0,8.0,38,False,cantopop
43hrb3UDtUdvVNQ5gSCsMI,Te Deseo el Mal,"Cosculluela, Zion & Lennox",297177,2010-01-01,2010,0.372,0.482,0.713,0.0,0.101,-5.278,0.153,103.818,0.379,0.0,9.0,48,False,"latin hip hop, reggaeton, trap latino, urbano latino"
698MZlcTeiVRIaAGmijXE9,Zelda With Lyrics (Nes - Overworld),brentalfloss,135053,2010-06-06,2010,0.719,0.511,0.748,0.0,0.172,-4.339,0.101,160.169,0.525,1.0,6.0,21,True,"antiviral pop, comic, nerdcore, scorecore"
6RTiKXUvAzfr1RTR2NpbSo,Make This Day,Zac Brown Band,242853,2010-09-20,2010,0.131,0.576,0.824,8.58e-06,0.0664,-5.473,0.0534,181.973,0.715,1.0,8.0,35,False,"contemporary country, country, country road, modern country rock"
58Fun4SYmcZy2vDJZ84Hhu,昨夜小樓又東風,Fei Yu-ching,245840,2010-04-30,2010,0.583,0.357,0.397,2.18e-05,0.118,-9.117,0.0335,75.718,0.225,1.0,5.0,28,False,"c-pop, classic mandopop"
0XapRkYEEHKacDxtBmAanF,Zropoto,DJ Arafat,221880,2010-10-25,2010,0.344,0.642,0.869,5.74e-06,0.108,-4.226,0.0976,134.972,0.589,1.0,0.0,36,False,"azontobeats, coupe-decale"
6HuyP5a5QXQNWV9vf4GkUJ,I See the Light,"Mandy Moore, Zachary Levi",224240,2010-11-24,2010,0.842,0.267,0.137,0.0,0.076,-14.347,0.0304,90.246,0.168,1.0,5.0,45,False,"dance pop, hollywood, neo mellow, post-teen pop"
7AAqmjDeyoZmrnPOVVJXE8,Zombie Jamboree,GrooveBarbers,212640,2010-02-14,2010,0.276,0.773,0.825,0.0,0.363,-7.649,0.0963,150.003,0.97,0.0,4.0,18,False,
5QKSgz59Dy0tPqhEXPD3Uh,Where the Boat Leaves From / One Love - Live,Zac Brown Band,231880,2010-05-04,2010,0.122,0.497,0.838,0.0,0.92,-6.215,0.0733,96.604,0.726,1.0,6.0,34,False,"contemporary country, country, country road, modern country rock"
3HeNPdfuvCRBsYBgCrZhP8,Escape,The Devil Wears Prada,285080,2010-08-23,2010,0.00165,0.322,0.996,0.0123,0.202,-3.617,0.269,165.025,0.0355,1.0,0.0,35,False,"christian metal, christian metalcore, melodic metalcore, metalcore"
4P7Xq0u3W6q8fnZiiStZqC,真的好想你,Fei Yu-ching,295400,2010-04-30,2010,0.5,0.47,0.372,0.0,0.267,-9.251,0.0317,75.963,0.307,1.0,8.0,27,False,"c-pop, classic mandopop"
44HVAhMSnVmT7copMUwBVh,Zoo Movements (Vocal),Dr. Jean Feldman,138613,2010-05-01,2010,0.111,0.763,0.734,0.0571,0.0535,-10.735,0.0383,179.97,0.923,1.0,8.0,20,False,preschool children's music
4acv9cybr3QdBcQ5WpyiI1,Ayla - DJ Taucher Radio Edit,"Ayla, Taucher",238466,2010-09-10,2010,0.116,0.709,0.861,0.766,0.107,-9.945,0.0442,144.036,0.684,0.0,9.0,50,False,"bubble trance, dream trance, german trance, trance"
3512VhO7OhXUaGkvoDZz2b,"Alien (English Version) - Live, 12.04.2010, Mediolanum Forum Mailand, Italien",Tokio Hotel,185680,2010-01-01,2010,0.000995,0.514,0.979,2.57e-06,0.763,-1.891,0.129,134.96,0.32,1.0,0.0,33,False,german pop rock
5VaAG7aMEtalGvLlnchYgU,With A Spirit,009 Sound System,598053,2010,2010,0.00212,0.605,0.613,0.00365,0.59,-7.443,0.043,123.968,0.734,1.0,10.0,36,False,dream trance
7t1IrKaMQNd10X7s4Ka3b7,"Automatic - Live, 12.04.2010, Mediolanum Forum Mailand, Italien",Tokio Hotel,193573,2010-01-01,2010,0.0137,0.509,0.995,0.00101,0.765,-1.752,0.109,130.015,0.308,1.0,1.0,30,False,german pop rock
6KiAEdLLo268B0ZKk8Ze2c,Move That Body,"Nelly, Akon, T-Pain",205013,2010-11-12,2010,2.96e-05,0.827,0.765,3.27e-06,0.131,-6.793,0.0367,111.011,0.545,0.0,5.0,41,False,"dance pop, gangster rap, hip hop, pop rap, rap, st louis rap, urban contemporary"
021C5AyF13a0czo2b2FudS,4:00 AM,Avenged Sevenfold,300546,2010-12-17,2010,0.000676,0.486,0.973,0.0,0.145,-4.161,0.104,144.987,0.374,1.0,10.0,32,False,alternative metal
1zPDgF3K6QXcTopDB3SVg9,"Sleazy REMIX 2.0 Get Sleazier (feat. Lil' Wayne, Wiz Khalifa, T.I. & André 3000)","Kesha, Lil Wayne, Wiz Khalifa, T.I., André 3000",293053,2010-10-29,2010,0.0172,0.698,0.791,1.19e-05,0.0805,-5.655,0.233,170.034,0.912,0.0,6.0,31,True,"dance pop, pop"
7zws0jMHJ454INenvULV28,Just A Dream,Nelly,237800,2010-11-12,2010,0.0424,0.528,0.753,0.0,0.12,-6.162,0.0307,89.954,0.103,1.0,1.0,35,False,"dance pop, gangster rap, hip hop, pop rap, rap, st louis rap, urban contemporary"
5dmcUNfQN8WXwB4Tqb5Iou,"A 3 0'clock Prayer (186, 1319-20)",Donna Cori Gibson,271986,2010-07-29,2010,0.66,0.283,0.254,1.28e-06,0.11,-11.732,0.0345,119.995,0.245,1.0,0.0,21,False,rosary
5Hcakl4A9VDmBmd6Jl7ZQJ,Altra,Digitaline,170373,2010-04-27,2010,0.000511,0.804,0.528,0.859,0.129,-13.174,0.0676,124.002,0.34,1.0,7.0,29,False,"minimal tech house, swiss techno"
0stgmIAllNSME1hW4WcpnE,Al revés,Oscuro,184046,2010-05-14,2010,0.0121,0.658,0.879,0.000345,0.792,-6.784,0.0853,93.137,0.806,1.0,2.0,39,True,rap underground colombiano
0aj9Q86NkFNWhE4xwj48D7,I'm Number 1,"Nelly, Baby, DJ Khaled",212866,2010-11-12,2010,0.00304,0.375,0.768,0.000135,0.325,-5.721,0.222,162.047,0.31,1.0,2.0,25,True,"dance pop, gangster rap, hip hop, pop rap, rap, st louis rap, urban contemporary"
6IpVTq4tDyVlPjAEzdICn9,Anxiety,Wasted Penguinz,380700,2010-07-02,2010,0.00124,0.576,0.483,0.573,0.0535,-6.664,0.0376,145.004,0.142,0.0,11.0,27,False,"classic hardstyle, euphoric hardstyle"
2u81eRZxCQoyN2gzDVm1q6,Just A Dream,Nelly,237800,2010-11-12,2010,0.0424,0.532,0.753,0.0,0.12,-6.162,0.0308,89.912,0.101,1.0,1.0,24,False,"dance pop, gangster rap, hip hop, pop rap, rap, st louis rap, urban contemporary"
06YKRWJJaaWT7CKEKloYLs,You a Me Baby,Vybz Kartel,174506,2010-03-09,2010,0.052,0.533,0.753,2.62e-05,0.101,-5.679,0.293,138.525,0.334,1.0,6.0,35,False,"dancehall, jamaican dancehall, reggae fusion"
5W24UYuMrdmrmtqNp9481Q,Space And Time,009 Sound System,298307,2010,2010,0.00473,0.572,0.566,0.309,0.106,-12.979,0.0411,122.976,0.598,1.0,10.0,25,False,dream trance
5bRvIVn10BgYx6pwLCSddF,"All Along The Watchtower - Live at GTE Virginia Beach Amphitheater, Virginia Beach, VA, 06.04.96",Dave Matthews Band,467626,2010-08-31,2010,0.0112,0.424,0.729,0.00824,0.963,-8.879,0.0726,111.926,0.515,0.0,9.0,11,False,"jam band, neo mellow, pop rock"
6nWxvf64Fpc3R2wyhwbTWQ,Ayla - DJ Taucher Remix,"Ayla, Taucher",573306,2010-09-10,2010,0.0878,0.724,0.702,0.673,0.336,-12.149,0.0554,144.034,0.171,0.0,9.0,28,False,"bubble trance, dream trance, german trance, trance"
7vNvnDT0Op0UAn9jCREaXj,Love Dem / Gallis Anthem,Vybz Kartel,149093,2010-03-09,2010,0.145,0.642,0.793,0.0,0.35,-5.196,0.248,113.944,0.378,1.0,6.0,42,False,"dancehall, jamaican dancehall, reggae fusion"
0NGv3OVIGNWUngdJfHV6Un,"Ants Marching - Live at Vivo Rio, Rio de Janeiro, Brazil 09.30.08",Dave Matthews Band,548165,2010-11-13,2010,0.000595,0.482,0.937,0.0676,0.932,-6.352,0.0458,114.334,0.534,1.0,2.0,15,False,"jam band, neo mellow, pop rock"
2UFWz236e1D4K3nwk4rYbp,Outside and Inside,The String Cheese Incident,514413,2010-11-09,2010,0.0783,0.439,0.71,0.545,0.872,-11.831,0.0315,98.97,0.604,1.0,2.0,21,False,"jam band, jamgrass, progressive bluegrass"
41oeYIgaKI5OjYiv34FTsv,A nos actes manqués,M. Pokora,225453,2010,2010,0.0163,0.61,0.932,3.28e-06,0.0767,-3.398,0.0715,113.178,0.787,1.0,3.0,40,False,"french pop, r&b francais, variete francaise"
4g1hT6vfvz1tAF3Kkp8gk1,Like a Movie,Vybz Kartel,149800,2010-03-09,2010,0.0634,0.565,0.73,5.39e-05,0.323,-6.607,0.326,151.593,0.579,0.0,6.0,31,False,"dancehall, jamaican dancehall, reggae fusion"
1MRchf0hKqNtU2EGBekRlx,"Break Away - Live, 12.04.2010, Mediolanum Forum Mailand, Italien",Tokio Hotel,203853,2010-01-01,2010,0.00026,0.452,0.995,0.123,0.954,-1.919,0.117,109.91,0.224,1.0,1.0,31,False,german pop rock
48HwfVVSyTS0hZWfTG0H83,Another Brick In The Wall,ortoPilot,282052,2010-06-06,2010,0.745,0.711,0.54,0.0234,0.0774,-7.994,0.0619,96.799,0.828,1.0,5.0,23,False,viral pop
2khnv6aUb71nJq0UlEPK5u,Nuh Fraid a Nobody / Neva Scared,Vybz Kartel,173026,2010-03-09,2010,0.0471,0.548,0.737,0.0,0.171,-5.847,0.332,138.346,0.32,1.0,11.0,36,False,"dancehall, jamaican dancehall, reggae fusion"
4aWERDFO5cWZLfbl0GmQkp,6th Chakra: A 3.0,Steven Halpern,231440,2010,2010,0.989,0.203,0.015,0.952,0.0938,-26.385,0.0396,69.174,0.03,1.0,2.0,30,False,"healing, meditation, sleep"
2Hq0rDd90j0P4owehOF56Y,Just A Dream,Nelly,237800,2010-11-12,2010,0.0424,0.532,0.753,0.0,0.12,-6.162,0.0308,89.912,0.101,1.0,1.0,26,False,"dance pop, gangster rap, hip hop, pop rap, rap, st louis rap, urban contemporary"
