id,name,artists,duration_ms,release_date,year,acousticness,danceability,energy,instrumentalness,liveness,loudness,speechiness,tempo,valence,mode,key,popularity,explicit,genre
5zM41BmRD4GHbqpDCC5hB1,Un tale,Mina,206367,1942-11-13,1942,0.82,0.171,0.308,0.0,0.129,-12.542,0.0318,170.906,0.333,1,10,0,False,"classic italian pop, italian adult pop, ye ye"
2hE8oavB2gWlQZ60PHlHQs,Una carezza e un bacio,Natalino Otto,166635,1942-11-23,1942,0.995,0.693,0.0978,0.947,0.0971,-31.173,0.0415,122.391,0.717,0,9,0,False,"canzone genovese, swing italiano, vintage italian pop"
35lPwl4cQkIPzdugGbQTRf,Uocchie c' arraggiunate - Instrument and base Version,Orchestra Studio 7,226377,1942-11-13,1942,0.966,0.543,0.202,0.000847,0.105,-15.749,0.0357,114.061,0.35,1,5,0,False,
6mhDfu30nbJCgkr2pSTZzB,Ulajh Gaye Naina Tumse,Veena Kumari,193463,1942-01-01,1942,0.995,0.496,0.299,0.834,0.312,-8.334,0.121,72.891,0.646,1,8,0,False,
5RdyU807IPsJXac7jYRmmP,Un Mundo Raro,Lola Flores,140760,1942-07-07,1942,0.422,0.571,0.407,0.0,0.0871,-15.907,0.133,135.694,0.741,1,3,0,False,copla
0GGHqQcldUM22vsqlbFOx2,Un tale,Mina,206341,1942-11-13,1942,0.808,0.167,0.309,0.0,0.129,-12.585,0.0328,172.722,0.345,1,10,0,False,"classic italian pop, italian adult pop, ye ye"
6IHPMjQK2MWbGAJLsuWQja,Uocchie c'arraggiunate - Musical base Version,Orchestra Studio 7,226194,1942-11-13,1942,0.961,0.573,0.128,0.919,0.103,-19.877,0.0331,114.591,0.254,1,5,0,False,
1R69rH0yCt08SunwwNJHjk,Ummeed Unse Kya Thi,Parul Ghosh,195466,1942-01-01,1942,0.995,0.424,0.163,0.857,0.064,-14.525,0.0381,61.484,0.398,0,4,0,False,classic bollywood
1J3VLciigezGioC2VKA58s,Un'ora sola ti vorrei - Musical base Version,Orchestra Studio 7,211905,1942-11-13,1942,0.0123,0.393,0.204,0.66,0.12,-17.428,0.0335,69.978,0.322,1,0,0,False,
0ToxISRTxoh3ixRLeJPxbH,Ufemia,Natalino Otto,194638,1942-11-23,1942,0.735,0.833,0.267,9.64e-05,0.0959,-16.282,0.155,113.89,0.825,1,0,0,False,"canzone genovese, swing italiano, vintage italian pop"
17BCX3RJyRnlNAed627F8D,"Un bel dì, vedremo from Madama Butterfly (Act II)","Giacomo Puccini, Bidu Sayão, Erich Leinsdorf, Columbia Symphony Orchestra",273293,1942,1942,0.945,0.289,0.251,1.82e-05,0.134,-12.831,0.0374,102.898,0.175,0,10,0,False,"classical, italian opera, italian romanticism, post-romantic era"
7wbDGxAvMQGm0xT2LxmvSB,Ud Ja Panchhi Ud Ja,Noor Jehan,194480,1942-12-01,1942,0.99,0.648,0.165,0.942,0.101,-14.381,0.379,71.54,0.743,1,5,0,False,"classic bollywood, classic pakistani pop, filmi, ghazal"
2ZuwXC74odD3kBvtMb2uWo,Un'ora sola ti vorrei - Instrument and base Version,Orchestra Studio 7,213289,1942-11-13,1942,0.68,0.489,0.245,0.166,0.125,-14.517,0.0407,104.954,0.36,1,0,0,False,
2hqu1Drcb63bp6GYbOuRjI,Ummeed Unse Kya Thi,Parul Ghosh,195466,1942-01-01,1942,0.995,0.28,0.163,0.858,0.064,-14.525,0.0458,69.708,0.383,0,11,0,False,classic bollywood
3HZ9NwYw223JrWfiWZzcqS,Usignolo,Luciano Tajoli,210625,1942-11-23,1942,0.986,0.287,0.148,0.025,0.38,-13.996,0.0431,172.893,0.357,1,4,0,False,"canzone napoletana, classic italian pop"
57tMi3IAJUrhPSYIwff5MP,Un Lamento,"Osvaldo Pugliese, Jorge Maciel",161680,1942-02-25,1942,0.941,0.415,0.503,1.4e-06,0.351,-7.37,0.0446,115.915,0.521,0,4,0,False,"latin classical, tango"
5KVo9rHzrkCCFIMzxcHTv7,Under a Blanket of Blue,Helen Forrest,159853,1942-04-29,1942,0.983,0.337,0.118,0.245,0.102,-16.997,0.0355,75.768,0.237,0,7,0,False,torch song
0PLgMFAedWGyfK3Wi5ny5g,Ui Ma Abhi Chhoti Hoon Balam,"Mehendi Raza, Rewa Shankar, Pt. Indra",207052,1942-12-31,1942,0.986,0.572,0.459,0.14,0.274,-7.797,0.0297,132.333,0.727,0,8,0,False,
6tORdZ5B54kM8Cv8A9osCU,Naan Unathadimai Andro,"U. R. Jeevaratnam, S. Valsamy Poet",154114,1942-01-01,1942,0.978,0.493,0.265,0.916,0.111,-15.61,0.0695,63.717,0.731,1,8,0,False,
0vIe3uYh0w24zDvEe7LBke,Opera Ayda,Umm Kulthum,771626,1942-01-01,1942,0.995,0.265,0.261,0.365,0.265,-14.187,0.033,85.967,0.432,0,7,0,False,"classic arab pop, microtonal"
2Tgb0tCTZ3FQGVRzGmCpyx,Ataf Habeeby Wehannany,Umm Kulthum,288333,1942-01-01,1942,0.994,0.245,0.301,0.921,0.425,-13.944,0.0446,76.597,0.735,0,5,0,False,"classic arab pop, microtonal"
7hdSRt0V6dATWgpiS0gyLy,Ya Farhet El Ahbab,Umm Kulthum,305733,1942-01-01,1942,0.995,0.285,0.303,0.486,0.463,-12.284,0.0387,68.22,0.602,1,8,0,False,"classic arab pop, microtonal"
5hX0ZHTl7XEB3hSxDUQC2Z,Solamente Una Vez,Nelson Hoerlle,143998,1942,1942,0.748,0.684,0.404,0.888,0.0734,-19.332,0.0315,104.243,0.917,1,0,0,False,
2vclSM35yNmroC7gs45G9I,Pathiniye Unpole,P. U. Chinnappa,162760,1942-12-01,1942,0.985,0.552,0.377,0.698,0.167,-9.833,0.106,71.757,0.554,1,10,0,False,
6QHMN3ic88hu48G4G6SkVb,"Tod und Verklärung, Op. 24: Largo","Richard Strauss, Arturo Toscanini, Philadelphia Orchestra",303093,1942,1942,0.947,0.0739,0.0251,0.969,0.139,-35.824,0.0409,78.623,0.0345,1,8,0,False,"classical, german romanticism, post-romantic era"
0L9NUb7VWUKi88mcr2CW2t,"Tod und Verklärung, Op. 24: Allegro molto agitato","Richard Strauss, Arturo Toscanini, Philadelphia Orchestra",217893,1942,1942,0.825,0.236,0.31,0.846,0.212,-13.286,0.0327,79.167,0.082,0,0,0,False,"classical, german romanticism, post-romantic era"
4RqgRm6fd1igzcx0Ccl6If,"Tod und Verklärung, Op. 24: Moderato","Richard Strauss, Arturo Toscanini, Philadelphia Orchestra",445600,1942,1942,0.924,0.142,0.204,0.919,0.132,-14.64,0.0361,63.688,0.0349,1,0,0,False,"classical, german romanticism, post-romantic era"
45I6hRup3a1Gm3Ug1NwvVT,"Tod und Verklärung, Op. 24: Meno mosso, ma sempre alla breve","Richard Strauss, Arturo Toscanini, Philadelphia Orchestra",428333,1942,1942,0.924,0.187,0.198,0.882,0.0864,-16.657,0.0376,129.115,0.0792,1,2,0,False,"classical, german romanticism, post-romantic era"
0oFa3x7vSNRXERdyw2yYLe,Per un filo d'erba,Natalino Otto,213942,1942-11-23,1942,0.98,0.392,0.0176,0.00363,0.185,-22.999,0.0505,179.68,0.643,1,9,0,False,"canzone genovese, swing italiano, vintage italian pop"
11BoFuxfIACuiw6JNFkVHD,Maaya Ulagai Nee Mathiyaathe,"S. D. Subbaiah, S. Valsamy Poet",150999,1942-01-01,1942,0.993,0.381,0.193,0.657,0.111,-14.74,0.186,77.046,0.656,0,11,0,False,
37HmKPYA0W2vWf02Oq3owK,Dhyan Uska Lagaye Baithe Hai,Surendra,163828,1942-01-01,1942,0.992,0.448,0.198,0.67,0.107,-12.341,0.0645,66.364,0.368,0,3,0,False,
7oSw7EhSfaCu7i7eoIzeD2,Hace un Año - Remasterizado,Francisco Canaro,167026,1942-03-08,1942,0.968,0.669,0.31,0.816,0.143,-14.497,0.0424,117.826,0.697,1,7,0,False,"orquesta tipica, tango, vintage tango"
3yv0pZJjYC9SS6OwnhXIoE,Tir Unka Kaleje Ke Us Paar,Shamim Akhtar,175537,1942-12-31,1942,0.996,0.551,0.124,0.854,0.113,-14.65,0.219,69.71,0.682,1,5,0,False,
1kb1VHgtLnP4ZhmMR2lfpE,Hai Unki Meri Sirf Itni Kahani,Sitara Devi,153622,1942-01-01,1942,0.99,0.503,0.159,0.00263,0.179,-11.62,0.106,130.637,0.526,1,8,0,False,classic bollywood
6FTXHxBUSYtaBfZdlzmMof,Per Un Filo D'erba,Giorgio Consolini,199288,1942-11-23,1942,0.975,0.508,0.148,0.108,0.109,-18.394,0.0382,107.252,0.623,1,3,0,False,"canzone napoletana, vintage italian pop"
3jhqZOfzU6KNh9UJBmku93,¡ande Usted..!,Estrellita Castro,134693,1942-03-11,1942,0.873,0.655,0.479,0.00544,0.155,-11.056,0.295,123.977,0.965,0,7,1,False,copla
5uYx9cqssDLNGxMS2vza1I,Porta un bacione a Firenze,Carlo Buti,180793,1942-04-06,1942,0.979,0.493,0.409,0.0,0.31,-11.543,0.0472,121.872,0.867,1,2,0,False,vintage italian pop
6y0Dv6ftPymiSF22mbJkrb,Porta un bacione a firenze,Carlo Buti,194351,1942-04-06,1942,0.976,0.488,0.389,0.0,0.26,-11.939,0.046,122.197,0.829,1,2,0,False,vintage italian pop
3Uw1QVetBSFiSuh0dxZZYs,Soltanto un bacio,Natalino Otto,167758,1942-11-23,1942,0.995,0.411,0.0526,0.739,0.255,-19.118,0.0795,59.856,0.398,1,0,0,False,"canzone genovese, swing italiano, vintage italian pop"
6E2IExwAyybInUfYapSKnt,Pothum Pothum Jenmam Ithey,"U. R. Jeevaratnam, S. Valsamy Poet",156139,1942-01-01,1942,0.991,0.445,0.147,0.905,0.121,-14.517,0.0494,69.15,0.32,0,11,0,False,
590ZTV2nt0zj5nUrSbMAsj,Sundarta Ki Khan Kahoon,Urmila,170573,1942-12-31,1942,0.985,0.45,0.442,0.918,0.232,-10.294,0.0583,66.739,0.961,1,11,0,False,
6RjUWzjZiHhUMKALVer1mr,Paalaazhi,Udumalai Narayana Kavi,158278,1942-12-31,1942,0.994,0.604,0.343,0.877,0.11,-11.57,0.303,67.926,0.819,1,8,0,False,
3ZNxQ0B8JvhjyPnNLjMxoR,Arule Puri Kalaivani,"V.A.Chellappa, Udumalai Narayana Kavi",193444,1942-12-31,1942,0.994,0.4,0.27,0.973,0.165,-14.665,0.0491,67.542,0.607,1,4,0,False,
39rhzl7ZzqRNBSDLNcPsxl,Phula Re Man Ke Phool,Urmila,190217,1942-12-31,1942,0.996,0.422,0.238,0.642,0.375,-12.235,0.0666,71.409,0.878,1,8,0,False,
38hJJVt1bIO4mGxu5ptD6e,Aaj Ki Duniya Kal Se Nyari,Urmila,189780,1942-12-31,1942,0.994,0.53,0.426,0.718,0.214,-8.945,0.0558,83.632,0.846,1,6,0,False,
5ByV9gf4vY1A7fcrSMniQ9,Thannaiyarinthathin Thanmai,"K.N.Rajalakshmi, Udumalai Narayana Kavi",176447,1942-12-31,1942,0.995,0.481,0.328,0.903,0.292,-7.397,0.193,172.0,0.837,1,3,0,False,
6iHGFj6BWiqSrw7fLiYKOQ,Vedhanai En Viduvai Maname,"J.V.Raghavan, Udumalai Narayana Kavi",193294,1942-12-31,1942,0.989,0.395,0.245,0.819,0.105,-10.781,0.078,73.94,0.683,1,3,0,False,
1xKrdP9eo70SgaT0XmjvpS,Thaayai Yeasal Ennaalume Sariyo,"S. D. Subbaiah, U. R. Jeevaratnam, S. Valsamy Poet",181812,1942-01-01,1942,0.995,0.338,0.493,0.946,0.522,-6.889,0.0439,66.07,0.778,0,11,0,False,
6o1FHibsGdyOGte2hQBPKg,Disate Srishti Aj Navin,"Urmila, Shantaram Athavale",196881,1942-11-11,1942,0.984,0.366,0.483,0.00934,0.537,-5.831,0.0493,83.506,0.857,1,10,0,False,
0FdoPovvNHcY34tn2ukj2z,Yafarhet El Ahbab,Umm Kulthum,309539,1942-01-01,1942,0.938,0.321,0.537,0.000508,0.28,-5.422,0.045,97.285,0.53,1,8,0,False,"classic arab pop, microtonal"
1inpN8QQZKPMRb4IUo7Jyd,Sethi Kelum Aiya,"T.S.Durairaj, Udumalai Narayana Kavi",149710,1942-12-31,1942,0.991,0.631,0.395,0.717,0.166,-8.48,0.22,84.759,0.784,1,6,0,False,
3DbWvlsd6rJXECabUpCk5J,Kahe Ko Muskayee Kali Ri,Urmila,186653,1942-12-31,1942,0.996,0.602,0.315,0.00712,0.416,-10.732,0.0609,82.034,0.951,0,1,0,False,
00trJbxCoQuYrRwNbOXQLm,Mere Chhote Se Man Men,Uma Devi,191013,1942-01-01,1942,0.995,0.825,0.109,0.433,0.121,-10.107,0.465,128.942,0.837,0,4,0,False,classic bollywood
4ssXPXfFcQBk0rYWv79A4G,Mere Chhote Se Man Men,Uma Devi,191013,1942-01-01,1942,0.995,0.825,0.109,0.433,0.121,-10.107,0.465,128.942,0.837,0,4,0,False,classic bollywood
1DoEMB8ECXFsgwUB2QYSpZ,Vaarayo Maamathi Vathana Singari,"S. D. Subbaiah, U. R. Jeevaratnam, S. Valsamy Poet",177171,1942-01-01,1942,0.995,0.47,0.259,0.847,0.212,-11.077,0.049,65.669,0.641,0,4,0,False,
0ni46YglkRvz2nzLUlwRiz,"Goldberg Variations, BWV 988: Variation XXII","Johann Sebastian Bach, Claudio Arrau",82253,1942,1942,0.995,0.629,0.256,0.865,0.125,-17.647,0.0482,99.949,0.857,1,7,0,False,"baroque, classical, early music, german baroque"
5u86Ayf24mQg3YlEVz9NVf,"Goldberg Variations, BWV 988: Variation XXVI","Johann Sebastian Bach, Claudio Arrau",128026,1942,1942,0.991,0.389,0.132,0.914,0.139,-22.25,0.0415,109.321,0.733,1,7,0,False,"baroque, classical, early music, german baroque"
3BPMzZwT7yRhNbLP7lnTUt,"Goldberg Variations, BWV 988: Variation XIV","Johann Sebastian Bach, Claudio Arrau",129186,1942,1942,0.995,0.416,0.276,0.901,0.151,-18.414,0.0439,95.694,0.892,1,7,0,False,"baroque, classical, early music, german baroque"
7r9nNwkD19k0MR6byCXfe7,"Goldberg Variations, BWV 988: Variation XX","Johann Sebastian Bach, Claudio Arrau",119853,1942,1942,0.994,0.398,0.231,0.898,0.143,-18.84,0.0369,98.578,0.927,0,4,0,False,"baroque, classical, early music, german baroque"
4HHQfdK3TnnTQB8v6dcQV1,"Goldberg Variations, BWV 988: Variation XXIII","Johann Sebastian Bach, Claudio Arrau",121786,1942,1942,0.995,0.398,0.232,0.893,0.156,-19.43,0.0444,99.879,0.922,1,7,0,False,"baroque, classical, early music, german baroque"
7CzWG5eb73O6ALr8Xc3705,"Goldberg Variations, BWV 988: Variation XXV","Johann Sebastian Bach, Claudio Arrau",509106,1942,1942,0.995,0.562,0.072,0.87,0.124,-25.685,0.053,93.689,0.198,0,0,0,False,"baroque, classical, early music, german baroque"
0aaXdNKPsGckcAyWvkk8kT,"Goldberg Variations, BWV 988: Variation XXVII - Canon at the Ninth","Johann Sebastian Bach, Claudio Arrau",115200,1942,1942,0.994,0.424,0.195,0.917,0.129,-23.389,0.0431,103.493,0.896,1,7,0,False,"baroque, classical, early music, german baroque"
2DhQdqOgx9bGVTy57Qrigs,"Goldberg Variations, BWV 988: Variation XXVIII","Johann Sebastian Bach, Claudio Arrau",145226,1942,1942,0.995,0.526,0.0863,0.887,0.101,-25.749,0.0583,81.318,0.603,1,7,0,False,"baroque, classical, early music, german baroque"
5JKstSDqEvWKaSIA9jRKq9,"Goldberg Variations, BWV 988: Variation XXIX","Johann Sebastian Bach, Claudio Arrau",129013,1942,1942,0.995,0.387,0.314,0.914,0.136,-16.248,0.0363,93.653,0.786,1,7,0,False,"baroque, classical, early music, german baroque"
1kiqn2TegL1dJAF3oN1rap,"Goldberg Variations, BWV 988: Variation XXI - Canon at the Seventh","Johann Sebastian Bach, Claudio Arrau",185080,1942,1942,0.996,0.434,0.146,0.903,0.0983,-22.651,0.046,81.166,0.709,0,0,0,False,"baroque, classical, early music, german baroque"
4C3wkWr3QQl5gHvSlIjt8h,"Goldberg Variations, BWV 988: Variation XVI - Overture","Johann Sebastian Bach, Claudio Arrau",172693,1942,1942,0.993,0.376,0.198,0.862,0.147,-19.178,0.0462,63.665,0.622,1,7,0,False,"baroque, classical, early music, german baroque"
7umadvo2x9tIzjzgcYnHNg,"Goldberg Variations, BWV 988: Variation XVIII - Canon at the Sixth","Johann Sebastian Bach, Claudio Arrau",70706,1942,1942,0.995,0.571,0.206,0.813,0.158,-21.813,0.0466,111.905,0.84,1,7,0,False,"baroque, classical, early music, german baroque"
3tVJHOB4UBZTr2RylPN89b,"Goldberg Variations, BWV 988: Variation XV - Canon at the Fifth","Johann Sebastian Bach, Claudio Arrau",253000,1942,1942,0.996,0.631,0.0898,0.926,0.121,-28.073,0.0741,124.809,0.72,0,7,0,False,"baroque, classical, early music, german baroque"
60BNTgmDP2rR6Sd3MnKjw1,"Goldberg Variations, BWV 988: Variation XIX","Johann Sebastian Bach, Claudio Arrau",63053,1942,1942,0.995,0.599,0.227,0.917,0.142,-23.836,0.0536,93.873,0.883,1,7,0,False,"baroque, classical, early music, german baroque"
3yt3wXbZFAsq38nChX5QS5,"Goldberg Variations, BWV 988: Variation XXIV: Canon at the Octave","Johann Sebastian Bach, Claudio Arrau",200080,1942,1942,0.995,0.382,0.104,0.934,0.145,-27.356,0.0473,182.308,0.687,1,7,0,False,"baroque, classical, early music, german baroque"
5J1uVp5qYRCI3n9KogmVnV,"Goldberg Variations, BWV 988: Variation XVII","Johann Sebastian Bach, Claudio Arrau",118760,1942,1942,0.995,0.552,0.332,0.914,0.182,-20.949,0.0517,100.487,0.894,1,7,0,False,"baroque, classical, early music, german baroque"
5LDybOToQCsLvdjjJ1U0hP,宵待草,高峰三枝子,199560,1942,1942,0.929,0.181,0.342,0.000272,0.0975,-8.302,0.0358,83.767,0.197,0,9,0,False,enka
089qIwpyJT8TlxTH6s3cu3,夕顔のビギン,高峰三枝子,233800,1942,1942,0.8,0.36,0.242,0.000701,0.0946,-13.258,0.0361,85.851,0.23,0,5,0,False,enka
1GW3IEw4AoqOWNkmKtgJIy,宵待草,高峰三枝子,196706,1942,1942,0.982,0.27,0.197,0.0114,0.0804,-12.273,0.036,96.113,0.188,0,10,1,False,enka
5YmiguJ91MIWbdh6sAcQI9,宵待草〜あいさつ,高峰三枝子,257453,1942,1942,0.907,0.235,0.376,2.76e-05,0.941,-15.535,0.0859,140.868,0.318,0,10,0,False,enka
3xU0IPnpuiVTmzjyDakClb,雪降る窓辺,高峰三枝子,196280,1942,1942,0.843,0.312,0.282,0.0,0.0828,-8.974,0.0317,146.42,0.459,1,9,0,False,enka
7dCEcGvFRr4OTZdTw1Rerp,迎春花 (インチュンホワ),高峰三枝子,201986,1942,1942,0.94,0.583,0.238,0.0,0.0671,-8.064,0.0286,91.718,0.513,1,0,0,False,enka
6BQpkccg8VIkVh2lg3jCaw,宵待草,高峰三枝子,191600,1942,1942,0.944,0.151,0.25,0.000401,0.101,-12.526,0.0372,91.774,0.109,0,10,0,False,enka
4bhLpVcBkXoq3iQJNa9oJ1,Y de hai,Mina,113841,1942-11-13,1942,0.929,0.568,0.452,2.89e-06,0.179,-10.451,0.0391,94.064,0.789,0,5,0,False,"classic italian pop, italian adult pop, ye ye"
1oh9jQ4c0cYCKOOZ25HQ9n,Yeh Rail Humare Ghar Ki,"Rajkumari, Prem Adib",205946,1942-01-01,1942,0.988,0.627,0.432,0.716,0.106,-10.612,0.0619,125.677,0.95,1,10,0,False,"classic bollywood, filmi, ghazal"
2KFjGuW1Rw1ghqiFx8u8f4,You'll Never Catch Me,Local Oafs,50373,1942-06-06,1942,0.116,0.137,0.999,0.932,0.441,-8.133,0.061,178.291,0.0405,0,6,0,False,
48oTd2zRo35jExk0rXLnU3,Yeh Kya Sun Rahi Hoon,Shamshad Begum,190256,1942-12-31,1942,0.989,0.507,0.0673,0.00128,0.116,-14.052,0.0554,71.569,0.45,0,2,0,False,"classic bollywood, filmi, ghazal"
4NJ8Vhjz9ndZNBsVbbFbbS,Yally Fott Elmal,Mohammed Abdel Wahab,548872,1942-01-01,1942,0.974,0.455,0.186,0.000563,0.0945,-13.909,0.271,80.061,0.858,1,3,0,False,"arab folk, belly dance, classic arab pop"
4vV98sBZEr4qFFaOmMc3xQ,Yeh Dard Mohabbat Hai,"Khursheed Bano, D. N. Madhok",201960,1942-01-01,1942,0.994,0.332,0.0389,0.865,0.109,-19.965,0.0863,68.908,0.534,1,1,0,False,classic bollywood
5Lp4sdHFyYsS9Jw6lHGr4x,Yeh Duniya Kya Hai,"K. C. Varma, S. Newrekar",206048,1942-01-01,1942,0.995,0.461,0.171,0.862,0.167,-12.846,0.0546,69.785,0.432,0,3,0,False,
73jykUqXlFtpxO4WeRzCvR,Yeh Thandi Hawayen,"Vasanti, Khursheed Bano, D. N. Madhok",170293,1942-01-01,1942,0.995,0.503,0.0698,0.749,0.258,-16.247,0.104,143.64,0.678,1,5,0,False,
3eHpeTL8d35ewo2BoJCtz0,Y de hai,Mina,113867,1942-11-13,1942,0.935,0.597,0.452,3.94e-06,0.19,-10.401,0.0395,93.952,0.778,0,5,0,False,"classic italian pop, italian adult pop, ye ye"
55iMyKwwOZukOdwmDljbm7,Yeh Mujhse Kaha Dil Ne,"Anima Dasgupta, Kalyani Nair",138571,1942-01-01,1942,0.995,0.572,0.176,0.884,0.109,-16.922,0.195,146.655,0.677,0,8,0,False,
57neRwcOVcEk3vRBuAXgiM,You Go to My Head,Helen Forrest,154214,1942-04-29,1942,0.971,0.298,0.118,1.01e-05,0.33,-14.975,0.0335,81.179,0.253,1,11,0,False,torch song
72zOxc1ZkIX15lD9gpFFl0,Yeh Mere Bhaiya Yeh Unka Dil,Shamim Akhtar,173589,1942-12-31,1942,0.996,0.652,0.0818,0.819,0.193,-13.258,0.15,119.937,0.555,1,8,0,False,
4u5yJGb1NgNN7UImkrmfGB,Y No Veo Na,Lola Flores,142640,1942-07-07,1942,0.924,0.659,0.587,0.266,0.118,-9.683,0.0431,124.687,0.936,1,8,0,False,copla
7tufTIHo0REnPx1mU4tDhW,嫁ぐ日ちかく,高峰三枝子,193760,1942,1942,0.993,0.442,0.126,1.45e-06,0.215,-12.665,0.0376,94.673,0.426,0,0,0,False,enka
00LSN4p58dGFzgK5TIwKOv,Hallet Ya Rabea,Mohammed Abdel Wahab,401542,1942-01-01,1942,0.974,0.351,0.192,0.00466,0.414,-14.949,0.0969,83.388,0.526,1,2,1,False,"arab folk, belly dance, classic arab pop"
48N3VsOpmhzBVyNksKLkbx,Teri Yaad Men Woh Maza Pa Raha,Surendra,192725,1942-01-01,1942,0.956,0.359,0.251,0.000313,0.109,-12.535,0.0876,83.684,0.417,0,10,0,False,
2hVcnmUav48VoTlvUbeb1s,Kad Yaar Sarooda Buta,Sitara Devi,181421,1942-01-01,1942,0.976,0.569,0.391,0.00027,0.588,-7.805,0.0888,65.441,0.796,0,0,0,False,classic bollywood
2bcR5eC6Ihp9Aj98VWxQhG,Boff You off My Mind,Local Oafs,30080,1942-06-06,1942,0.139,0.199,0.999,4.04e-05,0.921,-8.555,0.0446,85.942,0.0393,1,8,0,False,
0izK51FLNbg7iSwtjiR4aK,Sencillo y Compadre - Remasterizado,"Francisco Canaro, Carlos Roldán",181440,1942-03-08,1942,0.986,0.611,0.172,0.694,0.0613,-10.596,0.0687,125.971,0.8,1,6,0,False,"orquesta tipica, tango, vintage tango"
66jfyRNiJgTUM03egAXog6,Leave Yr Blues,&Caleb,228018,1942-02-16,1942,0.0778,0.661,0.594,1.16e-05,0.175,-6.941,0.0516,77.834,0.791,1,7,0,False,
4gAHrfbOFl20g1uf5b9SPM,Kabhi Yaad Ansoo Ban Ke,"Khursheed Bano, Vasanti, Aroon, D. N. Madhok",181426,1942-01-01,1942,0.994,0.74,0.0771,0.815,0.181,-16.207,0.425,76.308,0.805,1,5,0,False,classic bollywood
0J1YvSraCDptfjlY6w251G,Dil Yeh Kiska Hai Meri Jaan,"Surinder, Shamshad Begum",190841,1942-12-31,1942,0.993,0.757,0.065,0.736,0.11,-16.189,0.355,107.593,0.61,1,2,0,False,
3jjVaHVVaynIJhu00nWxmp,上海夜船,高峰三枝子,206386,1942,1942,0.948,0.265,0.314,0.0,0.318,-9.55,0.0356,136.542,0.437,1,7,0,False,enka
2YxqCCrbJsUBVkHVcP26sG,踊りましょうよ,高峰三枝子,220293,1942,1942,0.769,0.698,0.31,0.000128,0.169,-10.695,0.0339,118.571,0.737,1,0,0,False,enka
1V64plcTfPGYjVrUwbxt6h,北京夜となれば,高峰三枝子,196400,1942,1942,0.995,0.288,0.2,0.086,0.6,-12.317,0.048,204.404,0.551,1,4,0,False,enka
1yR1XN5VqqKRKGUPrPCVXc,Gori Dekha Hai Tumko Jab Se,Yakub,176843,1942-12-31,1942,0.993,0.454,0.641,0.000905,0.792,-7.068,0.122,140.846,0.746,1,5,0,False,
11QgqEbsHEJPnTqudEPPqJ,Naanmugan Padaippil Yaavarum Samame,"S. D. Subbaiah, S. Valsamy Poet",189078,1942-01-01,1942,0.993,0.615,0.368,0.348,0.116,-5.808,0.0454,108.09,0.691,0,11,0,False,
4mTJkfKqoBEQzqTgyFcxoK,La Lola Ya Está a Tu Vera,Lola Flores,186026,1942-07-07,1942,0.52,0.511,0.404,0.0,0.291,-7.698,0.075,120.215,0.678,1,7,0,False,copla
2dkiJNt6e4ZvPiXpGHW2VW,Baby Won't You Please Come Home,Helen Forrest,117053,1942-04-29,1942,0.98,0.485,0.191,3.55e-06,0.114,-11.849,0.0426,82.054,0.489,0,7,0,False,torch song
1SBwKGFqUn5YVvTYBAVZ5d,How Come You Do Me Like You Do,Helen Forrest,128240,1942-04-29,1942,0.988,0.763,0.0747,0.00503,0.2,-13.081,0.132,99.719,0.496,1,5,0,False,torch song
3Dca38DAfXNQBXX7Sx4qZJ,Entre Col y Col,Lola Flores,121493,1942-07-07,1942,0.99,0.739,0.418,0.771,0.153,-8.541,0.107,103.233,0.967,1,0,0,False,copla
5Tl3xEp9lbEDVdJ3Ed3RTR,湖畔の宿,高峰三枝子,248666,1942,1942,0.949,0.26,0.238,0.00125,0.935,-15.59,0.0451,114.343,0.209,0,8,0,False,enka
5qKd8D8KVRc0s7hDpualcm,孤独の夜,高峰三枝子,205786,1942,1942,0.928,0.459,0.255,1.96e-05,0.082,-10.497,0.0316,71.887,0.148,1,0,0,False,enka
1Pc6DjadHZHX01WTpmwJqn,湖畔の宿,高峰三枝子,192293,1942,1942,0.957,0.435,0.248,0.0,0.102,-10.608,0.0382,82.263,0.4,0,9,1,False,enka
6ykFlIq7kd7Tef1HdqYVJR,母を呼ぶ歌,高峰三枝子,205840,1942,1942,0.99,0.284,0.268,0.0161,0.214,-12.191,0.0402,77.236,0.312,1,6,0,False,enka
4lIp1fX8jDAJuisj6Oc5pd,湖畔の宿,高峰三枝子,203320,1942,1942,0.973,0.392,0.204,1.26e-06,0.117,-11.684,0.0347,70.976,0.232,0,8,1,False,enka
4yOvfTcvo7SeLp0EDTNdla,湖畔の宿,高峰三枝子,230893,1942,1942,0.951,0.375,0.253,0.00013,0.111,-12.138,0.0405,77.182,0.325,0,8,0,False,enka
2kfZZNxWqi639nYzUPZMPf,乙女は夢みる,高峰三枝子,203946,1942,1942,0.986,0.261,0.27,0.00014,0.386,-11.986,0.037,101.523,0.44,1,10,0,False,enka
6MoPBPMhN6P9xBWiO5uXbM,Aa Aa Kaun Humen Yaad Aaye,Maruti Rao,185666,1942-12-31,1942,0.995,0.411,0.165,0.867,0.442,-12.801,0.08,142.973,0.424,1,8,0,False,
7g0tmWNqC9KBdr1hpy98FS,"No, No, No y No",Lola Flores,160266,1942-07-07,1942,0.802,0.541,0.917,0.266,0.778,-7.241,0.231,126.117,0.805,0,3,0,False,copla
022drkfpglb0KMAgPUhD3y,Chhuk Chhuk Karti Ye Gaadi,"Rohosen, Neelkanth Tiwari, D. N. Madhok",186447,1942-12-31,1942,0.673,0.907,0.607,0.0,0.312,-7.917,0.135,114.758,0.962,1,5,0,False,
3C0oDk4JE4xKLtxdAE8xe9,Dil Mein Teri Yaad Liye,"Shanta Hublikar, Balwant Singh",179908,1942-12-31,1942,0.993,0.459,0.139,0.0611,0.87,-17.831,0.414,204.595,0.785,0,11,0,False,
4butp63x1yywNvAh7O1HUp,Hamesha Khil Rahen Yeh Phool,Shanta Apte,161948,1942-12-31,1942,0.991,0.618,0.248,3.07e-05,0.369,-8.002,0.101,116.336,0.844,1,2,0,False,classic bollywood
5uwyUakNlixXSq7LfjUTCr,乙女は何を夢みるや,高峰三枝子,200813,1942,1942,0.983,0.596,0.206,0.0,0.0814,-10.542,0.039,112.987,0.548,1,5,0,False,enka
39skOoVlGzCfRXmPhYnw7H,"Symphony No. 2 in D Major, Op. 43: II. Tempo andante, ma rubato","Jean Sibelius, Arturo Toscanini, NBC Symphony Orchestra",722813,1942,1942,0.948,0.205,0.12,0.935,0.172,-16.392,0.0365,107.595,0.1,0,2,0,False,"classical, finnish classical, impressionism, post-romantic era"
7czIESZO2wx3V7U9jI2s4D,"Piano Concerto No. 27 in B-Flat Major, K. 595: I. Allegro","Wolfgang Amadeus Mozart, Robert Casadesus, Sir John Barbirolli, New York Philharmonic",755586,1942,1942,0.976,0.343,0.157,0.866,0.111,-15.713,0.0355,136.532,0.202,1,10,0,False,"classical, classical era"
71l2M7pPLvkQsGhuQcqjji,Zulmi Jawani Ne Zulm Kiya,Sumati Trilokekar,179600,1942-12-31,1942,0.987,0.402,0.217,0.00146,0.345,-9.199,0.159,181.4,0.498,0,2,0,False,
7HzEV7v0hRkbgL5NV3xDL2,Zorongo Gitano,Lola Flores,183523,1942-07-07,1942,0.702,0.639,0.624,0.0,0.0757,-9.006,0.121,121.453,0.751,1,6,0,False,copla
4YZShl0gICnm5PE90ghTzp,Zara Dheere Sajanwa,"Shamim Akhtar, Rama Shukul",179873,1942-12-31,1942,0.996,0.608,0.131,0.862,0.15,-14.171,0.266,69.188,0.617,1,7,0,False,
7h0spIBVxJHOx7LjMXWDUL,Zappatore - Instrument and base Version,Orchestra Studio 7,198582,1942-11-13,1942,0.331,0.341,0.192,0.388,0.178,-13.346,0.0336,143.196,0.379,0,7,0,False,
4NHbJyB7mpib2G9CAQ1wfU,Zappatore - Musical base Version,Orchestra Studio 7,206341,1942-11-13,1942,0.298,0.343,0.247,0.634,0.127,-12.034,0.0335,142.137,0.421,0,7,0,False,
3R4GKnYaEddREo09etykv2,La Zarzamora,Lola Flores,167706,1942-07-07,1942,0.994,0.478,0.251,0.000659,0.195,-11.311,0.202,176.251,0.724,0,11,2,False,copla
4b7YrjiyCzuHoyTtCZcFxs,O zampugnaro 'nnammurato - Musical base Version,Orchestra Studio 7,252708,1942-11-13,1942,0.0234,0.485,0.163,0.846,0.116,-14.253,0.0319,88.378,0.111,1,8,0,False,
1suO1SBaYcFTynLzVrDyO3,'O zampugnaro 'nnammurato - Instrument and base Version,Orchestra Studio 7,252865,1942-11-13,1942,0.461,0.291,0.232,8.09e-05,0.175,-13.025,0.0392,169.511,0.161,1,8,0,False,
1gzmmGaYKg7VJjJIP2srRx,雨ぞ降る,高峰三枝子,195213,1942,1942,0.991,0.219,0.193,1.18e-05,0.149,-12.644,0.041,82.004,0.361,0,2,0,False,enka
5DPnk8t6Arb6B0BGxMIWYd,Chhota Sa Sansar Hamara,Shanta Apte,189213,1942-12-01,1942,0.841,0.534,0.479,0.122,0.235,-9.35,0.0578,136.911,0.947,1,11,0,False,classic bollywood
38Ssz0LTwdZPc7v94SJZuM,Log Mujh Ko Khush Samajhte Hai Magar Main Gham Mein Hoon,Ghulam Haider,198066,1942-01-01,1942,0.994,0.464,0.129,0.859,0.21,-14.028,0.0745,102.11,0.446,0,6,0,False,
5TDZAcfLRg4ho6xFMmkj5m,Bujh Sako To Bujho,Shanta Apte,205080,1942-01-01,1942,0.695,0.621,0.38,2.98e-06,0.108,-9.989,0.0457,71.783,0.897,1,4,0,False,classic bollywood
51BMViSQp7tGJctOVUj9Q7,Mohe Apne Hi Rang Main,Shanta Apte,192152,1942-01-01,1942,0.897,0.512,0.387,0.0,0.341,-11.69,0.0686,127.86,0.758,0,9,0,False,classic bollywood
7BeSvDwZ628d1cKAN9mC8x,Mazdoor Hai Shaan Is Duniya Ki,Zahur Raza,201672,1942-12-31,1942,0.993,0.633,0.297,0.511,0.202,-9.181,0.101,130.245,0.7,1,10,0,False,
1ZlqAAGIQ8w4kWAVjRwWUr,Arman Tadapte Hain,Shanta Apte,201933,1942-01-01,1942,0.996,0.333,0.242,0.947,0.499,-14.802,0.0372,103.518,0.571,1,9,0,False,classic bollywood
6YleYG1P8BdmUHep8in6c8,Bujh Sako To Bujho,Shanta Apte,205080,1942-12-01,1942,0.695,0.619,0.38,2.95e-06,0.108,-9.989,0.0461,72.01,0.896,1,11,0,False,classic bollywood
