id,name,artists,duration_ms,release_date,year,acousticness,danceability,energy,instrumentalness,liveness,loudness,speechiness,tempo,valence,mode,key,popularity,explicit,genre
5R0v2GLujsGk37QCkGdvMQ,Rock Lobster,The B-52's,295333,1979-01-01,1979,0.0111,0.554,0.815,0.0486,0.0511,-12.481,0.0409,90.889,0.6,1,1,41,False,"album rock, classic rock, dance rock, new romantic, new wave, new wave pop, permanent wave, post-punk, rock, zolo"
0x0lkNZwLs6tU3XDu1VNyw,Lucille Has Messed My Mind Up,Frank Zappa,342080,1979-09-17,1979,0.495,0.762,0.381,2.21e-05,0.0553,-13.244,0.101,121.366,0.685,0,9,34,False,"art rock, blues rock, experimental, instrumental rock, jazz fusion, jazz rock, progressive rock, proto-metal, psychedelic rock, symphonic rock, zolo"
63lZR6NrvsosUAFwXSE63E,Local Girls,"Graham Parker & The Rumour, Graham Parker",223666,1979-03-01,1979,0.245,0.686,0.859,1.55e-05,0.325,-7.753,0.0348,112.409,0.791,1,2,27,False,"power pop, pub rock"
26TsScuJSlqwZyaoWG2l7u,The Logical Song - Live At Pavillon de Paris/1979,Supertramp,245866,1979-03-29,1979,0.547,0.555,0.749,0.00157,0.976,-7.806,0.0595,127.415,0.698,0,0,42,False,"album rock, art rock, classic rock, glam rock, mellow gold, piano rock, progressive rock, rock, soft rock, symphonic rock"
2qEGnHhpYEjXbjiceeKk0F,La catedral,"Agustín Barrios Mangoré, John C. Williams",432400,1979,1979,0.973,0.344,0.0556,0.862,0.0806,-28.592,0.047,116.078,0.184,0,11,32,False,"classical guitar, guitarra clasica, latin classical, polca paraguaya"
4ZxtmVTaCtmC4pTn0nkUJ5,Love You Inside Out,Bee Gees,250640,1979-01-01,1979,0.302,0.71,0.694,3.78e-05,0.209,-5.796,0.0351,95.081,0.872,0,11,38,False,"disco, mellow gold, soft rock"
0yPRVkBaOa1E0vSdKbuOvT,Last Cheater's Waltz,T.G. Sheppard,227026,1979-07-12,1979,0.597,0.531,0.288,0.19,0.0844,-17.066,0.0261,97.691,0.283,1,0,26,False,"classic country pop, country, country rock"
2wwK6OjlEZSOHgCcW7eFeY,Long Time,Molly Hatchet,199733,1979,1979,0.0656,0.5,0.793,0.0149,0.119,-7.406,0.0327,89.69,0.509,0,9,27,False,"album rock, classic rock, country rock, glam metal, hard rock, southern rock"
0Fn2gODioyQgOW9mh55aw1,Like a Hurricane - Live; 2016 Remaster,"Neil Young, Crazy Horse",468438,1979-11-14,1979,0.0971,0.334,0.796,0.246,0.716,-11.402,0.0646,116.922,0.422,0,9,29,False,"canadian singer-songwriter, classic canadian rock, classic rock, folk rock, mellow gold, permanent wave, rock, roots rock, singer-songwriter"
7aROycQXwtu4Mt9e0hht6X,Lovin' You Is Easy,Journey,216493,1979,1979,0.0374,0.571,0.72,9.84e-05,0.111,-7.428,0.0326,109.857,0.393,0,9,27,False,"album rock, classic rock, hard rock, mellow gold, rock, soft rock"
7AG5ds8XtXavTZkFfLt8Qq,Love Gun,Rick James,346453,1979-10-16,1979,0.00652,0.761,0.938,0.1,0.1,-3.856,0.0635,121.714,0.748,1,9,32,False,"disco, funk, motown, p funk, quiet storm, soul, synth funk"
04BXsortkjpUxf1sOtLRXE,Monkey Man - 2015 Remaster,The Specials,165600,1979-11-01,1979,0.0914,0.497,0.924,2.86e-05,0.35,-7.312,0.0368,152.681,0.969,1,2,49,False,"britpop, new wave, punk, ska, ska revival"
6wUS6fFYO3VwJsbUn7zWEW,Mariage d'amour,Richard Clayderman,160920,1979-01-01,1979,0.816,0.315,0.451,0.882,0.0976,-12.333,0.0345,165.07,0.672,0,7,49,False,easy listening
6owwZC8gUvrBuygvOHaYXb,Mania De Você,"Rita Lee, Roberto De Carvalho",295106,1979,1979,0.802,0.628,0.312,1.45e-06,0.101,-13.396,0.0321,124.692,0.559,1,7,63,False,"mpb, tropicalia"
43U1bCDTZAhhY1Y8mCkTG4,Pop Muzik (12 Inch Version),"M, Nick Launay",296466,1979-01-01,1979,0.124,0.94,0.727,0.00021,0.0808,-9.982,0.0358,110.796,0.969,1,1,51,False,synthpop
2CXkN6UAb3jAFwz4VbsDq0,September Morn,Neil Diamond,232000,1979-12-22,1979,0.628,0.419,0.23,5.85e-06,0.222,-17.102,0.0359,128.892,0.199,1,10,55,False,"adult standards, brill building pop, folk rock, mellow gold, singer-songwriter, soft rock, yacht rock"
5VMTSLp2WX3dsnsVWiVGB7,Mind - 2005 Remaster,Talking Heads,252040,1979-08-03,1979,0.279,0.618,0.801,0.042,0.38,-6.416,0.0433,103.296,0.451,1,2,35,False,"alternative rock, art punk, dance rock, funk rock, new wave, permanent wave, post-punk, rock, zolo"
1HUTQRf1kFERMNNVvCU5R4,My Forbidden Lover - 2018 Remaster,CHIC,274960,1979-07-30,1979,0.143,0.814,0.819,0.0,0.298,-12.712,0.0587,108.338,0.807,0,0,30,False,"disco, funk, motown, soul"
266M1Dgd2GeR8xW2tufu3a,Mr Clarinet,The Birthday Party,223973,1979-02-27,1979,0.0104,0.472,0.647,2.85e-06,0.47,-12.903,0.035,151.589,0.84,1,5,32,False,"australian post-punk, dream pop, experimental, experimental rock, gothic rock, industrial, post-punk"
3mK75eGdaeLXxX7P1OzWLK,Man in the Mirror - 2003 Edit,Michael Jackson,303960,1979,1979,0.403,0.808,0.775,4.85e-06,0.128,-6.02,0.0371,100.334,0.213,1,8,38,False,"r&b, soul"
5OU4PqYhwypDsiviprGhSy,"Medley: Working My Way Back to You / Forgive Me, Girl",The Spinners,243200,1979,1979,0.469,0.84,0.777,3.58e-06,0.216,-6.399,0.0451,121.633,0.92,0,9,39,False,"classic soul, disco, funk, motown, philly soul, quiet storm, soul, southern soul"
4Gw9ACmKi3O2vP8UwJqF0M,Memories Can't Wait - 2005 Remaster,Talking Heads,210013,1979-08-03,1979,0.0204,0.383,0.778,0.228,0.441,-4.845,0.0282,91.176,0.512,0,11,34,False,"alternative rock, art punk, dance rock, funk rock, new wave, permanent wave, post-punk, rock, zolo"
66YHxyGAUGjMBDdrDlWIMD,One of My Turns,Pink Floyd,216800,1979-11-30,1979,0.305,0.315,0.218,0.0012,0.226,-15.215,0.0728,175.868,0.156,1,0,52,False,"album rock, art rock, classic rock, progressive rock, psychedelic rock, rock, symphonic rock"
7oR2quSsW5O7YmUC7HmwiV,Move Your Boogie Body,The Bar-Kays,376226,1979,1979,0.386,0.781,0.954,0.00379,0.105,-7.052,0.0453,113.937,0.964,1,0,30,False,"classic soul, disco, funk, memphis soul, motown, p funk, popping, post-disco, soul, southern soul"
5cj49uxWOZFpIpLISNGvvT,Me Gusta Bailar Contigo,Juan Gabriel,311560,1979-08-03,1979,0.543,0.255,0.447,0.0147,0.0667,-13.761,0.0285,167.563,0.362,1,9,42,False,"cancion melodica, latin pop, mariachi, musica mexicana, ranchera"
6TfspH2AcZdTIXw7StwKQB,Machine Gun Etiquette,The Damned,109059,1979-11-02,1979,8.99e-06,0.218,0.939,0.000299,0.466,-7.124,0.101,138.31,0.563,0,11,33,False,"new wave, post-punk, punk, uk post-punk"
21ogc36Tn5Hy6gpgWmueJC,"MacArthur Park Suite: MacArthur Park/One Of A Kind/Heavens Knows/MacArthur Park Reprise - DJ Promo 12"" Version",Donna Summer,1055400,1979-04-25,1979,0.122,0.651,0.832,0.00224,0.0575,-8.189,0.0422,131.316,0.637,0,4,35,False,"disco, hi-nrg, new wave pop, soft rock"
2Rx6xa3zxZ0dr6s0N6zDt5,マジック・レイ,CASIOPEA,282973,1979,1979,0.603,0.712,0.438,0.766,0.101,-11.045,0.0366,141.212,0.713,1,9,33,False,"japanese jazz, japanese jazz fusion"
7fDzG8eOkIJ1HgVqebjelq,My Girl,Madness,164933,1979-10-19,1979,0.102,0.689,0.915,0.00028,0.087,-4.77,0.0376,119.378,0.704,0,1,28,False,"britpop, new romantic, new wave, ska, ska revival"
7aNpyFZuNbDR1zmko0C7xu,Minstrel Gigolo,Christopher Cross,354706,1979-12-20,1979,0.284,0.647,0.384,0.0102,0.078,-14.952,0.031,114.307,0.605,1,2,27,False,"mellow gold, soft rock, yacht rock"
4m135IefwsN8Y1uZqd0JR6,"Me, I Disconnect from You - 1998 Remaster",Tubeway Army,202760,1979-04-06,1979,0.00502,0.59,0.533,0.00392,0.508,-12.202,0.0584,132.622,0.213,1,7,34,False,"early synthpop, new romantic, new wave, uk post-punk, zolo"
1toPcmUedKAy3Ce3YegF35,"Moon River (From ""Breakfast At Tiffany's"")",Richard Clayderman,195213,1979-01-01,1979,0.568,0.406,0.3,0.903,0.288,-15.585,0.0297,184.31,0.362,1,0,43,False,easy listening
4aF7lO8ZOibQZXo1rfkisa,Must of Got Lost,The J. Geils Band,178240,1979-06-05,1979,0.41,0.53,0.516,0.00182,0.0532,-12.378,0.0793,103.922,0.738,1,0,28,False,"album rock, classic rock, country rock, hard rock, mellow gold, rock, singer-songwriter, soft rock"
5NSFOzVMjfnaqlIBikysXM,Manimal,Germs,131106,1979-10-01,1979,2.97e-05,0.318,0.956,0.0406,0.16,-8.354,0.053,105.879,0.319,0,11,30,False,"early us punk, hardcore punk, punk"
6q6ONvx8Dc3qC7YjfMLF0o,Map Ref 41 Degrees N 93 Degrees W - 2006 Remastered Version,Wire,220413,1979-09-01,1979,0.439,0.422,0.894,1.47e-05,0.339,-5.22,0.0667,140.729,0.798,1,7,32,False,"alternative rock, art punk, experimental rock, post-punk, punk, uk post-punk"
2QQDZl9xzGOM3z0JevtVgZ,Take Me to Your Heaven,Wilson Brothers,220853,1979-09-15,1979,0.068,0.457,0.806,0.0,0.106,-6.123,0.0443,92.075,0.883,1,2,43,False,deep soft rock
56PGlBXd4xJHTPhWARsg6W,Melody Lee,The Damned,127513,1979-11-02,1979,0.00445,0.256,0.941,0.00122,0.135,-9.477,0.113,108.367,0.127,0,11,32,False,"new wave, post-punk, punk, uk post-punk"
2kZDs0Cuo9utZEAdwvmzNf,Maracatu Atômico,Gilberto Gil,264306,1979-01-01,1979,0.264,0.678,0.832,5.37e-06,0.175,-7.632,0.034,106.07,0.963,0,2,42,False,"bossa nova, mpb, samba, tropicalia, violao"
5MnOyYxgPVb2V6jv9c1en7,Meathook,The Cure,137893,1979-05-11,1979,0.389,0.639,0.464,0.00113,0.107,-11.21,0.473,166.396,0.608,1,0,27,False,"new wave, permanent wave, rock, uk post-punk"
5VSHTbOYjs16k6tb6o70Sh,My Sarah,Thin Lizzy,212466,1979,1979,0.472,0.714,0.562,0.000318,0.0799,-11.811,0.0397,125.309,0.778,1,2,26,False,"album rock, blues rock, classic rock, glam metal, hard rock, irish rock, metal, rock"
0NUzX8hwfUC7ZZ1kaXckvb,My Way,Sex Pistols,245413,1979-02-26,1979,0.563,0.249,0.833,0.665,0.381,-7.849,0.099,174.919,0.245,1,4,42,False,"alternative rock, punk, rock"
1G6eFFDRaLr9EbThnhzMBD,One Step Beyond,Madness,138360,1979-10-19,1979,0.0124,0.477,0.94,0.032,0.412,-4.888,0.0423,154.82,0.941,0,0,43,False,"britpop, new romantic, new wave, ska, ska revival"
3GO4hkP8sn2KaertRUyY8s,Manny Moe And Jack,The Dickies,170173,1979-01-01,1979,0.0138,0.274,0.961,7.38e-05,0.389,-6.432,0.0409,190.216,0.822,1,9,30,False,"early us punk, hardcore punk, punk"
1codjVUPm0ic7gVIHwsZnS,"My My, Hey Hey (Out of the Blue) - Live; 2016 Remaster","Neil Young, Crazy Horse",241848,1979-11-14,1979,0.798,0.518,0.451,9.1e-05,0.977,-14.212,0.0335,124.562,0.43,0,7,32,False,"canadian singer-songwriter, classic canadian rock, classic rock, folk rock, mellow gold, permanent wave, rock, roots rock, singer-songwriter"
1FPi0KsUABEXojN4z6noG4,Mind,Talking Heads,252733,1979-08-03,1979,0.209,0.641,0.554,0.0614,0.238,-14.085,0.0487,103.557,0.478,1,2,30,False,"alternative rock, art punk, dance rock, funk rock, new wave, permanent wave, post-punk, rock, zolo"
4GR4yBf2nLpUydcLLS55yX,Mélancolie,Yves Duteil,158826,1979-01-01,1979,0.661,0.54,0.143,0.00233,0.102,-13.265,0.031,98.885,0.346,0,10,46,False,chanson
0mmktWYbLUn93jXiPodyfH,The Modern Day,Foreigner,206200,1979-09-10,1979,0.013,0.617,0.658,0.000765,0.0811,-7.989,0.0294,122.902,0.55,1,2,28,False,"album rock, classic rock, glam metal, hard rock, mellow gold, rock, soft rock"
1EFsKhZXfAftEYLR1iAyh2,My Heart,Donnie & Joe Emerson,474266,1979,1979,0.015,0.352,0.586,0.0678,0.0791,-9.677,0.0498,101.172,0.369,1,2,28,False,"soft rock, traditional soul"
6Vx6Al5OHhRofE0PJ4Z4M8,Manzanita,Tony Rice Unit,287960,1979-01-01,1979,0.424,0.633,0.431,0.405,0.1,-13.602,0.034,118.756,0.683,1,0,25,False,"bluegrass, progressive bluegrass"
6ZkdsPHBRDlzK5VjWDgByG,Memories Can't Wait,Talking Heads,210026,1979-08-03,1979,0.00268,0.261,0.521,0.381,0.248,-12.802,0.0332,183.181,0.538,1,2,29,False,"alternative rock, art punk, dance rock, funk rock, new wave, permanent wave, post-punk, rock, zolo"
7uyivkbdc8iH8wyBGBhlXV,One More Chance,Michael Jackson,229000,1979,1979,0.108,0.476,0.596,0.0,0.138,-4.234,0.0705,80.74,0.549,1,7,44,False,"r&b, soul"
2BEArHIJsI5fxYEpCZv2sF,Ring My Bell,Anita Ward,212009,1979-01-01,1979,0.109,0.783,0.541,0.0822,0.0891,-13.398,0.0405,125.816,0.967,0,5,47,False,disco
6AP5PK3voduGjY9nDsszO2,Manasa Sancharare,"S. P. Balasubrahmanyam, Vani Jairam",108628,1979-06-01,1979,0.978,0.571,0.21,0.000408,0.0892,-12.323,0.17,135.721,0.719,1,5,31,False,filmi
3Pa8R1DDDzN9zD6dZJyJLS,Me Olvide De Vivir,Julio Iglesias,290333,1979-09-25,1979,0.72,0.363,0.319,0.000115,0.16,-13.719,0.0412,115.788,0.603,1,0,38,False,latin pop
3zrjh6mjXLdkaC4vJwxgWX,My Own Kind Of Hat,Merle Haggard,175240,1979-05-18,1979,0.525,0.673,0.3,1.08e-06,0.0433,-14.039,0.0405,84.236,0.534,1,2,24,False,"bakersfield sound, country, country rock, nashville sound, outlaw country"
0YugXuM6VccgIwDHkeLH8l,Mov'in On,Missouri,284346,1979-05-10,1979,0.0165,0.446,0.786,0.38,0.0842,-10.581,0.0505,137.485,0.377,0,1,24,False,
3dEFrNH3fSFze0taMtPJtJ,Madness,Madness,158186,1979-10-19,1979,0.0157,0.525,0.858,0.000517,0.0696,-5.291,0.182,145.987,0.833,1,0,24,False,"britpop, new romantic, new wave, ska, ska revival"
4Lk3gKIgxMaSR0cq7fUgVe,Manic Mechanic,ZZ Top,155533,1979-11-01,1979,0.16,0.396,0.556,0.0238,0.323,-15.281,0.0363,167.525,0.852,1,9,27,False,"album rock, blues rock, classic rock, hard rock, rock"
6gFL7oRijipnPw6LtF34Cj,Metropolis,Motörhead,215840,1979-03-24,1979,4.96e-05,0.426,0.656,0.761,0.0916,-7.668,0.0307,108.987,0.0552,0,2,33,False,"alternative metal, hard rock, metal, nu metal, rock, speed metal"
3TBeNvNMUHTRArg6EsceCo,Mr. Sellack,The Roches,243506,1979-04-11,1979,0.879,0.686,0.048,0.0,0.0755,-18.84,0.0371,130.51,0.453,1,2,27,False,folk rock
47373YsMOwLhfcbYtmKSi9,My Friends,"Stephen Sondheim, Len Cariou, Angela Lansbury, Original Broadway Cast of Sweeney Todd: The Demon Barber of Fleet Street, Paul Gemignani",163866,1979,1979,0.855,0.318,0.272,3.41e-06,0.136,-10.503,0.0364,84.783,0.207,1,8,26,False,broadway
0qX0UHSX8c9HWT7i6Dg3bs,Move On Up - Radio Edit,Destination,237040,1979-01-01,1979,0.00454,0.843,0.703,0.00402,0.075,-10.121,0.0438,140.035,0.965,0,9,36,False,"deep disco, disco"
6BnyAc8WIuT45KRMuFdT6N,Men Sharadlil Ghazala,Toni Hanna,220845,1979-01-01,1979,0.879,0.49,0.562,0.000107,0.214,-9.96,0.0366,146.825,0.742,1,0,36,False,"arab pop, classic arab pop, jordanian pop"
6f6kOQ4bFb5gr9uB87llvb,Middle Man - Remastered 2022,Little River Band,267807,1979-07-01,1979,0.0129,0.435,0.435,0.0,0.147,-9.361,0.028,138.006,0.405,1,0,29,False,"album rock, classic rock, country rock, mellow gold, singer-songwriter, soft rock, yacht rock"
5mGq3cybgQDZgTEbu9ldV9,Man Gave Names to All the Animals,Bob Dylan,267106,1979-08-20,1979,0.458,0.763,0.509,0.000175,0.0799,-11.139,0.0533,94.376,0.965,0,11,37,False,"classic rock, country rock, folk, folk rock, rock, roots rock, singer-songwriter"
3rQ3a2Tt45OixIQ4Uuu3iP,You're The One I Need,Barry White,265333,1979,1979,0.134,0.617,0.619,0.00142,0.166,-8.942,0.0249,88.459,0.712,0,9,54,False,"disco, quiet storm, soul"
7r8A2uC6AV3F6M4TRugPSf,The Machman - 1998 Remaster,Tubeway Army,188200,1979-04-06,1979,0.00258,0.564,0.659,0.00425,0.117,-11.043,0.0485,117.102,0.737,0,11,28,False,"early synthpop, new romantic, new wave, uk post-punk, zolo"
3USkKUsbN8TbeMtgl28XyN,"Meu Querido, Meu Velho, Meu Amigo - Remasterizada",Roberto Carlos,207093,1979-04-07,1979,0.586,0.639,0.56,0.0,0.149,-6.826,0.0282,134.309,0.785,0,11,49,False,"jovem guarda, mpb"
7KvQ9xLgYi63UdMW83b9hx,マイティー・マウス,CASIOPEA,189226,1979,1979,0.302,0.703,0.876,0.918,0.253,-7.054,0.0368,132.093,0.913,1,7,28,False,"japanese jazz, japanese jazz fusion"
1u2bt26ipUrk4kHvcLXl6R,Too Much Too Young - 2015 Remaster,The Specials,366760,1979-11-01,1979,0.0243,0.79,0.595,0.104,0.304,-8.316,0.0488,133.418,0.838,1,2,50,False,"britpop, new wave, punk, ska, ska revival"
0iijpRubQCC5cBUGd0U8sf,Mainline,Black Ivory,419173,1979,1979,0.0146,0.708,0.86,0.0159,0.165,-10.773,0.049,116.304,0.712,0,1,25,False,classic soul
1V43BO81I2LLHjy25en933,Mine,"George Gershwin, Zubin Mehta, New York Philharmonic",175866,1979,1979,0.755,0.581,0.155,0.941,0.0991,-26.249,0.045,137.746,0.538,1,0,29,False,"american modern classical, classical, early modern classical, tin pan alley"
3SCjNU9XICOAYi6wM7jqSe,Me and Bobby McGee,Willie Nelson,340000,1979-10-01,1979,0.322,0.549,0.691,0.00629,0.0754,-11.755,0.0421,90.205,0.821,1,9,25,False,"classic country pop, classic texas country, country, country rock, nashville sound, outlaw country, singer-songwriter"
6E1mSGcu2bWytuAf5HpUWE,One Man's Pleasure,Molly Hatchet,205626,1979,1979,0.0499,0.625,0.641,4.27e-06,0.0457,-7.831,0.0284,105.079,0.939,1,9,32,False,"album rock, classic rock, country rock, glam metal, hard rock, southern rock"
0IPI7yil60RAOUhlid7GmN,Move On - 2017 Remaster,David Bowie,200040,1979,1979,0.476,0.445,0.593,0.000271,0.381,-10.376,0.0576,150.481,0.437,0,8,28,False,"art rock, classic rock, glam rock, permanent wave, rock"
5i2859ZJXGPOzDwdZSOMiH,Manifesto,Roxy Music,329400,1979-03-01,1979,0.303,0.638,0.608,0.359,0.688,-8.104,0.029,107.966,0.565,1,4,29,False,"art rock, glam rock, melancholia, new romantic, new wave, new wave pop, sophisti-pop"
1fBxdTUpYGQPYkOfxM9uhe,Single-Handed Sailor,Dire Straits,282760,1979-06-15,1979,0.272,0.6,0.625,0.619,0.354,-11.391,0.026,102.677,0.868,0,2,36,False,"album rock, classic rock, mellow gold, rock"
6QHLjlNN0EjQiwu3MBk88v,My Shadow In Vain,Tubeway Army,179160,1979-08-10,1979,0.289,0.648,0.743,0.00056,0.148,-10.063,0.0936,139.277,0.646,1,9,25,False,"early synthpop, new romantic, new wave, uk post-punk, zolo"
58Pz2cGXmjnmaN0FZEt0qB,Millworker,James Taylor,231733,1979,1979,0.513,0.433,0.0843,5.75e-05,0.143,-20.377,0.0338,141.463,0.275,1,7,25,False,"classic rock, folk, folk rock, mellow gold, singer-songwriter, soft rock"
451DmtsIrqVod8SD5tpXcU,Slow Blues,Mick Taylor,203600,1979,1979,0.407,0.515,0.309,0.951,0.0939,-15.859,0.0286,77.581,0.543,0,11,38,False,british blues
5HfTjS4mcDDb4GIaksowKA,Melody Ann,The Marshall Tucker Band,327840,1979-02-05,1979,0.0203,0.613,0.82,0.0134,0.298,-10.357,0.0335,98.319,0.848,1,7,20,False,"album rock, classic rock, country rock, mellow gold, singer-songwriter, soft rock, southern rock"
3YWTp4Ap4sZNIyFkP0a0rx,Take Me Home,Cher,403000,1979-01-01,1979,0.00562,0.706,0.524,2.13e-05,0.0297,-12.357,0.0681,121.979,0.894,1,4,39,False,"dance pop, pop"
2bspsdHJfZf4URZsTUMW8B,Night Boat to Cairo,Madness,211226,1979-10-19,1979,0.118,0.314,0.974,0.121,0.0749,-5.011,0.0431,155.551,0.598,0,3,37,False,"britpop, new romantic, new wave, ska, ska revival"
4KuUjDtpMTBv55FzbcOW38,The Way You Make Me Feel,Michael Jackson,296906,1979,1979,0.0413,0.744,0.814,0.000168,0.118,-5.66,0.203,171.7,0.439,1,1,42,False,"r&b, soul"
3z8EX1QoPW20ME8IueIADZ,No One Gets The Prize,Diana Ross,280733,1979-05-23,1979,0.0866,0.699,0.715,0.0477,0.273,-6.114,0.0448,117.642,0.693,1,0,43,False,"adult standards, disco, motown, quiet storm, soft rock, soul"
2iBtKDOBYvIMcGvsbmyYn5,No Class,Motörhead,158400,1979-03-24,1979,0.000279,0.206,0.886,0.181,0.354,-8.579,0.0653,152.786,0.323,0,3,44,False,"alternative metal, hard rock, metal, nu metal, rock, speed metal"
3XdQTxhIMzb9cXutu2L9Xm,Nine Pound Hammer,Tony Rice Unit,175093,1979-01-01,1979,0.136,0.622,0.56,0.159,0.328,-11.159,0.0358,121.169,0.838,1,9,32,False,"bluegrass, progressive bluegrass"
1fvUEiUz6QADwIIgRbiTd9,Night Spots,The Cars,193866,1979,1979,0.128,0.676,0.934,0.00351,0.606,-6.944,0.0328,130.777,0.967,1,9,31,False,"album rock, classic rock, hard rock, mellow gold, new romantic, new wave, new wave pop, permanent wave, power pop, rock, singer-songwriter, soft rock, synthpop"
0S7xK1PyFYQBEUgCPoUBvA,Never Had A Love Like This Before - Remastered 2004,Tavares,275706,1979,1979,0.503,0.699,0.589,0.0,0.258,-8.074,0.0448,94.535,0.839,0,11,32,False,"disco, motown, quiet storm"
1zejgyb96aqB1JGu8RDJNF,Not Great Men,Gang Of Four,186560,1979-09-25,1979,0.00282,0.831,0.652,0.31,0.0876,-5.658,0.0693,123.892,0.782,0,11,29,False,"alternative rock, art punk, dance rock, funk rock, post-punk, punk, uk post-punk"
0AkhjjsrpxfKToGjTTYB5A,Nothin' But a Heartache,The Pointer Sisters,199253,1979-09-01,1979,0.384,0.719,0.538,0.0,0.154,-7.198,0.031,107.278,0.888,1,4,36,False,"disco, girl group, hi-nrg, motown, new wave pop, soft rock"
2PSdTZ0AlHDtHBduxzLAWU,Nothing Sure Looked Good On You,Gene Watson,221933,1979-01-01,1979,0.781,0.58,0.291,0.0274,0.175,-11.894,0.0249,87.214,0.476,1,11,31,False,classic country pop
5fNu20lXWU75Ww0dAkIGeJ,Nights On Broadway,Bee Gees,275373,1979-01-01,1979,0.337,0.576,0.721,0.00752,0.226,-6.164,0.0381,88.927,0.608,1,5,39,False,"disco, mellow gold, soft rock"
1lMoqzAjvLxIQJoYSeNVj1,Nostalgia,Angel Canales,340400,1979,1979,0.759,0.539,0.235,2.53e-06,0.315,-13.576,0.0836,91.826,0.325,1,0,44,False,"salsa, salsa puertorriquena"
5qolpk9X28wwWLGE8sZ328,No Time This Time,The Police,197666,1979-10-02,1979,0.022,0.294,0.969,0.00226,0.0654,-5.659,0.12,201.411,0.469,1,0,35,False,"album rock, classic rock, permanent wave, rock"
1CT4JcYoexOuUyG5lzoTYk,No Qualifications,Chris Rea,139440,1979-07-18,1979,0.496,0.751,0.319,1.09e-06,0.116,-13.673,0.0387,107.685,0.632,1,4,36,False,"soft rock, sophisti-pop"
35iCSlFxyiawRBUOtQAkeT,Summer Night City,ABBA,214706,1979,1979,0.0138,0.476,0.858,0.0,0.177,-5.66,0.0371,130.703,0.765,0,7,54,False,"europop, swedish pop"
4xMp9le2qWuL22Fnu3RWUv,Not Any Longer,The Lijadu Sisters,293706,1979-01-01,1979,0.105,0.615,0.575,0.825,0.08,-13.306,0.0419,104.79,0.943,1,8,32,False,"afrobeat, afropop, world"
7BTSWCnqZfPw9tk4V9dr9E,The Number One Song In Heaven,Sparks,446760,1979-03,1979,0.00145,0.354,0.932,0.593,0.23,-6.303,0.0954,150.359,0.137,1,3,36,False,"glam rock, synthpop, zolo"
6HmcHhVFsbeiXCl93wHm0h,Never Forget - 2015 Remaster,Fleetwood Mac,218853,1979-10-12,1979,0.395,0.693,0.536,0.000591,0.0403,-12.009,0.0372,118.38,0.867,0,11,31,False,"album rock, classic rock, rock, soft rock, yacht rock"
4wxbvj2DU5UVsUVU9FORSB,The Nips Are Getting Bigger,Mental As Anything,200800,1979,1979,0.0338,0.817,0.866,0.0238,0.143,-5.369,0.0788,150.134,0.966,1,7,33,False,australian rock
6y9JP8k9WGhCfae9jzx2W8,No G.D.M.,Gina X Performance,357040,1979,1979,0.0469,0.774,0.396,0.0103,0.211,-12.041,0.0388,110.297,0.782,0,7,32,False,"dance rock, early synthpop, synthpop"
2fWxcJeDQiLStdAdwF4ms6,No Side to Fall In,The Raincoats,109666,1979,1979,0.486,0.434,0.614,0.000196,0.394,-8.334,0.0525,147.681,0.787,1,6,31,False,"art punk, experimental rock, post-punk, riot grrrl, uk post-punk"
6yBJoRzDcP8WwqF38l5aTn,Not Guilty,George Harrison,214933,1979-02-20,1979,0.782,0.687,0.292,0.000922,0.114,-12.628,0.0332,112.926,0.294,0,4,34,False,"album rock, classic rock, folk rock, mellow gold, rock, singer-songwriter, soft rock"
0jAaMqSa8g6W3IOnZqrnNZ,Night Fever - GRN Remix,Bee Gees,283960,1979-01-01,1979,0.000184,0.649,0.806,0.552,0.084,-8.11,0.0398,119.402,0.457,0,1,38,False,"disco, mellow gold, soft rock"
4snYOGT0e0OrcfQXePO5cR,"Never Before, Never Again - From ""The Muppet Movie""/Soundtrack Version",Miss Piggy,169973,1979-01-01,1979,0.821,0.364,0.394,0.000152,0.137,-12.689,0.0312,143.702,0.308,1,6,27,False,cartoon
4ZNcd1iiFpRe1OoTVXPqgy,Not That Funny - 2015 Remaster,Fleetwood Mac,194826,1979-10-12,1979,0.0928,0.767,0.66,0.00596,0.0494,-9.223,0.0381,137.655,0.839,1,0,31,False,"album rock, classic rock, rock, soft rock, yacht rock"
38bw7l15N831T7TZWMVrPA,Never Make Me Cry - 2015 Remaster,Fleetwood Mac,138160,1979-10-12,1979,0.785,0.342,0.0555,0.000919,0.111,-20.257,0.0333,152.821,0.075,1,1,30,False,"album rock, classic rock, rock, soft rock, yacht rock"
6tA1UlYbMnpUkWyjcBAq8g,Never Gonna Stop - Remastered,Linda Clifford,282863,1979-08-24,1979,0.268,0.747,0.501,0.0,0.122,-9.18,0.244,90.582,0.703,1,5,24,False,deep disco
4zPnTqSP5mDfXRzpxPtRdm,Night Train,Rickie Lee Jones,198826,1979-03-08,1979,0.487,0.558,0.202,0.000295,0.117,-17.133,0.0359,110.37,0.235,1,4,24,False,"folk, singer-songwriter"
01AKO5Syk8cVCKTjyZfuBw,No Surprize,Aerosmith,266164,1979-11-16,1979,0.000798,0.486,0.933,0.167,0.244,-5.332,0.0352,138.678,0.431,1,4,28,False,"album rock, classic rock, hard rock, rock"
5F1CxsOXX6altKaKlEPuox,Powderfinger - 2016 Remaster,"Neil Young, Crazy Horse",330480,1979-06-27,1979,0.282,0.482,0.66,0.0102,0.0972,-10.827,0.0326,106.748,0.563,1,7,45,False,"canadian singer-songwriter, classic canadian rock, classic rock, folk rock, mellow gold, permanent wave, rock, roots rock, singer-songwriter"
02X7NNA0oC2EcGFls0OKzo,No Golden Throat,Lizzy Mercier Descloux,158840,1979,1979,0.0959,0.868,0.629,0.0336,0.129,-10.989,0.182,83.205,0.761,1,7,29,False,"experimental rock, french post-punk, no wave"
0dO6QXkWOZW1RJPgCEaFPk,The Needle and the Damage Done - Live; 2016 Remaster,"Neil Young, Crazy Horse",145980,1979-11-14,1979,0.528,0.421,0.565,0.0,0.985,-12.293,0.0511,115.268,0.387,1,7,27,False,"canadian singer-songwriter, classic canadian rock, classic rock, folk rock, mellow gold, permanent wave, rock, roots rock, singer-songwriter"
67RQrv20bjrWI2cAWSjJXC,Not While I'm Around,"Stephen Sondheim, Ken Jennings, Angela Lansbury, Original Broadway Cast of Sweeney Todd: The Demon Barber of Fleet Street, Paul Gemignani",236773,1979,1979,0.931,0.38,0.196,6.68e-06,0.287,-12.52,0.0747,89.247,0.251,1,8,27,False,broadway
4FqRbcFtoTY9B9QbFffTOY,No Place Like London,"Stephen Sondheim, Len Cariou, Victor Garber, Merle Louise, Original Broadway Cast of Sweeney Todd: The Demon Barber of Fleet Street, Paul Gemignani",219266,1979,1979,0.878,0.376,0.275,0.00183,0.101,-15.513,0.066,96.735,0.31,1,9,26,False,broadway
5V4ewSVZN6a0wOfWTBZJxq,Novelty - 2020 Digital Remaster,Joy Division,243960,1979-10-07,1979,0.000301,0.528,0.895,0.317,0.136,-9.063,0.0499,148.475,0.475,0,4,31,False,"alternative rock, indie rock, madchester, new wave, post-punk, punk, rock, uk post-punk"
2Zk9PZUmYT7FD2x1OoqOkp,"No More Tears (Enough Is Enough) - 12"" Version","Donna Summer, Barbra Streisand",704813,1979-04-25,1979,0.0509,0.651,0.786,0.000113,0.104,-8.436,0.0445,135.041,0.393,0,7,31,False,"disco, hi-nrg, new wave pop, soft rock"
6wn3qIMMkDmojf2cbg1jWU,No Te Vayas Sin Mi,Ramon Ayala Y Sus Bravos Del Norte,210000,1979,1979,0.945,0.499,0.204,0.0226,0.123,-9.996,0.0377,164.384,0.393,1,10,22,False,"musica mexicana, norteno"
1FWxFbfTK9zhK6n1HuorsZ,North Of The Border,Johnny Rodriguez,221866,1979,1979,0.505,0.676,0.434,0.0,0.198,-12.297,0.0444,109.463,0.546,1,1,24,False,"classic country pop, outlaw country"
1Gb2wkjjyJBPFBnF0Cl5Ni,Ride Natty Ride - 12” Mix / Bonus Track,Bob Marley & The Wailers,383333,1979-10-02,1979,0.129,0.881,0.733,0.000112,0.0371,-6.434,0.0371,125.988,0.943,1,10,40,False,"reggae, roots reggae"
04ZsNWSZ13iUUqg6YQnQNP,Never Again,Donnie Elbert,177188,1979,1979,0.945,0.53,0.31,0.00145,0.361,-7.753,0.0288,75.007,0.317,1,9,23,False,"classic soul, northern soul, souldies"
