id,name,artists,duration_ms,release_date,year,acousticness,danceability,energy,instrumentalness,liveness,loudness,speechiness,tempo,valence,mode,key,popularity,explicit,genre
6G8ydGqM5Pbz4XEucokDKG,Mi Buenos Aires Querido - Remasterizado,"Francisco Canaro, Carlos Galán",196000,1934-01-10,1934,0.995,0.634,0.199,0.756,0.16,-13.984,0.106,118.973,0.58,1,6,0,False,"orquesta tipica, tango, vintage tango"
5Zix2hjExwR6unVSIDUOsA,Orquideas a la Luz de la Vida - Remasterizado,Francisco Canaro,195506,1934-01-10,1934,0.995,0.661,0.109,0.00064,0.14,-14.465,0.0948,120.558,0.735,0,5,0,False,"orquesta tipica, tango, vintage tango"
2VE5kHvkmBbIUwspxjX0zC,Media Noche - Remasterizado,"Francisco Canaro, Carlos Galán",170506,1934-01-10,1934,0.995,0.735,0.121,0.759,0.247,-16.65,0.126,117.428,0.533,0,2,0,False,"orquesta tipica, tango, vintage tango"
3fPiQHKezPTZ8cp7b0bRdE,Mis Claveles - Remasterizado,"Francisco Canaro, Carlos Galán",193493,1934-01-10,1934,0.984,0.685,0.293,0.0026,0.227,-9.973,0.0664,120.822,0.924,1,10,0,False,"orquesta tipica, tango, vintage tango"
7u62KAUTwlTlb3K8Ks90YW,Profecía Gitana - Remasterizado,"Francisco Canaro, Carlos Galán",171000,1934-01-10,1934,0.992,0.742,0.245,0.00791,0.116,-14.141,0.0901,123.214,0.827,1,9,0,False,"orquesta tipica, tango, vintage tango"
7wPuncxOcQqhTZobOC652k,Ushuaia - Remasterizado,"Francisco Canaro, Carlos Galán",151960,1934-01-10,1934,0.98,0.694,0.221,0.262,0.585,-12.513,0.128,117.4,0.919,1,11,0,False,"orquesta tipica, tango, vintage tango"
7300PxCJlpQCEodZmjCg54,Quiereme Otra Vez - Remasterizado,"Francisco Canaro, Carlos Galán",213000,1934-01-10,1934,0.952,0.454,0.282,0.104,0.538,-12.869,0.0577,125.78,0.761,1,7,0,False,"orquesta tipica, tango, vintage tango"
556swAYYvgMaOglO6TnEE1,Piano Concerto No. 3 in C Minor Op. 37: III Rondo (allegro),"Ludwig van Beethoven, Marguerite Long, Paris Conservatoire Orchestra",511333,1934,1934,0.988,0.405,0.171,0.853,0.224,-19.731,0.0385,122.327,0.318,0,0,0,False,"classical, classical era, early romantic era, german romanticism"
6lKBfX1BK5xGByy6QpPdvJ,No Seas Niña - Remasterizado,"Francisco Canaro, Carlos Galán",173506,1934-01-10,1934,0.995,0.695,0.134,0.9,0.164,-18.068,0.0556,119.78,0.891,1,2,0,False,"orquesta tipica, tango, vintage tango"
2zjWioNUL12eB8sRpRVejY,Last Chance,Frankie Goes To Bollywood,215800,1934,1934,0.863,0.763,0.529,0.73,0.12,-15.049,0.0427,116.322,0.614,1,0,0,False,
3Qp0FqfCku6sk8jczLeFzd,Mi Musa Campera - Remasterizado,"Francisco Canaro, Carlos Galán",155000,1934-01-10,1934,0.994,0.61,0.136,0.00698,0.453,-15.128,0.0617,117.812,0.731,1,5,0,False,"orquesta tipica, tango, vintage tango"
0jcI0pMwUuV2Zd9zxQbnOy,Santo Remedio - Remasterizado,"Francisco Canaro, Carlos Galán",169506,1934-01-10,1934,0.985,0.663,0.39,0.169,0.141,-10.523,0.289,152.807,0.93,0,4,0,False,"orquesta tipica, tango, vintage tango"
2GZaAOc9FykuIzHSeQGAQI,21 Guns,samedowski,161111,1934-12-15,1934,0.191,0.621,0.555,0.0213,0.0734,-8.603,0.0499,112.665,0.4,1,7,26,False,
5a1eeTzIWizPJLR9LS4cq8,Ghamza Paikan Hua Jaata Hai,K. L. Saigal,201340,1934-01-01,1934,0.995,0.479,0.146,0.948,0.0935,-17.801,0.0555,94.169,0.42,0,9,1,False,"classic bollywood, filmi, ghazal"
04b0QbnpNR2MCup4FdN5Ju,Ghar Ye Tera Sada Na Mera Hai,K. L. Saigal,198186,1934-01-01,1934,0.996,0.518,0.267,0.784,0.168,-11.411,0.0679,115.771,0.349,0,8,1,False,"classic bollywood, filmi, ghazal"
1KPFHoywWOxO2XRy3Tn9lo,Garden of the Moon,Red Norvo,175773,1934-12-15,1934,0.824,0.69,0.222,0.00658,0.32,-10.627,0.0419,104.82,0.587,1,6,0,False,"cool jazz, jazz vibraphone, swing, vintage jazz"
2zzUGzxBmP26yTA05xoExE,I've Got My Love to Keep Me Warm,Red Norvo,178213,1934-12-15,1934,0.99,0.608,0.274,0.0182,0.0498,-10.756,0.0608,173.282,0.641,0,9,1,False,"cool jazz, jazz vibraphone, swing, vintage jazz"
10KIRxz4oahrw2ejYMcs9Z,Ibne Mariyam Hua Kare Koi,K. L. Saigal,213758,1934-01-01,1934,0.995,0.449,0.237,0.0204,0.34,-13.338,0.0512,136.626,0.298,0,9,4,False,"classic bollywood, filmi, ghazal"
5E3tYxfp956lPLL2pTRj9Y,Gar Sia Bakhat Hi Hona Tha,K. L. Saigal,194644,1934-01-01,1934,0.995,0.428,0.33,0.87,0.313,-11.178,0.131,64.597,0.44,1,2,0,False,"classic bollywood, filmi, ghazal"
4Wn36bOT5rAFi6sDoqGP6A,Gia Sena Monaha,"Kostas Giannidis, Stella Greka",168158,1934,1934,0.893,0.372,0.323,0.0,0.163,-8.449,0.0645,75.908,0.459,1,10,0,False,
6RLsLadmJPbck00LDAasKe,Giati Palia Mou Agapi,"Kostas Giannidis, Kakia Mendri",197000,1934,1934,0.966,0.544,0.198,3.93e-06,0.302,-12.181,0.146,113.016,0.521,1,9,0,False,
5SkXHQxQjew01IDhuh6mre,Giati Na Xehaseis,"Kostas Giannidis, Danai",193538,1934,1934,0.878,0.333,0.33,0.0109,0.194,-8.329,0.0372,99.147,0.516,0,2,0,False,
2sLa7dwf6jYKHHDtb6SaL4,Gyrise Piso,"Kostas Giannidis, Koula Nikolaidou",199923,1934,1934,0.72,0.341,0.672,4.8e-06,0.315,-7.795,0.0907,91.562,0.789,0,8,0,False,
0eC0Vfv59RT2CXI338sqiu,"Giati, Giati, Giati","Kostas Giannidis, Kostas Maniatakis",183600,1934,1934,0.978,0.497,0.453,0.0589,0.516,-6.387,0.0633,115.315,0.811,1,9,0,False,
4LP99a2RZLPCzOgD55gG1b,Ghar Ye Tera Sada Na Mera Hai,K. L. Saigal,200522,1934-01-01,1934,0.995,0.47,0.24,0.794,0.146,-11.247,0.0522,79.523,0.394,1,8,0,False,"classic bollywood, filmi, ghazal"
2lnxh7WBVEZmZwaIx48qHv,Glow Reefer Glow,Cellular Project,299853,1934,1934,0.742,0.45,0.651,0.964,0.287,-3.509,0.0361,116.394,0.219,0,2,0,False,
0yOGWVSkBCwnHzAxvIXXGY,Gather Lip Rouge While You May,"Richard Himber and his Orchestra, Joey Nash",160666,1934-07-01,1934,0.966,0.758,0.367,7.51e-06,0.341,-9.325,0.0854,93.176,0.906,0,3,0,False,
78dqkEFrT7aBRhc1mCaO12,"Go Ahead, Buddy","Kokomo Arnold, Casey Bill Weldon",164253,1934-05-20,1934,0.989,0.716,0.292,0.00869,0.181,-14.43,0.0528,104.887,0.968,1,0,0,False,"acoustic blues, chicago blues, delta blues, traditional blues"
2BS77oiueNq1Q0AI7DYGlX,Grandpa Got Drunk,Kokomo Arnold,185973,1934-05-20,1934,0.992,0.586,0.176,2.96e-05,0.191,-15.348,0.0531,87.912,0.486,1,5,0,False,"acoustic blues, chicago blues, delta blues, traditional blues"
6QLy1YRiIXwbLpWfCgRWRX,Gahan Bhav Sarita,"Shanta Apte, Shantaram Athavale",194218,1934-12-31,1934,0.965,0.366,0.219,0.27,0.0825,-12.399,0.0576,75.848,0.352,1,9,0,False,classic bollywood
4MUyS6sg2vRlCEck7njPJR,Gokul Gaaon Ka Choraa,Bano Bai Latekar,227091,1934-12-31,1934,0.996,0.403,0.341,0.964,0.148,-13.185,0.122,72.198,0.581,1,8,0,False,
5GdC5zpydTcclcKke1fhTf,Gosh! I Must Be Falling in Love,Jack Jackson & His Orchestra,172213,1934,1934,0.98,0.514,0.0878,0.021,0.0959,-17.537,0.0464,147.014,0.658,0,7,0,False,british dance band
7LvUSSqUZrIxrSMoECD7qi,Ghazal - Kamleshwari Bai,Kamleshwari Bai,342796,1934-12-31,1934,0.994,0.515,0.0551,0.828,0.377,-15.516,0.268,70.078,0.482,0,10,0,False,
3Hdabig0IgtRNV7QfdbKZP,Golondrinas - Remasterizado,"Francisco Canaro, Roberto Maida",186000,1934-01-10,1934,0.975,0.725,0.167,0.179,0.155,-13.85,0.0657,118.642,0.678,1,4,0,False,"orquesta tipica, tango, vintage tango"
4vyQDEfPEWvuoKQZN0hSKb,Giridhaar Jhoolat Raadhay,Laxmibai Jadhav,185945,1934-12-31,1934,0.996,0.367,0.259,0.965,0.344,-12.745,0.0381,68.441,0.416,1,7,0,False,
5xyNbtpSNVTB7tZTSuciJm,Gee! Oh Gosh! I'm Grateful (Roy Fox),Roy Fox,152653,1934,1934,0.965,0.697,0.0956,0.00117,0.106,-18.301,0.0972,107.096,0.432,1,0,0,False,british dance band
7j4B4u1npi7gYBhauzCrya,"Goodnight, Llittle Girl of My Dreams",Roy Fox,195533,1934,1934,0.982,0.366,0.0562,0.244,0.085,-20.881,0.0508,67.469,0.244,1,7,0,False,british dance band
5egvDGFmi2DvkD1uZd8cYA,Για πες αλεύρι,Κώστας Μαυρέας,94210,1934-01-01,1934,0.994,0.523,0.185,0.835,0.109,-20.212,0.115,132.35,0.75,1,5,0,False,
1A9QNc25qWEXti3bfKROCa,Mara Ba Ghamza,K. L. Saigal,186607,1934-01-01,1934,0.995,0.644,0.298,0.955,0.163,-13.223,0.137,66.188,0.613,1,11,0,False,"classic bollywood, filmi, ghazal"
7kDsyA9Lvc6IkHdORgzAuW,I Gynaika Ehei Panta Karnavali,"Kostas Giannidis, Vasos Seitanidis",196916,1934,1934,0.872,0.506,0.502,9.37e-05,0.876,-9.504,0.157,119.465,0.661,0,9,0,False,
1sLbkotLyUl6WZT0BUDc3C,Kahe Guman Kare,K. L. Saigal,191015,1934-01-01,1934,0.995,0.472,0.298,0.892,0.0909,-9.867,0.0547,137.934,0.451,1,2,0,False,"classic bollywood, filmi, ghazal"
71oCLeBEdOf2cqn2sAwnd4,Lag Gayi Chot Karejwa Mein,K. L. Saigal,190451,1934-01-01,1934,0.996,0.436,0.231,0.857,0.141,-9.494,0.032,106.617,0.219,1,6,0,False,"classic bollywood, filmi, ghazal"
6RL0zWjw0yb28xk33GuDZU,Toot Gaya Sab Sapne Mere,K. L. Saigal,161970,1934-01-01,1934,0.995,0.539,0.184,0.933,0.127,-13.959,0.0705,72.865,0.51,1,5,0,False,"classic bollywood, filmi, ghazal"
1VEwahxp2gNwtnFe98fh1T,Hat Gayi Lo Kaali Ghata,K. L. Saigal,195818,1934-01-01,1934,0.996,0.447,0.38,0.814,0.295,-8.885,0.037,72.479,0.558,1,9,0,False,"classic bollywood, filmi, ghazal"
53Y1IiZTJgBFvBoK6sTsR6,I've Gone (1967),The Revolution,216160,1934,1934,0.673,0.331,0.73,0.659,0.162,-6.362,0.0704,185.306,0.714,1,4,0,False,electro jazz
0Nas53DbLE3NyMQHiMbxah,I'm Going Fishing Too,Kokomo Arnold,187013,1934-05-20,1934,0.99,0.701,0.266,1.96e-05,0.141,-10.185,0.0375,84.57,0.585,1,5,0,False,"acoustic blues, chicago blues, delta blues, traditional blues"
441fe0Nwz9hYZfiJ9p36cn,My Gal's Been Foolin' Me,Kokomo Arnold,162560,1934-05-20,1934,0.994,0.693,0.339,0.000116,0.191,-13.623,0.0492,81.946,0.704,1,2,0,False,"acoustic blues, chicago blues, delta blues, traditional blues"
1vh0nDAKWfZTVlUushp2tD,Naadh Gupt Vedha,Laxmi Bai,282047,1934-12-31,1934,0.967,0.348,0.315,0.913,0.163,-13.498,0.104,90.09,0.481,1,7,0,False,
5UZ442u3etcFjKyiKQCrEh,Katwa Garra Gayalwa,Laxmibai Jadhav,190519,1934-12-31,1934,0.994,0.353,0.35,0.974,0.247,-12.505,0.0475,69.782,0.636,1,7,0,False,
1htL2o2htfDWAxh9ylySB9,Rehmat Pe Teri Mere Gunahon Ko Naaz Hai,K. L. Saigal,187403,1934-01-01,1934,0.994,0.499,0.309,0.937,0.108,-13.44,0.0465,128.405,0.537,1,9,0,False,"classic bollywood, filmi, ghazal"
7vLY9MykWrvMqm8ecd6drf,O Sohne Saqiya Meri Gali Vi Phera Paunda Ja,K. L. Saigal,219943,1934-01-01,1934,0.995,0.591,0.382,0.875,0.104,-10.745,0.0664,95.044,0.57,1,1,0,False,"classic bollywood, filmi, ghazal"
3i4QHDmIYu1F87ECJi8cYh,Shama Ka Jalna Hai Ya Sozshe-Parwana Hai,K. L. Saigal,191125,1934-01-01,1934,0.992,0.452,0.376,0.93,0.147,-11.961,0.0558,101.504,0.444,1,6,0,False,"classic bollywood, filmi, ghazal"
2GoPimN9kdgigxjuHNh0Fp,Jaag Aur Dekh Zara Alam-E-Veeraan Mera,K. L. Saigal,193910,1934-01-01,1934,0.994,0.547,0.481,0.829,0.238,-7.926,0.0864,76.177,0.755,0,4,0,False,"classic bollywood, filmi, ghazal"
6h51uX66VVzOwTVuhEzi1c,I only have eyes for you,Georgina Jackson,261720,1934,1934,0.764,0.358,0.198,0.000102,0.161,-13.612,0.0303,80.082,0.121,1,3,0,False,
71k0HRntP1f2WtkkFGXmqh,Ae Bekhabari Dil Ko Deewana Bana Dena,K. L. Saigal,202451,1934-01-01,1934,0.985,0.6,0.494,0.00101,0.445,-6.3,0.194,140.858,0.475,1,9,0,False,"classic bollywood, filmi, ghazal"
6c1OIYabaO4OMOz7b8e3Rv,Shukriya Hasti Ka Lekin Tumne Ye Kya Kar Diya,K. L. Saigal,202511,1934-01-01,1934,0.994,0.671,0.279,0.946,0.138,-14.03,0.243,113.921,0.61,1,0,0,False,"classic bollywood, filmi, ghazal"
2tBOpe45kSWWspKxkwIJtE,Mahi Naal Je Akh Lad Di Kadi Na,K. L. Saigal,219629,1934-01-01,1934,0.996,0.428,0.282,0.937,0.105,-13.658,0.0463,83.075,0.497,1,1,0,False,"classic bollywood, filmi, ghazal"
17w56SiGwh70R0Y7aXp5as,Hasratein Khamosh Hain,K. L. Saigal,192106,1934-01-01,1934,0.996,0.425,0.0969,0.941,0.113,-19.126,0.0632,116.791,0.469,1,11,0,False,"classic bollywood, filmi, ghazal"
75g5iY9ZVv3dazFY8rqdlI,Je Ne Suis Pas Bien Portant,Gaston Ouvrard,194200,1934,1934,0.953,0.746,0.285,0.0,0.161,-14.059,0.398,101.309,0.757,1,5,0,False,"chanson humoristique, vintage chanson"
0mmVLNzfLCSinNllC5STAx,Hairate Nazara,K. L. Saigal,194053,1934-01-01,1934,0.995,0.335,0.155,0.915,0.359,-11.523,0.067,74.963,0.312,1,8,0,False,"classic bollywood, filmi, ghazal"
2IgLcFb8vLJFkdnRTz9xEl,Rollin' Home,"Richard Himber and his Orchestra, Guy Russell",204653,1934-07-01,1934,0.939,0.516,0.267,0.109,0.111,-10.128,0.0279,113.169,0.56,1,10,0,False,
2CeYbREc749GxD0c5OLLwA,Idhar Phir Bhi Aana Udhar Jaane Waale,K. L. Saigal,210407,1934-01-01,1934,0.995,0.522,0.318,0.81,0.151,-10.218,0.0423,125.976,0.45,1,11,0,False,"classic bollywood, filmi, ghazal"
6QZJFQnC7g7agSBvrwRz9r,Koi Kisi Ka Nahi Jahan Main,Gauhar,202073,1934-01-01,1934,0.975,0.352,0.105,4.89e-06,0.0997,-14.508,0.0502,73.389,0.4,1,1,0,False,
7jsxzeggw6LuSHNyARgeFE,Ishq Khud Maile-Hijaab Hai Aaj,K. L. Saigal,211487,1934-01-01,1934,0.994,0.558,0.194,0.0336,0.0947,-9.992,0.0594,113.312,0.417,1,5,0,False,"classic bollywood, filmi, ghazal"
46Qr3VYTLAn1kBtYzfalQ1,Apni Hasti Ka Asar Khushnamaya Ho Jaaye,K. L. Saigal,198519,1934-01-01,1934,0.995,0.513,0.299,0.926,0.108,-9.798,0.042,101.092,0.483,0,10,0,False,"classic bollywood, filmi, ghazal"
2lmMYNVZvsEvr5yrJNUv5g,Muskurate Huye,K. L. Saigal,195589,1934-01-01,1934,0.992,0.33,0.156,0.925,0.142,-17.267,0.0672,69.121,0.23,0,5,0,False,"classic bollywood, filmi, ghazal"
6XJNfWLir3ISunlLNq7SSw,Jaha Kichhu Mamo Achhe Priyotamo,Gyanendra Prasad Goswami,206413,1934-12-01,1934,0.994,0.458,0.0956,0.00573,0.715,-16.713,0.0625,73.206,0.32,1,1,0,False,
58heypz4S6hqvVS8aJUbra,Matwale Panese,K. L. Saigal,210346,1934-01-01,1934,0.995,0.489,0.353,0.913,0.108,-11.636,0.0614,101.549,0.458,0,4,0,False,"classic bollywood, filmi, ghazal"
1k9riLvLZYOOJTvDnYJ5zG,Hum Apna Unhey,K. L. Saigal,205823,1934-01-01,1934,0.995,0.459,0.316,0.909,0.256,-10.695,0.0829,69.323,0.717,1,0,0,False,"classic bollywood, filmi, ghazal"
0CorZdUHKmHT2eyrvz5VhM,Mat Karo Kisi Se Pyar,Gauhar,183983,1934-01-01,1934,0.992,0.435,0.0648,0.0419,0.101,-15.771,0.124,73.925,0.536,1,6,0,False,
0H6th8ZEzJqOKRnifM43Qy,Home On the Range,Sons of the Pioneers,157173,1934-01-19,1934,0.991,0.395,0.137,0.000115,0.146,-13.535,0.0291,96.943,0.489,1,6,14,False,"cowboy western, traditional country, vocal harmony group, western swing"
2z2vT0x2L0vUwjOPgOY39d,Says My Heart,Red Norvo,176213,1934-12-15,1934,0.924,0.666,0.159,0.0319,0.0846,-13.286,0.0648,152.223,0.582,1,3,11,False,"cool jazz, jazz vibraphone, swing, vintage jazz"
3f1sQVzxVHZwSsblO6gWvY,Skeleton Rag,Hoosier Hot Shots,86240,1934-09-15,1934,0.43,0.657,0.46,0.929,0.139,-10.302,0.0355,145.685,0.965,1,5,6,False,"novelty, traditional country"
6PdWL1SKXKy2kv2EMz6TWZ,Some Like It Hot,Red Norvo,174853,1934-12-15,1934,0.954,0.794,0.459,0.871,0.164,-9.713,0.0548,98.376,0.886,0,2,8,False,"cool jazz, jazz vibraphone, swing, vintage jazz"
49Fo8VmIxXi4Z6i7Vj7HBY,Honeysuckle Rose,Red Norvo,169093,1934-12-15,1934,0.884,0.807,0.381,0.822,0.705,-14.01,0.138,119.876,0.881,0,7,0,False,"cool jazz, jazz vibraphone, swing, vintage jazz"
4jaThVeilwveLmkwnOzjsI,Zing! Went the Strings of My Heart,Red Norvo,209723,1934-12-15,1934,0.615,0.416,0.512,0.578,0.105,-9.819,0.0425,165.033,0.743,1,8,5,False,"cool jazz, jazz vibraphone, swing, vintage jazz"
3YEg8fszz1aMebJr7wuFFX,Sweet Jennie Lee,Hoosier Hot Shots,119053,1934-09-15,1934,0.646,0.727,0.359,5.68e-06,0.133,-8.841,0.0646,129.719,0.952,1,8,0,False,"novelty, traditional country"
7DMcu4fN04O8g84rLxkM2k,Who's Sorry Now,Hoosier Hot Shots,164560,1934-09-15,1934,0.964,0.62,0.163,0.00282,0.0914,-12.467,0.176,163.898,0.774,0,0,0,False,"novelty, traditional country"
6IrD053ve8476emSZKhDHL,"Toot Toot, Tootsie",Hoosier Hot Shots,163106,1934-09-15,1934,0.823,0.708,0.441,0.0215,0.119,-10.369,0.0883,132.549,0.968,1,3,1,False,"novelty, traditional country"
4jDleuFQ6FgnjqVsT5vlkz,I Like Mountain Music,Hoosier Hot Shots,151853,1934-09-15,1934,0.823,0.857,0.444,0.0357,0.127,-9.659,0.101,120.03,0.967,1,3,1,False,"novelty, traditional country"
0m19wqa54CsGmYLHtXOdYG,Love Is Here to Stay,Red Norvo,167880,1934-12-15,1934,0.88,0.792,0.125,0.000625,0.112,-12.135,0.0561,127.232,0.61,1,8,0,False,"cool jazz, jazz vibraphone, swing, vintage jazz"
6DJDAGjojvO2seebhNMJIM,Madame Ivone,Julio Sosa,188066,1934-02-25,1934,0.934,0.506,0.626,0.0,0.604,-6.725,0.226,114.953,0.648,1,2,7,False,"folklore argentino, tango"
4VHZmeNXe6zYtL8yt6ozdE,I Wonder As I Wander,Stephen DeCesare,288560,1934,1934,0.985,0.22,0.179,0.0103,0.137,-15.326,0.0369,81.036,0.181,0,10,0,False,
6WkuMrxQyteELFKEXdPZ8Y,Isle Of Capri,Stephen DeCesare,118986,1934,1934,0.72,0.674,0.763,0.0,0.122,-5.11,0.0311,129.337,0.941,1,5,0,False,
1unrAOQF0FKH7qXV2JwjXf,I Wonder as I Wander,Sandy Campbell Merritt,250931,1934,1934,0.81,0.186,0.117,0.000222,0.117,-11.96,0.0333,79.766,0.0809,0,3,0,False,
1Hf2qs6qfAKPhHQzK43fpR,İçelim,Safiye Ayla,170292,1934-11-11,1934,0.989,0.539,0.461,0.00294,0.813,-6.709,0.158,120.735,0.538,0,1,0,False,"rumeli turkuleri, turk sanat muzigi"
1ONHJEOJO3vEnFITklRGV0,Inourmi (Fox Exandrik),"Kostas Bezos, Tasos Vamparis, Christos Mnimatidis, Danai",192841,1934,1934,0.864,0.573,0.538,0.0,0.0843,-5.424,0.0293,97.183,0.907,1,9,0,False,
4Kkoj0GwOFq7eujGf95ddo,It Might Have Been A Diff'rent Story,"Richard Himber and his Orchestra, Joey Nash",181946,1934-07-01,1934,0.978,0.568,0.32,7.87e-06,0.22,-10.733,0.059,116.437,0.552,1,11,0,False,
0AJKTjr1gbu81uXdLbfqJd,It All Begins and Ends with You,Red Norvo,184240,1934-12-15,1934,0.979,0.647,0.281,0.00609,0.194,-10.186,0.0389,119.995,0.578,0,5,0,False,"cool jazz, jazz vibraphone, swing, vintage jazz"
2hSs8kGoHUpfCiOymgdqfe,Ishq Mujhko Nahin Wahshat Hi Sahi,K. L. Saigal,200228,1934-01-01,1934,0.995,0.497,0.204,0.922,0.104,-17.241,0.0903,76.913,0.476,1,4,0,False,"classic bollywood, filmi, ghazal"
5xwUMGrtWi7AjazKYXRd2h,I Always Keep My Girl Out Late,Jack Jackson & His Orchestra,195813,1934,1934,0.938,0.907,0.276,0.0103,0.105,-16.686,0.074,117.026,0.863,1,10,0,False,british dance band
076PnTo8TVVV3ewMXkg1cQ,If I Had You,Red Norvo,249400,1934-12-15,1934,0.99,0.553,0.307,0.922,0.113,-13.618,0.0437,80.122,0.311,0,2,0,False,"cool jazz, jazz vibraphone, swing, vintage jazz"
3eUXbMSJSTXg9ADKMwKL0w,Ishq Mujhko Nahin Wahshat Hi Sahi,K. L. Saigal,200329,1934-01-01,1934,0.996,0.447,0.206,0.925,0.105,-17.293,0.116,74.843,0.498,1,9,0,False,"classic bollywood, filmi, ghazal"
5McZTOjD6GwSQiKpqjUPFE,I'll Show You Off,Jack Jackson & His Orchestra,179320,1934,1934,0.974,0.909,0.234,0.00636,0.0704,-16.027,0.0715,108.013,0.8,0,7,0,False,british dance band
1UvBTeV1oUvMH3LWFuE8nM,"In Other Words, We're Through (Roy Fox)",Roy Fox,194680,1934,1934,0.986,0.56,0.0556,0.00146,0.284,-17.286,0.0399,94.197,0.277,0,5,1,False,british dance band
4CXvhMFbdGlvnImUxkZYvV,I'll Be Around,Red Norvo,202373,1934-12-15,1934,0.988,0.383,0.0792,0.15,0.0829,-14.923,0.0329,69.071,0.236,1,8,0,False,"cool jazz, jazz vibraphone, swing, vintage jazz"
41e3tb9hB1xrFnuWpVbeax,Ici L'on Pêche,Jean Tranchant,187893,1934,1934,0.93,0.431,0.174,3.37e-06,0.311,-16.197,0.0413,104.477,0.634,1,0,0,False,vintage chanson
1rc0Udzrh4o7hBkGtTE1C2,I'm Paying With Fire,Jack Jackson & His Orchestra,200306,1934,1934,0.986,0.654,0.0568,0.223,0.172,-18.659,0.0695,114.443,0.581,1,7,0,False,british dance band
5zucCRWtyfPiZQ4X46rOdL,I'll Be up Someday,Kokomo Arnold,187240,1934-05-20,1934,0.992,0.777,0.266,0.000113,0.0876,-12.598,0.0452,96.484,0.525,1,7,0,False,"acoustic blues, chicago blues, delta blues, traditional blues"
57xqkKAjtZvvZVYJKPnHqX,"I Kiss Your Hand, Madame",Red Norvo,181640,1934-12-15,1934,0.917,0.63,0.465,0.779,0.301,-8.708,0.126,164.186,0.747,1,8,0,False,"cool jazz, jazz vibraphone, swing, vintage jazz"
2VSML3kSpWDPg51FRO2HeF,No Peace In the World - Blue Earth Mix,Irie White,423253,1934,1934,0.00897,0.659,0.915,0.266,0.0507,-5.424,0.0467,138.014,0.596,1,4,0,False,
4tuy7NOS9I5yb4KDhtUgLu,Love Is The Thing,"Richard Himber and his Orchestra, Joey Nash",185426,1934-07-01,1934,0.953,0.495,0.294,3.32e-06,0.203,-10.791,0.0433,116.437,0.509,1,5,0,False,
6f0qhB6pd48E64NAohoiEO,Love Is The Sweetest Thing,"Richard Himber and his Orchestra, Joey Nash",183706,1934-07-01,1934,0.952,0.416,0.325,7.39e-05,0.13,-10.717,0.0405,119.084,0.565,0,10,0,False,
1fSEfFVb7ptJmK2faM28zz,Music is a Friend of Love,Jack Jackson & His Orchestra,200026,1934,1934,0.966,0.59,0.107,0.000467,0.413,-19.363,0.11,149.4,0.693,0,7,0,False,british dance band
3JfGR8L1DfNUjAWeYW1JBE,Sittin' in The Dark,Jack Jackson & His Orchestra,192653,1934,1934,0.983,0.731,0.156,0.216,0.0522,-19.036,0.0582,137.046,0.745,0,7,0,False,british dance band
5LqGA4uxv7q0xe7KGZxuJT,Reflections in the Water,Jack Jackson & His Orchestra,179893,1934,1934,0.959,0.334,0.107,0.741,0.167,-20.067,0.0425,127.672,0.369,1,3,0,False,british dance band
4w6fv7Bqf0gL8AO0DSvsu5,Mañana Iré Temprano,Julio Sosa,175506,1934-02-25,1934,0.901,0.433,0.53,7.31e-05,0.204,-8.081,0.0539,123.542,0.632,0,10,3,False,"folklore argentino, tango"
4ZlUHgXDv097fR0PQIYpKd,"Variations on a Hebrew Melody, Variation I","Ira Givol, Matan Givol, Jonathan Aner",105213,1934,1934,0.989,0.423,0.0376,0.906,0.0669,-25.604,0.0462,98.145,0.0388,1,9,0,False,
67DAg99qKtldcUoUVHPYJj,"Variations on a Hebrew Melody, Variation III: Alla Marcia","Ira Givol, Matan Givol, Jonathan Aner",117466,1934,1934,0.98,0.442,0.261,0.0364,0.126,-17.307,0.0476,98.89,0.602,0,7,0,False,
4q7UdYv8BA9D7LPRgt6ULK,"Variations on a Hebrew Melody, Variation II: Allegretto grazioso","Ira Givol, Matan Givol, Jonathan Aner",104120,1934,1934,0.979,0.376,0.0764,0.00784,0.0635,-25.401,0.036,96.484,0.36,1,7,0,False,
0A8xrRnrdqyqQrZXwogPQ7,Hopa Hopa - Remasterizado,Ignacio Corsini,156560,1934-06-26,1934,0.979,0.678,0.152,0.000154,0.182,-16.194,0.0798,101.001,0.596,0,3,0,False,vintage tango
6wFdEjRsDOw6MBFw5pAVRr,Misterio - Remasterizado,Ignacio Corsini,170280,1934-06-26,1934,0.955,0.466,0.214,5.58e-05,0.138,-16.377,0.0606,167.521,0.491,0,1,0,False,vintage tango
6wzXHSUeKYyzRFIx40LHqD,Tuyita - Remasterizado,Ignacio Corsini,185906,1934-06-26,1934,0.992,0.324,0.139,0.763,0.224,-21.453,0.0468,69.873,0.433,1,6,0,False,vintage tango
3HidmR8gM3ZtY1XTqTnxYd,"Variations on a Hebrew Melody, Variation VI: Molto tranquillo","Ira Givol, Matan Givol, Jonathan Aner",300320,1934,1934,0.95,0.0971,0.011,0.202,0.172,-35.316,0.0435,79.646,0.0645,1,4,0,False,
0HzoRw2LEFYbtTk3ojzjTw,Pillerías - Remasterizado,Ignacio Corsini,150413,1934-06-26,1934,0.992,0.629,0.39,0.000301,0.168,-16.404,0.0554,116.436,0.902,1,4,0,False,vintage tango
0LjhnsHsMu2cujOTrFMtO1,"Variations on a Hebrew Melody, Variation V: Molto vivace e tempestoso","Ira Givol, Matan Givol, Jonathan Aner",126066,1934,1934,0.981,0.539,0.321,0.566,0.108,-17.485,0.0658,128.936,0.514,0,11,0,False,
0W00x3CpfbXAQPg8zKbJ1m,Amar y Ser Amado - Remasterizado,Ignacio Corsini,155066,1934-06-26,1934,0.902,0.65,0.215,2.8e-06,0.123,-15.296,0.0925,80.126,0.71,1,5,0,False,vintage tango
2smuGDE78RhO22qTVpW5BA,"Variations on a Hebrew Melody, Moderato molto tranquillo","Ira Givol, Matan Givol, Jonathan Aner",80533,1934,1934,0.972,0.206,0.00203,0.137,0.0813,-43.385,0.0394,83.896,0.124,0,8,0,False,
0Dv3d9x02E0r0WJjTF5nUT,Perdona Si No Vuelvo - Remasterizado,Ignacio Corsini,220333,1934-06-26,1934,0.995,0.66,0.118,0.259,0.112,-19.224,0.217,113.752,0.495,1,5,0,False,vintage tango
1xStbpEahjo4UKxeSQy8Zj,Koee Nahin Noor Malik Ke Saamane,Inayati Bai,179490,1934-12-31,1934,0.995,0.569,0.0878,0.0647,0.116,-10.478,0.418,108.382,0.661,0,11,0,False,
6tDi0QNhTMbCbhjSVvVmrp,Los Sauces del Uruguay - Remasterizado,Ignacio Corsini,222066,1934-06-26,1934,0.963,0.62,0.322,0.000227,0.152,-16.173,0.0415,110.134,0.677,1,3,0,False,vintage tango
2u9fXzWHYVB4Nkx1EP9fri,La Tropilla - Remasterizado,Ignacio Corsini,154093,1934-06-26,1934,0.993,0.484,0.178,0.016,0.477,-20.836,0.0742,114.527,0.536,1,11,0,False,vintage tango
1wpaEOUKkVUlEGck7elo23,"Variations on a Hebrew Melody, Adagio misterioso","Ira Givol, Matan Givol, Jonathan Aner",215146,1934,1934,0.976,0.223,0.0562,0.0317,0.0564,-23.865,0.0407,72.266,0.0413,1,8,0,False,
2MUmUhEmYum2HIg4JIr1uO,Siete Lágrimas - Remasterizado,Ignacio Corsini,139106,1934-06-26,1934,0.951,0.622,0.175,1.56e-05,0.621,-18.484,0.0667,107.595,0.611,1,0,0,False,vintage tango
3X0iBJD9GZ6IPb0ctnSYW9,Por una Mujer - Remasterizado,Ignacio Corsini,159106,1934-06-26,1934,0.995,0.531,0.124,0.0168,0.118,-23.243,0.0711,101.902,0.555,1,2,0,False,vintage tango
64iPJSbV6fUBKOjYAoyAk4,Violetas - Remasterizado,Ignacio Corsini,155506,1934-06-26,1934,0.932,0.528,0.412,0.0138,0.248,-15.979,0.162,42.736,0.765,1,5,0,False,vintage tango
3BTj1E1pxMeXstUQEJwwha,Santa Claus Is Coming To Town,Peter Micciche,245283,1934,1934,0.518,0.704,0.307,0.908,0.106,-20.156,0.066,84.96,0.25,0,5,0,False,
2UjSld62JAS0H13MDrwKZ4,Santa Claus is Coming to Town - XMAS in Eastgate,Woody Harvey,152531,1934,1934,0.000432,0.326,0.928,0.0,0.116,-5.505,0.0429,75.009,0.559,1,6,0,False,
0sJMcar80y8f8dRjsQ9iJn,Santa Claus Is Coming to Town,Stephanie Woodford,154618,1934,1934,0.695,0.507,0.202,0.0,0.178,-16.752,0.0404,133.263,0.878,1,7,0,False,
3jvRnc0VvC5zLLJZnwp2kN,Santa Claus Is Coming To Town,The Haywains,106036,1934,1934,0.00107,0.377,0.811,0.0,0.268,-7.917,0.0505,148.588,0.569,1,7,0,False,
3uHqYzQ52yIFSCnN6gFxFv,The Wind's in the West,Roy Fox,195666,1934,1934,0.969,0.566,0.173,0.111,0.0673,-15.505,0.0496,180.842,0.629,0,9,0,False,british dance band
63sJkrCgXNdLYNrrYLI6Sc,The Lady Is a Tramp,Tommy Dorsey,174226,1934,1934,0.751,0.586,0.638,0.00486,0.0941,-7.312,0.15,198.753,0.962,1,0,0,False,"adult standards, big band, dixieland, jazz trombone, swing, tin pan alley, vintage jazz"
2x4Cf1mBmCaCWYEiSNgGOk,That's What I Learned in College,Hoosier Hot Shots,136586,1934-09-15,1934,0.754,0.722,0.291,0.00088,0.0817,-12.135,0.255,133.993,0.958,1,3,0,False,"novelty, traditional country"
29IVdlO7CSlcoOIpOsamkO,Santa Claus Is Coming To Town,The Moors,14628,1934,1934,0.00244,0.0,0.801,0.00125,0.0503,-0.671,0.0,0.0,0.0,0,4,0,False,
4uEnygcR6fsbgGTMdnkygy,One Morning in May (Roy Fox),Roy Fox,179146,1934,1934,0.982,0.323,0.144,0.0034,0.107,-16.17,0.0476,166.249,0.32,1,8,0,False,british dance band
7GCyGih4vUF4YCo9NptQtB,My Well Is Dry,Kokomo Arnold,161493,1934-05-20,1934,0.974,0.822,0.156,6.13e-05,0.125,-14.486,0.0424,99.737,0.786,1,2,0,False,"acoustic blues, chicago blues, delta blues, traditional blues"
0oPowkLWDoHxfju2BJQ7ph,Que Me Importa Tu Pasado,Julio Sosa,167880,1934-02-25,1934,0.937,0.472,0.528,0.00239,0.271,-10.176,0.0527,121.203,0.604,1,11,2,False,"folklore argentino, tango"
