id,name,artists,duration_ms,release_date,year,acousticness,danceability,energy,instrumentalness,liveness,loudness,speechiness,tempo,valence,mode,key,popularity,explicit,genre
6E6RViXGAhLXHv4Sbe8e96,Master and Servant,Depeche Mode,252866,1984-09-24,1984,0.0151,0.62,0.916,0.00228,0.0633,-8.306,0.0515,127.778,0.799,0,10,48,False,"dance rock, new romantic, new wave, permanent wave, rock, synthpop"
0jVfjWK9DUc5ShqwwPADyp,Missing You,Diana Ross,245346,1984-09-13,1984,0.658,0.644,0.355,0.00116,0.0485,-11.41,0.0366,86.822,0.187,0,4,36,False,"adult standards, disco, motown, quiet storm, soft rock, soul"
6gEr0i9oirt2d9w62s6jZH,Mi Najayita,Los Bukis,181653,1984-01-01,1984,0.169,0.717,0.601,0.0,0.0557,-10.304,0.0337,93.868,0.969,1,7,44,False,"grupera, gruperas inmortales, musica mexicana"
42XNPphik9hLUpSg0n6eP1,Mountain Lake,Riley Lee,143626,1984-01-01,1984,0.992,0.146,0.0419,0.894,0.173,-23.742,0.0429,167.565,0.378,0,2,41,False,"meditation, shakuhachi"
58U8hRjWQdGCGQ1Y42SJFp,Method of Modern Love,Daryl Hall & John Oates,333933,1984,1984,0.0708,0.714,0.726,2.15e-05,0.093,-6.621,0.0569,94.203,0.753,0,5,40,False,"album rock, classic rock, mellow gold, rock, singer-songwriter, soft rock, yacht rock"
6jNFXIiJDOvSzFqQOk0Gt9,Main Title - The Terminator,Brad Fiedel,160925,1984,1984,0.868,0.156,0.429,0.87,0.107,-19.091,0.0609,69.282,0.0676,1,3,43,False,"classic soundtrack, soundtrack"
5TJB2SemXdMapyP096ohBy,Misty Night Cruising,S. Kiyotaka & Omega Tribe,266746,1984-12-21,1984,0.0414,0.621,0.974,7.64e-05,0.412,-5.326,0.0615,146.857,0.49,1,10,41,False,classic city pop
68ml3Lm4GNTlpNmmUJfvUu,Main Title (A Nightmare on Elm Street),Charles Bernstein,212666,1984-11-16,1984,0.000421,0.172,0.4,0.0334,0.111,-10.423,0.032,111.95,0.038,1,2,37,False,horror synth
4vzczrJUr7LWVuD8rbIIfY,"Mommy, Can I Go Out & Kill Tonight?",Misfits,123133,1984-01-01,1984,0.0369,0.259,0.902,0.0,0.387,-15.098,0.0953,97.01,0.0573,1,9,37,False,"horror punk, new jersey hardcore, new jersey punk, punk"
4I28nhaWCEqxdXZqH6vePL,Mandy,Richard Clayderman,142160,1984-01-01,1984,0.865,0.577,0.346,0.958,0.101,-14.555,0.0292,106.373,0.397,1,10,48,False,easy listening
7jwQlYGpOml9ETGre1HqGA,Somebody's Watching Me,Rockwell,298866,1984-01-30,1984,0.0371,0.82,0.357,0.00452,0.0541,-13.585,0.0437,124.117,0.765,0,1,62,False,
1A8Fko18JWELjgXtGHaL11,Mi Muchacho,"Diomedes Diaz, Colacho Mendoza",286960,1984,1984,0.667,0.638,0.539,8.69e-06,0.0621,-8.573,0.1,170.044,0.964,1,9,47,False,"cumbia, vallenato"
0iMYJE4NWjmlAE7e5WS5qS,Take Me with U,Prince,234133,1984-06-25,1984,0.0859,0.707,0.814,0.00281,0.234,-10.677,0.0288,121.918,0.697,1,2,50,False,"funk, funk rock, minneapolis sound, rock, synth funk"
46XbQrakS163FgM9l47rcG,My Baby's Got Good Timing,Dan Seals,207173,1984-01-01,1984,0.0846,0.782,0.417,0.0,0.0549,-14.673,0.0304,114.166,0.934,1,8,35,False,"classic country pop, country, country rock"
7vEYpLe2jDmZTYg0zdPNoz,Maldito sea tu nombre,Ángeles Del Infierno,225386,1984,1984,0.000182,0.209,0.977,0.001,0.0574,-4.224,0.168,182.675,0.106,0,11,48,False,"latin metal, rock en espanol, rock urbano mexicano"
2tcQzupbw4uSw7efYw0xkQ,My City Was Gone,Pretenders,324800,1984,1984,0.266,0.742,0.598,0.464,0.0898,-11.341,0.0257,107.664,0.961,1,9,31,False,"album rock, classic rock, mellow gold, new romantic, new wave, new wave pop, permanent wave, rock, soft rock"
7kXJNpViLTJSTZzL29Rq7A,Mondlicht,Xmal Deutschland,303333,1984-06-22,1984,0.227,0.396,0.658,0.00797,0.244,-14.168,0.0358,135.293,0.288,1,7,38,False,"dark wave, deathrock, gothic rock, neue deutsche welle"
7i9bu8l7zFppFNxPZVpsQ6,MLK - Remastered 2009,U2,154000,1984-10-01,1984,0.492,0.216,0.0571,0.0,0.093,-20.29,0.0313,97.91,0.0688,1,7,35,False,"irish rock, permanent wave, rock"
6858ZMSrTDiCw3F58FDf8q,Manantial de Corazon,Yordano,225133,1984-11-11,1984,0.467,0.788,0.495,0.0,0.0317,-8.061,0.048,74.969,0.952,0,7,44,False,"classic venezuelan pop, tropical, venezuelan rock"
1MGgmB8tBTpicGil7mfUqc,"Missing You - 7"" Single Mix",Diana Ross,254786,1984-09-13,1984,0.591,0.569,0.439,0.0012,0.071,-9.729,0.0516,173.456,0.183,0,4,31,False,"adult standards, disco, motown, quiet storm, soft rock, soul"
72WH0zMtlmeiDTrzTgmgnz,The Morning After,Ratt,214693,1984-03-27,1984,7.8e-05,0.474,0.91,0.000937,0.224,-7.621,0.048,143.359,0.533,1,8,34,False,"album rock, glam metal, hard rock"
2qrWPMkdznGoNUN6JvbHFI,My Secret (Didja Gitit Yet?),New Edition,251733,1984-01-01,1984,0.0226,0.796,0.563,0.00207,0.0513,-12.441,0.0497,120.647,0.849,1,6,32,False,"boy band, contemporary r&b, new jack swing, r&b, urban contemporary"
77Iw0LG356gd4CF5tCcGNj,Metal Thrashing Mad,Anthrax,162360,1984,1984,0.00019,0.187,0.914,0.426,0.285,-9.373,0.228,195.604,0.225,1,7,38,False,"alternative metal, glam metal, groove metal, hard rock, metal, nu metal, old school thrash, rap metal, rock, speed metal, thrash metal"
3VvffhjGEQupMOzoXinJm3,Me Muero Porque Seas Mi Novia,Los Bukis,179746,1984-01-01,1984,0.3,0.641,0.603,0.0,0.0667,-10.693,0.0369,179.563,0.973,1,7,36,False,"grupera, gruperas inmortales, musica mexicana"
43THPstJP6RXLMd7ryXyNf,Marcia Baïla,Les Rita Mitsouko,335746,1984-01-04,1984,0.201,0.772,0.795,0.0,0.0765,-5.945,0.0328,126.847,0.819,1,7,58,False,"chanson, french rock"
0XHhoiOpZUjUbiNHdCcQgM,Mis Amores,Roberto Carlos,231240,1984,1984,0.296,0.537,0.586,0.0,0.138,-7.765,0.0389,202.231,0.52,1,0,29,False,"jovem guarda, mpb"
4JP7dgTc4SwllOM98u4wDP,Murder,David Gilmour,299373,1984-03-05,1984,0.226,0.226,0.565,0.00351,0.13,-10.931,0.0508,173.576,0.302,1,0,35,False,"album rock, art rock, classic rock, progressive rock, symphonic rock"
0jBCPiIQ4YwqGcJNRxfytF,Middle of the Road,Pretenders,255493,1984,1984,0.00943,0.491,0.939,0.0799,0.0165,-8.588,0.0707,166.74,0.566,1,9,29,False,"album rock, classic rock, mellow gold, new romantic, new wave, new wave pop, permanent wave, rock, soft rock"
28f5iTZpcNg8lIEvQm3XrO,Major Moves,"Hank Williams, Jr.",215866,1984-05-01,1984,0.286,0.7,0.31,9.06e-06,0.119,-13.825,0.0296,106.603,0.214,1,2,29,False,"country, country rock, outlaw country"
0NgBe6cubzUkCr0rYrFgCI,Model Man,King Crimson,229720,1984-03-26,1984,0.0131,0.722,0.541,8.67e-05,0.048,-10.364,0.103,103.357,0.631,1,9,35,False,"art rock, instrumental rock, jazz rock, progressive rock, psychedelic rock, symphonic rock, zolo"
3jxLYg1dhbj1rnsGmwdChh,Me Gustas Tal Como Eres,Luis Miguel,193352,1984-06-14,1984,0.275,0.699,0.611,0.0,0.0948,-8.886,0.028,108.458,0.738,1,4,48,False,"bolero, latin pop"
23UbRcbWIsgqDDAExRJqS1,Mack The Knife,"Frank Sinatra, Quincy Jones",292240,1984-08-01,1984,0.381,0.596,0.615,0.0,0.303,-10.158,0.0396,138.396,0.565,1,1,36,False,"adult standards, easy listening, lounge"
3cqnn3G9J0ZDo5ZgCWAFij,Magic,Mick Smiley,259800,1984-06-08,1984,0.00916,0.524,0.424,0.151,0.133,-18.098,0.0401,130.054,0.422,0,4,33,False,
6SSizCDpjkoNOHe5SVZFh4,Marching to Honolulu - Remastered,"Kapono Beamer, Hawaiian Steel Guitar",160891,1984-12-31,1984,0.593,0.652,0.602,0.871,0.201,-7.025,0.0313,112.551,0.899,1,0,34,False,"hawaiian, slack-key guitar"
3SvIVERdn47bvRYXcSJDRv,緑色のラグーン,Yu Hayami,219240,1984-09-02,1984,0.353,0.643,0.662,1.71e-06,0.378,-9.988,0.0417,126.775,0.517,0,11,36,False,"classic city pop, idol kayo, techno kayo"
1USKs5wcxokVwrgbfATjmP,Mystery,Dio,238000,1984,1984,0.0011,0.481,0.928,0.0301,0.194,-5.877,0.0312,126.609,0.819,1,5,29,False,"album rock, alternative metal, glam metal, hard rock, metal, rock, speed metal"
4e4EjNZodRI8IR1CCO8D8M,"You, Me And He",Mtume,267226,1984,1984,0.266,0.77,0.28,0.000598,0.0883,-15.659,0.186,71.638,0.389,1,5,38,False,"contemporary r&b, funk, new jack swing, post-disco, quiet storm, urban contemporary"
3V92kxWqO9oIJAQ1jEnqUT,Monkey Man,Toots & The Maytals,175533,1984-07-07,1984,0.222,0.843,0.528,2.62e-06,0.0752,-12.474,0.0448,128.491,0.961,1,10,39,False,"reggae, roots reggae, ska"
4Nf4pScvTosqe9xz0FCBui,Music For A Found Harmonium - 2008 Digital Remaster,Penguin Cafe Orchestra,219733,1984,1984,0.915,0.382,0.225,0.921,0.05,-12.962,0.0459,97.045,0.103,1,0,38,False,compositional ambient
0cAPfvvqFZsqsIz3ZDSKIa,This Must Be the Place (Naive Melody) - Live,Talking Heads,297226,1984,1984,0.394,0.769,0.583,0.00103,0.705,-10.191,0.0329,114.248,0.923,1,7,46,False,"alternative rock, art punk, dance rock, funk rock, new wave, permanent wave, post-punk, rock, zolo"
38T5LePgQRVhMD3idN1blA,Me Voy De Estas Tierras,Los Tigres Del Norte,151173,1984-01-01,1984,0.482,0.877,0.524,6.36e-06,0.208,-10.828,0.0839,110.342,0.962,1,0,35,False,"banda, musica mexicana, norteno, ranchera"
3aXYVBh5xgdHwRbkVrYf5T,Maybe Partying Will Help,Minutemen,116426,1984-07-24,1984,0.0145,0.59,0.833,0.527,0.0613,-9.976,0.0983,134.864,0.574,1,9,34,False,"alternative rock, experimental rock, hardcore punk, no wave, post-hardcore, post-punk, punk"
18W1OSSRFyBmGVfOfQ5Ixk,Mr. Bojangles,John Holt,319933,1984,1984,0.176,0.641,0.278,1.59e-06,0.0993,-16.35,0.0702,75.995,0.666,0,1,39,False,"dub, lovers rock, reggae, rocksteady, roots reggae"
7y1u6imIRHxTT40WMbLmKs,Mr. Telephone Man,New Edition,238486,1984-08-06,1984,0.0308,0.729,0.534,0.0,0.0545,-9.646,0.0326,94.039,0.781,1,2,32,False,"boy band, contemporary r&b, new jack swing, r&b, urban contemporary"
75SqjGbzUnlQzytV5UzKER,Madam Butterfly (Un Bel Di Vedremo),Malcolm McLaren,389666,1984-01-01,1984,0.141,0.451,0.651,1.11e-06,0.303,-14.925,0.089,101.67,0.451,1,11,38,False,
1Akqana0Uhppv4162JRLBE,Me Falta Tu Presencia,Los Yonic's,209160,1984-01-01,1984,0.127,0.653,0.695,0.0,0.0588,-9.483,0.068,75.023,0.842,1,11,35,False,"banda, grupera, gruperas inmortales, musica mexicana, norteno, ranchera"
1j6VQkMRBlqam4COYjVUBU,Mr. Lincoln,"Hank Williams, Jr.",254400,1984-05-01,1984,0.0961,0.528,0.392,1.42e-06,0.0774,-13.57,0.0302,142.352,0.279,1,2,25,False,"country, country rock, outlaw country"
1b3BQCRnqWCMMJlXlrC4wm,Mona Lisa Lost Her Smile,David Allan Coe,221666,1984-04-01,1984,0.414,0.638,0.554,2.74e-05,0.0779,-11.743,0.0258,94.143,0.839,1,10,27,False,"country, outlaw country"
0aXzRRrXvDycmdeCad2sar,Mi Believe/Summer Holiday,Yellowman,247706,1984-05-01,1984,0.506,0.858,0.462,1.33e-06,0.213,-13.651,0.189,77.863,0.891,0,11,31,False,"dub, reggae, roots reggae"
2nXsA5iHV5ZqWkcDvYSYvv,My Mommy Comes Back,"Hap Palmer, Martha Cheney",137906,1984-01-01,1984,0.583,0.676,0.463,0.0,0.327,-7.837,0.0327,61.832,0.766,1,7,27,False,children's folk
6NG0ZuJsu99WgQ2yFUUAOy,"The More You Live, The More You Love",A Flock Of Seagulls,250520,1984,1984,0.00388,0.622,0.74,0.00405,0.538,-10.271,0.0354,139.525,0.786,0,11,43,False,"new romantic, new wave, new wave pop, synthpop"
67sjNlg6wPl1LlI086NpgA,Man With An Open Heart,King Crimson,185266,1984-03-26,1984,0.183,0.793,0.624,0.00143,0.113,-12.018,0.0377,113.949,0.839,1,9,31,False,"art rock, instrumental rock, jazz rock, progressive rock, psychedelic rock, symphonic rock, zolo"
6Sl47NIwtXYYXP1UB7a0hI,Out Of Step,Minor Threat,80786,1984-06-01,1984,0.0173,0.398,0.951,0.00157,0.823,-7.294,0.379,170.449,0.693,1,0,46,False,"dc hardcore, hardcore punk, punk, straight edge"
49jp3IoMKKZRY6XTc4ooJF,Memory Image - Remastered,"Jim Harbourg, Claude Larson, Manuel Landy",195329,1984-06-30,1984,0.712,0.171,0.29,0.879,0.138,-12.136,0.0389,123.149,0.092,0,2,28,False,
7kRhtWodPO1Oi0UVuj7Dob,Mi Novia Tiene Bíceps - Remasterizado 2007,Soda Stereo,145533,1984-02-06,1984,0.096,0.532,0.976,0.00386,0.368,-5.413,0.0922,184.531,0.895,0,6,51,False,"argentine rock, latin alternative, latin rock, post-punk argentina, rock en espanol, ska argentino"
21QmURe6x2kxpbaF3pUJ1Q,Midsummer's Daydream - Instrumental,Triumph,100466,1984-11-10,1984,0.867,0.493,0.241,0.749,0.09,-15.08,0.0543,84.035,0.492,1,2,29,False,"album rock, canadian metal, classic canadian rock, classic rock, glam metal, hard rock"
5ZtDMeGtChiwhJOnrXMaiF,Never Could Toe the Mark,Waylon Jennings,177640,1984-06-01,1984,0.0883,0.861,0.344,0.0337,0.102,-17.029,0.0614,93.969,0.889,1,7,39,False,"classic texas country, country, outlaw country"
0Anb7B9hNq5yXUAy4DBLLU,"No Woman, No Cry - Eric “E.T.” Thorngren Remix",Bob Marley & The Wailers,251066,1984-05-01,1984,0.0694,0.862,0.432,0.0,0.0553,-11.099,0.0385,97.064,0.713,1,0,47,False,"reggae, roots reggae"
1D9LtacCKg6ukRkzz3zMa1,"No Woman, No Cry - Live At The Lyceum, London/1975",Bob Marley & The Wailers,429200,1984-05-01,1984,0.247,0.649,0.659,0.0316,0.732,-9.343,0.0531,78.451,0.615,1,1,45,False,"reggae, roots reggae"
6kXQ0gfy6miSSdipvtsntD,Nena,Diego Verdaguer,162716,1984-04-01,1984,0.682,0.841,0.587,1.47e-05,0.131,-9.596,0.0282,113.662,0.968,1,6,50,False,"grupera, latin pop, ranchera"
44naTt3UwdyECyAehMClsH,Never You Done That,General Public,250666,1984-01-28,1984,0.0561,0.476,0.69,0.000443,0.557,-12.303,0.0446,154.916,0.844,1,7,35,False,"new romantic, new wave, power pop"
3CCBwpqjdar1PG6HHulmD0,No More Lonely Nights (Ballad) - Remastered 1993,Paul McCartney,312733,1984-10-22,1984,0.00349,0.32,0.428,0.000276,0.519,-14.262,0.0536,172.603,0.411,1,5,50,False,"classic rock, mellow gold, rock, soft rock"
4W17seqvaBsacGPuwyO5MQ,New Sensations,Lou Reed,344826,1984-04-01,1984,0.193,0.775,0.554,0.00668,0.0743,-11.926,0.0405,133.21,0.89,1,7,41,False,"classic rock, glam rock, permanent wave, rock, singer-songwriter"
3pql3jKoIGq8iWKemtrvB4,Necromancy,Bathory,219880,1984-01-01,1984,4.65e-06,0.318,0.872,0.94,0.447,-7.775,0.0559,96.332,0.586,1,10,43,False,"autonomous black metal, black metal, black thrash, metal, old school thrash, pagan black metal, swedish black metal, swedish metal, thrash metal, viking black metal, viking metal"
1OdicOW5M1kZxlT5tE3nNe,Never Tell,Violent Femmes,429373,1984-06-01,1984,0.0509,0.506,0.514,1.66e-06,0.134,-12.668,0.173,104.776,0.668,0,2,34,False,"acoustic punk, alternative rock, punk"
257zC1bFBkUyNRu8vGvkI4,Never Talking to You Again,Hüsker Dü,100933,1984-07-01,1984,0.841,0.403,0.381,0.0,0.087,-14.679,0.0338,137.209,0.504,0,4,34,False,"alternative rock, experimental rock, hardcore punk, noise pop, noise rock, post-hardcore, post-punk, power pop, punk"
5jDqM2vXnlHSQ43VI7RdmM,No Reason,Minor Threat,117600,1984-06-01,1984,0.00408,0.393,0.977,0.00233,0.109,-6.736,0.123,159.271,0.464,0,6,31,False,"dc hardcore, hardcore punk, punk, straight edge"
21vp1orbqySVyww9ngW44w,Viet Nam,Minutemen,89666,1984-07-24,1984,0.0128,0.716,0.877,0.000918,0.114,-9.299,0.281,160.513,0.956,1,2,44,False,"alternative rock, experimental rock, hardcore punk, no wave, post-hardcore, post-punk, punk"
5W2wzbDu4os7SbAGVzbYfY,One Night Love Affair,Bryan Adams,273080,1984-11-05,1984,0.000507,0.519,0.845,1.61e-06,0.376,-5.667,0.0374,124.624,0.609,0,6,51,False,"canadian pop, canadian singer-songwriter, classic canadian rock, heartland rock, mellow gold, soft rock"
4zbdL145HrWmV19spFSkJ5,Night In That Land,Nightnoise,192813,1984,1984,0.978,0.162,0.148,0.313,0.0682,-17.944,0.0413,168.201,0.181,1,7,31,False,new age
1jQ86hNKMD4c0w1F0RESYA,No One's Little Girl,The Raincoats,270360,1984,1984,0.00252,0.536,0.559,0.445,0.354,-9.714,0.0352,94.043,0.546,1,9,32,False,"art punk, experimental rock, post-punk, riot grrrl, uk post-punk"
6uk2BGhzfEanRJOgGzhTl5,"24 Préludes, Op. 28: 4. In E Minor - 1974 Recording","Frédéric Chopin, Maurizio Pollini",120426,1984-01-01,1984,0.994,0.389,0.00531,0.92,0.06,-31.402,0.0781,66.78,0.0375,0,9,35,False,"classical, early romantic era, polish classical"
2lqc273pCZk6gtkfubaCbh,Night Comes Down,Judas Priest,240440,1984,1984,0.0142,0.327,0.559,0.00284,0.155,-5.561,0.0303,94.694,0.255,0,4,35,False,"album rock, alternative metal, birmingham metal, glam metal, hard rock, metal, rock"
04rLT4KBoCtGpJSTp1sPjR,No Shelter,Broken Edge,238133,1984,1984,0.0153,0.491,0.776,0.00671,0.195,-9.45,0.161,180.554,0.524,0,6,34,False,
148uoUpRp6FJK5qYoXijwm,Notte prima degli esami,Antonello Venditti,291506,1984-12-01,1984,0.863,0.348,0.176,0.0,0.338,-18.279,0.0336,158.417,0.396,1,5,57,False,"canzone d'autore, classic italian pop, italian adult pop, italian pop"
5sUfnVc1HErvppiQq13wX4,No Flowers Please,Naked Eyes,243826,1984-09-01,1984,0.0227,0.585,0.647,0.00649,0.121,-12.009,0.0305,99.108,0.693,0,9,30,False,"new romantic, new wave pop, synthpop"
6x8GeAremuPbjgKJw5ao4D,Nobody's Home,Deep Purple,240026,1984-09-16,1984,0.00291,0.49,0.89,0.000923,0.0359,-6.599,0.041,133.699,0.852,1,2,38,False,"album rock, classic rock, hard rock, metal, rock"
2SnbvVwRHzm3p6XH4ZsNgW,Nothing Left Inside,Black Flag,404533,1984-03-01,1984,0.772,0.309,0.252,0.395,0.112,-19.711,0.0362,126.307,0.247,1,4,29,False,"alternative rock, california hardcore, hardcore punk, punk"
0hPQO6CKJLlT9R7oRZ5ODL,Nature Trail to Hell,"""Weird Al"" Yankovic",356133,1984-01-01,1984,0.0171,0.432,0.663,0.0,0.149,-12.281,0.0476,169.617,0.576,1,5,26,False,"comedy rock, comic, parody"
4sr4NdrPfds9Qfors9UkiO,Solid,Ashford & Simpson,312000,1984-01-01,1984,0.27,0.814,0.474,8.16e-06,0.599,-12.017,0.0309,101.241,0.956,1,0,53,False,"classic soul, disco, funk, motown, post-disco, quiet storm, soul, southern soul, urban contemporary"
6mFg8cKXSzNOmHnnR2sP91,Nelson Mandela - 2002 Remaster,The Specials,257320,1984-06-01,1984,0.0943,0.658,0.847,0.036,0.273,-6.041,0.0598,127.092,0.779,1,0,40,False,"britpop, new wave, punk, ska, ska revival"
1QeOzKtXyIcaQqLM5pKJ8i,"No Remorse (Live at The Hollywood Palladium, Los Angeles, CA – March 10th, 1985)",Metallica,383559,1984-07-27,1984,0.000479,0.222,0.985,0.859,0.726,-6.874,0.157,114.615,0.0399,1,7,25,False,"hard rock, metal, old school thrash, rock, thrash metal"
3MzqZDQInpsxboLy33uMct,New-York avec toi - Remasterisé en 2015,Téléphone,142680,1984-05-07,1984,0.122,0.55,0.815,6.56e-05,0.146,-6.34,0.0426,162.248,0.716,1,9,58,False,"chanson, french pop, french rock"
49B6sqAukHZ69oFCaLOHOQ,Not Me - Remastered,This Mortal Coil,224533,1984-10-01,1984,5.74e-06,0.55,0.831,0.702,0.045,-8.342,0.0331,135.667,0.74,0,9,30,False,"dream pop, ethereal wave, melancholia, shoegaze, uk post-punk"
6ynAeOwUozXLDgukzmgH8e,The Nightmare Continues,Discharge,109960,1984-01-01,1984,1.07e-06,0.279,0.973,0.0297,0.0467,-5.577,0.0538,75.668,0.274,0,8,30,False,"anarcho-punk, crossover thrash, crust punk, d-beat, hardcore punk, punk"
6kBimNaoQNxnv85yNgeUDp,No Sanctuary - Remastered,Queensrÿche,364553,1984,1984,0.228,0.274,0.611,6.3e-05,0.314,-6.653,0.0306,141.004,0.0835,0,4,27,False,"album rock, glam metal, hard rock, metal, progressive metal, us power metal"
2GlBGDFgiJWyrkARnQZFva,No One Together,Kansas,417400,1984,1984,0.0925,0.537,0.596,6.23e-05,0.0512,-11.15,0.0422,99.133,0.606,1,5,26,False,"album rock, classic rock, hard rock, heartland rock, mellow gold, progressive rock, rock, soft rock"
7b0UAKA6QLFZnR9dbT5fxN,Necromancy,Bathory,219951,1984-01-01,1984,4.54e-06,0.159,0.871,0.929,0.474,-7.923,0.0948,194.348,0.516,1,3,33,False,"autonomous black metal, black metal, black thrash, metal, old school thrash, pagan black metal, swedish black metal, swedish metal, thrash metal, viking black metal, viking metal"
01QAgElIaZwj5HRAuNa7ty,New Song,Howard Jones,255373,1984-03-08,1984,0.104,0.763,0.781,0.0145,0.0769,-8.298,0.0542,112.332,0.719,1,5,30,False,"new romantic, new wave, new wave pop, synthpop"
2xrdTuS1XLK5iEebMXus8G,"24 Préludes, Op. 28: 19. In E Flat Major - 1974 Recording","Frédéric Chopin, Maurizio Pollini",78466,1984-01-01,1984,0.976,0.365,0.0792,0.897,0.208,-27.054,0.0296,96.626,0.31,1,3,38,False,"classical, early romantic era, polish classical"
2yhxt9pe5XkdnwG1HjFMuM,Nightmare,Mercyful Fate,381173,1984-09-07,1984,0.000174,0.256,0.885,0.761,0.749,-8.945,0.0752,127.21,0.405,0,4,31,False,"danish metal, death metal, hard rock, metal, thrash metal"
45cUqi1BtDP8MSd32ENJXb,No Voy a Mover un Dedo,Yordano,236920,1984-11-11,1984,0.713,0.718,0.309,0.0,0.103,-11.282,0.0312,130.497,0.579,1,5,36,False,"classic venezuelan pop, tropical, venezuelan rock"
3fI6xSQqR37GqFTfdKzBBQ,"Nuages (That Which Passes, Passes Like Clouds)",King Crimson,287386,1984-03-26,1984,0.537,0.512,0.335,0.897,0.099,-16.955,0.0484,127.936,0.491,0,2,28,False,"art rock, instrumental rock, jazz rock, progressive rock, psychedelic rock, symphonic rock, zolo"
4qOvULmbt4cql7YBWDPvkn,The Natural,Randy Newman,217906,1984,1984,0.192,0.201,0.263,5.99e-05,0.0999,-17.928,0.0331,77.416,0.165,1,5,23,False,"movie tunes, singer-songwriter"
6nT02nLUsL3Xc1LRPzlHsQ,Nature Without Man,Minutemen,106893,1984-07-24,1984,0.000386,0.47,0.679,0.00879,0.256,-11.096,0.0414,111.588,0.907,0,4,26,False,"alternative rock, experimental rock, hardcore punk, no wave, post-hardcore, post-punk, punk"
4918sAEeavmgbRoasuCSjq,New Kind Of Kick,The Cramps,207440,1984-01-01,1984,0.133,0.6,0.893,1.1e-05,0.208,-6.622,0.0875,131.271,0.455,1,11,24,False,"garage rock, gothabilly, post-punk, psychobilly, punk"
2WgnLtwA8WxNuFRz6j0VXB,Night Comes On,Leonard Cohen,280173,1984-12-11,1984,0.786,0.372,0.219,0.0034,0.128,-16.142,0.0327,146.647,0.228,1,7,33,False,"canadian singer-songwriter, melancholia, permanent wave, singer-songwriter"
5uzxLxMCb5UiWwpZrwSpeG,Twentieth Century Fox,38 Special,225440,1984-01-01,1984,0.000822,0.412,0.649,0.0206,0.114,-12.986,0.0368,153.074,0.634,1,5,30,False,"album rock, classic rock, country rock, glam metal, hard rock, mellow gold, rock, soft rock, southern rock"
256bUjPPMLgrbo1o3zmLPp,Now That You Got Me,Honeymoon Suite,210266,1984-06-14,1984,0.0379,0.486,0.632,0.0,0.047,-17.023,0.0374,147.139,0.84,1,7,25,False,"canadian metal, classic canadian rock"
0m2Hj8mGlgCzRMcwlY4gfM,Naked Girls Falling Down the Stairs,The Cramps,164800,1984,1984,0.041,0.294,0.934,7.14e-06,0.338,-6.543,0.0599,179.197,0.813,1,9,21,False,"garage rock, gothabilly, post-punk, psychobilly, punk"
4Sbdxp1r7A5QKU4eOW8RMX,Night of the Unborn,Mercyful Fate,301733,1984-09-07,1984,0.00512,0.21,0.934,0.855,0.12,-7.831,0.0915,136.915,0.322,1,7,29,False,"danish metal, death metal, hard rock, metal, thrash metal"
6YSF0u64K0xreRh1uOJuPw,88 Lines about 44 Women,The Nails,296640,1984,1984,0.0416,0.8,0.716,0.0305,0.0872,-9.224,0.0579,148.689,0.975,1,2,39,True,
0AkmNg3BN8xBuECm5xllwR,Nunca Quedas Mal Con Nadie,Los Prisioneros,250984,1984,1984,0.307,0.566,0.932,0.0,0.342,-6.848,0.0693,155.063,0.902,1,2,50,False,"chilean hardcore, chilean rock, latin alternative, latin rock, rock en espanol, ska chileno"
6sn3FHCq2csvNkq2h9Au8V,The Riddle,Nik Kershaw,234840,1984-01-01,1984,0.121,0.578,0.655,6.91e-06,0.137,-7.935,0.0277,101.889,0.898,1,9,62,False,"new romantic, new wave, new wave pop"
3J2o94SUck1Bpq3EAhNBEi,Nine Times Blue,The Monkees,129973,1984-09-18,1984,0.654,0.483,0.409,2.6e-06,0.148,-11.197,0.0354,91.17,0.613,1,7,23,False,"album rock, beatlesque, bubblegum pop, classic rock, folk rock, mellow gold, rock, rock-and-roll, singer-songwriter, soft rock, sunshine pop"
7CHupJAHu78AZvookw788C,New Gods,Meat Puppets,132666,1984,1984,3.98e-05,0.392,0.917,0.198,0.127,-8.328,0.123,140.218,0.684,1,8,20,False,"alternative rock, cowpunk, grunge, punk"
0siySPc0ooo4rNTdwaoXM1,Stay the Night - 2006 Remaster,Chicago,229693,1984-05-14,1984,0.11,0.686,0.662,1.17e-06,0.0569,-5.31,0.0317,84.225,0.748,1,0,42,False,"album rock, classic rock, mellow gold, rock, soft rock, yacht rock"
6MU15zZD7oLjWabzapNPHi,Near The End,David Gilmour,350786,1984-03-05,1984,0.599,0.454,0.279,0.0249,0.191,-11.629,0.0279,160.475,0.223,0,11,26,False,"album rock, art rock, classic rock, progressive rock, symphonic rock"
59aRyLpboGTcvqjivppGcb,Not in Love - Remastered,Platinum Blonde,247360,1984,1984,0.00794,0.662,0.715,1.36e-05,0.0804,-4.134,0.0685,135.909,0.699,0,8,35,False,classic canadian rock
5HWfFv6sEBnpfRgJYOSCPv,No Se Va A Llamar Mi Amor,Charly García,130320,1984-01-01,1984,0.157,0.555,0.965,0.0,0.142,-7.573,0.0836,127.975,0.396,1,2,49,False,"argentine rock, latin alternative, latin rock, post-punk argentina, rock en espanol"
6abZZf6H7PBRVpfhmjYJ8q,Never Again,Discharge,139920,1984-01-01,1984,1.31e-06,0.218,0.989,0.0132,0.241,-5.31,0.149,152.482,0.106,1,1,26,False,"anarcho-punk, crossover thrash, crust punk, d-beat, hardcore punk, punk"
2c343Y5TmH6jCs3ES9kxjp,4th Of July - Remastered 2009,U2,135053,1984-10-01,1984,0.32,0.262,0.117,0.751,0.0556,-22.289,0.0344,138.129,0.149,1,7,32,False,"irish rock, permanent wave, rock"
2wiVxxnjeJf0q9xSYDB48h,NM 156 - Remastered,Queensrÿche,279733,1984,1984,0.0279,0.557,0.977,0.000126,0.297,-5.15,0.134,110.172,0.159,0,6,23,False,"album rock, glam metal, hard rock, metal, progressive metal, us power metal"
0lxdetiUsmWw8urikORRPD,NIGHT DREAMER,T-SQUARE,367466,1984-04-01,1984,0.175,0.638,0.824,0.813,0.0771,-6.349,0.029,115.726,0.925,0,0,28,False,"japanese jazz, japanese jazz fusion"
7b4d8LI9t4avQi9u3D7doK,"Symphony No. 25 In G Minor, K. 183, 1st Movement","Wolfgang Amadeus Mozart, Sir Neville Marriner, Academy of St. Martin in the Fields",470800,1984-01-01,1984,0.975,0.294,0.111,0.896,0.317,-19.059,0.0462,155.352,0.285,0,7,28,False,"classical, classical era"
4rLmt4hvKAx5C1PRpj1lg6,Operator,Midnight Star,448240,1984-01-01,1984,0.0112,0.804,0.827,0.00392,0.0908,-8.188,0.0442,125.276,0.7,0,11,38,False,"contemporary r&b, funk, motown, new jack swing, post-disco, quiet storm, urban contemporary"
4mOLsya7jOsaONExOxpryV,Out of Touch,Daryl Hall & John Oates,261000,1984,1984,0.0657,0.777,0.827,0.000392,0.0574,-5.464,0.0316,114.89,0.906,0,9,44,False,"album rock, classic rock, mellow gold, rock, singer-songwriter, soft rock, yacht rock"
019KRrap2TW8ASDAWbe6OU,Once in a Lifetime - Live,Talking Heads,325573,1984,1984,0.028,0.518,0.769,5.31e-05,0.962,-8.696,0.102,122.783,0.571,1,2,42,False,"alternative rock, art punk, dance rock, funk rock, new wave, permanent wave, post-punk, rock, zolo"
3QOQEObqJvCi4M2SNeko7V,The Order of Death,Public Image Ltd.,289973,1984,1984,0.166,0.653,0.598,0.539,0.607,-12.919,0.0336,103.088,0.552,0,11,37,False,"alternative rock, new romantic, new wave, post-punk, punk, uk post-punk"
00IIRIjBvLdF3iYN85baVx,One Lonely Night,REO Speedwagon,201466,1984-11-05,1984,0.0561,0.408,0.579,0.000149,0.0712,-10.277,0.026,76.051,0.397,1,5,41,False,"album rock, classic rock, glam metal, hard rock, mellow gold, rock, soft rock"
3Utqk7miIHD0sxaeYmLbeL,"Oh, Me",Meat Puppets,182000,1984,1984,0.169,0.576,0.309,0.104,0.103,-12.458,0.0411,129.971,0.359,0,7,34,False,"alternative rock, cowpunk, grunge, punk"
