id,name,artists,duration_ms,release_date,year,acousticness,danceability,energy,instrumentalness,liveness,loudness,speechiness,tempo,valence,mode,key,popularity,explicit,genre
74fLsLnQCJk4RX5suTBkYm,"Bark at the Moon - Live at Orlando Arena, Orlando, FL - August 1992",Ozzy Osbourne,328733,1993-06-23,1993,2.69e-05,0.209,0.973,0.473,0.948,-7.137,0.189,74.584,0.238,1.0,6.0,24,True,"album rock, alternative metal, birmingham metal, classic rock, glam metal, hard rock, metal, rock"
1HA56iWzXjr0lya1RzdNhE,This Could Be the Start of Something,Buddy Greco,160400,1993-07-13,1993,0.642,0.682,0.516,0.0,0.135,-10.54,0.131,113.006,0.796,1.0,8.0,30,False,deep adult standards
6PsX6nmpsOFR0jjLyEzmPZ,Barbecue Blues,Lucille Bogan,162664,1993,1993,0.983,0.605,0.202,0.0,0.0818,-12.55,0.0535,110.555,0.563,1.0,3.0,21,False,"country blues, pre-war blues, traditional blues"
6WHUFWgddSADJvnbJmCUTj,Soundtrack Of Space,B12,244706,1993,1993,0.0722,0.122,0.302,0.00114,0.235,-11.694,0.0382,148.314,0.0333,1.0,3.0,15,False,intelligent dance music
6dEPdJzMrAguiD92rEsAaa,Boom! I Got Your Boyfriend,M.C. Luscious,266106,1993-05-12,1993,0.00356,0.89,0.747,0.271,0.109,-7.897,0.0958,130.012,0.619,0.0,6.0,16,True,miami bass
2QDpjHhd6IFzcBUxrdKUtW,Buen Rock Esta Noche,Los Superclasicos,133933,1993,1993,0.498,0.524,0.492,0.0175,0.0822,-14.06,0.0883,196.129,0.832,1.0,9.0,25,False,mexican rock-and-roll
5cijIVFJvAeCTn933Pr6xW,12 O'Clock,Vangelis,331426,1993-05-03,1993,0.838,0.161,0.163,0.752,0.126,-17.414,0.0435,131.969,0.0421,0.0,1.0,35,False,"cyberpunk, synthesizer"
1EsJoDuJ2STML0AgiWC84b,19 Naughty III,Naughty By Nature,283600,1993-02-23,1993,0.0801,0.74,0.5,0.000419,0.0781,-15.293,0.336,101.598,0.535,1.0,7.0,23,True,"east coast hip hop, hip hop, new jersey rap"
6h7etYZribWKK51we62tYY,"Blowin' in the Wind - Live at Madison Square Garden, New York, NY - October 1992",Stevie Wonder,378106,1993-03-03,1993,0.173,0.329,0.782,8.64e-05,0.99,-7.819,0.0512,129.074,0.609,1.0,10.0,23,False,"motown, soul"
5AsCS23rCQXOadhlkfw03v,Brand,Majesty Crush,294866,1993-01-01,1993,0.000778,0.499,0.639,0.586,0.196,-8.66,0.0331,112.595,0.591,1.0,2.0,17,True,shoegaze
1hjZbd4ZlaCQhEpuyADSyb,Boogie Down - Single Version,Eddie Kendricks,231893,1993-01-15,1993,0.332,0.714,0.625,0.0206,0.312,-11.534,0.0298,114.535,0.928,0.0,5.0,32,False,"classic soul, disco, funk, motown, p funk, post-disco, quiet storm, soul"
5h5vfZxyiHUzti36IlmzFU,Buckin' Em Down,LL COOL J,241666,1993-06-01,1993,0.00408,0.786,0.521,0.000436,0.108,-12.492,0.0823,92.965,0.222,1.0,1.0,19,False,"east coast hip hop, golden age hip hop, hip hop, old school hip hop, queens hip hop, rap"
2sJ4UnGzuckorQhzAwW5ay,Brown Skin Woman,KRS-One,279360,1993-09-03,1993,0.0555,0.807,0.485,0.442,0.349,-11.631,0.104,94.992,0.216,1.0,1.0,22,False,"bronx hip hop, conscious hip hop, east coast hip hop, golden age hip hop, hardcore hip hop, hip hop, old school hip hop, political hip hop"
5yfljhHgEziLNUgroj4trN,"Bertha - Live at the Carefree Theatre, 1992",Los Lobos,320866,1993,1993,0.0292,0.466,0.666,0.61,0.48,-10.29,0.0345,86.015,0.848,1.0,0.0,16,False,roots rock
0N3DF5tdZlS0FA8vMpF2Ea,Besame Mucho,Francisco Garcia,173788,1993-01-01,1993,0.428,0.644,0.313,0.882,0.117,-17.59,0.0388,103.045,0.513,0.0,2.0,24,False,romantico
6B4O8Erp0ZQ1dgE9LBimsA,Transit Ride,"Guru, Branford Marsalis",238293,1993-01-01,1993,0.0211,0.655,0.756,0.000292,0.282,-11.408,0.239,93.026,0.882,1.0,6.0,41,False,"boston hip hop, east coast hip hop, jazz rap"
6RWhuPGp8HN9qpy9ofkd4x,Brooklyn (Owes The Charmer Under Me),Steely Dan,259066,1993-12-15,1993,0.495,0.635,0.481,5.82e-05,0.109,-11.991,0.0239,105.411,0.665,1.0,5.0,16,False,"album rock, classic rock, country rock, folk rock, mellow gold, rock, soft rock, yacht rock"
0DHtcpnbDfbNoYXO1YDX9o,Bodhisattva,Steely Dan,316666,1993-12-15,1993,0.113,0.523,0.757,0.0123,0.0219,-11.682,0.0429,109.749,0.787,1.0,0.0,16,False,"album rock, classic rock, country rock, folk rock, mellow gold, rock, soft rock, yacht rock"
1GJKB7GoNTDuyCC8UNPd3u,Mi Barquita de Madera,Las Hermanas Núñez,120485,1993-12-01,1993,0.62,0.798,0.463,0.00283,0.419,-7.665,0.0436,117.438,0.936,1.0,10.0,36,False,"mariachi, mexican rock-and-roll, ranchera"
3tqyCIt1CbDWwdFOJKirQW,Badlife,My Life With The Thrill Kill Kult,256573,1993-09-07,1993,9.26e-06,0.558,0.859,0.118,0.497,-9.583,0.0409,113.395,0.383,0.0,4.0,16,False,"electro-industrial, industrial, industrial metal, industrial rock"
5NztBU1j5kMteimPtm4bJ2,Baila Esta Cumbia,Selena,182000,1993-01-01,1993,0.511,0.71,0.645,5.2e-05,0.066,-9.546,0.139,182.714,0.775,1.0,0.0,18,False,"mexican pop, tejano"
5RGYrJcv4clGFe7Dfci1M0,The Blue Danube,"Johann Strauss II, Eugene Ormandy",526666,1993-06-08,1993,0.925,0.22,0.0575,0.805,0.104,-21.723,0.0363,179.57,0.153,1.0,2.0,22,False,"classical, late romantic era, operetta"
1RLbxcZM5xjOwJOMHfGwXd,Solo Se Que Fue En Marzo,Banda R-15,166986,1993-01-01,1993,0.51,0.874,0.499,0.0,0.204,-6.819,0.0427,110.546,0.966,1.0,10.0,32,False,"banda, duranguense, grupera, musica mexicana, musica nayarita, norteno, tecnobanda"
5ORadPjABFk3RexSRxpPZK,Blue Buddha,My Life With The Thrill Kill Kult,435666,1993-09-07,1993,0.00477,0.656,0.652,0.0062,0.0984,-10.093,0.0529,90.128,0.508,0.0,11.0,15,False,"electro-industrial, industrial, industrial metal, industrial rock"
4eXtCKD69R1JzTUMpQ3izs,Black Cow,Steely Dan,307813,1993-12-15,1993,0.189,0.479,0.304,0.0119,0.0494,-16.286,0.0593,188.148,0.583,1.0,2.0,15,False,"album rock, classic rock, country rock, folk rock, mellow gold, rock, soft rock, yacht rock"
2VdbkEyvcnNvTU4Tn1tL2v,Girl I've Been Hurt,Snow,252400,1993,1993,0.000272,0.668,0.649,0.0,0.0789,-11.821,0.0373,90.95,0.471,0.0,1.0,33,False,"canadian old school hip hop, reggae fusion"
1ZKkUSVMRY9E3BSVytpJCn,Bad Sneakers,Steely Dan,199893,1993-12-15,1993,0.522,0.699,0.357,0.0,0.0944,-14.078,0.0607,113.853,0.78,0.0,6.0,14,False,"album rock, classic rock, country rock, folk rock, mellow gold, rock, soft rock, yacht rock"
5Oa9Y6UI9QaC3magLZQhn2,The Boston Rag,Steely Dan,338906,1993-12-15,1993,0.0256,0.552,0.496,4.21e-05,0.0717,-12.17,0.0294,76.363,0.633,0.0,9.0,15,False,"album rock, classic rock, country rock, folk rock, mellow gold, rock, soft rock, yacht rock"
4lDO8725XUQFSf8QDiPpYS,"Ballade No. 1 in G Minor, Op. 23","Frédéric Chopin, Staffan Scheja",565560,1993-06-30,1993,0.98,0.314,0.124,0.882,0.0644,-20.559,0.0402,136.179,0.0523,0.0,7.0,17,False,"classical, early romantic era, polish classical"
4VNagrofo5iBKSTBaNNUD5,Black Friday,Steely Dan,221440,1993-12-15,1993,0.00672,0.544,0.667,0.00032,0.16,-13.183,0.0508,131.35,0.717,0.0,11.0,14,False,"album rock, classic rock, country rock, folk rock, mellow gold, rock, soft rock, yacht rock"
3r7r0vCwFRTClT6nUAsQTV,Bose,Banda Blanca,438973,1993-03-23,1993,0.338,0.866,0.663,2.15e-05,0.15,-13.558,0.0446,134.206,0.971,1.0,10.0,21,False,"musica hondurena, punta, punta rock"
4F9lWUCeY9iqehF4Po5QCO,Black Eyed Susan,Paul Westerberg,216333,1993-06-11,1993,0.637,0.611,0.463,0.301,0.354,-20.075,0.0352,120.903,0.787,1.0,8.0,14,False,"alternative country, alternative rock, power pop"
53tcojVMxLLiIaNSeypJb5,Bio Dimension,B12,353800,1993,1993,0.0263,0.615,0.565,0.44,0.088,-14.821,0.0475,122.841,0.0657,1.0,1.0,11,False,intelligent dance music
5USmjuwFMhRLoWF03AwttY,El Baile del Perrito,"Alfredo ""El Pulpo""",190746,1993,1993,0.00502,0.882,0.448,4.21e-05,0.0404,-11.902,0.068,140.113,0.911,0.0,7.0,33,False,"cumbia del sureste, musica campechana, tropical tecladista"
7LHE2wQAHfDSNiSYTUwVKU,Static Emotion,B12,148960,1993-03-29,1993,0.822,0.618,0.185,5.05e-05,0.117,-17.707,0.0411,105.911,0.0377,0.0,8.0,14,False,intelligent dance music
7Hr3mBvRtYNFqhPDAw6Uvp,"Bodhisattva - Live At The Santa Monica Civic Auditorium, CA / 1980",Steely Dan,464666,1993-12-15,1993,0.00766,0.446,0.684,0.0176,0.849,-13.026,0.0813,122.315,0.484,0.0,9.0,13,False,"album rock, classic rock, country rock, folk rock, mellow gold, rock, soft rock, yacht rock"
731793XQHjYQ3jikBpRw8n,Babylon Sisters,Steely Dan,347933,1993-12-15,1993,0.286,0.665,0.359,0.00437,0.066,-12.848,0.0542,61.049,0.524,0.0,10.0,13,False,"album rock, classic rock, country rock, folk rock, mellow gold, rock, soft rock, yacht rock"
5kgzRNJafEpPS6xUcn315u,Barrytown,Steely Dan,202333,1993-12-15,1993,0.509,0.644,0.59,0.0,0.201,-12.915,0.0317,126.463,0.896,1.0,9.0,14,False,"album rock, classic rock, country rock, folk rock, mellow gold, rock, soft rock, yacht rock"
2zlh5zxhAWTYxo4GOzUdRn,19 Naughty III - Remastered,Naughty By Nature,283640,1993,1993,0.0579,0.745,0.746,0.00021,0.0775,-7.592,0.318,101.502,0.521,1.0,7.0,20,True,"east coast hip hop, hip hop, new jersey rap"
5eeYgJRgpUIrgX9K8jgHyM,"Black Sabbath - Live at Pacific Amphitheater, Costa Mesa, CA - November 1992",Ozzy Osbourne,432160,1993-06-23,1993,0.000173,0.256,0.776,0.521,0.986,-10.801,0.0572,119.137,0.119,0.0,4.0,18,True,"album rock, alternative metal, birmingham metal, classic rock, glam metal, hard rock, metal, rock"
0cjKy6TG7dzVz5u4JRl5tZ,1 2 I Love You,The March Violets,187093,1993,1993,0.0196,0.594,0.854,0.0996,0.303,-11.328,0.0548,158.979,0.659,0.0,10.0,15,False,"deathrock, gothic rock"
5V1cVRZ49BxOfWWltnD4YU,Como Tu Decidas,Banda R-15,149920,1993-01-01,1993,0.535,0.583,0.479,0.0,0.0616,-7.63,0.373,191.947,0.972,1.0,0.0,28,False,"banda, duranguense, grupera, musica mexicana, musica nayarita, norteno, tecnobanda"
0bXO7OtXRjb5IlfgBipg4i,Las Tres Tumbas,Banda R-15,152786,1993-01-01,1993,0.588,0.608,0.528,1.54e-05,0.0293,-7.281,0.196,198.698,0.973,1.0,10.0,27,False,"banda, duranguense, grupera, musica mexicana, musica nayarita, norteno, tecnobanda"
4f43gPQmr8gE6evsaCiQmv,Blessed Be The Almighty,Garnett Silk,219493,1993,1993,0.0194,0.834,0.654,0.00466,0.099,-11.116,0.218,170.646,0.949,1.0,7.0,16,False,"dancehall, lovers rock, old school dancehall, reggae, roots reggae"
3rsctwxyd6Zs1fgPGOaXS4,Stella By Starlight,Frank Sinatra,199933,1993-10-10,1993,0.818,0.15,0.25,0.000248,0.368,-14.255,0.0387,85.367,0.116,1.0,7.0,28,False,"adult standards, easy listening, lounge"
1UsJjlq1P6kivReh86MYA3,La Banda Borracha,Banda R-15,162813,1993-01-01,1993,0.46,0.906,0.842,0.000439,0.0778,-7.122,0.164,111.376,0.952,1.0,5.0,26,False,"banda, duranguense, grupera, musica mexicana, musica nayarita, norteno, tecnobanda"
2IeM4N8dFf4JNZtYVu11Gk,Take Me Back,Andrae Crouch,252960,1993-08-17,1993,0.227,0.461,0.541,0.0,0.0932,-11.805,0.0327,128.442,0.666,1.0,1.0,32,False,"gospel, gospel r&b, jesus movement"
6gkXNt0pP1vPTMNCzXaK1C,Basic Emotion,B12,291266,1993,1993,0.809,0.813,0.275,0.501,0.0971,-16.43,0.0474,109.855,0.0378,1.0,8.0,11,False,intelligent dance music
5rBUuAPGWc6ldmatX7XpUH,If You Are But A Dream (with The Bobby Tucker Singers),"Frank Sinatra, Bobby Tucker Singers",183226,1993-10-05,1993,0.919,0.209,0.226,0.125,0.272,-15.961,0.0346,86.775,0.138,1.0,10.0,28,False,"adult standards, easy listening, lounge"
71auVoglNHivkiI85On08p,Ballade (1890/1903): Andantino con moto,"Claude Debussy, Paul Crossley",421133,1993,1993,0.985,0.207,0.00927,0.89,0.0726,-35.664,0.0392,66.504,0.0351,1.0,5.0,15,False,"classical, impressionism, post-romantic era"
2miB0iEQziDjF8pRQnTRIB,"Tripping Billies - Live at The Muse, Nantucket, MA - August 1993",Dave Matthews Band,285906,1993-11-09,1993,0.454,0.508,0.66,8.73e-06,0.69,-13.76,0.0374,121.191,0.745,0.0,11.0,21,False,"jam band, neo mellow, pop rock"
7BZzW5mZ3JLL1JxHsFCrwM,24 Deep,Brotha Lynch Hung,253800,1993-01-01,1993,0.0427,0.769,0.784,0.0,0.127,-9.038,0.324,89.638,0.89,0.0,4.0,44,True,"horrorcore, sacramento hip hop, west coast rap"
3BWgJkVh9Nkr94jAl2VrzL,2 Hard 4 the Fuckin' Radio,Mac Dre,296066,1993-11-29,1993,0.0204,0.949,0.707,6.91e-05,0.334,-7.136,0.281,100.072,0.678,0.0,10.0,33,False,"cali rap, hyphy, oakland hip hop, west coast rap"
4cf7GM8kOiqc0KwDn3GxRa,Both Sides of the Story - 2015 Remaster,Phil Collins,403920,1993-10-19,1993,0.0383,0.523,0.706,0.000112,0.0725,-6.91,0.0426,127.632,0.426,1.0,8.0,42,False,"rock drums, soft rock"
4dX48AhVF9gZv4a7MhAJSj,Brain On Ska,Mustard Plug,103840,1993-11-15,1993,0.000782,0.451,0.866,1.88e-05,0.155,-10.955,0.0456,183.839,0.915,1.0,11.0,31,False,"grand rapids indie, ska, ska punk"
1DXCKvUwlBAZJf9TuQweQb,Bad Timing - 2012 Remaster,Blue Rodeo,309973,1993-10-26,1993,0.474,0.576,0.411,3.3e-06,0.109,-8.158,0.0266,147.494,0.406,1.0,9.0,44,False,"canadian rock, country rock"
6Gf8mol1cgqSlNzE1mfQng,Blue Jeans - 2012 Remaster,Blur,234653,1993-05-10,1993,0.044,0.65,0.707,0.0,0.0859,-8.203,0.0275,106.545,0.78,0.0,1.0,37,False,"alternative rock, britpop, madchester, permanent wave, rock"
4M8k3O09ksiX6CTDWiDpEr,Between Sun & Moon - 2004 Remaster,Rush,277773,1993-09-28,1993,5.74e-05,0.511,0.931,0.00242,0.148,-5.816,0.047,122.001,0.524,1.0,7.0,28,False,"album rock, canadian metal, classic canadian rock, classic rock, hard rock, progressive rock, rock"
0ane2ZZlq61RuEkzEaJrtj,Back Fade,Brotha Lynch Hung,313160,1993-01-01,1993,0.0835,0.78,0.72,0.0,0.26,-8.222,0.265,87.314,0.678,0.0,11.0,23,True,"horrorcore, sacramento hip hop, west coast rap"
4f4Z7WfFepkjUV9tvMwWLT,Baddi Choufik Koul Yom,Mohamed Jamal,272253,1993,1993,0.58,0.57,0.41,0.0,0.193,-9.224,0.033,97.559,0.481,0.0,7.0,36,False,lebanese pop
4J0HROC9pT8Wdahp2M6gHO,Bendecida 2 - 2012 Remastered Version,Heroes Del Silencio,36480,1993-11-15,1993,0.857,0.49,0.383,0.0,0.356,-12.388,0.0582,106.758,0.225,1.0,10.0,40,False,"latin alternative, latin rock, musica aragonesa, rock en espanol, spanish rock"
03ykodt9LeVEeUu40NvrBF,20th Century,Brad,242440,1993-04-27,1993,0.0805,0.73,0.87,0.311,0.266,-10.012,0.0565,102.537,0.965,0.0,4.0,28,False,grunge
67ZZQeqWyR6fONDDQWsFNB,23 Beats Off,Fugazi,402520,1993-04-01,1993,0.0145,0.286,0.538,0.838,0.126,-8.369,0.0378,105.145,0.0622,0.0,11.0,24,False,"alternative rock, dc hardcore, noise pop, noise rock, post-hardcore, post-punk, punk"
0Er7mNOp3mvwvPzY5zWMZ6,Beautiful Mind - 2016 Remastered,The Verve,328373,1993-06-21,1993,0.183,0.286,0.497,0.74,0.116,-10.112,0.0307,78.222,0.117,0.0,11.0,27,False,"britpop, permanent wave, rock, shoegaze"
22FWMXQz6V3EdDZhdkpcj8,Banana,Alfredo Y Sus Teclados,227600,1993,1993,0.448,0.768,0.758,0.00107,0.129,-10.571,0.0317,125.67,0.828,1.0,0.0,33,False,"cumbia del sureste, tropical tecladista"
3R3hLQX2u6lZIORZQsJmtD,Can't Turn Back the Years - 2015 Remaster,Phil Collins,280506,1993-10-19,1993,0.477,0.645,0.194,0.0103,0.09,-13.32,0.0371,173.235,0.291,0.0,5.0,46,False,"rock drums, soft rock"
4MuwejxwcRuraRUTAlGuI4,Blue - Remastered 2016,The Verve,198613,1993-06-21,1993,2.21e-05,0.285,0.947,0.0956,0.19,-6.105,0.0536,168.078,0.5,0.0,11.0,28,False,"britpop, permanent wave, rock, shoegaze"
5AIcpQ7JFM3DZju7bPqb8t,5 Days in May - 2012 Remaster,Blue Rodeo,434053,1993-10-26,1993,0.43,0.56,0.437,0.00222,0.0885,-9.978,0.034,154.884,0.365,0.0,4.0,47,False,"canadian rock, country rock"
5mLIrVr1Py3AbEHzzUkV0Y,Besándote - Remastered 2001,Los Auténticos Decadentes,262066,1993,1993,0.461,0.705,0.828,1.01e-05,0.107,-4.867,0.0596,98.963,0.921,1.0,7.0,17,False,"argentine rock, latin alternative, latin rock, rock en espanol, ska argentino"
3XiH40FnMVBVjw8Nv7DHCx,Blue Skies,Tom Waits,133561,1993-02-01,1993,0.966,0.575,0.0241,0.0,0.143,-24.406,0.042,82.888,0.413,1.0,8.0,27,False,"folk, singer-songwriter"
7vJHgVyZ7R2geewKzP7FW5,Bendecida - 2012 Remastered Version,Heroes Del Silencio,358973,1993-11-15,1993,0.0273,0.566,0.925,0.0,0.275,-4.723,0.0327,106.043,0.672,1.0,9.0,36,False,"latin alternative, latin rock, musica aragonesa, rock en espanol, spanish rock"
5qSYRRnGgrxeEFuh83Mo3K,The Black Rider - 2023 Remaster,Tom Waits,200573,1993,1993,0.416,0.328,0.486,0.0,0.201,-11.997,0.031,82.304,0.49,1.0,0.0,22,False,"folk, singer-songwriter"
57epoi5Tab9SB8L5bdZBRF,Black Tie White Noise - 2003 Remaster,David Bowie,294440,1993-04-05,1993,0.0186,0.555,0.936,0.0,0.138,-7.029,0.151,161.966,0.577,1.0,1.0,24,False,"art rock, classic rock, glam rock, permanent wave, rock"
3ZYYnEBVTsMutqF8zDF5Vw,Popscene - 2012 Remaster,Blur,194786,1993-05-10,1993,0.000516,0.405,0.991,0.00161,0.34,-5.583,0.0971,169.856,0.441,1.0,2.0,41,False,"alternative rock, britpop, madchester, permanent wave, rock"
0x6kpr8Cq5Wyh1VZ6q5TYU,Skank By Numbers,Mustard Plug,153173,1993-11-15,1993,0.000554,0.449,0.778,0.000266,0.419,-13.004,0.103,199.227,0.909,1.0,0.0,28,False,"grand rapids indie, ska, ska punk"
2nA8ivIQo9p7L7RfCYW6Xe,Butterfly - 2016 Remastered,The Verve,399573,1993-06-21,1993,0.00471,0.328,0.67,0.339,0.118,-7.644,0.0344,169.997,0.312,1.0,2.0,22,False,"britpop, permanent wave, rock, shoegaze"
5at6w5HOcyYn86xPTa7ZbC,Blue Jeans - 2012 Remaster,Blur,234653,1993-05-10,1993,0.044,0.65,0.707,0.0,0.0859,-8.203,0.0275,106.545,0.78,0.0,1.0,25,False,"alternative rock, britpop, madchester, permanent wave, rock"
2W2z57Vk9bfcsxMCKnVFpv,Tecateando,Banda Sinaloense El Recodo,198200,1993-03-01,1993,0.462,0.863,0.447,0.197,0.0935,-11.681,0.0717,110.478,0.976,1.0,10.0,35,False,banda sinaloense
625ZeFcodKUzyo50EzHFpP,20 Buck Spin,Pentagram,260293,1993,1993,0.125,0.186,0.899,0.0243,0.224,-4.826,0.0734,103.256,0.448,1.0,1.0,19,False,"doom metal, sludge metal, stoner metal, stoner rock"
0j0XIyoBTQgvCSdyXoffjh,I Believe - 2006 Remaster,Robert Plant,274066,1993-05-25,1993,0.0271,0.508,0.784,0.0603,0.146,-7.789,0.0316,104.122,0.618,1.0,4.0,34,False,"album rock, art rock, blues rock, classic rock, hard rock, mellow gold, progressive rock, rock, singer-songwriter, uk americana"
6vEQb99X3hWD1nENGR6IoR,Bronchus 2,Autechre,213373,1993-11-29,1993,0.836,0.276,0.77,0.0962,0.118,-20.855,0.093,72.758,0.0336,0.0,10.0,21,False,"abstract, ambient techno, drill and bass, electronica, glitch, intelligent dance music, uk experimental electronic"
3FNuLtMZzowfYT7VtSjPzs,Big Stripey Lie - 2018 Remaster,Kate Bush,208413,1993-11-02,1993,0.000371,0.617,0.622,0.131,0.0758,-13.221,0.0447,110.262,0.578,1.0,7.0,21,False,"art pop, art rock, baroque pop, new wave pop, permanent wave, piano rock, singer-songwriter"
1hbrWgBsUV2SZcWNzdSCkD,Heart Shaped Box - 2013 Mix,Nirvana,278786,1993-09-21,1993,0.0962,0.284,0.567,0.00596,0.0867,-12.58,0.0537,202.013,0.495,1.0,1.0,35,False,"grunge, permanent wave, rock"
6Ma5guFqPFxpP5E3JJhgun,The Blue Danube Waltz,"Johann Strauss II, Wiener Staatsopernchor, Wiener Philharmoniker, Willi Boskovsky",477000,1993-01-01,1993,0.986,0.216,0.209,0.724,0.313,-15.431,0.0346,182.442,0.108,1.0,2.0,17,False,"classical, late romantic era, operetta"
5pZsN9IGLZAOYwxOET2v3G,Black Box Theme - 2023 Remaster,Tom Waits,161973,1993,1993,0.313,0.14,0.276,0.991,0.168,-16.616,0.0325,144.334,0.212,0.0,1.0,18,False,"folk, singer-songwriter"
6TF23qjJ82K7glU1SrVf8g,Going Back West,Boney M.,189066,1993-10-08,1993,0.00583,0.975,0.491,0.000252,0.0447,-12.988,0.0673,119.427,0.821,1.0,2.0,48,False,europop
14DncBYItdQnVt99xuAm96,Believe,Lenny Kravitz,294586,1993-03-09,1993,0.00529,0.445,0.589,0.0939,0.112,-6.924,0.0308,79.013,0.203,0.0,9.0,23,False,"permanent wave, rock"
2viDjuO3nDJ7w17Kn6UpYu,The Bridge - 2021 Remaster,Dan Forden,63346,1993-04-01,1993,0.0465,0.513,0.921,0.879,0.0799,-12.075,0.046,117.475,0.942,1.0,1.0,17,False,
1JVsEciUZKtji9oAC9LMz1,Chemical World - 2012 Remaster,Blur,393760,1993-05-10,1993,0.0372,0.312,0.816,8.53e-05,0.159,-7.527,0.0473,140.744,0.551,1.0,2.0,37,False,"alternative rock, britpop, madchester, permanent wave, rock"
2yIINfKM7FSllGaCFXNawR,Can't Turn Back the Years - 2015 Remaster,Phil Collins,280506,1993-10-19,1993,0.476,0.648,0.194,0.0102,0.09,-13.318,0.037,173.231,0.304,0.0,5.0,35,False,"rock drums, soft rock"
7yvBPrHqrMjSCBs8ICBIJe,Basta De Llamarme Así - Remasterizado 2008,Los Fabulosos Cadillacs,216160,1993-06-18,1993,0.871,0.475,0.139,1.8e-05,0.0532,-11.928,0.075,203.155,0.302,1.0,7.0,33,False,"argentine rock, latin alternative, latin pop, latin rock, rock en espanol, ska, ska argentino"
0yfbpCFr0ZGzqFa9YukLRu,Bullshit,Tha Alkaholiks,209000,1993-08-24,1993,0.0405,0.819,0.701,0.0,0.159,-7.839,0.239,95.712,0.453,1.0,2.0,14,True,"alternative hip hop, hardcore hip hop, hip hop"
76J6iClvhdPlYsaYNpTFYI,Nothing but Love - 2009 Remastered Version,Mr. Big,225773,1993-09-17,1993,0.299,0.465,0.57,0.0,0.29,-5.437,0.0294,142.326,0.472,1.0,4.0,40,False,"glam metal, hard rock"
0FoTV05MCN57vL22pPbeiw,Banks of the Ohio,Bill Monroe and Doc Watson,213240,1993-10-08,1993,0.976,0.542,0.283,0.000105,0.133,-14.777,0.0442,77.617,0.323,1.0,5.0,12,False,traditional bluegrass
3WP3OIYgTAnfFuiQBvgzgi,Silent Night,Boyz II Men,152333,1993-10-05,1993,0.924,0.226,0.121,1.6e-05,0.128,-19.706,0.0374,117.883,0.0683,1.0,2.0,21,False,"boy band, contemporary r&b, new jack swing, r&b, urban contemporary"
6GBv0Aff8k2XAiLcFBq8X8,Bow Down Mister - A Small Portion 2 B Polite Mix,Jesus Loves You,225333,1993-01-01,1993,0.0229,0.665,0.82,0.0,0.08,-9.817,0.0359,105.072,0.367,1.0,7.0,25,False,
4GfSs3JnDbAFAmS7yFH4OY,Biotech Is Godzilla - 2017 Remaster,Sepultura,112226,1993-10-19,1993,0.00309,0.546,0.998,1.08e-06,0.295,-4.639,0.172,118.393,0.0344,0.0,5.0,23,False,"alternative metal, brazilian groove metal, brazilian metal, brazilian thrash metal, death metal, deathrash, groove metal, hard rock, latin metal, metal, metal mineiro, nu metal, old school thrash, speed metal, thrash metal"
127M7vBbwxeCHO6AEQkMNx,Sunday Sunday - 2012 Remaster,Blur,158360,1993-05-10,1993,0.00318,0.342,0.857,0.0,0.354,-5.985,0.0456,118.645,0.857,1.0,7.0,38,False,"alternative rock, britpop, madchester, permanent wave, rock"
6N4IR3JBzT9cjsq6hdSXnH,Bailongo,"Alfredo ""El Pulpo""",205040,1993,1993,0.0368,0.752,0.76,0.0301,0.216,-9.02,0.0394,135.59,0.96,1.0,2.0,25,False,"cumbia del sureste, musica campechana, tropical tecladista"
4sNTDiLygCF0NAo3vDqhY2,Bu Gün Bayram,Barış Manço,155426,1993-12-01,1993,0.583,0.475,0.452,0.0,0.227,-13.987,0.0414,96.906,0.677,1.0,0.0,39,False,"anadolu rock, turkish instrumental, turkish psych, turkish rock"
65dgNhprxnVcHwXnBe8Cjx,Breakdown,The London Suede,364158,1993,1993,0.618,0.333,0.416,0.0141,0.0801,-9.316,0.029,131.945,0.102,1.0,8.0,11,False,"britpop, glam rock"
7lQWpAFPEeiseTDNPlBV9n,Buena - 2022 Remaster,Morphine,199709,1993-09-14,1993,0.0468,0.535,0.538,0.208,0.125,-11.202,0.0476,96.345,0.576,0.0,10.0,16,False,boston rock
5IFQKC3Z77NCzTwMBZLgU7,Give Me Central 209,Lightnin' Hopkins,177421,1993-05-24,1993,0.935,0.611,0.334,0.00619,0.116,-11.701,0.0325,68.872,0.401,0.0,10.0,28,False,"acoustic blues, blues, country blues, delta blues, texas blues, traditional blues"
7FjE4SMmOoR0Nj17Q9QK4M,Just The Right Bullets - 2023 Remaster,Tom Waits,215146,1993,1993,0.633,0.407,0.635,0.000357,0.47,-11.661,0.0485,116.374,0.719,0.0,5.0,26,False,"folk, singer-songwriter"
5nGuwdPZAuTN3DMS7yVViz,Jump They Say - 2003 Remaster,David Bowie,265333,1993-04-05,1993,0.00062,0.541,0.913,0.000142,0.0244,-7.366,0.0523,125.992,0.624,1.0,10.0,30,False,"art rock, classic rock, glam rock, permanent wave, rock"
5q4dfOveseWLyR1nOwKN6l,Berita Kepada Kawan,Ebiet G. Ade,339568,1993-08-01,1993,0.404,0.55,0.321,0.0,0.354,-11.113,0.0328,143.602,0.365,1.0,2.0,52,False,"dangdut, indonesian pop rock"
60cS1aPQABn0IlS8xDLA6X,Call It What U Want,"Above The Law, 2Pac, MONEY B",273533,1993-02-02,1993,0.0386,0.863,0.811,0.0,0.208,-7.592,0.254,98.522,0.706,1.0,2.0,22,True,"g funk, west coast rap"
3I8A8mlIveYwigESQML8ti,Can You Forgive Her? - 2018 Remaster,Pet Shop Boys,234146,1993,1993,0.0293,0.501,0.882,3.82e-06,0.219,-5.794,0.0467,173.477,0.724,0.0,11.0,45,False,"dance rock, new romantic, new wave, new wave pop, permanent wave, synthpop"
7ccnmscF6xvw5XPD6xAdYz,Why Should I Love You? - 2018 Remaster,Kate Bush,302626,1993-11-02,1993,0.413,0.599,0.492,0.0449,0.183,-15.615,0.0369,119.407,0.758,1.0,8.0,30,False,"art pop, art rock, baroque pop, new wave pop, permanent wave, piano rock, singer-songwriter"
3SMRBHOIKsUuP7PqPkQRMT,Bone Bag - 2012 Remaster,Blur,244386,1993-05-10,1993,6.67e-05,0.373,0.492,0.0264,0.16,-9.194,0.0273,181.986,0.536,1.0,9.0,18,False,"alternative rock, britpop, madchester, permanent wave, rock"
1Hz0DpjQRPcXG137VLrgHR,Badgeman Brown - 2012 Remaster,Blur,288160,1993-05-10,1993,0.00787,0.246,0.813,0.000149,0.111,-6.716,0.052,140.485,0.233,1.0,4.0,18,False,"alternative rock, britpop, madchester, permanent wave, rock"
5YXqRPCnkBUc54tofQkOna,Biển Tình,Hương Lan,215200,1993-06-25,1993,0.773,0.477,0.565,4.31e-05,0.342,-8.999,0.0306,91.97,0.514,1.0,11.0,18,False,"vietnamese bolero, vietnamese pop"
7JO6HyvaVrwlfjFoljqIaT,"Bruch: Violin Concerto No. 1 in G Minor, Op. 26: I. Prelude. Allegro moderato","Max Bruch, Maxim Vengerov, Kurt Masur, Gewandhausorchester",489533,1993-12-01,1993,0.893,0.237,0.138,0.162,0.122,-18.672,0.0407,112.949,0.108,1.0,3.0,17,False,"classical, german romanticism, late romantic era"
16ekLxouvHDMlRqPmoLOD0,Head Over Heels - 2012 Remaster,Blue Rodeo,242733,1993-10-26,1993,0.202,0.629,0.871,9.8e-05,0.147,-5.224,0.0296,136.677,0.898,1.0,9.0,41,False,"canadian rock, country rock"
6Rl7bI0f22xipMeYxZaSU7,Start Choppin - 2019 Remaster,Dinosaur Jr.,338253,1993-02-09,1993,0.00314,0.387,0.675,0.00119,0.0839,-9.761,0.0852,111.84,0.541,1.0,2.0,33,False,"alternative rock, lo-fi, noise pop, noise rock, permanent wave, power pop, shoegaze, slacker rock"
0NQ61HS437hTIsl57U0GNw,Don't Let It Go to Your Head,The Brand New Heavies,231093,1993-01-01,1993,0.419,0.686,0.524,0.000496,0.053,-16.344,0.0381,108.053,0.708,1.0,5.0,25,False,acid jazz
67xLyaYtxkVqbByPSOKMuI,Back n da Hood,Mac Dre,325453,1993,1993,0.0133,0.705,0.797,0.000411,0.421,-6.937,0.274,98.425,0.705,0.0,1.0,10,False,"cali rap, hyphy, oakland hip hop, west coast rap"
7aXY2lRxkHoBUNkSebg5Ol,Lily - 2018 Remaster,Kate Bush,233013,1993-11-02,1993,0.52,0.556,0.585,0.000356,0.183,-13.437,0.0442,146.752,0.595,0.0,7.0,32,False,"art pop, art rock, baroque pop, new wave pop, permanent wave, piano rock, singer-songwriter"
3GsS8jzoixpCnp4jDWCEvb,2 Da Beat Ch'yall,Kris Kross,221200,1993-08-03,1993,0.00276,0.859,0.741,0.0,0.325,-12.329,0.271,98.082,0.529,0.0,11.0,14,False,"gangster rap, hardcore hip hop, hip hop, hip pop, miami bass, old school atlanta hip hop"
