id,name,artists,duration_ms,release_date,year,acousticness,danceability,energy,instrumentalness,liveness,loudness,speechiness,tempo,valence,mode,key,popularity,explicit,genre
25cUhiAod71TIQSNicOaW3,Adorn,Miguel,193146,2012-09-28,2012,0.0543,0.625,0.576,4.07e-05,0.187,-5.693,0.175,179.063,0.235,0.0,11.0,71,False,"r&b, urban contemporary"
54MXF9I8s3DuiQo3g0gZ5k,A Match Into Water,Pierce The Veil,212546,2012-07-17,2012,0.0002,0.371,0.979,3.67e-06,0.516,-2.701,0.144,196.058,0.473,1.0,1.0,72,True,"modern rock, pop punk, screamo"
3poJLRLGViMX3gicX9UYtD,Advice,Alex G,157973,2012-11-05,2012,0.000183,0.356,0.611,0.867,0.127,-5.71,0.0289,170.069,0.272,1.0,10.0,68,False,"philly indie, pov: indie, slacker rock"
6XD3HMATLswheYevIfKkSi,All Over The Road,Easton Corbin,163066,2012-01-01,2012,0.0471,0.492,0.841,0.0,0.0886,-3.579,0.0421,199.849,0.722,1.0,5.0,64,False,"contemporary country, country, country road"
1hJXpII24ReABFg8Ig6k7w,Abbey,Mitski,166706,2012-01-31,2012,0.835,0.287,0.203,0.0,0.128,-9.117,0.0396,75.663,0.238,1.0,11.0,69,False,"brooklyn indie, pov: indie"
4P6BuLsqtg5uISdE77ypI9,Ayy Ladies (feat. Tyga),"Travis Porter, Tyga",211293,2012-05-28,2012,0.096,0.905,0.782,0.0,0.0623,-3.604,0.164,96.055,0.798,0.0,10.0,65,True,"atl hip hop, dirty south rap, futuristic swag, southern hip hop, trap"
7a86XRg84qjasly9f6bPSD,We Are Young (feat. Janelle Monáe),"fun., Janelle Monáe",250626,2012-02-21,2012,0.02,0.378,0.638,7.66e-05,0.0849,-5.576,0.075,184.086,0.735,1.0,10.0,74,False,"baroque pop, metropopolis, neo mellow"
14EORgkbXqIx5K4Haucmnb,Absolute Zero,Stone Sour,229840,2012-10-17,2012,0.000108,0.552,0.988,0.309,0.846,-2.555,0.0787,139.941,0.619,0.0,1.0,65,True,"alternative metal, nu metal, post-grunge"
0Ot6e3wYVQQ1Us9PM977jE,A Little Death,The Neighbourhood,209706,2012-12-18,2012,0.0026,0.53,0.763,1.86e-06,0.105,-4.712,0.0332,88.013,0.338,0.0,6.0,69,False,"modern alternative rock, modern rock, pop"
1fOkmYW3ZFkkjIdOZSf596,Pink Matter,"Frank Ocean, André 3000",268813,2012-07-10,2012,0.951,0.392,0.233,0.000322,0.106,-11.012,0.0587,176.569,0.494,0.0,11.0,79,True,"lgbtq+ hip hop, neo soul"
3e0yTP5trHBBVvV32jwXqF,Anna Sun,WALK THE MOON,321280,2012-06-19,2012,0.00173,0.472,0.844,0.0,0.24,-6.578,0.054,140.034,0.34,1.0,10.0,59,False,"dance rock, modern alternative rock, modern rock, neo mellow, pop rock"
0d0jsoba88SpOoFxCxA2rZ,The Art of Peer Pressure,Kendrick Lamar,324533,2012,2012,0.285,0.555,0.611,0.00106,0.273,-9.216,0.356,94.939,0.409,0.0,10.0,57,True,"conscious hip hop, hip hop, rap, west coast rap"
2FqoR7diymD1Eh7cVb3DMg,Algo Me Gusta De Ti,"Wisin & Yandel, Chris Brown, T-Pain",274946,2012-01-01,2012,0.00291,0.626,0.769,0.0,0.0598,-5.296,0.0325,127.949,0.237,0.0,11.0,71,False,"electro latino, reggaeton, trap latino, urbano latino"
6QFCMUUq1T2Vf5sFUXcuQ7,Beauty And A Beat,"Justin Bieber, Nicki Minaj",227986,2012-01-01,2012,0.000704,0.601,0.843,5.27e-05,0.0681,-4.87,0.0593,128.002,0.534,1.0,0.0,80,False,"canadian pop, pop"
75lo8VozcCLRG9WGG674iD,As Long As You Love Me,"Justin Bieber, Big Sean",229466,2012-01-01,2012,0.0807,0.571,0.873,0.0,0.361,-3.382,0.0997,139.691,0.613,0.0,0.0,66,False,"canadian pop, pop"
7J8D1BVioYBaKFUnDAHTak,Another Way Out,Hollywood Undead,167666,2012-01-01,2012,0.000108,0.563,0.946,0.00512,0.118,-5.72,0.0548,149.966,0.652,1.0,9.0,61,False,"alternative metal, modern rock, post-grunge, rap metal, rap rock"
1vNn7rVQT6UtEW1NGH53fT,All Night Longer,Sammy Adams,177093,2012-08-20,2012,0.000652,0.712,0.649,0.0,0.0683,-4.753,0.063,127.028,0.616,1.0,1.0,55,True,indie pop rap
3n69hLUdIsSa1WlRmjMZlW,Breezeblocks,alt-J,227080,2012-09-18,2012,0.096,0.615,0.658,0.000911,0.205,-7.299,0.0343,150.093,0.293,1.0,5.0,69,False,"indie rock, indietronica, modern alternative rock, modern rock, rock"
4HuiEuJ7ZW8jewUuZBg6sk,Sarah,Alex G,176146,2012-11-05,2012,0.513,0.65,0.686,0.000189,0.138,-5.198,0.0314,124.019,0.497,0.0,4.0,73,False,"philly indie, pov: indie, slacker rock"
0Hf4aIJpsN4Os2f0y0VqWl,Feel This Moment (feat. Christina Aguilera),"Pitbull, Christina Aguilera",229506,2012,2012,0.039,0.673,0.758,0.0,0.341,-3.632,0.158,135.956,0.542,1.0,7.0,79,False,"dance pop, miami hip hop, pop"
2fhrh50AOgPHwm7o0OPQ0a,Aquí En Mi Corazón Tu Mandas,Lalo El Gallo Elizalde,126893,2012-01-04,2012,0.528,0.834,0.528,2.91e-06,0.0386,-5.329,0.0567,121.113,0.979,1.0,0.0,62,False,"classic sierreno, norteno"
4p9iQNEmsIGkB6eG8Val8n,Mary,Alex G,197733,2012-11-05,2012,0.0497,0.693,0.467,0.452,0.107,-9.558,0.043,105.955,0.402,0.0,4.0,73,True,"philly indie, pov: indie, slacker rock"
1YzIpqwnj5M8qylwn1Tr9Z,Keep The Wolves Away,Uncle Lucius,275520,2012-08-28,2012,0.52,0.683,0.351,0.000593,0.11,-10.276,0.0318,122.212,0.144,0.0,1.0,72,False,"classic texas country, modern southern rock, roots rock"
42zd6DYQ4o4SECmTITrM1U,Dreams and Nightmares,Meek Mill,230693,2012-10-26,2012,0.468,0.631,0.774,0.0,0.281,-2.459,0.3,79.745,0.44,1.0,11.0,70,True,"hip hop, philly rap, pop rap, rap, southern hip hop, trap"
3oyMHCAAcnWFdcGuVgwfhd,A Woman Like You,Lee Brice,209786,2012-04-24,2012,0.245,0.592,0.584,0.0,0.0862,-7.422,0.0305,160.048,0.371,1.0,7.0,56,False,"contemporary country, country, country road, modern country rock"
6VObnIkLVruX4UVyxWhlqm,Skyfall,Adele,286480,2012-10-04,2012,0.417,0.346,0.552,0.0,0.114,-6.864,0.0282,75.881,0.0789,0.0,0.0,86,False,"british soul, pop, pop soul, uk pop"
1IT0WQk5J8NsaeII8ktdlZ,King For A Day,"Pierce The Veil, Kellin Quinn",236293,2012-07-17,2012,3.81e-05,0.403,0.965,0.000276,0.341,-2.238,0.0964,112.363,0.431,1.0,6.0,76,True,"modern rock, pop punk, screamo"
3IeJGGgaWesi692BFR4dc0,Animals,Alex G,173053,2012-11-05,2012,0.218,0.615,0.544,0.55,0.0908,-5.807,0.0372,135.929,0.225,1.0,0.0,54,False,"philly indie, pov: indie, slacker rock"
1KxwZYyzWNyZSRyErj2ojT,Let Her Go,Passenger,252733,2012-08-28,2012,0.365,0.479,0.545,0.0,0.0963,-7.346,0.0688,74.897,0.243,1.0,7.0,74,False,"folk-pop, neo mellow"
0pwYLVXVknPSGUQb39cePC,As Long As You Love Me,"Justin Bieber, Big Sean",229466,2012-06-15,2012,0.0811,0.571,0.873,0.0,0.361,-3.382,0.1,139.691,0.613,0.0,0.0,65,False,"canadian pop, pop"
06WohfoFEUa5faNy8f9S5N,Adrenalize,In This Moment,255773,2012-08-14,2012,0.00023,0.465,0.96,0.0,0.129,-3.888,0.0787,132.013,0.433,1.0,6.0,57,False,"alternative metal, nu metal, post-grunge"
7C7yqFTM0ncyJ04GIKrxdV,Anything Could Happen,Ellie Goulding,286322,2012-01-01,2012,0.433,0.702,0.781,0.0,0.135,-4.081,0.03,102.997,0.382,1.0,0.0,55,False,"indietronica, metropopolis, pop, uk pop"
63w0QA1wiV7QhF9jeiHETF,Angel Eyes,Love and Theft,186626,2012-07-24,2012,0.0134,0.656,0.696,0.0,0.0753,-5.917,0.0261,108.015,0.966,1.0,8.0,55,False,"contemporary country, country road"
1L8RiMflaEtWqg6GtRQNAF,Algo Más,La Quinta Estacion,266040,2012-08-07,2012,0.449,0.565,0.642,0.0,0.701,-6.294,0.0516,149.731,0.433,1.0,5.0,55,False,"latin arena pop, latin pop, spanish pop rock"
0d8ONGx43ZprlHlmLZODpD,"Analog 2 (feat. Tyler, The Creator, Frank Ocean & Sydney Bennett)","Odd Future, Tyler, The Creator, Frank Ocean, Syd",276386,2012-03-16,2012,0.229,0.599,0.673,3.77e-05,0.066,-8.363,0.566,148.044,0.262,1.0,1.0,56,True,underground hip hop
1q3RiD1tIWUpGsNFADMlvl,All Too Well,Taylor Swift,327893,2012-10-22,2012,0.0382,0.602,0.609,0.0002,0.127,-7.803,0.0243,93.06,0.337,1.0,0.0,54,False,pop
4ff1q6L0CZ3nf3LKJ1O7lY,16 Mirrors,Alex G,87093,2012-11-05,2012,0.638,0.564,0.3,0.0022,0.101,-7.349,0.0887,121.888,0.0487,1.0,2.0,71,False,"philly indie, pov: indie, slacker rock"
5SXsXjVJCWeJuf7FHvgBYR,The Avengers,Alan Silvestri,123360,2012-01-01,2012,0.606,0.25,0.553,0.673,0.145,-8.188,0.0429,118.985,0.226,1.0,7.0,60,False,"orchestral soundtrack, soundtrack"
3EKh7JNsBrGoh2xqPotBKT,Hell Above,Pierce The Veil,223546,2012-07-17,2012,0.000463,0.48,0.977,2.82e-06,0.355,-1.993,0.117,129.999,0.331,1.0,6.0,69,False,"modern rock, pop punk, screamo"
3kjDI9GpW9DpD3oixUviV4,A Pirate Looks At Forty,"Jack Johnson, Dave Matthews, Tim Reynolds",232066,2012-01-01,2012,0.732,0.352,0.275,5.01e-05,0.825,-14.341,0.0357,203.968,0.336,1.0,7.0,55,False,neo mellow
0LFcFGLYTX6UmeIdO7NVd7,Ali Bomaye,"The Game, 2 Chainz, Rick Ross",372706,2012-01-01,2012,0.0209,0.381,0.69,0.0,0.438,-5.312,0.455,78.239,0.223,0.0,10.0,60,True,"detroit hip hop, gangster rap, hip hop, pop rap, rap, southern hip hop, trap"
1tQsbO9e25DNPCmZhbCB26,A Part Of Me (feat. Laura Whiteside),Neck Deep,189415,2012-09-11,2012,0.328,0.429,0.822,6.58e-06,0.0841,-1.527,0.0498,130.024,0.243,1.0,4.0,61,False,"pop punk, uk pop punk"
179TZwPk0txEvjkraVTVKo,El Precio De La Soledad,Alfredo Olivas,186360,2012-10-15,2012,0.129,0.715,0.846,2.57e-06,0.084,-3.665,0.18,95.426,0.909,1.0,10.0,77,False,"banda, corrido, musica mexicana, norteno, sad sierreno, sierreno"
59tUXZ9dL0qkaa18WCfUnZ,Am I The Only One,Dierks Bentley,191253,2012-01-01,2012,0.29,0.579,0.878,0.0,0.789,-5.396,0.145,165.972,0.88,1.0,2.0,53,False,"contemporary country, country, country road"
591nHHHzZl1NLt9PMKpinM,I Could Be The One (Avicii Vs. Nicky Romero) - Radio Edit,"Avicii, Nicky Romero",208320,2012-01-01,2012,0.332,0.509,0.79,6.67e-05,0.316,-3.782,0.0374,127.946,0.638,0.0,6.0,62,False,"dance pop, edm, pop, pop dance"
4eYaDRhiL5iesFp2EuoODr,A Thousand Years,The Piano Guys,275973,2012,2012,0.989,0.23,0.217,0.892,0.0844,-13.464,0.0386,157.084,0.156,1.0,10.0,52,False,bow pop
190jyVPHYjAqEaOGmMzdyk,Beauty And A Beat,"Justin Bieber, Nicki Minaj",227986,2012-06-15,2012,0.000688,0.602,0.843,5.27e-05,0.0682,-4.831,0.0593,128.003,0.526,1.0,0.0,75,False,"canadian pop, pop"
1llY5gzWqdAjm1Hscr4kwn,Mis,Alex G,200680,2012-01-15,2012,0.804,0.536,0.328,0.318,0.165,-11.404,0.034,61.204,0.105,1.0,0.0,68,False,"philly indie, pov: indie, slacker rock"
2wcbC2ViEAKUjCx4pz1q6J,Anastasio Pacheco,"Chalino Sanchez, Los Amables Del Norte",208956,2012-01-16,2012,0.659,0.485,0.49,6.64e-05,0.0846,-8.229,0.0766,189.919,0.903,1.0,5.0,56,False,"banda, corrido, corridos clasicos, musica mexicana, norteno, sierreno"
1bKRtH1leT7y003VikaXUc,Anthem Of The Lonely,Nine Lashes,241719,2012-01-01,2012,0.000364,0.348,0.972,0.0,0.119,-3.144,0.0951,196.213,0.652,0.0,10.0,58,False,"christian alternative rock, christian rock"
1mKXFLRA179hdOWQBwUk9e,Just Give Me a Reason (feat. Nate Ruess),"P!nk, Nate Ruess",242733,2012-09-18,2012,0.344,0.778,0.547,0.000306,0.132,-7.273,0.0489,95.0,0.442,1.0,2.0,85,False,"dance pop, pop"
3q2v8QaTnHLveAQzR6gvYm,"Sing About Me, I'm Dying Of Thirst",Kendrick Lamar,723573,2012,2012,0.303,0.654,0.753,8.25e-05,0.13,-7.556,0.398,110.699,0.371,0.0,8.0,64,True,"conscious hip hop, hip hop, rap, west coast rap"
2t0Ci12vaJaYzEmsJL2S1X,All I Want Is You,Barry Louis Polisar,157623,2012-07-02,2012,0.38,0.692,0.395,0.0,0.0634,-11.434,0.0416,90.378,0.746,1.0,7.0,54,False,
2Y5pjQMzAQ5QpBazHrzhqP,Amor Express,Banda Sinaloense MS de Sergio Lizárraga,187333,2012-01-01,2012,0.659,0.739,0.577,0.0,0.098,-7.014,0.0383,132.829,0.961,1.0,10.0,62,False,banda
3JMAdPq5TUOKBGsTATjLEH,American Dream,MKTO,225746,2012,2012,0.114,0.554,0.767,0.0,0.231,-5.043,0.0497,122.846,0.497,1.0,0.0,56,False,"pop, post-teen pop"
5gCBDJVkU7XHkh4b9i43hn,Mine All Mine,Kolton Moore & the Clever Few,181560,2012,2012,0.56,0.534,0.336,0.0,0.0956,-10.038,0.0286,149.671,0.354,1.0,8.0,65,False,red dirt
78JKJfKsqgeBDBF58gv1SF,Hands on the Wheel (feat. Asap Rocky),"ScHoolboy Q, A$AP Rocky",197131,2012-01-14,2012,0.0166,0.646,0.784,0.0,0.0721,-7.471,0.108,127.839,0.179,0.0,1.0,69,True,"gangster rap, hip hop, pop rap, rap, southern hip hop, trap"
2ThDyuLg8XDB0UtEEOLe7t,Mi Amigo el de Arriba,Los Inquietos Del Norte,146466,2012-03-26,2012,0.417,0.721,0.801,1.31e-06,0.0739,-7.058,0.0648,122.327,0.649,1.0,7.0,68,False,"banda, corrido, musica mexicana, norteno, sierreno"
7hn8Q8WAxFdL4aZ159GI7C,A Thousand Years (feat. Steve Kazee) - Pt. 2; The Twilight Saga: Breaking Dawn Soundtrack,"Christina Perri, Steve Kazee",305893,2012-11-09,2012,0.618,0.272,0.281,0.0,0.111,-8.131,0.0307,138.856,0.152,1.0,10.0,61,False,pop
4bcQ8zBC5hG7wp3ZKtnLlB,Adam,Alex G,108026,2012-11-05,2012,0.781,0.654,0.444,0.899,0.134,-9.918,0.0393,111.101,0.301,1.0,7.0,49,False,"philly indie, pov: indie, slacker rock"
1rUQmXEy41tXwHIKFECNTa,Wide Awake,Katy Perry,220933,2012-01-01,2012,0.0843,0.511,0.68,6.73e-06,0.502,-5.103,0.0359,160.04,0.557,1.0,5.0,73,False,pop
4esOae7i4rqTbAu9o5Pxco,Girl on Fire,Alicia Keys,224920,2012-11-18,2012,0.135,0.482,0.706,0.00106,0.105,-5.762,0.0607,92.513,0.144,1.0,9.0,76,False,"neo soul, pop, r&b"
3zsRP8rH1kaIAo9fmiP4El,Angels,The xx,171653,2012-09-10,2012,0.95,0.424,0.157,0.0593,0.101,-18.141,0.0428,91.537,0.342,1.0,9.0,61,False,"downtempo, dream pop, indietronica"
1kFi7TFCs6yBaIcQN06NIb,Cowboys and Angels,Dustin Lynch,227720,2012-08-21,2012,0.245,0.355,0.55,3.2e-05,0.0979,-5.772,0.0285,73.842,0.26,1.0,10.0,63,False,"contemporary country, country, country road, modern country rock"
59bx5emG4yTKWzAxwxgrKv,Answer to No One (feat. JJ Lawhorn),"Colt Ford, JJ Lawhorn",212924,2012-08-07,2012,0.187,0.468,0.874,0.0,0.0718,-4.45,0.0992,79.988,0.523,0.0,7.0,50,False,"contemporary country, country, country rap, country road, redneck"
0vFMQi8ZnOM2y8cuReZTZ2,Blown Away,Carrie Underwood,240133,2012-05-01,2012,0.0909,0.531,0.843,0.0,0.0283,-2.569,0.0429,136.991,0.392,0.0,9.0,62,False,"classic oklahoma country, contemporary country, country, country dawn, dance pop, pop"
0bPiyfCmBIWqDDQZ6KqFXu,Change,Alex G,124333,2012-11-05,2012,0.961,0.667,0.314,0.78,0.108,-14.966,0.0479,92.384,0.322,0.0,9.0,66,False,"philly indie, pov: indie, slacker rock"
0T43CFyDADeg19VaUdXORY,Alta Y Delgadita,Lalo El Gallo Elizalde,150333,2012-01-04,2012,0.67,0.777,0.686,2.46e-05,0.282,-4.235,0.0512,128.947,0.978,1.0,7.0,53,False,"classic sierreno, norteno"
0VwNdo84DaVYLIkbVO86ND,We Are Never Ever Getting Back Together,Taylor Swift,193146,2012-10-22,2012,0.00957,0.628,0.676,2.65e-05,0.121,-5.911,0.0916,85.984,0.75,1.0,7.0,71,False,pop
2SHnUyZq0zwmvRIl4WY77G,Alive,Krewella,290760,2012-06-18,2012,0.00413,0.663,0.822,0.00318,0.234,-2.909,0.0557,128.002,0.567,1.0,9.0,52,False,"edm, electra, electro house, pop dance"
61aPpbJMAD5BjWkiHeX9R6,Inténtalo (feat. América Sierra & El Bebeto),"3BallMTY, América Sierra, El Bebeto",193533,2012-01-01,2012,0.215,0.792,0.917,3.28e-05,0.061,-5.01,0.0686,131.895,0.966,1.0,9.0,68,False,trival
5oJrV0mGkw9dilk96X3W0c,Adrenaline,Shinedown,206226,2012-03-23,2012,5.17e-05,0.467,0.986,9.21e-05,0.291,-2.69,0.0634,159.935,0.4,1.0,9.0,49,False,"alternative metal, nu metal, post-grunge"
7qU7vhCPKhkDiJYGoboISc,Apocalypse Dreams,Tame Impala,356946,2012-01-01,2012,0.249,0.496,0.929,0.131,0.0677,-2.279,0.0503,127.998,0.267,1.0,8.0,54,False,"australian psych, modern rock, neo-psychedelic, rock"
3suf1WpGLuPpq2DXkkmyK5,Forever,Alex G,149640,2012-11-05,2012,0.611,0.644,0.569,0.912,0.219,-8.911,0.041,85.001,0.787,1.0,9.0,65,False,"philly indie, pov: indie, slacker rock"
4Sfa7hdVkqlM8UW5LsSY3F,Take a Walk,Passion Pit,264493,2012-07-23,2012,0.0338,0.566,0.755,0.0,0.315,-5.526,0.0368,101.006,0.445,1.0,11.0,64,False,"indie rock, indietronica, modern rock, neo-synthpop, shimmer pop"
0725YWm6Z0TpZ6wrNk64Eb,Super Rich Kids,"Frank Ocean, Earl Sweatshirt",304760,2012-07-10,2012,0.219,0.739,0.419,0.0,0.196,-8.241,0.0854,60.493,0.58,0.0,3.0,76,True,"lgbtq+ hip hop, neo soul"
7wfCiX59FY09gsKKFhYfxp,American,Lana Del Rey,248907,2012-11-12,2012,0.535,0.397,0.585,0.000438,0.0976,-6.518,0.0359,143.983,0.18,1.0,7.0,48,False,"art pop, pop"
2nvXyajLAAV9Iwy8K9EbUd,National Anthem,Lana Del Rey,230533,2012-01-01,2012,0.566,0.533,0.901,0.000147,0.102,-6.008,0.24,84.959,0.432,0.0,0.0,64,False,"art pop, pop"
0uLwWjN1KFO678WNJcZDkw,Llévame Contigo,Romeo Santos,226400,2012-08-27,2012,0.602,0.813,0.694,1.37e-06,0.0919,-5.092,0.0319,119.079,0.92,0.0,7.0,75,False,"bachata, latin hip hop, latin pop, trap latino, urbano latino"
6Ymvlzom4TQeoKqAWsZRD8,Somethin' 'Bout A Truck,Kip Moore,213826,2012-01-01,2012,0.0697,0.554,0.794,0.0,0.63,-5.417,0.035,176.01,0.79,1.0,11.0,67,False,"contemporary country, country, country road, modern country rock"
5Yf9nkFp0JoR6V048LfnbG,Alguien,Kany García,183600,2012-07-30,2012,0.625,0.426,0.487,0.0,0.126,-6.703,0.039,55.395,0.342,1.0,7.0,61,False,"latin pop, puerto rican pop"
1M0g1beKC4H9gbrOiSayHW,National Anthem,Lana Del Rey,230520,2012-11-12,2012,0.531,0.532,0.899,0.000146,0.0957,-5.935,0.244,85.0,0.436,0.0,0.0,62,False,"art pop, pop"
5T7euBIHxQ6HwkU0FVjhT3,Apenas Te Fuiste Ayer,Lalo El Gallo Elizalde,136853,2012-01-04,2012,0.681,0.46,0.479,4.36e-06,0.187,-3.632,0.105,195.536,0.97,1.0,7.0,52,False,"classic sierreno, norteno"
252UPuQsncbBFhTrx4Ytcc,La Diabla,Romeo Santos,239026,2012-08-27,2012,0.461,0.859,0.747,1.14e-06,0.34,-4.176,0.0623,124.966,0.882,1.0,0.0,75,False,"bachata, latin hip hop, latin pop, trap latino, urbano latino"
2oAlRe4XfVRm3LOOHiErdD,Cuernito Armani,El Komander,183797,2012,2012,0.139,0.792,0.65,4.25e-06,0.12,-6.076,0.051,114.816,0.84,1.0,8.0,70,False,"banda, corrido, musica mexicana, norteno, sierreno"
5JLv62qFIS1DR3zGEcApRt,Wide Awake,Katy Perry,220946,2012-03-12,2012,0.0749,0.515,0.683,2.64e-06,0.392,-5.099,0.0371,159.878,0.572,1.0,5.0,76,False,pop
4ti3jFBiVjPE4t9WOzKkHW,Always Then,The KVB,251376,2012-01-30,2012,0.138,0.471,0.713,0.819,0.173,-10.395,0.0341,137.029,0.528,1.0,1.0,52,False,"dark post-punk, grave wave, nu gaze"
4YA7nxDtAVE2R1Eryx7uRu,Always On Time,"Ja Rule, Ashanti",245373,2012-01-01,2012,0.193,0.839,0.706,0.0,0.205,-6.109,0.231,96.669,0.849,0.0,5.0,48,True,"dance pop, east coast hip hop, gangster rap, hip hop, hip pop, pop rap, queens hip hop, rap, urban contemporary"
3rKZwwfHpmimL6aqOmTiLE,The Anthem,"Pitbull, Lil Jon",245054,2012-05-08,2012,0.00459,0.793,0.781,1.68e-06,0.0846,-4.277,0.186,123.996,0.883,0.0,10.0,48,True,"dance pop, miami hip hop, pop"
44Tu2rpOsIlu69qrRZaahl,Beso Al Aire (feat. América Sierra & Smoky),"3BallMTY, América Sierra, Smoky",229240,2012-01-01,2012,0.0854,0.666,0.916,0.0,0.205,-3.709,0.299,131.951,0.751,0.0,1.0,67,False,trival
4jKBjyOdVKfmyauxwW8QUs,Ain't Much Left of Me,Blackberry Smoke,298786,2012-08-14,2012,0.129,0.231,0.797,1.4e-06,0.255,-4.699,0.0489,153.514,0.336,1.0,7.0,48,False,"modern southern rock, southern rock"
46bkeaB7DA45q7PdKWLFkR,Amsterdam,Imagine Dragons,241426,2012-09-04,2012,0.00852,0.517,0.768,8.4e-06,0.136,-4.961,0.0363,115.002,0.206,1.0,9.0,47,False,"modern rock, pop, rock"
4oBsoXtlj3zYqVs4FEEqmA,Dance All Night,"Dirty Heads, Matisyahu",206333,2012-06-19,2012,0.0164,0.704,0.753,0.0,0.154,-6.163,0.0493,81.047,0.895,1.0,1.0,61,False,"reggae fusion, reggae rock"
089YdobV7859anDvVu1TsY,Awesome God,Michael W. Smith,197613,2012,2012,0.283,0.298,0.66,5.24e-06,0.629,-8.187,0.041,138.902,0.185,1.0,7.0,51,False,"ccm, christian alternative rock, christian music"
5H06kjjKa1Oz8BZcGeplel,Alone,Trampled by Turtles,268280,2012-04-10,2012,0.758,0.546,0.432,0.4,0.0976,-10.637,0.0321,141.09,0.277,1.0,0.0,47,False,"duluth indie, indie folk, jam band, new americana, progressive bluegrass, stomp and holler"
2PieESXphabz5AkALFS08X,The Art of Peer Pressure,Kendrick Lamar,324533,2012,2012,0.286,0.555,0.611,0.00106,0.273,-9.216,0.356,94.939,0.411,0.0,10.0,47,True,"conscious hip hop, hip hop, rap, west coast rap"
3GhmL9fuM8jwGcHCFbeo3v,Me Prefieres A Mi,Arcángel,195657,2012-01-01,2012,0.546,0.726,0.604,2.71e-05,0.913,-8.127,0.0846,80.994,0.788,1.0,7.0,74,False,"latin hip hop, reggaeton, trap latino, urbano latino"
717lZxxn53x2B0eucGiD1Z,All Night,Parov Stelar,166613,2012-04-20,2012,0.223,0.793,0.578,0.926,0.293,-8.747,0.0428,125.021,0.803,0.0,7.0,61,False,"balkan beats, downtempo, electro swing, nu jazz"
3dB42OEuVNiktvt3V5JRVI,"Amor, Amor de Mis Amores (with Devendra Banhart)","Natalia Lafourcade, Devendra Banhart",237000,2012-09-18,2012,0.14,0.69,0.398,3.08e-05,0.128,-6.704,0.0274,105.009,0.643,1.0,2.0,61,False,"cantautora mexicana, latin alternative, latin pop, mexican pop, rock en espanol, veracruz indie"
3eCY6AUZVvKuFQYVpvMEMV,A Quién Esperas,Beto Y Sus Canarios,143871,2012-05-04,2012,0.325,0.639,0.53,0.000196,0.211,-9.011,0.0347,112.531,0.88,1.0,5.0,49,False,"musica mexicana, tierra caliente"
4Pwjz3DfvfQWV0rO2V8jyh,"Bitch, Don’t Kill My Vibe",Kendrick Lamar,310720,2012,2012,0.0152,0.587,0.698,0.0,0.442,-8.948,0.0943,133.954,0.0985,1.0,1.0,71,True,"conscious hip hop, hip hop, rap, west coast rap"
6IbnUaczZBT34DhaD6S18F,Bubblegum Bitch,MARINA,154666,2012-04-27,2012,0.000219,0.495,0.856,0.0,0.103,-5.123,0.0311,158.024,0.609,0.0,0.0,76,True,"metropopolis, pop, pov: indie, uk alternative pop"
2pMPWE7PJH1PizfgGRMnR9,Bad Religion,Frank Ocean,175453,2012-07-10,2012,0.738,0.359,0.367,1.43e-06,0.0736,-7.684,0.0335,83.331,0.104,1.0,9.0,72,False,"lgbtq+ hip hop, neo soul"
23UoI3jlFiWdo5jadUYo69,Bulls In The Bronx,Pierce The Veil,267866,2012-07-17,2012,0.000394,0.472,0.925,0.000528,0.0826,-3.545,0.15,159.989,0.338,0.0,6.0,70,False,"modern rock, pop punk, screamo"
3aGibUHhQyBsyumYHylw0K,Backseat Freestyle,Kendrick Lamar,212653,2012,2012,0.000739,0.547,0.651,0.0,0.235,-7.601,0.3,77.878,0.645,1.0,1.0,67,True,"conscious hip hop, hip hop, rap, west coast rap"
3UGIZ8qcrMTwzLbx6Kttqt,Boyfriend,Justin Bieber,171333,2012-01-01,2012,0.0358,0.717,0.55,0.00196,0.126,-6.019,0.0521,96.976,0.332,0.0,10.0,75,False,"canadian pop, pop"
7oVEtyuv9NBmnytsCIsY5I,BURN IT DOWN,Linkin Park,230253,2012-06-19,2012,0.0143,0.585,0.972,0.0,0.0707,-4.45,0.0534,110.006,0.585,0.0,9.0,78,False,"alternative metal, nu metal, post-grunge, rap metal, rock"
712uvW1Vezq8WpQi38v2L9,"Bitch, Don’t Kill My Vibe",Kendrick Lamar,310720,2012,2012,0.0151,0.586,0.698,0.0,0.443,-8.948,0.0943,133.954,0.098,1.0,1.0,66,True,"conscious hip hop, hip hop, rap, west coast rap"
7DfFc7a6Rwfi3YQMRbDMau,Thinkin Bout You,Frank Ocean,200746,2012-07-10,2012,0.409,0.721,0.339,0.00153,0.0973,-11.195,0.0532,129.83,0.2,1.0,0.0,85,False,"lgbtq+ hip hop, neo soul"
5wEreUfwxZxWnEol61ulIi,Born To Die,Lana Del Rey,286253,2012-01-01,2012,0.2,0.393,0.634,0.000166,0.198,-6.629,0.0378,85.767,0.395,0.0,4.0,69,False,"art pop, pop"
47k7FCxk7ylTwKCnJ3QTVc,Brand New City,Mitski,132773,2012-01-31,2012,0.0499,0.482,0.829,0.0,0.0824,-5.956,0.0587,148.119,0.657,0.0,5.0,70,False,"brooklyn indie, pov: indie"
5lF0pHbsJ0QqyIrLweHJPW,Burn,Ellie Goulding,231213,2012-10-12,2012,0.3,0.313,0.76,0.0,0.105,-5.049,0.0616,86.735,0.343,0.0,10.0,75,False,"indietronica, metropopolis, pop, uk pop"
3WD91HQDBIavSapet3ZpjG,Video Games,Lana Del Rey,281946,2012-01-01,2012,0.808,0.39,0.252,0.0,0.0887,-9.666,0.0298,122.053,0.181,0.0,6.0,72,False,"art pop, pop"
487OPlneJNni3NWC8SYqhW,Born To Die,Lana Del Rey,285400,2012-11-12,2012,0.222,0.428,0.626,8.22e-05,0.277,-6.639,0.0339,86.02,0.379,0.0,4.0,63,False,"art pop, pop"
0nJW01T7XtvILxQgC5J7Wh,When I Was Your Man,Bruno Mars,213826,2012-12-07,2012,0.932,0.612,0.28,0.0,0.088,-8.648,0.0434,72.795,0.387,1.0,0.0,89,False,"dance pop, pop"
3w3y8KPTfNeOKPiqUTakBh,Locked out of Heaven,Bruno Mars,233478,2012-12-07,2012,0.049,0.726,0.698,0.0,0.309,-4.165,0.0431,143.994,0.867,1.0,5.0,88,False,"dance pop, pop"
4Th9Lu8GK0mt5fZZ945FI7,Breathe,Stick Figure,292485,2012-06-15,2012,0.0534,0.804,0.64,0.135,0.101,-5.998,0.0479,93.994,0.763,1.0,11.0,60,False,"reggae fusion, reggae rock"
0KAiuUOrLTIkzkpfpn9jb9,Drive By,Train,195973,2012-04-17,2012,0.00107,0.765,0.837,1.06e-05,0.0801,-3.113,0.032,122.028,0.721,0.0,1.0,82,False,"dance pop, neo mellow, pop, pop rock"
4k80K0b6KZ2QjAYkXON7q6,Blow Me (One Last Kiss),P!nk,255586,2012-09-18,2012,0.000145,0.597,0.919,0.0,0.282,-2.954,0.0439,113.991,0.729,1.0,7.0,66,True,"dance pop, pop"
0tZkVZ9DeAa0MNK2gY5NtV,Baby I'm Yours,"Breakbot, Irfane",215506,2012-09-17,2012,0.726,0.829,0.792,5.83e-06,0.122,-3.755,0.0668,118.05,0.758,0.0,2.0,68,False,"filter house, funktronica, nu disco"
6VWUOFXGwH1OgyPrfRONrn,Bring It Back,Travis Porter,217906,2012-05-28,2012,0.116,0.944,0.76,0.0,0.113,-4.355,0.0851,98.001,0.545,0.0,11.0,64,True,"atl hip hop, dirty south rap, futuristic swag, southern hip hop, trap"
2eRYuzlSOBk3HlMsCSOLPJ,Baby Come Back,Player,214373,2012-06-11,2012,0.0713,0.645,0.604,0.0,0.129,-9.904,0.118,156.436,0.545,0.0,5.0,60,False,"soft rock, yacht rock"
24jvD83UgLmrdGjhWTFslY,Video Games,Lana Del Rey,281960,2012-11-12,2012,0.811,0.236,0.249,1e-06,0.087,-9.595,0.0348,72.847,0.181,0.0,6.0,65,False,"art pop, pop"
1hWYT0w2R0J19rlVkiez7X,Battle Scars (with Guy Sebastian),"Lupe Fiasco, Guy Sebastian",250320,2012-09-25,2012,0.186,0.517,0.811,0.0,0.105,-4.526,0.286,168.269,0.494,0.0,5.0,63,False,"chicago rap, conscious hip hop, hip hop, political hip hop, pop rap, rap, southern hip hop"
5lWFrW5T3JtxVCLDb7etPu,Bad - 2012 Remaster,Michael Jackson,247360,2012-09-18,2012,0.00462,0.787,0.889,0.423,0.0665,-3.786,0.0397,114.091,0.394,1.0,8.0,67,False,"r&b, soul"
7ALEBJ8LOQqXVJ2tqnXtoH,"Bitch, Don’t Kill My Vibe - Remix","Kendrick Lamar, JAY-Z",278800,2012,2012,0.0545,0.631,0.791,0.0,0.226,-5.776,0.226,133.669,0.123,1.0,1.0,57,True,"conscious hip hop, hip hop, rap, west coast rap"
6OKmGZASRCmiKQKz4hCNrs,Brillas,León Larregui,224826,2012-01-01,2012,0.341,0.628,0.462,0.000864,0.217,-11.813,0.0354,93.016,0.308,1.0,9.0,57,False,"latin alternative, latin rock, rock en espanol"
0yqWOXyvDtC2ol1Idz8r8J,Build Your Kingdom Here,Rend Collective,257959,2012-01-08,2012,0.0218,0.456,0.508,0.0,0.237,-14.339,0.0402,133.965,0.553,1.0,2.0,59,False,"ccm, christian alternative rock, christian music"
7qzNc93sUMR3vHt5WADmOa,Blood,In This Moment,207586,2012-08-14,2012,0.012,0.534,0.95,1.91e-06,0.413,-2.712,0.161,140.079,0.526,0.0,9.0,58,False,"alternative metal, nu metal, post-grunge"
77XvocHaWXkG39G4qag6BG,Blue Jeans - Remastered 2011,Lana Del Rey,209440,2012-01-01,2012,0.432,0.553,0.828,0.0,0.0801,-4.399,0.0635,117.948,0.504,1.0,3.0,58,True,"art pop, pop"
2jATUzETZL49e6SywauZKE,Va Va Voom,Nicki Minaj,183560,2012-01-01,2012,0.0625,0.648,0.836,0.00995,0.202,-3.394,0.0316,126.889,0.705,1.0,8.0,72,True,"hip pop, pop, queens hip hop, rap"
4ScCM5slsFwNzGV8BAYFWK,Bag of Bones,Mitski,276226,2012-01-31,2012,0.936,0.435,0.24,0.0,0.126,-13.338,0.0365,83.191,0.322,1.0,0.0,60,False,"brooklyn indie, pov: indie"
