id,name,artists,duration_ms,release_date,year,acousticness,danceability,energy,instrumentalness,liveness,loudness,speechiness,tempo,valence,mode,key,popularity,explicit,genre
3M4FujhEzjIbsKjRibnTB1,"The Rite of Spring, K. 015: Part II ""The Sacrifice"": Introduction","Igor Stravinsky, Staatskapelle Dresden, Otmar Suitner",262240,1964-03-10,1964,0.983,0.156,0.0388,0.794,0.223,-31.4,0.0349,71.299,0.0351,0.0,0.0,0,False,"classical, early modern classical, neoclassicism, russian modern classical"
21hXiFWZSLAsJUoolYGV1y,16 Candles,Frankie Valli & The Four Seasons,168960,1964-03-01,1964,0.755,0.468,0.432,0.0,0.246,-10.125,0.0302,99.707,0.332,1.0,10.0,22,False,"adult standards, bubblegum pop, doo-wop, lounge, northern soul, rock-and-roll, rockabilly"
6VCuc7gcyYPXxy2IzAc5cd,"Amsterdam - Live, Olympia / 1964",Jacques Brel,202600,1964,1964,0.417,0.414,0.806,0.0,0.356,-5.445,0.257,129.841,0.406,0.0,6.0,37,False,"belgian singer-songwriter, chanson"
2iSS4t0drnfyP3r2UAJwKn,Ask Me Now (Take 1),Thelonious Monk,223506,1964,1964,0.99,0.527,0.341,0.904,0.107,-10.924,0.0388,73.982,0.123,1.0,8.0,20,False,"bebop, contemporary post-bop, jazz, jazz piano, jazz trio"
6dNsu5wbiD8keAWts8INjU,"Autumn Leaves - Live at Festival Mondial Du Jazz Antibes/Juan-Les-Pins, France - July 27, 1963",Miles Davis,832226,1964,1964,0.831,0.464,0.359,0.000929,0.847,-13.065,0.0767,86.984,0.555,0.0,7.0,17,False,"cool jazz, hard bop, jazz, jazz fusion, jazz trumpet, soul, vocal jazz"
1nwQILbWx9WXke8gT8xRsS,Auld Lang Syne - 1991 Remix,The Beach Boys,80120,1964-11-09,1964,0.722,0.425,0.123,0.0,0.171,-19.565,0.0681,57.178,0.337,1.0,1.0,20,False,"baroque pop, classic rock, folk rock, mellow gold, psychedelic rock, rock, singer-songwriter, sunshine pop"
7BoeifyvhTzpwGhl623obG,"A Hard Rain's A-Gonna Fall - Live at Philharmonic Hall, New York, NY - October 1964",Bob Dylan,464400,1964,1964,0.53,0.427,0.407,0.0,0.807,-12.063,0.0734,169.864,0.366,1.0,5.0,15,False,"classic rock, country rock, folk, folk rock, rock, roots rock, singer-songwriter"
2zV376BsdqWd5BX0Jwd4iB,"Asa Di War, Pt. 1",Bhai Surjan Singh Ragi,1198519,1964-12-31,1964,0.99,0.439,0.284,0.573,0.117,-12.369,0.123,68.989,0.66,1.0,7.0,19,False,shabad
6WIk1WJfBVPgOWNnRu7IMH,As Tears Go By,Marianne Faithfull,158720,1964,1964,0.565,0.514,0.544,1.59e-05,0.216,-9.822,0.0268,127.689,0.766,1.0,0.0,20,False,"british invasion, folk, singer-songwriter"
51qNQkkJdjWOP3Kzsqv8Rs,A 16 Anni Tu Vuoi Amare,Neil Sedaka,124266,1964-04-01,1964,0.477,0.625,0.592,0.0,0.691,-6.61,0.0335,132.565,0.856,0.0,7.0,2,False,"adult standards, brill building pop, bubblegum pop, easy listening, rockabilly, soft rock"
4Epvw6WuSsE28tu9j27DCq,"I Loves You Porgy - Live At Carnegie Hall, New York, 1964",Nina Simone,150760,1964-01-01,1964,0.921,0.346,0.118,1.69e-06,0.96,-20.669,0.0439,143.85,0.227,1.0,11.0,21,False,"jazz blues, neo soul, soul, soul jazz, torch song, vocal jazz"
10cg96POewnGipBTe4oM0j,Take The A Train,"Charles Mingus, Eric Dolphy",1046666,1964,1964,0.746,0.46,0.57,0.82,0.676,-13.919,0.125,112.508,0.477,1.0,5.0,12,False,"avant-garde jazz, bebop, contemporary post-bop, cool jazz, electric bass, free jazz, hard bop, jazz, jazz double bass"
4Ba1bmMUXrkM9zUwxrhzDd,A Little Unfair,Lefty Frizzell,147360,1964,1964,0.608,0.666,0.299,0.000271,0.144,-14.823,0.0268,94.806,0.711,1.0,4.0,10,False,"arkansas country, classic country pop, honky tonk, traditional country, western swing"
3OsPGKXz4qdRY7gukbcQhH,"All I Really Want to Do - Live at Philharmonic Hall, New York, NY - October 1964",Bob Dylan,241373,1964,1964,0.703,0.357,0.64,0.0,0.684,-9.007,0.384,181.723,0.596,1.0,0.0,11,False,"classic rock, country rock, folk, folk rock, rock, roots rock, singer-songwriter"
6UWqWTIARjAtF9x8vsKMeI,Ay ! Mourir pour toi - Réenregistrement 1964,Charles Aznavour,222053,1964-01-01,1964,0.085,0.375,0.445,0.0,0.0703,-10.084,0.0368,96.843,0.48,1.0,0.0,22,False,chanson
7s18XjOhAPCDECfR2nTcEv,Autumn Leaves,101 Strings Orchestra,233941,1964-01-01,1964,0.643,0.0792,0.187,0.83,0.175,-16.741,0.0379,79.275,0.0758,0.0,4.0,11,False,easy listening
4F9vdsZgNvci1hszveARWn,"3 Waltzes, Op. 64: No. 1 in D-Flat Major ""Minute""","Frédéric Chopin, Arthur Rubinstein",109173,1964,1964,0.991,0.239,0.0719,0.88,0.283,-29.002,0.0368,142.321,0.565,1.0,8.0,28,False,"classical, early romantic era, polish classical"
0f6PdvdisCcWj24cmCzYhY,"All Day and All of the Night (Live at The Playhouse Theatre, 1964)",The Kinks,137869,1964-02-02,1964,0.0153,0.614,0.797,0.0143,0.203,-5.541,0.0316,139.532,0.932,1.0,5.0,14,False,"album rock, art rock, british invasion, classic rock, folk rock, glam rock, protopunk, psychedelic rock, rock, singer-songwriter"
69htku8D961lZe0FLZ2GmR,"3 Waltzes, Op. 34: No. 1 in A-Flat Major","Frédéric Chopin, Arthur Rubinstein",304173,1964,1964,0.994,0.27,0.0595,0.901,0.126,-23.081,0.0412,67.975,0.195,1.0,8.0,25,False,"classical, early romantic era, polish classical"
6uokl3aZjUsJwCjTlvLLfg,"It's As Easy As 1, 2, 3",Jan & Dean,147333,1964,1964,0.501,0.523,0.611,1.19e-06,0.158,-11.193,0.0535,135.151,0.64,1.0,1.0,18,False,"bubblegum pop, classic garage rock, doo-wop, rock-and-roll, rockabilly, sunshine pop, surf music"
1mreZCRg1gnNFLdGMqLW2b,"It Ain't Me, Babe - Live at Philharmonic Hall, New York, NY - October 1964","Bob Dylan, Joan Baez",231773,1964,1964,0.767,0.556,0.555,0.0,0.844,-9.673,0.109,107.924,0.456,1.0,7.0,21,False,"classic rock, country rock, folk, folk rock, rock, roots rock, singer-songwriter"
1yDngUM0Ho4337zJUWSYzP,"Ah-Leu-Cha (feat. John Coltrane, Bill Evans, Cannonball Adderley, Paul Chambers & Jimmy Cobb) - Live at the Newport Jazz Festival, Newport, RI - July 1958","Miles Davis, John Coltrane, Bill Evans, Cannonball Adderley, Paul Chambers, Jimmy Cobb",352826,1964,1964,0.517,0.488,0.652,1.9e-05,0.895,-13.022,0.0527,77.494,0.82,1.0,0.0,9,False,"cool jazz, hard bop, jazz, jazz fusion, jazz trumpet, soul, vocal jazz"
0vywBbO4lwiutv1q2dzVWC,12-String Special,Glen Campbell,110760,1964,1964,0.311,0.514,0.734,0.918,0.126,-10.725,0.0326,118.865,0.968,1.0,10.0,8,False,"adult standards, arkansas country, classic country pop, country rock, folk rock, mellow gold, nashville sound, singer-songwriter, soft rock"
2LE5SVdO34jp0choLAOQRI,500 Miles,Glen Campbell,143453,1964,1964,0.3,0.737,0.371,0.634,0.115,-9.074,0.044,125.113,0.647,1.0,10.0,21,False,"adult standards, arkansas country, classic country pop, country rock, folk rock, mellow gold, nashville sound, singer-songwriter, soft rock"
4y9u9cdW7NmUM6VLO6t6Dw,"All Of You - Live at Festival Mondial Du Jazz Antibes/Juan-Les-Pins, France - July 27, 1963",Miles Davis,1009026,1964,1964,0.799,0.54,0.387,9.99e-05,0.673,-10.1,0.0541,131.096,0.423,1.0,3.0,11,False,"cool jazz, hard bop, jazz, jazz fusion, jazz trumpet, soul, vocal jazz"
18jBucTqAk3FFWG85M44Ud,"3 Waltzes, Op. 34: No. 2 in A Minor","Frédéric Chopin, Arthur Rubinstein",314173,1964,1964,0.995,0.185,0.00893,0.913,0.0848,-33.654,0.0422,69.77,0.0863,1.0,0.0,26,False,"classical, early romantic era, polish classical"
2vufCokaCkRC9N1BgehpVu,Albert's Shuffle,"Mike Bloomfield, Al Kooper",413000,1964,1964,0.0815,0.445,0.588,0.53,0.713,-8.389,0.0266,96.968,0.676,1.0,0.0,8,False,"blues, blues rock, chicago blues, electric blues, traditional blues"
3jf0E5YD7SzQD4QBY8Vunv,ATFW You,"Charles Mingus, Eric Dolphy",266186,1964,1964,0.977,0.368,0.508,0.895,0.69,-20.128,0.19,90.291,0.49,1.0,3.0,8,False,"avant-garde jazz, bebop, contemporary post-bop, cool jazz, electric bass, free jazz, hard bop, jazz, jazz double bass"
1WBfzmOEVFIiDvte4al0ND,"Bizet: Carmen, Act 1: Séguedille. ""Près des remparts de Séville"" (Carmen, José)","Georges Bizet, Maria Callas, Nicolai Gedda, Orchestre de l'Opéra National de Paris, Georges Prêtre, Orchestre du Théâtre National de l'Opéra Paris, Paris Opera Orchestra",276453,1964,1964,0.972,0.307,0.0845,0.0,0.107,-19.425,0.0463,82.634,0.219,1.0,2.0,26,False,"classical, french opera, french romanticism, late romantic era"
4wgEltds8cyxlYE1FtZRO1,Au revoir,Gilbert Bécaud,175026,1964,1964,0.347,0.472,0.464,0.0,0.153,-9.611,0.031,118.891,0.388,1.0,0.0,27,False,chanson
3pabcCisyWJGR84cUdrBPy,"3 Waltzes, Op. 64: No. 3 in A-Flat Major","Frédéric Chopin, Arthur Rubinstein",200173,1964,1964,0.995,0.158,0.0849,0.871,0.322,-27.205,0.039,81.816,0.182,0.0,5.0,24,False,"classical, early romantic era, polish classical"
4hoUJPX2vPZegLSEOm85eB,"3 Waltzes, Op. posth. 70: No. 2 in F Minor","Frédéric Chopin, Arthur Rubinstein",207173,1964,1964,0.995,0.212,0.0529,0.892,0.108,-29.652,0.0406,75.599,0.331,1.0,8.0,25,False,"classical, early romantic era, polish classical"
2b8hnsqhZp1Mk9ciROco3x,"3 Waltzes, Op. posth. 70: No. 1 in G-Flat Major","Frédéric Chopin, Arthur Rubinstein",110173,1964,1964,0.995,0.451,0.0472,0.778,0.176,-26.03,0.0538,74.3,0.194,1.0,6.0,23,False,"classical, early romantic era, polish classical"
1QhBuTdDCsPdzEAlz0Ucjo,"12 Danzas Españolas, Op. 37: No. 5, Andaluza (Arr. J. Williams for Guitar)","Enrique Granados, John C. Williams",259400,1964,1964,0.976,0.353,0.0356,0.817,0.0931,-28.156,0.058,113.026,0.202,1.0,4.0,7,False,"early modern classical, post-romantic era, spanish classical"
5vndZza9NKe2re6C34pVpi,"As Time Goes By (From ""Casablanca"") - From ""Casablanca""",Teddy Wilson,166240,1964-01-01,1964,0.919,0.42,0.337,0.804,0.115,-10.517,0.0285,83.797,0.395,0.0,5.0,8,False,"jazz piano, stride"
1fS65P9BO6ybDbGeOXF8re,An Comhra Donn / Murphy’s Hornpipe (Hornpipes),The Chieftains,261359,1964-01-01,1964,0.951,0.515,0.273,0.655,0.391,-15.786,0.0457,82.651,0.647,1.0,7.0,8,False,"celtic, irish folk"
57Pg9ryXlu0KGJwfPobHC5,"Here's That Rainy Day - Live At Café Au Go-Go,1964",The New Stan Getz Quartet,372040,1964-10-25,1964,0.976,0.359,0.06,0.224,0.698,-25.06,0.0387,71.286,0.115,1.0,5.0,12,False,jazz quartet
3IP9HZyKJN6QdP0Ijspg10,"Bizet: Carmen, Act 1: ""Sur la place"" (Chorus, Moralès, Micaela)","Georges Bizet, Andréa Guiot/Claude Calès/Choeurs René Duclos/Orchestre de l'Opéra National de Paris/Georges Prêtre, Georges Prêtre, Orchestre du Théâtre National de l'Opéra Paris, Orchestre de l'Opéra National de Paris, Paris Opera Orchestra",442386,1964,1964,0.929,0.319,0.104,0.00437,0.197,-20.923,0.0416,104.581,0.118,1.0,10.0,22,False,"classical, french opera, french romanticism, late romantic era"
5Qg3T1QTxvap0eNKSqDNQj,"3 Waltzes, Op. 34: No. 3 in F Major","Frédéric Chopin, Arthur Rubinstein",141173,1964,1964,0.993,0.348,0.045,0.917,0.119,-28.425,0.0423,142.696,0.234,1.0,5.0,23,False,"classical, early romantic era, polish classical"
4k8uAuKuKMbCkNlbucW787,"It's Alright, Ma (I'm Only Bleeding) - Live at Philharmonic Hall, New York, NY - October 1964",Bob Dylan,566493,1964,1964,0.582,0.607,0.349,0.0,0.785,-12.766,0.103,105.034,0.359,1.0,0.0,15,False,"classic rock, country rock, folk, folk rock, rock, roots rock, singer-songwriter"
0B0Lm3Q45W6XLy950ibHmr,"Suite Española No. 1, Op. 47: No. 5, Asturias (Arr. J. Williams for Guitar)","Isaac Albéniz, John C. Williams",377600,1964,1964,0.943,0.298,0.155,0.889,0.081,-24.317,0.0673,122.812,0.239,0.0,4.0,20,False,"classical, impressionism, post-romantic era, spanish classical"
06Lj0X4VrDqt95PyugZpxf,Acapulco 1922,The Baja Marimba Band,129893,1964-01-01,1964,0.801,0.684,0.221,0.424,0.071,-17.229,0.0416,137.319,0.754,1.0,5.0,4,False,easy listening
4dvfA7hnyUpCENwSwPjbg6,"Bizet: Carmen, Act 1: ""Avec la garde montante"" (Children's Chorus, Moralès, José)","Georges Bizet, Nicolai Gedda, Georges Prêtre, Orchestre du Théâtre National de l'Opéra Paris, Orchestre de l'Opéra National de Paris, Paris Opera Orchestra",233760,1964,1964,0.85,0.66,0.112,0.067,0.0827,-23.96,0.0524,122.303,0.464,0.0,2.0,22,False,"classical, french opera, french romanticism, late romantic era"
1XGSxrAmNCG2sXfJrOdj9f,"Ann, Wonderful One",Chet Baker,286680,1964-01-01,1964,0.902,0.51,0.0616,0.0287,0.1,-20.23,0.0376,117.697,0.147,1.0,7.0,9,False,"cool jazz, jazz, jazz trumpet, vocal jazz"
7GHalpGilg3gFN4K7WJo3A,"12 Tonadillas al Estilo Antiguo, H. 136: No. 8, La Maja de Goya (Arr. J. Williams for Guitar)","Enrique Granados, John C. Williams",222106,1964,1964,0.965,0.451,0.0761,0.752,0.092,-24.412,0.0411,151.168,0.32,1.0,7.0,8,False,"early modern classical, post-romantic era, spanish classical"
23v6vYuY6oS1I1ilef4xe6,"Suite for Solo Cello No. 1 in G Major, BWV 1007: 1. Prélude","Johann Sebastian Bach, Maurice Gendron",146000,1964-01-01,1964,0.968,0.199,0.177,0.819,0.19,-20.531,0.0566,82.657,0.345,1.0,7.0,22,False,"baroque, classical, early music, german baroque"
5ElFtY6kvyjkv2E2KVfzHB,"3 Waltzes, Op. posth. 70: No. 3 in D-Flat Major","Frédéric Chopin, Arthur Rubinstein",168173,1964,1964,0.996,0.29,0.0538,0.796,0.143,-30.162,0.05,78.679,0.203,1.0,1.0,22,False,"classical, early romantic era, polish classical"
1WUt8SY17zIL49TxENehP5,"Bizet: Carmen, Act 1: ""Carmen! sur tes pas"" (Chorus, Carmen, José)","Georges Bizet, Maria Callas, Nicolai Gedda, Choeurs Rene Duclos, Choeurs D'Enfants Jean Pesneaud, Orchestre de l'Opéra National de Paris, Georges Prêtre, Orchestre du Théâtre National de l'Opéra Paris, Paris Opera Orchestra",87746,1964,1964,0.91,0.272,0.126,0.000272,0.125,-20.155,0.0468,83.731,0.122,0.0,9.0,21,False,"classical, french opera, french romanticism, late romantic era"
712Z4RYZspsuHcD692uiYr,"Adagio for Strings, Op. 11","Samuel Barber, Leonard Bernstein, New York Philharmonic",596560,1964,1964,0.909,0.0594,0.0752,0.946,0.0876,-23.649,0.0483,60.149,0.0299,0.0,10.0,7,False,"american modern classical, classical"
5T7xxxt9JZJdvaRcZtwshV,"12 Études, Op. 25: No. 7 in C-Sharp Minor","Frédéric Chopin, Vladimir Horowitz",339146,1964,1964,0.992,0.26,0.0197,0.862,0.101,-27.919,0.0498,79.273,0.0752,0.0,1.0,8,False,"classical, early romantic era, polish classical"
00qDTylkoAFKKuJrkDgSG9,"Autant d'amour, autant de fleurs",Jean Ferrat,132733,1964,1964,0.46,0.581,0.717,0.0,0.0981,-6.669,0.0403,82.527,0.952,0.0,9.0,20,False,chanson
08OjaQhrAR92Fq5GqAUdQ1,"Bizet: Carmen, Act 1: ""Parle-moi de ma mère!"" (José, Micaela)","Georges Bizet, Nicolai Gedda, Georges Prêtre, Orchestre du Théâtre National de l'Opéra Paris, Orchestre de l'Opéra National de Paris, Paris Opera Orchestra",536040,1964,1964,0.964,0.218,0.129,0.000275,0.207,-21.121,0.0517,171.147,0.135,1.0,0.0,19,False,"classical, french opera, french romanticism, late romantic era"
0BQPnY7NmTIvstctfTbyfJ,"Bizet: Carmen, Act 1: ""La cloche a sonné....Dans l'air"" (Chorus)","Georges Bizet, Choeurs René Duclos/Choeurs d'Enfants Jean Pesneaud/Orchestre de l'Opéra National de Paris/Georges Prêtre, Georges Prêtre, Orchestre du Théâtre National de l'Opéra Paris, Orchestre de l'Opéra National de Paris, Paris Opera Orchestra",273360,1964,1964,0.879,0.183,0.0541,0.0211,0.123,-25.905,0.0383,82.239,0.122,1.0,4.0,20,False,"classical, french opera, french romanticism, late romantic era"
4WmRCXr1c4m7Efz96TX6j9,Crazy Arms - 1964 Version,Jerry Lee Lewis,151466,1964-05-13,1964,0.316,0.464,0.633,4.13e-05,0.171,-13.26,0.0591,140.691,0.678,1.0,5.0,15,False,"piano rock, rock-and-roll, rockabilly"
2WGHZc4Clh9UkN8xiiDp7u,"Bizet: Carmen, Act 1: ""C'est bien là, n'est-ce pas?"" (José, Zuñiga)","Georges Bizet, Nicolai Gedda, Georges Prêtre, Orchestre du Théâtre National de l'Opéra Paris, Orchestre de l'Opéra National de Paris, Paris Opera Orchestra",73773,1964,1964,0.915,0.485,0.145,1.66e-06,0.338,-22.924,0.13,97.094,0.397,1.0,1.0,19,False,"classical, french opera, french romanticism, late romantic era"
0QjhqYzNnicAaYdXIZtqJY,"Serenade in G Major, K. 525 ""Eine kleine Nachtmusik"": II. Romance. Andante","Wolfgang Amadeus Mozart, Leonard Bernstein, New York Philharmonic",390706,1964,1964,0.88,0.28,0.0532,0.525,0.128,-21.6,0.0424,137.176,0.173,1.0,0.0,15,False,"classical, classical era"
3zcTTddmyG28Eo3NSRZUOn,"Invention No. 13 in A Minor, BWV 784 - Remastered","Johann Sebastian Bach, Glenn Gould",44746,1964,1964,0.988,0.243,0.314,0.884,0.115,-24.158,0.0379,143.209,0.743,1.0,0.0,14,False,"baroque, classical, early music, german baroque"
7buaEIGFa9f7rXjOAApie9,"Silver Dagger - Live at Philharmonic Hall, New York, NY - October 1964","Bob Dylan, Joan Baez",221493,1964,1964,0.627,0.294,0.648,9.53e-06,0.723,-8.597,0.0815,129.213,0.522,1.0,7.0,18,False,"classic rock, country rock, folk, folk rock, rock, roots rock, singer-songwriter"
2UXqndhDfPlLT2uJa3op6o,"Lute Suite No. 2 in C Minor, BWV 997: V. Double","Johann Sebastian Bach, John C. Williams",179160,1964,1964,0.972,0.325,0.195,0.784,0.11,-27.011,0.044,101.058,0.855,0.0,9.0,18,False,"baroque, classical, early music, german baroque"
19rvXquguyGBEF5Kbgimi7,"6-Nix-Pix-Flix - Live At Café Au Go-Go,1964","The New Stan Getz Quartet, Astrud Gilberto",66933,1964-10-25,1964,0.466,0.375,0.412,0.0,0.931,-16.752,0.613,75.328,0.627,0.0,8.0,13,False,jazz quartet
5WjxJPiy9dr9YjMXc29tkN,"Bizet: Carmen, Act 1: ""Que se passe-t-il donc là-bas?...Au secours!"" (Zuñiga, Chorus)","Georges Bizet, Jacques Mars/Choeurs René Duclos/Orchestre de l'Opéra National de Paris/Georges Prêtre, Georges Prêtre, Orchestre du Théâtre National de l'Opéra Paris, Orchestre de l'Opéra National de Paris, Paris Opera Orchestra",180293,1964,1964,0.864,0.384,0.335,0.00256,0.375,-15.852,0.0421,75.308,0.354,1.0,2.0,17,False,"classical, french opera, french romanticism, late romantic era"
5n5gShgfCfr9c0Y5MUQf9N,"Invention No. 14 in B-Flat Major, BWV 785 - Remastered","Johann Sebastian Bach, Glenn Gould",96733,1964,1964,0.992,0.3,0.189,0.928,0.125,-23.93,0.0366,103.398,0.835,1.0,10.0,14,False,"baroque, classical, early music, german baroque"
23gAHeSkHIMbhx8KtIahVT,Après l'amour - Réenregistrement 1964,Charles Aznavour,120933,1964-01-01,1964,0.762,0.265,0.388,1.46e-06,0.313,-11.106,0.0353,175.951,0.435,1.0,0.0,11,False,chanson
5s6uDxKZsmtiExct2gpPmH,"Suite for Solo Cello No. 1 in G Major, BWV 1007: 4. Sarabande","Johann Sebastian Bach, Maurice Gendron",185000,1964-01-01,1964,0.97,0.125,0.0644,0.88,0.13,-23.795,0.0479,67.728,0.141,1.0,7.0,14,False,"baroque, classical, early music, german baroque"
5TN8Zinq90BNxpLWdQinKk,"Lute Suite No. 2 in C Minor, BWV 997: III. Sarabande","Johann Sebastian Bach, John C. Williams",300013,1964,1964,0.982,0.42,0.0368,0.942,0.0757,-32.108,0.0566,80.685,0.151,0.0,9.0,16,False,"baroque, classical, early music, german baroque"
3Ce76WiiBfV8Jfu4sEYwCD,"Across the Blue Ridge Mountains - Live at Vanderbilt University, Nashville, TN - May 1963",Flatt & Scruggs,168600,1964-07-01,1964,0.726,0.465,0.45,0.0027,0.762,-15.46,0.0513,120.5,0.742,1.0,2.0,2,False,"banjo, bluegrass, bluegrass gospel, traditional country"
1b2GL6DixQ68PV4p8ZUIMx,"A.T.F.W. (Art Tatum Fats Waller) - Live In Théâtre des Champs-Elysées, Paris / April 19th, 1964",Charles Mingus,257453,1964,1964,0.984,0.422,0.357,0.893,0.759,-16.299,0.0419,82.507,0.389,0.0,5.0,4,False,"avant-garde jazz, bebop, contemporary post-bop, cool jazz, electric bass, free jazz, hard bop, jazz, jazz double bass"
7Jh5KI6K5gAhis0c0f4cha,"Lute Suite in E Minor, BWV 996 (Arr. J. Williams for Guitar): IV. Sarabande","Johann Sebastian Bach, John C. Williams",270226,1964,1964,0.993,0.475,0.00909,0.872,0.104,-30.743,0.0696,78.866,0.273,1.0,7.0,19,False,"baroque, classical, early music, german baroque"
4I3wYHiMdEyKdQwbTJyc9i,"A Jug Of Punch - Live at Carnegie Hall, New York, NY - March 17, 1963",The Clancy Brothers & Tommy Makem,193266,1964,1964,0.86,0.376,0.445,0.0,0.953,-15.196,0.192,81.836,0.432,1.0,3.0,2,False,"irish folk, irish pub song"
7a4QBTMxpHMhSwrx16xmje,"Adagaka Ichchina, Pt. 1","Ghantasala, P. Susheela",208213,1964-12-01,1964,0.967,0.615,0.382,0.0807,0.104,-10.997,0.257,136.811,0.828,1.0,2.0,2,False,vintage tollywood
6xdPjUOkDtiq2Wd7QmoU91,"Invention No. 12 in A Major, BWV 783 - Remastered","Johann Sebastian Bach, Glenn Gould",55680,1964,1964,0.989,0.259,0.246,0.921,0.115,-22.412,0.0347,139.893,0.942,1.0,9.0,12,False,"baroque, classical, early music, german baroque"
2vSmsxxfVw3jGgKrVqJwDD,"Invention No. 15 in B Minor, BWV 786 - Remastered","Johann Sebastian Bach, Glenn Gould",51533,1964,1964,0.99,0.441,0.321,0.964,0.116,-21.349,0.0452,104.711,0.98,1.0,2.0,13,False,"baroque, classical, early music, german baroque"
0KAG9uUdHDyqSlYkjnYRV6,"Invention No. 1 in C Major, BWV 772 - Remastered","Johann Sebastian Bach, Glenn Gould",91746,1964,1964,0.994,0.519,0.27,0.87,0.111,-22.893,0.0496,119.539,0.885,1.0,0.0,13,False,"baroque, classical, early music, german baroque"
0weTskmeE1huGMzJaNAVsb,"Bizet: Carmen, Act 1: ""Voici l'ordre; partez"" (Zuñiga, Carmen)","Georges Bizet, Maria Callas, Georges Prêtre, Orchestre du Théâtre National de l'Opéra Paris, Orchestre de l'Opéra National de Paris, Paris Opera Orchestra",119240,1964,1964,0.949,0.371,0.0697,1.54e-05,0.0917,-20.315,0.0919,114.846,0.366,1.0,1.0,16,False,"classical, french opera, french romanticism, late romantic era"
4S1IJXZov04AMU9qOHxY2E,"Bizet: Carmen, Act 1: Entr'acte","Georges Bizet, Georges Prêtre, Orchestre du Théâtre National de l'Opéra Paris, Orchestre de l'Opéra National de Paris, Paris Opera Orchestra",100826,1964,1964,0.918,0.49,0.0118,5.4e-05,0.086,-35.592,0.0385,113.86,0.472,1.0,7.0,16,False,"classical, french opera, french romanticism, late romantic era"
1CIoOw68BlzkjpC4jJvgOP,An Dhruimfhionn Donn Dílis (Slow Air),The Chieftains,131065,1964-01-01,1964,0.978,0.183,0.0648,0.857,0.069,-21.036,0.0392,101.043,0.511,1.0,1.0,4,False,"celtic, irish folk"
1RLQ7jBexmbG1FUIJMxa7P,"A Paris dans chaque Faubourg - Extrait du film ""14 Juillet""",Yves Montand,221026,1964-01-20,1964,0.963,0.226,0.0681,0.000155,0.216,-18.672,0.0364,43.105,0.227,1.0,3.0,10,False,chanson
6WKtwtJQDpddZVE1sekkRZ,"Amour, castagnettes et tango",Lucienne Delyle,138576,1964-08-17,1964,0.714,0.78,0.589,1.21e-06,0.0686,-7.79,0.301,125.429,0.637,1.0,8.0,6,False,vintage chanson
3gpRA8ENMOuqxWyzlUZiVJ,Whatever Possess'd Me,Chet Baker,243346,1964-01-01,1964,0.974,0.417,0.0326,0.00863,0.106,-21.545,0.0398,163.843,0.281,0.0,7.0,29,False,"cool jazz, jazz, jazz trumpet, vocal jazz"
2P0OZc3EsypRGv3GyENOva,"Invention No. 8 in F Major, BWV 779 - Remastered","Johann Sebastian Bach, Glenn Gould",63266,1964,1964,0.991,0.486,0.357,0.898,0.102,-19.652,0.0478,100.193,0.973,0.0,7.0,16,False,"baroque, classical, early music, german baroque"
4Svh24esLyKeZ8W5yYTc1L,"Cello Suite No. 1 in G Major, BWV 1007: I. Prélude (Transcribed for Guitar by John Williams)","Johann Sebastian Bach, John C. Williams",152080,1964,1964,0.951,0.365,0.216,0.849,0.0794,-24.536,0.0542,142.887,0.793,1.0,2.0,13,False,"baroque, classical, early music, german baroque"
4bhLxlMLviv7EYUQzxrViy,"Straight, No Chaser (feat. John Coltrane, Bill Evans, Cannonball Adderley, Paul Chambers & Jimmy Cobb) - Live at the Newport Jazz Festival, Newport, RI - July 1958","Miles Davis, John Coltrane, Bill Evans, Cannonball Adderley, Paul Chambers, Jimmy Cobb",527600,1964,1964,0.573,0.511,0.39,9.18e-05,0.341,-16.001,0.0651,95.572,0.593,1.0,0.0,10,False,"cool jazz, hard bop, jazz, jazz fusion, jazz trumpet, soul, vocal jazz"
3vcyuR1o2d4tqa0qzQyaoA,"Spanish Harlem Incident - Live at Philharmonic Hall, New York, NY - October 1964",Bob Dylan,162333,1964,1964,0.806,0.609,0.637,0.0,0.91,-7.951,0.408,120.295,0.493,1.0,7.0,14,False,"classic rock, country rock, folk, folk rock, rock, roots rock, singer-songwriter"
1CwiEbNy1Hm3aaEYBodrCB,"Who Killed Davey Moore? - Live at Philharmonic Hall, New York, NY - October 1964",Bob Dylan,221400,1964,1964,0.872,0.522,0.384,0.0,0.796,-12.105,0.551,177.377,0.473,1.0,3.0,13,False,"classic rock, country rock, folk, folk rock, rock, roots rock, singer-songwriter"
4coksFxESflWVCzoeeEGWS,"The Times They Are A-Changin' - Live at Philharmonic Hall, New York, NY - October 1964",Bob Dylan,209200,1964,1964,0.689,0.377,0.773,0.0,0.961,-7.585,0.489,189.997,0.601,1.0,7.0,15,False,"classic rock, country rock, folk, folk rock, rock, roots rock, singer-songwriter"
79TU7Z00JCnoU7FPAGCF7Q,"To Ramona - Live at Philharmonic Hall, New York, NY - October 1964",Bob Dylan,300600,1964,1964,0.83,0.495,0.291,0.0,0.934,-10.299,0.098,158.385,0.28,1.0,2.0,15,False,"classic rock, country rock, folk, folk rock, rock, roots rock, singer-songwriter"
0H9ZzwIBJSxOJT3HVuAsjW,"Don't Think Twice, It's All Right - Live at Philharmonic Hall, New York, NY - October 1964",Bob Dylan,242973,1964,1964,0.811,0.537,0.573,1.88e-06,0.963,-9.294,0.369,104.911,0.427,1.0,4.0,15,False,"classic rock, country rock, folk, folk rock, rock, roots rock, singer-songwriter"
58thlEaWWLRVVLPs35g7aJ,"Good Golly, Miss Molly - Live At The Star-Club, Hamburg, Germany/1964",Jerry Lee Lewis,141000,1964,1964,0.0224,0.335,0.975,0.0228,0.941,-7.066,0.0628,92.292,0.806,1.0,7.0,18,False,"piano rock, rock-and-roll, rockabilly"
2zzPdyKmyxU3TRh1CcT6sP,"Invention No. 10 in G Major, BVW 781 - Remastered","Johann Sebastian Bach, Glenn Gould",39933,1964,1964,0.989,0.298,0.288,0.903,0.134,-22.832,0.0483,159.908,0.887,1.0,7.0,12,False,"baroque, classical, early music, german baroque"
3uPfG7jzfXRvE5QJ4AoXLq,"Invention No. 11 in G Minor, BWV 782 - Remastered","Johann Sebastian Bach, Glenn Gould",54546,1964,1964,0.989,0.269,0.428,0.918,0.113,-22.335,0.0505,107.608,0.947,1.0,10.0,12,False,"baroque, classical, early music, german baroque"
6VDALi6PIOWyomTwtybT1P,Flight 19 (Alternate Take) - Alternate Take/Rudy Van Gelder Edition/1999 Remaster,Andrew Hill,229506,1964,1964,0.806,0.507,0.382,7.67e-05,0.113,-12.566,0.0393,141.73,0.849,0.0,5.0,7,False,"avant-garde jazz, bebop, contemporary post-bop, free jazz, jazz piano"
2jm4r2LruBBzaEM1Q3rNOg,"The Four Seasons - Violin Concerto in F Minor, Op. 8 No. 4, RV 297 ""Winter"": II. Largo","Antonio Vivaldi, Leonard Bernstein, New York Philharmonic",137866,1964,1964,0.693,0.266,0.19,0.00142,0.113,-23.082,0.0409,132.554,0.28,1.0,10.0,15,False,"baroque, classical, early music, italian baroque"
