id,name,artists,duration_ms,release_date,year,acousticness,danceability,energy,instrumentalness,liveness,loudness,speechiness,tempo,valence,mode,key,popularity,explicit,genre
3DIzAvnoRPkTQh4r3XoaYE,12:01 A.M.,Commodores,60360,1979-01-01,1979,0.202,0.711,0.603,0.374,0.0281,-13.297,0.0592,161.494,0.967,1,7,7,False,"adult standards, disco, funk, mellow gold, motown, quiet storm, soft rock, soul"
3zxWlXdyicpUIVXBkTu7C0,Agent 008,Piotr Figiel,214000,1979-09-13,1979,0.115,0.442,0.793,0.0174,0.246,-12.13,0.231,105.211,0.717,0,0,3,False,
4xaI26U1rt9rcdomYOtOJP,A caminho do além,"Milionário & José Rico, Continental",174280,1979,1979,0.504,0.471,0.385,0.0,0.331,-5.017,0.0349,149.278,0.739,1,9,11,False,"sertanejo, sertanejo tradicional, sertanejo universitario"
00dNYc5CNUpTzzMB7iMXRC,Alma perdida,"Milionário & José Rico, Continental",139826,1979,1979,0.302,0.608,0.653,0.0,0.394,-4.072,0.0295,91.989,0.806,1,0,12,False,"sertanejo, sertanejo tradicional, sertanejo universitario"
4df3K3ote7TRlQzx8apeB3,Aufbruch,Roedelius,226240,1979,1979,0.703,0.368,0.628,0.96,0.0865,-17.601,0.0415,115.276,0.558,0,4,1,False,"berlin school, fourth world, krautrock"
4yQcjWLQiFW1qKJkxK5vES,Ampfer,Roedelius,149240,1979,1979,0.981,0.286,0.145,0.904,0.0761,-19.855,0.0411,134.24,0.0901,1,2,2,False,"berlin school, fourth world, krautrock"
2lI8Y677WOM0hNRHZFGUFR,"Another Coke / The Body - Live, Manchester Uni 19/05/79",The Good Missionaries,398880,1979,1979,0.431,0.421,0.368,0.0135,0.44,-15.331,0.131,149.186,0.271,0,0,0,True,
3Ze3GFS0L1q73JiBIpTvLH,"8 Août, 0h15, 125ème Rue",François Bréant,313573,1979,1979,0.581,0.506,0.269,0.295,0.094,-16.035,0.0355,88.644,0.44,0,5,1,False,
27gKkFha9jCTSwkpnarlUz,Langer Atem,Roedelius,436560,1979,1979,0.568,0.314,0.359,0.877,0.0831,-9.875,0.0278,93.954,0.177,1,3,3,False,"berlin school, fourth world, krautrock"
0VJ1Ucm4m4L557uO7wwC1f,Schöner Abend,Roedelius,287933,1979,1979,0.9,0.172,0.199,0.933,0.203,-12.494,0.0357,65.871,0.171,1,10,1,False,"berlin school, fourth world, krautrock"
7K2obBWwABH42UsSTQEIjc,Anjo demônio,"Milionário & José Rico, Continental",135400,1979,1979,0.593,0.561,0.551,6.75e-06,0.0875,-5.561,0.0452,97.197,0.968,1,0,9,False,"sertanejo, sertanejo tradicional, sertanejo universitario"
0KiNNtIJ5X1TeXflylu6KZ,13 - und die geraubte Ahnfrau - Teil 03,"Hui Buh, das Schlossgespenst",57093,1979-10-01,1979,0.698,0.643,0.547,0.0,0.667,-13.952,0.643,116.378,0.64,0,8,12,False,hoerspiel
6jVT6goRQ4oGVA8zuBWaxF,13 - und die geraubte Ahnfrau - Teil 07,"Hui Buh, das Schlossgespenst",61906,1979-10-01,1979,0.831,0.698,0.544,0.0,0.426,-13.098,0.937,135.152,0.714,0,2,12,False,hoerspiel
1MK3vBAOdnQH0T1A4QOLYV,13 - und die geraubte Ahnfrau - Teil 08,"Hui Buh, das Schlossgespenst",59906,1979-10-01,1979,0.821,0.652,0.519,0.0,0.392,-13.749,0.928,89.992,0.642,1,2,12,False,hoerspiel
4pL93Vnv0yczm7uESlO3iP,13 - und die geraubte Ahnfrau - Teil 01,"Hui Buh, das Schlossgespenst",60773,1979-10-01,1979,0.702,0.707,0.43,0.0,0.34,-15.771,0.856,82.718,0.599,1,10,12,False,hoerspiel
07bRrzwUPGuRLglTi4gNdn,13 - und die geraubte Ahnfrau - Teil 09,"Hui Buh, das Schlossgespenst",60693,1979-10-01,1979,0.746,0.772,0.356,0.0,0.25,-15.879,0.939,46.28,0.424,0,11,12,False,hoerspiel
62iiSLf8KybMnTfaYLz5lR,13 - und die geraubte Ahnfrau - Teil 02,"Hui Buh, das Schlossgespenst",61600,1979-10-01,1979,0.545,0.803,0.548,0.0,0.382,-12.891,0.864,102.996,0.482,1,1,12,False,hoerspiel
7JUAF2qd9MVN8EXE2hahEF,13 - und die geraubte Ahnfrau - Teil 05,"Hui Buh, das Schlossgespenst",58666,1979-10-01,1979,0.829,0.6,0.597,0.0,0.68,-11.726,0.897,94.512,0.614,1,9,12,False,hoerspiel
7hSlUu7DwQ9S3wWhffhKo8,13 - und die geraubte Ahnfrau - Teil 06,"Hui Buh, das Schlossgespenst",62040,1979-10-01,1979,0.755,0.755,0.574,0.0,0.39,-11.244,0.781,118.618,0.636,0,3,12,False,hoerspiel
3mKTGpOiqGA8jtlbTRD4tY,13 - und die geraubte Ahnfrau - Teil 04,"Hui Buh, das Schlossgespenst",63280,1979-10-01,1979,0.822,0.653,0.587,0.0,0.364,-11.796,0.836,77.759,0.582,0,6,12,False,hoerspiel
4Ts0fXQ3poXYc1VCHKw3mW,Ana,Adelito e Rebelde,219297,1979-03-26,1979,0.747,0.621,0.235,5.1e-05,0.247,-12.187,0.03,157.881,0.488,1,11,0,False,
7GSd5b6QVUSLlgZ9mxpCKt,A tak se sejdem až V září,"Hana Zagorová, Helena Vondráčková, Marie Rottrova, Václav Neckář, Jiří Korn, Jiří Schelinger, Josef Vobruba, Taneční orchestr Čs. rozhlasu",169253,1979,1979,0.152,0.622,0.665,0.0,0.427,-12.147,0.157,104.379,0.96,1,5,0,False,classic czech pop
4M0A92Xd0E8lrmm7ISD3L5,Austria,This Evening's Show,157074,1979-02-19,1979,0.169,0.664,0.751,0.448,0.232,-6.625,0.0616,122.354,0.431,1,10,0,False,
4mtwCP1uyF9CJyckeAXFtZ,Až se vrátíš k prázdným kioskům,"Helena Vondráčková, Václav Neckář, Jiří Korn, Josef Vobruba, Taneční orchestr Čs. rozhlasu",173306,1979,1979,0.756,0.303,0.236,4.73e-05,0.12,-13.819,0.0313,83.498,0.221,1,0,0,False,classic czech pop
58sWrV8lzXyUeERsrVlffy,04. El Puquianito,Banda Los Aguiluchos De Puquio,185675,1979,1979,0.466,0.506,0.456,0.906,0.378,-6.186,0.196,100.401,0.607,0,10,0,False,
5eOVCthgfnCvXITs9d2gkJ,5 Minutes before Midnight,heats,243400,1979-05-01,1979,0.283,0.722,0.462,0.00325,0.0962,-14.349,0.105,124.793,0.887,1,9,0,False,
3aIN0qUS8Lk0hssNAYwSsi,Tchau Amor,Adelito e Rebelde,116636,1979-03-26,1979,0.636,0.673,0.64,2.37e-05,0.273,-9.399,0.04,95.004,0.845,1,0,0,False,
5gN9Td0JOgPmLLstQLBntk,Eu Te Amo Meu Sertão,Adelito e Rebelde,211826,1979-03-26,1979,0.855,0.738,0.263,0.00302,0.119,-14.1,0.0286,102.089,0.671,1,5,0,False,
4ar5FFL1PghKjBBxCiLgKA,Eu Não Queria Que Isto Acontecesse,Adelito e Rebelde,157518,1979-03-26,1979,0.753,0.574,0.406,8.42e-06,0.119,-13.563,0.0419,173.251,0.654,1,10,0,False,
2u1S73Bzl6Iy0brJnXldQV,Minha História de Amor,Adelito e Rebelde,187794,1979-03-26,1979,0.921,0.598,0.228,1.84e-05,0.105,-12.065,0.0491,176.969,0.651,1,0,0,False,
6TndO7D3zSXgkBsys8Nmbr,"Ngobrolan Warung Pojok, Episode 02","Jayakarta Group, Jojon, Cahyono, Cipto, Andy S",1511637,1979-02-20,1979,0.877,0.671,0.564,0.0,0.522,-6.3,0.67,101.977,0.576,1,1,0,False,
0X8KP7x7XveljDIr6TsGLa,"Ngobrolan Warung Pojok, Episode 01","Jayakarta Group, Jojon, Cahyono, Cipto, Andy S",1556535,1979-02-20,1979,0.899,0.708,0.534,0.0,0.883,-9.055,0.876,128.833,0.612,0,5,0,False,
0VNF1ZJhtYCzGrVwgMHfe0,"Jojon Jagoan Bloon, Episode 01","Jayakarta Group, Jojon, Cahyono, Cipto, Andy S",1598168,1979-10-10,1979,0.977,0.563,0.704,0.0,0.37,-7.141,0.869,65.31,0.657,1,1,0,False,
7AppM78f1H1s3AeMJNNZyv,"Jojon Jagoan Bloon, Episode 02","Jayakarta Group, Jojon, Cahyono, Cipto, Andy S",1587285,1979-10-10,1979,0.969,0.558,0.704,0.0,0.734,-6.586,0.746,86.506,0.672,0,7,0,False,
5rE4ys5AI00lFSZysiXUTb,O Sucesso Me Chama,Adelito e Rebelde,135240,1979-03-26,1979,0.877,0.59,0.311,7.85e-06,0.709,-11.535,0.0604,152.531,0.691,1,7,0,False,
2ZF4pRHJAJRZsJcvYUI3TA,Volte,Adelito e Rebelde,180532,1979-03-26,1979,0.873,0.721,0.251,0.0,0.126,-12.259,0.031,78.539,0.562,1,0,0,False,
5GPmfhuxkiadi2K9b2sf7G,Eu Sei Que Você Tenta Me Esquecer,Adelito e Rebelde,234919,1979-03-26,1979,0.826,0.704,0.37,2.68e-06,0.116,-12.119,0.0553,96.897,0.642,1,1,0,False,
7EfxOBy9Pou9CcmY1bbiql,Juliana,Adelito e Rebelde,208535,1979-03-26,1979,0.872,0.766,0.255,3.9e-05,0.469,-13.554,0.0322,107.108,0.719,1,9,0,False,
14JvA4jwdIhKEq9lX9Q5T1,Prometo Não Mais Errar,Adelito e Rebelde,199968,1979-03-26,1979,0.718,0.657,0.231,0.0,0.339,-12.036,0.0329,92.018,0.518,1,9,0,False,
0EtVGa1H2CeuP3HPACax43,Regresso de um Vaqueiro,Adelito e Rebelde,163631,1979-03-26,1979,0.834,0.691,0.245,0.0,0.485,-11.837,0.0371,76.307,0.574,0,2,0,False,
3y5nK7SX5jp9Jyn7WYIqxk,"Jesus, Dai-Me o Seu Perdão",Adelito e Rebelde,160940,1979-03-26,1979,0.738,0.767,0.327,7.7e-06,0.1,-12.82,0.0347,74.949,0.585,1,9,0,False,
21LxDO1O9ASnAbvCiNRDq8,"Pulcinella Suite, K034b: II. Serenata - III. Scherzino","Igor Stravinsky, Alexander Gibson, English Chamber Orchestra",442000,1979-01-01,1979,0.961,0.314,0.0671,0.705,0.13,-23.187,0.0385,107.424,0.285,1,0,0,False,"classical, early modern classical, neoclassicism, russian modern classical"
3MYKe6AECTY7DbFigS99kX,"Pulcinella Suite, K034b: II. Serenata - III. Scherzino","Igor Stravinsky, Alexander Gibson, English Chamber Orchestra",442000,1979-01-01,1979,0.961,0.314,0.0671,0.705,0.13,-23.187,0.0385,107.229,0.286,1,0,0,False,"classical, early modern classical, neoclassicism, russian modern classical"
45KPvztpBFBO6FMvwJ5ri3,Frog With a Man Voice,This Evening's Show,542772,1979-02-19,1979,0.00108,0.522,0.876,0.448,0.601,-7.702,0.209,120.876,0.62,0,10,0,False,
2U4lQB6yillOgznV7vgCa6,"10,000 Miles Away",The Cobbers,256266,1979,1979,0.601,0.454,0.64,0.0,0.271,-11.728,0.0683,117.667,0.869,1,0,0,False,bush ballad
0sUBzvWnj8DmMXLLSVIftF,"Coro: D'uom fiero nel soglio, Recitativo (Alessandro, Leonato, Clito, Tassile): Chi oserà traditore (1:09) Aria (Alessandro): Prove sono di Grandezza (3:52) - from ""Alessandro""","George Frideric Handel, René Jacobs, Sigiswald Kuijken",338960,1979,1979,0.935,0.481,0.248,4.91e-06,0.243,-19.252,0.108,105.401,0.593,1,4,0,False,"baroque, classical, early music, english baroque, german baroque"
6vOhAv5KYp1cq3frHlMvsP,1980,Herb Alpert,145920,1979-09-01,1979,0.127,0.536,0.644,0.871,0.297,-9.346,0.0299,104.563,0.45,0,7,25,False,jazz trumpet
1uWtiecGoeWarPyLJzaplD,1960,America,191426,1979-01-01,1979,0.89,0.496,0.179,0.00042,0.105,-17.506,0.0276,97.472,0.172,1,9,27,False,"album rock, classic rock, folk rock, mellow gold, soft rock"
3DN9QAUfzTS6WcZLa8KUBP,16th Avenue,Lacy J. Dalton,188160,1979,1979,0.705,0.546,0.323,0.0,0.306,-12.972,0.0332,144.387,0.564,1,7,22,False,classic country pop
0kXtfBgrfnwggeOhIpgKGo,Again And Again And Again - Remastered 1993,Wings,214040,1979-06-06,1979,0.038,0.631,0.64,0.0,0.558,-9.836,0.0325,117.35,0.907,1,0,27,False,"album rock, art rock, classic rock, folk rock, mellow gold, rock, singer-songwriter, soft rock"
21x9OVpVdf6T9Fd7BmqrHH,After The Ball/Million Miles - Remastered 1993,Wings,239493,1979-06-06,1979,0.297,0.401,0.101,8.85e-06,0.11,-14.271,0.0296,73.36,0.327,1,7,25,False,"album rock, art rock, classic rock, folk rock, mellow gold, rock, singer-songwriter, soft rock"
2YkZ06KjaXlqAyGKxXKj21,Another Man's Woman - Live At Pavillon de Paris/1979,Supertramp,452080,1979-03-29,1979,0.394,0.412,0.566,0.00877,0.933,-12.887,0.0383,138.026,0.438,0,2,31,False,"album rock, art rock, classic rock, glam rock, mellow gold, piano rock, progressive rock, rock, soft rock, symphonic rock"
7onU54swU5qTb4HheZdgrR,Another Suitcase In Another Hall - Original Cast Recording/1979,"Andrew Lloyd Webber, Tim Rice, Patti LuPone, Jane Ohringer, Mandy Patinkin, Rene Wiegert",281466,1979-01-01,1979,0.851,0.463,0.159,4.01e-06,0.106,-18.907,0.0409,120.132,0.287,1,1,19,False,"broadway, west end"
3XqPOmAKzXbz5wcGbKklOi,And The Money Kept Rolling In (And Out) - Original Cast Recording/1979,"Andrew Lloyd Webber, Tim Rice, Mandy Patinkin, Original Broadway Cast Of Evita, Rene Wiegert",262106,1979-01-01,1979,0.356,0.445,0.461,0.0,0.179,-14.551,0.0821,160.317,0.673,1,0,19,False,"broadway, west end"
6P2hnVVErhgrc0W0L7CMrS,"Academic Festival Overture, Op. 80","Johannes Brahms, Chicago Symphony Orchestra, Sir Georg Solti",634866,1979-09-01,1979,0.842,0.253,0.184,0.866,0.115,-16.844,0.0355,72.731,0.211,1,0,18,False,"classical, german romanticism, late romantic era"
585PqsRh32DTPvtqwc9ZCy,"Aaja Re O Mere Dilbar Aaja, Pt. 1","Lata Mangeshkar, Nitin Mukesh",299586,1979-12-30,1979,0.954,0.284,0.45,0.0161,0.174,-10.259,0.0328,110.362,0.367,0,11,24,False,"classic bollywood, filmi, lata"
69ToRBlsvl4tMXkOVcr4qi,A Touching Display - 2006 Remastered Version,Wire,415880,1979-09-01,1979,0.911,0.199,0.563,0.747,0.17,-7.506,0.0342,96.895,0.117,1,7,22,False,"alternative rock, art punk, experimental rock, post-punk, punk, uk post-punk"
7vBGWiAa1zP1HZKUbUeX9t,"A Cinema In Buenos Aires, 26 July 1952 - Original Cast Recording/1979","Tim Rice, Andrew Lloyd Webber, Carlos Pasini Hansen, Original Broadway Cast Of Evita, Rene Wiegert",60226,1979-01-01,1979,0.848,0.541,0.392,0.000468,0.21,-15.64,0.461,98.437,0.492,1,5,16,False,
4Js8WJxndfHdYdi5y4fJwg,The Art Of The Possible - Original Cast Recording/1979,"Andrew Lloyd Webber, Patti LuPone, Bob Gunton, Mandy Patinkin, Rene Wiegert",159893,1979-01-01,1979,0.371,0.522,0.292,0.0,0.31,-18.855,0.182,148.648,0.479,0,9,16,False,"broadway, west end"
1UbrHSCGSCcIzUDqfBpZsA,"Atrocity Exhibition - The Factory, Manchester Live 11 April 1980",Joy Division,374173,1979-06-01,1979,0.13,0.336,0.932,0.0955,0.951,-7.525,0.122,140.841,0.14,1,9,22,False,"alternative rock, indie rock, madchester, new wave, post-punk, punk, rock, uk post-punk"
384NxE5gCvG8o2iihtyHFF,The Actress Hasn't Learned The Lines (You'd Like To Hear) - Original Cast Recording/1979,"Andrew Lloyd Webber, Tim Rice, Patti LuPone, Mandy Patinkin, Original Broadway Cast Of Evita, Rene Wiegert",141223,1979-01-01,1979,0.893,0.585,0.0806,0.0,0.0869,-21.851,0.104,115.123,0.196,0,2,15,False,"broadway, west end"
4uDoXDvLLsZVwSvCHBzhPR,Accuracy - Live in Nottingham 10/79,The Cure,155680,1979-05-11,1979,0.226,0.493,0.839,0.909,0.607,-9.835,0.0409,117.507,0.495,0,11,14,False,"new wave, permanent wave, rock, uk post-punk"
4S000F0XdjoZSNGCJFJTsD,"A Few More Kisses To Go - 12"" Version",Isaac Hayes,444160,1979-01-01,1979,0.638,0.626,0.488,0.00731,0.116,-12.088,0.038,132.581,0.467,0,5,17,False,"classic soul, disco, funk, memphis soul, quiet storm, soul, southern soul"
1G9W1iDg6L1vBwGhS63RJT,Another Man's Fool,Waylon Jennings,173888,1979-11-01,1979,0.437,0.845,0.309,0.0503,0.125,-16.391,0.0419,106.047,0.495,1,2,15,False,"classic texas country, country, outlaw country"
1Dv2sbWOUCjs6K5V5tq5jz,A Mutual Friend - 2006 Remastered Version,Wire,268373,1979-09-01,1979,0.782,0.275,0.439,0.69,0.118,-8.522,0.0267,96.713,0.148,1,9,19,False,"alternative rock, art punk, experimental rock, post-punk, punk, uk post-punk"
3FaIYdWU6pG00lek88C7HU,"Angel (St. Louis, November 5, 1979) - 2015 Remaster",Fleetwood Mac,314480,1979-10-12,1979,0.0711,0.578,0.835,0.00204,0.95,-7.436,0.0389,130.401,0.804,1,9,18,False,"album rock, classic rock, rock, soft rock, yacht rock"
36DiTmcDG2sUnZVMqZvnOg,"High Flying, Adored - Original Cast Recording/1979","Andrew Lloyd Webber, Tim Rice, Patti LuPone, Mandy Patinkin, Original Broadway Cast Of Evita, Rene Wiegert",224600,1979-01-01,1979,0.858,0.533,0.195,2.16e-05,0.113,-16.427,0.0408,129.72,0.203,1,5,20,False,"broadway, west end"
2jr0vNYZiiukPwICQFz0Us,Buenos Aires - Original Cast Recording/1979,"Tim Rice, Andrew Lloyd Webber, Patti LuPone, Mark Syers, Original Broadway Cast Of Evita, Rene Wiegert",291131,1979-01-01,1979,0.442,0.634,0.518,1.82e-05,0.565,-15.401,0.256,129.878,0.599,1,5,24,False,
42APZvi9YwpdU9cNutBSHm,"Ancient Airs And Dances, Suite No. 3, [P. 172]: 1. Italiana","Ottorino Respighi, Boston Symphony Orchestra, Seiji Ozawa",169466,1979-01-01,1979,0.924,0.152,0.102,0.791,0.693,-24.521,0.0376,96.294,0.213,1,10,19,False,"classical, early modern classical, impressionism, italian romanticism, neoclassicism, post-romantic era"
2rfKYnKhgZiTnFXVKp8yao,Academy Award Performance,Sparks,301866,1979-03,1979,0.135,0.585,0.885,0.00589,0.254,-5.072,0.0355,152.036,0.592,1,9,17,False,"glam rock, synthpop, zolo"
5NaIKVh7q8jaFSV7rfhanu,"All Along the Watchtower - Live at Nippon Budokan Hall, Tokyo, Japan - February/March 1978",Bob Dylan,206666,1979-04-23,1979,0.26,0.537,0.813,0.00221,0.907,-6.604,0.0415,129.66,0.76,0,9,21,False,"classic rock, country rock, folk, folk rock, rock, roots rock, singer-songwriter"
3cmOBeZ2x0BSzxazV02vYa,Adagio en Mi País,Alfredo Zitarrosa,335533,1979,1979,0.927,0.529,0.172,0.0253,0.0976,-15.751,0.0412,89.503,0.452,1,0,34,False,"canto popular uruguayo, folklore argentino, folklore uruguayo, nueva cancion, trova"
2ZUXrCDGNMEADEf8wtS0l9,"Ancient Airs And Dances, Suite No. 3, [P. 172]: 4. Passacaglia","Ottorino Respighi, Boston Symphony Orchestra, Seiji Ozawa",203226,1979-01-01,1979,0.951,0.299,0.279,0.933,0.155,-13.854,0.0332,116.139,0.401,0,7,18,False,"classical, early modern classical, impressionism, italian romanticism, neoclassicism, post-romantic era"
7pf8Z5F8XvsGbxAIC1SRRu,Dub To Africa,"Prince Far I, The Arabs",199973,1979,1979,1.7e-05,0.755,0.439,0.699,0.254,-11.276,0.0448,129.815,0.499,0,8,30,False,"dub, dub poetry, reggae, roots reggae, uk dub"
79OkVw5IjKs0mef9fRm9xC,"All I Really Want to Do - Live at Nippon Budokan Hall, Tokyo, Japan - February/March 1978",Bob Dylan,228853,1979-04-23,1979,0.524,0.466,0.612,3.85e-06,0.984,-7.105,0.0394,129.034,0.712,1,1,18,False,"classic rock, country rock, folk, folk rock, rock, roots rock, singer-songwriter"
4HeTM95uOsZgfZkj0WKJ3P,1979 It's Dancing Time (Full Length Album Mix),Revanche,519546,1979,1979,0.232,0.814,0.887,0.0174,0.332,-6.617,0.121,124.825,0.746,0,7,15,False,deep disco
2RGUGXtHTkqcffJUZ7Pd1n,Antarctica,Men Without Hats,206026,1979,1979,0.0158,0.772,0.814,0.000443,0.0686,-5.831,0.0703,85.808,0.555,0,10,10,False,"classic canadian rock, new romantic, new wave pop, synthpop"
1Vkg6ktB8X34zKZg6AJMYc,Goodnight And Thank You - Original Cast Recording/1979,"Andrew Lloyd Webber, Tim Rice, Mandy Patinkin, Patti LuPone, Bob Gunton, Original Broadway Cast Of Evita, Rene Wiegert",192306,1979-01-01,1979,0.793,0.703,0.392,0.0,0.159,-16.191,0.0623,108.509,0.876,1,7,19,False,"broadway, west end"
5Z2GSKG5JpnKvutZxyTRB1,A José Artigas,Alfredo Zitarrosa,154866,1979,1979,0.928,0.558,0.337,3.15e-05,0.128,-12.037,0.229,70.645,0.536,0,11,34,False,"canto popular uruguayo, folklore argentino, folklore uruguayo, nueva cancion, trova"
3lYtKnLTruwOGr1noGi2D9,"Concerto for Horn and Orchestra in E-flat Major, K.447: II. Romance. Larghetto - Instrumental","Wolfgang Amadeus Mozart, János Rolla, Dale Clevenger, Franz Liszt Chamber Orchestra, La Grande Écurie et la Chambre du Roy, Jean-Claude Malgoire",283133,1979,1979,0.99,0.216,0.00843,0.845,0.111,-27.064,0.0401,70.452,0.144,1,8,28,False,"classical, classical era"
0donbyfoyQuz1Y5N9dhkxr,いとしのエリー,サザンオールスターズ,264886,1979-04-05,1979,0.239,0.437,0.463,3.86e-06,0.118,-11.379,0.0338,140.768,0.379,1,2,53,False,"classic j-pop, j-pop"
5lRoCNHbAe2tKn7IUYRbVT,あなたがいる人生,Jin Kirigaya,252933,1979,1979,0.588,0.503,0.308,0.00221,0.132,-12.904,0.0321,140.582,0.21,1,4,13,False,classic city pop
4zuUbVOygkYUQkoYIO3DAP,Give A Little Bit - Live At Pavillon de Paris/1979,Supertramp,242760,1979-03-29,1979,0.585,0.388,0.75,0.000457,0.962,-9.083,0.0407,98.816,0.47,1,2,32,False,"album rock, art rock, classic rock, glam rock, mellow gold, piano rock, progressive rock, rock, soft rock, symphonic rock"
7JIhfZMitlPvuNzpC8h2Gl,Sal y Agua,Lisandro Meza Y Su Conjunto,162075,1979-07-06,1979,0.0294,0.751,0.416,0.0,0.105,-8.161,0.731,190.009,0.94,0,11,21,False,cumbia
12oYYewEW6Gw1SaJh6Ky3g,All Over,Burning Spear,125640,1979,1979,0.0149,0.912,0.362,0.316,0.118,-13.517,0.165,128.723,0.571,0,11,14,False,"dub, reggae, roots reggae"
5VsrXsGEbQ1tt64SOrqvJR,"Dim All The Lights - 12"" Version",Donna Summer,432520,1979-04-25,1979,0.0265,0.783,0.726,0.000427,0.288,-9.294,0.0314,120.375,0.864,1,7,22,False,"disco, hi-nrg, new wave pop, soft rock"
39ZZHQG2E7h5SpJDvUrkDo,"Ancient Airs And Dances, Suite No. 1, [P. 109]: 1. Balletto detto ""Il Conte Orlando""","Ottorino Respighi, Boston Symphony Orchestra, Seiji Ozawa",181720,1979-01-01,1979,0.955,0.314,0.0643,0.911,0.138,-21.547,0.0388,120.344,0.311,1,2,13,False,"classical, early modern classical, impressionism, italian romanticism, neoclassicism, post-romantic era"
6PNy4eexagMfQN7L77dkig,We Are So Fragile - 1998 Remaster,Tubeway Army,175933,1979-04-06,1979,0.01,0.561,0.598,0.00129,0.0654,-8.168,0.105,136.789,0.725,1,9,24,False,"early synthpop, new romantic, new wave, uk post-punk, zolo"
4UhozPqJxqnaKauhNusdWj,Requiem For Evita / Oh What A Circus - Original Cast Recording/1979,"Tim Rice, Andrew Lloyd Webber, Mandy Patinkin, Original Broadway Cast Of Evita, Rene Wiegert",551933,1979-01-01,1979,0.653,0.34,0.276,0.0,0.315,-17.276,0.046,134.332,0.288,1,11,21,False,
5FPXhhyHOQjsBOnoazePxf,Canto de aquí para allá,Gustavo Pena - El Príncipe,166112,1979,1979,0.939,0.45,0.265,1.25e-05,0.174,-15.315,0.0273,98.944,0.332,0,11,35,False,"argentine indie, rock nacional"
6U03S0pRakmwMdOlzteQ67,"Ancient Airs And Dances, Suite No. 2, [P. 138]: 3. Campanae parisienses - Aria","Ottorino Respighi, Boston Symphony Orchestra, Seiji Ozawa",356253,1979-01-01,1979,0.962,0.0683,0.0474,0.891,0.2,-24.97,0.042,74.059,0.0588,1,0,13,False,"classical, early modern classical, impressionism, italian romanticism, neoclassicism, post-romantic era"
2h43vP26AShUfADMIS1019,"Akhnaten: Act I, Scene 1: Funeral of Amenhotep III","Philip Glass, Dennis Russell Davies, Cornelius Hauptmann, Paul Esswood, Stuttgart State Opera Orchestra, Chor der Staatsoper Stuttgart, Helmut Holzapfel",541266,1979,1979,0.906,0.434,0.502,0.897,0.392,-13.858,0.0649,178.023,0.243,0,1,11,False,"american contemporary classical, classical, compositional ambient, contemporary classical, minimalism"
4IelIE8X4Gsu6QPHqSnTQx,"Shadow Of A Doubt (A Complex Kid) - Live At Hammersmith Odeon, London, England/1980",Tom Petty and the Heartbreakers,282173,1979-10-19,1979,0.00491,0.441,0.884,0.00174,0.979,-5.286,0.0437,143.02,0.567,1,9,23,False,"album rock, classic rock, hard rock, heartland rock, mellow gold, rock, singer-songwriter, soft rock"
5kdd1nzimLc5Rtad4TUbvG,"Don't Do Me Like That - Live At Hammersmith Odeon, London, England/1980",Tom Petty and the Heartbreakers,169626,1979-10-19,1979,0.193,0.653,0.9,3.37e-06,0.995,-5.595,0.0447,122.635,0.881,1,0,27,False,"album rock, classic rock, hard rock, heartland rock, mellow gold, rock, singer-songwriter, soft rock"
20R2CCtPvCNWhGYlO3jTUP,Breakfast In America - Live At Wembley/1979,Supertramp,185173,1979-03-29,1979,0.541,0.514,0.638,2.19e-06,0.825,-11.961,0.112,77.636,0.559,0,0,34,False,"album rock, art rock, classic rock, glam rock, mellow gold, piano rock, progressive rock, rock, soft rock, symphonic rock"
7liVHOZmyeuMOI80YlNmH4,"Ancient Airs And Dances, Suite No. 1, [P. 109]: 2. Gagliarda","Ottorino Respighi, Boston Symphony Orchestra, Seiji Ozawa",202200,1979-01-01,1979,0.961,0.28,0.0824,0.918,0.157,-19.06,0.0346,93.352,0.321,1,2,11,False,"classical, early modern classical, impressionism, italian romanticism, neoclassicism, post-romantic era"
4KnPAIisb1jXEHsiq4zpht,"The Nutcracker (Suite), Op. 71a, TH. 35: I. Miniature Overture","Pyotr Ilyich Tchaikovsky, Berliner Philharmoniker, Mstislav Rostropovich",184093,1979,1979,0.954,0.463,0.0612,0.836,0.0857,-26.987,0.0439,124.36,0.449,1,10,15,False,"classical, late romantic era, russian romanticism"
07k71c8312GKekT3pdz5Cj,"La Bohème / Act 1: ""O soave fanciulla""","Giacomo Puccini, José Carreras, Katia Ricciarelli, Orchestra of the Royal Opera House, Covent Garden, Sir Colin Davis",261160,1979-12-01,1979,0.986,0.16,0.0718,0.0157,0.0889,-21.947,0.0474,69.479,0.0395,1,0,31,False,"classical, italian opera, italian romanticism, post-romantic era"
2IBM4EpEiJbvmlXCWT78e3,Alphaville - Bonus Track,The Monochrome Set,173506,1979-01-01,1979,0.0201,0.501,0.507,0.00142,0.31,-12.109,0.0422,126.336,0.793,1,5,12,False,uk post-punk
27Eo5ctdOEGE2BlgW17Ip3,"Walk Away - 12"" Version",Donna Summer,435266,1979-04-25,1979,0.0449,0.834,0.855,0.00186,0.0566,-7.787,0.0451,114.053,0.896,0,8,21,False,"disco, hi-nrg, new wave pop, soft rock"
2hEnSKuSuzLbwKUZhybyY4,Winter Rose/Love Awake - Remastered 1993,Wings,297800,1979-06-06,1979,0.41,0.314,0.198,6.83e-06,0.108,-15.125,0.0319,171.956,0.291,1,2,24,False,"album rock, art rock, classic rock, folk rock, mellow gold, rock, singer-songwriter, soft rock"
2mdeBSWdNu0kXzvqWMjREM,"Alison - Live At Hollywood High, 1978",Elvis Costello & The Attractions,185040,1979-01-05,1979,0.33,0.507,0.543,8.73e-05,0.876,-7.524,0.0408,94.917,0.527,1,4,8,False,"art rock, new romantic, new wave, new wave pop, power pop"
6iN1TTunTJBekwrKhVQMou,"Like a Rolling Stone - Live at Nippon Budokan Hall, Tokyo, Japan - February/March 1978",Bob Dylan,397133,1979-04-23,1979,0.508,0.406,0.724,0.00546,0.866,-6.594,0.0347,97.325,0.467,1,0,24,False,"classic rock, country rock, folk, folk rock, rock, roots rock, singer-songwriter"
5LnX31wL57Ac0UixPWojui,I'm Alive,Gamma,198120,1979,1979,0.00558,0.724,0.612,0.0397,0.299,-7.062,0.028,130.077,0.49,1,0,17,False,
0riVEt2GGqiYHLtmlwB33g,"Ancient Airs And Dances, Suite No. 2, [P. 138]: 4. Bergamasca","Ottorino Respighi, Boston Symphony Orchestra, Seiji Ozawa",319333,1979-01-01,1979,0.944,0.453,0.146,0.489,0.0881,-17.337,0.037,90.239,0.444,1,2,11,False,"classical, early modern classical, impressionism, italian romanticism, neoclassicism, post-romantic era"
3neV49w5AEDDfZJxjeLiit,"Ancient Airs And Dances, Suite No. 3, [P. 172]: 2. Arie di corte","Ottorino Respighi, Boston Symphony Orchestra, Seiji Ozawa",394626,1979-01-01,1979,0.958,0.165,0.0553,0.914,0.108,-20.632,0.0386,89.535,0.18,0,7,9,False,"classical, early modern classical, impressionism, italian romanticism, neoclassicism, post-romantic era"
5B1HWWvYg765RkBYWc5esh,Waltz For Eva And Che - Original Cast Recording/1979,"Tim Rice, Andrew Lloyd Webber, Mandy Patinkin, Patti LuPone, Original Broadway Cast Of Evita, Rene Wiegert",225066,1979-01-01,1979,0.87,0.579,0.26,0.0,0.126,-14.957,0.0348,93.466,0.385,1,10,18,False,
2iC8n6ZQX07TFl2Lnc1XCx,Aloha Mama - 2003 Remaster,Chicago,251266,1979-08-13,1979,0.193,0.614,0.807,0.000807,0.615,-6.168,0.0555,131.028,0.713,0,7,9,False,"album rock, classic rock, mellow gold, rock, soft rock, yacht rock"
1QhaYQrhargwyi9TcycR8h,Spin It On - Remastered 1993,Wings,132240,1979-06-06,1979,0.000213,0.544,0.786,0.000241,0.19,-10.194,0.0738,129.266,0.933,1,2,29,False,"album rock, art rock, classic rock, folk rock, mellow gold, rock, singer-songwriter, soft rock"
0vtD9ZXIlYXay6xL4I1Pc8,Public High School,Necros,87883,1979-09-14,1979,0.0174,0.302,0.644,0.000216,0.526,-9.171,0.114,197.571,0.764,1,10,20,False,"anarcho-punk, crossover thrash, crust punk, hardcore punk, ohio hardcore"
