id,name,artists,duration_ms,release_date,year,acousticness,danceability,energy,instrumentalness,liveness,loudness,speechiness,tempo,valence,mode,key,popularity,explicit,genre
6CuC5ceZg9BtTyPp3VtlRK,What Can I Say After I Say I'm Sorry?,Hoosier Hot Shots,144880,1934-09-15,1934,0.951,0.719,0.209,7.39e-06,0.0713,-10.978,0.0671,170.041,0.842,1,3,0,False,"novelty, traditional country"
2ODpNF79IgFPmt67ehyKh6,The Show is Over (Roy Fox),Roy Fox,177280,1934,1934,0.953,0.371,0.0974,0.00731,0.109,-15.405,0.0356,123.84,0.214,0,2,0,False,british dance band
7efygglBmoc6IBSXqBgupM,O Corse Ile D'amour,Tino Rossi,184666,1934,1934,0.97,0.413,0.141,2.71e-05,0.322,-14.543,0.0512,74.316,0.188,1,0,0,False,"vintage chanson, ye ye"
2jqDOzeAaqYl0OkvQGV4gX,Let Me Do It To You Baby,E-Motion,308613,1934,1934,0.00942,0.869,0.888,0.00111,0.186,-2.731,0.0859,135.023,0.856,0,4,0,False,
0AhXmVoSMjrIFRZz3hTh46,Symphonie sur un chant montagnard français Op. 25: III Animé,"Vincent d'Indy, Marguerite Long, Colonne Symphony Orchestra",431920,1934,1934,0.96,0.292,0.267,0.826,0.235,-15.138,0.0455,86.567,0.121,1,8,0,False,"early modern classical, french romanticism, impressionism, late romantic era"
0ybo79Gu1pm9IwiYOAOPgC,Nrc Jump,Red Norvo,297733,1934-12-15,1934,0.917,0.688,0.162,0.00556,0.106,-17.695,0.0565,97.62,0.598,0,5,0,False,"cool jazz, jazz vibraphone, swing, vintage jazz"
2shhptegkTUGqhYqnUEovR,Rencor,Julio Sosa,187493,1934-02-25,1934,0.974,0.422,0.627,1.38e-05,0.313,-9.24,0.119,122.196,0.528,0,10,7,False,"folklore argentino, tango"
1h9tGEO9xbarDMKW7MeFBk,María,Julio Sosa,176933,1934-02-25,1934,0.954,0.418,0.579,0.0,0.163,-10.134,0.0912,121.858,0.598,0,7,9,False,"folklore argentino, tango"
1wvWLObklI38hPs5VnQk2J,Tiempos Viejos,Julio Sosa,139893,1934-02-25,1934,0.99,0.594,0.447,0.876,0.144,-10.386,0.0839,126.732,0.658,0,0,12,False,"folklore argentino, tango"
5E1QiDTyXUYFazkXFMf4iG,Recordándote,Julio Sosa,187640,1934-02-25,1934,0.904,0.567,0.493,0.00042,0.13,-8.878,0.0817,116.249,0.561,1,9,13,False,"folklore argentino, tango"
5h1BzrnHYlw4v4lM18LzCI,Sur,Julio Sosa,195693,1934-02-25,1934,0.991,0.561,0.364,0.0073,0.11,-5.771,0.0545,120.339,0.389,1,5,5,False,"folklore argentino, tango"
4APzh2qBbISWkapq9BFLhP,Nunca Tuvo Novio,Julio Sosa,219613,1934-02-25,1934,0.96,0.366,0.638,0.0,0.0959,-8.747,0.0708,118.341,0.519,1,10,8,False,"folklore argentino, tango"
1412v8NRstozIrgGZioI9m,Volvio una Noche,Julio Sosa,195413,1934-02-25,1934,0.971,0.442,0.571,0.0605,0.168,-9.567,0.0785,112.472,0.773,1,1,4,False,"folklore argentino, tango"
1TbfrHZWEWcd1ivdS6965I,Miss Otis Regrets/Just One of Those Things,"The Pogues, Kirsty MacColl",284133,1934,1934,0.338,0.332,0.79,0.000151,0.147,-11.023,0.0752,156.875,0.644,1,0,11,False,"celtic punk, celtic rock, folk punk, punk"
2YyiEkkMgxdw3VDNyL9A9U,Llorando la Carta,Julio Sosa,167880,1934-02-25,1934,0.832,0.56,0.686,0.0,0.0942,-4.593,0.0595,123.787,0.815,1,5,5,False,"folklore argentino, tango"
6qW7kzDdTOAqUXOip8GPGg,Jivan Been Madhur Na Baje,K. L. Saigal,202043,1934-01-01,1934,0.995,0.369,0.252,0.969,0.11,-11.507,0.0669,68.684,0.358,1,1,0,False,"classic bollywood, filmi, ghazal"
2g9xAg7WCfabnu1erVebgh,Jaagay Ho Kaheen Rain Baalam Moray,Kamala Singha Jharia,186624,1934-12-31,1934,0.994,0.427,0.281,0.925,0.198,-10.631,0.0426,92.069,0.668,0,6,0,False,
6UunFFvx4RHzOKUwegE7fc,Jo Beet Chuki So Beet Chuki,K. L. Saigal,193277,1934-01-01,1934,0.993,0.492,0.278,0.187,0.149,-9.284,0.037,95.223,0.279,1,8,0,False,"classic bollywood, filmi, ghazal"
0b67Fz1xiHojV7XOCxcbrg,Jhuaniya Waali Ray Daiyya,Siddheshwari Bai,190258,1934-12-31,1934,0.986,0.456,0.0862,0.00138,0.55,-13.276,0.318,75.518,0.44,1,2,0,False,
6H5aDXSY3UqkEHMNzpF0ze,Jholo Nai Jholo Re Jholo,Waheedan Bai,187608,1934-12-31,1934,0.991,0.433,0.0636,0.0241,0.291,-14.234,0.245,75.202,0.564,0,9,0,False,
0rjDxuPhsjVT1BxY2ge4IS,Janam Janam Ka Dukhiya Prani,K. L. Saigal,173125,1934-01-01,1934,0.996,0.588,0.477,0.938,0.193,-10.26,0.0374,134.854,0.748,1,10,0,False,"classic bollywood, filmi, ghazal"
5GMDVua99nu0WygAFG5s0v,Jibone Jegechhilo Madhumas,Pankaj Mullick,195466,1934-12-01,1934,0.972,0.319,0.138,0.778,0.108,-16.494,0.0429,68.699,0.0735,0,3,0,False,"classic bollywood, filmi, rabindra sangeet"
7o66cNTnbOkbHmaw20pz5J,Jhulana Jhulao Ri,K. L. Saigal,186934,1934-01-01,1934,0.994,0.537,0.426,0.734,0.0845,-9.235,0.0322,119.245,0.599,1,5,0,False,"classic bollywood, filmi, ghazal"
0eNyLYi3zvG7H5Jy8nCwUV,You Just as Well Let Her Go,"Kokomo Arnold, Casey Bill Weldon",189080,1934-05-20,1934,0.992,0.646,0.407,0.107,0.111,-11.207,0.0449,178.394,0.883,1,7,0,False,"acoustic blues, chicago blues, delta blues, traditional blues"
7swvAYnysK0DX9DjndKddC,Raag Jogiya - Raag Rani Durga Bai,Raag Rani Durga Bai,261269,1934-12-31,1934,0.993,0.443,0.0539,0.00515,0.11,-16.623,0.079,127.904,0.275,1,9,0,False,
4jztNa9rbMHDchRFQNDzwF,So Ja Rajkumari,K. L. Saigal,178815,1934-01-01,1934,0.991,0.245,0.202,0.955,0.0999,-14.07,0.0403,185.9,0.12,0,6,2,False,"classic bollywood, filmi, ghazal"
3KSTpSGhrMtNyohQxvugsV,Tumi Jabe Chole Balo Ki,Santosh Sengupta,184826,1934-12-01,1934,0.993,0.294,0.241,0.0154,0.152,-11.934,0.0407,161.764,0.203,1,9,0,False,
6eOq9nNvOmQFLq9U005gdJ,Slop Jar Blues,Kokomo Arnold,180693,1934-05-20,1934,0.952,0.737,0.0378,0.0,0.107,-18.978,0.0591,87.577,0.534,1,2,0,False,"acoustic blues, chicago blues, delta blues, traditional blues"
4YbpDu1yUdFJMsAv19WCE9,Mam Jiva Sukhvaya,"Ratnaprabha, Dadasaheb Torne",210845,1934-01-01,1934,0.995,0.463,0.157,0.805,0.22,-9.791,0.0553,71.805,0.479,0,1,0,False,
7sAVIkanRFFOvUbiclBhKM,Sister Jane Cross the Hall,Kokomo Arnold,160893,1934-05-20,1934,0.984,0.575,0.208,7.25e-05,0.0968,-15.054,0.0567,128.348,0.767,1,6,0,False,"acoustic blues, chicago blues, delta blues, traditional blues"
0faZUw3gtlSw1ZUhKhZ3Mn,Mala Suerte - Versión Con Julio Sosa,Julio Sosa,183853,1934-02-25,1934,0.973,0.504,0.494,0.0209,0.239,-11.828,0.0822,122.925,0.847,1,11,2,False,"folklore argentino, tango"
3CrRh7ScCSNI51dY7tNfsh,Tenemos Que Abrirnos,Julio Sosa,200466,1934-02-25,1934,0.89,0.541,0.553,1.14e-06,0.076,-3.805,0.0518,119.692,0.811,1,2,1,False,"folklore argentino, tango"
5jgaZ7ReEPC6WfaXBs2CuV,Lloró Como una Mujer,Julio Sosa,188893,1934-02-25,1934,0.944,0.507,0.63,0.0,0.0815,-9.817,0.0671,119.625,0.749,0,2,2,False,"folklore argentino, tango"
6VjFjspKBJB0LuhGeeKIj9,Silbando,Julio Sosa,190960,1934-02-25,1934,0.866,0.519,0.544,5.92e-06,0.115,-5.876,0.0425,123.94,0.532,1,7,1,False,"folklore argentino, tango"
1KejplBCIlhxUjFQnNGtsk,Mala Suerte - Versión Alternativa,Julio Sosa,183973,1934-02-25,1934,0.994,0.483,0.587,0.537,0.281,-9.495,0.0939,125.413,0.867,1,11,1,False,"folklore argentino, tango"
2x5JZpIDdB90XIxmEk4UnL,Por Seguidora y por Fiel,Julio Sosa,204680,1934-02-25,1934,0.955,0.469,0.607,0.0,0.16,-4.717,0.0444,118.976,0.623,1,3,2,False,"folklore argentino, tango"
21knx0snztykwZCZH9nXgK,La Casita Está Triste,Julio Sosa,178546,1934-02-25,1934,0.922,0.528,0.561,3.45e-06,0.331,-4.271,0.0529,120.591,0.695,0,11,2,False,"folklore argentino, tango"
1HakvLncrgLt0BjSuVj1gT,Soledad,Julio Sosa,198973,1934-02-25,1934,0.96,0.327,0.648,0.0788,0.169,-7.666,0.107,51.151,0.722,0,0,2,False,"folklore argentino, tango"
5li9TuAL1aDuLl1TqQBfRa,Padrino Pelao,Julio Sosa,194253,1934-02-25,1934,0.837,0.605,0.483,0.0,0.0857,-5.069,0.0944,118.296,0.685,1,9,2,False,"folklore argentino, tango"
3VNyO7VGwZU9qlbOdiDR1b,"No Te Apures, Cara Blanca",Julio Sosa,145280,1934-02-25,1934,0.981,0.499,0.427,0.63,0.477,-11.557,0.0619,117.978,0.662,1,0,2,False,"folklore argentino, tango"
06SCZnoE0qiuBBV5fvccut,Nunca Tuvo Novio - Versión Alternativa,Julio Sosa,222546,1934-02-25,1934,0.946,0.394,0.608,2.32e-06,0.155,-10.563,0.0604,108.979,0.551,1,10,1,False,"folklore argentino, tango"
1e66MFiuyjYc471f2KKuPb,Yo Soy Aquel Muchacho,Julio Sosa,206344,1934-02-25,1934,0.914,0.504,0.462,0.0,0.373,-5.625,0.0852,60.038,0.505,1,1,2,False,"folklore argentino, tango"
13uiZTebMQjEnVqClynjPU,Uno,Julio Sosa,216293,1934-02-25,1934,0.978,0.408,0.527,0.0898,0.176,-13.415,0.0622,118.398,0.596,0,0,3,False,"folklore argentino, tango"
1D84qUQWsLHt8wwt3qQ2fn,Tan Solo por Verte,Julio Sosa,154533,1934-02-25,1934,0.982,0.517,0.441,2.29e-06,0.171,-6.096,0.0434,123.331,0.451,0,10,1,False,"folklore argentino, tango"
0T8B70yl3qFfobewN85bIy,Mascarita,Julio Sosa,187573,1934-02-25,1934,0.973,0.581,0.302,0.0173,0.132,-11.341,0.0573,124.914,0.484,0,7,2,False,"folklore argentino, tango"
0diude5OJlpDshNQtTvtGf,Una y Mil Noches,Julio Sosa,163373,1934-02-25,1934,0.983,0.692,0.272,5.56e-05,0.0806,-7.054,0.0564,124.52,0.526,1,9,1,False,"folklore argentino, tango"
2tPXM5r53c5c56nHM6E5OH,Viejo Smoking,Julio Sosa,172573,1934-02-25,1934,0.971,0.447,0.494,9.93e-05,0.103,-10.859,0.0697,126.802,0.636,1,11,2,False,"folklore argentino, tango"
6lx8Np44g4mDRL3xu9fHlR,Pa' Mi Es Igual,Julio Sosa,176546,1934-02-25,1934,0.956,0.49,0.464,0.00121,0.484,-9.038,0.0982,123.408,0.781,0,2,2,False,"folklore argentino, tango"
6iGlEGA0Ms7NQJfJveXC1d,Mi Sentencia,Julio Sosa,181773,1934-02-25,1934,0.961,0.536,0.438,7.42e-05,0.11,-5.163,0.0536,121.901,0.435,1,5,1,False,"folklore argentino, tango"
3I7vvoDjPKp441C4NN680q,Olvidao,Julio Sosa,195373,1934-02-25,1934,0.948,0.485,0.515,0.0,0.241,-3.96,0.041,129.864,0.487,0,3,2,False,"folklore argentino, tango"
4S6ueqoqZy6xjXLLiklc6T,No Me Pidas Amor,Julio Sosa,125693,1934-02-25,1934,0.859,0.515,0.644,0.0,0.2,-8.031,0.272,81.722,0.622,0,9,1,False,"folklore argentino, tango"
6vw5dkhM6ZBcmsawOJupsF,Maria - Versión Alternativa,Julio Sosa,173213,1934-02-25,1934,0.973,0.495,0.526,0.0661,0.132,-9.632,0.0827,61.845,0.694,0,7,1,False,"folklore argentino, tango"
3OY39VjH9y2SQNK5K1MK5T,Quién Hubiera Dicho,Julio Sosa,171573,1934-02-25,1934,0.939,0.505,0.544,5.97e-05,0.374,-10.248,0.124,124.43,0.588,0,4,2,False,"folklore argentino, tango"
0MylXGNmWAP7I3EWc0zQxr,Un Alma Buena,Julio Sosa,190893,1934-02-25,1934,0.902,0.457,0.765,2.67e-05,0.234,-3.374,0.105,123.981,0.548,1,8,1,False,"folklore argentino, tango"
02lyuV5LMOo3Twb132nmT0,Por una Mala Mujer,Julio Sosa,220680,1934-02-25,1934,0.948,0.525,0.565,3.34e-05,0.11,-4.375,0.0422,116.778,0.527,0,9,2,False,"folklore argentino, tango"
2vAqLkOCnFa5NFHDFbo6bW,Must We Say Goodnight - So Soon,"Richard Himber and his Orchestra, Joey Nash",167586,1934-07-01,1934,0.856,0.227,0.421,0.00822,0.128,-9.974,0.0331,137.648,0.193,1,10,0,False,
2IUki2FNlStZ7dRJtI3PvP,Time to Go Home,Jack Jackson & His Orchestra,180226,1934,1934,0.957,0.687,0.158,0.0329,0.0645,-15.922,0.0646,161.1,0.932,1,10,0,False,british dance band
2rkQX8ZL0S3B3Xn5fQfFcC,Ol' Pappy,Jack Jackson & His Orchestra,194520,1934,1934,0.982,0.709,0.0311,0.00103,0.101,-23.874,0.0777,99.294,0.506,1,3,0,False,british dance band
4uPTbkyaF0wTZAP0jsjmFC,Our Big Love Scene,"Richard Himber and his Orchestra, Joey Nash",158746,1934-07-01,1934,0.985,0.293,0.34,0.0021,0.106,-9.33,0.0337,141.414,0.338,1,10,0,False,
670CzmDwQh19kiyETeLv3B,When Loves Comes Swinging Along,"Richard Himber and his Orchestra, Joey Nash",178213,1934-07-01,1934,0.758,0.381,0.298,0.00151,0.172,-10.745,0.0451,120.082,0.539,1,3,0,False,
3SUr76hUzTepeqrkhZ5iXj,Smoke Rings,"Richard Himber and his Orchestra, Joey Nash",165933,1934-07-01,1934,0.979,0.652,0.142,0.000327,0.137,-11.551,0.0442,100.299,0.525,0,5,0,False,
6JSl4HTxDPcw37pIbWOODI,"Play to Me, Gypsy!",Jack Jackson & His Orchestra,187813,1934,1934,0.905,0.42,0.0648,0.000681,0.26,-22.374,0.0498,130.788,0.626,1,10,0,False,british dance band
0O36GAbWkXax3qC8j3bRaI,Kadam Chale Aage,K. L. Saigal,194307,1934-01-01,1934,0.994,0.377,0.339,0.94,0.24,-11.534,0.0449,77.103,0.528,1,10,0,False,"classic bollywood, filmi, ghazal"
7JxZsrGaT1D1RbTibQGill,Kya Humne Bigada Hai Kyun,K. L. Saigal,175605,1934-01-01,1934,0.995,0.508,0.403,0.894,0.369,-9.355,0.0743,146.143,0.814,1,5,0,False,"classic bollywood, filmi, ghazal"
7BjCj5WNUSXsumuHceHkHI,Kahe Ko Raad Machai,"K. L. Saigal, Pahari Sanyal",197019,1934-01-01,1934,0.995,0.608,0.355,0.692,0.126,-8.941,0.0381,119.957,0.705,0,2,0,False,"classic bollywood, filmi, ghazal"
7JMyLL0LlKHsR62m4ZERtW,Kaun Bujhave Ram Tapas More,K. L. Saigal,193209,1934-01-01,1934,0.995,0.4,0.292,0.891,0.147,-11.115,0.0347,85.053,0.254,0,7,0,False,"classic bollywood, filmi, ghazal"
54oQmzvv8KQv1MsZI8tB37,Kisney Yeh Sab Khel Rachaya,K. L. Saigal,187392,1934-01-01,1934,0.994,0.421,0.0554,0.372,0.162,-16.415,0.0543,72.685,0.149,1,1,0,False,"classic bollywood, filmi, ghazal"
281b3CcRUT0XsxYEBI5reS,Karun Kya Aas Nirash Bhai,K. L. Saigal,203671,1934-01-01,1934,0.995,0.62,0.203,0.0965,0.104,-11.133,0.0369,97.498,0.457,1,9,0,False,"classic bollywood, filmi, ghazal"
3fp2M2m19TAr8vO7yB8uTI,Kid Man Blues,Kokomo Arnold,167813,1934-05-20,1934,0.995,0.702,0.206,3.73e-05,0.237,-15.469,0.0354,93.162,0.495,0,10,0,False,"acoustic blues, chicago blues, delta blues, traditional blues"
0tT3ZbgGth7f02WfE7sAf1,Kapoio Mystiko,"Kostas Giannidis, Koula Nikolaidou, Takis Morakis",208375,1934,1934,0.844,0.135,0.517,0.0,0.338,-6.326,0.035,79.394,0.412,1,2,0,False,
0RNz3BHaAvtcPE1TSYk0Ac,Katha Chhilo Aaj Raate,K.C.Dey,199453,1934-12-01,1934,0.994,0.506,0.101,0.888,0.109,-18.514,0.038,73.99,0.23,1,9,0,False,
44cSKxwvjtge2B0Sn0xsoE,Kahaan Hain Sab Kuchh Laala Aur Gule Mein Pramukh Bane,Miss Kamala Singh,173534,1934-12-31,1934,0.951,0.485,0.343,0.517,0.624,-10.693,0.23,114.091,0.74,0,3,0,False,
77j9Aoe68CXJrRVFYIuaLC,Kiti Sukhada Yet Nisha,"Shanta Apte, Shantaram Athavale",190411,1934-12-31,1934,0.978,0.497,0.172,0.436,0.115,-13.553,0.101,105.62,0.532,1,4,0,False,classic bollywood
5Z7vrKIHvqYSP2T0BELPFc,Kaisay Katay Rajani Sajani,Bhaag-Wati Shankar,166440,1934-12-31,1934,0.995,0.561,0.256,0.91,0.399,-11.857,0.185,79.943,0.835,1,10,0,False,
10NlChlTLMUTQZ5VkhVjR9,Kaisay Kaisay Jaawun Shyam Milan Ko,Mallikarjun Mansur,275655,1934-12-31,1934,0.996,0.683,0.125,0.751,0.258,-14.055,0.0828,66.296,0.809,1,5,0,False,"hindustani classical, hindustani vocal, indian classical, khayal"
52nAqS62Aq6REs47ED8XlF,Kamsini Mein Dil Pe Gham Ka,Shanta Apte,128666,1934-12-31,1934,0.985,0.272,0.0339,0.000401,0.113,-20.963,0.0363,105.149,0.149,1,3,0,False,classic bollywood
6cpTYgUwvl5HqFPWVccFf2,Kudrat Aaya Chamke,Phiroz Dastur,187617,1934-12-31,1934,0.994,0.404,0.16,0.868,0.441,-12.099,0.0851,81.992,0.77,1,10,0,False,
0ACKes5QlsC9KRMgvXvi4V,Kesay Bitaai Sukh Rain Sakhi,Saraswatibai,183344,1934-12-31,1934,0.956,0.287,0.681,0.964,0.432,-9.359,0.109,69.613,0.468,1,1,0,False,
6h9phPXKLI9wgfpwyHW0ob,Kaanha Anokhe Khillari Holii Khelan Hun Jawo,Zohra Bai,179815,1934-12-31,1934,0.996,0.563,0.226,0.893,0.255,-12.685,0.261,68.381,0.632,1,7,0,False,
2bmPz9hK7gXEAcQwI3Cobn,Aah Ko Chaahiye Ik Umr Asar Hone Tak,K. L. Saigal,210545,1934-01-01,1934,0.995,0.54,0.223,0.916,0.0799,-13.94,0.14,121.305,0.38,1,7,0,False,"classic bollywood, filmi, ghazal"
5mmwVykVVgNZbZuzd3ak2c,Main Kya Janu Kya Jaadoo Hai,K. L. Saigal,179368,1934-01-01,1934,0.995,0.655,0.336,0.881,0.14,-8.945,0.0336,114.16,0.51,0,5,0,False,"classic bollywood, filmi, ghazal"
0olKM6Td2bLRTll1fleoIr,Panchi Kahe Hota Udas,K. L. Saigal,193665,1934-01-01,1934,0.992,0.327,0.673,0.819,0.497,-8.498,0.0585,83.761,0.617,1,5,0,False,"classic bollywood, filmi, ghazal"
7BU9uetkaQZwWPPJeZita2,Ab Kya Bataun Main Tere Milne Se Kya Mila,K. L. Saigal,193011,1934-01-01,1934,0.973,0.616,0.507,0.0156,0.188,-5.964,0.15,73.703,0.435,1,7,0,False,"classic bollywood, filmi, ghazal"
2ZEPvxFOm3G0E6HEPrEsKD,Ye Kaisa Anyay Data,K. L. Saigal,211565,1934-01-01,1934,0.994,0.4,0.309,0.946,0.161,-10.296,0.0438,67.891,0.28,1,9,0,False,"classic bollywood, filmi, ghazal"
2mqvekJaQjikEwrAO8OzsU,Main Man Ki Baat Bataoon,K. L. Saigal,186485,1934-01-01,1934,0.994,0.546,0.259,0.854,0.248,-10.266,0.0584,124.53,0.701,1,4,0,False,"classic bollywood, filmi, ghazal"
0iuEVwb15h03Awwn1rZHHZ,Nayan Heen Ko Raah Dikha,K. L. Saigal,177399,1934-01-01,1934,0.993,0.234,0.351,0.822,0.111,-11.444,0.0454,67.607,0.287,1,5,0,False,"classic bollywood, filmi, ghazal"
3CAKFZQBdVgFZHeAtEBqCD,Apni Hasti Ka Asar Khushnamaya Ho Jaaye,K. L. Saigal,198511,1934-01-01,1934,0.995,0.49,0.302,0.905,0.108,-9.786,0.0419,100.646,0.465,0,10,0,False,"classic bollywood, filmi, ghazal"
6rkVYmyNclei9sTbexwVSW,Haaye Kis Baat Ki Mohabbat Mein,K. L. Saigal,203124,1934-01-01,1934,0.995,0.283,0.231,0.967,0.119,-14.099,0.0406,76.687,0.231,1,9,0,False,"classic bollywood, filmi, ghazal"
5jShAKt65dYTWuD17eiyf6,Ab Kya Bataun Main Tere Milne Se Kya Mila,K. L. Saigal,190843,1934-01-01,1934,0.992,0.572,0.406,0.152,0.17,-9.034,0.0847,72.236,0.438,1,7,0,False,"classic bollywood, filmi, ghazal"
1C1f1iELy7ZkqjRwF4GWjn,O Koubaros Ki I Koubara,"Kostas Giannidis, Nikos Gounaris",204207,1934,1934,0.942,0.379,0.48,0.0,0.508,-8.812,0.0516,73.762,0.497,1,1,0,False,
3d4DedEBRdByys0lCqfqld,Main Nahin Makhan Khayo,K. L. Saigal,167759,1934-01-01,1934,0.995,0.402,0.27,0.822,0.11,-11.593,0.0491,132.559,0.758,1,10,0,False,"classic bollywood, filmi, ghazal"
4WS2AUc19g2tyAzHhq7dVB,Suno Suno Hey Krishna Kala,K. L. Saigal,212114,1934-01-01,1934,0.994,0.542,0.189,0.834,0.162,-13.228,0.0469,126.377,0.376,1,4,0,False,"classic bollywood, filmi, ghazal"
4cc3c5kwgwWbjHROOdkDCQ,Andhe-ki-laathitu Hi Hai,K. L. Saigal,217290,1934-01-01,1934,0.992,0.386,0.322,0.0225,0.164,-9.484,0.0419,103.577,0.144,1,6,0,False,"classic bollywood, filmi, ghazal"
68RRb4DEs4FFfAhS54Bdvy,Prem Nagar Mein Banaaoongi,K. L. Saigal,194840,1934-01-01,1934,0.966,0.631,0.422,9.27e-05,0.17,-5.574,0.0372,109.731,0.726,0,0,0,False,"classic bollywood, filmi, ghazal"
3FmdZLCHtjlNjQCAVEe5bp,Matwale Panese,K. L. Saigal,212745,1934-01-01,1934,0.995,0.476,0.302,0.894,0.12,-12.694,0.0551,100.844,0.508,1,11,0,False,"classic bollywood, filmi, ghazal"
2Uw5C1ZnUV4x1Hkinb9tsM,Us Mast Nazar Pe,K. L. Saigal,182298,1934-01-01,1934,0.966,0.286,0.391,0.0,0.104,-7.393,0.0394,77.576,0.526,1,5,0,False,"classic bollywood, filmi, ghazal"
7dtcAN6yWZi2POnZXtXZVX,Main Unhe Chhedun,K. L. Saigal,200301,1934-01-01,1934,0.993,0.469,0.361,0.191,0.114,-8.348,0.0485,108.334,0.337,1,0,0,False,"classic bollywood, filmi, ghazal"
7a5OaainESJIlCglHzeoji,Madhukar Shyam Hamare Chor,K. L. Saigal,196398,1934-01-01,1934,0.994,0.399,0.238,0.94,0.158,-12.426,0.0531,73.059,0.573,0,3,0,False,"classic bollywood, filmi, ghazal"
0KvwVN7q2SjoUpNqH7woNd,Sapt Suran Teen Gram,K. L. Saigal,219485,1934-01-01,1934,0.995,0.398,0.301,0.854,0.135,-10.559,0.0413,123.079,0.288,1,8,0,False,"classic bollywood, filmi, ghazal"
6G94eDOY2llSSdfnQoas69,Hori Ho Brijraj Dulare,K. L. Saigal,198270,1934-01-01,1934,0.994,0.446,0.31,0.956,0.233,-9.875,0.0357,67.069,0.654,1,0,0,False,"classic bollywood, filmi, ghazal"
59Ax9IXkm7zW8tGiM8TKXd,Layi Hayaat Aaye Qaza Le Chali Chale,K. L. Saigal,201316,1934-01-01,1934,0.991,0.484,0.339,0.572,0.179,-9.251,0.0808,128.759,0.377,1,10,0,False,"classic bollywood, filmi, ghazal"
4EyaTctbds1ceF8sVl49VA,Tadapat Beete Din Rain,K. L. Saigal,194893,1934-01-01,1934,0.994,0.275,0.141,0.442,0.0974,-11.698,0.0464,73.894,0.105,1,2,0,False,"classic bollywood, filmi, ghazal"
6QjAWVjah298UkiZeAmObN,Radhe Rani Daro Na Bansuri Bole,K. L. Saigal,189993,1934-01-01,1934,0.994,0.435,0.421,0.863,0.159,-10.073,0.0459,74.771,0.603,1,0,0,False,"classic bollywood, filmi, ghazal"
5o0M91GArv3RZ9Y6FRot3V,Hum Apna Unhey,K. L. Saigal,209841,1934-01-01,1934,0.996,0.577,0.309,0.892,0.0968,-10.657,0.0603,115.098,0.719,1,7,0,False,"classic bollywood, filmi, ghazal"
0sOUJsYOEN5p1ucd9H03mZ,Absar Bito Jaat,K. L. Saigal,186235,1934-01-01,1934,0.996,0.475,0.436,0.869,0.324,-9.457,0.0589,68.193,0.564,1,11,0,False,"classic bollywood, filmi, ghazal"
2I6kHAinx3SaUCoUs6PyzC,Preet Mein Hai Jeevan Jokhon,K. L. Saigal,193454,1934-01-01,1934,0.994,0.266,0.0735,0.791,0.402,-14.526,0.0339,74.947,0.171,1,7,0,False,"classic bollywood, filmi, ghazal"
3bTtB5eSc1Kgiz10EHEFiX,Persi Tetoio Kairo,"Kostas Giannidis, Stella Greka",194432,1934,1934,0.842,0.272,0.311,0.0,0.591,-8.114,0.0337,81.974,0.401,0,7,0,False,
62wvHPk0yaLAoLfLugkRg0,Aik Kaafir Pey Tabiyat Aa Gayi,Janki Bai,163143,1934-12-31,1934,0.995,0.49,0.206,0.733,0.267,-11.318,0.133,79.107,0.718,1,7,0,False,
5n8ZbGSfiT1XeNaziG2jRM,Nadiya Kinare Mora Gaon,Siddheshwari Devi,184726,1934-12-31,1934,0.988,0.514,0.18,0.000559,0.452,-8.577,0.0648,124.239,0.603,1,3,0,False,"hindustani vocal, indian classical"
2IZO4RUBSKTc38S329RyjN,Ahesan Kia To,Waheedan Bai,192002,1934-12-31,1934,0.983,0.571,0.0403,0.000131,0.428,-14.375,0.375,127.318,0.558,1,1,0,False,
5FFEqsPhgmjkPMROYKPRDn,Udd Kaagaa Bol Na Bolay,Thaakur Dutt,184227,1934-12-31,1934,0.404,0.632,0.232,0.0,0.615,-12.254,0.952,82.482,0.64,1,6,0,False,
0ZoNjXLPiGK2xxUdwxHpiB,Nadiya Kinaaray Mora Gaaon,Siddheshwari Bai,192975,1934-12-31,1934,0.992,0.427,0.115,8.66e-05,0.552,-11.959,0.178,72.153,0.513,1,2,0,False,
7nf829lk5pLJ5VoXVj1JBZ,Pyari Laad Se Jhoolay Laadli Laad Karay,Khadim Hussain Khan,206864,1934-12-31,1934,0.944,0.445,0.48,0.921,0.112,-14.162,0.0876,71.186,0.914,1,7,0,False,
3N7KYZYzPfcZvvmPzMAC9b,Long and Tall,Kokomo Arnold,167973,1934-05-20,1934,0.978,0.792,0.17,2.69e-05,0.0884,-13.352,0.0495,96.44,0.516,0,10,0,False,"acoustic blues, chicago blues, delta blues, traditional blues"
61gofCxP6vTHmvAft9aqLi,Old Black Cat Blues (Jinx Blues),Kokomo Arnold,205160,1934-05-20,1934,0.893,0.699,0.0859,1.97e-05,0.123,-18.227,0.0657,86.092,0.649,1,6,0,False,"acoustic blues, chicago blues, delta blues, traditional blues"
3q3jrWBN6TRrLkko2fn4Cu,Rocky Road Blues,Kokomo Arnold,166160,1934-05-20,1934,0.995,0.744,0.172,0.00688,0.177,-17.327,0.0453,97.354,0.804,1,2,0,False,"acoustic blues, chicago blues, delta blues, traditional blues"
3AasNH8B2bPjlmwQKuzlCZ,How Long How Long Blues,Kokomo Arnold,195546,1934-05-20,1934,0.957,0.596,0.0573,8.14e-06,0.131,-20.481,0.0826,171.465,0.546,1,2,0,False,"acoustic blues, chicago blues, delta blues, traditional blues"
4AU3dN0vOt2sYRHK4PX6on,Laugh and Grin Blues,Kokomo Arnold,189280,1934-05-20,1934,0.981,0.758,0.225,2.06e-05,0.116,-14.854,0.0448,84.26,0.376,0,9,0,False,"acoustic blues, chicago blues, delta blues, traditional blues"
6gBFw4utgYljRRqdioLNiT,Sagefield Woman Blues 2,"Kokomo Arnold, Casey Bill Weldon",182813,1934-05-20,1934,0.979,0.561,0.389,1.27e-05,0.146,-10.081,0.0464,177.863,0.49,1,8,0,False,"acoustic blues, chicago blues, delta blues, traditional blues"
3GTS10ZvZ4WBvL9SLP6Oef,Shake That Thing,Kokomo Arnold,160853,1934-05-20,1934,0.985,0.633,0.248,0.000112,0.107,-15.683,0.0726,166.02,0.903,1,0,0,False,"acoustic blues, chicago blues, delta blues, traditional blues"
0EZuOV6filxekCZeTM50AZ,Tired of Runnin' from Door to Door,Kokomo Arnold,158453,1934-05-20,1934,0.993,0.446,0.218,1.48e-05,0.193,-14.744,0.0603,201.229,0.609,1,7,0,False,"acoustic blues, chicago blues, delta blues, traditional blues"
2xr9JTrsFo2878t767EWSK,Hitch Me to Your Buggy and Drive Me Like a Mule,"Kokomo Arnold, Casey Bill Weldon",181053,1934-05-20,1934,0.994,0.669,0.158,0.00473,0.127,-18.264,0.0477,129.122,0.58,1,8,0,False,"acoustic blues, chicago blues, delta blues, traditional blues"
27UYazbPVZ8rhDzlRuRtRB,Lonesome Road Blues,Kokomo Arnold,179773,1934-05-20,1934,0.987,0.629,0.227,3.3e-06,0.105,-15.449,0.0488,94.229,0.618,1,11,0,False,"acoustic blues, chicago blues, delta blues, traditional blues"
25xLxxPoh5ggxC0El8WlUg,Russian Lullaby,Red Norvo,182320,1934-12-15,1934,0.983,0.69,0.451,0.89,0.117,-9.769,0.0378,94.83,0.858,0,2,0,False,"cool jazz, jazz vibraphone, swing, vintage jazz"
4yh0gaHmdlscHXo0QICNCY,Le Chaland Qui Passe,Lys Gauty,194000,1934,1934,0.926,0.359,0.232,0.0,0.0975,-15.124,0.0509,119.749,0.383,1,11,0,False,vintage chanson
3SmINSBLr34fqEXcxxhpWO,Le Moulin Qui Jase,Lys Gauty,196640,1934,1934,0.961,0.251,0.277,1.64e-05,0.906,-12.376,0.0512,69.912,0.323,1,10,0,False,vintage chanson
0seRXxLcBSmaZL9Vu8WpQM,Le Bonheur N'est Plus Un Rêve,Lys Gauty,197533,1934,1934,0.94,0.343,0.291,1.97e-05,0.321,-14.498,0.081,87.971,0.407,1,0,0,False,vintage chanson
5HzXJTghk6VzrH5pnpKXrX,Layi Hayaat Aaye Qaza Le Chali Chale,K. L. Saigal,198297,1934-01-01,1934,0.995,0.504,0.399,0.627,0.29,-10.098,0.0991,124.5,0.408,1,10,0,False,"classic bollywood, filmi, ghazal"
7pTMtRym656vPbBhxv4VJ2,Les Beaux Dimanches De Printemps,Reda Caire,204226,1934,1934,0.975,0.46,0.241,0.0,0.111,-14.027,0.0573,135.754,0.616,1,0,0,False,vintage chanson
7BaftT4mAIiTRfH73UmekH,La Crise Est Finie,Albert Préjean,158226,1934,1934,0.927,0.662,0.362,0.0,0.218,-11.963,0.0638,130.665,0.857,1,3,0,False,vintage chanson
5ap6vfWiDRdyUNzg3X5FLQ,Laagi Rey Mori Nandlaal,Saraswatibai,187431,1934-12-31,1934,0.995,0.499,0.495,0.871,0.301,-9.399,0.292,68.605,0.677,0,7,0,False,
5LJ4WOk4SC4nXqB7Ko9W9v,La Boheme - At El Garage estudio,"Charras Gonzalez, Veronica Gonzalez Day, Adrian Charras",173728,1934,1934,0.964,0.513,0.208,2.45e-06,0.147,-10.818,0.0379,133.099,0.311,0,4,0,False,
5YGR24vswbZdjaDdWQI7Q9,Lonesome Southern Blues,Kokomo Arnold,185853,1934-05-20,1934,0.988,0.605,0.119,0.0,0.151,-16.094,0.0915,86.389,0.728,1,7,0,False,"acoustic blues, chicago blues, delta blues, traditional blues"
48aKlIRpYd2zeXtgh9Ell3,Lagan Tau Se Laagi Saanwariya,Saraswatibai,176216,1934-12-31,1934,0.959,0.358,0.699,0.887,0.583,-8.068,0.158,68.042,0.504,1,1,0,False,
456f4cmscROSN4TGcZc8Uc,La Mejorana - Remasterizado,Francisco Canaro,176000,1934-01-10,1934,0.994,0.635,0.141,0.937,0.112,-17.337,0.0626,121.419,0.636,0,4,0,False,"orquesta tipica, tango, vintage tango"
2I2BWFOLWxssPeJuI12tV9,Lou'siana Lullaby,Roy Fox,187480,1934,1934,0.968,0.678,0.0692,0.00035,0.103,-20.606,0.126,102.711,0.619,1,7,0,False,british dance band
3mJ5wWuPldUvyBClel3s3l,The Last Round Up,"Richard Himber and his Orchestra, Joey Nash",182413,1934-07-01,1934,0.976,0.463,0.161,0.0107,0.121,-16.314,0.0411,74.319,0.517,1,2,0,False,
7045iBIFgiMTaSgUixCBfy,Laageen Laageen Re Saanwaariya Tau Se Akhiyan,Mallikarjun Mansur,279260,1934-12-31,1934,0.996,0.457,0.133,0.856,0.402,-15.586,0.143,67.792,0.63,1,0,0,False,"hindustani classical, hindustani vocal, indian classical, khayal"
7rAU2sN7C21v3DfJ6U6M1o,Los Amores Con la Crisis - Remasterizado,"Francisco Canaro, Ernesto Fama",177493,1934-01-10,1934,0.995,0.631,0.165,0.211,0.121,-18.846,0.492,162.445,0.917,1,2,0,False,"orquesta tipica, tango, vintage tango"
