id,name,artists,duration_ms,release_date,year,acousticness,danceability,energy,instrumentalness,liveness,loudness,speechiness,tempo,valence,mode,key,popularity,explicit,genre
4jRhqYMDV0C8NLoFjRpZ3f,"Waltz No. 9 in A-Flat Major, Op. 69 No. 1 ""The Farewell""",Pamela Howland,205360,2010-10-03,2010,0.995,0.398,0.0189,0.908,0.0876,-28.476,0.0375,85.0,0.147,1.0,8.0,22,False,focus
3yXv3k2CPnB5tQK9Abg145,"Symphony No. 3 in F major, Op. 90: III. Poco allegretto",Seattle Symphony Orchestra,408786,2010-09-11,2010,0.985,0.113,0.0312,0.894,0.0709,-26.926,0.0432,91.953,0.0399,0.0,0.0,27,False,"american orchestra, orchestra"
5dDmbREtziny16xOS95wvO,Alejandra - Instrumental,Mariachi Arriba Juárez,208560,2010-01-01,2010,0.175,0.275,0.379,0.402,0.291,-9.218,0.0301,168.362,0.413,1.0,2.0,12,False,mariachi
2zt0LFiyJoGwn9Haorpzc6,Arnavut Kaldırımı,Demet Sağıroğlu,291693,2010-03-05,2010,0.362,0.717,0.678,0.0,0.141,-9.813,0.168,105.002,0.372,0.0,5.0,33,False,turkish pop
3TQe65TU2YriCQlMmfsQ8c,Salmo 91,Erick Porta,355466,2010-01-06,2010,0.00496,0.573,0.953,0.00121,0.176,-2.652,0.23,139.331,0.603,0.0,0.0,18,False,"latin christian, latin worship"
0yp4YiaVLTHwgr8juzFMWc,"Concerto en sol mineur, BWV 975: III. Presto","Johann Sebastian Bach, Alexandre Tharaud",134306,2010-12-07,2010,0.983,0.341,0.269,0.94,0.155,-20.462,0.0367,121.047,0.783,0.0,7.0,21,False,"baroque, classical, early music, german baroque"
1RPbKbjpCVDJ6ABPaEiptx,Alap on the Afghan rubab: Raga Bhupali,Homayun Sakhi,325506,2010-03-30,2010,0.986,0.382,0.203,0.922,0.139,-25.806,0.0408,101.752,0.309,1.0,9.0,9,False,"afghan pop, afghan traditional"
2Qa14m7Malmpz0NEoX0kKl,愛火花,Jacky Cheung,224866,2010-01-01,2010,0.0985,0.707,0.994,0.0,0.627,-4.618,0.0506,131.765,0.523,0.0,10.0,9,False,"c-pop, classic mandopop"
7FqNwAWjlDUddUNYSaYGCB,"Chopin: Nocturne No. 2 in E-Flat Major, Op. 9 No. 2","Frédéric Chopin, YUNDI",267760,2010-03-15,2010,0.992,0.406,0.0113,0.871,0.0811,-31.333,0.0383,65.509,0.0694,1.0,3.0,26,False,"classical, early romantic era, polish classical"
0NZK7AWFdAYTuDQGYqSY2E,Ties Ourselves Around,The Diogenes Club,341771,2010-02-22,2010,0.0203,0.696,0.561,0.284,0.114,-8.968,0.0518,125.006,0.644,1.0,7.0,19,False,
4PH9w0aIxJqyulLYTssyeE,I-95 Song (The Asshole Song),The Good Brothers,194320,2010,2010,0.662,0.626,0.616,0.0,0.102,-4.497,0.0281,115.048,0.642,1.0,7.0,23,False,"autoharp, banjo, canadian country"
7B3fOo4ZZIqerQIVQ8HXOm,Dem Be - Live - Acoustic,STS9,273881,2010-06-22,2010,0.594,0.426,0.741,0.87,0.965,-8.455,0.0278,142.625,0.283,0.0,9.0,13,False,"jam band, jamtronica, livetronica"
3SgWoIHhVPtTdPNyXjEtYD,ベートーヴェン：交響曲第7番イ長調作品92より 第1楽章・第４楽章　ドラマエディット,"Ludwig van Beethoven, のだめカンタービレ, Toshiaki Umeda",440546,2010-09-15,2010,0.952,0.306,0.275,0.879,0.145,-10.976,0.0373,141.121,0.17,1.0,9.0,29,False,"classical, classical era, early romantic era, german romanticism"
46pXk0ju0ySEJwAqFIBWqA,Deadly Medley (feat. Royce Da 5'9 & Elzhi),"Black Milk, Royce Da 5'9"", Elzhi",222693,2010-09-14,2010,0.362,0.495,0.932,0.0,0.465,-4.457,0.211,83.512,0.85,0.0,0.0,18,True,"alternative hip hop, detroit hip hop, instrumental hip hop"
6CbHvyB7OvV4bIfpn3VGv6,Born To Be Wasted,009 Sound System,373051,2010,2010,0.0163,0.605,0.594,0.934,0.106,-10.049,0.0932,132.029,0.393,0.0,10.0,35,False,dream trance
114F64sKFHHtCOcnKPDuJk,03' Bonnie & Clyde,"JAY-Z, Beyoncé",204493,2010-11-22,2010,0.197,0.871,0.758,0.0,0.148,-3.749,0.292,89.878,0.43,0.0,9.0,25,False,"east coast hip hop, gangster rap, hip hop, pop rap, rap"
5Z2lp1VeJE2rVoxpyDTGW8,Barstool,The String Cheese Incident,347480,2010-11-09,2010,0.539,0.575,0.702,0.00161,0.79,-12.929,0.0618,103.019,0.65,1.0,0.0,22,False,"jam band, jamgrass, progressive bluegrass"
5q1l2JH6HSH0TUbel2BEQa,Beatnik killers,0.8Syooogeki,174413,2010-08-04,2010,0.000188,0.487,0.956,0.128,0.0665,-1.248,0.0945,158.007,0.727,0.0,6.0,27,False,japanese post-punk
7xbDPUOzNhMo0uBc4EBgf0,Brasil '07,Medications,168360,2010-04-20,2010,0.0823,0.428,0.542,0.742,0.181,-10.743,0.0284,180.127,0.483,1.0,7.0,21,False,"math rock, post-hardcore"
6lkJKbOu7COoTKAqpC7xyR,Suicide of the 21st century,0.8Syooogeki,140813,2010-08-04,2010,5.23e-05,0.618,0.983,0.0264,0.11,-3.017,0.0556,154.059,0.963,1.0,5.0,42,False,japanese post-punk
5ZFFQEEINuTztkeFUJT4an,Good To Go,"Yelawolf, Bun B",217813,2010-01-01,2010,0.0194,0.799,0.769,2.04e-06,0.118,-7.4,0.0657,76.007,0.506,0.0,6.0,36,True,alabama rap
4oI41JVdiftLlWKmwOtGye,I'll Be Back,2PM,214478,2010-10-11,2010,0.00793,0.803,0.903,3.91e-06,0.132,-5.071,0.0508,130.002,0.665,0.0,5.0,45,False,"k-pop, k-pop boy group"
1VWISCCZ7LjBoiSgRu0SVj,Becky (1.0 Mix),Donald Glaude,103306,2010-05-25,2010,5.27e-05,0.675,0.889,0.816,0.931,-6.148,0.266,132.507,0.704,0.0,11.0,17,False,
5E6NkoLYr8bbosPIH9gnJP,Beg,Kidneythieves,218240,2010-07-20,2010,0.000476,0.462,0.927,0.0343,0.0642,-5.542,0.0732,160.052,0.642,1.0,10.0,20,False,"industrial metal, industrial rock"
3UPbmPagNCREskY464AoaX,03' Bonnie & Clyde,"JAY-Z, Beyoncé",205240,2010-11-22,2010,0.21,0.87,0.765,0.0,0.235,-3.4,0.297,89.91,0.379,0.0,9.0,14,True,"east coast hip hop, gangster rap, hip hop, pop rap, rap"
09OXCMBAsXM1wsbzBrfv1u,Bun Fi Bun (feat. Maxwell),"Vybz Kartel, Maxwell",138626,2010-03-09,2010,0.142,0.768,0.648,0.0,0.139,-10.008,0.186,105.056,0.497,0.0,11.0,23,False,"dancehall, jamaican dancehall, reggae fusion"
5U7SGT8qk82yujU8ZyXs4t,Broke,"Nelly, Yo Gotti, Sophie Greene",215173,2010-11-12,2010,0.0109,0.83,0.679,0.0,0.0623,-5.669,0.0525,144.005,0.839,0.0,1.0,19,True,"dance pop, gangster rap, hip hop, pop rap, rap, st louis rap, urban contemporary"
0029bXZHiFj1UUF28N3MSS,Black Clouds,The String Cheese Incident,1090520,2010-11-09,2010,0.303,0.325,0.764,0.675,0.931,-10.32,0.047,151.522,0.49,1.0,2.0,13,False,"jam band, jamgrass, progressive bluegrass"
75n6Bewk6tzR89Tw4N9xyy,Bail for Me,Vybz Kartel,196440,2010-03-09,2010,0.0732,0.378,0.826,0.0,0.275,-5.516,0.27,76.457,0.463,1.0,4.0,22,False,"dancehall, jamaican dancehall, reggae fusion"
7uFMDzQwskdgvWXgGILzuf,Come Breed Me (feat. Gaza Indu),"Vybz Kartel, Gaza Indu",215760,2010-03-09,2010,0.00281,0.477,0.726,0.0,0.553,-6.216,0.276,198.283,0.396,0.0,11.0,36,False,"dancehall, jamaican dancehall, reggae fusion"
5mzD1pbPLB4ijk1BarbQS1,01 Still Smokin,DJ Michael 5000 Watts,152773,2010-09-30,2010,0.00743,0.468,0.664,0.0,0.0643,-8.848,0.326,135.319,0.331,0.0,5.0,13,True,"chopped and screwed, houston rap"
02aeMyLJWxZMSd8v25mHyj,Beş,Gripin,329691,2010-03-04,2010,0.475,0.587,0.575,0.0,0.112,-6.628,0.0435,87.929,0.294,0.0,0.0,50,False,"turkish alternative, turkish pop, turkish rock"
06kqUhFRQ1x8P2V46tJtGr,Beat Of The Moment (Remastered),009 Sound System,336250,2010-11-05,2010,0.256,0.7,0.757,0.955,0.123,-11.413,0.0401,125.999,0.804,1.0,1.0,17,False,dream trance
6iUkHyVw8iC8knGg77bIER,Buscandote,"Orquesta Typica Osvaldo Fresedo, Ricardo Ruiz",171101,2010-05-21,2010,0.979,0.504,0.109,0.858,0.109,-20.049,0.0382,122.476,0.634,1.0,2.0,24,False,"orquesta tipica, vintage tango"
32chLg3Ew3OjQOdJMUJDHo,03' Bonnie & Clyde,"JAY-Z, Beyoncé",205240,2010-11-22,2010,0.21,0.87,0.765,0.0,0.235,-3.4,0.297,89.91,0.379,0.0,9.0,11,True,"east coast hip hop, gangster rap, hip hop, pop rap, rap"
3EN8rqw3foBKi6Ki89hztW,Bicycle - Radio Mix,Vybz Kartel,136880,2010-03-09,2010,0.0306,0.568,0.686,0.0,0.362,-8.247,0.297,102.79,0.274,0.0,1.0,19,False,"dancehall, jamaican dancehall, reggae fusion"
4ESwkGCyueRheJClLZJLHJ,Sunday blues,Mr. G,185573,2010-04-27,2010,0.00262,0.815,0.672,0.891,0.213,-9.358,0.168,124.009,0.935,1.0,6.0,32,False,"chicago house, classic house, deep house, float house, minimal tech house, techno"
0kxNEUIcb0fb8dFgAQcgVJ,Born To Be Wasted (Remastered),009 Sound System,397049,2010-11-05,2010,0.000669,0.622,0.73,0.943,0.194,-6.381,0.0777,132.035,0.417,0.0,10.0,17,False,dream trance
5yn4MMYh2BefHZv24cUjlq,"World Behind My Wall - Live, 12.04.2010, Mediolanum Forum Mailand, Italien",Tokio Hotel,258600,2010-01-01,2010,0.00678,0.457,0.942,1.17e-05,0.578,-1.736,0.0361,94.973,0.106,1.0,10.0,31,False,german pop rock
5CzQ6Do8ValJCfxUjG0E0T,"Best Of What's Around - Live at Shoreline Amphitheatre, Mountain View, CA 07.06.97",Dave Matthews Band,356666,2010-05-04,2010,0.0339,0.551,0.921,1.75e-05,0.73,-6.676,0.0586,96.604,0.677,1.0,9.0,9,False,"jam band, neo mellow, pop rock"
1OVujG64ktErX7BjIH67MM,"""BL06_Sakkaku""",Shiro SAGISU,195733,2010-12-01,2010,0.0381,0.226,0.731,0.913,0.228,-9.913,0.0581,154.943,0.336,0.0,9.0,20,False,"anime score, japanese soundtrack"
35MPqsvDYUWYIGaspo0nc9,Box Chevy - Album Version (Edited),"Yelawolf, Rittz The Rapper",293160,2010-01-01,2010,0.26,0.807,0.568,0.000297,0.0962,-7.889,0.0562,131.005,0.176,0.0,6.0,9,False,alabama rap
72Hx9LxyLK5RXzeYIM8Spx,Behind The Wheel - Live In Barcelona,Depeche Mode,310520,2010-11-05,2010,0.00657,0.643,0.855,0.0621,0.979,-9.145,0.0572,124.882,0.248,1.0,0.0,28,False,"dance rock, new romantic, new wave, permanent wave, rock, synthpop"
1HjzbQrTV2H4QdWWCPRaHh,"0,4 - Original Mix",BuddhaSmile,311400,2010-10-10,2010,0.209,0.633,0.708,0.907,0.132,-8.425,0.0294,99.98,0.115,0.0,0.0,7,False,
4Qb6wSNTPZyCzUiaLeoV5e,bostons,Have Heart,175920,2010-01-01,2010,0.000142,0.351,0.916,0.176,0.699,-6.877,0.0633,94.878,0.322,0.0,4.0,8,False,"boston hardcore, chaotic hardcore, dreamo, hardcore punk, melodic hardcore, straight edge"
3elADx8qjpoxZMb6BKNIx1,Billy Crystal - Album Version (Edited),"Yelawolf, Rock City",239906,2010-01-01,2010,0.0695,0.759,0.852,0.0615,0.353,-7.381,0.101,143.015,0.499,1.0,1.0,6,False,alabama rap
4EFZMhxtgCpSKASQS8qfHI,Badlands,MiM0SA,280697,2010-10-04,2010,0.378,0.651,0.668,0.167,0.111,-6.902,0.0882,143.925,0.308,0.0,11.0,7,False,"glitch hop, halftime dnb, purple sound"
2PHXg4LnjeweUd3Zovun09,Broke,"Nelly, Yo Gotti, Sophie Greene",215173,2010-11-12,2010,0.0109,0.83,0.679,0.0,0.0623,-5.669,0.0525,144.005,0.839,0.0,1.0,8,True,"dance pop, gangster rap, hip hop, pop rap, rap, st louis rap, urban contemporary"
19sIa4pUGBdxdPDZhPcbDb,"Tomorrow, Wendy - 2010 Digital Remaster/5:05",Concrete Blonde,309933,2010-01-01,2010,0.124,0.291,0.52,0.000181,0.155,-8.186,0.0304,180.085,0.194,1.0,3.0,21,False,lilith
3mSuT45Aymjkb0hWRBn6bc,Miss Brown's Teahouse,The String Cheese Incident,1025813,2010-11-09,2010,0.358,0.428,0.648,0.441,0.702,-13.011,0.0405,115.519,0.656,1.0,5.0,15,False,"jam band, jamgrass, progressive bluegrass"
54jBZpQut8WiebPyIBiKgB,Orange Blossom Special,The String Cheese Incident,571413,2010-11-09,2010,0.11,0.342,0.809,0.857,0.918,-12.201,0.0468,164.288,0.512,1.0,9.0,15,False,"jam band, jamgrass, progressive bluegrass"
7cdvFTpLdgPaFHiPifAtGB,The Blackout of '03,Jim Norton,219680,2010-02-16,2010,0.807,0.494,0.672,0.0,0.806,-17.114,0.946,54.193,0.248,0.0,8.0,7,True,"comedy, deep comedy, new comedy"
1c5Mtnguig5DNNrJ1IR0nM,The Battle of Strangers,Kenji Kawai,790066,2010-09-22,2010,0.0704,0.208,0.499,0.931,0.107,-14.295,0.0455,99.034,0.0762,1.0,0.0,11,False,"anime score, japanese soundtrack, shonen"
2TaFTqaTKjwURc82P43zdK,Back from Where I Started,De-Phazz,300026,2010-04-09,2010,0.531,0.743,0.638,0.0222,0.157,-11.356,0.0486,93.981,0.725,0.0,2.0,23,False,"downtempo, electro jazz, jazztronica, nu jazz, trip hop"
2duYu7cAxQV5jEoE6G4El1,03' Bonnie & Clyde,"JAY-Z, Beyoncé",204493,2010-11-22,2010,0.195,0.871,0.758,0.0,0.148,-3.749,0.292,89.878,0.43,0.0,9.0,26,False,"east coast hip hop, gangster rap, hip hop, pop rap, rap"
5xr6GN4kdnPCAxSVr0UInV,Come Back Home,Vybz Kartel,201466,2010-03-09,2010,0.548,0.52,0.845,0.0,0.348,-5.177,0.183,122.934,0.864,1.0,0.0,22,False,"dancehall, jamaican dancehall, reggae fusion"
6zBeWZ6divtpmU8zO1ZU2Y,Shibuya Route 48,0.8Syooogeki,184973,2010-08-04,2010,2.04e-05,0.248,0.995,0.632,0.137,-3.212,0.456,95.139,0.102,0.0,9.0,22,False,japanese post-punk
3UdqmkCXZdvYIUAjBvnNDk,Virginity (feat. Gaza Indu),"Vybz Kartel, Gaza Indu",199173,2010-03-09,2010,0.111,0.576,0.699,0.0,0.24,-7.937,0.327,80.914,0.817,0.0,5.0,36,False,"dancehall, jamaican dancehall, reggae fusion"
6MLKa6TTN4lsvLKjR10THu,Careful (feat. Stephen McGregor),"Vybz Kartel, Stephen McGregor",240000,2010-03-09,2010,0.0143,0.446,0.644,0.000123,0.207,-8.143,0.113,95.134,0.567,0.0,10.0,32,False,"dancehall, jamaican dancehall, reggae fusion"
06xmCqlWUYCpLR5HTxeFq1,Break'em,TLB,96182,2010-12-24,2010,0.00022,0.709,0.968,0.893,0.2,-5.887,0.0479,94.977,0.304,1.0,2.0,27,False,"raggatek, tekno"
2XPQVxvimeMxvKKbI8IRYs,Boogieman,Deliri0us,227866,2010-03-06,2010,0.378,0.774,0.898,0.0027,0.268,-2.676,0.0382,120.006,0.78,1.0,0.0,5,True,
76sK58nejiOiN0CiSwNHcF,brotherly love,Have Heart,170093,2010-01-01,2010,0.000306,0.23,0.943,0.723,0.644,-7.257,0.0777,150.203,0.221,1.0,9.0,5,False,"boston hardcore, chaotic hardcore, dreamo, hardcore punk, melodic hardcore, straight edge"
2r3LYe3xB9ZEaNAS0ScjEh,Can't Get Over Me,Vybz Kartel,169946,2010-03-09,2010,0.0999,0.458,0.559,0.0,0.193,-10.233,0.247,97.588,0.478,1.0,1.0,33,False,"dancehall, jamaican dancehall, reggae fusion"
0jU9padNptNSQVDLI0vuhM,Final Mission - Quantum Burst,Kenji Kawai,491666,2010-09-22,2010,0.0319,0.454,0.58,0.928,0.0796,-13.137,0.0442,82.375,0.124,1.0,0.0,29,False,"anime score, japanese soundtrack, shonen"
3M0KsB361izxPTfXwyQPSw,Marie,Vybz Kartel,162386,2010-03-09,2010,0.104,0.768,0.726,0.0,0.0927,-5.573,0.301,94.059,0.519,0.0,5.0,34,False,"dancehall, jamaican dancehall, reggae fusion"
2bogRyaG0LMCj3x14Vuvy3,Million Dollar By Morning,Vybz Kartel,213106,2010-03-09,2010,0.0887,0.583,0.867,0.0,0.0863,-4.614,0.385,129.974,0.759,1.0,6.0,23,False,"dancehall, jamaican dancehall, reggae fusion"
62FgqpxUfiKqu76fHTcAca,Life We Living,Vybz Kartel,233613,2010-03-09,2010,0.061,0.659,0.744,0.0,0.285,-4.81,0.154,85.041,0.625,0.0,4.0,34,False,"dancehall, jamaican dancehall, reggae fusion"
7pKfCtLQVqUttZeW7qoHpI,Stream,Blamstrain,117179,2010-06-15,2010,0.896,0.145,0.0441,0.888,0.104,-28.223,0.0427,185.76,0.282,0.0,9.0,21,False,"ambient idm, deep idm, finnish electronic"
6EqbqmtYCffvzVk8qrOfl8,By All Means,"Boom Jinx, Andrew Bayer",358880,2010,2010,0.0191,0.653,0.773,0.673,0.0373,-8.349,0.101,128.386,0.237,1.0,4.0,7,False,"progressive house, progressive trance, uplifting trance"
6zsTrRfVRqG4atLD4VT1Zs,Without My Own,Vybz Kartel,159720,2010-03-09,2010,0.0158,0.484,0.726,0.0,0.213,-5.022,0.283,109.338,0.398,1.0,8.0,30,False,"dancehall, jamaican dancehall, reggae fusion"
5HfjTXnAl9ajqxf4StJat3,04 She Big Fine,LIL Josh & Ernest,238159,2010-10-03,2010,0.00175,0.814,0.38,0.0,0.0966,-11.943,0.673,180.035,0.72,1.0,11.0,3,False,baton rouge rap
4dtFBm4JnKRODRVeYe3XRP,hard bark on the family tree,Have Heart,253440,2010-01-01,2010,0.000361,0.192,0.957,0.0669,0.615,-7.26,0.147,147.225,0.0546,1.0,9.0,11,False,"boston hardcore, chaotic hardcore, dreamo, hardcore punk, melodic hardcore, straight edge"
3kEDJDkuaK7mcvElZ4pJQU,Black Rebel,Wonderful★opportunity!,214000,2010-12-27,2010,0.0249,0.533,0.948,3.59e-06,0.112,-3.704,0.0531,99.994,0.754,1.0,9.0,4,False,"anime rock, j-division, vocaloid"
2NrmUfu4JtIa747TGJVldX,02: 45,"Thomas Bjerring, David Skog",219684,2010-05-07,2010,0.34,0.618,0.662,0.766,0.112,-11.249,0.0288,119.956,0.308,1.0,6.0,9,False,
0LfrC1sjbjWcA83AVNAGrm,Bigger Stream (Origin 2005),Solar Fields,374770,2010-12-01,2010,0.572,0.399,0.376,0.956,0.248,-14.501,0.0373,144.99,0.054,1.0,2.0,8,False,"ambient trance, downtempo, psychill, space ambient"
0pqgW8Q28pGhwBvBi4STXl,Black Is The New Yellow - Original Mix,"Super8 & Tab, Anton Sonin",357586,2010-05-10,2010,0.000433,0.495,0.894,0.925,0.167,-7.542,0.028,134.159,0.18,1.0,1.0,6,False,"finnish edm, progressive house, progressive trance, trance, uplifting trance"
5Lpw3QUMO6LUN3Rs7htgKs,Blast Off,Deliri0us,187080,2010-03-06,2010,0.0823,0.732,0.945,0.0,0.103,-1.614,0.0642,148.003,0.559,1.0,8.0,4,True,
5QLXOb8RKR98laKm9KgrMV,Black Angels,Epic Score,153744,2010-03-19,2010,0.521,0.391,0.657,0.0318,0.129,-8.223,0.0465,130.105,0.124,0.0,2.0,6,False,epicore
247mhXwFq3550zGEEdcyyg,Get Wild,Vybz Kartel,203946,2010-03-09,2010,0.0395,0.71,0.641,0.0,0.196,-5.284,0.213,96.207,0.455,0.0,4.0,30,False,"dancehall, jamaican dancehall, reggae fusion"
0b2hTglcjcsjXLl4ohcwgy,Class Of '04,Chernobyl Babies,177080,2010-04-06,2010,0.0301,0.439,0.857,0.0,0.348,-6.828,0.0859,146.465,0.647,1.0,8.0,15,False,street punk
0qDVk15oEzh5hFPstWsEKR,Pure Delta Binaural Beats (0.9hz),Pure Binaural Beats,3549000,2010-10-14,2010,0.994,0.759,0.000288,0.823,0.11,-37.031,0.169,71.891,0.188,1.0,2.0,12,False,brain waves
4lCFzexVjh7MlbrzLnqRoE,Shenandoah Breakdown,The String Cheese Incident,245840,2010-11-09,2010,0.126,0.319,0.784,0.852,0.74,-10.851,0.0426,154.25,0.824,1.0,9.0,9,False,"jam band, jamgrass, progressive bluegrass"
6X1sd1kEaSRdJRQ9wYrbZr,The Song Before,"Broadcast, The Focus Group",159968,2010-09-10,2010,0.49,0.175,0.761,0.758,0.328,-8.35,0.0479,140.077,0.202,0.0,5.0,13,False,"art pop, chamber pop, dream pop, experimental rock, hauntology, indietronica, nu gaze, slowcore"
0JozHlJtnUesVQE3xT4h7b,Come Back - Live In Barcelona,Depeche Mode,365120,2010-11-05,2010,0.0162,0.453,0.753,0.0447,0.979,-9.968,0.038,143.986,0.205,0.0,5.0,24,False,"dance rock, new romantic, new wave, permanent wave, rock, synthpop"
45oR0E5gY9Tvs8J6EPhqBt,"84, 94, 04",Mac Dre,213866,2010-01-19,2010,0.0358,0.807,0.741,0.0,0.191,-6.215,0.15,92.012,0.606,0.0,10.0,8,False,"cali rap, hyphy, oakland hip hop, west coast rap"
59yOLxX5qZaCn0hY0qS9uQ,Life Sweet,Vybz Kartel,219760,2010-03-09,2010,0.00841,0.626,0.761,0.0,0.296,-5.682,0.153,108.535,0.261,0.0,11.0,28,False,"dancehall, jamaican dancehall, reggae fusion"
5NEYCAbSS8lrSGGHK2meHm,Long Gone,"Nelly, Plies, Chris Brown",220520,2010-11-12,2010,0.000342,0.545,0.755,0.0,0.29,-5.662,0.0695,176.002,0.55,1.0,8.0,15,True,"dance pop, gangster rap, hip hop, pop rap, rap, st louis rap, urban contemporary"
3iIUhciNEaZe2qKzKvIxuf,Super Star (feat. Black Rhyno),"Vybz Kartel, Black Rhyno",194680,2010-03-09,2010,0.0532,0.429,0.883,0.0,0.379,-6.519,0.192,88.319,0.455,1.0,6.0,18,False,"dancehall, jamaican dancehall, reggae fusion"
4CgoSgmivOACoVnKQsIkZf,"Tripping Billies - Live at Shoreline Amphitheatre, Mountain View, CA 07.06.97",Dave Matthews Band,363800,2010-05-04,2010,0.00311,0.506,0.972,0.00507,0.878,-6.695,0.0564,119.325,0.579,0.0,11.0,7,False,"jam band, neo mellow, pop rock"
6RXgRxJLlPcyjnTPrCYeWJ,One-Master-Blade - Extended version,Brennan Heart,431169,2010-12-06,2010,0.186,0.638,0.807,0.734,0.0503,-5.773,0.0895,150.012,0.0853,1.0,8.0,27,False,"classic hardstyle, euphoric hardstyle, rawstyle"
3XkI6O4lihB44dnmNoxDds,Jude (Be Somebody),Kidneythieves,197480,2010-07-20,2010,0.000593,0.529,0.823,0.0712,0.37,-8.157,0.121,160.029,0.559,1.0,2.0,24,False,"industrial metal, industrial rock"
4K9x7O7UXwyA0oNCJw0tMK,I'll Be Back (Club Mix),2PM,239426,2010-10-11,2010,0.0127,0.758,0.759,0.0,0.106,-3.713,0.0443,130.001,0.624,0.0,6.0,13,False,"k-pop, k-pop boy group"
6w65VbntAd0YEpK2RoiEJw,Black Water,P.B.K.,525995,2010-04-19,2010,0.000559,0.558,0.709,0.84,0.19,-7.459,0.0754,169.821,0.317,1.0,1.0,9,False,
1gCit9KXWQfPjXiZt9ZJ7o,Bohemian Rhapsody,ortoPilot,361859,2010-07-07,2010,0.904,0.5,0.275,1.61e-05,0.0798,-10.812,0.0543,76.431,0.338,1.0,7.0,27,False,viral pop
3eKrH5NHMBi7x4NIZwHkf1,Bizarre,Kenji Kawai,142426,2010-09-22,2010,0.518,0.386,0.27,0.849,0.0904,-18.461,0.0375,139.857,0.053,0.0,7.0,3,False,"anime score, japanese soundtrack, shonen"
2EkDYLonqgijsYzPOhddW5,Big Guns,Epic Score,104254,2010-03-19,2010,0.156,0.422,0.755,0.95,0.136,-6.948,0.0452,87.373,0.578,0.0,7.0,3,False,epicore
1ZANPDdiSYUQ9cugRoOetb,"#41 - Live at GTE Virginia Beach Amphitheater, Virginia Beach, VA, 06.04.96",Dave Matthews Band,500560,2010-08-31,2010,0.00109,0.308,0.891,0.00403,0.904,-7.871,0.183,88.729,0.33,0.0,4.0,11,False,"jam band, neo mellow, pop rock"
2VtDMuGaH0Xquu6TtO7isI,"Drive In Drive Out - Live at GTE Virginia Beach Amphitheater, Virginia Beach, VA, 06.04.96",Dave Matthews Band,367826,2010-08-31,2010,0.00172,0.561,0.886,0.0127,0.974,-7.82,0.0616,121.047,0.648,1.0,2.0,10,False,"jam band, neo mellow, pop rock"
1LSVZqz404v3uh5icAkAyJ,Story of My Life,Vybz Kartel,157786,2010-03-09,2010,0.0173,0.667,0.782,0.0,0.16,-6.673,0.367,111.753,0.76,0.0,11.0,26,False,"dancehall, jamaican dancehall, reggae fusion"
3QuH98etXysoPyuRqrAUms,Mother in Law,Vybz Kartel,152440,2010-03-09,2010,0.0293,0.615,0.829,0.0,0.255,-6.577,0.419,121.214,0.575,1.0,7.0,26,False,"dancehall, jamaican dancehall, reggae fusion"
2iLqd1ulS8J9cLw9Qr4ZKw,James Bond Theme,007,191000,2010-07-26,2010,0.761,0.605,0.289,0.0892,0.157,-15.441,0.0345,138.909,0.281,1.0,0.0,11,False,
0SBB6Scw40Hka8HXEZUmo7,Ghetto Youth,Vybz Kartel,255493,2010-03-09,2010,0.00078,0.414,0.723,1.12e-05,0.266,-6.68,0.0374,83.554,0.0642,1.0,6.0,27,False,"dancehall, jamaican dancehall, reggae fusion"
6V1Ha54suZAAoH9vuKznS6,10 Mile Stereo,Beach House,303853,2010-01-26,2010,0.0523,0.239,0.74,0.00117,0.419,-4.385,0.048,193.039,0.309,0.0,10.0,42,False,"art pop, baltimore indie, dream pop, dreamo, indie rock, indietronica, modern dream pop, pov: indie"
2sIHfAm9qdFqOIzhZhigVu,Bonny & Clyde,10 Ft. Ganja Plant,174186,2010-06-15,2010,0.199,0.825,0.511,0.756,0.0506,-9.1,0.144,85.407,0.774,1.0,2.0,43,False,"east coast reggae, reggae"
4DdaOUTsCqz4cLK3z92oso,143,"Bobby Brackins, Ray J",206813,2010-01-01,2010,0.0113,0.833,0.751,0.0,0.0235,-7.117,0.0854,98.039,0.716,1.0,11.0,38,True,"cali rap, slow game"
6sKKGGCuMDKiP9HProsMah,Baile De Los Pobres,Calle 13,207986,2010-11-22,2010,0.138,0.686,0.84,2.35e-06,0.133,-6.265,0.164,179.939,0.492,0.0,11.0,57,False,"latin afrobeat, latin alternative, latin hip hop, latin rock, puerto rican rock, rap conciencia, reggaeton, rock en espanol"
0bfmfUQQ291rU0BUxc33u0,Blame It on the Boogie,The Jacksons,214200,2010-03-01,2010,0.0836,0.775,0.647,0.0,0.079,-10.832,0.0951,113.291,0.888,1.0,8.0,44,False,"disco, motown"
1ucEKV5tPSgZSHGTJHqG7Y,Biggidy Bounce It,Ha-Sizzle,198374,2010-08-03,2010,0.42,0.861,0.918,0.0,0.167,-2.261,0.235,108.442,0.524,0.0,6.0,33,True,
5tN5Y4VcX8K6k0WXpPI7LV,Big Cheeseburgers and Good French Fries,Blaze Foley,149546,2010,2010,0.954,0.685,0.18,0.0043,0.11,-14.148,0.0535,105.036,0.696,1.0,11.0,34,False,"alternative country, american folk revival, cosmic american, folk, outlaw country, singer-songwriter"
46aRfPg3yedW0t1xuBnUGd,"Be Still, My Soul",The Tabernacle Choir at Temple Square,298186,2010-06-15,2010,0.976,0.0842,0.105,0.955,0.103,-22.223,0.0423,84.694,0.0359,1.0,5.0,33,False,"american choir, lds"
7hp830BlIT6lu3b1A0YYdS,100% Texan,Kevin Fowler,232960,2010-12-07,2010,0.558,0.576,0.829,1.06e-06,0.0566,-5.011,0.038,144.774,0.879,1.0,7.0,30,False,"classic texas country, outlaw country, red dirt"
61qmUg56QggXtSfsDvljMJ,Balisong,Rivermaya,219493,2010-05-18,2010,0.343,0.554,0.503,0.000231,0.247,-8.795,0.0379,79.211,0.468,0.0,0.0,31,False,opm
5ZgQSiBcESiDm6DQYD2nZE,174 Hz Earthing Schumann Resonance,J.S. Epperson,280454,2010-08-29,2010,0.782,0.0651,0.115,0.955,0.0858,-19.657,0.0491,59.541,0.0291,0.0,5.0,37,False,"healing, meditation, tone"
7bznzicO9bLBhe6SufE0Vw,Best of My Love - Single Version,The Emotions,218706,2010-03-01,2010,0.0375,0.772,0.633,0.0171,0.0497,-10.24,0.0334,115.601,0.969,1.0,0.0,39,False,"chicago soul, classic soul, disco, funk, girl group, motown, post-disco, quiet storm, soul, southern soul"
3VHybOuCYoDcDfvg0b6qc1,1009,Bonobo,270426,2010-03-29,2010,0.00972,0.695,0.803,0.00246,0.0863,-6.722,0.112,129.046,0.447,0.0,1.0,38,False,"downtempo, electronica, indietronica, instrumental hip hop, jazztronica, nu jazz, trip hop"
1S1SjHm9tdQyhwuwN3YXuu,Black Dreams,"Boo Rossini, Trick Dddy, Jeezy, Blood Raw",268408,2010-09-01,2010,0.00207,0.583,0.66,0.0,0.746,-7.055,0.352,159.008,0.253,0.0,11.0,29,False,
6M103vCysD1cETj1edCppf,Because Of You (Freestyle Dance Usa Mix),The Cover Girls,528320,2010-11-08,2010,0.00424,0.68,0.736,0.0995,0.332,-9.992,0.043,119.192,0.714,1.0,1.0,29,False,freestyle
4VapF6f7rhPJKMdorsJ1xF,Bomba Ecuatoriana,Banda Show 24 de Mayo de Patate,159892,2010-09-01,2010,0.428,0.769,0.631,0.911,0.103,-7.359,0.0402,137.645,0.934,0.0,7.0,39,False,"bomba, cumbia ecuatoriana"
4A5VaeDFaX7XKV0JnsRSxw,Broken Wings,Mr. Mister,275333,2010-02-26,2010,0.125,0.333,0.54,1.23e-05,0.0581,-11.68,0.0373,132.013,0.465,0.0,1.0,41,False,"album rock, new romantic, new wave pop, soft rock, synthpop"
5BRNOoY1kWixSHG36Pcyj0,Brand New Day,Ryan Star,194066,2010-08-02,2010,0.00918,0.503,0.954,0.0,0.176,-4.907,0.0696,93.719,0.649,0.0,6.0,35,False,
0NF73ZSuTEARh5UEugffB5,Best Song Ever - Kat Krazy Remix,"One Direction, Kat Krazy",186096,2010-11-29,2010,0.107,0.701,0.878,0.0,0.0666,-2.179,0.0929,127.0,0.771,1.0,1.0,33,False,"boy band, pop, post-teen pop, talent show"
2iYV9NsgLQUYKdkV5cICeO,Being 1,Volbeat,141960,2010-09-10,2010,3.88e-05,0.244,0.931,0.0233,0.172,-5.136,0.0477,145.032,0.393,1.0,11.0,36,False,"danish metal, danish rock"
4HAJ9RMS1Wg585OkfzGLHN,Baby Don't Get Hooked on Me,Mac Davis,182373,2010-03-01,2010,0.0561,0.51,0.397,3.14e-05,0.0686,-13.332,0.0524,80.979,0.765,1.0,9.0,31,False,"classic country pop, country rock"
6DtgjNnFU73SoLXh5teMhn,Basto,Intocable,217253,2010-01-01,2010,0.064,0.513,0.744,1.17e-05,0.167,-7.24,0.118,182.148,0.675,1.0,0.0,40,False,"banda, musica mexicana, norteno, tejano"
2CqljaIS3GwnFiJTkMlbcN,1000 Boys,Matt Duncan,212640,2010-05-01,2010,0.0601,0.76,0.435,8.19e-05,0.261,-7.829,0.0401,80.002,0.793,1.0,0.0,29,False,"lexington ky indie, retro soul"
3Xff0NbFMNutsomqY9aXgb,Bad Day,Darwin Deez,186106,2010,2010,0.02,0.789,0.395,0.0,0.167,-8.521,0.124,105.983,0.808,1.0,2.0,26,False,"british indie rock, shimmer pop"
7iFJXeUmPcBhSiJqUZhrBp,Battle Hymn of the Republic,The Tabernacle Choir at Temple Square,328160,2010-06-15,2010,0.947,0.179,0.181,0.0161,0.103,-18.162,0.0374,105.029,0.107,1.0,10.0,28,False,"american choir, lds"
3S2lkNM9wDfVSdSQb4ZWzp,Bathilda Bagshot,Alexandre Desplat,234440,2010-11-23,2010,0.579,0.104,0.0667,0.871,0.109,-19.812,0.0398,171.659,0.0355,1.0,1.0,32,False,"french soundtrack, orchestral soundtrack, soundtrack"
