id,name,artists,duration_ms,release_date,year,acousticness,danceability,energy,instrumentalness,liveness,loudness,speechiness,tempo,valence,mode,key,popularity,explicit,genre
1kFEwz97Yb0xD39ITT1n40,Aida / Act 2: Che veggo!...Egli?...Mio padre!,"Giuseppe Verdi, Renata Tebaldi, Ebe Stignani, Aldo Protti, Fernando Corena, Coro dell'Accademia Nazionale Di Santa Cecilia, Orchestra dell'Accademia Nazionale di Santa Cecilia, Alberto Erede",59533,1952-01-01,1952,0.984,0.401,0.0953,0.000104,0.849,-19.265,0.0652,111.28,0.0459,1.0,7.0,0,False,"classical, italian opera, italian romanticism, late romantic era"
0flG6XYeFAAUkDI5ApLkWM,Aida / Act 2: Fu la sorte dell'armi a'tuoi funesta,"Giuseppe Verdi, Ebe Stignani, Renata Tebaldi, Orchestra dell'Accademia Nazionale di Santa Cecilia, Alberto Erede",447600,1952-01-01,1952,0.985,0.242,0.11,0.0,0.65,-19.559,0.0676,69.082,0.041,0.0,4.0,0,False,"classical, italian opera, italian romanticism, late romantic era"
31RRnCEdP5xjuokOYLSaiM,Air II - 1992 Remastered,"Christoph Willibald Gluck, Arturo Toscanini, NBC Symphony Orchestra",150200,1952,1952,0.942,0.163,0.139,0.823,0.47,-19.919,0.0434,65.505,0.319,1.0,0.0,0,False,"classical, classical era, early music, galante era"
5QlRQ7AtjmFgJrwhMzIfCy,Air - 1992 Remastered,"Christoph Willibald Gluck, Arturo Toscanini, NBC Symphony Orchestra",104493,1952,1952,0.971,0.238,0.0601,0.766,0.141,-27.911,0.039,64.216,0.226,1.0,5.0,0,False,"classical, classical era, early music, galante era"
0rrkBxZNHN90ktbrhEQ1oS,"Artist's Life, Op. 316","Johann Strauss II, Josef Dichler, Grete Dichlerová",270672,1952,1952,0.993,0.405,0.296,0.857,0.0849,-12.801,0.0328,87.266,0.118,1.0,0.0,0,False,"classical, late romantic era, operetta"
477c6tBk8Sw98y6KlxNbfK,A Guy Is A Guy (2021 Remaster),"Mavis Rivers, The Astor Trio",189946,1952,1952,0.978,0.724,0.156,1.21e-06,0.0779,-10.514,0.0597,131.79,0.53,1.0,7.0,0,False,nz jazz
0ikXAEx1W189VeeIfbdr5O,Alta Payer Alto Chhonwa Porechhe,Tarun Banerjee,212653,1952-12-01,1952,0.786,0.612,0.525,0.0,0.102,-11.215,0.0339,112.055,0.732,0.0,10.0,0,False,
2AqJ8V4rTGSh6wlQj9ofg8,Anarkoli,Tarun Banerjee,222426,1952-12-01,1952,0.969,0.391,0.219,0.0,0.18,-13.062,0.0372,121.99,0.136,0.0,4.0,0,False,
5IpyCWSz9PrSUoNL0V3AUg,Amar Monke Niye Amar,Tarun Banerjee,187666,1952-12-01,1952,0.903,0.38,0.401,0.0284,0.284,-14.091,0.0821,169.508,0.781,1.0,0.0,0,False,
6ccUZtAYqpXymEAsZeS0Yp,Ami Chiratore Dure Chole Jabo,Satinath Mukherjee,194666,1952-12-01,1952,0.991,0.451,0.095,0.955,0.0909,-21.148,0.0822,110.984,0.459,1.0,9.0,0,False,classic bangla pop
2X3YlA6Vd2V2J96mbhT7jf,Aar Deri Nei,Tarun Banerjee,210440,1952-12-01,1952,0.968,0.479,0.454,0.00021,0.279,-11.225,0.0346,145.945,0.824,1.0,3.0,0,False,
3j89Ss31OSPerrobDjaVap,Aalta Paayer Aalto Chhowa,Tarun Banerjee,212746,1952-12-01,1952,0.689,0.574,0.574,0.0,0.133,-9.957,0.037,112.1,0.716,0.0,10.0,0,False,
2na5BUBIgwoDnvPkvMvVEf,Aaji Bijan Ghare Nishith Raate,Susmita Bhattacharya,283226,1952-12-01,1952,0.92,0.517,0.228,0.00063,0.12,-15.039,0.0302,129.243,0.477,1.0,7.0,0,False,
6KcDJOPoMcUZxHSEG5GSAs,Ami Rabo Chiradin Tomari,Satinath Mukherjee,174253,1952-12-01,1952,0.991,0.484,0.073,0.947,0.114,-24.276,0.0409,73.986,0.574,1.0,7.0,0,False,classic bangla pop
6o2ZEd5WUok3R8XzLvlpZn,Ankhi Chhala Chhalia,Tarun Banerjee,174146,1952-12-01,1952,0.99,0.767,0.265,0.000142,0.288,-14.326,0.0399,115.892,0.752,1.0,4.0,0,False,
3aPNZ2MYz1mKJzfwziHdn4,Angel's Song - 2021 Remastered Version,"Frida Sarsen-Bucky, Marian Anderson, Franz Rupp",149413,1952-09-05,1952,0.994,0.335,0.0896,0.00331,0.102,-17.421,0.0398,77.716,0.286,1.0,1.0,0,False,
0QzargNuv2pjcDFWZDA7re,Adeste Fideles (O Come All Ye Faithful) - 2021 Remastered Version,"John Francis Wade, Marian Anderson, Franz Rupp",203373,1952-09-05,1952,0.995,0.357,0.199,8.96e-06,0.0959,-7.788,0.0372,98.484,0.231,1.0,9.0,0,False,
7mwctcAwMOVXqaBK0M1X2X,"Aai Aai Raat Suhani, Pt. 2",Lata Mangeshkar,179933,1952-01-01,1952,0.992,0.0,0.217,0.225,0.136,-17.23,0.0,0.0,0.0,1.0,4.0,0,False,"classic bollywood, filmi, lata"
5v3yY3TBV12fPN07ZiHISW,"Accelerationen Walzer, Op. 234 - 2021 Remastered Version","Johann Strauss II, Eugene Ormandy, Philadelphia Orchestra",448773,1952-09-19,1952,0.949,0.313,0.199,0.805,0.109,-14.868,0.0329,91.751,0.268,1.0,7.0,0,False,"classical, late romantic era, operetta"
3DMroO3kRf7VaH8mN3Oyk4,"A Última Trombeta, Pt. 2",Olay Rodge,617514,1952-11-01,1952,0.937,0.641,0.311,0.0,0.467,-13.281,0.519,127.169,0.517,1.0,8.0,0,False,
1wls4X8iUJY8phlfqJD5H7,"Alcina, HWV 34 / Act 2: ""Ah, mio cor"" - 1953 Version","George Frideric Handel, Irma Kolassi, Jacqueline Bonneau",211306,1952-01-01,1952,0.994,0.299,0.14,2.25e-06,0.14,-11.93,0.0455,184.245,0.105,0.0,7.0,0,False,"baroque, classical, early music, english baroque, german baroque"
5Mmj2YJ8oQq6mLS7px86Kb,"Alcina - Act 2: ""Ah, mio cor"" - 1955 Version","George Frideric Handel, Irma Kolassi, Jacqueline Bonneau",243213,1952-01-01,1952,0.988,0.253,0.0533,1.96e-06,0.0981,-21.291,0.0484,77.856,0.0647,0.0,7.0,0,False,"baroque, classical, early music, english baroque, german baroque"
3udFIPuztkFLiWeQBJnV9A,A Is For Architecture - Part 2 (1960),Eldon Rathburn,273041,1952,1952,0.912,0.267,0.27,0.905,0.417,-10.134,0.0313,110.971,0.235,1.0,2.0,0,False,canadian classical
4qrAR5xZYrtYIU6Hvg9lTo,American Fantasy - 2021 Remastered Version,"Herbert Victor, Eugene Ormandy, The Philadelphia Orchestra Pops",591173,1952-05-13,1952,0.737,0.307,0.476,0.885,0.0891,-10.922,0.055,128.008,0.154,1.0,5.0,0,False,
33yzj4JrYoPVwDsTX0yWuB,"Andhali Mano Kagal, Pt. 2",Ratikumar Vyas,193884,1952-10-01,1952,0.995,0.61,0.0951,0.00101,0.274,-10.933,0.338,105.317,0.541,1.0,1.0,0,False,
7q3pzMfoQQUYjQkSJuClVB,"Aranik Muni, Pt. 2",Shantilal B. Shah,198681,1952-10-01,1952,0.995,0.701,0.151,0.0354,0.385,-8.493,0.335,129.668,0.643,1.0,8.0,0,False,
6piubfTXKH2iSmc6Qdb1Ba,Ahdetli Warda,Toraia Orchestra Of Algiers,193491,1952-02-24,1952,0.786,0.472,0.498,0.0,0.659,-8.512,0.0436,102.06,0.921,0.0,7.0,0,False,
03xMAs2dpEt1gC4o7qQEeU,Arap Kapero - Nandi Tribe,Hugh Tracey,184880,1952-09-05,1952,0.89,0.563,0.208,0.0,0.153,-19.684,0.332,101.848,0.962,0.0,1.0,0,False,
5uIN1H3wvqJi2VGfUQxBua,Apopse mes to kapileio,Thanasis Kavourakis,187720,1952-01-01,1952,0.978,0.582,0.644,0.00021,0.462,-9.298,0.0335,141.194,0.921,0.0,2.0,0,False,
5jSqOwMMu9RjS6Fh7uApmg,Azerbaijan: Folk Song,Unspecified,173960,1952-01-01,1952,0.957,0.527,0.183,9.84e-06,0.489,-16.068,0.116,145.163,0.588,1.0,6.0,0,False,
1FSuNzS4tdIsuoslGt38c5,Australia: Australian Aborigines - Corroborree Song,Unspecified,80626,1952-01-01,1952,0.256,0.755,0.532,0.167,0.0922,-14.781,0.274,130.822,0.72,1.0,1.0,0,False,
6DgzPaNwPKEM7FsqyygMDg,Albania: Lule Sofo Djale Lule,Unspecified,212893,1952-01-01,1952,0.955,0.381,0.391,3.81e-05,0.137,-11.724,0.043,84.334,0.895,0.0,4.0,0,False,
4uFOiq2sgYlr1CTFwBCsXQ,A Is For Architecture - Part 3 (1960),Eldon Rathburn,332592,1952,1952,0.846,0.333,0.322,0.852,0.107,-9.983,0.0353,127.991,0.319,1.0,2.0,0,False,canadian classical
04H9ImAH81n5EA8xeMhCFl,A Is For Architecture - Part 1 (1960),Eldon Rathburn,236449,1952,1952,0.874,0.307,0.27,0.393,0.131,-12.735,0.0312,83.079,0.461,0.0,9.0,0,False,canadian classical
692qFoZnTqtcMDH8bfVTux,"À la manière de Chabrier, M. 63/2","Maurice Ravel, Robert Casadesus",135080,1952,1952,0.995,0.443,0.0449,0.9,0.165,-27.426,0.0413,77.147,0.133,1.0,7.0,0,False,"classical, impressionism, neoclassicism, post-romantic era"
37cYU7aGUOC57Mt5uDL5V2,"Ekhono Akashe Chand, Pt. 2",Satinath Mukherjee,184253,1952-12-01,1952,0.989,0.477,0.105,0.895,0.157,-18.334,0.0412,75.52,0.497,0.0,5.0,0,False,classic bangla pop
31rvsB4C2nllbhpykWRdiN,"Frauenliebe und -leben, Op. 42: 2. Er, der Herrlichste von allen","Robert Schumann, Irmgard Seefried, Erik Werba",184733,1952-01-01,1952,0.993,0.359,0.0674,1.45e-05,0.146,-16.654,0.0501,85.417,0.175,1.0,3.0,0,False,"early romantic era, german romanticism"
0nuFMvCkLHOJHINeGN0ygr,Raater Akash Taray Royechhe,Satinath Mukherjee,182733,1952-12-01,1952,0.982,0.376,0.12,0.842,0.144,-21.015,0.044,68.004,0.485,1.0,1.0,0,False,classic bangla pop
5lGon4j48cgF0LpZxzXqjJ,"Ekhono Akashe Chand, Pt. 1",Satinath Mukherjee,181013,1952-12-01,1952,0.989,0.405,0.0678,0.905,0.0845,-19.346,0.0438,69.442,0.553,1.0,1.0,0,False,classic bangla pop
0RNsRwHYx5G9Up8TqGlxmu,Magnoliya Aar Camelia Phul,Tarun Banerjee,165293,1952-12-01,1952,0.885,0.514,0.288,0.0,0.149,-14.003,0.0553,151.082,0.935,1.0,8.0,0,False,
2rjF7XU16YMzAd82Umnpfv,Jodi Aase Kobhu,Satinath Mukherjee,173026,1952-12-01,1952,0.993,0.39,0.0444,0.924,0.114,-25.524,0.0386,137.942,0.348,1.0,8.0,0,False,classic bangla pop
2DAgStDDr0QJFZwgx4JAtL,Ellora Ajantar Karukajer Mato,Tarun Banerjee,189600,1952-12-01,1952,0.975,0.708,0.273,0.0,0.276,-14.794,0.0455,119.738,0.82,1.0,10.0,0,False,
3qnLcc7kHnAiJOygBSOh1g,"Five Poems of Mary Stuart, Op. 135: Nach der Geburt ihres Sohnes","Robert Schumann, Irmgard Seefried, Erik Werba",69466,1952-01-01,1952,0.992,0.406,0.014,0.0,0.13,-25.996,0.0634,77.256,0.119,0.0,4.0,0,False,"early romantic era, german romanticism"
6nj3gsq2Jb09652xdUUe53,"6 Weihnachtslieder, Op.8: 2. Die Hirten","Peter Cornelius, Irmgard Seefried, Erik Werba",128946,1952-01-01,1952,0.994,0.363,0.0758,1.61e-05,0.13,-18.545,0.0473,87.93,0.133,1.0,5.0,0,False,german romanticism
4xMsVOuecmXQ9zINpUY77Z,Symphony No. 2: A London Symphony: II. Lento,"Ralph Vaughan Williams, London Philharmonic Orchestra, Sir Adrian Boult",662000,1952,1952,0.856,0.0799,0.0287,0.732,0.096,-22.888,0.0441,82.976,0.0339,1.0,0.0,0,False,"classical, early modern classical, post-romantic era"
1T6ITfHMCul52oCNFp3QAN,Symphony No. 2: A London Symphony: IV. Andante con moto - Epilogue,"Ralph Vaughan Williams, London Philharmonic Orchestra, Sir Adrian Boult",749083,1952,1952,0.84,0.165,0.158,0.879,0.189,-17.155,0.0406,110.676,0.0395,1.0,0.0,0,False,"classical, early modern classical, post-romantic era"
1D2AnvZF57q70vUtydfzXl,"Symphony No. 2 in D Major, Op. 73: IV. Allegro con spirito","Johannes Brahms, Arturo Toscanini",533880,1952,1952,0.885,0.306,0.348,0.906,0.13,-12.391,0.0313,104.512,0.392,1.0,2.0,0,False,"classical, german romanticism, late romantic era"
7IhKcGllUGZ19jHBKIBu1j,"Symphony No. 2 in D Major, Op. 73: II. Adagio non troppo","Johannes Brahms, Arturo Toscanini",511546,1952,1952,0.952,0.0839,0.195,0.891,0.0987,-16.061,0.0472,74.49,0.0453,1.0,11.0,0,False,"classical, german romanticism, late romantic era"
2xJpDimDPeR68MPCm1tVfj,"Symphony No. 2 in D Major, Op. 73: III. Allegretto grazioso (Quasi andantino)","Johannes Brahms, Arturo Toscanini",329106,1952,1952,0.952,0.242,0.185,0.939,0.133,-21.208,0.0472,84.326,0.232,1.0,0.0,0,False,"classical, german romanticism, late romantic era"
3rioRZyRLt3OWkmfhtZ2k1,"Symphony No. 2 in D Major, Op. 73: I. Allegro non troppo","Johannes Brahms, Arturo Toscanini",878960,1952,1952,0.939,0.222,0.203,0.925,0.135,-13.15,0.039,118.892,0.0688,1.0,2.0,0,False,"classical, german romanticism, late romantic era"
2MtJohjFXUWn8tymF1MRqV,Symphony No. 2 in B Minor: II. Scherzo. Prestissimo - Allegretto,"Alexander Borodin, Minnesota Orchestra, Antal Doráti",289764,1952,1952,0.967,0.388,0.201,0.836,0.099,-17.93,0.0569,114.376,0.168,1.0,5.0,0,False,"classical, early modern classical, late romantic era, russian romanticism"
3ljgoeGCInp6uOo1L5Ka1l,Symphony No. 2 in B Minor: IV. Finale. Allegro,"Alexander Borodin, Minnesota Orchestra, Antal Doráti",399929,1952,1952,0.978,0.44,0.294,0.818,0.0701,-10.118,0.0367,136.589,0.176,1.0,6.0,0,False,"classical, early modern classical, late romantic era, russian romanticism"
5cWvk50zNDGSQSahsmuVTo,Symphony No. 2 in B Minor: I. Allegro,"Alexander Borodin, Minnesota Orchestra, Antal Doráti",464342,1952,1952,0.971,0.446,0.275,0.894,0.0988,-10.218,0.039,113.454,0.22,1.0,7.0,0,False,"classical, early modern classical, late romantic era, russian romanticism"
1FckJwLT0fWVN9BqOTDPFO,Symphony No. 2 in B Minor: III. Andante,"Alexander Borodin, Minnesota Orchestra, Antal Doráti",444026,1952,1952,0.976,0.0991,0.104,0.853,0.112,-15.237,0.0401,79.998,0.0394,1.0,1.0,0,False,"classical, early modern classical, late romantic era, russian romanticism"
58YgnaQGPnbbM0yTioD08x,"Prelude, Aria & Finale, CFF 26: II. Aria. Lento","César Franck, Jörg Demus",386844,1952,1952,0.995,0.344,0.0116,0.943,0.109,-28.465,0.0427,79.19,0.0753,1.0,8.0,0,False,"classical, french romanticism, late romantic era"
3CtYcaG1Aaj2dvXs4gk0Wt,"Prelude, Aria & Finale, CFF 26: I. Prélude. Allegro moderato e maestoso","César Franck, Jörg Demus",525834,1952,1952,0.994,0.427,0.0961,0.908,0.141,-18.755,0.0413,99.468,0.0495,1.0,4.0,0,False,"classical, french romanticism, late romantic era"
7JB26tUfVOOa42CLJyUkfx,"Prelude, Aria & Finale, CFF 26: III. Final. Allegro molto ed agitato","César Franck, Jörg Demus",431760,1952,1952,0.991,0.252,0.228,0.9,0.103,-17.928,0.0404,68.676,0.0637,1.0,4.0,0,False,"classical, french romanticism, late romantic era"
73psvUP7zZlxpmxTUXrlKz,"Banjo and Fiddle - 28 April, 1947","Jascha Heifetz, Emanuel Bay",152080,1952-01-01,1952,0.993,0.367,0.0423,0.959,0.107,-33.182,0.0384,79.529,0.697,1.0,2.0,0,False,violin
5YJr3EUq7ZHtqhClRNNavi,"St. Matthew Passion, BWV 244 - Part Two: No. 33 Evangelist, Pontifex: ""Und der Hohepriester stand auf""","Johann Sebastian Bach, Karl Erb, Herman Schey, Royal Concertgebouw Orchestra, Willem Mengelberg",54146,1952-01-01,1952,0.894,0.303,0.109,1.3e-06,0.122,-24.825,0.0559,111.384,0.296,0.0,0.0,0,False,"baroque, classical, early music, german baroque"
4VTN7GhyqwTqg2Dzgh3off,"St. Matthew Passion, BWV 244 - Part One: No. 16 Evangelist, Jesus, Petrus: ""Petrus aber antwortete""","Johann Sebastian Bach, Karl Erb, Willem Ravelli, Herman Schey, Royal Concertgebouw Orchestra, Willem Mengelberg",92000,1952-01-01,1952,0.964,0.353,0.101,0.0,0.254,-21.387,0.0545,126.467,0.222,1.0,2.0,0,False,"baroque, classical, early music, german baroque"
4ZXqw9KRayE5HwPVUQFMIq,"St. Matthew Passion, BWV 244 - Part One: No. 13 Aria (Soprano): ""Ich will dir mein Herz schenken""","Johann Sebastian Bach, Jo Vincent, Royal Concertgebouw Orchestra, Willem Mengelberg",284160,1952-01-01,1952,0.92,0.294,0.251,0.0198,0.119,-17.912,0.0563,114.763,0.2,1.0,7.0,0,False,"baroque, classical, early music, german baroque"
27lnVpIKy1eCAtKiGKoBId,Kamel El Awsaf Live Record,Abdel Halim Hafez,1254022,1952-12-31,1952,0.989,0.322,0.221,0.861,0.742,-16.027,0.0405,118.546,0.185,0.0,0.0,2,False,classic arab pop
1eScfRVmknHlCdA058NIiF,Kapitel 33 - Der alte Mann und das Meer - Erzählung,"Ernest Hemingway, Christian Brückner",186963,1952,1952,0.668,0.71,0.273,0.0,0.227,-18.096,0.958,117.388,0.316,1.0,0.0,10,False,
51KNiThWTN8HWAGCgA475G,Kapitel 32 - Der alte Mann und das Meer - Erzählung,"Ernest Hemingway, Christian Brückner",187553,1952,1952,0.756,0.706,0.307,2.8e-06,0.583,-17.858,0.96,109.809,0.286,1.0,0.0,10,False,
5nZyi2mAqhfojX6hib7yHa,Kapitel 37 - Der alte Mann und das Meer - Erzählung,"Ernest Hemingway, Christian Brückner",181807,1952,1952,0.867,0.644,0.32,0.0,0.255,-15.628,0.963,91.353,0.568,0.0,11.0,9,False,
6vbMTH3FAEzBc3oqIK33yh,Kapitel 38 - Der alte Mann und das Meer - Erzählung,"Ernest Hemingway, Christian Brückner",183665,1952,1952,0.799,0.65,0.274,6.12e-06,0.399,-18.274,0.966,73.202,0.574,1.0,2.0,9,False,
0zOvx2zTITY2D1IHVIubFt,Kapitel 34 - Der alte Mann und das Meer - Erzählung,"Ernest Hemingway, Christian Brückner",183817,1952,1952,0.745,0.686,0.296,1.69e-06,0.605,-18.423,0.958,105.657,0.385,0.0,11.0,9,False,
5dwcp7fpbFdfOrfa7G5irm,Kapitel 30 - Der alte Mann und das Meer - Erzählung,"Ernest Hemingway, Christian Brückner",191459,1952,1952,0.811,0.623,0.289,2.47e-06,0.21,-16.73,0.97,82.766,0.475,0.0,11.0,9,False,
4Zl49XQFJGwRMWuZRSIF8w,Kapitel 35 - Der alte Mann und das Meer - Erzählung,"Ernest Hemingway, Christian Brückner",181502,1952,1952,0.825,0.705,0.307,1.25e-05,0.487,-18.611,0.963,110.89,0.431,0.0,11.0,9,False,
7pQslFht63dycnovL1i60W,Kapitel 39 - Der alte Mann und das Meer - Erzählung,"Ernest Hemingway, Christian Brückner",185483,1952,1952,0.847,0.688,0.29,1.8e-05,0.309,-17.437,0.961,113.618,0.518,0.0,11.0,9,False,
7wD60ozHSWBnNyLFLmRd2p,"Aida / Act 3: Pur ti riveggo, mia dolce Aida","Giuseppe Verdi, Mario del Monaco, Renata Tebaldi, Orchestra dell'Accademia Nazionale di Santa Cecilia, Alberto Erede",169200,1952-01-01,1952,0.985,0.416,0.28,0.000209,0.603,-16.511,0.0653,89.137,0.316,1.0,7.0,0,False,"classical, italian opera, italian romanticism, late romantic era"
4xs2rE48zqAwR8QrGeOwWK,Aida / Act 3: Fuggiam gli ardori inospiti,"Giuseppe Verdi, Renata Tebaldi, Mario del Monaco, Aldo Protti, Orchestra dell'Accademia Nazionale di Santa Cecilia, Alberto Erede",393200,1952-01-01,1952,0.985,0.28,0.126,0.002,0.561,-18.333,0.0567,87.739,0.105,0.0,7.0,0,False,"classical, italian opera, italian romanticism, late romantic era"
23au6Zkb3ft1P9mW5djnno,Aida / Act 3: Qui Radames verrà!...O Patria mia,"Giuseppe Verdi, Renata Tebaldi, Orchestra dell'Accademia Nazionale di Santa Cecilia, Alberto Erede",417000,1952-01-01,1952,0.973,0.237,0.0636,0.000493,0.154,-23.154,0.0487,93.942,0.0333,1.0,5.0,0,False,"classical, italian opera, italian romanticism, late romantic era"
22OURVwjaa2D2gqlSj3hrP,Aida / Act 3: O tu che sei d'Osiride,"Giuseppe Verdi, Dario Caselli, Ebe Stignani, Coro dell'Accademia Nazionale Di Santa Cecilia, Orchestra dell'Accademia Nazionale di Santa Cecilia, Alberto Erede",273666,1952-01-01,1952,0.965,0.224,0.0382,0.000719,0.118,-28.174,0.0434,108.302,0.0323,1.0,7.0,0,False,"classical, italian opera, italian romanticism, late romantic era"
6eVCJxePSVKC9LSpeDkrDF,Aida / Act 3: Ciel! mio padre!,"Giuseppe Verdi, Renata Tebaldi, Aldo Protti, Orchestra dell'Accademia Nazionale di Santa Cecilia, Alberto Erede",473000,1952-01-01,1952,0.988,0.3,0.248,0.00107,0.329,-15.295,0.066,84.734,0.0827,0.0,5.0,0,False,"classical, italian opera, italian romanticism, late romantic era"
02ARMzcARZHekrx2GRys3K,Aida / Act 3: Tu...Amonasro!...tu!...il Re?,"Giuseppe Verdi, Mario del Monaco, Renata Tebaldi, Aldo Protti, Dario Caselli, Orchestra dell'Accademia Nazionale di Santa Cecilia, Alberto Erede",151226,1952-01-01,1952,0.987,0.427,0.34,0.009,0.333,-10.373,0.0687,65.81,0.25,1.0,2.0,0,False,"classical, italian opera, italian romanticism, late romantic era"
5HGVIMTB1kCoAXfdbZ6KGM,Ayida Pas Nan Bètise (Pétro Dance),The Ayida Group,147026,1952-01-01,1952,0.978,0.583,0.268,0.125,0.34,-18.195,0.305,92.813,0.664,1.0,7.0,0,False,"haitian traditional, haitian vodou drumming"
7h363YgHQFgPWrnq9A0qpb,Ayida Déesse Arc en Ciel (Mahi Dance),The Ayida Group,126786,1952-01-01,1952,0.963,0.619,0.451,0.702,0.189,-19.67,0.263,103.23,0.766,0.0,7.0,0,False,"haitian traditional, haitian vodou drumming"
22EsPnFrgqBL8FawCgFxJ3,"A Última Trombeta, Pt. 3",Olay Rodge,490282,1952-11-01,1952,0.926,0.552,0.333,0.0,0.17,-12.222,0.329,104.082,0.402,1.0,9.0,0,False,
6SQA5MCliOS8HH8Qt3qZjX,"3 Mélodies, Op. 18: 3. Automne","Gabriel Fauré, Irma Kolassi, Jacqueline Bonneau",169413,1952-01-01,1952,0.994,0.278,0.132,5.04e-05,0.115,-15.403,0.0445,170.862,0.0991,1.0,7.0,0,False,"classical, post-romantic era"
35qEo9IRBmjneYzmcKrlV5,Ahleflk Matesadksh,Farid al-Atrash,362426,1952-01-01,1952,0.953,0.493,0.319,0.0,0.638,-6.672,0.0602,141.026,0.479,1.0,0.0,0,False,"arab folk, arab pop, classic arab pop, oud, syrian pop"
7IUak4KcDppGy1tcNaiteZ,Angélique Oh (Jerico),"Blind minstrel with guitar, young boy with cha-chas",165946,1952-01-01,1952,0.994,0.625,0.554,0.0111,0.167,-11.467,0.0588,119.903,0.728,1.0,2.0,0,False,haitian traditional
2XkDD6DiPcsFUZbPHkKMha,"Five Poems of Mary Stuart, Op. 135: An die Königin Elisabeth","Robert Schumann, Irmgard Seefried, Erik Werba",98306,1952-01-01,1952,0.986,0.461,0.041,7.96e-05,0.154,-22.073,0.049,87.378,0.454,0.0,9.0,0,False,"early romantic era, german romanticism"
3thd7furfK1pufl9TcIlMG,"Sonata for Piano for 4 hands in D Major, K. 381: III. Allegro molto","Wolfgang Amadeus Mozart, Josef Dichler, Grete Dichlerová",250440,1952,1952,0.989,0.4,0.166,0.946,0.149,-16.96,0.0328,81.133,0.319,1.0,2.0,0,False,"classical, classical era"
3G6f2BO7qPxc09oThyfQwp,"Sonata for Piano for 4 hands in D Major, K. 381: I. Allegro","Wolfgang Amadeus Mozart, Josef Dichler, Grete Dichlerová",210119,1952,1952,0.991,0.539,0.28,0.889,0.092,-14.535,0.0418,71.538,0.569,1.0,2.0,0,False,"classical, classical era"
3St2qLDGo2UzpqpcgpcwUI,"Sonata for Piano for 4 hands in D Major, K. 381: II. Andante","Wolfgang Amadeus Mozart, Josef Dichler, Grete Dichlerová",271977,1952,1952,0.994,0.495,0.0373,0.951,0.129,-22.976,0.0421,114.733,0.193,1.0,7.0,0,False,"classical, classical era"
5C3AQumQBWya0hp77RmD5e,Mambo Ayida (Congo Dance),The Ayida Group,117760,1952-01-01,1952,0.974,0.691,0.411,0.816,0.33,-16.444,0.286,112.674,0.746,0.0,4.0,0,False,"haitian traditional, haitian vodou drumming"
013tUrZk60l2Zn25ipC4u2,Sabrin Aala Sabri,Abdel Aziz Mahmoud,609176,1952-01-01,1952,0.949,0.355,0.395,0.173,0.719,-11.257,0.0446,109.793,0.455,1.0,0.0,0,False,
5xhHwmEnvaqg4zk3CqRjtM,"Frauenliebe und -leben Op. 42: 3. Ich kann's nicht fassen, nicht glauben","Robert Schumann, Irmgard Seefried, Erik Werba",98213,1952-01-01,1952,0.992,0.522,0.0943,0.0,0.0652,-16.618,0.0977,83.55,0.0477,0.0,0.0,0,False,"early romantic era, german romanticism"
1TLw39ZpWTfE8ytOX24r1l,"6 Weihnachtslieder, Op. 8: 3. Die Könige","Peter Cornelius, Irmgard Seefried, Erik Werba",145786,1952-01-01,1952,0.994,0.458,0.076,8.62e-06,0.245,-20.023,0.0654,93.471,0.166,1.0,10.0,0,False,german romanticism
41cDCiCVfsVXQKCBdjUh1s,"Symphony No. 3 in F Major, Op. 90: IV. Allegro","Johannes Brahms, Arturo Toscanini",529866,1952,1952,0.928,0.208,0.261,0.953,0.179,-9.867,0.035,80.988,0.11,0.0,5.0,0,False,"classical, german romanticism, late romantic era"
7F6gukMF0jeADGW5iFvzR7,"Symphony No. 3 in F Major, Op. 90: II. Andante","Johannes Brahms, Arturo Toscanini",575200,1952,1952,0.974,0.155,0.105,0.928,0.115,-15.481,0.042,134.952,0.0375,1.0,0.0,0,False,"classical, german romanticism, late romantic era"
7CY4ZxA3reGeTzsA9q7HV3,"Symphony No. 3 in F Major, Op. 90: III. Poco allegretto","Johannes Brahms, Arturo Toscanini",415453,1952,1952,0.967,0.185,0.141,0.847,0.116,-16.795,0.0377,133.123,0.0934,0.0,0.0,0,False,"classical, german romanticism, late romantic era"
7iG9ylzL9RdAhltZSit4zg,"Symphony No. 3 in F Major, Op. 90: I. Allegro con brio","Johannes Brahms, Arturo Toscanini",824626,1952,1952,0.925,0.24,0.123,0.909,0.116,-14.548,0.0344,103.003,0.0792,1.0,5.0,0,False,"classical, german romanticism, late romantic era"
6blGewqLDDFzHkXNKBLMMY,"Symphony No. 3 in C Minor, Op. 78 ""Organ"": Part I: I. Adagio - Allegro moderato","Camille Saint-Saëns, Arturo Toscanini, NBC Symphony Orchestra",614026,1952,1952,0.891,0.13,0.144,0.796,0.268,-20.219,0.0452,69.682,0.131,1.0,8.0,0,False,"classical, french romanticism, late romantic era"
7AqQ9iRImCCCG1Jbfa2rcz,"Symphony No. 31 in D Major, K. 297 ""Paris"": III. Allegro - Remastered 2024","Wolfgang Amadeus Mozart, London Symphony Orchestra, Josef Krips",241095,1952,1952,0.891,0.326,0.324,0.876,0.338,-13.754,0.0358,126.473,0.4,1.0,2.0,0,False,"classical, classical era"
6oBKwsdPO9Yy3dcymGxG2y,"Symphony No. 31 in D Major, K. 297 ""Paris"": II. Andante - Remastered 2024","Wolfgang Amadeus Mozart, London Symphony Orchestra, Josef Krips",308333,1952,1952,0.923,0.157,0.064,0.0971,0.255,-24.214,0.0496,69.474,0.138,1.0,7.0,0,False,"classical, classical era"
0kkmQycy7IjiNzMK0zivZg,"Symphony No. 39 in E-Flat Major, K. 543: III. Menuetto. Allegretto - Remastered 2024","Wolfgang Amadeus Mozart, London Symphony Orchestra, Josef Krips",255971,1952,1952,0.919,0.384,0.0611,0.767,0.143,-21.574,0.0332,129.918,0.374,1.0,3.0,0,False,"classical, classical era"
4URZ82JjNj9wJ79n2iwUej,"Symphony No. 3 in C Minor, Op. 78 ""Organ"": Part II: III. Allegro moderato - Presto","Camille Saint-Saëns, Arturo Toscanini, Joseph Kahn, NBC Symphony Orchestra",407266,1952,1952,0.876,0.296,0.2,0.83,0.588,-20.978,0.0409,143.646,0.426,1.0,8.0,0,False,"classical, french romanticism, late romantic era"
5JLWAZ9SCABHG0HxGnvej5,"Parthita No. 3 for Piano in A Minor, .: Fantasie","Johann Sebastian Bach, Hugo Steurer",1071987,1952,1952,0.994,0.302,0.217,0.857,0.0945,-18.281,0.0403,132.475,0.458,0.0,9.0,0,False,"baroque, classical, early music, german baroque"
2ni8ROrdTA644VIZG56nBd,"Symphony No. 39 in E-Flat Major, K. 543: II. Andante con moto - Remastered 2024","Wolfgang Amadeus Mozart, London Symphony Orchestra, Josef Krips",504361,1952,1952,0.955,0.137,0.0443,0.682,0.0908,-23.021,0.0346,81.597,0.0723,1.0,8.0,0,False,"classical, classical era"
5iffyP6qvNbu7NxfohJAoQ,"Symphony No. 39 in E-Flat Major, K. 543: I. Adagio – Allegro - Remastered 2024","Wolfgang Amadeus Mozart, London Symphony Orchestra, Josef Krips",538629,1952,1952,0.918,0.242,0.152,0.897,0.158,-18.071,0.0346,141.775,0.0776,1.0,3.0,0,False,"classical, classical era"
1Z6skZJ8Llbv0lCEr46nJv,"Symphony No. 39 in E-Flat Major, K. 543: IV. Finale. Allegro - Remastered 2024","Wolfgang Amadeus Mozart, London Symphony Orchestra, Josef Krips",253776,1952,1952,0.932,0.438,0.355,0.942,0.339,-16.45,0.0351,131.612,0.358,1.0,3.0,0,False,"classical, classical era"
7cVTDmyHfDkJ1y4g4UPW2Z,"Symphony No. 3 in C Minor, Op. 78 ""Organ"": Part II: IV. Maestoso - Allegro","Camille Saint-Saëns, Arturo Toscanini, George Cook, Joseph Kahn, NBC Symphony Orchestra",468920,1952,1952,0.806,0.3,0.314,0.944,0.0758,-13.293,0.035,103.146,0.186,1.0,0.0,0,False,"classical, french romanticism, late romantic era"
4gZvb8lYTjeuazPNw4OPXO,"Symphony No. 3 in C Minor, Op. 78 ""Organ"": Part I: II. Poco adagio","Camille Saint-Saëns, Arturo Toscanini, George Cook, NBC Symphony Orchestra",600160,1952,1952,0.619,0.0788,0.0329,0.836,0.105,-29.383,0.0399,173.916,0.0352,1.0,1.0,0,False,"classical, french romanticism, late romantic era"
