id,name,artists,duration_ms,release_date,year,acousticness,danceability,energy,instrumentalness,liveness,loudness,speechiness,tempo,valence,mode,key,popularity,explicit,genre
6D5GoogBIBMUBlQ1CYTkOH,She Needs Me (Remix),"Kendrick Lamar, Dom Kennedy, Murs",195790,2010-09-14,2010,0.417,0.606,0.835,1.11e-06,0.103,-6.107,0.265,100.145,0.313,1.0,5.0,54,True,"conscious hip hop, hip hop, rap, west coast rap"
1JgTzrrrnh6neqTtvA3F5d,Kasvetli Kutlama,She Past Away,306666,2010-04-03,2010,0.00038,0.488,0.923,0.825,0.0924,-7.425,0.029,144.016,0.57,0.0,0.0,41,False,"gothic post-punk, gothic rock, modern goth, turkish post-punk"
4yjGPsGJrWSkj3kHUfp1xI,The Kill Ring,John Powell,269146,2010-01-01,2010,0.253,0.179,0.512,0.913,0.126,-10.586,0.0431,76.201,0.0392,1.0,7.0,40,False,"british soundtrack, orchestral soundtrack, soundtrack"
6qMOBDnIaCj7QrvI8T5V4C,King Night,SALEM,230960,2010-09-28,2010,0.000173,0.431,0.838,0.809,0.493,-6.526,0.0679,131.808,0.166,1.0,1.0,39,False,"grave wave, witch house"
0LMQvt6yAGggdowj8hazNy,"Kingdom Celebration - From ""Tangled""/Score",Alan Menken,110800,2010-01-01,2010,0.553,0.331,0.438,0.764,0.0841,-10.33,0.0365,136.448,0.805,1.0,1.0,37,False,"broadway, movie tunes, orchestral soundtrack"
0KstahwTIgIo3foojN23tw,Kill Her,Hopsin,220845,2010-11-19,2010,0.113,0.838,0.829,0.0,0.198,-3.894,0.249,137.098,0.58,1.0,5.0,36,True,"conscious hip hop, indie pop rap"
1hzPJvGgRT8iqw9eisCXxC,You Kill Me (In A Good Way),Sleeping With Sirens,222120,2010-03-22,2010,6.09e-05,0.38,0.907,0.0,0.103,-5.052,0.062,155.019,0.607,0.0,3.0,49,False,"neon pop punk, pop emo, pop punk, screamo"
4h0EXpatqJImv4VRgvX6po,Last Kiss,Taylor Swift,367133,2010-10-25,2010,0.57,0.371,0.341,3.09e-05,0.101,-9.475,0.0319,89.038,0.196,1.0,10.0,47,False,pop
6YcXD1FUybxr983RrkFwS7,Kites,Geographer,261337,2010-08-17,2010,0.00486,0.424,0.7,0.0288,0.091,-7.328,0.0315,85.988,0.16,1.0,5.0,35,False,"bay area indie, chillwave, indietronica, shimmer pop"
7kruFQxtsgz7aLpV82WsLN,Kuntry Boys (feat. Lil Wyte & Jelly Roll),"SMO, Lil Wyte, Jelly Roll",294374,2010-11-16,2010,0.11,0.678,0.961,0.0,0.264,-2.642,0.245,143.411,0.829,1.0,0.0,34,False,redneck
6TRVvpoVFwyYyIGTFh0Y7P,P&P 1.5,"Kendrick Lamar, Ab-Soul",361942,2010-09-14,2010,0.299,0.55,0.692,6.57e-06,0.198,-7.438,0.369,146.453,0.593,0.0,6.0,53,True,"conscious hip hop, hip hop, rap, west coast rap"
4FcOYKkhIXgvO787zu0Cxy,My Kind Of Crazy,Brantley Gilbert,214560,2010,2010,0.5,0.551,0.452,0.0,0.272,-9.402,0.0299,142.015,0.329,1.0,8.0,46,False,"contemporary country, country, country road, modern country rock"
60CirPlTOEWOUBus7HxV3B,Radioactive,Kings of Leon,206186,2010-10-19,2010,0.00877,0.408,0.925,0.000454,0.12,-4.88,0.0533,126.405,0.361,1.0,5.0,58,False,"modern rock, rock"
7fLzbEOBOae9lUnOwr7Tse,Memories (feat. Kid Cudi),"David Guetta, Kid Cudi",210093,2010-11-22,2010,0.0015,0.561,0.87,2.82e-06,0.246,-6.103,0.343,129.98,0.498,1.0,8.0,80,False,"big room, dance pop, edm, pop, pop dance"
4i95IcFlxQLIVDlChgAHGU,Kiss My Country Ass,Blake Shelton,252920,2010-11-08,2010,0.0435,0.517,0.846,0.0,0.177,-4.332,0.0346,89.912,0.683,1.0,7.0,33,False,"classic oklahoma country, contemporary country, country, country road, modern country rock"
2iLTaymYzJtKxanHsFw5rc,KC Tea,Tech N9ne Collabos,241946,2010-07-27,2010,0.082,0.859,0.67,0.0,0.487,-6.089,0.221,95.989,0.659,0.0,6.0,33,True,"country rap, kansas city hip hop"
2v1DwZai9QYkcq8iuDzeDB,Killing Floor - Live At Monterey,Jimi Hendrix,194653,2010-01-01,2010,0.0211,0.4,0.731,0.0222,0.309,-9.911,0.047,80.416,0.823,0.0,1.0,38,False,"acid rock, album rock, alternative rock, classic rock, hard rock, proto-metal, psychedelic rock, rock"
4zXOUCBRI3DcPboKXZeFu5,Kiss It Better,He Is We,245786,2010-01-01,2010,0.812,0.664,0.335,0.0,0.104,-7.336,0.0281,144.967,0.237,1.0,6.0,36,False,"alternative pop rock, neon pop punk, pixie, washington indie"
69y5Ccc4CVtL96cHzvgQEy,Carolina In My Mind - Live At The Troubadour / 2007,"Carole King, James Taylor",256493,2010-01-01,2010,0.652,0.367,0.522,0.0,0.705,-7.296,0.0301,131.178,0.239,1.0,5.0,39,False,"brill building pop, classic rock, folk, folk rock, mellow gold, singer-songwriter, soft rock"
5Y3d8TTZXRfhrGGVoKAeNP,The Kids (feat. Janelle Monáe),"B.o.B, Janelle Monáe",206906,2010-04-27,2010,0.0916,0.761,0.92,0.0,0.365,-5.773,0.413,139.966,0.587,1.0,5.0,34,False,"atl hip hop, dance pop, pop rap, rap, southern hip hop"
52itZ0w0CydihB2JCZEIft,Pee Loon,"Pritam, Mohit Chauhan",285686,2010-06-29,2010,0.277,0.656,0.721,0.000139,0.188,-5.064,0.0364,83.95,0.883,1.0,8.0,73,False,"filmi, indian instrumental, modern bollywood"
4BmRwi5cI23NPjmemqsRN4,Kimi ni Todoke - TV ver.,Tomofumi Tanizawa,63826,2010-01-27,2010,0.244,0.66,0.549,0.0,0.0863,-8.669,0.0397,125.922,0.208,0.0,6.0,42,False,
4XCHizdk3YrzdveEOAGpob,Kill EVERYBODY - Bare Noize Remix,"Skrillex, Bare Noize",281122,2010-12-21,2010,0.00133,0.594,0.947,0.108,0.305,-3.904,0.0519,140.043,0.362,1.0,0.0,35,False,"brostep, complextro, edm, electro, pop dance"
0wSv9PSXKJVDrFA5okOztU,Killin' It,Foxy Shazam,238040,2010-04-12,2010,0.00147,0.567,0.901,0.0,0.318,-4.019,0.0491,142.959,0.587,1.0,7.0,40,False,"cincinnati indie, piano rock"
4bwO2XUKLaL1wM8VTr8L7F,King of the Road,Randy Travis,228213,2010-09-24,2010,0.249,0.84,0.332,1.6e-06,0.111,-10.759,0.0427,120.495,0.621,1.0,2.0,35,False,"contemporary country, country, country gospel, country road"
70m0stSROYe2pyzUDhQnOk,Kaine / Escape,SQUARE ENIX MUSIC,186466,2010-04-21,2010,0.608,0.629,0.735,0.0,0.079,-9.616,0.0303,128.001,0.637,0.0,7.0,39,False,japanese vgm
5QemHQxj7PRkrw8lJl2W7C,Scott Mescudi Vs. The World,"Kid Cudi, CeeLo Green",235293,2010-11-09,2010,0.28,0.78,0.72,0.591,0.132,-5.914,0.0278,108.685,0.583,0.0,11.0,51,True,"hip hop, ohio hip hop, pop rap, rap"
4aPRuTsiG7B4owTTF8Dm3U,Love The Way You Lie (Part II) - Pt. 2,"Rihanna, Eminem",296226,2010-11-16,2010,0.328,0.485,0.839,0.0,0.048,-4.5,0.158,165.999,0.398,1.0,10.0,56,True,"barbadian pop, pop, urban contemporary"
0ob3zPIGXWwg2hyXJNs3Ct,La Carcacha,Selena,196826,2010-01-01,2010,0.13,0.695,0.8,0.0,0.361,-5.635,0.0673,182.065,0.93,1.0,8.0,60,False,"mexican pop, tejano"
2qWPIc4TfXwTzw8cTNxgoI,La Ley del Monte,Vicente Fernández,174360,2010-12-01,2010,0.308,0.64,0.393,0.0129,0.0593,-4.333,0.0316,105.605,0.751,1.0,7.0,63,False,"mariachi, ranchera"
5tWcnoeAmrmiIwaBycUGue,La Doble Rodada,Los Armadillos de la Sierra,179293,2010,2010,0.789,0.925,0.33,0.0,0.0647,-8.29,0.0496,103.883,0.965,1.0,5.0,54,False,tierra caliente
0f73zOCdBx6ZPdiBjwN1AP,Little White Church,Little Big Town,186224,2010-01-01,2010,0.13,0.667,0.878,0.0,0.16,-4.797,0.0445,107.024,0.816,1.0,10.0,53,False,"contemporary country, country, country dawn, country road"
5ExE1x7WIIsb159d2cZ0Z2,Loonboon,Laura Shigihara,107012,2010-11-22,2010,0.701,0.518,0.395,0.928,0.236,-17.661,0.0335,159.888,0.742,1.0,11.0,59,False,video game music
2HaUEu0wAO5AOT0UB3i0LO,Living In A Dream,Finger Eleven,184773,2010-10-05,2010,0.00216,0.534,0.922,6.34e-05,0.257,-2.305,0.0568,98.022,0.71,1.0,8.0,56,False,"alternative metal, canadian rock, funk metal, nu metal, post-grunge"
7iuU9NU6rhcWNYJ1KjylTO,Lead Me,Sanctus Real,228800,2010-01-01,2010,0.0266,0.314,0.644,0.0,0.108,-4.646,0.0345,198.063,0.27,1.0,1.0,54,False,"ccm, christian alternative rock, christian music"
11EX5yhxr9Ihl3IN1asrfK,Need You Now,Lady A,277573,2010-01-01,2010,0.0906,0.588,0.622,0.000633,0.2,-5.535,0.0303,107.942,0.229,1.0,4.0,70,False,"contemporary country, country, country dawn, country pop, country road"
4XRZbiVdsA5qv6f6qP70lS,Love Like Woe,The Ready Set,200453,2010-06-14,2010,0.139,0.697,0.775,0.0,0.0737,-4.106,0.0636,90.015,0.822,1.0,10.0,52,False,"neon pop punk, pixie, pop emo, pop punk"
26iYJEimPCE0ozDlpj0UFN,Livin' On Love,Alan Jackson,228733,2010-11-19,2010,0.163,0.705,0.669,3.41e-06,0.0966,-5.974,0.0262,118.539,0.673,1.0,9.0,54,False,country
1jlKdNbOA90rjnt88GJnwO,La Vuelta Al Mundo,Calle 13,234133,2010-11-22,2010,0.159,0.748,0.538,1.62e-06,0.167,-9.943,0.222,124.974,0.779,1.0,0.0,69,False,"latin afrobeat, latin alternative, latin hip hop, latin rock, puerto rican rock, rap conciencia, reggaeton, rock en espanol"
2qomKwhtqtbQWk7dwAmFXg,The Legend Begins,Marc Streitenfeld,87680,2010-05-11,2010,0.973,0.235,0.231,0.973,0.235,-17.956,0.0394,66.687,0.0325,1.0,5.0,59,False,"german soundtrack, orchestral soundtrack, soundtrack"
2aqsQyxUdXNQPvgWe6gqON,La Rubia Y La Morena,Los Dinamicos Del Norte,195093,2010,2010,0.161,0.493,0.684,1.38e-06,0.209,-7.439,0.101,182.312,0.873,1.0,8.0,53,False,"classic sierreno, corridos alternativos, norteno"
6Z2sE22Gqu0XOv5RbK9sM9,Long Term Relationships Were Only Cool When Divorce Wasn't,Merchant Ships,158333,2010-04-20,2010,0.417,0.307,0.397,0.0942,0.131,-13.039,0.0522,67.411,0.05,1.0,0.0,51,False,"lo-fi indie, midwest emo"
29CJGwJt5wyo7Sjje87Cy8,Lay It On The Line,Triumph,246026,2010-05-14,2010,0.00672,0.228,0.872,0.0,0.242,-5.479,0.0627,91.718,0.279,0.0,9.0,52,False,"album rock, canadian metal, classic canadian rock, classic rock, glam metal, hard rock"
5u9NUat59IiQFVEzZ4r3Np,Love is All,The Tallest Man On Earth,255853,2010-04-13,2010,0.931,0.624,0.252,0.000421,0.104,-11.502,0.03,107.0,0.367,1.0,2.0,57,False,"chamber pop, indie folk, stomp and holler, swedish americana, swedish singer-songwriter"
0yAc7tMrxA3KwdVpVDe402,La Complicidad,Cultura Profética,364959,2010-08-22,2010,0.155,0.641,0.744,1.86e-05,0.148,-5.636,0.0942,129.01,0.669,1.0,9.0,62,False,"latin alternative, latin rock, reggae en espanol, rock en espanol"
1TiPjfuaAbA3KgxzzweqIn,La Escuelita,Banda Los Recoditos,125746,2010,2010,0.568,0.871,0.616,0.0,0.0933,-3.872,0.0443,112.601,0.971,1.0,10.0,55,False,"banda, banda sinaloense, musica mexicana, norteno"
7McYWSdRoKDO8Dl70bURcZ,Ley del Hielo,Canserbero,212558,2010-01-01,2010,0.362,0.808,0.65,4.32e-05,0.145,-7.108,0.249,92.012,0.811,0.0,10.0,65,False,"boom bap espanol, rap conciencia, rap politico, trap latino, urbano latino, venezuelan hip hop"
7LG1SR44Kh4f9lgyXSdWTD,Loud,"Tech N9ne Collabos, Irv Da PHENOM, Alan Wayne, BizzyMain",291866,2010-07-27,2010,0.252,0.865,0.878,0.0,0.107,-2.637,0.271,140.075,0.763,0.0,1.0,48,True,"country rap, kansas city hip hop"
36WNQJFVjYhDRZ6vJhYXEh,Let Me Hear You Scream,Ozzy Osbourne,205800,2010-06-11,2010,0.000367,0.492,0.979,0.0,0.953,-2.315,0.0888,130.005,0.315,1.0,0.0,53,False,"album rock, alternative metal, birmingham metal, classic rock, glam metal, hard rock, metal, rock"
0mSs7n2iFEfoONUCWoZfDl,Letter Sounds (apple apple aaa),Barbara Milne,265486,2010-08-17,2010,0.746,0.821,0.0601,4.17e-06,0.115,-13.629,0.0565,105.423,0.476,1.0,0.0,49,False,children's music
6XDBA3QWX51lDJ0oZbaJJN,Long Live,Taylor Swift,317946,2010-10-25,2010,0.036,0.418,0.68,7.59e-05,0.108,-4.3,0.0346,204.125,0.142,1.0,7.0,47,False,pop
0rJqQqradmRGsvslGseKNq,Like Me,"El Titø, Yung Bruh, rich disease",243012,2010-12-15,2010,0.16,0.507,0.623,0.0,0.349,-12.414,0.0687,145.02,0.575,0.0,8.0,50,True,
1w6kG4Rc29m5EherbvpkF5,Your Love,Nicki Minaj,245253,2010-01-01,2010,0.00204,0.422,0.52,0.00413,0.411,-10.231,0.343,189.63,0.184,1.0,11.0,64,True,"hip pop, pop, queens hip hop, rap"
7xAACq6jlGqXw4bNCTYcm6,Lucifer,SHINee,233986,2010-07-19,2010,0.0323,0.75,0.914,0.0,0.107,-1.819,0.0518,125.034,0.866,0.0,11.0,56,False,"k-pop, k-pop boy group"
3Li7Cw9cnF830ijj8iX8H4,La dolce vita,"Nino Rota, Studio Orchestra, StudioConductor",57400,2010-09-01,2010,0.972,0.554,0.0886,0.115,0.074,-16.992,0.0333,104.753,0.413,1.0,5.0,54,False,"classic soundtrack, italian soundtrack, orchestral soundtrack, vintage italian soundtrack"
3ZpSFamHHJE4kL59IePR7P,Love Come Down - Single Version,"Evelyn ""Champagne"" King",217360,2010-01-25,2010,0.00601,0.804,0.621,0.00301,0.0433,-7.317,0.0652,117.274,0.903,1.0,11.0,46,False,"classic soul, disco, funk, minneapolis sound, post-disco, quiet storm, soul, urban contemporary"
1r8oPEXqnhUVgkUkJNqEuF,Love Will Tear Us Apart - 2010 Remaster,Joy Division,204621,2010,2010,0.000989,0.525,0.902,0.691,0.137,-8.662,0.0368,146.83,0.907,1.0,2.0,51,False,"alternative rock, indie rock, madchester, new wave, post-punk, punk, rock, uk post-punk"
4zK05ecddIq3vfd08Aqi8y,La Vida Es Así,Ivy Queen,192306,2010-01-01,2010,0.0474,0.705,0.8,1.5e-06,0.448,-8.332,0.123,156.109,0.48,1.0,5.0,55,False,"latin hip hop, rap latina, reggaeton, trap latino, urbano latino"
5uaTGZyDMK1iZ9eW1qeBEX,Live Like You Were Dying,Tim McGraw,300333,2010-11-30,2010,0.492,0.416,0.546,0.0,0.0845,-7.728,0.0297,159.929,0.418,1.0,7.0,48,False,"contemporary country, country, country road"
4FVHUUsSdHTo1keNdg2vWM,Little Miss,bôa,233480,2010-04-20,2010,0.42,0.621,0.814,0.0,0.301,-5.752,0.0376,118.177,0.787,0.0,9.0,51,False,pov: indie
4EC81w5nKG5tZlkHyKT2vO,Lucidity,Tame Impala,271720,2010-05-21,2010,0.109,0.367,0.872,0.0944,0.351,-6.301,0.0641,147.015,0.496,1.0,4.0,51,False,"australian psych, modern rock, neo-psychedelic, rock"
0jlqvPEW6s0U8vDJuIYCwU,Lonely At The Top,Jamey Johnson,193773,2010,2010,0.331,0.648,0.645,0.00212,0.21,-8.334,0.0333,116.593,0.692,1.0,9.0,46,False,"country, country road, outlaw country"
4Ysok52J5hPSSi1vgUbgf8,Like My Dog,Billy Currington,166560,2010-01-01,2010,0.476,0.697,0.724,0.0,0.14,-4.428,0.0322,96.953,0.478,1.0,10.0,46,False,"contemporary country, country, country road"
0lOlFH0KCWgRLoYiUZCd8b,La Gente Del Chapo,Los Alegres Del Barranco,181865,2010-10-29,2010,0.442,0.804,0.762,0.0,0.108,-7.084,0.0674,120.552,0.903,1.0,7.0,49,False,"corrido, musica mexicana, norteno, sierreno"
2sH1DIngiSA8EQfkcQXpBq,La Melodía,Joey Montana,219103,2010-01-01,2010,0.226,0.701,0.836,2.76e-06,0.293,-5.35,0.0284,116.998,0.76,1.0,9.0,63,False,"latin pop, reggaeton, urbano latino"
4tM7IvirymOPAk74Us27kD,Let Me Take You Out,"Bryan J, Travis Porter",225706,2010-01-01,2010,0.157,0.705,0.63,0.0,0.108,-5.842,0.056,139.957,0.641,1.0,8.0,44,False,
2CBRlZtrYrhd8XXFFDSxAl,Little Bitty,Alan Jackson,158080,2010-11-19,2010,0.15,0.563,0.796,0.0,0.355,-7.604,0.0409,162.88,0.741,1.0,4.0,49,False,country
1xuYajTJZh8zZrPRmUaagf,"Latinoamérica (feat. Totó la Momposina, Susana Baca & Maria Rita)","Calle 13, Totó La Momposina, Susana Baca, Maria Rita",301426,2010-11-22,2010,0.59,0.691,0.805,0.0,0.0975,-6.81,0.0947,142.503,0.866,0.0,2.0,62,False,"latin afrobeat, latin alternative, latin hip hop, latin rock, puerto rican rock, rap conciencia, reggaeton, rock en espanol"
0hIWFtRapuJrfDCovuGww9,La Inconforme,Grupo G,190320,2010-06-04,2010,0.132,0.894,0.698,0.00291,0.125,-6.284,0.0451,95.021,0.622,0.0,1.0,50,False,"cumbia sonidera, musica poblana"
7tk8lPTwBw2CYefi2QWR2d,La vénus du mélo,"Stacey Kent, Matt Skelton, John Parricelli, Jeremy Brown",227200,2010-03-22,2010,0.763,0.798,0.345,1.65e-06,0.115,-12.805,0.0484,124.164,0.486,1.0,2.0,55,False,"contemporary vocal jazz, vocal jazz"
74W0bOVbd1xLglztYp8bbl,Love Done Gone,Billy Currington,210746,2010-01-01,2010,0.121,0.672,0.72,0.0,0.0694,-3.07,0.029,127.001,0.795,1.0,8.0,45,False,"contemporary country, country, country road"
3zf1mZtT7AKf7HPkT5qLIY,Let It Go,Alex G,135600,2010-01-01,2010,0.603,0.595,0.65,0.00883,0.133,-5.029,0.0404,99.953,0.679,1.0,7.0,49,False,"philly indie, pov: indie, slacker rock"
6Z0UPq98UiEm7h1tHoYwzs,Lone Star,Tony Marcus,147214,2010-03-01,2010,0.886,0.711,0.456,0.00167,0.265,-11.788,0.039,121.158,0.782,1.0,0.0,48,False,
4k5Rb51qsUSMFg6oFdVC48,Love The Way You Lie,"Eminem, Rihanna",263373,2010-06-18,2010,0.224,0.747,0.935,0.0,0.515,-5.079,0.249,87.021,0.604,1.0,10.0,48,False,"detroit hip hop, hip hop, rap"
2VQfu1xhXtCQWp0LJNNJVR,La Tragedia de Iguala,Los Armadillos de la Sierra,229053,2010,2010,0.801,0.86,0.402,0.0,0.0844,-8.509,0.0592,135.947,0.973,1.0,5.0,47,False,tierra caliente
0ieS2bue78yadTdPiyzsaO,Love Of My Life (An Ode To Hip Hop) - Longer Album Version,"Erykah Badu, Common",337573,2010-05-11,2010,0.118,0.808,0.404,0.000625,0.0913,-9.27,0.348,87.461,0.487,1.0,7.0,45,False,"afrofuturism, alternative r&b, neo soul, r&b"
5fybLNY2eBRnEGg8SUW6yk,The Light,Common,243586,2010-05-11,2010,0.0894,0.938,0.646,3.52e-06,0.0733,-6.309,0.244,97.009,0.662,1.0,7.0,47,True,"alternative hip hop, chicago rap, conscious hip hop, hardcore hip hop, hip hop, political hip hop"
47fPXkWBYmYLcRCGrXgoYq,The Last Time,All That Remains,238306,2010-10-12,2010,0.00126,0.521,0.961,0.0,0.0782,-2.338,0.0611,103.027,0.331,0.0,1.0,47,False,"alternative metal, melodic metalcore, metalcore, nu metal, post-grunge"
0OnmyfhRfD8jGyNioWdqW4,Lifeline - Reggae Version,Citizen Cope,234133,2010-02-08,2010,0.149,0.884,0.531,0.00124,0.15,-7.607,0.105,112.163,0.807,1.0,5.0,45,False,alternative rock
0jicrrstuAzf6GLIUdwAQk,Loco,Jowell & Randy,231106,2010-01-01,2010,0.0111,0.75,0.771,2.14e-05,0.566,-8.91,0.0935,114.898,0.75,0.0,9.0,53,False,"reggaeton, urbano latino"
3jmrIQTRL9ea0Xv4yCvJEJ,Love All Over Me,Monica,229946,2010-03-19,2010,0.546,0.514,0.628,0.0,0.161,-5.661,0.0451,129.539,0.422,0.0,4.0,44,False,"contemporary r&b, hip pop, r&b, urban contemporary"
6q5U75yeUt3qR5X1A4LJAD,Little Black Backpack - Remastered,Stroke 9,224939,2010-01-26,2010,0.000136,0.453,0.847,0.0,0.0988,-4.918,0.0515,118.077,0.319,1.0,7.0,44,False,pop rock
0vQTsDj5g7omaBxibYqU4B,Los Amores Del Comandante,Los Alegres Del Barranco,172042,2010-10-26,2010,0.691,0.83,0.846,2.52e-05,0.0852,-3.919,0.105,117.674,0.885,1.0,7.0,46,False,"corrido, musica mexicana, norteno, sierreno"
3ofiQMPt5OZZTzzsCewZBU,Lithium,Labyrinth Ear,207986,2010-03-08,2010,0.0434,0.481,0.765,0.658,0.179,-10.863,0.415,149.977,0.404,1.0,7.0,48,False,"dark synthpop, grave wave"
61beXNR1qPPxjyM8x3pdRk,Laredo,Band of Horses,192240,2010-05-14,2010,0.00338,0.505,0.826,2.04e-06,0.214,-5.154,0.0333,123.356,0.602,1.0,10.0,46,False,"chamber pop, indie folk, indie rock, indietronica, modern rock, seattle indie, stomp and holler"
79rFv44RxuMb70y6sHC14l,The Last Fight,Bullet For My Valentine,259306,2010-04-20,2010,0.000456,0.299,0.971,0.0,0.283,-3.118,0.142,184.549,0.336,1.0,7.0,53,False,"alternative metal, melodic metalcore, nu metal, post-grunge, uk metalcore, welsh metal"
5xWf75kSj2NvtF64nUEKjz,Last Call for the Blues,Cody Jinks,338693,2010-06-28,2010,0.283,0.668,0.474,0.000151,0.139,-5.877,0.0261,75.018,0.576,1.0,0.0,42,False,"classic texas country, modern southern rock, outlaw country"
5aTsxlQlq0vIedDWZoqMWN,Lights - Single Version,Ellie Goulding,210853,2010-01-01,2010,0.0302,0.681,0.798,0.036,0.131,-6.169,0.0364,120.006,0.774,0.0,8.0,62,False,"indietronica, metropopolis, pop, uk pop"
65nCVhtlWYUzNvcM1MYp4l,Landslide,The Chicks,228480,2010,2010,0.569,0.574,0.4,6.19e-06,0.164,-8.387,0.0273,146.018,0.512,1.0,2.0,47,False,"contemporary country, country, country dawn"
3iyrjnobBKSVcQvXrygk1b,The Loser Wins,"Atmosphere, Slug, Ant",216186,2010-09-07,2010,0.0507,0.695,0.577,0.000114,0.257,-5.567,0.133,94.963,0.473,1.0,2.0,44,True,"alternative hip hop, conscious hip hop, minnesota hip hop"
73jLhrKOby9QOBdAdpnsOl,La Casa,Caramelos De Cianuro,268800,2010,2010,0.33,0.71,0.679,0.00419,0.197,-8.331,0.0248,108.005,0.82,1.0,0.0,55,False,"pop reggaeton, venezuelan rock"
7h70RTLbnhDyPGXjl3iEhh,Need You Now,Lady A,236440,2010-01-01,2010,0.0298,0.581,0.717,0.000185,0.243,-4.433,0.0318,107.884,0.316,1.0,4.0,61,False,"contemporary country, country, country dawn, country pop, country road"
3Nd9wTStUxHHBWkbrENCVL,Liebestraum,"Franz Liszt, Arthur Rubinstein",285285,2010-03-01,2010,0.991,0.365,0.151,0.898,0.102,-15.769,0.0316,94.982,0.0391,1.0,8.0,46,False,"classical, late romantic era"
3iBa3vSCcjdTi7iGqdPFNJ,Long Time (Grinder),Kevin Gates,181160,2010-10-29,2010,0.0962,0.65,0.548,0.0,0.173,-8.856,0.291,160.13,0.619,1.0,0.0,45,True,"baton rouge rap, pop rap, rap, southern hip hop, trap"
1Bf0CcX3gBGnHCsmUX7Uuj,Las Mil Y Una Noche,Estrellas De Tuzantla,213838,2010-02-16,2010,0.189,0.797,0.645,0.0,0.151,-9.358,0.0831,140.105,0.898,0.0,2.0,46,False,tierra caliente
1D27z8xNzjW0Mwwt1NCWhJ,Last Kiss,Taylor Swift,367133,2010-10-25,2010,0.57,0.371,0.341,3.09e-05,0.101,-9.475,0.0319,89.038,0.196,1.0,10.0,42,False,pop
3KoTtGEDiBwUWzdRQVh9lh,Last Friday Night (T.G.I.F.),Katy Perry,230733,2010-08-24,2010,0.00129,0.652,0.81,2.91e-05,0.667,-3.789,0.0406,126.022,0.732,0.0,3.0,49,False,pop
4LMZe6lky1O4SwurRXKr3L,Mares de Lujo,Los Armadillos de la Sierra,167453,2010,2010,0.757,0.85,0.295,3.79e-06,0.0704,-10.534,0.0534,97.688,0.939,1.0,1.0,54,False,tierra caliente
18V3WdhlafZXWC2uAXVEf9,Let It Shine,Tim Bowman,246237,2010-08-03,2010,0.267,0.608,0.864,0.875,0.204,-7.12,0.0366,95.987,0.739,0.0,0.0,44,False,smooth jazz
2rAi3yDJa6IyWDZH4lql8S,Let It Go,Zac Brown Band,277280,2010-09-20,2010,0.402,0.606,0.565,1.64e-05,0.0699,-7.413,0.0331,161.988,0.68,1.0,6.0,43,False,"contemporary country, country, country road, modern country rock"
7DjCRhhFo9PPzca1BjMLcf,Long Live,Taylor Swift,317453,2010-10-25,2010,0.036,0.418,0.68,7.59e-05,0.114,-4.3,0.0347,204.12,0.142,1.0,7.0,41,False,pop
2MWOqewf5j0qf2b6S5J6cS,Marry Me,Train,205453,2010-12-01,2010,0.834,0.461,0.267,2.03e-05,0.107,-8.514,0.0278,87.918,0.481,1.0,0.0,64,False,"dance pop, neo mellow, pop, pop rock"
5yEPktRqvIhko5QFF3aBhQ,Mean,Taylor Swift,237733,2010-10-25,2010,0.452,0.568,0.761,0.0,0.217,-3.987,0.0459,163.974,0.789,1.0,4.0,57,False,pop
2mei1NCzlPpkh98PzEqc4N,Memoir #02 [06.12.09],"Maria Pseftoga, May Roosevelt",117818,2010-07-05,2010,0.958,0.204,0.0228,0.945,0.114,-16.438,0.0446,70.874,0.0676,1.0,0.0,62,False,corecore
0dBW6ZsW8skfvoRfgeerBF,Mine,Taylor Swift,230706,2010-10-25,2010,0.00265,0.624,0.757,1.87e-06,0.189,-2.94,0.0296,121.07,0.658,1.0,7.0,55,False,pop
2opyAm6zOyjR0An5LkblfN,Make Me Wanna Die,The Pretty Reckless,235653,2010-01-01,2010,0.00227,0.495,0.905,3.29e-06,0.142,-3.768,0.0653,97.106,0.215,1.0,8.0,54,False,"alternative metal, candy pop"
29JkmIEHcUg0R4BQ8o4PmJ,Move Your Body,My Darkest Days,193106,2010-01-01,2010,0.000502,0.626,0.897,0.0,0.333,-3.65,0.0514,121.986,0.883,1.0,11.0,55,False,"alternative metal, post-grunge"
0bePGTDjn0XuEKoN7rOMvV,Undercover Martyn,Two Door Cinema Club,167773,2010-02-17,2010,0.000244,0.454,0.873,1.73e-05,0.0847,-5.072,0.122,159.814,0.562,1.0,2.0,68,False,"indie rock, indietronica, irish rock, modern alternative rock, modern rock, northern irish indie"
0NAT5pDG4XcYe9sUD3fR7k,Mi Ultima Carta,Prince Royce,244720,2010,2010,0.0711,0.737,0.854,0.0,0.132,-2.415,0.0306,130.0,0.919,1.0,10.0,61,False,"bachata, latin hip hop, latin pop, urbano latino"
3DZfp14PTnqbFToBnCztfW,Meet the Frownies,Mr Twin Sister,240493,2010-09-21,2010,0.274,0.663,0.444,0.664,0.388,-11.214,0.0338,122.975,0.2,0.0,11.0,57,False,chillwave
2rQyI7A1yTvTXJ9J4qFmmN,Mud On the Tires,Brad Paisley,206720,2010-11-02,2010,0.294,0.448,0.824,3.81e-05,0.662,-5.508,0.0478,185.217,0.463,1.0,2.0,54,False,"contemporary country, country, country road"
6JgvsaqkGa0jzK5DTj5CAn,Maldito Amor,Tierra Cali,167933,2010-08-03,2010,0.601,0.787,0.578,0.000657,0.167,-6.873,0.0519,97.975,0.795,1.0,7.0,56,False,"banda, musica mexicana, norteno, tierra caliente"
3aCkU7zRK9YtA9KyoTIqnb,Muy Tranquilo,Gramatik,233755,2010-07-29,2010,0.24,0.641,0.621,0.0299,0.175,-3.88,0.0523,89.936,0.749,1.0,7.0,61,False,"downtempo, instrumental hip hop, jazz boom bap, jazztronica, livetronica, slovenian electronic, trip hop"
2uEqb2TEV29ktnJl8DyObt,Me Encantaría,Fidel Rueda,187000,2010-01-01,2010,0.249,0.926,0.549,8.48e-05,0.0903,-5.431,0.0364,106.992,0.966,1.0,0.0,62,False,"banda, musica mexicana, norteno"
4FHPfduH1LYt8oTJwcSxkw,Mentalidad Enferma,Los Buitres De Culiacan Sinaloa,202213,2010,2010,0.32,0.779,0.799,0.0,0.133,-3.386,0.136,125.5,0.744,1.0,0.0,58,False,"corrido, musica mexicana, norteno, sierreno"
4N60XfcTE1ysLZGbYgnYXq,Mean,Taylor Swift,237733,2010-10-25,2010,0.452,0.568,0.761,0.0,0.217,-3.987,0.0459,163.974,0.789,1.0,4.0,50,False,pop
6zO0e11RCBnh1w8kjPZpIh,Mouthful of Diamonds,Phantogram,253426,2010,2010,0.138,0.613,0.815,0.816,0.113,-4.542,0.0295,99.981,0.219,1.0,0.0,49,False,"indietronica, metropopolis, neo-synthpop"
42lb5Ne9DymiyPqX9KGOoq,Move,MercyMe,178066,2010-05-04,2010,0.0162,0.623,0.864,2.32e-06,0.242,-5.541,0.052,106.011,0.759,0.0,9.0,49,False,"ccm, christian alternative rock, christian indie, christian music"
45CFyww2OsnABfrBg6FzRY,The Messenger,Linkin Park,181893,2010-09-08,2010,0.72,0.527,0.209,0.0,0.116,-12.113,0.0283,62.663,0.362,1.0,7.0,49,False,"alternative metal, nu metal, post-grunge, rap metal, rock"
3rIgo725niu2yb3WNx62Jt,Me Duele La Cabeza,"Héctor Acosta ""El Torito""",233706,2010-01-01,2010,0.26,0.858,0.786,0.0,0.0841,-2.49,0.0346,123.056,0.833,0.0,2.0,48,False,"bachata, bachata dominicana"
2USyvcBpPjhW0rgiD2R8Bp,Mariposa Traicionera,Maná,264599,2010-03-16,2010,0.527,0.773,0.794,0.000354,0.113,-4.954,0.0326,101.143,0.907,0.0,5.0,57,False,"latin arena pop, latin pop, latin rock, mexican pop, mexican rock, rock en espanol"
7CisLSqtKbDw2VtpN6IuLw,Make A Movie,"Twista, Chris Brown",202000,2010-11-09,2010,0.00752,0.846,0.774,0.0,0.207,-5.131,0.0509,120.012,0.375,1.0,1.0,50,True,"chicago rap, dirty south rap, gangster rap, trap"
1CrulxovN7Mu4VNSLbjaFa,Moonscapes,Dangermuffin,201253,2010-04-01,2010,0.703,0.429,0.7,0.0081,0.106,-9.113,0.0337,133.903,0.751,0.0,0.0,46,False,jam band
1JUBl7RQUp4wwpSLArvc3e,Mexican Radio,Wall Of Voodoo,250240,2010-08-24,2010,0.00371,0.555,0.737,0.00104,0.386,-9.663,0.0548,82.296,0.469,1.0,0.0,46,False,"new wave, synthpop"
4PwwyZBEkHcm4OTJThCzXi,Moneygrabber,Fitz and The Tantrums,189893,2010-08-24,2010,0.0608,0.696,0.886,1.01e-06,0.585,-3.713,0.0291,112.52,0.801,0.0,9.0,48,False,"la indie, modern alternative rock, modern rock, pop rock, pov: indie"
6LZaxlycSWrJZ4Volb25qx,Mine,Taylor Swift,230706,2010-10-25,2010,0.00265,0.624,0.757,1.87e-06,0.189,-2.94,0.0296,121.07,0.658,1.0,7.0,47,False,pop
4UOWkmOtb3DgMaSmI8rTaC,More Today Than Yesterday,The Spiral Starecase,188986,2010-11-02,2010,0.143,0.608,0.764,0.0,0.067,-6.262,0.0332,142.121,0.769,1.0,7.0,47,False,
36jd1zpcTaY4izWrWLATCR,Mente En Blanco,Voz De Mando,230293,2010-01-01,2010,0.181,0.86,0.632,0.0,0.0822,-5.321,0.0441,112.537,0.953,1.0,1.0,50,False,"corrido, musica mexicana, norteno, sierreno"
5KNkyX3vkaktFOj9Js3I2F,Me Paresco Pero No Soy,La Mar-K De Tierra Caliente,204266,2010-02-01,2010,0.165,0.679,0.425,0.00113,0.109,-8.543,0.0801,157.821,0.628,1.0,0.0,47,False,tierra caliente
